index,url,valid,domain,title,description,image,published,archive,content,quote,language,keyword
https://www.tagesschau.de/newsticker/liveblog-ukraine-freitag-474.html,https://www.tagesschau.de/newsticker/liveblog-ukraine-freitag-474.html,0,www.tagesschau.de,Ukraine-Liveblog: ++ Russland greift Region Kiew mit Drohnen an ++,Bei Drohnenangriffen Russlands ist in der Region Kiew mindestens ein Mensch gestorben. CDU-Sicherheitspolitiker Kiesewetter plädiert für den Einsatz von Bundeswehrsoldaten nach Kriegsende. Die aktuellen Entwicklungen.,https://images.tagesschau.de/image/5b073b67-29bf-4703-b6b1-71469e4c25bb/AAABjz78AfM/AAABkZLhkrw/16x9-1280/flagge-ukraine-truemmer-101.jpg,2025-01-03T07:51:30Z,,"Stand: 03.01.2025 08:51 Uhr
Bei Drohnenangriffen Russlands ist in der Region Kiew mindestens ein Mensch gestorben. CDU-Sicherheitspolitiker Kiesewetter plädiert für den Einsatz von Bundeswehrsoldate… [+2066 chars]",,de,'Russland'
https://www.tagesspiegel.de/wissen/russischer-sattelit-cosmos-2553-eine-gigantische-bedrohung-fur-den-westen-12950485.html,https://www.tagesspiegel.de/wissen/russischer-sattelit-cosmos-2553-eine-gigantische-bedrohung-fur-den-westen-12950485.html,0,www.tagesspiegel.de,Russischer Sattelit Cosmos 2553: Eine gigantische Bedrohung für den Westen,Russland testet die Bedrohung durch nukleare Detonationen im All mit dem Satelliten Cosmos 2553. Für westliche Infrastruktur und satellitengestützte Technologien hätte eine Explosion im erdnahen Orbit katastrophale Folgen.,https://www.tagesspiegel.de/images/12951934/alternates/BASE_16_9_W1400/1735823172000/atomschlag-im-all.jpeg,2025-01-03T08:01:26Z,http://archive.md/20250103083149/https://www.tagesspiegel.de/wissen/russischer-sattelit-cosmos-2553-eine-gigantische-bedrohung-fur-den-westen-12950485.html,"Es scheint wie von langer Hand geplant. Keine drei Wochen, bevor Putins Panzer die Ukraine überfallen haben, hat Russland im Februar 2022 einen neuartigen Satelliten in eine ungewöhnliche Erdumlaufba… [+767 chars]",,de,'Russland'
https://www.dw.com/de/slowakei-gasstreit-mit-ukraine-als-ablenkungsman%C3%B6ver/a-71204420,https://www.dw.com/de/slowakei-gasstreit-mit-ukraine-als-ablenkungsman%C3%B6ver/a-71204420,0,www.dw.com,Slowakei: Gasstreit mit Ukraine als Ablenkungsmanöver,"Der slowakische Premier Robert Fico bricht wegen des Gastransit-Stopps einen schweren Streit mit der Ukraine vom Zaun. Doch es geht nicht um eine drohende Energiekrise, sondern um innenpolitische Probleme des EU-Landes.",https://static.dw.com/image/71138502_6.jpg,2025-01-03T08:27:00Z,https://web.archive.org/web/20250104100931/https://www.dw.com/de/slowakei-gasstreit-mit-ukraine-als-ablenkungsman%25C3%25B6ver/a-71204420,"Während Russland die Ukraine Tag für Tag zerbombt, wird das Schicksal der ukrainischen Menschen und ihres Landes immer mehr zum Spielball von Macht- und Parteipolitik in einigen EU-Ländern. In Ungarn… [+6912 chars]",,de,'Ukraine'
https://www.focus.de/politik/ausland/slowakei-gasstreit-mit-ukraine-als-ablenkungsmanoever_2864e7e5-9061-4f83-aa6b-459238a8c554.html,https://www.focus.de/politik/ausland/slowakei-gasstreit-mit-ukraine-als-ablenkungsmanoever_2864e7e5-9061-4f83-aa6b-459238a8c554.html,0,www.focus.de,Ausland - Slowakei: Gasstreit mit Ukraine als Ablenkungsmanöver,"Der slowakische Premier Robert Fico bricht wegen des Gastransit-Stopps einen schweren Streit mit der Ukraine vom Zaun. Doch es geht nicht um eine drohende Energiekrise, sondern um innenpolitische Probleme des EU-Landes.",https://quadro.burda-forward.de/ctf/ceec6c3f-aab1-46d6-9825-38cd82d35165.07f47a60-ee16-470c-9fd8-76ffd33c2fcc.png?im=Resize%3D%281200%2C630%29&hash=3db504ee2cbf69bf8ae600a85cecc1495be4c5d30525b13a04610f1409c70f7f,2025-01-03T08:41:42Z,,"Während Russland die Ukraine Tag für Tag zerbombt, wird das Schicksal der ukrainischen Menschen und ihres Landes immer mehr zum Spielball von Macht- und Parteipolitik in einigen EU-Ländern. In Ungarn… [+6584 chars]",,de,'Russland'
https://www.focus.de/politik/ausland/wurde-assad-in-russland-vergiftet-telegram-kanal-verbreitet-ueberraschende-behauptung_id_260605143.html,https://www.focus.de/politik/ausland/wurde-assad-in-russland-vergiftet-telegram-kanal-verbreitet-ueberraschende-behauptung_id_260605143.html,0,www.focus.de,„Es gibt allen Grund zu der Annahme“ - Wurde Assad in Russland vergiftet? Telegram-Kanal verbreitet überraschende Behauptung,Der syrische Ex-Präsident Baschar al Assad soll in Russland vergiftet worden sein. Dies behauptet ein russischer Telegram-Kanal. Assad musste medizinisch behandelt werden.,https://p6.focus.de/img/fotos/id_260550895/gettyimages-894087542.jpg?im=Crop%3D%280%2C85%2C1024%2C512%29%3BResize%3D%281200%2C627%29&impolicy=perceptual&quality=mediumHigh&hash=81d457b842dab1f11e92dd858e2ab908242298b1f57c32989416664eef97274e,2025-01-03T08:45:36Z,,Der syrische Ex-Präsident Baschar al Assad soll in Russland vergiftet worden sein. Dies behauptet ein russischer Telegram-Kanal. Assad musste medizinisch behandelt werden.Ein russischer Telegram-Kana… [+1778 chars],,de,'Russland'
https://www.focus.de/politik/ausland/ukraine-krise/nach-ende-russischer-gaslieferungen-slowakischer-ministerpraesident-droht-mit-massnahmen-gegen-kiew_id_260605171.html,https://www.focus.de/politik/ausland/ukraine-krise/nach-ende-russischer-gaslieferungen-slowakischer-ministerpraesident-droht-mit-massnahmen-gegen-kiew_id_260605171.html,0,www.focus.de,Nach Ende russischer Gaslieferungen - Slowakischer Ministerpräsident droht mit Maßnahmen gegen Kiew,"Der slowakische Ministerpräsident Robert Fico hat angekündigt, dass die Regierung in Bratislava Maßnahmen gegen Kiew in Erwägung ziehe. Grund ist die Einstellung der russischen Gaslieferungen über die Ukraine.",https://p6.focus.de/img/politik/ausland/id_260604763/der-slowakische-ministerpraesident-fico-droht-damit-ukrainische-fluechtlinge-schlechter-zu-behandeln.-archivbild-.jpg?im=Crop%3D%280%2C77%2C2048%2C1024%29%3BResize%3D%281200%2C627%29&impolicy=perceptual&quality=mediumHigh&hash=e87a3aad2252be130ba1b02731d1d9bee17b0ba8fe896336066d8b2db284c406,2025-01-03T08:52:50Z,,"Der slowakische Ministerpräsident Robert Fico hat angekündigt, dass die Regierung in Bratislava Maßnahmen gegen Kiew in Erwägung ziehe. Grund ist die Einstellung der russischen Gaslieferungen über di… [+1679 chars]",,de,'Ukraine'
https://salzburg.orf.at/stories/3287647/,https://salzburg.orf.at/stories/3287647/,0,salzburg.orf.at,Gas-Alarm in Saalfelden,In Saalfelden (Pinzgau)  hat es Freitag in den frühen Morgenstunden einen Gas-Alarm gegeben. In einem Geschäft bemerkte die Filialleiterin den Gasgeruch. Zwei jeweils 63-jährige Bewohner einer nahen Wohnung mussten ins Spital gebracht werden.,https://ibs.orf.at/sbg?image=https%3A%2F%2Foekastatic.orf.at%2Fmojo%2F1_4_1%2Fstoryserver%2Foeka%2Fcommon%2Fimages%2Fog-fallback-sbg.png%3Fs%3Dc92708ae469bc368ecb4861244504a18cb7e05fa,2025-01-03T13:44:14Z,https://web.archive.org/web/20250104020042/https://salzburg.orf.at/stories/3287647/,Die 53-jährige Handelsangestellte alarmierte sofort die Feuerwehr. Das ganze Haus musste dann von den Einsatzkräften technisch belüftet werden. Fachleute kümmerten sich um die Sperre der Gasleitung.,,,
https://www.n-tv.de/politik/Warum-die-AfD-noch-nicht-halbiert-ist-article25465691.html,https://www.n-tv.de/politik/Warum-die-AfD-noch-nicht-halbiert-ist-article25465691.html,0,www.n-tv.de,Wieduwilts Woche: Warum die AfD noch nicht halbiert ist,"Die Deutschen flüchten angesichts hoher AfD-Umfragewerte in schlichte Erklärungen: Es liegt an Tiktok, es liegt an Russland, es liegt an Desinformation, es liegt an der DDR. Nur an den Deutschen, an denen liegt es nicht.",https://bilder3.n-tv.de/img/incoming/crop25277958/1141323617-cImg_16_9-w1200/Fruher-ging-Alice-Weidel-auf-Distanz-zum-Thuringer-AfD-Landesvorsitzenden-Bjorn-Hocke-der-zu-den-wichtigsten-Vertretern-der-Rechtsauen-Stromung-der-Partei-zahlt-inzwischen-treten-beide-gemeinsam-im-Wahlkampf-auf.jpg,2025-01-03T13:59:28Z,,"Die Deutschen flüchten angesichts hoher AfD-Umfragewerte in schlichte Erklärungen: Es liegt an Tiktok, es liegt an Russland, es liegt an Desinformation, es liegt an der DDR. Nur an den Deutschen, an … [+6293 chars]",,de,'Atomkraft'
https://www.welt.de/politik/ausland/video255027840/Nach-Stopp-fuer-russisches-Gas-Slowakei-droht-Ukraine-mit-schlechter-Behandlung-von-Fluechtlingen.html,https://www.welt.de/politik/ausland/video255027840/Nach-Stopp-fuer-russisches-Gas-Slowakei-droht-Ukraine-mit-schlechter-Behandlung-von-Fluechtlingen.html,0,www.welt.de,Slowakei droht Ukraine mit schlechter Behandlung von Flüchtlingen,"Nach dem Transitstopp der Ukraine für russisches Gas droht der slowakische Ministerpräsident Robert Fico mit einer schlechteren Behandlung ukrainischer Flüchtlinge. Der als russlandfreundlich geltende Fico droht weiter, Stromlieferungen in das Land einzustell…",https://img.welt.de/img/politik/ausland/mobile255027632/7767930577-ci16x9-w1200/Ministerpraesident-Robert-Fico.jpg,2025-01-03T14:10:17Z,https://web.archive.org/web/20250104004942/https://www.welt.de/politik/ausland/video255027840/Nach-Stopp-fuer-russisches-Gas-Slowakei-droht-Ukraine-mit-schlechter-Behandlung-von-Fluechtlingen.html,Nach dem Transitstopp der Ukraine für russisches Gas droht der slowakische Ministerpräsident Robert Fico mit einer schlechteren Behandlung ukrainischer Flüchtlinge. Der als russlandfreundlich geltend… [+122 chars],,de,'Ukraine'
https://www.welt.de/politik/ausland/article255027582/Kritik-an-Grossbritannien-Oeffnet-die-Nordsee-Schafft-die-Windraeder-ab-fordert-Trump.html,https://www.welt.de/politik/ausland/article255027582/Kritik-an-Grossbritannien-Oeffnet-die-Nordsee-Schafft-die-Windraeder-ab-fordert-Trump.html,0,www.welt.de,"„Öffnet die Nordsee. Schafft die Windräder ab!“, fordert Trump",Großbritanniens neue Regierung will keine neuen Lizenzen für Gas- und Ölgewinnung in der Nordsee vergeben. Ein amerikanischer Konzern verkündete daraufhin seinen Rückzug aus der Region. Das sorgt nun für Unmut beim künftigen US-Präsidenten.,https://img.welt.de/img/politik/ausland/mobile255027578/0637936687-ci16x9-w1200/Donald-Trump.jpg,2025-01-03T14:12:04Z,http://archive.md/20250103182242/https://www.welt.de/politik/ausland/article255027582/Kritik-an-Grossbritannien-Oeffnet-die-Nordsee-Schafft-die-Windraeder-ab-fordert-Trump.html,Der künftige US-Präsident Donald Trump fordert den Abbau der Windräder in der Nordsee. Der 78-Jährige verbreitete auf seiner Online-Plattform Truth Social einen Bericht aus dem vergangenen November ü… [+1154 chars],,de,'Gas'
https://www.nzz.ch/sport/extremsport/kaum-ein-schiff-verirrt-sich-je-ins-suedpolarmeer-ausser-jene-der-teilnehmer-der-vendee-globe-sie-nehmen-dort-wertvolle-messungen-fuer-die-wissenschaft-vor-ld.1862814,https://www.nzz.ch/sport/extremsport/kaum-ein-schiff-verirrt-sich-je-ins-suedpolarmeer-ausser-jene-der-teilnehmer-der-vendee-globe-sie-nehmen-dort-wertvolle-messungen-fuer-die-wissenschaft-vor-ld.1862814,0,www.nzz.ch,Kaum ein Schiff verirrt sich je ins Südpolarmeer – ausser jene der Teilnehmer der Vendée Globe: Sie nehmen dort wertvolle Messungen für die Wissenschaft vor,"Das Südpolarmeer absorbiert so viel Kohlendioxid, wie die USA pro Jahr ausstossen. Trotz der Bedeutung im Kampf gegen den Klimawandel ist es wenig erforscht. Mithilfe der Solo-Weltumsegelung wollen Forschende die Prozesse im Südlichen Ozean besser verstehen.","https://img.nzz.ch/2024/12/30/99a3a292-a5c2-4d77-b709-8b08a5e72a10.jpeg?width=1200&height=675&fit=bounds&quality=75&auto=webp&crop=2744,1544,x398,y923&wmark=nzz",2025-01-03T15:45:00Z,http://archive.md/20250103195436/https://www.nzz.ch/sport/extremsport/kaum-ein-schiff-verirrt-sich-je-ins-suedpolarmeer-ausser-jene-der-teilnehmer-der-vendee-globe-sie-nehmen-dort-wertvolle-messungen-fuer-die-wissenschaft-vor-ld.1862814,"Die Jacht von Boris Hermann ist während der Vendée Globe mit zahlreichen Messgeräten ausgestattet.
Oliver Heer segelt im Moment weit entfernt von der Zivilisation im Pazifik. Auf 55 Grad südlicher B… [+8472 chars]",,de,'Gas'
https://www.zeit.de/news/2025-01/03/deutlich-mehr-uran-aus-russland-nach-lingen-geliefert,https://www.zeit.de/news/2025-01/03/deutlich-mehr-uran-aus-russland-nach-lingen-geliefert,0,www.zeit.de,Atomkraft: Deutlich mehr Uran aus Russland nach Lingen geliefert,Hier finden Sie Informationen zu dem Thema „Atomkraft“. Lesen Sie jetzt „Deutlich mehr Uran aus Russland nach Lingen geliefert“.,https://img.zeit.de/news/2025-01/03/deutlich-mehr-uran-aus-russland-nach-lingen-geliefert-image-group/wide__1300x731,2025-01-03T16:57:55Z,,"Im vergangenen Jahr sind 68,8 Tonnen Uran aus Russland zur Brennelementefabrik im niedersächsischen Lingen geliefert worden. Trotz des russischen Kriegs gegen die Ukraine wuchs die Menge um rund 66 P… [+1584 chars]",,de,'Atomkraft'
https://www.stern.de/gesellschaft/regional/niedersachsen-bremen/atomkraft--deutlich-mehr-uran-aus-russland-nach-lingen-geliefert-35353744.html,https://www.stern.de/gesellschaft/regional/niedersachsen-bremen/atomkraft--deutlich-mehr-uran-aus-russland-nach-lingen-geliefert-35353744.html,0,www.stern.de,Atomkraft: Deutlich mehr Uran aus Russland nach Lingen geliefert,Trotz des Ukrainekriegs kam im vergangenen Jahr tonnenweise Uran aus Russland ins niedersächsische Lingen. Niedersachsens Umweltminister Meyer kritisiert diese Entwicklung und warnt.,https://image.stern.de/35353746/t/ZT/v1/w1440/r1.7778/-/03--bdnf2upxcjv5axs2048jpeg---17d20cf6799847f1.jpg,2025-01-03T16:57:55Z,,"Kopiere den aktuellen Link
Trotz des Ukrainekriegs kam im vergangenen Jahr tonnenweise Uran aus Russland ins niedersächsische Lingen. Niedersachsens Umweltminister Meyer kritisiert diese Entwicklung… [+1757 chars]",,de,'Atomkraft'
https://www.zeit.de/politik/ausland/2025-01/ukraine-lage-2025-krieg-front-russland-verhandlungen-woche,https://www.zeit.de/politik/ausland/2025-01/ukraine-lage-2025-krieg-front-russland-verhandlungen-woche,0,www.zeit.de,Lage in der Ukraine: Ein Blick nach vorn,"2024 hielt die Ukraine stand, marschierte in Russland ein – aber verlor Zehntausende Soldaten und die Hoffnung auf eine Wende im Kriegsgeschehen. Was wird 2025 prägen?",https://img.zeit.de/politik/ausland/2025-01/ukraine-lage-2025-krieg-front-russland-verhandlungen-woche-bild-lwiw/wide__1300x731,2025-01-03T17:13:44Z,http://archive.md/20250103194136/https://www.zeit.de/politik/ausland/2025-01/ukraine-lage-2025-krieg-front-russland-verhandlungen-woche,"Es ist eine Frage der Perspektive: 2024 hat Russland in der Ukraine etwa siebenmal so viel Gebiet erobern können wie im Vorjahr. Schätzungsweise 30.000 ukrainische Soldaten wurden dabei getötet, seit… [+16481 chars]",,de,'Russland'
https://www.tagesspiegel.de/internationales/ukraine-invasion-tag-1045-hat-bidens-salami-taktik-eine-eskalation-im-ukrainekrieg-vermieden-12959509.html,https://www.tagesspiegel.de/internationales/ukraine-invasion-tag-1045-hat-bidens-salami-taktik-eine-eskalation-im-ukrainekrieg-vermieden-12959509.html,0,www.tagesspiegel.de,"Ukraine-Invasion, Tag 1045: Hat Bidens Salami-Taktik eine Eskalation im Ukrainekrieg vermieden?","Selenskyj hofft auf Trumps „Unberechenbarkeit“, Slowakei will ukrainische Geflüchtete schlechter behandeln. Der Nachrichtenüberblick am Abend.",https://www.tagesspiegel.de/images/12959515/alternates/BASE_16_9_W1400/1735924792000/u-s-president-joe-biden-delivers-remarks-regarding-fatal-new-orleans-truck-ramming-at-camp-david.jpeg,2025-01-03T17:25:38Z,https://web.archive.org/web/20250104045655/https://www.tagesspiegel.de/internationales/ukraine-invasion-tag-1045-hat-bidens-salami-taktik-eine-eskalation-im-ukrainekrieg-vermieden-12959509.html,"War Joe Biden zu zögerlich in seiner Unterstützung der Ukraine mit Waffen? Diese Frage wird maßgeblich bestimmen, wie die Amtszeit des scheidenden US-Präsidenten beurteilt wird. Hat sich Biden aus An… [+5833 chars]",,de,'Gas'
https://www.faz.net/aktuell/politik/bundestagswahl/robert-habeck-fuer-verdoppelung-der-verteidigungsausgaben-110210059.html,https://www.faz.net/aktuell/politik/bundestagswahl/robert-habeck-fuer-verdoppelung-der-verteidigungsausgaben-110210059.html,0,www.faz.net,Verdoppelung der Verteidigungsausgaben: Wo Habeck sich nicht irrt,Die Verteidigungsausgaben verdoppeln? Dafür werden dem Kanzlerkandidaten der Grünen nicht die Herzen zufliegen. Doch Deutschlands Sicherheit hat ihren Preis.,https://media0.faz.net/ppmedia/aktuell/4062904409/1.10210056/facebook_teaser/robert-habeck-bei-einem-besuch.jpg,2025-01-03T17:36:17Z,http://archive.md/20250103174603/https://www.faz.net/aktuell/politik/bundestagswahl/robert-habeck-fuer-verdoppelung-der-verteidigungsausgaben-110210059.html,"Doch die Zeiten, dafür sorgte Putin, haben sich geändert und die ehemals radikalpazifistischen Grünen mit ihnen. Keine andere Partei trat so früh und seither so konsequent für die Unterstützung der U… [+1592 chars]",,de,'Preis'
https://www.jungewelt.de/artikel/491083.der-euro-sackt-ab.html,https://www.jungewelt.de/artikel/491083.der-euro-sackt-ab.html,0,www.jungewelt.de,Zu Lust und Risiken des Kapitalverkehrs: Der Euro sackt ab,"Nachdem der Wirtschaftskrieg gegen Russland in Szene gesetzt wurde, importiert die EU heute bereits 48 Prozent des teuren Flüssiggases aus den USA.",https://www.jungewelt.de/img/1100/203840.jpg,2025-01-03T18:38:09Z,https://web.archive.org/web/20250103225556/http://www.jungewelt.de/artikel/491083.der-euro-sackt-ab.html,"Der Euro ist am Donnerstag, dem ersten Handelstag auch an den Devisenmärkten, bis auf 1,0225 Dollar gefallen. Das ist ein niedrigerer Wert als im ganzen Jahr zuvor. Zuletzt war die EU-Währung 2022 so… [+3025 chars]",,de,'Russland'
https://taz.de/Russische-Gaslieferungen-nach-Europa/!6056722/,https://taz.de/Russische-Gaslieferungen-nach-Europa/!6056722/,0,taz.de,Russische Gaslieferungen nach Europa: Kein russisches Gas mehr durch die Ukraine,Seit Beginn des Jahres fließt kein Gas aus Russland mehr durch die Ukraine. Damit verliert Gazprom Einnahmen in Milliardenhöhe. Welche Konsequenzen drohen Europa?,https://taz.de/picture/7445436/1200/37339859-1.jpeg,2025-01-03T18:54:00Z,https://web.archive.org/web/20250103193656/https://taz.de/Russische-Gaslieferungen-nach-Europa/!6056722/,Seit Beginn des Jahres fließt kein Gas aus Russland mehr durch die Ukraine. Damit verliert Gazprom Einnahmen in Milliardenhöhe. Welche Konsequenzen drohen Europa? mehr...,,de,'Gas'
https://www.diepresse.com/19225004/robert-ficos-halb-leere-drohungen-gegen-die-ukraine,https://www.diepresse.com/19225004/robert-ficos-halb-leere-drohungen-gegen-die-ukraine,0,www.diepresse.com,Robert Ficos halb leere Drohungen gegen die Ukraine [premium],"Der slowakische Premier wirft der Ukraine wegen des Gas-Transit-Stopps „Sabotage“ vor und erwägt deshalb, ukrainischen Flüchtlingen die Leistungen zu kürzen und Stromexporte ins Nachbarland zu stoppen. Aber vieles spricht gegen eine allzu heftige Antwort.",https://img.diepresse.com/public/incoming/cg3zam-UKRAINE-CRISISRUSSIA-SLOVAKIA/alternates/DPR_SOCIAL_NACHRICHTEN/UKRAINE-CRISISRUSSIA-SLOVAKIA,2025-01-03T19:08:11Z,https://web.archive.org/web/20250104125337/https://www.diepresse.com/19225004/robert-ficos-halb-leere-drohungen-gegen-die-ukraine,"Der slowakische Premier wirft der Ukraine wegen des Gas-Transit-Stopps Sabotage vor und erwägt deshalb, ukrainischen Flüchtlingen die Leistungen zu kürzen und Stromexporte ins Nachbarland zu stoppen.… [+1055 chars]",,de,'Gas'
https://www.n-tv.de/politik/23-30-Ukraine-Unterstuetzer-protestieren-in-Bratislava-gegen-Fico--article25466520.html,https://www.n-tv.de/politik/23-30-Ukraine-Unterstuetzer-protestieren-in-Bratislava-gegen-Fico--article25466520.html,0,www.n-tv.de,Ukraine-Krieg im Liveticker: +++ 23:30 Ukraine-Unterstützer protestieren in Bratislava gegen Fico +++,Lesen Sie alle aktuellen Entwicklungen und Nachrichten über den russischen Angriffskrieg auf die Ukraine im Liveticker von ntv.de.,https://bilder3.n-tv.de/img/incoming/crop25117070/4231326595-cImg_16_9-w1200/Ukraine-Liveticker.jpg,2025-01-03T19:22:00Z,,"Rund 4000 Menschen sind dem Aufruf der Bürgerinitiative ""Mier Ukrajine"" (Friede der Ukraine) gefolgt und haben in der slowakischen Hauptstadt Bratislava gegen den slowakischen Regierungschef Robert F… [+23279 chars]",,de,'Angriff'
https://orf.at/stories/3380638/,https://orf.at/stories/3380638/,0,orf.at,Stopp von Gastransit setzt Moldawien zu,Trotz des – von der Ukraine lange angekündigten – Gastransitstopps von russischem Gas durch die Ukraine in der Nacht auf Mittwoch ist die Versorgungslage in der EU stabil. Anders sieht es im EU-Beitrittskandidatenland Moldawien aus. Durch das Aus von russisch…,https://ibs.orf.at/news?image=https%3A%2F%2Fassets.orf.at%2Fmims%2F2025%2F01%2F95%2Fcrops%2Fw%3D1200%2Ch%3D630%2Cq%3D75%2F2473878_master_946795_gastransit_russland_moldawien_transnistrien_r.jpg%3Fs%3Da5b37287052fbf53b206596fc0c81d8e971e9295,2025-01-03T22:25:34Z,https://web.archive.org/web/20250103230017/https://orf.at/stories/3380638/,Der lokale Energieversorger Tiraspoltransgaz in Transnistrien stellte die Versorgung von Haushalten mit Gas und Heizwärme ein. Auch in zahlreichen staatlichen Einrichtungen wurde vorübergehend die St… [+5592 chars],,de,'Gas'
https://www.n-tv.de/politik/06-59-Partisanengruppe-Russische-Kommandanten-in-der-Region-Donezk-bestellen-zivile-Fahrzeuge--article23143824.html,https://www.n-tv.de/politik/06-59-Partisanengruppe-Russische-Kommandanten-in-der-Region-Donezk-bestellen-zivile-Fahrzeuge--article23143824.html,0,www.n-tv.de,Ukraine-Krieg im Liveticker: +++ 06:59 Partisanengruppe: Russische Kommandanten in der Region Donezk bestellen zivile Fahrzeuge +++,Lesen Sie alle aktuellen Entwicklungen und Nachrichten über den russischen Angriffskrieg auf die Ukraine im Liveticker von ntv.de.,https://bilder3.n-tv.de/img/incoming/crop25117070/4231326595-cImg_16_9-w1200/Ukraine-Liveticker.jpg,2025-01-03T23:32:00Z,,"Die proukrainische Partisanengruppe Atesh, die in Russland und von Russland besetzten Gebieten aktiv ist, berichtet, Kommandanten würden in Donezk zivile Fahrzeuge für militärische Zwecke bestellen. … [+8849 chars]",,de,'Gas'
https://www.n-tv.de/politik/16-07-Angebliche-Anschlagsplaene-Vier-Jugendliche-in-Russland-festgenommen--article23143824.html,https://www.n-tv.de/politik/16-07-Angebliche-Anschlagsplaene-Vier-Jugendliche-in-Russland-festgenommen--article23143824.html,0,www.n-tv.de,Ukraine-Krieg im Liveticker: +++ 16:07 Angebliche Anschlagspläne: Vier Jugendliche in Russland festgenommen +++,Lesen Sie alle aktuellen Entwicklungen und Nachrichten über den russischen Angriffskrieg auf die Ukraine im Liveticker von ntv.de.,https://bilder3.n-tv.de/img/incoming/crop25117070/4231326595-cImg_16_9-w1200/Ukraine-Liveticker.jpg,2025-01-03T23:32:00Z,https://web.archive.org/web/20250104163225/https://www.n-tv.de/politik/16-07-Angebliche-Anschlagsplaene-Vier-Jugendliche-in-Russland-festgenommen--article23143824.html,"In Russland sind vier Jugendliche wegen eines mutmaßlichen Anschlagsplans festgenommen worden. Den Verdächtigen, die zwischen 2007 und 2008 geboren wurden, werde vorgeworfen, einen Sprengstoffanschla… [+20203 chars]",,de,'Angriff'
https://www.n-tv.de/politik/05-36-Selenskyj-raeumt-Rueckschlaege-an-der-Front-ein--article23143824.html,https://www.n-tv.de/politik/05-36-Selenskyj-raeumt-Rueckschlaege-an-der-Front-ein--article23143824.html,0,www.n-tv.de,Ukraine-Krieg im Liveticker: +++ 05:36 Selenskyj räumt Rückschläge an der Front ein +++,Lesen Sie alle aktuellen Entwicklungen und Nachrichten über den russischen Angriffskrieg auf die Ukraine im Liveticker von ntv.de.,https://bilder3.n-tv.de/img/incoming/crop25117070/4231326595-cImg_16_9-w1200/Ukraine-Liveticker.jpg,2025-01-03T23:32:00Z,,Der ukrainische Präsident Selenskyj räumt das kontinuierliche Vorrücken der Russen in der Ostukraine ein. In einem Fernsehinterview führt er es vor allem auf fehlende Reserven der ukrainischen Armee … [+7427 chars],,de,'Gas'
https://www.n-tv.de/politik/14-34-Russlands-Autoabsatz-2024-um-fast-50-Prozent-gestiegen--article23143824.html,https://www.n-tv.de/politik/14-34-Russlands-Autoabsatz-2024-um-fast-50-Prozent-gestiegen--article23143824.html,0,www.n-tv.de,Ukraine-Krieg im Liveticker: +++ 14:34 Russlands Autoabsatz 2024 um fast 50 Prozent gestiegen +++,Lesen Sie alle aktuellen Entwicklungen und Nachrichten über den russischen Angriffskrieg auf die Ukraine im Liveticker von ntv.de.,https://bilder3.n-tv.de/img/incoming/crop25117070/4231326595-cImg_16_9-w1200/Ukraine-Liveticker.jpg,2025-01-03T23:32:00Z,https://web.archive.org/web/20250105023437/https://www.n-tv.de/politik/14-34-Russlands-Autoabsatz-2024-um-fast-50-Prozent-gestiegen--article23143824.html,"Der russische Automarkt ist im vergangenen Jahr stark gewachsen. Die Zahl der Neuzulassungen sei um 47 Prozent auf 1,55 Millionen Stück gestiegen, berichten Nachrichtenagenturen unter Berufung auf Da… [+17312 chars]",,de,'Angriff'
