index,url,valid,domain,title,description,image,published,archive,content,quote,language,keyword
https://www.sueddeutsche.de/wirtschaft/inflation-konjunktur-wirtschaft-ukraine-krieg-rezession-wachstum-1.5731519,https://www.sueddeutsche.de/wirtschaft/inflation-konjunktur-wirtschaft-ukraine-krieg-rezession-wachstum-1.5731519,0,www.sueddeutsche.de,Wirtschaft wächst trotz Krieg und Inflation stark,"Die Deutschen haben ihre Konten leergeräumt, um trotz Rekord-Teuerung zu konsumieren. Das pushte die Wirtschaftsleistung 2022 um fast zwei Prozent. Aber wie geht es jetzt weiter?",https://www.sueddeutsche.de/image/sz.1.5731520/1200x675?v=1673600532,2023-01-13T09:03:11Z,https://web.archive.org/web/20230113090542/https://www.sueddeutsche.de/wirtschaft/inflation-konjunktur-wirtschaft-ukraine-krieg-rezession-wachstum-1.5731519,"Die Deutschen haben ihre Konten leergeräumt, um trotz Rekord-Teuerung zu konsumieren. Das pushte die Wirtschaftsleistung 2022 um fast zwei Prozent. Aber wie geht es jetzt weiter?Es war ein Jahr der E… [+6352 chars]",,de,'Inflation'
https://www.faz.net/aktuell/wirtschaft/bruttoinlandsprodukt-deutsche-wirtschaft-ist-2022-um-1-9-prozent-gewachsen-18599255.html,https://www.faz.net/aktuell/wirtschaft/bruttoinlandsprodukt-deutsche-wirtschaft-ist-2022-um-1-9-prozent-gewachsen-18599255.html,0,www.faz.net,"Bruttoinlandsprodukt: Deutsche Wirtschaft ist 2022 um 1,9 Prozent gewachsen","Trotz Krieg, Energiekrise und Inflation ist die Wirtschaft nicht abgestürzt. Sie steht am Rande einer Rezession, doch gibt es Lichtblicke.",https://media1.faz.net/ppmedia/aktuell/wirtschaft/1058176664/1.8599299/facebook_teaser/container-im-hamburger-hafen.jpg,2023-01-13T09:05:34Z,https://web.archive.org/web/20230113092150/https://www.faz.net/aktuell/wirtschaft/bruttoinlandsprodukt-deutsche-wirtschaft-ist-2022-um-1-9-prozent-gewachsen-18599255.html,"In den zurückliegenden zwölf Monaten ist das Bruttoinlandsprodukt um 1,9 Prozent gewachsen. Das hat das Statistische Bundesamt am Freitag bekanntgegeben. Das Wachstum lag damit zwar deutlich unter de… [+3656 chars]",,de,'Inflation'
https://www.tagesschau.de/wirtschaft/verbraucher/gaspreis-125.html,https://www.tagesschau.de/wirtschaft/verbraucher/gaspreis-125.html,0,www.tagesschau.de,Wann Kunden vom sinkenden Gaspreis profitieren,Die Gasspeicher sind voll und das Wetter mild. Das lässt den Gaspreis wieder deutlich sinken. Davon profitieren auch schon einige Kunden. Warum kommt der Rückgang aber nicht bei allen Verbrauchern an? <em>Von Bianca von der Au.</em>,https://www.tagesschau.de/multimedia/bilder/gaspreis-105~_v-original.jpg,2023-01-13T09:31:26Z,,Die Gasspeicher sind voll und das Wetter mild. Das lässt den Gaspreis wieder deutlich sinken. Davon profitieren auch schon einige Kunden. Warum kommt der Rückgang aber nicht bei allen Verbrauchern an… [+3140 chars],,de,'Gas'
https://www.tagesschau.de/wirtschaft/weltwirtschaft/inflation-argentinien-101.html,https://www.tagesschau.de/wirtschaft/weltwirtschaft/inflation-argentinien-101.html,0,www.tagesschau.de,Inflation in Argentinien bei fast 95 Prozent,In Argentinien ist die Inflation auf den höchsten Stand seit Anfang der 1990er-Jahre gestiegen. Das südamerikanische Land gehört zu den Staaten mit der stärksten Teuerung weltweit.,https://www.tagesschau.de/multimedia/bilder/argentinien-inflation-103~_v-original.jpg,2023-01-13T10:20:54Z,https://web.archive.org/web/20230113102231/http://www.tagesschau.de/wirtschaft/weltwirtschaft/inflation-argentinien-101.html,"In Argentinien ist die Inflation auf den höchsten Stand seit Anfang der 1990er-Jahre gestiegen. Das südamerikanische Land gehört zu den Staaten mit der stärksten Teuerung weltweit.
Im Zuge der schwe… [+2335 chars]",,de,'Inflation'
https://www.zeit.de/news/2023-01/13/loch-in-abwasserleitung-des-stillgelegten-akw-brunsbuettel,https://www.zeit.de/news/2023-01/13/loch-in-abwasserleitung-des-stillgelegten-akw-brunsbuettel,0,www.zeit.de,Atomkraft: Loch in Abwasserleitung des stillgelegten AKW Brunsbüttel,,,2023-01-13T10:59:18Z,https://web.archive.org/web/20230113112528/https://www.zeit.de/news/2023-01/13/loch-in-abwasserleitung-des-stillgelegten-akw-brunsbuettel,"When browsing with ads:
We collect personal data and also transmit it to third-party providers
 that help us improve and finance our digital content. Some of the information stored on your device, … [+732 chars]",,de,'Atomkraft'
https://www.stern.de/gesellschaft/regional/hamburg-schleswig-holstein/atomkraft--loch-in-abwasserleitung-des-stillgelegten-akw-brunsbuettel-33096752.html,https://www.stern.de/gesellschaft/regional/hamburg-schleswig-holstein/atomkraft--loch-in-abwasserleitung-des-stillgelegten-akw-brunsbuettel-33096752.html,0,www.stern.de,Atomkraft: Loch in Abwasserleitung des stillgelegten AKW Brunsbüttel,"Bei Kontrollen ist ein Leck an einer Leitung für radioaktive Abwässer im stillgelegten Kernkraftwerk Brunsbüttel entdeckt worden. Durch die Leckage an einer Schweißnaht habe es eine geringe Kontamination im Sperrbereich des Reaktorgebäudes gegeben, teilte das…",https://image.stern.de/33096754/t/_-/v1/w1440/r1.7778/-/13--urnnewsmldpacom2009010123011399206863v2w800h600l637t214r4451b2722jpeg---df62c60f58080002.jpg,2023-01-13T10:59:18Z,https://web.archive.org/web/20230113111315/https://www.stern.de/gesellschaft/regional/hamburg-schleswig-holstein/atomkraft--loch-in-abwasserleitung-des-stillgelegten-akw-brunsbuettel-33096752.html,Bei Kontrollen ist ein Leck an einer Leitung für radioaktive Abwässer im stillgelegten Kernkraftwerk Brunsbüttel entdeckt worden. Durch die Leckage an einer Schweißnaht habe es eine geringe Kontamina… [+1251 chars],,de,'Atomkraft'
https://www.zeit.de/news/2023-01/13/ministerpraesident-rhein-fordert-leopard-lieferung-an-ukraine,https://www.zeit.de/news/2023-01/13/ministerpraesident-rhein-fordert-leopard-lieferung-an-ukraine,0,www.zeit.de,Ukraine-Krieg: Ministerpräsident Rhein fordert Leopard-Lieferung an Ukraine,,,2023-01-13T11:22:24Z,https://web.archive.org/web/20230113113506/https://www.zeit.de/news/2023-01/13/ministerpraesident-rhein-fordert-leopard-lieferung-an-ukraine,"When browsing with ads:
We collect personal data and also transmit it to third-party providers
 that help us improve and finance our digital content. Some of the information stored on your device, … [+732 chars]",,de,'Ukraine'
https://www.focus.de/panorama/welt/streit-eskaliert-messerattacke-in-fluechtlingseinrichtung-ukrainer-tot_id_182932927.html,https://www.focus.de/panorama/welt/streit-eskaliert-messerattacke-in-fluechtlingseinrichtung-ukrainer-tot_id_182932927.html,0,www.focus.de,Streit eskaliert - Messerattacke in Flüchtlingseinrichtung - Ukrainer tot,Ein Streit in einer Flüchtlingsunterkunft in Lotte ist eskaliert. Ein 40-Jähriger soll dabei einen ukrainischen Mitbewohner getötet haben. Der Mann konnte nach einer Flucht gefasst werden.,https://p6.focus.de/img/regional/nordrhein-westfalen/id_182932821/ein-blaulicht-leuchtet-auf-dem-dach-eines-streifenwagens-der-polizei..jpg?im=Crop%3D%280%2C281%2C2048%2C1023%29%3BResize%3D%281200%2C627%29&impolicy=perceptual&quality=medium&hash=4d9f839671c104aa257e50c44c49019fe9b8462ae99e61dc0e04a547cb08242d,2023-01-13T11:24:50Z,https://web.archive.org/web/20230113120754/https://www.focus.de/panorama/welt/streit-eskaliert-messerattacke-in-fluechtlingseinrichtung-ukrainer-tot_id_182932927.html,"Ein heftiger Streit zwischen zwei Ukrainern ist am Donnerstagabend in einer Flüchtlingseinrichtung im westfälischen Lotte für einen der beiden Männer tödlich ausgegangen. 
Wie Polizei und Staatsanwa… [+348 chars]",,de,'Ukraine'
https://www.zeit.de/news/2023-01/13/it-fachfrau-nach-flucht-in-greifswald-mein-herz-ist-in-der-ukraine,https://www.zeit.de/news/2023-01/13/it-fachfrau-nach-flucht-in-greifswald-mein-herz-ist-in-der-ukraine,0,www.zeit.de,Migration: IT-Fachfrau nach Flucht in Greifswald: «Mein Herz ist in der Ukraine»,,,2023-01-13T15:03:04Z,https://web.archive.org/web/20230113152003/https://www.zeit.de/news/2023-01/13/it-fachfrau-nach-flucht-in-greifswald-mein-herz-ist-in-der-ukraine,"When browsing with ads:
We collect personal data and also transmit it to third-party providers
 that help us improve and finance our digital content. Some of the information stored on your device, … [+732 chars]",,de,'Flucht'
https://www.stern.de/wirtschaft/atomkraft--deutschland-macht-schluss---im-gegensatz-zu-anderen-laendern-33094010.html,https://www.stern.de/wirtschaft/atomkraft--deutschland-macht-schluss---im-gegensatz-zu-anderen-laendern-33094010.html,0,www.stern.de,Neue Meiler: Deutschland steigt aus der Atomkraft aus – ganz im Gegensatz zu anderen Ländern,"Aus der Atomkraft will Deutschland aussteigen. Im Zuge der Energiekrise fordern einige, wieder stärker auf nukleare Energie zu setzen. Ein Blick in die Welt zeigt: Viele Staaten tun dies bereits.",https://image.stern.de/33093118/t/xV/v2/w1440/r1.7778/-/atomkraftwerk-akw.jpg,2023-01-13T15:50:00Z,https://web.archive.org/web/20230113160315/https://www.stern.de/wirtschaft/atomkraft--deutschland-macht-schluss---im-gegensatz-zu-anderen-laendern-33094010.html,"Atomkraft?
An dieser Frage scheiden sich die Geister der deutschen Politik.
Eigentlich soll am 15. April Schluss sein für die letzten drei laufenden Atomkraftwerke in Deutschland: Emsland, Isar 2 u… [+1065 chars]",,de,'Atomkraft'
https://www.faz.net/aktuell/politik/ukraine-liveticker-lambrecht-will-am-schuetzenpanzer-puma-festhalten-18495964.html,https://www.faz.net/aktuell/politik/ukraine-liveticker-lambrecht-will-am-schuetzenpanzer-puma-festhalten-18495964.html,0,www.faz.net,Ukraine-Liveblog: Lambrecht will am Schützenpanzer Puma festhalten,NATO verlegt Awacs-Aufklärungsflugzeuge nach Rumänien +++ Moskau meldet Einnahme von Soledar  +++ Polen: Ukraine braucht mehr als 14 Leopard-Panzer +++ alle Entwicklungen im Liveblog.,https://media1.faz.net/ppmedia/aktuell/3269345291/1.8601319/facebook_teaser/verteidigungsministerin.jpg,2023-01-13T16:07:45Z,https://web.archive.org/web/20230113163124/https://www.faz.net/aktuell/politik/ukraine-liveticker-lambrecht-will-am-schuetzenpanzer-puma-festhalten-18495964.html,"Der Präsident des Reservistenverbandes der Deutschen Bundeswehr, Patrick Sensburg, hat die schnelle Lieferung möglichst vieler Leopard-Kampfpanzer an die Ukraine gefordert - auch aus Bundeswehr-Bestä… [+1342 chars]",,de,'Ukraine'
https://www.zeit.de/news/2023-01/13/scholz-verteidigt-raeumung-von-luetzerath-kritik-an-gewalt,https://www.zeit.de/news/2023-01/13/scholz-verteidigt-raeumung-von-luetzerath-kritik-an-gewalt,0,www.zeit.de,Klima: Scholz verteidigt Räumung von Lützerath: Kritik an Gewalt,,,2023-01-13T16:29:45Z,https://web.archive.org/web/20230113165243/https://www.zeit.de/news/2023-01/13/scholz-verteidigt-raeumung-von-luetzerath-kritik-an-gewalt,"When browsing with ads:
We collect personal data and also transmit it to third-party providers
 that help us improve and finance our digital content. Some of the information stored on your device, … [+732 chars]",,de,'Klima'
https://www.sueddeutsche.de/leben/flucht-mitgenommen-1.5731541,https://www.sueddeutsche.de/leben/flucht-mitgenommen-1.5731541,0,www.sueddeutsche.de,Flucht: Mitgenommen,"Wer flüchtet, muss viel zurücklassen. Hier erzählen
Kinder, was sie retten konnten. Diesmal Masha, 10,
aus Mykolajiwka in der Ukraine, seit fast acht 
Monaten in Kunewalde, Sachsen.",https://www.sueddeutsche.de/assets/png/sz-ecb090256670a577bd629a9718686332.png,2023-01-13T17:52:35Z,https://web.archive.org/web/20230115181905/https://www.sueddeutsche.de/leben/flucht-mitgenommen-1.5731541,"13. Januar 2023, 18:52 Uhr
Wer flüchtet, muss viel zurücklassen. Hier erzählen
Kinder, was sie retten konnten. Diesmal Masha, 10,
aus Mykolajiwka in der Ukraine, seit fast acht 
Monaten in Kunewa… [+1083 chars]",,de,'Flucht'
https://www.faz.net/aktuell/politik/ukraine-liveblog-iaea-will-weitere-experten-in-ukrainischen-atomkraftwerken-stationieren-18495964.html,https://www.faz.net/aktuell/politik/ukraine-liveblog-iaea-will-weitere-experten-in-ukrainischen-atomkraftwerken-stationieren-18495964.html,0,www.faz.net,Ukraine-Liveblog: IAEA will weitere Experten in ukrainischen Atomkraftwerken stationieren,Lambrecht will am Schützenpanzer Puma festhalten +++ NATO verlegt Awacs-Aufklärungsflugzeuge nach Rumänien +++ Moskau meldet Einnahme von Soledar +++ alle Entwicklungen im Liveblog.,https://media0.faz.net/ppmedia/aktuell/politik/3542648760/1.8601704/facebook_teaser/iaea-chef-rafael-grossi-wird.jpg,2023-01-13T18:17:24Z,https://web.archive.org/web/20230113190453/https://www.faz.net/aktuell/politik/ukraine-liveblog-iaea-will-weitere-experten-in-ukrainischen-atomkraftwerken-stationieren-18495964.html,"Der Präsident des Reservistenverbandes der Deutschen Bundeswehr, Patrick Sensburg, hat die schnelle Lieferung möglichst vieler Leopard-Kampfpanzer an die Ukraine gefordert - auch aus Bundeswehr-Bestä… [+1342 chars]",,de,'Ukraine'
https://www.faz.net/aktuell/rhein-main/der-sprung-ins-eiskalte-wasser-macht-kaltbader-gluecklich-18601473.html,https://www.faz.net/aktuell/rhein-main/der-sprung-ins-eiskalte-wasser-macht-kaltbader-gluecklich-18601473.html,0,www.faz.net,Kaltbaden: Frieren macht glücklich,"Für die einen ist bereits der Gedanke eine Qual, für andere ist es das reine Vergnügen: baden in eiskaltem Wasser. Die Ice Dippers treffen sich jede Woche zum Baden - auch bei zehn Grad minus.",https://media0.faz.net/ppmedia/aktuell/689455315/1.8601470/facebook_teaser_fplus/haende-hoch-es-ist-wichtig-die.jpg,2023-01-13T19:11:35Z,https://web.archive.org/web/20230115163322/http://www.faz.net/aktuell/rhein-main/der-sprung-ins-eiskalte-wasser-macht-kaltbader-gluecklich-18601473.html,"Es ist 9 Uhr morgens, kurz vor Silvester. Die Lufttemperatur beträgt etwa sechs Grad. Das Wasser des Walldorfer Sees hat viereinhalb Grad, Georg Patsakas hat es gerade gemessen. Es ist alles nur der … [+1185 chars]",,de,'Frieren'
https://www.zeit.de/news/2023-01/13/mann-in-wohnung-mit-messer-attackiert-taeter-auf-flucht,https://www.zeit.de/news/2023-01/13/mann-in-wohnung-mit-messer-attackiert-taeter-auf-flucht,0,www.zeit.de,Dortmund : Mann in Wohnung mit Messer attackiert: Täter auf Flucht,,,2023-01-13T19:28:29Z,https://web.archive.org/web/20230113200629/https://www.zeit.de/news/2023-01/13/mann-in-wohnung-mit-messer-attackiert-taeter-auf-flucht,"When browsing with ads:
We collect personal data and also transmit it to third-party providers
 that help us improve and finance our digital content. Some of the information stored on your device, … [+732 chars]",,de,'Flucht'
https://www.zeit.de/politik/ausland/2023-01/ukraine-ueberblick-internationale-atomenergiebehoerde-wolodymyr-selenskyj-akw-soledar,https://www.zeit.de/politik/ausland/2023-01/ukraine-ueberblick-internationale-atomenergiebehoerde-wolodymyr-selenskyj-akw-soledar,0,www.zeit.de,"Ukraine-Überblick: Mehr Atomkontrolleure für Ukraine, Selenskyj dementiert Soledar-Fall",Bis zu zwölf Mitarbeiter der Internationalen Atomenergiebehörde werden alle AKW der Ukraine überwachen. Laut Selenskyj gehen die Kämpfe um Soledar weiter. Die Nacht,,2023-01-14T04:28:04Z,,"When browsing with ads:
We collect personal data and also transmit it to third-party providers
 that help us improve and finance our digital content. Some of the information stored on your device, … [+732 chars]",,de,'Ukraine'
https://www.dw.com/de/ukraine-aktuell-tote-und-verletzte-bei-angriff-auf-dnipro/a-64392780,https://www.dw.com/de/ukraine-aktuell-tote-und-verletzte-bei-angriff-auf-dnipro/a-64392780,0,www.dw.com,Ukraine aktuell: Tote und Verletzte bei Angriff auf Dnipro,Aus der Großstadt Dnipro werden nach einer russischen Attacke mindestens fünf Tote gemeldet. Auch die ukrainische Hauptstadt wurde angegriffen. Ein Überblick.,https://static.dw.com/image/64394778_6.jpg,2023-01-14T10:21:00Z,,"Das Wichtigste in Kürze:
<ul><li>Tote und Verletzte in Dnipro</li><li>Großbritannien will Challenger-Kampfpanzer bereit stellen</li><li>Die IAEA schickt weitere Experten zu den ukrainischen Atomkraf… [+8858 chars]",,de,'Ukraine'
https://www.dw.com/de/ukraine-aktuell-raketen-auf-kiew/a-64392780,https://www.dw.com/de/ukraine-aktuell-raketen-auf-kiew/a-64392780,0,www.dw.com,Ukraine aktuell: Raketen auf Kiew,Die Hauptstadt steht unter Beschuss. Präsident Selenskyj berichtet von weiteren Kämpfen um die im Osten gelegene Kleinstadt Soledar. Die IAEA will ihr Personal in der Ukraine aufstocken. Ein Überblick.,https://static.dw.com/image/64393277_6.jpg,2023-01-14T10:21:00Z,https://web.archive.org/web/20230114104901/https://www.dw.com/de/ukraine-aktuell-raketen-auf-kiew/a-64392780,"Das Wichtigste in Kürze:
<ul><li>Kiew steht unter Beschuss</li><li>Präsident Selenskyj sieht Soledar noch nicht verloren</li><li>London: Russland befürchtet ukrainische Angriffe im Schwarzen Meer</l… [+6379 chars]",,de,'Angriff'
https://www.stern.de/politik/ausland/brasilien--oberstes-gericht-billigt-ermittlungen-gegen-bolsonaro--33099598.html,https://www.stern.de/politik/ausland/brasilien--oberstes-gericht-billigt-ermittlungen-gegen-bolsonaro--33099598.html,0,www.stern.de,Vorwurf der Anstiftung: Nach Sturm auf Brasiliens Kongress: Oberstes Gericht stimmt Ermittlungen gegen Bolsonaro zu,Die Ausschreitungen Tausender Anhänger des Ex-Präsidenten Brasiliens wurde als Angriff auf die Demokratie wahrgenommen. Nun billigt das Oberstes Gericht Ermittlungen gegen Jair Bolsonaro – und dessen Rolle beim Sturm auf den Präsidentenpalast.,https://image.stern.de/33099640/t/d9/v1/w1440/r1.7778/-/bolsonaro.jpg,2023-01-14T10:23:00Z,https://web.archive.org/web/20230114102735/https://www.stern.de/politik/ausland/brasilien--oberstes-gericht-billigt-ermittlungen-gegen-bolsonaro--33099598.html,Die Ausschreitungen Tausender Anhänger des Ex-Präsidenten Brasiliens wurde als Angriff auf die Demokratie wahrgenommen. Nun billigt das Oberstes Gericht Ermittlungen gegen Jair Bolsonaro und dessen R… [+4353 chars],,de,'Angriff'
https://www.fr.de/politik/ukraine-krieg-russische-verluste-kampf-putin-russland-selenskyj-news-ticker-zr-92025236.html,https://www.fr.de/politik/ukraine-krieg-russische-verluste-kampf-putin-russland-selenskyj-news-ticker-zr-92025236.html,0,www.fr.de,Russland löst Kriegsflotte auf - Geheimdienst spricht von „spezifischer Bedrohung“ - fr.de,"<ol><li>Russland löst Kriegsflotte auf - Geheimdienst spricht von „spezifischer Bedrohung“  fr.de
</li><li>+++ Krieg in der Ukraine +++: Angriffe auf Kiew – Gouverneure warnen vor schweren Luftschlägen  DER SPIEGEL
</li><li>Plant Kiew eine Offensive?: Londo…",https://www.fr.de/bilder/2023/01/13/92025236/30681323-ein-landungsschiff-bdk-58-kaliningrad-der-russischen-schwarzmeerflotte-im-februar-2022-2ucKyi6vGQfe.jpg,2023-01-14T11:10:00Z,https://web.archive.org/web/20230114001835/https://www.fr.de/politik/ukraine-krieg-russische-verluste-kampf-putin-russland-selenskyj-news-ticker-zr-92025236.html,"<ol><li>Startseite</li><li>Politik</li></ol>Erstellt: 14.01.2023Aktualisiert: 14.01.2023, 12:17 Uhr
Von: Caspar Felix Hoffmann, Stefan Krieger, Andreas Apetz, Lucas Maier
KommentareTeilen
Vor alle… [+10452 chars]",,de,'Russland'
https://www.faz.net/aktuell/politik/ukraine-liveblog-russland-verlegt-schiffe-der-schwarzmeerflotte-18495964.html,https://www.faz.net/aktuell/politik/ukraine-liveblog-russland-verlegt-schiffe-der-schwarzmeerflotte-18495964.html,0,www.faz.net,Ukraine-Liveblog: London: Russland verlegt Schiffe aus Angst vor ukrainischem Angriff,Raketenangriff auf Kiew am Samstagmorgen +++ Bericht: Entscheidung über Entsendung von Leopard-Kampfpanzern nächste Woche +++ IAEA stationiert mehr Experten an ukrainischen AKWs +++ Entwicklungen im Liveblog.,https://media1.faz.net/ppmedia/aktuell/3477445856/1.8602571/facebook_teaser/schiffe-der-schwarzmeerflotte.jpg,2023-01-14T11:20:43Z,,Bundesjustizminister Marco Buschmann (FDP) sieht die Einrichtung eines speziellen UN-Sondertribunals für russische Kriegsverbrechen in der Ukraine skeptisch. Das unterspült möglicherweise die Akzepta… [+1688 chars],,de,'Russland'
https://www.faz.net/aktuell/politik/bulgarien-setzt-auf-atomkraft-und-westliche-partner-18600633.html,https://www.faz.net/aktuell/politik/bulgarien-setzt-auf-atomkraft-und-westliche-partner-18600633.html,0,www.faz.net,Loslösung von Russland: Brennstäbe für Bulgarien aus Amerika,"Was bei Gas bereits gelang, soll nun auch bei Atomkraft geschehen: Bulgarien will mit Hilfe westlicher Partner von Russland unabhängig(er) werden.",https://media0.faz.net/ppmedia/aktuell/politik/ausland/1465634946/1.8600632/facebook_teaser_fplus/das-atomkraftwerk-kozloduj-im.jpg,2023-01-14T11:26:35Z,https://web.archive.org/web/20230114114603/https://www.faz.net/aktuell/politik/bulgarien-setzt-auf-atomkraft-und-westliche-partner-18600633.html,"Bei Erdgas ist es schon gelungen, nun versucht Bulgarien, auch bei Atomstrom unabhängig(er) von Russland werden. Das bulgarische Atomkraftwerk in Kozloduj an der Donau, gebaut in den Siebzigerjahren … [+622 chars]",,de,'Atomkraft'
https://www.zeit.de/news/2023-01/14/fdp-legt-positionspapier-im-kampf-gegen-inflation-vor,https://www.zeit.de/news/2023-01/14/fdp-legt-positionspapier-im-kampf-gegen-inflation-vor,0,www.zeit.de,Finanzen: FDP legt Positionspapier im Kampf gegen Inflation vor,,,2023-01-14T11:26:46Z,https://web.archive.org/web/20230114115212/https://www.zeit.de/news/2023-01/14/fdp-legt-positionspapier-im-kampf-gegen-inflation-vor,"When browsing with ads:
We collect personal data and also transmit it to third-party providers
 that help us improve and finance our digital content. Some of the information stored on your device, … [+732 chars]",,de,'Inflation'
https://www.sueddeutsche.de/politik/ukraine-krieg-newsblog-dnipro-tote-luftalarm-grossbritannien-challenger-1.5731440,https://www.sueddeutsche.de/politik/ukraine-krieg-newsblog-dnipro-tote-luftalarm-grossbritannien-challenger-1.5731440,0,www.sueddeutsche.de,Liveblog zum Krieg in der Ukraine: Tote und Verletzte nach Raketenangriff in Dnipro,"In der ukrainischen Großstadt wurde ein Wohnblock schwer beschädigt. Unter den Trümmern werden noch Menschen vermutet, erklärt die ukrainische Präsidialverwaltung.",https://www.sueddeutsche.de/image/sz.1.5732302/1200x675?v=1673713750,2023-01-14T11:54:44Z,https://web.archive.org/web/20230114170129/https://www.sueddeutsche.de/politik/ukraine-krieg-newsblog-dnipro-tote-luftalarm-grossbritannien-challenger-1.5731440,Seit Februar wehren sich die ukrainischen Truppen gegen den russischen Angriff. Viele Angaben über den Kriegsverlauf wie Opferzahlen oder Details zu Kämpfen stammen von der ukrainischen oder der russ… [+207 chars],,de,'Ukraine'
https://web.de/magazine/politik/russland-krieg-ukraine/ukraine-krieg-live-ticker-grossbritannien-challenger-kampfpanzer-ukraine-abgeben-37723230,https://web.de/magazine/politik/russland-krieg-ukraine/ukraine-krieg-live-ticker-grossbritannien-challenger-kampfpanzer-ukraine-abgeben-37723230,0,web.de,Ukraine-Krieg im Live-Ticker: Großbritannien will Challenger-Kampfpanzer an Ukraine abgeben - WEB.DE News,"<ol><li>Ukraine-Krieg im Live-Ticker: Großbritannien will Challenger-Kampfpanzer an Ukraine abgeben  WEB.DE News
</li><li>Ukraine-Krieg | Großbritannien will Challenger-Kampfpanzer an Ukraine liefern  t-online
</li><li>Großbritannien liefert Challenger-Kamp…","https://i0.web.de/image/660/37723660,pd=2,f=opengraph.jpg",2023-01-14T11:55:32Z,https://web.archive.org/web/20230114140706/https://web.de/magazine/politik/russland-krieg-ukraine/ukraine-krieg-live-ticker-grossbritannien-challenger-kampfpanzer-ukraine-abgeben-37723230,<ul><li>12:36 Uhr: Großbritannien will Challenger-Kampfpanzer an Ukraine abgeben</li><li>12:24 Uhr: Morawiecki will in Berlin über Kampfpanzer für die Ukraine sprechen</li><li>10:44 Uhr: London: Russ… [+9521 chars],,de,'Angriff'
https://www.zeit.de/news/2023-01/14/polizeipraesident-demo-herausforderung-fuer-einsatzkraefte,https://www.zeit.de/news/2023-01/14/polizeipraesident-demo-herausforderung-fuer-einsatzkraefte,0,www.zeit.de,Klima-Protest: Polizeipräsident: Demo Herausforderung für Einsatzkräfte,,,2023-01-14T12:08:44Z,https://web.archive.org/web/20230114123532/https://www.zeit.de/news/2023-01/14/polizeipraesident-demo-herausforderung-fuer-einsatzkraefte,"When browsing with ads:
We collect personal data and also transmit it to third-party providers
 that help us improve and finance our digital content. Some of the information stored on your device, … [+732 chars]",,de,'Klima'
https://www.n-tv.de/politik/London-Russland-verlegt-Schiffe-aus-Sorge-vor-Angriffen-article23844419.html,https://www.n-tv.de/politik/London-Russland-verlegt-Schiffe-aus-Sorge-vor-Angriffen-article23844419.html,0,www.n-tv.de,Plant Kiew eine Offensive?: London: Russland verlegt Schiffe aus Sorge vor Angriffen,"Zehn Schiffe der russischen Schwarzmeerflotte verlassen vor wenigen Tagen den Hafen von Noworossijsk. Der britische Geheimdienst geht nicht von einer neuen Militäroperation aus. Vielmehr vermuten die Experten, dass der Kreml auf eine Bedrohung von ukrainische…",https://bilder3.n-tv.de/img/incoming/crop23844562/396132643-cImg_16_9-w1200/214830747.jpg,2023-01-14T12:10:36Z,https://web.archive.org/web/20230114122616/https://www.n-tv.de/politik/London-Russland-verlegt-Schiffe-aus-Sorge-vor-Angriffen-article23844419.html,Zehn Schiffe der russischen Schwarzmeerflotte verlassen vor wenigen Tagen den Hafen von Noworossijsk. Der britische Geheimdienst geht nicht von einer neuen Militäroperation aus. Vielmehr vermuten die… [+1394 chars],,de,'Russland'
