index,url,valid,domain,title,description,image,published,archive,content,quote,language,keyword
https://www.zeit.de/news/2025-06/10/verschwundene-waffen-diese-konsequenzen-soll-es-geben,https://www.zeit.de/news/2025-06/10/verschwundene-waffen-diese-konsequenzen-soll-es-geben,0,www.zeit.de,Mängel geprüft: Verschwundene Waffen - diese Konsequenzen soll es geben,Hier finden Sie Informationen zu dem Thema „Mängel geprüft“. Lesen Sie jetzt „Verschwundene Waffen - diese Konsequenzen soll es geben“.,https://img.zeit.de/news/2025-06/10/verschwundene-waffen-diese-konsequenzen-soll-es-geben-image-group/wide__1300x731,2025-06-10T02:04:37Z,,Nach der Prüfung von Mängeln bei der Aufbewahrung von Beweismitteln bei der Polizei in Sachsen-Anhalt sollen Konsequenzen gezogen werden. So sollen etwa Schulungen für Mitarbeiter verstärkt und minde… [+1792 chars],,de,'Waffen'
https://www.zeit.de/wirtschaft/2025-06/heizungen-waermepumpe-gasheizung-statistik-wohnen,https://www.zeit.de/wirtschaft/2025-06/heizungen-waermepumpe-gasheizung-statistik-wohnen,0,www.zeit.de,Heizungen: Käuferstreik im Heizungskeller,"Wärmepumpe? Gasheizung? Oder einfach nichts machen? Die Verwirrung ums Heizen ist groß, auch wegen der Regierung – das wirkt sich auf Verkäufe aus. Die Lage in Grafiken",https://img.zeit.de/wirtschaft/2025-05/heizungen-waermepumpe-gasheizung-statistik-wohnen-bild/wide__1300x731,2025-06-10T07:27:46Z,,"Sollen alle Hausbesitzerinnen und Hausbesitzer weiter Öl und Gas verbrennen dürfen?
Soll die Förderung für Wärmepumpen und andere klimafreundlichere Heizungen sinken?
Die neue Wirtschaftsministerin… [+623 chars]",,de,'Heizen'
https://www.faz.net/aktuell/gesellschaft/kriminalitaet/schizophrenie-und-gewalt-es-braucht-mehr-behandlung-110522373.html,https://www.faz.net/aktuell/gesellschaft/kriminalitaet/schizophrenie-und-gewalt-es-braucht-mehr-behandlung-110522373.html,0,www.faz.net,So kann Gewalt von Menschen mit Schizophrenie verhindert werden,Nicht erst seit den Angriffen von Aschaffenburg und Hamburg ist klar: Menschen mit Schizophrenie können ein erhöhtes Gewaltrisiko haben. Warum werden sie dann nicht besser behandelt?,https://media1.faz.net/ppmedia/aktuell/1662468582/1.10522369/facebook_teaser/das-macht-ja-auch-wuetend.jpg,2025-06-10T07:32:27Z,,"Gewalt ist nicht krank. Die meisten Körperverletzungen und Tötungsdelikte werden von Gesunden begangen, psychisch kranke Menschen haben im Durchschnitt kein erhöhtes Gewaltrisiko. Wenn es nun um die … [+11277 chars]",,de,'Angriff'
https://www.morgenpost.de/wirtschaft/article409225458/pelletspreise-heute-aktuell-10-juni-2025-holz-pellets-tonne-heizung.html,https://www.morgenpost.de/wirtschaft/article409225458/pelletspreise-heute-aktuell-10-juni-2025-holz-pellets-tonne-heizung.html,0,www.morgenpost.de,Pelletspreise heute (10. Juni): Der aktuelle Preis pro Tonne,Das Juni-Wetter blieb auch über Pfingsten wechselhaft. Wie wirkt sich das auf den Pelletspreis aus? Ein Überblick vom 10. Juni.,https://img.sparknews.funkemedien.de/407215581/407215581_1726557934_v16_9_1600.jpeg,2025-06-10T07:47:40Z,,"Berlin. Das Juni-Wetter blieb auch über Pfingsten wechselhaft. Wie wirkt sich das auf den Pelletspreis aus? Ein Überblick vom 10. Juni.
Ist der Abwärtstrend beim Pelletspreis nun endgültig vorbei? H… [+4956 chars]",,de,'heizen'
https://www.stern.de/gesellschaft/regional/thueringen/verbraucherpreise--inflation-in-thueringen-verharrt-bei-1-6-prozent-35796182.html,https://www.stern.de/gesellschaft/regional/thueringen/verbraucherpreise--inflation-in-thueringen-verharrt-bei-1-6-prozent-35796182.html,0,www.stern.de,"Verbraucherpreise: Inflation in Thüringen verharrt bei 1,6 Prozent","Lebensmittel werden immer teurer, dafür gibt es Entlastung bei den Energiepreisen: Im Mai müssen die Verbraucher daher im Schnitt nicht unter übermäßigen Preissprüngen leiden.",https://image.stern.de/35796184/t/3O/v1/w1440/r1.7778/-/10--4laxjvt6twv8axs2048jpeg---1cd8f4150f632f08.jpg,2025-06-10T09:41:57Z,,"Kopiere den aktuellen Link
Zur Merkliste hinzufügen
Lebensmittel werden immer teurer, dafür gibt es Entlastung bei den Energiepreisen: Im Mai müssen die Verbraucher daher im Schnitt nicht unter übe… [+1678 chars]",,de,'Inflation'
https://stadt-bremerhaven.de/nothing-phone-3-neues-bild-zeigt-das-kommende-smartphone/,https://stadt-bremerhaven.de/nothing-phone-3-neues-bild-zeigt-das-kommende-smartphone/,0,stadt-bremerhaven.de,Nothing Phone (3): Neues Bild zeigt das kommende Smartphone,Das Nothing Phone (3) wird am 1. Juli 2025 offiziell mit allen Spezifikationen vorgestellt. Dann werden wir auch mehr zur Verfügbarkeit und dem Preis erfahren. Doch inzwischen ist immerhin schon ein Bild des Smartphones durchgesickert. Die Aufnahme zeigt die …,https://stadt-bremerhaven.de/wp-content/uploads/2025/06/Nothing-Phone-3.jpg,2025-06-10T10:00:18Z,,Das Nothing Phone (3) wird am 1. Juli 2025 offiziell mit allen Spezifikationen vorgestellt. Dann werden wir auch mehr zur Verfügbarkeit und dem Preis erfahren. Doch inzwischen ist immerhin schon ein … [+1930 chars],,de,'Preis'
https://www.zeit.de/news/2025-06/10/polizei-entdeckt-waffen-und-drogen-auf-hof-in-oberbayern,https://www.zeit.de/news/2025-06/10/polizei-entdeckt-waffen-und-drogen-auf-hof-in-oberbayern,0,www.zeit.de,Durchsuchung: Polizei entdeckt Waffen und Drogen auf Hof in Oberbayern,Hier finden Sie Informationen zu dem Thema „Durchsuchung“. Lesen Sie jetzt „Polizei entdeckt Waffen und Drogen auf Hof in Oberbayern“.,https://img.zeit.de/news/2025-06/10/polizei-entdeckt-waffen-und-drogen-auf-hof-in-oberbayern-image-group/wide__1300x731,2025-06-10T10:42:44Z,,"Auf einem Hof in Oberbayern haben Polizisten mehrere Schusswaffen und kiloweise Marihuana gefunden. Ins Visier geraten war der mutmaßliche Besitzer, weil er Jugendlichen Drogen verkauft haben soll, w… [+812 chars]",,de,'Waffen'
https://stadt-bremerhaven.de/wow-live-sport-und-premium-heftige-preiserhoehung/,https://stadt-bremerhaven.de/wow-live-sport-und-premium-heftige-preiserhoehung/,0,stadt-bremerhaven.de,WOW Live-Sport und Premium: Heftige Preiserhöhung,"Neulich gab es schon Infos zu Preiserhöhungen von Sky und WOW, nun schickt man den WOW-Sportkunden böse Mails zu. Es wird heftig teurer, wenn man Monats-Zahler ist. Ab dem 24. Juli 2025 wird der monatliche Preis für Kunden mit einem...Zum Beitrag: WOW Live-Sp…",https://stadt-bremerhaven.de/wp-content/uploads/2022/06/Logo-WOW_.jpg,2025-06-10T13:18:41Z,,"Neulich gab es schon Infos zu Preiserhöhungen von Sky und WOW, nun schickt man den WOW-Sportkunden böse Mails zu. Es wird heftig teurer, wenn man Monats-Zahler ist. Ab dem 24. Juli 2025 wird der mona… [+1679 chars]",,de,'Preis'
https://www.tagesschau.de/ausland/europa/ukraine-angriffe-staedte-tote-100.html,https://www.tagesschau.de/ausland/europa/ukraine-angriffe-staedte-tote-100.html,0,www.tagesschau.de,Drei Menschen sterben bei russischen Angriffen auf Kiew und Odessa,Wieder hat Russland Städte in der Ukraine mit Drohnen und Raketen beschossen. Drei Menschen kamen dabei ums Leben - eine Geburtsklinik wurde getroffen. Aber auch in Russland herrschte in der Nacht Drohnenalarm.,https://images.tagesschau.de/image/1bfc94ec-bc37-43d2-bcc2-8e952d30f078/AAABl1oIMQo/AAABkZLhkrw/16x9-1280/angriff-kiew-118.jpg,2025-06-10T14:40:34Z,,"Stand: 10.06.2025 16:40 Uhr
Wieder hat Russland Städte in der Ukraine mit Drohnen und Raketen beschossen. Drei Menschen kamen dabei ums Leben - eine Geburtsklinik wurde getroffen. Aber auch in Russl… [+3686 chars]",,de,'Russland'
https://www.faz.net/aktuell/politik/ausland/veranstaltung-in-moskau-elon-musks-vater-lobt-putin-110528091.html,https://www.faz.net/aktuell/politik/ausland/veranstaltung-in-moskau-elon-musks-vater-lobt-putin-110528091.html,0,www.faz.net,Veranstaltung in Moskau: Elon Musks Vater lobt Putin,"Errol Musk, der Vater des reichsten Mannes der Welt, preist in Moskau Russland, Putin und sich selbst. Kritik an seinen Gastgebern kommt ihm nicht über die Lippen.",https://media1.faz.net/ppmedia/aktuell/gesellschaft/2401220407/1.10528143/facebook_teaser_fplus/russlands-aussenminister.jpg,2025-06-10T17:20:20Z,,"Errol Musk ist Moskaus jüngste Trophäe im Ringen mit dem Westen. Der 79 Jahre alte Südafrikaner ist der Vater des Unternehmers Elon Musk, des reichsten Menschen der Welt und, jedenfalls bis zum jüngs… [+287 chars]",,de,'Russland'
https://www.zeit.de/news/2025-06/10/russland-will-eigenen-messenger-herausbringen,https://www.zeit.de/news/2025-06/10/russland-will-eigenen-messenger-herausbringen,0,www.zeit.de,Meinungsfreiheit in Russland: Russland will eigenen Messenger herausbringen,Hier finden Sie Informationen zu dem Thema „Meinungsfreiheit in Russland“. Lesen Sie jetzt „Russland will eigenen Messenger herausbringen“.,https://img.zeit.de/news/2025-06/10/russland-will-eigenen-messenger-herausbringen-image-group/wide__1300x731,2025-06-10T17:45:25Z,,"Das russische Parlament, die Staatsduma, hat angesichts der anhaltenden Spannungen mit dem Westen ein Gesetz zur Schaffung eines eigenen Messengers verabschiedet. Die Software «gewährt die Möglichkei… [+1631 chars]",,de,'Russland'
https://www.faz.net/aktuell/wirtschaft/arm-und-reich/russlands-kartoffelkrise-der-preisschock-trifft-die-aermere-bevoelkerung-110526268.html,https://www.faz.net/aktuell/wirtschaft/arm-und-reich/russlands-kartoffelkrise-der-preisschock-trifft-die-aermere-bevoelkerung-110526268.html,0,www.faz.net,Inflation in Russland: Putins Kartoffelkrise,"Der Preisschock trifft die ärmere Bevölkerung. Er hat mit einer schlechten Ernte zu tun, aber auch mit dem Krieg gegen die Ukraine. Die wenigsten Russen machen Präsident Putin für die Inflation verantwortlich.",https://media0.faz.net/ppmedia/aktuell/2007770088/1.10526274/facebook_teaser/volle-regale-hohe-preise-eine.jpg,2025-06-10T18:26:41Z,,Wieder einmal herrscht in Russland Empörung über ein teurer gewordenes Lebensmittel: Dieses Mal geht es um die Kartoffel und damit um eine der wichtigsten Zutaten der russischen Alltagsküche. Sie geh… [+7516 chars],,de,'Inflation'
https://www.zeit.de/news/2025-06/11/erneut-angriff-mit-toten-auf-charkiw-gemeldet,https://www.zeit.de/news/2025-06/11/erneut-angriff-mit-toten-auf-charkiw-gemeldet,0,www.zeit.de,Krieg in der Ukraine: Erneut Angriff mit Toten auf Charkiw gemeldet,Hier finden Sie Informationen zu dem Thema „Krieg in der Ukraine“. Lesen Sie jetzt „Erneut Angriff mit Toten auf Charkiw gemeldet“.,https://img.zeit.de/news/2025-06/11/erneut-angriff-mit-toten-auf-charkiw-gemeldet-image-group/wide__1300x731,2025-06-11T00:43:55Z,,Bei einem erneut heftigen russischen Drohnenangriff auf das ostukrainische Charkiw sind Medienberichten zufolge in der Nacht mindestens zwei Menschen getötet und Dutzende weitere verletzt worden. Unt… [+666 chars],,de,'Ukraine'
https://www.faz.net/aktuell/politik/bundestagswahl/liveticker-zur-merz-regierung-spd-politiker-fordern-gespraeche-mit-russland-faz-110093143.html,https://www.faz.net/aktuell/politik/bundestagswahl/liveticker-zur-merz-regierung-spd-politiker-fordern-gespraeche-mit-russland-faz-110093143.html,0,www.faz.net,Liveblog zur Merz-Regierung: Prominente SPD-Politiker fordern Gespräche mit Russland,Mützenich: „Sofortige Kehrtwende in der Außen- und Sicherheitspolitik“ nötig +++ Union kritisiert „Bürgerwehr“ an niederländischer Grenze +++ Innenminister Alexander Dobrindt will Bundespolizei mit Tasern ausrüsten +++ alle Entwicklungen im Liveblog,https://media0.faz.net/ppmedia/aktuell/politik/ukraine/253936135/1.10529560/facebook_teaser/glaubt-dass-gespraeche-mit.jpg,2025-06-11T06:35:09Z,,In der Diskussion um eine mögliche Wiedereinführung der Wehrpflicht drängt die CDU beim Koalitionspartner SPD auf die Umwidmung des geplanten freiwilligen Wehrdienstes in eine Wehrpflicht. Das Thema … [+2071 chars],,de,'Russland'
https://www.zeit.de/news/2025-06/11/russland-handel-verliert-fuer-deutschland-massiv-an-bedeutung,https://www.zeit.de/news/2025-06/11/russland-handel-verliert-fuer-deutschland-massiv-an-bedeutung,0,www.zeit.de,Außenhandel: Russland-Handel verliert für Deutschland massiv an Bedeutung,Hier finden Sie Informationen zu dem Thema „Außenhandel“. Lesen Sie jetzt „Russland-Handel verliert für Deutschland massiv an Bedeutung“.,https://img.zeit.de/news/2025-06/11/russland-handel-verliert-fuer-deutschland-massiv-an-bedeutung-image-group/wide__1300x731,2025-06-11T07:24:56Z,,Russland verliert als Lieferant von Waren für die deutsche Wirtschaft weiter stark an Bedeutung. Wegen des Angriffskriegs auf die Ukraine und der deshalb verhängten Sanktionen brachen die Einfuhren a… [+2358 chars],,de,'Russland'
https://www.morgenpost.de/wirtschaft/article409225458/pelletspreise-heute-aktuell-11-juni-2025-holz-pellets-tonne-heizung.html,https://www.morgenpost.de/wirtschaft/article409225458/pelletspreise-heute-aktuell-11-juni-2025-holz-pellets-tonne-heizung.html,0,www.morgenpost.de,Pelletspreise heute (11. Juni): Der aktuelle Preis pro Tonne,Ab Mittwoch sollen die Temperaturen in Deutschland wieder steigen. Wie wirkt sich das auf den Pelletspreis aus? Ein Überblick.,https://img.sparknews.funkemedien.de/407215592/407215592_1726479333_v16_9_1600.jpeg,2025-06-11T07:38:23Z,,"Berlin. Ab Mittwoch sollen die Temperaturen in Deutschland wieder steigen. Wie wirkt sich das auf den Pelletspreis aus? Ein Überblick.
Ist der Abwärtstrend beim Pelletspreis nun endgültig vorbei? Ha… [+5176 chars]",,de,'Preis'
https://www.sueddeutsche.de/wissen/fluss-waermepumpe-heizen-fliessgewaesser-li.3252649,https://www.sueddeutsche.de/wissen/fluss-waermepumpe-heizen-fliessgewaesser-li.3252649,0,www.sueddeutsche.de,Heizen: Warum gibt es nicht mehr Fluss-Wärmepumpen?,Laut einer Studie könnte man viele Großstädte komplett mit Wärme aus Flüssen heizen. Doch es gibt erst wenige entsprechende Anlagen. Wird da Potenzial verschenkt?,https://www.sueddeutsche.de/2025/06/10/a0042815-6eae-4650-ac3a-dbda4bf63203.jpeg?q=60&fm=webp&width=1200&rect=0%2C209%2C4000%2C2250,2025-06-11T08:00:00Z,,"Für den Mannheimer Versorger MVV ein guter Grund, den Rhein, der am Stadtrand entlangfließt, als Wärmequelle zu nutzen: Das Unternehmen hat schon im Oktober 2023 eine Wärmepumpe installiert, die aus … [+4593 chars]",,de,'heizen'
https://www.focus.de/politik/erneut-schwere-angriffe-kiew-will-oelpreisgrenze-halbieren_e4724e89-9f8d-4d0c-b6e5-a5a4e221b833.html,https://www.focus.de/politik/erneut-schwere-angriffe-kiew-will-oelpreisgrenze-halbieren_e4724e89-9f8d-4d0c-b6e5-a5a4e221b833.html,0,www.focus.de,Erneut schwere Angriffe : Kiew will Ölpreisgrenze halbieren,"Seit Tagen gehen Menschen in Los Angeles auf die Straße, um gegen die harte Abschiebungspolitik des US-Präsidenten zu protestieren. Nun liefert die Ausgangssperre einen Grund für Festnahmen.",https://quadro.burda-forward.de/ctf/6f18a33e-a0ff-415b-a105-4a288173022b.ac582e6f-f8a1-40cc-a925-901d2fb5bd22.png?im=RegionOfInterestCrop%3D%281200%2C630%29%2CregionOfInterest%3D%28749%2C562%29&hash=88b5bb66dcb3b81e6cdbe796fc4c41dd8a155e39559a159cb49cd802edd7294a,2025-06-11T08:22:37Z,,Erneut hat es bei russischen Luftangriffen auf die Ukraine in der Nacht Tote und Dutzende Verletzte gegeben. In der ostukrainischen Stadt Charkiw wurden nach Angaben der regionalen Behörden bei einem… [+3271 chars],,de,'Angriff'
https://www.zeit.de/news/2025-06/11/spd-politiker-fordern-diplomatische-gespraeche-mit-russland,https://www.zeit.de/news/2025-06/11/spd-politiker-fordern-diplomatische-gespraeche-mit-russland,0,www.zeit.de,Außenpolitik: SPD-Politiker fordern diplomatische Gespräche mit Russland,Hier finden Sie Informationen zu dem Thema „Außenpolitik“. Lesen Sie jetzt „SPD-Politiker fordern diplomatische Gespräche mit Russland“.,https://img.zeit.de/news/2025-06/11/spd-politiker-fordern-diplomatische-gespraeche-mit-russland-image-group/wide__1300x731,2025-06-11T08:30:32Z,,"Prominente SPD-Politiker stellen sich gegen die Sicherheits- und Verteidigungspolitik der schwarz-roten Bundesregierung und ihrer eigenen Parteiführung. In einem «Manifest», das der Deutschen Presse-… [+1913 chars]",,de,'Russland'
https://www.sueddeutsche.de/politik/spd-manifest-russland-abruestung-muetzenich-li.3267301,https://www.sueddeutsche.de/politik/spd-manifest-russland-abruestung-muetzenich-li.3267301,0,www.sueddeutsche.de,SPD-Manifest: „Wieder ins Gespräch mit Russland kommen“,Mit deutlichen Worten fordern prominente SPD-Politiker eine Abkehr von der Aufrüstungspolitik und Gespräche mit Moskau. Es ist ein Angriff auf die Linie der Parteiführung um Lars Klingbeil.,https://www.sueddeutsche.de/2025/01/28/b2f5552e-ab97-43ec-b938-1916ce696d8f.jpeg?q=60&fm=webp&width=1200&rect=0%2C61%2C3000%2C1687,2025-06-11T08:31:00Z,,Mit deutlichen Worten fordern prominente SPD-Politiker eine Abkehr von der Aufrüstungspolitik und Gespräche mit Moskau. Es ist ein Angriff auf die Linie der Parteiführung um Lars Klingbeil.Damit glei… [+569 chars],,de,'Angriff'
https://www.tagesspiegel.de/politik/aussenpolitik-spd-politiker-fordern-abrustung-und-gesprache-mit-russland-13833766.html,https://www.tagesspiegel.de/politik/aussenpolitik-spd-politiker-fordern-abrustung-und-gesprache-mit-russland-13833766.html,0,www.tagesspiegel.de,Außenpolitik: SPD-Politiker fordern Abrüstung und Gespräche mit Russland,Ein „Manifest“ sorgt für Unruhe im politischen Berlin: Mehrere SPD-Politiker fordern eine sofortige Kehrtwende in der Außenpolitik – und gehen damit auch ihre Parteispitze offensiv an.,https://www.tagesspiegel.de/images/13834537/alternates/BASE_16_9_W1400/1749637334000/spd-politiker-fordern-abrustung-und-gesprache-mit-russland.jpeg,2025-06-11T08:31:44Z,,Es ist ein Angriff auf die schwarz-rote Bundesregierung und auf die eigene Parteiführung rund um Vizekanzler Lars Klingbeil: Prominente SPD-Politiker fordern in einem Manifest eine Abkehr von der Auf… [+5214 chars],,de,'Angriff'
https://www.stern.de/panorama/angriff-auf-schule--amoklauf-in-graz--alle-verletzten-in-stabilem-zustand-35798362.html,https://www.stern.de/panorama/angriff-auf-schule--amoklauf-in-graz--alle-verletzten-in-stabilem-zustand-35798362.html,0,www.stern.de,Angriff auf Schule: Amoklauf in Graz: Alle Verletzten in stabilem Zustand,Die meisten der Verletzten müssen noch auf Intensivstationen behandelt werden. Nun gibt es auch erste Informationen zu den Todesopfern.,https://image.stern.de/35798992/t/3p/v1/w1440/r1.7778/-/11--na6qurprhdv10axs2048jpeg---29ceeaff1e1c2f52.jpg,2025-06-11T08:32:19Z,,"Kopiere den aktuellen Link
Zur Merkliste hinzufügen
Die meisten der Verletzten müssen noch auf Intensivstationen behandelt werden. Nun gibt es auch erste Informationen zu den Todesopfern.
Nach dem… [+711 chars]",,de,'Angriff'
https://www.tagesspiegel.de/berlin/mann-stirbt-nach-messerattacke-in-berlin-angriff-am-bahnhof-gesundbrunnen--tater-fluchtig-13833868.html,https://www.tagesspiegel.de/berlin/mann-stirbt-nach-messerattacke-in-berlin-angriff-am-bahnhof-gesundbrunnen--tater-fluchtig-13833868.html,0,www.tagesspiegel.de,Mann stirbt nach Messerattacke in Berlin: Angriff am Bahnhof Gesundbrunnen – Täter flüchtig,Ein Streit vorm Bahnhof Gesundbrunnen eskaliert am Dienstagabend. Ein 39-Jähriger wird mit einem Messer am Hals verletzt und stirbt später. Die Mordkommission ermittelt – gibt es einen Clan-Bezug?,https://www.tagesspiegel.de/images/13834957/alternates/BASE_16_9_W1400/1749639701000/berlin-mitte-ot-gesundbrunnen-bahnhof-gesundbrunnen-nordkreuz-01-07-2024-gesundbrunnen-berlin-mitte-ot-gesundbru.jpeg,2025-06-11T08:53:17Z,,"Nach einem Messerangriff am Bahnhof Gesundbrunnen ist ein 39-Jähriger im Krankenhaus seinen Verletzungen erlegen. Wie Berliner Staatsanwaltschaft und Polizei mitteilten, soll das Opfer am Dienstagabe… [+2762 chars]",,de,'Angriff'
https://www.zeit.de/news/2025-06/11/razzia-in-leipzig-waffen-und-fahrraeder-gefunden,https://www.zeit.de/news/2025-06/11/razzia-in-leipzig-waffen-und-fahrraeder-gefunden,0,www.zeit.de,50 Bundespolizisten im Einsatz: Razzia in Leipzig - Waffen und Fahrräder gefunden,Hier finden Sie Informationen zu dem Thema „50 Bundespolizisten im Einsatz“. Lesen Sie jetzt „Razzia in Leipzig - Waffen und Fahrräder gefunden“.,https://img.zeit.de/news/2025-06/11/razzia-in-leipzig-waffen-und-fahrraeder-gefunden-image-group/wide__1300x731,2025-06-11T09:53:35Z,,Die Bundespolizei hat bei Durchsuchungen in Leipzig große Mengen mutmaßlichen Diebesguts sichergestellt. Die Beamten waren am Morgen unter anderem in der Leipziger Comeniusstraße sowie einem Gebäude … [+575 chars],,de,'Waffen'
https://www.diepresse.com/19784368/zwei-tote-und-ueber-50-verletzte-bei-drohnenangriff-auf-charkiw,https://www.diepresse.com/19784368/zwei-tote-und-ueber-50-verletzte-bei-drohnenangriff-auf-charkiw,0,www.diepresse.com,Zwei Tote und über 50 Verletzte bei Drohnenangriff auf Charkiw,"Der Bürgermeister von Charkiw, Ihor Terechow, berichtet von 17 Angriffen auf die Stadt. Der ukrainische Präsident Wolodymyr Selenskij fordert westliche Industrieländer auf, Sanktionen gegen Russlands Ölsektor vorzunehmen.",https://img.diepresse.com/public/incoming/lkrj4g-TOPSHOT-UKRAINE-RUSSIA-CONFLICT-WAR/alternates/DPR_SOCIAL_NACHRICHTEN/TOPSHOT-UKRAINE-RUSSIA-CONFLICT-WAR,2025-06-11T09:55:10Z,,"Der Bürgermeister von Charkiw, Ihor Terechow, berichtet von 17 Angriffen auf die Stadt. Der ukrainische Präsident Wolodymyr Selenskij fordert westliche Industrieländer auf, Sanktionen gegen Russlands… [+6242 chars]",,de,'Angriff'
https://www.telepolis.de/features/Prominente-SPD-Mitglieder-fordern-Kurswechsel-in-der-Sicherheitspolitik-10439910.html,https://www.telepolis.de/features/Prominente-SPD-Mitglieder-fordern-Kurswechsel-in-der-Sicherheitspolitik-10439910.html,0,www.telepolis.de,Prominente SPD-Mitglieder fordern Kurswechsel in der Sicherheitspolitik,In einem Manifest drängen SPD-Friedenskreise auf Gespräche mit Russland und einen Stopp der Stationierung von US-Mittelstreckenraketen. Das Papier könnte für Unruhe in der Ampel-Koalition sorgen.,https://heise.cloudimg.io/bound/1200x1200/q85.png-lossy-85.webp-lossy-85.foil1/_www-heise-de_/imgs/18/4/8/7/3/2/8/7/shutterstock_2528198925-3961463d817ca21f.jpeg,2025-06-11T10:00:00Z,,"Rolf Mützenich zählt zu den Initiatoren des ""Manifests""
(Bild: Juergen Nowak/Shutterstock.com )
In einem Manifest drängen SPD-Friedenskreise auf Gespräche mit Russland und einen Stopp der Stationie… [+4117 chars]",,de,'Angriff'
https://www.telepolis.de/features/SPD-Manifest-Kurskorrektur-fuer-eine-friedliche-Aussenpolitik-gefordert-10439910.html,https://www.telepolis.de/features/SPD-Manifest-Kurskorrektur-fuer-eine-friedliche-Aussenpolitik-gefordert-10439910.html,0,www.telepolis.de,SPD-Manifest: Kurskorrektur für eine friedliche Außenpolitik gefordert,Prominente SPD-Politiker drängen auf Dialog mit Russland und Abrüstung. Das könnte für Spannungen in der Koalition sorgen.,https://heise.cloudimg.io/bound/1200x1200/q85.png-lossy-85.webp-lossy-85.foil1/_www-heise-de_/imgs/18/4/8/7/3/2/8/7/shutterstock_2528198925-3961463d817ca21f.jpeg,2025-06-11T10:00:00Z,,"Rolf Mützenich zählt zu den Initiatoren des ""Manifests""
(Bild: Juergen Nowak/Shutterstock.com )
Prominente SPD-Politiker drängen auf Dialog mit Russland und Abrüstung. Das könnte für Spannungen in … [+4223 chars]",,de,'Russland'
https://www.stern.de/politik/deutschland/aussenpolitik--spd-politiker-fordern-abruestung-und-gespraeche-mit-russland-35798988.html,https://www.stern.de/politik/deutschland/aussenpolitik--spd-politiker-fordern-abruestung-und-gespraeche-mit-russland-35798988.html,0,www.stern.de,Außenpolitik: SPD-Politiker fordern Abrüstung und Gespräche mit Russland,"Ein ""Manifest"" sorgt für Unruhe im politischen Berlin: Mehrere SPD-Politiker fordern eine sofortige Kehrtwende in der Außenpolitik – und gehen damit auch ihre Parteispitze offensiv an.",https://image.stern.de/35799422/t/VZ/v1/w1440/r1.7778/-/11--7asngd4l2bv4axs2048jpeg---047108efa96a1ac9.jpg,2025-06-11T10:21:13Z,,"Kopiere den aktuellen Link
Zur Merkliste hinzufügen
Ein ""Manifest"" sorgt für Unruhe im politischen Berlin: Mehrere SPD-Politiker fordern eine sofortige Kehrtwende in der Außenpolitik und gehen dami… [+5380 chars]",,de,'Russland'
https://www.bild.de/regional/berlin/berlin-mann-stirbt-nach-messer-angriff-an-bahnhof-6849465b5f36f04e93218c4d,https://www.bild.de/regional/berlin/berlin-mann-stirbt-nach-messer-angriff-an-bahnhof-6849465b5f36f04e93218c4d,0,www.bild.de,Mordkommission ermittelt - Mann stirbt nach Messer-Angriff in Berlin,Die Reihe der blutigen Messer-Attacken reißt nicht ab. Am Dienstagabend wurde ein Mann am Bahnhof Berlin-Gesundbrunnen bei einem Streit getötet.,"https://images.bild.de/6849465b5f36f04e93218c4d/3b0041e42e25759e4669d23a96087d03,ed1d9cb6?w=1280",2025-06-11T10:34:48Z,,"Berlin Die Reihe der blutigen Messer-Attacken reißt nicht ab. Am Dienstagabend wurde ein Mann am Bahnhof Berlin-Gesundbrunnen so schwer verletzt, dass er starb! 
Auf dem Vorplatz zum Bahnhof, dem Ha… [+632 chars]",,de,'Angriff'
https://www.morgenpost.de/berlin/article409235180/starke-zunahme-antimuslimischer-angriffe-in-berlin.html,https://www.morgenpost.de/berlin/article409235180/starke-zunahme-antimuslimischer-angriffe-in-berlin.html,0,www.morgenpost.de,Starke Zunahme antimuslimischer Angriffe in Berlin,"Palästina-Konflikt, Migrations-Debatte, Alltags-Rassismus: Verband kritisiert zunehmende Muslimfeindlichkeit in der Stadt.",https://img.sparknews.funkemedien.de/409235759/409235759_1749638985_v16_9_1600.jpeg,2025-06-11T10:49:42Z,,"Berlin. Palästina-Konflikt, Migrations-Debatte, Alltags-Rassismus: Verband kritisiert zunehmende Muslimfeindlichkeit in der Stadt.
Statistisch gesehen ereignen sich zwei muslimfeindliche Taten pro T… [+3646 chars]",,de,'Angriff'
