index,url,valid,domain,title,description,image,published,archive,content,quote,language,keyword
https://www.faz.net/aktuell/politik/ukraine-liveticker-baerbock-kein-nato-beitritt-der-ukraine-mitten-im-krieg-faz-18495964.html,https://www.faz.net/aktuell/politik/ukraine-liveticker-baerbock-kein-nato-beitritt-der-ukraine-mitten-im-krieg-faz-18495964.html,0,www.faz.net,Ukraine-Liveblog: Baerbock: Kein NATO-Beitritt der Ukraine „mitten im Krieg“,Selenskyj zu Europa-Gipfel in Moldau eingetroffen +++ USA setzen Stahlzölle gegen Ukraine weiterhin aus und sagen neue Militärhilfen zu +++ Russland will Kinder aus Grenzregion in Sicherheit bringen +++ alle Entwicklungen im Liveblog,https://media0.faz.net/ppmedia/aktuell/3836671253/1.8933430/facebook_teaser/aussenministerin-annalena.jpg,2023-06-01T08:56:16Z,https://web.archive.org/web/20230601092334/https://www.faz.net/aktuell/politik/ukraine-liveticker-baerbock-kein-nato-beitritt-der-ukraine-mitten-im-krieg-faz-18495964.html,Eine Stellungnahme der UN lag zunächst nicht vor. Sie hatten im Juli zusammen mit der Türkei das Getreideabkommen zwischen den Regierungen in Moskau und Kiew vermittelt. Zwar hat Russland in diesem M… [+483 chars],,de,'Russland'
https://www.bild.de/regional/muenchen/nuernberg-news/prozess-in-muenchen-klima-kleber-stoerten-spiel-des-fc-bayern-84139006.bild.html,https://www.bild.de/regional/muenchen/nuernberg-news/prozess-in-muenchen-klima-kleber-stoerten-spiel-des-fc-bayern-84139006.bild.html,0,www.bild.de,"Bayern-Spiel gestört, jetzt Prozess - Tor-Chaoten wollten angeblich Fußball retten","Drei der Klima-Aktivisten, die im August 2022 das Bayern-Spiel gegen Borussia Mönchengladbach störten, stehen jetzt wegen Hausfriedensbruch vor Gericht.","https://images.bild.de/6478413c930fec6b386acdff/9245d7305c2974dc733b8e3e99ecc19e,a4aab653?w=1280",2023-06-01T11:56:01Z,https://web.archive.org/web/20230601124657/https://www.bild.de/regional/muenchen/nuernberg-news/prozess-in-muenchen-klima-kleber-stoerten-spiel-des-fc-bayern-84139006.bild.html,"München So viel Torgefahr gab es bei Spielen des FC Bayern nicht immer.
Im August des vergangenen Jahres stürmten Klima-Chaoten beim Heimspiel der Bayern gegen Borussia Mönchengladbach den Rasen in … [+2298 chars]",,de,'Klima'
https://www.freitag.de/autoren/svenja-beller/flucht-in-die-klima-nische-was-die-hitze-fuer-ein-drittel-der-menschen-bedeutet,https://www.freitag.de/autoren/svenja-beller/flucht-in-die-klima-nische-was-die-hitze-fuer-ein-drittel-der-menschen-bedeutet,0,www.freitag.de,Kolumne | Flucht in die Klima-Nische: Was die Hitze für ein Drittel der Menschen bedeutet,"Im Jahr 2100 könnte ein Drittel der Menschen weltweit außerhalb so genannter Klimanischen leben, zeigt eine neue Studie im Fachmagazin Nature Sustainability. Hoffentlich haben sie die Hitze-Tips des Norddeutschen Rundfunks gelesen Ich erzähle niemandem etwas …",https://www.freitag.de/autoren/svenja-beller/flucht-in-die-klima-nische-was-die-hitze-fuer-ein-drittel-der-menschen-bedeutet/@@images/social_image,2023-06-01T12:00:00Z,https://web.archive.org/web/20230531233930/https://www.freitag.de/autoren/svenja-beller/flucht-in-die-klima-nische-was-die-hitze-fuer-ein-drittel-der-menschen-bedeutet,"Ich erzähle niemandem etwas Neues, wenn ich sage: Es wird heiß. Und zwar so heiß, dass es mit einem Wassereis nicht getan sein wird, um damit umzugehen. Auch nicht damit, lockere, luftige Kleidung zu… [+2272 chars]",,de,'Klima'
https://www.wiwo.de/politik/deutschland/marktwirtschaftlicher-klimaschutz-so-funktioniert-der-co2-emissionshandel-/29168712.html,https://www.wiwo.de/politik/deutschland/marktwirtschaftlicher-klimaschutz-so-funktioniert-der-co2-emissionshandel-/29168712.html,0,www.wiwo.de,Marktwirtschaftlicher Klimaschutz: So funktioniert der CO2-Emissionshandel,"Ökonomen sind sich einig: Klimaschutz funktioniert am effektivsten mit Emissionshandel. Doch so wie die EU-Kommission den Handel bisher ausgestaltet, bleiben viele Schwachstellen. Wie funktioniert das System – und was lässt sich noch verbessern?",https://www.wiwo.de/images/co2-preis-100-pro-imago-life-2-240557570-highres/29171656/3-format11240.jpg,2023-06-01T12:18:00Z,https://web.archive.org/web/20230601143950/https://www.wiwo.de/politik/deutschland/marktwirtschaftlicher-klimaschutz-so-funktioniert-der-co2-emissionshandel-/29168712.html,"Was sind die Vorgaben der EU-Kommission zum Emissionshandel?
Die EU-Kommission hat im Grunde einen neuen Marktplatz geschaffen. Sie legt fest, wie viele Tonnen Emissionen in die Atmosphäre gelangen … [+9829 chars]",,de,'Klima'
https://www.brigitte.de/aktuell/greta-thunberg--klimaaktivistin-kommt-zum-edinburgh-book-festival-13536576.html,https://www.brigitte.de/aktuell/greta-thunberg--klimaaktivistin-kommt-zum-edinburgh-book-festival-13536576.html,0,www.brigitte.de,Greta Thunberg: Klimaaktivistin kommt zum Edinburgh Book Festival,Nach ihrem Auftritt bei der UN-Klimakonferenz 2021 in Glasgow stattet die Aktivistin im August Schottland einen weiteren Besuch ab.,https://image.brigitte.de/13536578/t/P0/v1/w1440/r1.7778/-/01--klimaaktivistin-kommt-zum-edinburgh-book-festival---1-1---spoton-article-1046023.jpg,2023-06-01T12:55:00Z,https://web.archive.org/web/20230601142251/https://www.brigitte.de/aktuell/greta-thunberg--klimaaktivistin-kommt-zum-edinburgh-book-festival-13536576.html,"Nach ihrem Auftritt bei der UN-Klimakonferenz 2021 in Glasgow stattet die Aktivistin im August Schottland einen weiteren Besuch ab.
Greta Thunberg (20) wird am 13. August 2023 an einem ""Special Even… [+1257 chars]",,de,'Klima'
https://www.stern.de/lifestyle/leute/greta-thunberg--aktivistin-fuer-buchfestival-angekuendigt-33520486.html,https://www.stern.de/lifestyle/leute/greta-thunberg--aktivistin-fuer-buchfestival-angekuendigt-33520486.html,0,www.stern.de,Greta Thunberg: Aktivistin für Buchfestival angekündigt,Nach ihrem Auftritt bei der UN-Klimakonferenz 2021 in Glasgow stattet die Aktivistin im August Schottland einen weiteren Besuch ab.,https://image.stern.de/33520490/t/gz/v1/w1440/r1.7778/-/01--aktivistin-fuer-buchfestival-angekuendigt---16-9---spoton-article-1046023.jpg,2023-06-01T13:05:00Z,https://web.archive.org/web/20230601132607/https://www.stern.de/lifestyle/leute/greta-thunberg--aktivistin-fuer-buchfestival-angekuendigt-33520486.html,"Nach ihrem Auftritt bei der UN-Klimakonferenz 2021 in Glasgow stattet die Aktivistin im August Schottland einen weiteren Besuch ab.
Greta Thunberg (20) wird am 13. August 2023 an einem ""Special Even… [+1257 chars]",,de,'Klima'
https://www.stern.de/panorama/wissen/klima--copernicus--waldbraende-auf-nordhalbkugel-aussergewoehnlich-33521112.html,https://www.stern.de/panorama/wissen/klima--copernicus--waldbraende-auf-nordhalbkugel-aussergewoehnlich-33521112.html,0,www.stern.de,Klima: Copernicus: Waldbrände auf Nordhalbkugel außergewöhnlich,In mehreren Regionen wurden dieses Jahr Rekordemissionen verzeichnet. Besonders betroffen ist Spanien. Aber auch anderen Ländern macht die Trockenheit zu schaffen.,https://image.stern.de/33521114/t/sG/v1/w1440/r1.7778/-/01--urnnewsmldpacom2009010123060199905960v3w800h600l588t417r1868b1270jpeg---86ec2b51cd0d34cb.jpg,2023-06-01T13:10:21Z,https://web.archive.org/web/20230601194921/https://www.stern.de/panorama/wissen/klima--copernicus--waldbraende-auf-nordhalbkugel-aussergewoehnlich-33521112.html,"In mehreren Regionen wurden dieses Jahr Rekordemissionen verzeichnet. Besonders betroffen ist Spanien. Aber auch anderen Ländern macht die Trockenheit zu schaffen.
Die Nordhalbkugel war in diesem Fr… [+1674 chars]",,de,'Klima'
https://www.morgenpost.de/web-wissen/article238558891/Copernicus-Waldbraende-auf-Nordhalbkugel-aussergewoehnlich.html,https://www.morgenpost.de/web-wissen/article238558891/Copernicus-Waldbraende-auf-Nordhalbkugel-aussergewoehnlich.html,0,www.morgenpost.de,Klima: Copernicus: Waldbrände auf Nordhalbkugel außergewöhnlich,In mehreren Regionen wurden dieses Jahr Rekordemissionen verzeichnet. Besonders betroffen ist Spanien. Aber auch anderen Ländern macht die Trockenheit zu schaffen.,https://img.morgenpost.de/img/web-wissen/crop238558889/1572603548-w820-cv16_9-q85/Waldbrand-in-Spanien.jpg,2023-06-01T13:10:21Z,,Reading/Bonn. Die Nordhalbkugel war in diesem Frühjahr außergewöhnlich stark von Waldbränden betroffen. Das teilte der EU-Atmosphärendienst CAMS (Copernicus Atmosphere Monitoring Service) heute mit. … [+1510 chars],,de,'Klima'
https://www.focus.de/klima/interview-hirsch_id_195229517.html,https://www.focus.de/klima/interview-hirsch_id_195229517.html,0,www.focus.de,"Interview mit Psychologin Nadja Hirsch - Expertin erklärt, warum in der Heizdebatte „alles falsch gemacht wurde“","Die ehemalige FDP-Europaabgeordnete Nadja Hirsch ist Diplompsychologin und leitet das Institut für Klimapsychologie in München. Sie rät der Politik dazu, Verhaltensänderungen im Dienste des Klimaschutzes künftig mit mehr Einfühlungsvermögen vorzubereiten.Von …",https://p6.focus.de/img/fotos/id_195236765/imago0244435590h-1-.jpg?im=Crop%3D%280%2C0%2C3463%2C1732%29%3BResize%3D%281200%2C627%29&impolicy=perceptual&quality=mediumHigh&hash=44f5fe22b990304b79d7a6ee2cdf9a07484e334bfe185d25d35f2dc0d9047324,2023-06-01T13:49:54Z,,"Die ehemalige FDP-Europaabgeordnete Nadja Hirsch ist Diplompsychologin und leitet das Institut für Klimapsychologie in München. Sie rät der Politik dazu, Verhaltensänderungen im Dienste des Klimaschu… [+6401 chars]",,de,'heizen'
https://www.diepresse.com/6294794/waehrend-europa-die-zukunft-plant-muessen-wir-die-nerven-bewahren,https://www.diepresse.com/6294794/waehrend-europa-die-zukunft-plant-muessen-wir-die-nerven-bewahren,0,www.diepresse.com,"Während Europa die Zukunft plant, müssen wir die Nerven bewahren [premium]","Es liegt an Türkis-Grün, dafür zu sorgen, dass Österreich nicht als einziges EU-Land vom Stopp des Gastransits durch die Ukraine „überrascht“ wird.",https://media.diepresse.com/social_diepresse_meinung_paid/images/uploads_1200/d/0/a/6294794/4FA83607-DEA4-4FA0-B76F-DC1644EEB064_v0_l.jpg,2023-06-01T15:00:00Z,https://web.archive.org/web/20230601164334/https://www.diepresse.com/6294794/waehrend-europa-die-zukunft-plant-muessen-wir-die-nerven-bewahren,"Es liegt an Türkis-Grün, dafür zu sorgen, dass Österreich nicht als einziges EU-Land vom Stopp des Gastransits durch die Ukraine überrascht wird.
Mit Ambitionen ist es hierzulande so eine Sache: Sin… [+1604 chars]",,de,'Klima'
https://www.stern.de/gesellschaft/regional/mecklenburg-vorpommern/klimastiftung--stiftung-lehnt-ruecktritt-ab--einigung-mit-land-hinfaellig-33520348.html,https://www.stern.de/gesellschaft/regional/mecklenburg-vorpommern/klimastiftung--stiftung-lehnt-ruecktritt-ab--einigung-mit-land-hinfaellig-33520348.html,0,www.stern.de,Klimastiftung: Stiftung lehnt Rücktritt ab: Einigung mit Land hinfällig,"Der Chef der Klimastiftung MV, Sellering, vertritt die Position seit Langem, jetzt hat sich der komplette Vorstand erklärt: Man tritt nicht wie vereinbart zurück. Die von Landtag und Landesregierung angestrebte Auflösung der Stiftung sei nicht rechtskonform m…",https://image.stern.de/33520350/t/-w/v2/w1440/r1.7778/-/01--urnnewsmldpacom2009010123060199904721v3w800h600l1259t153r2539b929jpeg---8b8712ec503bf1be.jpg,2023-06-01T15:15:11Z,https://web.archive.org/web/20230601191944/https://www.stern.de/gesellschaft/regional/mecklenburg-vorpommern/klimastiftung--stiftung-lehnt-ruecktritt-ab--einigung-mit-land-hinfaellig-33520348.html,"Der Chef der Klimastiftung MV, Sellering, vertritt die Position seit Langem, jetzt hat sich der komplette Vorstand erklärt: Man tritt nicht wie vereinbart zurück. Die von Landtag und Landesregierung … [+3208 chars]",,de,'Klima'
https://www.focus.de/finanzen/bereits-ab-2024-das-kommt-auf-mieter-zu-wenn-die-heizungsplaene-umgesetzt-werden_id_195242576.html,https://www.focus.de/finanzen/bereits-ab-2024-das-kommt-auf-mieter-zu-wenn-die-heizungsplaene-umgesetzt-werden_id_195242576.html,0,www.focus.de,"Bereits ab 2024 - Das kommt auf Mieter zu, wenn die Heizungspläne umgesetzt werden","Weg von Gas und Öl, hin zu mehr erneuerbaren Energien. Das ist der Plan des neuen Heizgesetz, dass die Bundesregierung plant. Ab 2024 könnte es für Haushalte wichtige Neuerungen und Änderungen geben. FOCUS online sagt, was sich genau für Mieterinnen und Miete…",https://p6.focus.de/img/fotos/id_195242575/gettyimages-508790050.jpg?im=Crop%3D%280%2C288%2C3464%2C1732%29%3BResize%3D%281200%2C627%29&impolicy=perceptual&quality=mediumHigh&hash=2a4d2eb860fdb6bc83ec1a0c0e0626b826f84f34a12364b082172d0164c8c6e8,2023-06-01T15:17:46Z,https://web.archive.org/web/20230601155145/https://www.focus.de/finanzen/bereits-ab-2024-das-kommt-auf-mieter-zu-wenn-die-heizungsplaene-umgesetzt-werden_id_195242576.html,"Weg von Gas und Öl, hin zu mehr erneuerbaren Energien. Das ist der Plan des neuen Heizgesetz, dass die Bundesregierung plant. Ab 2024 könnte es für Haushalte wichtige Neuerungen und Änderungen geben.… [+5980 chars]",,de,'Gas'
https://praxistipps.chip.de/heizen-mit-klimaanlage-ist-das-sinnvoll-einfach-erklaert_154413,https://praxistipps.chip.de/heizen-mit-klimaanlage-ist-das-sinnvoll-einfach-erklaert_154413,0,praxistipps.chip.de,Heizen mit Klimaanlage: Ist das sinnvoll? Einfach erklärt,"Heizen mit einer Klimaanlage, mag Ihnen paradox vorkommen. Denn wie der Name schon sagt, handelt es sich um ein Gerät, das zum Kühlen gedacht ist. … ... mehr",https://im.contentlounge.net/styles/manual_crop/s3/2022-07/imago_102116971-v1.jpg?im=AspectCrop%3D%281.91%2C1%29%2Cgravity%3DCenter%3BResize%3D%281200%2C630%29%2Caspect%3Dfit%3BBackgroundColor%2Ccolor%3Dffffff&hash=23f01d46e5aba90a54864352828a962301177742392b5c835c88186103085648,2023-06-01T15:42:17Z,,"Heizen mit einer Klimaanlage, mag Ihnen paradox vorkommen. Denn wie der Name schon sagt, handelt es sich um ein Gerät, das zum Kühlen gedacht ist.
Die mit einem Symbol oder farbiger Unterstreichung … [+3780 chars]",,de,'Klima'
https://www.morgenpost.de/wirtschaft/article238561809/Heizungstausch-Zwei-Drittel-fuerchten-Ueberforderung.html,https://www.morgenpost.de/wirtschaft/article238561809/Heizungstausch-Zwei-Drittel-fuerchten-Ueberforderung.html,0,www.morgenpost.de,Umfrage: Heizungstausch: Zwei Drittel fürchten Überforderung,Klimaschonendes Heizen löst bei den Menschen finanzielle Sorgen aus. Entsprechend uneinig sind Bürgerinnen und Bürger auch bei der Frage nach der Zustimmung zu den Heizungsplänen.,https://img.morgenpost.de/img/wirtschaft/crop238561805/940260941-w820-cv16_9-q85/Debatte-um-Heizungstausch.jpg,2023-06-01T16:02:03Z,https://web.archive.org/web/20230601164026/https://www.morgenpost.de/wirtschaft/article238561809/Heizungstausch-Zwei-Drittel-fuerchten-Ueberforderung.html,"Köln. Zwei von drei Menschen in Deutschland sorgen sich, dass die geplanten Maßnahmen zu klimaschonendem Heizen sie finanziell überfordern. 67 Prozent äußerten sich in einer Umfrage von Infratest Dim… [+741 chars]",,de,'Klima'
https://www.stern.de/wirtschaft/news/umfrage--heizungstausch--zwei-drittel-fuerchten-ueberforderung-33521396.html,https://www.stern.de/wirtschaft/news/umfrage--heizungstausch--zwei-drittel-fuerchten-ueberforderung-33521396.html,0,www.stern.de,Umfrage: Heizungstausch: Zwei Drittel fürchten Überforderung,Klimaschonendes Heizen löst bei den Menschen finanzielle Sorgen aus. Entsprechend uneinig sind Bürgerinnen und Bürger auch bei der Frage nach der Zustimmung zu den Heizungsplänen.,https://image.stern.de/33521398/t/M-/v1/w1440/r1.7778/-/01--urnnewsmldpacom2009010123060199908028v3w800h600l1126t553r2406b1346jpeg---52df2a964290657f.jpg,2023-06-01T16:02:03Z,https://web.archive.org/web/20230601214200/https://www.stern.de/wirtschaft/news/umfrage--heizungstausch--zwei-drittel-fuerchten-ueberforderung-33521396.html,"Klimaschonendes Heizen löst bei den Menschen finanzielle Sorgen aus. Entsprechend uneinig sind Bürgerinnen und Bürger auch bei der Frage nach der Zustimmung zu den Heizungsplänen.
Zwei von drei Mens… [+925 chars]",,de,'heizen'
https://www.zeit.de/news/2023-06/01/jugendsinfonieorchester-der-ukraine-kommt-zu-konzert,https://www.zeit.de/news/2023-06/01/jugendsinfonieorchester-der-ukraine-kommt-zu-konzert,0,www.zeit.de,Mainz: Jugendsinfonieorchester der Ukraine kommt zu Konzert,,,2023-06-01T16:06:19Z,,"When browsing with ads:
We collect personal data and also transmit it to third-party providers
 that help us improve and finance our digital content. Some of the information stored on your device, … [+821 chars]",,de,'Ukraine'
https://praxistipps.chip.de/klimaanlage-3-alternativen-zur-abkuehlung_121268,https://praxistipps.chip.de/klimaanlage-3-alternativen-zur-abkuehlung_121268,0,praxistipps.chip.de,Klimaanlage: 3 Alternativen zur Abkühlung,Für eine Klimaanlage gibt es auch Alternativen. Dazu brauchen Sie nicht auf andere Kühlgeräte zurückgreifen. Wir bieten simple Tricks für ein kühles Klima. … ... mehr,https://im.contentlounge.net/styles/manual_crop/s3/2022-07/imago_121454686-v1.jpg?im=AspectCrop%3D%281.91%2C1%29%2Cgravity%3DCenter%3BResize%3D%281200%2C630%29%2Caspect%3Dfit%3BBackgroundColor%2Ccolor%3Dffffff&hash=3dfade6844e7c116fc3fe4b19ab323a20ff6a634fa572170e7b5a82b3fb0f269,2023-06-01T16:07:14Z,,"Für eine Klimaanlage gibt es auch Alternativen. Dazu brauchen Sie nicht auf andere Kühlgeräte zurückgreifen. Wir bieten simple Tricks für ein kühles Klima.
Die mit einem Symbol oder farbiger Unterst… [+3227 chars]",,de,'Klima'
https://www.tagesspiegel.de/klima-podcast-gradmesser-scheitern-die-grunen-an-ihrer-klimapolitik-9905042.html,https://www.tagesspiegel.de/klima-podcast-gradmesser-scheitern-die-grunen-an-ihrer-klimapolitik-9905042.html,0,www.tagesspiegel.de,Klima-Podcast Gradmesser: Scheitern die Grünen an ihrer Klimapolitik?,"Die Bereitschaft zu konkreten Klima-Maßnahmen ist im Sinkflug, Robert Habeck wird immer unbeliebter. Aber im Deutschlandtrend nennen die Befragten Klimaschutz als wichtigstes Thema. Woher diese Diskrepanz kommt, verrät Politikberater Johannes Hillje.",https://www.tagesspiegel.de/images/heizungsgesetz/alternates/BASE_16_9_W1400/heizungsgesetz.jpeg,2023-06-01T16:21:05Z,,"Als drängendstes Thema nennen die Befragten im aktuellen ARD-Deutschlandtrend den Klimaschutz. Die Grünen aber, die sich wie keine andere Partei dem Klimaschutz verschrieben haben, sind im Umfragen-S… [+3868 chars]",,de,'Klima'
https://taz.de/Abstimmung-zum-EU-Lieferkettengesetz/!5934620/,https://taz.de/Abstimmung-zum-EU-Lieferkettengesetz/!5934620/,0,taz.de,Abstimmung zum EU-Lieferkettengesetz: Für mehr Menschenrechte und Klima,EU-Abgeordnete haben den Entwurf zum EU-Lieferkettengesetz verabschiedet. Nun beginnen Verhandlungen mit den Mitgliedstaaten.,https://taz.de/picture/6298516/948/32950495-1.jpeg,2023-06-01T16:48:00Z,,"EU-Abgeordnete haben den Entwurf zum EU-Lieferkettengesetz verabschiedet. Nun beginnen Verhandlungen mit den Mitgliedstaaten.
Unternehmen wie Kik können mit dem EU-Gesetz für ihre Arbeitsbedingungen… [+6320 chars]",,de,'Klima'
https://www.faz.net/aktuell/politik/ukraine-liveticker-nach-fliegeralarm-zwei-angriffswellen-auf-kiew-18495964.html,https://www.faz.net/aktuell/politik/ukraine-liveticker-nach-fliegeralarm-zwei-angriffswellen-auf-kiew-18495964.html,0,www.faz.net,Ukraine-Liveblog: Nach Fliegeralarm zwei Angriffswellen auf Kiew,Regionalregierung: Ukrainische Drohnen nahe russischer Stadt Kursk abgeschossen +++ USA kauft Gepard-Luftabwehrsysteme für die Ukraine +++ Baerbock: Kein NATO-Beitritt der Ukraine „mitten im Krieg“ +++ alle Entwicklungen im Liveblog,https://media1.faz.net/ppmedia/aktuell/politik/382885439/1.8935699/facebook_teaser/die-ukrainische-luftabwehr.jpg,2023-06-01T16:53:15Z,https://web.archive.org/web/20230602020517/https://www.faz.net/aktuell/politik/ukraine-liveticker-nach-fliegeralarm-zwei-angriffswellen-auf-kiew-18495964.html,"Das Schweizer Parlament hat gegen ein Gesetz gestimmt, das Drittstaaten die Weitergabe von in der Schweiz produzierten Rüstungsgütern an die Ukraine erlaubt hätte. Der Nationalrat in Bern votierte am… [+892 chars]",,de,'Ukraine'
https://www.n-tv.de/politik/Habeck-geht-mit-Antworten-auf-FDP-Fragen-in-die-Offensive-article24162648.html,https://www.n-tv.de/politik/Habeck-geht-mit-Antworten-auf-FDP-Fragen-in-die-Offensive-article24162648.html,0,www.n-tv.de,Instrumenten-Mix notwendig: Habeck geht mit Antworten auf FDP-Fragen in die Offensive,"Das Wirtschaftsministerium beantwortet den Fragenkatalog der FDP schriftlich und verteidigt darin die eigenen Ideen zum Heizungsgesetz. Wichtig sei, dass mehrere Instrumente genutzt würden, und dass die Kosten für das Heizen nicht aus dem Ruder liefen.",https://bilder1.n-tv.de/img/incoming/crop24162656/8401322970-cImg_16_9-w1200/402278839.jpg,2023-06-01T20:12:05Z,https://web.archive.org/web/20230601215303/https://www.n-tv.de/politik/Habeck-geht-mit-Antworten-auf-FDP-Fragen-in-die-Offensive-article24162648.html,"Das Wirtschaftsministerium beantwortet den Fragenkatalog der FDP schriftlich und verteidigt darin die eigenen Ideen zum Heizungsgesetz. Wichtig sei, dass mehrere Instrumente genutzt würden, und dass … [+5630 chars]",,de,'Klima'
https://scilogs.spektrum.de/natur-des-glaubens/die-wasserkriege-kommen-nicht-von-den-usa-illuminaten-lob-fuer-den-swr-und-kostenfreies-freimaurer-sciebook/,https://scilogs.spektrum.de/natur-des-glaubens/die-wasserkriege-kommen-nicht-von-den-usa-illuminaten-lob-fuer-den-swr-und-kostenfreies-freimaurer-sciebook/,0,scilogs.spektrum.de,Die Wasserkriege kommen nicht von den USA-Illuminaten – Lob für den SWR und kostenfreies Freimaurer-sciebook,"Noch immer treffe ich auf vor allem progressive und wissenschaftlich Gebildete mit einem viel zu optimistischen Weltbild. Viele glauben immer noch, Menschen bräuchten zur Klimakrise nur ausreichend “dringliche Warnungen” und würden ihr Verhalten schon ändern,…",https://scilogs.spektrum.de/natur-des-glaubens/files/FreimaurerBlumeCover.jpg,2023-06-01T20:25:47Z,https://web.archive.org/web/20230602080356/https://scilogs.spektrum.de/natur-des-glaubens/die-wasserkriege-kommen-nicht-von-den-usa-illuminaten-lob-fuer-den-swr-und-kostenfreies-freimaurer-sciebook/,"Noch immer treffe ich auf vor allem progressive und wissenschaftlich Gebildete mit einem viel zu optimistischen Weltbild. Viele glauben immer noch, Menschen bräuchten zur Klimakrise nur ausreichend “… [+4723 chars]",,de,'Klima'
https://www.focus.de/kultur/kino_tv/tv-kolumne-maybrit-illner-cdu-generalsekretaer-greift-gruene-wegen-heizungsgesetz-an-sie-machen-es-so-schlecht_id_195267529.html,https://www.focus.de/kultur/kino_tv/tv-kolumne-maybrit-illner-cdu-generalsekretaer-greift-gruene-wegen-heizungsgesetz-an-sie-machen-es-so-schlecht_id_195267529.html,0,www.focus.de,TV-Kolumne „Maybrit Illner“ - CDU-Generalsekretär greift Grüne wegen Heizungsgesetz an: „Sie machen es so schlecht!“,"Haben Sie schon ihre alte Heizung herausgerissen und sich eine Wärmepumpe gekauft? Es wird Zeit, denn das umstrittene Gesetz der Ampel wird kommen. Interessant wird es bei „Maybrit Illner“, wenn ein Gast mehr weiß als alle anderen. Obwohl er nur einen Villenb…",https://p6.focus.de/img/fotos/id_195268742/maybrit-illner-am-01.-juni.png?im=Crop%3D%280%2C60%2C1920%2C960%29%3BResize%3D%281200%2C627%29&impolicy=perceptual&quality=mediumHigh&hash=22c478f5af08d7f8a4d204c7c29886ea1539b416d38010464f2e4060b8eb0d2c,2023-06-01T22:23:03Z,https://web.archive.org/web/20230601232549/https://www.focus.de/kultur/kino_tv/tv-kolumne-maybrit-illner-cdu-generalsekretaer-greift-gruene-wegen-heizungsgesetz-an-sie-machen-es-so-schlecht_id_195267529.html,"Haben Sie schon ihre alte Heizung herausgerissen und sich eine Wärmepumpe gekauft? Es wird Zeit, denn das umstrittene Gesetz der Ampel wird kommen. Interessant wird es bei Maybrit Illner, wenn ein Ga… [+4338 chars]",,de,'heizen'
https://www.sueddeutsche.de/medien/luisa-neubauer-lanz-tv-kritik-1.5894329,https://www.sueddeutsche.de/medien/luisa-neubauer-lanz-tv-kritik-1.5894329,0,www.sueddeutsche.de,"Luisa Neubauer bei ""Markus Lanz"": Vernichtung, aber liebevoll",Luisa Neubauer gewinnt bei Markus Lanz im heimlichen Moderieren einer Talkshow. Gegen die Polarisierung der Klima-Debatte kommt sie hier dennoch nicht an.,https://www.sueddeutsche.de/image/sz.1.5895685/1200x675?v=1685667123,2023-06-02T00:52:21Z,https://web.archive.org/web/20230602025134/https://www.sueddeutsche.de/medien/luisa-neubauer-lanz-tv-kritik-1.5894329,"Luisa Neubauer gewinnt bei Markus Lanz im heimlichen Moderieren einer Talkshow. Gegen die Polarisierung der Klima-Debatte kommt sie hier dennoch nicht an. Luisa Neubauer hat eine gute Art, damit umzu… [+557 chars]",,de,'Klima'
https://www.handelsblatt.com/unternehmen/energie/sanieren-wie-vorgehen-beim-heizungstausch-drei-typische-beispiele/29164470.html,https://www.handelsblatt.com/unternehmen/energie/sanieren-wie-vorgehen-beim-heizungstausch-drei-typische-beispiele/29164470.html,0,www.handelsblatt.com,Sanieren: Wie vorgehen beim Heizungstausch? Drei typische Beispiele,Lohnt sich die Sanierung im 70er-Jahre-Bau? Kann eine Wärmepumpe ein 100 Jahre altes Haus heizen? Ist eine Gasheizung auch im Neubau noch eine Option? Tipps zu realen Fällen.,https://www.handelsblatt.com/images/inspektion-im-heizungskeller/29167702/3-format2003.jpg,2023-06-02T02:00:00Z,https://web.archive.org/web/20230602032420/https://www.handelsblatt.com/unternehmen/energie/sanieren-wie-vorgehen-beim-heizungstausch-drei-typische-beispiele/29164470.html,"Inspektion im HeizungskellerDer Tausch einer Heizung ist häufig eine komplexe Entscheidung.
(Foto: dpa)
Düsseldorf Wenn Thomas Rebel über die Wärmewende spricht, dann geht es um konkrete Häuser und… [+1123 chars]",,de,'Klima'
