index,url,valid,domain,title,description,image,published,archive,content,quote,language,keyword
https://www.politico.eu/podcast/berlin-playbook-podcast/security-update-strase-von-hormus-offnung-aber-kein-ende-in-sicht/,https://www.politico.eu/podcast/berlin-playbook-podcast/security-update-strase-von-hormus-offnung-aber-kein-ende-in-sicht/,0,www.politico.eu,"Security-Update: Straße von Hormus – Öffnung, aber kein Ende in Sicht",Präsentiert von Vodafone Business.,"https://www.politico.eu/cdn-cgi/image/width=1200,height=630,fit=crop,quality=80,onerror=redirect/wp-content/uploads/2026/02/17/Berlin-Playbook-podca-1920x1080-px-Max-Quality.jpg",2026-06-16T15:32:58Z,,"Nach fast vier Monaten Blockade der Straße von Hormus gibt es Bewegung am Persischen Golf: Donald Trump drängt auf ein Abkommen mit dem Iran. Doch was wie ein diplomatischer Durchbruch klingt, könnte… [+1817 chars]",,de,'Hormus'
https://www.zeit.de/politik/2026-06/g7-gipfel-evian-donald-trump-ukraine-nachrichtenpodcast,https://www.zeit.de/politik/2026-06/g7-gipfel-evian-donald-trump-ukraine-nachrichtenpodcast,0,www.zeit.de,G7-Gipfel: Folgt auf den Iran eine Lösung für den Ukrainekrieg?,Nach einem möglichen Iran-Abkommen wollen sich die G7-Staaten nun auf mehr Hilfe für die Ukraine einigen. Außerdem: Neues Zentrum für die Abwehr hybrider Gefahren.,https://img.zeit.de/politik/ausland/2026-06/g7-gipfel-evian-donald-trump-ukraine-nachrichtenpodcast-bild/wide__1300x731,2026-06-16T15:42:09Z,,Die Staats- und Regierungschefs der G7 sind im französischen Évian zu einem Gipfeltreffen zusammengekommen. Im Mittelpunkt des Treffens stehen die Kriege in der Ukraine und im Nahen Osten. Die kurz v… [+2717 chars],,de,'Hormus'
https://www.focus.de/finanzen/usa-benutzen-irans-taktik-und-schmuggeln-90-millionen-barrel-oel-durch-strasse-von-hormus_2dd7b778-4148-4dcb-b16c-4236484da8cd.html,https://www.focus.de/finanzen/usa-benutzen-irans-taktik-und-schmuggeln-90-millionen-barrel-oel-durch-strasse-von-hormus_2dd7b778-4148-4dcb-b16c-4236484da8cd.html,0,www.focus.de,USA benutzen Irans Taktik und schmuggeln 90 Millionen Barrel Öl durch Straße von Hormus,Die Straße von Hormus könnte sich bald wieder öffnen. Trotz der Sperre sind Millionen Barrel Öl durch die Meerenge gelangt.,"https://quadro.burda-forward.de/ctf/2ef31fae-7622-493e-b489-fe9e4c8e823d.73ed484e-0fe1-4e50-9a3f-c4ce0a1ffcd0.jpg?im=RegionOfInterestCrop=(1200,630),regionOfInterest=(1117,565)&hash=1bdf30db2270857cb0dc3cfbfc450cb8889e4bb243c1e78825a495b50754f566",2026-06-16T15:43:00Z,,"Medienberichten zufolge hat das US-Militär zahlreiche geheime Ölumladungen von Schiff zu Schiff überwacht, um den Energieexport aus dem Persischen Golf aufrechtzuerhalten. Offenbar nutzen die USA dab… [+3477 chars]",,de,'Iran'
https://www.faz.net/aktuell/feuilleton/medien-und-film/kino/film-killhouse-drohnenaction-aus-der-ukraine-200932031.html,https://www.faz.net/aktuell/feuilleton/medien-und-film/kino/film-killhouse-drohnenaction-aus-der-ukraine-200932031.html,0,www.faz.net,Film „KillHouse“: Drohnenaction aus der Ukraine,Der Actionthriller „Killhouse“ des Regisseurs Lyubomyr Levytsky bringt den Krieg in der Ukraine in beeindruckender Hollywood-Ästhetik auf die Leinwand – ein Großteil des Ensembles sind echte Soldaten und Veteranen.,https://media0.faz.net/image/w1200h627/07794c387388/w1755h916x403y35o/202606/43601.0.2219920728/hier-spielen-echte-soldaten.webp,2026-06-16T16:09:05Z,,"Oft klingen die Plots von Actionthrillern so, als könnten sie nur der wilden Phantasie eines Hollywood-Regisseurs entsprungen sein. Etwa, dass eine kleine Drohne, die mit einem handgeschriebenen Papi… [+285 chars]",,de,'Ukraine'
https://www.stern.de/news/g7-erhoehen-sanktionsdruck-auf-russland---trump-fordert-putin-zu-abkommen-auf-37552158.html,https://www.stern.de/news/g7-erhoehen-sanktionsdruck-auf-russland---trump-fordert-putin-zu-abkommen-auf-37552158.html,0,www.stern.de,G7 erhöhen Sanktionsdruck auf Russland - Trump fordert Putin zu Abkommen auf,Im Bemühen um ein Ende des Ukraine-Kriegs haben die G7-Staaten bei ihrem Gipfel in Frankreich den Druck auf Russland verstärkt und verschärfte Sanktionen angekündigt. Nach monatelanger Beschäftigung mit dem Iran-Krieg zeigte sich auch US-Präsident Donald Trum…,https://image.stern.de/37554076/t/dU/v1/w1440/r1.7778/-/16--trump-macron-und-selenskyj-beim-g7gipfel---71a36c8577a13678.jpg,2026-06-16T16:09:27Z,,"Kopiere den aktuellen Link
Zur Merkliste hinzufügen
Im Bemühen um ein Ende des Ukraine-Kriegs haben die G7-Staaten bei ihrem Gipfel in Frankreich den Druck auf Russland verstärkt und verschärfte Sa… [+4056 chars]",,de,'Russland'
https://www.faz.net/aktuell/wirtschaft/mehr-wirtschaft/strasse-von-hormus-noch-vertrauen-die-reeder-dem-frieden-nicht-200935376.html,https://www.faz.net/aktuell/wirtschaft/mehr-wirtschaft/strasse-von-hormus-noch-vertrauen-die-reeder-dem-frieden-nicht-200935376.html,0,www.faz.net,Straße von Hormus: Noch vertrauen die Reeder dem Frieden nicht,"„Starten Sie Ihre Motoren“, ruft Donald Trump den Kapitänen der gestrandeten Schiffe vor dem Friedensabkommen zu. Doch bis auf ein paar Wagemutige bleiben die Reeder vorsichtig.",https://media0.faz.net/image/w1200h627/b276ed0f9a35/w6000h3135x0y433o/202606/43601.0.2219859305/containerschiff-vor-der.webp,2026-06-16T16:22:13Z,,"Nach der Ankündigung, dass die USA und Iran ein Friedensabkommen erreicht hätten, dauerte es nur ein paar Stunden, dann machte sich die Disha auf den Weg durch die gefährlichste Meerenge der Welt. De… [+5829 chars]",,de,'Hormus'
https://www.faz.net/aktuell/politik/ausland/iran-krieg-wie-ist-die-lage-in-der-strasse-von-hormus-200934364.html,https://www.faz.net/aktuell/politik/ausland/iran-krieg-wie-ist-die-lage-in-der-strasse-von-hormus-200934364.html,0,www.faz.net,"Straße von Hormus: Wer weiß eigentlich, wo die Minen liegen?","Donald Trump will die Meerenge vollständig öffnen. Aber die Gefahr von Seeminen bleibt – und die amerikanischen Fähigkeiten, diese zu räumen, sind begrenzt.",https://media0.faz.net/image/w1200h627/2eea9990c281/w5500h2873x0y474o/202606/43601.0.2220933140/schiffe-in-der-strasse-von.webp,2026-06-16T16:23:44Z,,"Nach dem Willen von Donald Trump soll die Straße von Hormus von Freitag an wieder vollständig befahrbar sein. Man sei gerade dabei, ein paar Minen zu jagen, die bereits entdeckt worden seien, erklärt… [+3884 chars]",,de,'Hormus'
https://www.zeit.de/news/2026-06/16/ukrainischer-kampfjet-abgestuerzt-piloten-tot,https://www.zeit.de/news/2026-06/16/ukrainischer-kampfjet-abgestuerzt-piloten-tot,0,www.zeit.de,Russischer Angriffskrieg: Ukrainischer Kampfjet abgestürzt - Piloten tot,Hier finden Sie Informationen zu dem Thema „Russischer Angriffskrieg“. Lesen Sie jetzt „Ukrainischer Kampfjet abgestürzt - Piloten tot“.,https://img.zeit.de/news/2026-06/16/ukrainischer-kampfjet-abgestuerzt-piloten-tot-image-group/wide__1300x731,2026-06-16T19:14:09Z,,Beim Absturz eines ukrainischen Kampfflugzeugs vom Typ Su-24 sind nach offiziellen Angaben beide Piloten ums Leben gekommen. Der Absturz habe sich am Abend in der Region Chmelnyzkyj im Westen des Lan… [+536 chars],,de,'Angriff'
https://www.zeit.de/politik/ausland/2026-06/russland-kriegsschiff-warnschuesse-jacht-aermelkanal,https://www.zeit.de/politik/ausland/2026-06/russland-kriegsschiff-warnschuesse-jacht-aermelkanal,0,www.zeit.de,Russland: Russische Fregatte gibt im Ärmelkanal Warnschüsse ab,Im Nebel ist eine britische Jacht nahe an ein russisches Kriegsschiff geraten. Dessen Reaktion sollte laut Russland und Großbritannien eine Kollision verhindern.,https://img.zeit.de/politik/ausland/2026-06/russische-fregatte-aermelkanal-bild/wide__1300x731,2026-06-16T22:06:48Z,,"Ein russisches Kriegsschiff hat im Ärmelkanal Warnschüsse in
Richtung einer unter britischer Flagge fahrenden Jacht abgegeben. Damit sollte ein
Zusammenstoß der beiden Schiffe verhindert werden, te… [+3467 chars]",,de,'Russland'
https://www.zeit.de/news/2026-06/17/g7-staaten-kuendigen-neue-sanktionen-gegen-russland-an,https://www.zeit.de/news/2026-06/17/g7-staaten-kuendigen-neue-sanktionen-gegen-russland-an,0,www.zeit.de,Spitzentreffen in Évian: G7-Staaten kündigen neue Sanktionen gegen Russland an,Hier finden Sie Informationen zu dem Thema „Spitzentreffen in Évian“. Lesen Sie jetzt „G7-Staaten kündigen neue Sanktionen gegen Russland an“.,https://img.zeit.de/news/2026-06/17/g7-staaten-kuendigen-neue-sanktionen-gegen-russland-an-image-group/wide__1300x731,2026-06-16T23:22:34Z,,Die USA und die anderen G7-Staaten wollen mit zusätzlichem Druck auf Russland die Bemühungen um ein Ende des Ukraine-Krieges intensivieren. In einer Erklärung der Staats- und Regierungschefs vom Gipf… [+1718 chars],,de,'Hormus'
https://www.faz.net/aktuell/politik/ukraine/ukraine-liveticker-g7-wollen-mit-neuen-sanktionen-druck-auf-russland-erhoehen-faz-110683325.html,https://www.faz.net/aktuell/politik/ukraine/ukraine-liveticker-g7-wollen-mit-neuen-sanktionen-druck-auf-russland-erhoehen-faz-110683325.html,0,www.faz.net,Liveblog Ukrainekrieg: G7 wollen mit neuen Sanktionen Druck auf Russland erhöhen,Erklärung der Staats- und Regierungschefs vom G-7-Gipfel in Évian +++ Russische Fregatte feuert Warnschüsse auf Yacht im Ärmelkanal +++ Kreml dementiert Pläne für Treffen mit Selenskyj +++ alle Neuigkeiten im Liveblog,https://media0.faz.net/image/w1200h627/e8277b5b8565/w6000h3135x0y390o/202606/43601.0.2226540061/g-7-gipfel-in-vian.webp,2026-06-17T01:39:00Z,,Vor dem Hintergrund der geopolitischen Umbrüche stärkt Südostasien seine Kontakte zu Russland. Präsident Wladimir Putin empfängt am Mittwoch und Donnerstag die Staats- und Regierungschefs der südosta… [+1773 chars],,de,'Ukraine'
https://www.golem.de/sonstiges/zustimmung/auswahl.html?from=https://www.golem.de/news/gewinnwarnung-bmw-geraet-in-die-krise-2606-209847.html&referer=https://t.co/9eb0c01452,https://www.golem.de/sonstiges/zustimmung/auswahl.html?from=https://www.golem.de/news/gewinnwarnung-bmw-geraet-in-die-krise-2606-209847.html&referer=https://t.co/9eb0c01452,0,www.golem.de,Gewinnwarnung: BMW gerät in die Krise,"BMW streicht seine Jahresziele, der neue Chef geht in den Krisenmodus. (BMW, Wirtschaft)",,2026-06-17T05:17:02Z,,"Besuchen Sie Golem.de wie gewohnt mit Werbung und Tracking,
 indem Sie der Nutzung aller Cookies zustimmen.
 Details zum Tracking finden Sie im Privacy Center.
Skript wurde nicht geladen. Informat… [+607 chars]",,de,'Krise'
https://www.bild.de/leben-wissen/wissenschaft/forscher-wollen-schmelzende-arktis-wieder-zufrieren-6a32456aa7834e0047eec5d4,https://www.bild.de/leben-wissen/wissenschaft/forscher-wollen-schmelzende-arktis-wieder-zufrieren-6a32456aa7834e0047eec5d4,0,www.bild.de,Erste Erfolge - Forscher wollen schmelzende Arktis wieder zufrieren,"Forscher testen in der Arktis Meerwasser-Pumpen, um das Eis zu stärken. Sie feiern bereits erste Erfolge.","https://images.bild.de/6a32456aa7834e0047eec5d4/4a9485a9413a9bd214e8d22bd8f316dc,44a655?w=1280",2026-06-17T08:01:16Z,,TTS-Player überspringenArtikel weiterlesenNoch vor einem Jahr wäre das für Andrea Ceccolini kaum vorstellbar gewesen. Heute steht er auf dem arktischen Meereis bei Cambridge Bay in Kanada und zeigt a… [+2210 chars],,de,'frieren'
https://www.zeit.de/mobilitaet/2026-06/elektroauto-ukraine-energieversorgung-autonomie-krieg,https://www.zeit.de/mobilitaet/2026-06/elektroauto-ukraine-energieversorgung-autonomie-krieg,0,www.zeit.de,Elektroauto in der Ukraine: Autark durch den Krieg,"Ausgerechnet in der Ukraine boomen Elektroautos – trotz der Angriffe auf die Energieversorgung. Reichweitenängste stören offenbar wenig, es zählen andere Qualitäten.",https://img.zeit.de/mobilitaet/2026-06/elektroauto-ukraine-energieversorgung-autonomie-krieg-bild/wide__1300x731,2026-06-17T08:01:42Z,,"Schließen
Artikelzusammenfassung
Elektroautos boomen in der Ukraine trotz Kriegszustand, zeigt eine Analyse von Transport &amp; Environment. Seit Beginn der russischen Invasion hat sich die Zahl de… [+736 chars]",,de,'Angriff'
https://www.diepresse.com/30855752/macht-keinen-sinn-trumps-iran-deal-sorgt-fuer-entsetzen-in-den-eigenen,https://www.diepresse.com/30855752/macht-keinen-sinn-trumps-iran-deal-sorgt-fuer-entsetzen-in-den-eigenen,0,www.diepresse.com,„Macht keinen Sinn“: Trumps Iran-Deal sorgt für Entsetzen in den eigenen Reihen [premium],"Das Abkommen soll Teheran uneingeschränkte Ölexporte erlauben und den Transfer blockierter Gelder in Aussicht stellen. Der Iran bekomme „keinen Cent, wenn er sich nicht benimmt“, sagt die US-Regierung.",https://img.diepresse.com/public/incoming/z6bi2k-israel-palestinianstrump-hezbollah/alternates/WEBP_WIDE_1200/ISRAEL-PALESTINIANSTRUMP-HEZBOLLAH,2026-06-17T08:22:54Z,,"US-Präsident Donald Trump läuft Gefahr, mit seiner Iran-Strategie weite Teile seiner eigenen Partei zu verärgern. Zunächst sprachen sich einflussreiche Konservative wie Podcaster Joe Rogan oder Starm… [+4623 chars]",,de,'Iran'
https://www.zeit.de/news/2026-06/17/krise-am-neubau-deutschland-baut-an-der-falschen-stelle,https://www.zeit.de/news/2026-06/17/krise-am-neubau-deutschland-baut-an-der-falschen-stelle,0,www.zeit.de,Immobilien: Krise am Neubau: Deutschland baut an der falschen Stelle,Hier finden Sie Informationen zu dem Thema „Immobilien“. Lesen Sie jetzt „Krise am Neubau: Deutschland baut an der falschen Stelle“.,https://img.zeit.de/news/2026-06/17/krise-am-neubau-deutschland-baut-an-der-falschen-stelle-image-group/wide__1300x731,2026-06-17T09:17:36Z,,"Der Wohnungsbau in Deutschland bleibt auch 2026 schwach - und zu viele Wohnungen entstehen dort, wo sie wenig gebraucht werden. Das geht aus einer Analyse des Immobilienspezialisten Jones Lang LaSall… [+2005 chars]",,de,'Krise'
https://www.zeit.de/politik/ausland/2026-06/iran-abkommen-sanktionen-investitionen-usa,https://www.zeit.de/politik/ausland/2026-06/iran-abkommen-sanktionen-investitionen-usa,0,www.zeit.de,Irankrieg: Iran-Abkommen enthält Milliarden-Investitionen und Ende von Sanktionen,Eine durchgesickerte Kopie der Iran-USA-Vereinbarung enthält weitgehende US-Zugeständnisse an das Regime in Teheran. Der Text lässt allerdings viele Fragen offen.,https://img.zeit.de/politik/ausland/2026-06/iran-abkommen-sanktionen-investitionen-usa-foto-1/wide__1300x731,2026-06-17T11:11:01Z,,"Das Rahmenabkommen zwischen dem Iran und den USA, das am Freitag in der Schweiz unterzeichnet werden soll, sieht offenbar eine Reihe weitgehender Zugeständnisse der USA an das Regime in Teheran vor. … [+4092 chars]",,de,'Atomkraft'
https://www.faz.net/aktuell/politik/ausland/tusk-alle-hinweise-deuten-auf-politischen-mord-in-polen-accg-200939531.html,https://www.faz.net/aktuell/politik/ausland/tusk-alle-hinweise-deuten-auf-politischen-mord-in-polen-accg-200939531.html,0,www.faz.net,Getöteter Künstler: Tusk: Alle Hinweise deuten auf „politischen Mord“,"Nachdem ein russischer Künstler in Polen erschossen wurde, spricht Polens Ministerpräsident von einem politisch motivierten Verbrechen. Steckt Russland dahinter?",https://media0.faz.net/image/w1200h627/ab5596f170b4/w4000h2090x0y475o/202606/43601.0.2225222853/blick-auf-den-tatort-in-biala.webp,2026-06-17T11:42:29Z,,"Laut dem polnischen Ministerpräsidenten Donald Tusk deutet alles darauf hin, dass der am Montag in Polen erschossene Künstler einem politischen Mord zum Opfer gefallen ist. Allerdings müsse man weite… [+1025 chars]",,de,'Russland'
https://www.zeit.de/2026/27/strasse-von-hormus-schifffahrt-iran-minen,https://www.zeit.de/2026/27/strasse-von-hormus-schifffahrt-iran-minen,0,www.zeit.de,Straße von Hormus: Dauerhaft kaputt,Die Welt hofft auf einen Durchbruch und die Öffnung der Straße von Hormus. Doch einen Weg zurück zur alten Normalität gibt es nicht mehr.,https://img.zeit.de/2026/27/dauerhaft-kaputt-bild-3/wide__1300x731,2026-06-17T12:38:56Z,,"Es gibt Dinge, die kann man nicht reparieren, wenn sie kaputtgehen. Ökonomen haben dafür einen Fachbegriff, sie sprechen von Hysterese, wenn eine Volkswirtschaft nach einem Schock nicht mehr in ihre … [+1087 chars]",,de,'Hormus'
https://www.faz.net/aktuell/politik/ausland/nicolas-vaujournicolas-vaujour-der-admiral-fuer-die-strasse-von-hormus-200937294.html,https://www.faz.net/aktuell/politik/ausland/nicolas-vaujournicolas-vaujour-der-admiral-fuer-die-strasse-von-hormus-200937294.html,0,www.faz.net,Französische Marine: Der Admiral für die Straße von Hormus,"Der Generalstabschef der französischen Marine will Stärke demonstrieren.  Dafür lässt er Videos veröffentlichen, die Einsätze gegen Tanker der russischen Schattenflotte zeigen.",https://media0.faz.net/image/w1200h627/a94e81818016/w5140h2685x0y387o/202605/43601.0.2099992320/er-plant-den-einsatz-der.webp,2026-06-17T13:11:27Z,,So viel Aufmerksamkeit hat die französische Marine selten erhalten. Admiral Nicolas Vaujour leitet als Generalstabschef der Marine die Planungen für die internationale Militärkoalition in der Straße … [+2584 chars],,de,'Hormus'
https://www.faz.net/aktuell/rhein-main/wirtschaft/frankfurt-workshop-so-geht-geld-fuer-schueler-200931981.html,https://www.faz.net/aktuell/rhein-main/wirtschaft/frankfurt-workshop-so-geht-geld-fuer-schueler-200931981.html,0,www.faz.net,Finanzbildung für Schüler: So geht Geld,"In den Türmen der Deutschen Bank lernen Frankfurter Schüler, was Inflation, ETF und Konsumschulden bedeuten, und bekommen nebenbei vermittelt, warum private Kapitalbildung im künftigen Rentensystem eine Schlüsselrolle spielen soll.",https://media0.faz.net/image/w1200h627/2a2658de311a/w8158h4262x0y358o/202606/43601.0.2220446345/so-geht-geld-der-deutsche-bank.webp,2026-06-17T14:49:47Z,,"Wenn Neunt- bis Zwölftklässler in den Frankfurter Zwillingstürmen der Deutschen Bank über Geld sprechen, geht es längst nicht nur um Taschengeld. Der Workshop So geht Geld macht sichtbar, wie stark s… [+6473 chars]",,de,'Inflation'
https://www.tagesschau.de/ausland/europa/merz-evian-g7-interview-100.html,https://www.tagesschau.de/ausland/europa/merz-evian-g7-interview-100.html,0,www.tagesschau.de,Merz wertet Ergebnisse des G7-Gipfels als Erfolg,Nach dem G7-Gipfel hat Bundeskanzler Merz im <em>ARD-Interview</em> eine positive Bilanz gezogen. Auf die Entwicklung in der Straße von Hormus blickt er zuversichtlich. Und für Präsident Trump hatte er viel Lob übrig.,https://images.tagesschau.de/image/0d4d4400-c2b5-4443-918c-bb2e0a7ad63d/AAABntZKapM/AAABnSSvrFg/16x9-big/merz-preiss-100.jpg?width=1280,2026-06-17T16:00:28Z,,"Stand: 17.06.2026 18:00 Uhr
Nach dem G7-Gipfel hat Bundeskanzler Merz im ARD-Interview eine positive Bilanz gezogen. Auf die Entwicklung in der Straße von Hormus blickt er zuversichtlich. Und für Pr… [+3076 chars]",,de,'Hormus'
https://www.zeit.de/wirtschaft/2026-06/gewinneinbruch-bmw-absatz-china-autoindustrie,https://www.zeit.de/wirtschaft/2026-06/gewinneinbruch-bmw-absatz-china-autoindustrie,0,www.zeit.de,Gewinneinbruch bei BMW: Wenn selbst der Leistungsträger zurückfällt,"Selbst bei BMW bricht der Gewinn weg, das zeigt wie existenziell die Krise der Industrie ist. Und wie bedrohlich der Druck aus China geworden ist.",https://img.zeit.de/wirtschaft/2026-06/gewinneinbruch-bmw-absatz-china-autoindustrie-bild/wide__1300x731,2026-06-17T16:34:44Z,,"Schließen
Artikelzusammenfassung
BMW senkt die Gewinnprognose drastisch, was auf eine existenzielle Krise der deutschen Industrie hinweist. Trotz bisheriger Erfolge steht auch der Leistungsträger B… [+665 chars]",,de,'Krise'
https://www.faz.net/aktuell/wirtschaft/leitzins-unveraendert-neuer-fed-chef-kevin-warsh-startet-als-falke-200941093.html,https://www.faz.net/aktuell/wirtschaft/leitzins-unveraendert-neuer-fed-chef-kevin-warsh-startet-als-falke-200941093.html,0,www.faz.net,US-Notenbank: Kevin Warsh liefert erste Überaschungen,Der neue Fed-Chef startet als Falke: Die US-Notenbank stellt den Kampf gegen die Inflation über Zinssenkungen. Zugleich kündigt Kevin Warsh grundlegende Reformen an.,https://media0.faz.net/image/w1200h627/b8f767b32432/w5568h2909x0y111o/202606/43601.0.2230287079/der-neue-fed-chef-kevin-warsh.webp,2026-06-17T20:07:07Z,,"Die erste geldpolitische Pressemitteilung der amerikanischen Notenbank Federal Reserve unter ihrem neuen Chef Kevin Warsh fällt durch ihre  außergewöhnliche Kürze auf. Für die Botschaft, dass man die… [+3060 chars]",,de,'Inflation'
https://www.zeit.de/news/2026-06/18/iran-rahmenabkommen-digital-von-beiden-seiten-unterzeichnet,https://www.zeit.de/news/2026-06/18/iran-rahmenabkommen-digital-von-beiden-seiten-unterzeichnet,0,www.zeit.de,Iran-Krieg: Iran: Rahmenabkommen digital von beiden Seiten unterzeichnet,Hier finden Sie Informationen zu dem Thema „Iran-Krieg“. Lesen Sie jetzt „Iran: Rahmenabkommen digital von beiden Seiten unterzeichnet“.,https://img.zeit.de/news/2026-06/18/iran-rahmenabkommen-digital-von-beiden-seiten-unterzeichnet-image-group/wide__1300x731,2026-06-17T22:34:43Z,,Das Rahmenabkommen zwischen den USA und dem Iran zur Beendigung des Kriegs ist nach Angaben aus Teheran von den Präsidenten beider Länder digital unterzeichnet worden. Das sagte der Sprecher des iran… [+1686 chars],,de,'Iran'
https://www.faz.net/aktuell/politik/ausland/liveblog-irankrieg-rahmenabkommen-ist-digital-unterzeichnet-und-in-kraft-faz-200583539.html,https://www.faz.net/aktuell/politik/ausland/liveblog-irankrieg-rahmenabkommen-ist-digital-unterzeichnet-und-in-kraft-faz-200583539.html,0,www.faz.net,Liveblog Irankrieg: Bestätigung aus Iran und USA: Rahmenabkommen ist digital unterzeichnet und in Kraft,Iran sagt Gebührenfreiheit für Straße von Hormus nur für 60 Tage zu +++ US-Medien veröffentlichen offiziellen Text des Memorandums +++ Trump bedankt sich bei China und Russland: „Sehr neutral“ geblieben +++ alle Entwicklungen im Liveblog,https://media0.faz.net/image/w1200h627/648beebc1912/w6000h3135x0y401o/202606/43601.0.2224716403/tanker-und-frachtschiffe-im.webp,2026-06-17T22:50:16Z,,"Amerikanische Medien haben unter Berufung auf einen ranghohen Regierungsmitarbeiter den offiziellen Text des Memorandums veröffentlicht, das Teheran und Washington am Montag elektronisch unterzeichne… [+1200 chars]",,de,'Hormus'
https://www.zeit.de/news/2026-06/18/vermittler-pakistan-abkommen-usa-iran-tritt-sofort-in-kraft,https://www.zeit.de/news/2026-06/18/vermittler-pakistan-abkommen-usa-iran-tritt-sofort-in-kraft,0,www.zeit.de,Krieg: Vermittler Pakistan: Abkommen USA-Iran tritt sofort in Kraft,Hier finden Sie Informationen zu dem Thema „Krieg“. Lesen Sie jetzt „Vermittler Pakistan: Abkommen USA-Iran tritt sofort in Kraft“.,https://img.zeit.de/administratives/sharing/fallback-image-die-zeit/wide__1300x731,2026-06-18T00:10:48Z,,Das Rahmenabkommen zwischen den USA und dem Iran tritt laut dem Vermittlerstaat Pakistan nach erfolgter Unterzeichnung mit «sofortiger Wirkung» in Kraft. Teheran werde die Straße von Hormus «unverzüg… [+213 chars],,de,'Iran'
https://www.zeit.de/politik/ausland/2026-06/vereinbarung-iran-usa-kosten-finanzen-waffenruhe-5vor8,https://www.zeit.de/politik/ausland/2026-06/vereinbarung-iran-usa-kosten-finanzen-waffenruhe-5vor8,0,www.zeit.de,Vereinbarung mit dem Iran: Ein Deal ohne Rücksicht auf Verluste (anderer),Donald Trump gefällt sich selbst in der Rolle des knallharten Verhandlers. Sein Friedensdeal mit dem Iran zeigt: Vielleicht stimmt eher das Gegenteil.,https://img.zeit.de/politik/ausland/2026-06/vereinbarung-iran-usa-kosten-finanzen-waffenruhe-5vor8-bild/wide__1300x731,2026-06-18T02:51:58Z,,"Schließen
Artikelzusammenfassung
Das Friedensabkommen zwischen Donald Trump und dem Iran ist historisch, nicht wegen seiner Durchsetzungskraft, sondern wegen der vielen Zugeständnisse an das Regime… [+631 chars]",,de,'Iran'
https://www.faz.net/premium/weltwirtschaft/sicherheit/irankrieg-folgen-fuer-welthandel-und-strasse-von-hormus-accg-200934701.html,https://www.faz.net/premium/weltwirtschaft/sicherheit/irankrieg-folgen-fuer-welthandel-und-strasse-von-hormus-accg-200934701.html,0,www.faz.net,Weltweite Folgen: Was vom Kriege übrig blieb,"Der Irankrieg hat den Welthandel empfindlich getroffen. Seine Nachwirkungen könnten fatal sein, wenn die Sperrung wichtiger Meerengen Schule macht, warnen Wissenschaftler der Brookings Institution. Der amerikanische Thinktank beleuchtet in mehreren Studien au…",https://media0.faz.net/image/w1200h627/b80dcaf38c7e/w6000h3135x0y433o/202606/43601.0.2194330873/ein-schnellboot-der-iranischen.webp,2026-06-18T04:50:00Z,,"Mit der Blockade der Straße von Hormus habe Iran einen gefährlichen Präzedenzfall geschaffen, schreiben die Ökonomen Kari Heerman und David Wessel des amerikanischen Thinktanks Brookings Institution.… [+237 chars]",,de,'Hormus'
https://www.zeit.de/news/2026-06/18/flucht-in-peine-fahnder-suchen-nach-moerder,https://www.zeit.de/news/2026-06/18/flucht-in-peine-fahnder-suchen-nach-moerder,0,www.zeit.de,Niedersachsen: Flucht in Peine - Fahnder suchen nach Mörder,Hier finden Sie Informationen zu dem Thema „Niedersachsen“. Lesen Sie jetzt „Flucht in Peine - Fahnder suchen nach Mörder“.,https://img.zeit.de/news/2026-06/18/flucht-in-peine-fahnder-suchen-nach-moerder-image-group/wide__1300x731,2026-06-18T06:07:19Z,,"Fahnder des Landeskriminalamtes Niedersachsen suchen weiter nach einem geflohenen Mörder. Bisher ohne Erfolg, wie ein LKA-Sprecher am Morgen sagte. Der 42-Jährige war am Dienstagnachmittag während ei… [+1706 chars]",,de,'Flucht'
