index,url,valid,domain,title,description,image,published,archive,content,quote,language,keyword
https://www.stern.de/politik/ausland/lage-im-ueberblick--selenskyj--muessen-russische-flugplaetze-angreifen-35026912.html,https://www.stern.de/politik/ausland/lage-im-ueberblick--selenskyj--muessen-russische-flugplaetze-angreifen-35026912.html,0,www.stern.de,Lage im Überblick: Selenskyj: Müssen russische Flugplätze angreifen,"Die Ukraine lässt nicht locker - unermüdlich werden die westlichen Partner gebeten, die Erlaubnis zum Einsatz schwerer Waffen gegen Ziele in Russland zu erteilen.",https://image.stern.de/35026914/t/1X/v1/w1440/r1.7778/-/01--2qcuma3it4v3axw800h600jpeg---ebb0325473dbd540.jpg,2024-09-01T03:00:38Z,,"Die Ukraine lässt nicht locker - unermüdlich werden die westlichen Partner gebeten, die Erlaubnis zum Einsatz schwerer Waffen gegen Ziele in Russland zu erteilen.
Nach den jüngsten russischen Luftan… [+3916 chars]",,de,'Ukraine'
https://www.stern.de/gesellschaft/regional/hamburg-schleswig-holstein/maritime-industrie--schiffbaumesse-beginnt---was-die-branche-beschaeftigt-35026936.html,https://www.stern.de/gesellschaft/regional/hamburg-schleswig-holstein/maritime-industrie--schiffbaumesse-beginnt---was-die-branche-beschaeftigt-35026936.html,0,www.stern.de,Maritime Industrie: Schiffbaumesse beginnt - was die Branche beschäftigt,"Um den globalen Preiskampf zu überstehen, haben sich deutsche Werften spezialisiert. Andere sind verschwunden. Der Branchenverband warnt vor einem möglichen Kipppunkt - und macht einen Vorschlag.",https://image.stern.de/35026938/t/lx/v1/w1440/r1.7778/-/01--qm25oirpx3v47axw800h600jpeg---db5d366556cee7f8.jpg,2024-09-01T03:30:36Z,,"Um den globalen Preiskampf zu überstehen, haben sich deutsche Werften spezialisiert. Andere sind verschwunden. Der Branchenverband warnt vor einem möglichen Kipppunkt - und macht einen Vorschlag.
Vo… [+5801 chars]",,de,'Preis'
https://www.welt.de/politik/ausland/article253295370/Ukraine-Krieg-Explosionen-an-russischem-Kraftwerk-Selenskyj-will-Flugplaetze-angreifen.html,https://www.welt.de/politik/ausland/article253295370/Ukraine-Krieg-Explosionen-an-russischem-Kraftwerk-Selenskyj-will-Flugplaetze-angreifen.html,0,www.welt.de,Explosionen an russischem Kraftwerk – Selenskyj will Flugplätze angreifen,"Die Ukraine hat laut russischen Behörden zufolge in der Nacht Moskau und andere Regionen mit Drohnen angegriffen. In einer Videobotschaft hat der ukrainische Präsident Selenskyj erneut auf die Erlaubnis der westlichen Verbündeten gedrängt, schwere Waffen mit …",https://img.welt.de/img/politik/ausland/mobile253295372/4797939187-ci16x9-w1200/Selenskyj-wirbt-um-Flugabwehr-fuer-die-Ukraine.jpg,2024-09-01T03:39:56Z,,Die Ukraine hat laut russischen Behörden zufolge in der Nacht Moskau und andere Regionen mit Drohnen angegriffen. In einer Videobotschaft hat der ukrainische Präsident Selenskyj erneut auf die Erlaub… [+4976 chars],,de,'Ukraine'
https://www.tagesschau.de/newsticker/liveblog-ukraine-sonntag-466.html,https://www.tagesschau.de/newsticker/liveblog-ukraine-sonntag-466.html,0,www.tagesschau.de,Ukraine-Liveblog: ++ Offenbar Explosionen nahe Kraftwerk bei Moskau ++,Laut Berichten sind in der Nähe des Kraftwerks Konakowo nordwestlich von Moskau laute Explosionen zu hören. Selenskyj erneuert seinen Appell an den Westen zur Freigabe von Angriffen im russischen Hinterland. Die aktuellen Entwicklungen im Liveblog.,https://images.tagesschau.de/image/5b073b67-29bf-4703-b6b1-71469e4c25bb/AAABjz78AfM/AAABkZLhkrw/16x9-1280/flagge-ukraine-truemmer-101.jpg,2024-09-01T03:45:50Z,,"Stand: 01.09.2024 05:45 Uhr
Laut Berichten sind in der Nähe des Kraftwerks Konakowo nordwestlich von Moskau laute Explosionen zu hören. Selenskyj erneuert seinen Appell an den Westen zur Freigabe vo… [+2353 chars]",,de,'Ukraine'
https://www.morgenpost.de/berlin/article407138084/gruene-in-berlin-wir-sind-nach-wie-vor-eine-friedenspartei.html,https://www.morgenpost.de/berlin/article407138084/gruene-in-berlin-wir-sind-nach-wie-vor-eine-friedenspartei.html,0,www.morgenpost.de,Grüne in Berlin: „Wir sind nach wie vor eine Friedenspartei“,Die Berliner Grünen-Chefs verteidigen den Ukraine-Kurs ihrer Partei – und kritisieren Asylrechtsverschärfungen nach Solingen.,https://img.sparknews.funkemedien.de/407137914/407137914_1725029292_v16_9_1600.jpeg,2024-09-01T04:44:00Z,,Berlin. Die Berliner Grünen-Chefs verteidigen den Ukraine-Kurs ihrer Partei und kritisieren Asylrechtsverschärfungen nach Solingen.,,de,'Ukraine'
https://www.welt.de/geschichte/zweiter-weltkrieg/article253283832/1-September-1939-Das-Wort-Krieg-war-verboten-wie-bei-Putin.html,https://www.welt.de/geschichte/zweiter-weltkrieg/article253283832/1-September-1939-Das-Wort-Krieg-war-verboten-wie-bei-Putin.html,0,www.welt.de,Wie Putin verboten auch die Nazis das Wort „Krieg“,"Die Stimmung war gedrückt in Deutschland am 1. September 1939: Eigentlich wollte in der Bevölkerung niemand wirklich einen Eroberungsfeldzug gegen Polen. Propagandaminister Joseph Goebbels griff zu einem Trick, den Russland auch heute noch benutzt.",https://img.welt.de/img/geschichte/zweiter-weltkrieg/mobile253283826/5677937697-ci16x9-w1200/Hitler-Reden-werden-wissenschaftlich-aufbereitet.jpg,2024-09-01T05:26:11Z,,Die Stimmung war gedrückt in Deutschland am 1. September 1939: Eigentlich wollte in der Bevölkerung niemand wirklich einen Eroberungsfeldzug gegen Polen. Propagandaminister Joseph Goebbels griff zu e… [+7547 chars],,de,'Russland'
https://orf.at/stories/3368169/,https://orf.at/stories/3368169/,0,orf.at,Selenskyj will Freigabe von Angriffen auf Russland,,https://orf.at/mojo/1_4_1/storyserver//news/common/images/og-fallback-news.png,2024-09-01T05:30:32Z,,"Nach den jüngsten russischen Luftangriffen gegen ukrainische Städte hat Präsident Wolodymyr Selenskyj seinen Appell an den Westen zur Freigabe von Angriffen weit im russischen Hinterland erneuert.
D… [+1100 chars]",,de,'Ukraine'
https://orf.at/stories/3368170/,https://orf.at/stories/3368170/,0,orf.at,Russland: Starker Drohnenangriff von Ukraine,,https://orf.at/mojo/1_4_1/storyserver//news/common/images/og-fallback-news.png,2024-09-01T05:34:03Z,,Russland hat nach eigenen Angaben heute einen großen Drohnenangriff auf Westrussland sowie eine Attacke auf die Hauptstadt Moskau vereitelt. Unsere Verteidiger wehrten einen versuchten großen Drohnen… [+944 chars],,de,'Ukraine'
https://www.zeit.de/politik/ausland/2024-09/russland-ukraine-drohnen-moskau-kraftwerk,https://www.zeit.de/politik/ausland/2024-09/russland-ukraine-drohnen-moskau-kraftwerk,0,www.zeit.de,Russischer Angriffskrieg gegen die Ukraine: Russland spricht von ukrainischen Angriffen auf Energieinfrastruktur,"Über Hundert ukrainische Drohnen will Russland abgefangen haben. Wie viele russische Ziele getroffen haben, ist unklar. Eine Raffinerie in Moskau stehe in Flammen.",https://img.zeit.de/administratives/sharing/fallback-image/wide__1300x731,2024-09-01T07:23:36Z,,"Nach Angaben russischer Behörden hat es ukrainische Drohnenangriffe auf die Energieversorgung des Landes gegeben. Demnach waren die Nachbarregionen Moskau und Twer, aber auch andere Teile des Landes … [+1296 chars]",,de,'Russland'
https://www.zeit.de/news/2024-09/01/angriff-auf-polizisten-bei-hochzeitsfeier,https://www.zeit.de/news/2024-09/01/angriff-auf-polizisten-bei-hochzeitsfeier,0,www.zeit.de,Wuppertal: Angriff auf Polizisten bei Hochzeitsfeier,Hier finden Sie Informationen zu dem Thema „Wuppertal“. Lesen Sie jetzt „Angriff auf Polizisten bei Hochzeitsfeier“.,https://img.zeit.de/news/2024-09/01/angriff-auf-polizisten-bei-hochzeitsfeier-image-group/wide__1300x731,2024-09-01T07:28:39Z,https://web.archive.org/web/20240904101426/https://www.zeit.de/news/2024-09/01/angriff-auf-polizisten-bei-hochzeitsfeier,"Bei einer Hochzeitsfeier in Wuppertal sind fünf Polizisten leicht verletzt worden. Die Polizei war nach eigenen Angaben am Samstagabend zu der Feier gerufen worden, weil es zu einer Schlägerei unter … [+1503 chars]",,de,'Angriff'
https://www.zeit.de/news/2024-09/01/nach-gefaengnisausbruch-maenner-weiter-auf-der-flucht,https://www.zeit.de/news/2024-09/01/nach-gefaengnisausbruch-maenner-weiter-auf-der-flucht,0,www.zeit.de,Kriminelle: Nach Gefängnisausbruch: Männer weiter auf der Flucht,Hier finden Sie Informationen zu dem Thema „Kriminelle“. Lesen Sie jetzt „Nach Gefängnisausbruch: Männer weiter auf der Flucht“.,https://img.zeit.de/news/2024-09/01/nach-gefaengnisausbruch-maenner-weiter-auf-der-flucht-image-group/wide__1300x731,2024-09-01T09:16:51Z,,"Die Polizei sucht noch immer nach zwei Menschen, die aus einem Schweizer Gefängnis ausgebrochen sind. Man fahnde international nach ihnen, teilte das Justiz- und Sicherheitsdepartement des Kantons Ba… [+1246 chars]",,de,'Flucht'
https://www.zeit.de/news/2024-09/01/angriff-in-dresdner-strassenbahn-kind-und-fahrer-verletzt,https://www.zeit.de/news/2024-09/01/angriff-in-dresdner-strassenbahn-kind-und-fahrer-verletzt,0,www.zeit.de,Kriminalität: Angriff in Dresdner Straßenbahn: Kind und Fahrer verletzt,Hier finden Sie Informationen zu dem Thema „Kriminalität“. Lesen Sie jetzt „Angriff in Dresdner Straßenbahn: Kind und Fahrer verletzt“.,https://img.zeit.de/news/2024-09/01/angriff-in-dresdner-strassenbahn-kind-und-fahrer-verletzt-image-group/wide__1300x731,2024-09-01T09:44:52Z,,Ein stark betrunkener Mann hat in einer Straßenbahn in Dresden einen sechsjährigen Jungen und einen 43 Jahre alten Mann leicht verletzt. Der Fahrer der Linie zwei in Richtung Gorbitz hatte laut Poliz… [+444 chars],,de,'Angriff'
https://www.zeit.de/news/2024-09/01/angriff-auf-polizisten-mit-steinen-und-feuerwerkskoerpern,https://www.zeit.de/news/2024-09/01/angriff-auf-polizisten-mit-steinen-und-feuerwerkskoerpern,0,www.zeit.de,Berlin-Friedrichshain: Angriff auf Polizisten mit Steinen und Feuerwerkskörpern,Hier finden Sie Informationen zu dem Thema „Berlin-Friedrichshain“. Lesen Sie jetzt „Angriff auf Polizisten mit Steinen und Feuerwerkskörpern“.,https://img.zeit.de/news/2024-09/01/angriff-auf-polizisten-mit-steinen-und-feuerwerkskoerpern-image-group/wide__1300x731,2024-09-01T10:47:13Z,,Unbekannte haben Polizisten in der Rigaer Straße in Berlin-Friedrichshain mit Feuerwerkskörpern und Steinen angegriffen und verletzt. Die Beamten unterstützten am frühen Morgen zunächst die Feuerwehr… [+842 chars],,de,'Angriff'
https://www.zeit.de/news/2024-09/01/unfall-nach-flucht-vor-polizeikontrolle-beifahrerin-stirbt,https://www.zeit.de/news/2024-09/01/unfall-nach-flucht-vor-polizeikontrolle-beifahrerin-stirbt,0,www.zeit.de,Düsseldorf: Unfall nach Flucht vor Polizeikontrolle - Beifahrerin stirbt,Hier finden Sie Informationen zu dem Thema „Düsseldorf“. Lesen Sie jetzt „Unfall nach Flucht vor Polizeikontrolle - Beifahrerin stirbt“.,https://img.zeit.de/news/2024-09/01/unfall-nach-flucht-vor-polizeikontrolle-beifahrerin-stirbt-image-group/wide__1300x731,2024-09-01T11:40:36Z,,"Eine Frau ist in Düsseldorf bei einem Unfall nach der Flucht vor einer Polizeikontrolle gestorben. Die 42 Jahre alte Frau habe in der Nacht als Beifahrerin in einem Auto gesessen, dass eine Polizeist… [+1825 chars]",,de,'Flucht'
https://www.zeit.de/news/2024-09/01/radfahrer-bei-angriff-von-gruppe-schwer-verletzt,https://www.zeit.de/news/2024-09/01/radfahrer-bei-angriff-von-gruppe-schwer-verletzt,0,www.zeit.de,Dortmund: Radfahrer bei Angriff von Gruppe schwer verletzt,Hier finden Sie Informationen zu dem Thema „Dortmund“. Lesen Sie jetzt „Radfahrer bei Angriff von Gruppe schwer verletzt“.,https://img.zeit.de/news/2024-09/01/radfahrer-bei-angriff-von-gruppe-schwer-verletzt-image-group/wide__1300x731,2024-09-01T12:38:07Z,,"Ein 31 Jahre alter Radfahrer ist bei einem Angriff in Dortmund lebensgefährlich verletzt worden. Eine Gruppe von bis zu zehn Männern habe den Radfahrer am Samstag angegriffen, teilten Polizei und Sta… [+532 chars]",,de,'Angriff'
https://www.zeit.de/wirtschaft/2024-09/gasimporte-eu-russland-usa-norwegen,https://www.zeit.de/wirtschaft/2024-09/gasimporte-eu-russland-usa-norwegen,0,www.zeit.de,Gasimporte: Erstamals wieder mehr Gas aus Russland als aus den USA,Nach dem Großangriff auf die Ukraine war Russland nicht mehr Europas größter Gaslieferant. Doch nun beziehen die EU-Staaten wieder am zweitmeisten Gas von dort.,https://img.zeit.de/wirtschaft/2024-09/eu-staaten-importieren-gas-russland-bild/wide__1300x731,2024-09-01T12:51:28Z,,Erstmals seit knapp zwei Jahren haben die EU-Staaten in einem Quartal wieder mehr Gas aus Russland importiert als aus den USA. Das geht aus Daten der Brüsseler Beratungsgesellschaft Bruegel hervor. D… [+2283 chars],,de,'Russland'
https://www.zeit.de/news/2024-09/01/1-fc-nuernberg-koerperlicher-angriff-auf-u23-spieler,https://www.zeit.de/news/2024-09/01/1-fc-nuernberg-koerperlicher-angriff-auf-u23-spieler,0,www.zeit.de,2. Fußball-Bundesliga: 1. FC Nürnberg: Körperlicher Angriff auf U23-Spieler,Hier finden Sie Informationen zu dem Thema „2. Fußball-Bundesliga“. Lesen Sie jetzt „1. FC Nürnberg: Körperlicher Angriff auf U23-Spieler“.,https://img.zeit.de/news/2024-09/01/1-fc-nuernberg-koerperlicher-angriff-auf-u23-spieler-image-group/wide__1300x731,2024-09-01T16:11:45Z,,"Der 1. FC Nürnberg hat von einer Attacke auf einen seiner U23-Spieler berichtet. Wie der fränkische Fußball-Zweitligist mitteilte, kam es in der Nacht von Samstag auf Sonntag zu einem körperlichen An… [+1603 chars]",,de,'Angriff'
https://www.der-postillon.com/2024/09/thueringen-sachsen-1.html,https://www.der-postillon.com/2024/09/thueringen-sachsen-1.html,0,www.der-postillon.com,Putin gewinnt Wahlen in Thüringen und Sachsen,"Moskau, Erfurt, Dresden (dpo) - Es ist ein großer Tag für Wladimir Putin. Der russische Präsident ist der große Wahlsieger der Landtagswahlen in Thüringen und Sachsen. In beiden Bundesländern konnten kremltreue Parteien satte Zugewinne im verzeichnen. 
mehr...",https://blogger.googleusercontent.com/img/b/R29vZ2xl/AVvXsEisfcZTHirF0sc689LrWyY-Cj2OtMEjoRfly69UyRdKEmKAS2zQV7dNvuDrrWj2BbYiwGpvYf4cCmMNZwH6jRVv_B74CktlLJdfkqdCalQsu0kIzNC2NfNpPqvAKinLekMwOrbFoylkH8iXfUn3V1p2c1_zfLU0BvxsZSNh2bG1cDohnrXN1ixUIJ1g/w1600/imago0194877811h.jpg,2024-09-01T18:00:52Z,,"Moskau, Erfurt, Dresden (dpo) - Es ist ein großer Tag für Wladimir Putin. Der russische Präsident ist der große Wahlsieger der Landtagswahlen in Thüringen und Sachsen. In beiden Bundesländern konnten… [+1031 chars]",,de,'Wladimir Putin'
https://www.zeit.de/news/2024-09/02/selenskyj-russland-muss-den-krieg-spueren,https://www.zeit.de/news/2024-09/02/selenskyj-russland-muss-den-krieg-spueren,0,www.zeit.de,Lage im Überblick: Selenskyj: Russland muss den Krieg spüren,Hier finden Sie Informationen zu dem Thema „Lage im Überblick“. Lesen Sie jetzt „Selenskyj: Russland muss den Krieg spüren“.,https://img.zeit.de/news/2024-09/02/selenskyj-russland-muss-den-krieg-spueren-image-group/wide__1300x731,2024-09-02T02:30:38Z,,"Der ukrainische Präsident Wolodymyr Selenskyj hat die jüngsten Drohnenangriffe seines Militärs gegen Ziele in Russland als Notwendigkeit bezeichnet. «Der terroristische Staat muss spüren, wie es ist,… [+4679 chars]",,de,'Russland'
https://www.faz.net/aktuell/politik/ukraine/ukraine-liveticker-augenzeugen-melden-explosionen-in-kiew-faz-19030454.html,https://www.faz.net/aktuell/politik/ukraine/ukraine-liveticker-augenzeugen-melden-explosionen-in-kiew-faz-19030454.html,0,www.faz.net,Ukraine-Liveblog: Augenzeugen melden Explosionen in Kiew,Mehr als 40 Verletzte bei russischem Angriff auf Charkiw +++ Russischer Gouverneur meldet „massiven Drohnenangriff“ der Ukraine +++ alle Entwicklungen im Liveblog,https://media0.faz.net/ppmedia/aktuell/politik/4174061109/1.9957512/facebook_teaser/eine-rauchwolke-steigt-ueber.jpg,2024-09-02T03:56:53Z,,"Der ukrainische Präsident Wolodymyr Selenskyj versucht den Druck auf seine Partner zur Freigabe von Angriffen in Russland zu erhöhen. Den ukrainischen Himmel von russischen Gleitbomben zu säubern, is… [+729 chars]",,de,'Ukraine'
https://www.welt.de/debatte/kommentare/plus253300896/Atommacht-Russland-Der-wunde-Punkt-des-Wladimir-Putin-und-wie-der-Westen-ihn-nutzen-kann.html,https://www.welt.de/debatte/kommentare/plus253300896/Atommacht-Russland-Der-wunde-Punkt-des-Wladimir-Putin-und-wie-der-Westen-ihn-nutzen-kann.html,0,www.welt.de,Der wunde Punkt des Wladimir Putin – und wie der Westen ihn nutzen kann,Russlands nukleare Abschirmung wirkt: Einen Staat mit tausenden Atombomben greift niemand an. Wer sich im Kreml trotzdem sorgen muss. Ein Gastbeitrag des ehemaligen Wehrbeauftragten Hans-Peter Bartels und des Generalleutnants a.D. Rainer Glatz.,https://img.welt.de/img/debatte/kommentare/mobile253301168/2497935587-ci16x9-w1200-fnov-fpotl-fpi157750653/Russia-s-President-Vladimir-Putin-meets-with-China-s-Premier-Li-Q.jpg,2024-09-02T05:22:14Z,,Russlands nukleare Abschirmung wirkt: Einen Staat mit tausenden Atombomben greift niemand an. Wer sich im Kreml trotzdem sorgen muss. Ein Gastbeitrag des ehemaligen Wehrbeauftragten Hans-Peter Bartel… [+44 chars],,de,'Wladimir Putin'
https://www.golem.de/sonstiges/zustimmung/auswahl.html?from=https://www.golem.de/news/administrative-it-infiltriert-cyberangriff-trifft-deutsche-flugsicherung-2409-188600.html&referer=https://t.co/984d9797b9,https://www.golem.de/sonstiges/zustimmung/auswahl.html?from=https://www.golem.de/news/administrative-it-infiltriert-cyberangriff-trifft-deutsche-flugsicherung-2409-188600.html&referer=https://t.co/984d9797b9,0,www.golem.de,Administrative IT infiltriert: Cyberangriff trifft Deutsche Flugsicherung,"Nach Angaben eines Unternehmenssprechers betrifft der Vorfall die Büro-IT der DFS. Auswirkungen auf den Flugverkehr hat der Angriff wohl nicht. (Cyberwar, Security)",,2024-09-02T06:39:01Z,,"Besuchen Sie Golem.de wie gewohnt mit Werbung und Tracking,
 indem Sie der Nutzung aller Cookies zustimmen.
 Details zum Tracking finden Sie im Privacy Center.
Skript wurde nicht geladen. Informat… [+607 chars]",,de,'Angriff'
https://www.zeit.de/news/2024-09/02/hund-bei-angriff-von-zwei-anderen-hunden-schwer-verletzt,https://www.zeit.de/news/2024-09/02/hund-bei-angriff-von-zwei-anderen-hunden-schwer-verletzt,0,www.zeit.de,Tiere: Hund bei Angriff von zwei anderen Hunden schwer verletzt,Hier finden Sie Informationen zu dem Thema „Tiere“. Lesen Sie jetzt „Hund bei Angriff von zwei anderen Hunden schwer verletzt“.,https://img.zeit.de/news/2024-09/02/hund-bei-angriff-von-zwei-anderen-hunden-schwer-verletzt-image-group/wide__1300x731,2024-09-02T07:32:17Z,,"Ein Hund ist in Rotenburg von zwei herrenlosen Hunden angegriffen und schwer verletzt worden. Das Tier kam am Sonntagnachmittag in eine Klinik, wie die Polizei mitteilte. Demnach wollte ein elf Jahre… [+218 chars]",,de,'Angriff'
https://www.zeit.de/news/2024-09/02/angriff-auf-nuernberger-spieler-ermittlungen-gegen-unbekannt,https://www.zeit.de/news/2024-09/02/angriff-auf-nuernberger-spieler-ermittlungen-gegen-unbekannt,0,www.zeit.de,U23: Angriff auf Nürnberger Spieler: Ermittlungen gegen Unbekannt,Hier finden Sie Informationen zu dem Thema „U23“. Lesen Sie jetzt „Angriff auf Nürnberger Spieler: Ermittlungen gegen Unbekannt“.,https://img.zeit.de/news/2024-09/02/angriff-auf-nuernberger-spieler-ermittlungen-gegen-unbekannt-image-group/wide__1300x731,2024-09-02T08:07:06Z,,Nach dem Angriff auf einen U23-Spieler des 1. FC Nürnberg hat sich Abwehrspieler Niklas-Wilson Sommer mit einem Instagram-Post an seine Follower gewendet. «Vor 22h genau mir geht's gut Danke für die … [+2451 chars],,de,'Angriff'
https://www.tagesschau.de/newsticker/liveblog-ukraine-172.html,https://www.tagesschau.de/newsticker/liveblog-ukraine-172.html,0,www.tagesschau.de,Ukraine-Liveblog: ++ Putin: Kursk-Offensive hält Armee nicht auf ++,Das russische Militär rückt laut Präsident Putin trotz der ukrainischen Offensive in die Region Kursk in der Ostukraine weiter vor. Die Ukraine hat nach eigenen Angaben am Morgen 22 von 35 Raketen abgefangen. Alle Entwicklungen im Liveblog.,https://images.tagesschau.de/image/56b92e97-7f54-448a-8ca4-ecf0dce9f5ee/AAABkL9arAc/AAABkZLhkrw/16x9-1280/putin-1242.jpg,2024-09-02T10:40:22Z,,"Stand: 02.09.2024 12:40 Uhr
Das russische Militär rückt laut Präsident Putin trotz der ukrainischen Offensive in die Region Kursk in der Ostukraine weiter vor. Die Ukraine hat nach eigenen Angaben a… [+2367 chars]",,de,'Ukraine'
https://www.zeit.de/news/2024-09/02/autounfall-nach-flucht-vor-polizei-zwei-verletzte,https://www.zeit.de/news/2024-09/02/autounfall-nach-flucht-vor-polizei-zwei-verletzte,0,www.zeit.de,Verfolgungsjagd: Autounfall nach Flucht vor Polizei: zwei Verletzte,Hier finden Sie Informationen zu dem Thema „Verfolgungsjagd“. Lesen Sie jetzt „Autounfall nach Flucht vor Polizei: zwei Verletzte“.,https://img.zeit.de/news/2024-09/02/autounfall-nach-flucht-vor-polizei-zwei-verletzte-image-group/wide__1300x731,2024-09-02T11:34:26Z,,Auf der Flucht vor einer Polizeikontrolle wegen eines mutmaßlich gefälschten Kennzeichens ist ein Auto in Offenbach gegen eine Hauswand gefahren. Bei dem Unfall seien zwei Insassen des Autos verletzt… [+1104 chars],,de,'Flucht'
https://www.tagesschau.de/ausland/europa/rechnungshof-corona-hilfen-100.html,https://www.tagesschau.de/ausland/europa/rechnungshof-corona-hilfen-100.html,0,www.tagesschau.de,EU-Hilfsfonds: Mittel aus Coronahilfe werden nur schleppend abgerufen,Laut Europäischem Rechnungshof ist bisher nicht mal ein Drittel der Mittel aus den Corona-Hilfefonds der EU abgerufen worden. Die Gründe dafür reichen von Inflation bis zu Überforderung bei den Verwaltungen. Von T. Spickhofen,https://images.tagesschau.de/image/f4f1f3aa-2e9c-454a-af7a-fee23a9abc68/AAABjbJZSzg/AAABkZLhkrw/16x9-1280/eu-flagge-158.jpg,2024-09-02T15:47:36Z,,"Stand: 02.09.2024 17:47 Uhr
Laut Europäischem Rechnungshof ist bisher nicht mal ein Drittel der Mittel aus den Corona-Hilfefonds der EU abgerufen worden. Die Gründe dafür reichen von Inflation bis z… [+2476 chars]",,de,'Inflation'
https://www.welt.de/politik/ausland/video253323052/Ukraine-Krieg-Putin-in-der-Mongolei-Das-wird-in-Russland-dementsprechend-gefeiert.html,https://www.welt.de/politik/ausland/video253323052/Ukraine-Krieg-Putin-in-der-Mongolei-Das-wird-in-Russland-dementsprechend-gefeiert.html,0,www.welt.de,Putin in der Mongolei – „Das wird in Russland dementsprechend gefeiert“,"Wladimir Putin ist zu einem Besuch in der Mongolei eingetroffen. Das Mitgliedsland des Internationalen Strafgerichtshofs (IStGH) wäre verpflichtet, den per Haftbefehl gesuchten russischen Präsidenten festzunehmen. Christoph Wanner schätzt für WELT TV die Wahr…",https://img.welt.de/img/politik/deutschland/mobile253323198/5207934007-ci16x9-w1200/PCR1-PGM-16-00-17920-edited-jpg.jpg,2024-09-02T16:37:33Z,,"Wladimir Putin ist zu einem Besuch in der Mongolei eingetroffen. Das Mitgliedsland des Internationalen Strafgerichtshofs (IStGH) wäre verpflichtet, den per Haftbefehl gesuchten russischen Präsidenten… [+124 chars]",,de,'Russland'
https://www.jungewelt.de/artikel/482902.ukraine-krieg-erst-raus-aus-kursk.html,https://www.jungewelt.de/artikel/482902.ukraine-krieg-erst-raus-aus-kursk.html,0,www.jungewelt.de,Ukraine-Krieg: »Erst raus aus Kursk«,Putin nennt neue Bedingungen für Waffenstillstandsgespräche. Die Armee greift erneut Kiew an und erzielt im Donbass offenbar weitere Erfolge.,https://www.jungewelt.de/img/1100/199232.jpg,2024-09-02T17:36:56Z,,"Bevor sich die ukrainische Armee nicht aus dem Kursker Gebiet zurückziehe oder von Russland mit Gewalt von dort vertrieben sei, werde es keine Gespräche geben. Diese neue Vorbedingung für Waffenstill… [+2136 chars]",,de,'Wladimir Putin'
https://www.focus.de/politik/ausland/ukraine-krise/ukraine-krieg-im-ticker-selenskyj-fordert-russland-muss-den-krieg-spueren_id_57275780.html,https://www.focus.de/politik/ausland/ukraine-krise/ukraine-krieg-im-ticker-selenskyj-fordert-russland-muss-den-krieg-spueren_id_57275780.html,0,www.focus.de,News zum Ukraine-Krieg - Nächster russischer General wegen Korruption festgenommen,"Nach der ukrainischen Offensive in Kursk rückt Russland im Osten der Ukraine vor. Deshalb wird Kritik an Selenskyj laut. Doch der sagt: „Wir müssen den Krieg nach Hause bringen, dorthin, von wo er in die Ukraine gebracht wird.“ Alle Nachrichten zum Krieg in d…",https://p6.focus.de/img/panorama/welt/id_260234781/wladimir-putin.jpg?im=Crop%3D%280%2C0%2C2048%2C1022%29%3BResize%3D%281200%2C627%29&impolicy=perceptual&quality=mediumHigh&hash=cb04e90adc95687fae77ba4d526db5b518057c88c5e3a859d870227bdbe7070c,2024-09-02T18:47:15Z,,"<ul><li>
Kommentare</li><li>
E-Mail</li><li>
Teilen</li><li>
Mehr</li><li>
Twitter</li><li>
Drucken</li><li>
Feedback</li><li>
Fehler meldenSie haben einen Fehler gefunden?
Bitte markieren S… [+8330 chars]",,de,'Russland'
