index,url,valid,domain,title,description,image,published,archive,content,quote,language,keyword
https://www.zeit.de/news/2024-09/04/brand-in-radioaktiv-belasteter-tschernobyl-zone-ausgebrochen,https://www.zeit.de/news/2024-09/04/brand-in-radioaktiv-belasteter-tschernobyl-zone-ausgebrochen,0,www.zeit.de,Waldbrand in der Ukraine: Brand in radioaktiv belasteter Tschernobyl-Zone ausgebrochen,Hier finden Sie Informationen zu dem Thema „Waldbrand in der Ukraine“. Lesen Sie jetzt „Brand in radioaktiv belasteter Tschernobyl-Zone ausgebrochen“.,https://img.zeit.de/news/2024-09/04/brand-in-radioaktiv-belasteter-tschernobyl-zone-ausgebrochen-image-group/wide__1300x731,2024-09-04T15:25:16Z,https://web.archive.org/web/20240906013827/https://www.zeit.de/news/2024-09/04/brand-in-radioaktiv-belasteter-tschernobyl-zone-ausgebrochen,"In der Ukraine ist in der radioaktiv belasteten Sperrzone um das Atomkraftwerk Tschernobyl ein Waldbrand ausgebrochen. Eine Fläche von etwa 20 Hektar brenne, teilte der Gouverneur des Gebiets Kiew, R… [+2334 chars]",,de,'Ukraine'
https://www.zeit.de/news/2024-09/04/urteil-im-prozess-um-toedlichen-angriff-in-bingen-erwartet,https://www.zeit.de/news/2024-09/04/urteil-im-prozess-um-toedlichen-angriff-in-bingen-erwartet,0,www.zeit.de,Gericht: Urteil im Prozess um tödlichen Angriff in Bingen erwartet,Hier finden Sie Informationen zu dem Thema „Gericht“. Lesen Sie jetzt „Urteil im Prozess um tödlichen Angriff in Bingen erwartet“.,https://img.zeit.de/news/2024-09/04/urteil-im-prozess-um-toedlichen-angriff-in-bingen-erwartet-image-group/wide__1300x731,2024-09-04T15:30:36Z,,Rund elf Monate nach einer tödlichen Messerattacke in Bingen-Büdesheim wird vor dem Landgericht Mainz am Donnerstag (14.30 Uhr) das Urteil gegen einen angeklagten heute 32 Jahre alten Mann erwartet. … [+2243 chars],,de,'Angriff'
https://www.n-tv.de/politik/Bundesregierung-Ausbau-der-Geothermie-liegt-im-ueberragenden-oeffentlichen-Interesse-article25205131.html,https://www.n-tv.de/politik/Bundesregierung-Ausbau-der-Geothermie-liegt-im-ueberragenden-oeffentlichen-Interesse-article25205131.html,0,www.n-tv.de,Geothermie vernachlässigt: Ampel will zum Heizen verstärkt Erdwärme anzapfen,"Nach Einschätzung der Bundesregierung könnte für gut ein Viertel der benötigten Wärme in Deutschland durch Erdwärme in tieferen Gesteinslagen gewonnen werden. Um den Bau von Großanlagen zu beschleunigen, gewichtet die Ampel etwa den Naturschutz und das Bergre…",https://bilder3.n-tv.de/img/incoming/crop25205130/5931324214-cImg_16_9-w1200/474040789.jpg,2024-09-04T15:49:26Z,,Nach Einschätzung der Bundesregierung könnte für gut ein Viertel der benötigten Wärme in Deutschland durch Erdwärme in tieferen Gesteinslagen gewonnen werden. Um den Bau von Großanlagen zu beschleuni… [+2797 chars],,de,'Heizen'
https://www.focus.de/politik/deutschland/analyse-von-ulrich-reitz-habeck-und-die-vw-krise-mit-neuen-subventionen-will-der-gruene-das-e-auto-retten_id_260284250.html,https://www.focus.de/politik/deutschland/analyse-von-ulrich-reitz-habeck-und-die-vw-krise-mit-neuen-subventionen-will-der-gruene-das-e-auto-retten_id_260284250.html,0,www.focus.de,"Analyse von Ulrich Reitz - Krise zur Unzeit: Wenn VW hustet, droht Berlin eine Lungenentzündung",Die VW-Krise schlägt in Berlin auf. Grüne fürchten um ihr Verbrenner-Auto – und denken sich gleich die nächsten Elektro-Subventionen aus.Von FOCUS-online-Korrespondent Ulrich Reitz,https://p6.focus.de/img/fotos/id_260284356/mitarbeiter-protestieren-vor-beginn-einer-betriebsversammlung-in-einer-halle-im-vw-werk..jpg?im=Crop%3D%280%2C195%2C3463%2C1732%29%3BResize%3D%281200%2C627%29&impolicy=perceptual&quality=mediumHigh&hash=8c872c1f3c20bcba4bb39204458319c7cddca05f0324d063c7f8b3c10775f64f,2024-09-04T16:54:53Z,,Die VW-Krise schlägt in Berlin auf. Grüne fürchten um ihr Verbrenner-Auto und denken sich gleich die nächsten Elektro-Subventionen aus. Für das größte deutsche Industrieunternehmen und seinem Verhält… [+8354 chars],,de,'Gas'
https://www.jungewelt.de/artikel/483079.aufruf-des-icap-zu-einem-aktionstag-für-frieden-und-gegen-die-blockade.html,https://www.jungewelt.de/artikel/483079.aufruf-des-icap-zu-einem-aktionstag-für-frieden-und-gegen-die-blockade.html,0,www.jungewelt.de,Aufruf des ICAP zu einem Aktionstag für Frieden und gegen die Blockade,Außerdem: Der fraktionslose Hamburger Abgeordnete Martin Dolzer zu den Folgen des Ukrainekrieges für die Hansestadt.,https://www.jungewelt.de/img/1100/199333.jpg,2024-09-04T17:37:13Z,,"Das Kubanische Institut für Völkerfreundschaft (ICAP) ruft zu einem Aktionstag für den Frieden und gegen die Blockade auf:
Das Kubanische Institut für Völkerfreundschaft (ICAP) ruft alle Regionen au… [+3033 chars]",,de,'Ukraine'
https://www.zeit.de/news/2024-09/04/usa-werfen-russland-einmischung-in-praesidentenwahl-vor,https://www.zeit.de/news/2024-09/04/usa-werfen-russland-einmischung-in-praesidentenwahl-vor,0,www.zeit.de,US-Wahlkampf: USA werfen Russland Einmischung in Präsidentenwahl vor,Hier finden Sie Informationen zu dem Thema „US-Wahlkampf“. Lesen Sie jetzt „USA werfen Russland Einmischung in Präsidentenwahl vor“.,https://img.zeit.de/news/2024-09/04/usa-werfen-russland-einmischung-in-praesidentenwahl-vor-image-group/wide__1300x731,2024-09-04T17:54:35Z,,"Die US-Regierung wirft Russland eine Einmischung in die bevorstehende Präsidentenwahl im November vor. Die USA belegten mehrere Personen und Organisationen mit Sanktionen, darunter Vertreter des staa… [+3143 chars]",,de,'Wladimir Putin'
https://www.zeit.de/politik/ausland/2024-09/usa-verhaengen-wegen-wahleinmischung-sanktionen-gegen-russland,https://www.zeit.de/politik/ausland/2024-09/usa-verhaengen-wegen-wahleinmischung-sanktionen-gegen-russland,0,www.zeit.de,US-Präsidentschaftswahlkampf: USA verhängen wegen Wahleinmischung Sanktionen gegen Russland,"Die US-Regierung hat Strafmaßnahmen gegen mehrere Personen und Organisationen in Russland verhängt. Ihnen wird vorgeworfen, den US-Wahlkampf beeinflussen zu wollen.",https://img.zeit.de/politik/ausland/2024-09/usa-verhaengen-wegen-wahleinmischung-sanktionen-gegen-russland-bild/wide__1300x731,2024-09-04T18:13:45Z,,"Die US-Regierung wirft Russland eine Einmischung in die bevorstehende Präsidentschaftswahl im November vor. Die USA belegen mehrere Personen und Organisationen mit Sanktionen, darunter Vertreter des … [+1822 chars]",,de,'Wladimir Putin'
https://www.tagesschau.de/ausland/amerika/desinformation-102.html,https://www.tagesschau.de/ausland/amerika/desinformation-102.html,0,www.tagesschau.de,USA werfen Russland Einmischung in Präsidentenwahl vor,"Die US-Regierung beschuldigt Russland, sich in die Wahlen einzumischen. Auch US-Influencer sollen dabei unwissentlich eine Rolle gespielt haben. Nun reagiert Washington mit Sanktionen gegen den russischen Staatssender RT.",https://images.tagesschau.de/image/3a904b59-f5bf-4b73-9e04-d58dfd34bff4/AAABkb5XbgE/AAABkZLhkrw/16x9-1280/garland-116.jpg,2024-09-04T18:41:26Z,https://web.archive.org/web/20240904185017/https://www.tagesschau.de/ausland/amerika/desinformation-102.html,"Stand: 04.09.2024 20:41 Uhr
Die US-Regierung beschuldigt Russland, sich in die Wahlen einzumischen. Auch US-Influencer sollen dabei unwissentlich eine Rolle gespielt haben. Nun reagiert Washington m… [+2310 chars]",,de,'Russland'
https://www.faz.net/aktuell/politik/inland/bundeswehr-stellt-iris-t-flugabwehr-in-dienst-wodurch-zeichnet-es-sich-aus-19963287.html,https://www.faz.net/aktuell/politik/inland/bundeswehr-stellt-iris-t-flugabwehr-in-dienst-wodurch-zeichnet-es-sich-aus-19963287.html,0,www.faz.net,Luftverteidigung: Wie Iris-T Deutschland und Europa schützen soll,Die Bundeswehr stellt die Iris-T-Flugabwehr in Dienst. In der Ukraine hat sich das System längst als Lebensretter bewährt. Durch was zeichnet es sich aus?,https://media1.faz.net/ppmedia/aktuell/2578839502/1.9963611/facebook_teaser/bundeskanzler-olaf-scholz-und.jpg,2024-09-04T19:50:16Z,http://archive.md/20240905171712/https://www.faz.net/aktuell/politik/inland/bundeswehr-stellt-iris-t-flugabwehr-in-dienst-wodurch-zeichnet-es-sich-aus-19963287.html,"Iris-T SLM gilt als eines der modernsten Flugabwehrsysteme der Welt. Es dient dem Schutz von bewohnten Gebieten, Gebäuden und Anlagen. Mit einer hohen Feuerkraft und einem 360-Grad-Rundumschutz könne… [+4898 chars]",,de,'Ukraine'
https://www.n-tv.de/politik/14-38-Neuer-ukrainischer-Aussenminister-Andrij-Sybiha-bestaetigt--article23143824.html,https://www.n-tv.de/politik/14-38-Neuer-ukrainischer-Aussenminister-Andrij-Sybiha-bestaetigt--article23143824.html,0,www.n-tv.de,Ukraine-Krieg im Liveticker: +++ 14:38 Neuer ukrainischer Außenminister Andrij Sybiha bestätigt +++,Lesen Sie alle aktuellen Entwicklungen und Nachrichten über den russischen Angriffskrieg auf die Ukraine im Liveticker von ntv.de.,https://bilder3.n-tv.de/img/incoming/crop25117070/4231326595-cImg_16_9-w1200/Ukraine-Liveticker.jpg,2024-09-04T22:24:00Z,,Nach der Entlassung des ukrainischen Außenministers Dmytro Kuleba setzt das ukrainische Parlament dessen bisherigen Stellvertreter Andrij Sybiha als neuen Chefdiplomaten des Landes ein. Für die von P… [+21851 chars],,de,'Ukraine'
https://www.n-tv.de/politik/13-35-Putin-will-im-US-Praesidentschaftswahlkampf-Harris-unterstuetzen--article23143824.html,https://www.n-tv.de/politik/13-35-Putin-will-im-US-Praesidentschaftswahlkampf-Harris-unterstuetzen--article23143824.html,0,www.n-tv.de,"Ukraine-Krieg im Liveticker: +++ 13:35 Putin will im US-Präsidentschaftswahlkampf Harris ""unterstützen"" +++",Lesen Sie alle aktuellen Entwicklungen und Nachrichten über den russischen Angriffskrieg auf die Ukraine im Liveticker von ntv.de.,https://bilder3.n-tv.de/img/incoming/crop25117070/4231326595-cImg_16_9-w1200/Ukraine-Liveticker.jpg,2024-09-04T22:24:00Z,,"Eigentlich gilt er als politischer Freund von Donald Trump - nun hat der russische Präsident Wladimir Putin verkündet, dass er im US-Präsidentschaftswahlkampf die demokratische Kandidatin Kamala Harr… [+20123 chars]",,de,'Gas'
https://www.n-tv.de/politik/12-16-Nach-Kulebas-Ruecktritt-Selenskyj-schlaegt-Andrij-Sybiha-als-Aussenminister-vor--article23143824.html,https://www.n-tv.de/politik/12-16-Nach-Kulebas-Ruecktritt-Selenskyj-schlaegt-Andrij-Sybiha-als-Aussenminister-vor--article23143824.html,0,www.n-tv.de,Ukraine-Krieg im Liveticker: +++ 12:16 Nach Kulebas Rücktritt: Selenskyj schlägt Andrij Sybiha als Außenminister vor +++,Lesen Sie alle aktuellen Entwicklungen und Nachrichten über den russischen Angriffskrieg auf die Ukraine im Liveticker von ntv.de.,https://bilder3.n-tv.de/img/incoming/crop25117070/4231326595-cImg_16_9-w1200/Ukraine-Liveticker.jpg,2024-09-04T22:24:00Z,,Der ukrainische Präsident Wolodymyr Selenskyj schlägt seinen langjährigen Mitarbeiter Andrij Sybiha als neuen Außenminister vor. Sybiha war im ukrainischen Präsidialamt für Außenpolitik und strategis… [+17371 chars],,de,'Gas'
https://www.n-tv.de/politik/15-34-Im-Kill-House-lernen-Ukrainer-das-Toeten-mit-der-Drohne--article23143824.html,https://www.n-tv.de/politik/15-34-Im-Kill-House-lernen-Ukrainer-das-Toeten-mit-der-Drohne--article23143824.html,0,www.n-tv.de,"Ukraine-Krieg im Liveticker: +++ 15:34 Im ""Kill House"" lernen Ukrainer das Töten mit der Drohne +++",Lesen Sie alle aktuellen Entwicklungen und Nachrichten über den russischen Angriffskrieg auf die Ukraine im Liveticker von ntv.de.,https://bilder3.n-tv.de/img/incoming/crop25117070/4231326595-cImg_16_9-w1200/Ukraine-Liveticker.jpg,2024-09-04T22:24:00Z,,Mit Drohnen wehrt sich die Ukraine lange erfolgreich gegen Russlands übermächtige Streitmacht. Die Bedeutung der unbemannten Fluggeräte hat seit dem Beginn der russischen Invasion stetig zugenommen. … [+22938 chars],,de,'Angriff'
https://www.n-tv.de/politik/12-50-Video-zeigt-ukrainische-Kalaschnikow-Drohne-im-Einsatz--article23143824.html,https://www.n-tv.de/politik/12-50-Video-zeigt-ukrainische-Kalaschnikow-Drohne-im-Einsatz--article23143824.html,0,www.n-tv.de,Ukraine-Krieg im Liveticker: +++ 12:27 Russische Truppen rücken näher: Ukraine stellt Evakuierungen mit dem Zug aus Pokrowsk ein +++,Lesen Sie alle aktuellen Entwicklungen und Nachrichten über den russischen Angriffskrieg auf die Ukraine im Liveticker von ntv.de.,https://bilder3.n-tv.de/img/incoming/crop25117070/4231326595-cImg_16_9-w1200/Ukraine-Liveticker.jpg,2024-09-04T22:24:00Z,,"Im Krieg in der Ukraine testen die Verteidiger immer häufiger auch neuartige Kampfmittel. Im Netz tauchten zuletzt Videoaufnahmen auf, die den Einsatz eines fliegenden Waffenträgers zeigen. Der ukrai… [+19117 chars]",,de,'Gas'
https://www.n-tv.de/politik/14-06-Bericht-Sender-RT-zahlte-knapp-zehn-Millionen-US-Dollar-fuer-kremlfreundliche-Inhalte-in-den-USA--article23143824.html,https://www.n-tv.de/politik/14-06-Bericht-Sender-RT-zahlte-knapp-zehn-Millionen-US-Dollar-fuer-kremlfreundliche-Inhalte-in-den-USA--article23143824.html,0,www.n-tv.de,Ukraine-Krieg im Liveticker: +++ 14:06 Bericht: Sender RT zahlte knapp zehn Millionen US-Dollar für kremlfreundliche Inhalte in den USA +++,Lesen Sie alle aktuellen Entwicklungen und Nachrichten über den russischen Angriffskrieg auf die Ukraine im Liveticker von ntv.de.,https://bilder3.n-tv.de/img/incoming/crop25117070/4231326595-cImg_16_9-w1200/Ukraine-Liveticker.jpg,2024-09-04T22:24:00Z,,"Ein neuer Bericht untermauert den Vorwurf, dass Moskau immer wieder versuche, den Wahlkampf in den USA zu beeinflussen. Ein amerikanisches Medienunternehmen, das mit sechs konservativen Influencern v… [+21223 chars]",,de,'Ukraine'
https://www.n-tv.de/politik/16-14-Russische-Aggression-Niederlande-fahren-wegen-russischer-Aggression-Verteidigungsausgaben-hoch--article23143824.html,https://www.n-tv.de/politik/16-14-Russische-Aggression-Niederlande-fahren-wegen-russischer-Aggression-Verteidigungsausgaben-hoch--article23143824.html,0,www.n-tv.de,"Ukraine-Krieg im Liveticker: +++ 16:14 Russische Aggression"" - Niederlande fahren wegen ""russischer Aggression"" Verteidigungsausgaben hoch +++",Lesen Sie alle aktuellen Entwicklungen und Nachrichten über den russischen Angriffskrieg auf die Ukraine im Liveticker von ntv.de.,https://bilder3.n-tv.de/img/incoming/crop25117070/4231326595-cImg_16_9-w1200/Ukraine-Liveticker.jpg,2024-09-04T22:24:00Z,,"Die Niederlande kündigen angesichts des Ukraine-Kriegs eine deutliche Aufstockung der Verteidigungsausgaben an. Mit milliardenschweren zusätzlichen Investitionen in Panzer, Kampfflugzeuge und Fregatt… [+23881 chars]",,de,'Ukraine'
https://www.n-tv.de/politik/11-44-Putin-Deutschland-koennte-immer-noch-Gas-ueber-Nord-Stream-beziehen--article23143824.html,https://www.n-tv.de/politik/11-44-Putin-Deutschland-koennte-immer-noch-Gas-ueber-Nord-Stream-beziehen--article23143824.html,0,www.n-tv.de,Ukraine-Krieg im Liveticker: +++ 11:44 Putin: Deutschland könnte immer noch Gas über Nord-Stream beziehen +++,Lesen Sie alle aktuellen Entwicklungen und Nachrichten über den russischen Angriffskrieg auf die Ukraine im Liveticker von ntv.de.,https://bilder3.n-tv.de/img/incoming/crop25117070/4231326595-cImg_16_9-w1200/Ukraine-Liveticker.jpg,2024-09-04T22:24:00Z,,"Russlands Präsident Wladimir Putin verweist darauf, dass eine der in der Ostsee verlegten Nord-Stream-Pipelines noch intakt ist. Nichts stehe Deutschland im Wege, Gas über diese Röhre zu beziehen. Dr… [+16884 chars]",,de,'Gas'
https://www.n-tv.de/politik/14-57-Putin-sieht-ukrainische-Kursk-Offensive-gescheitert--article23143824.html,https://www.n-tv.de/politik/14-57-Putin-sieht-ukrainische-Kursk-Offensive-gescheitert--article23143824.html,0,www.n-tv.de,Ukraine-Krieg im Liveticker: +++ 14:57 Putin sieht ukrainische Kursk-Offensive gescheitert +++,Lesen Sie alle aktuellen Entwicklungen und Nachrichten über den russischen Angriffskrieg auf die Ukraine im Liveticker von ntv.de.,https://bilder3.n-tv.de/img/incoming/crop25117070/4231326595-cImg_16_9-w1200/Ukraine-Liveticker.jpg,2024-09-04T22:24:00Z,,Rund einen Monat nach Beginn der ukrainischen Offensive im russischen Gebiet Kursk hält Kremlchef Wladimir Putin die Ziele der Führung in Kiew für gescheitert. Ziel der ukrainischen Streitkräfte sei … [+22598 chars],,de,'Gas'
https://www.welt.de/politik/deutschland/article253361332/Buergerdialog-in-Berlin-Der-Abend-mit-dem-Kanzler-zeigt-das-ganze-Ausmass-der-Spaltung-Deutschlands.html,https://www.welt.de/politik/deutschland/article253361332/Buergerdialog-in-Berlin-Der-Abend-mit-dem-Kanzler-zeigt-das-ganze-Ausmass-der-Spaltung-Deutschlands.html,0,www.welt.de,Der Abend mit dem Kanzler zeigt das ganze Ausmaß der Spaltung Deutschlands,"Olaf Scholz lädt zum Kanzler-Gespräch in Berlin. Das Publikum treibt dort Themen wie Tempolimit, Umgang mit Klimaklebern oder Steuern für Besserverdiener um. Und nur unter anderem die Herausforderungen durch die starke Zuwanderung oder das Anwachsen der AfD. …",https://img.welt.de/img/politik/deutschland/mobile253361334/9167931497-ci16x9-w1200/Bundeskanzler-Scholz-im-Buergergespraech.jpg,2024-09-04T23:30:55Z,http://archive.md/20240904233529/https://www.welt.de/politik/deutschland/article253361332/Buergerdialog-in-Berlin-Der-Abend-mit-dem-Kanzler-zeigt-das-ganze-Ausmass-der-Spaltung-Deutschlands.html,"Olaf Scholz lädt zum Kanzler-Gespräch in Berlin. Das Publikum treibt dort Themen wie Tempolimit, Umgang mit Klimaklebern oder Steuern für Besserverdiener um. Und nur unter anderem die Herausforderung… [+8274 chars]",,de,'Klima'
https://www.stern.de/gesellschaft/regional/sachsen-anhalt/energieversorgung--verbraucher-koennen-auf-sinkende-gaspreise-hoffen-35038472.html,https://www.stern.de/gesellschaft/regional/sachsen-anhalt/energieversorgung--verbraucher-koennen-auf-sinkende-gaspreise-hoffen-35038472.html,0,www.stern.de,Energieversorgung: Verbraucher können auf sinkende Gaspreise hoffen,In der Corona-Pandemie und mit dem Ukraine-Krieg sind die Energiepreise stark angestiegen. Inzwischen stabilisieren sich die Preise wieder. Kunden können davon profitieren.,https://image.stern.de/35038474/t/Mz/v1/w1440/r1.7778/-/05--bznxzxxae3v10axw800h600jpeg---bf99b4af384b126c.jpg,2024-09-05T02:30:36Z,,"In der Corona-Pandemie und mit dem Ukraine-Krieg sind die Energiepreise stark angestiegen. Inzwischen stabilisieren sich die Preise wieder. Kunden können davon profitieren.
In Sachsen-Anhalt können … [+2636 chars]",,de,'Ukraine'
https://www.zeit.de/news/2024-09/05/verbraucher-koennen-auf-sinkende-gaspreise-hoffen,https://www.zeit.de/news/2024-09/05/verbraucher-koennen-auf-sinkende-gaspreise-hoffen,0,www.zeit.de,Energieversorgung: Verbraucher können auf sinkende Gaspreise hoffen,Hier finden Sie Informationen zu dem Thema „Energieversorgung“. Lesen Sie jetzt „Verbraucher können auf sinkende Gaspreise hoffen“.,https://img.zeit.de/news/2024-09/05/verbraucher-koennen-auf-sinkende-gaspreise-hoffen-image-group/wide__1300x731,2024-09-05T02:30:36Z,,"In Sachsen-Anhalt können Verbraucher auf sinkende Gaspreise hoffen. Mehrere Stadtwerke haben angekündigt, die Preise demnächst zu senken oder haben dies bereits getan. Das ergab eine Umfrage der Deut… [+3534 chars]",,de,'Gas'
https://www.zeit.de/news/2024-09/05/bericht-selenskyj-kommt-zu-ukraine-treffen-nach-ramstein,https://www.zeit.de/news/2024-09/05/bericht-selenskyj-kommt-zu-ukraine-treffen-nach-ramstein,0,www.zeit.de,Treffen der Verbündeten: Bericht: Selenskyj kommt zu Ukraine-Treffen nach Ramstein,Hier finden Sie Informationen zu dem Thema „Treffen der Verbündeten“. Lesen Sie jetzt „Bericht: Selenskyj kommt zu Ukraine-Treffen nach Ramstein“.,https://img.zeit.de/news/2024-09/05/bericht-selenskyj-kommt-zu-ukraine-treffen-nach-ramstein-image-group/wide__1300x731,2024-09-05T06:47:24Z,https://web.archive.org/web/20240905194406/https://www.zeit.de/news/2024-09/05/bericht-selenskyj-kommt-zu-ukraine-treffen-nach-ramstein,Zu Gesprächen über die weitere Unterstützung der Ukraine im Krieg gegen Russland in Ramstein reist am Freitag nach «Spiegel»-Informationen auch der ukrainische Präsident Wolodymr Selenskyj an. Beim B… [+1722 chars],,de,'Ukraine'
https://www.morgenpost.de/wirtschaft/article407156063/pelletspreise-aktuell-heute-5-september-2024-pellets-preis-heizung.html,https://www.morgenpost.de/wirtschaft/article407156063/pelletspreise-aktuell-heute-5-september-2024-pellets-preis-heizung.html,0,www.morgenpost.de,Pelletspreise aktuell (05.09.): Das kostet heute eine Tonne,"Der Sommer geht zu Ende, die Temperaturen halten sich. Was bedeutet das für die Pelletspreise? Der Preis pro Tonne vom 5. September im Überblick.",https://img.sparknews.funkemedien.de/406824301/406824301_1721292661_v16_9_1600.jpeg,2024-09-05T06:52:00Z,,"Berlin. Der Sommer geht zu Ende, die Temperaturen halten sich. Was bedeutet das für die Pelletspreise? Der Preis pro Tonne vom 5. September im Überblick.
Kaum Zeichen für eine größere Trendwende: Di… [+6669 chars]",,de,'Gas'
https://www.n-tv.de/wirtschaft/Osterreich-haengt-noch-immer-am-Tropf-von-Gazprom-article25206039.html,https://www.n-tv.de/wirtschaft/Osterreich-haengt-noch-immer-am-Tropf-von-Gazprom-article25206039.html,0,www.n-tv.de,Wann ist damit Schluss?: Österreich hängt noch immer am Tropf von Gazprom,"Unsere Nachbarn in Österreich sind stark abhängig von russischem Gas. Wenn die Ukraine den Transit einstellt, wäre Schluss mit diesen Lieferungen. Technische Alternativen gibt es längst. Doch wie teuer wird dann der Winter in Wien?",https://bilder4.n-tv.de/img/Podcast/crop25206035/9191327376-cImg_16_9-w1200/imago0164163923h.jpg,2024-09-05T08:00:00Z,,"Unsere Nachbarn in Österreich sind stark abhängig von russischem Gas. Wenn die Ukraine den Transit einstellt, wäre Schluss mit diesen Lieferungen. Technische Alternativen gibt es längst. Doch wie teu… [+2842 chars]",,de,'Gas'
https://www.zeit.de/news/2024-09/05/angriff-in-humanitaerer-zone-israel-hamas-zentrale-ziel,https://www.zeit.de/news/2024-09/05/angriff-in-humanitaerer-zone-israel-hamas-zentrale-ziel,0,www.zeit.de,Gaza-Krieg: Angriff in humanitärer Zone - Israel: Hamas-Zentrale Ziel,Hier finden Sie Informationen zu dem Thema „Gaza-Krieg“. Lesen Sie jetzt „Angriff in humanitärer Zone - Israel: Hamas-Zentrale Ziel“.,https://img.zeit.de/news/2024-09/05/angriff-in-humanitaerer-zone-israel-hamas-zentrale-ziel-image-group/wide__1300x731,2024-09-05T08:58:31Z,,Bei einem israelischen Angriff im Gazastreifen innerhalb einer ausgewiesenen humanitären Zone soll es palästinensischen Berichten zufolge mehrere Tote gegeben haben. Vier Menschen seien auf dem Gelän… [+2675 chars],,de,'Angriff'
https://www.zeit.de/news/2024-09/05/dutzende-russische-drohnen-greifen-ziele-in-der-ukraine-an,https://www.zeit.de/news/2024-09/05/dutzende-russische-drohnen-greifen-ziele-in-der-ukraine-an,0,www.zeit.de,Krieg in der Ukraine: Dutzende russische Drohnen greifen Ziele in der Ukraine an,Hier finden Sie Informationen zu dem Thema „Krieg in der Ukraine“. Lesen Sie jetzt „Dutzende russische Drohnen greifen Ziele in der Ukraine an“.,https://img.zeit.de/news/2024-09/05/dutzende-russische-drohnen-greifen-ziele-in-der-ukraine-an-image-group/wide__1300x731,2024-09-05T09:00:40Z,,"Das russische Militär hat nach ukrainischen Angaben mit 78 Kampfdrohnen iranischer Bauart Ziele im ukrainischen Hinterland angegriffen. 60 seien abgeschossen worden, teilte die ukrainische Luftwaffe … [+1120 chars]",,de,'Ukraine'
https://www.golem.de/sonstiges/zustimmung/auswahl.html?from=https://www.golem.de/news/anzeige-ackuschrauber-von-bosch-fast-zum-halben-preis-sichern-2409-188719.html&referer=https://t.co/69e56dc844,https://www.golem.de/sonstiges/zustimmung/auswahl.html?from=https://www.golem.de/news/anzeige-ackuschrauber-von-bosch-fast-zum-halben-preis-sichern-2409-188719.html&referer=https://t.co/69e56dc844,0,www.golem.de,Anzeige: Ackuschrauber von Bosch fast zum halben Preis sichern,"Der Akkuschrauber von Bosch ist für verschiedene Arbeiten rund ums Schrauben und Bohren in Holz, Metall und Kunststoff geeignet. (Technik/Hardware, Bosch)",,2024-09-05T10:01:01Z,,"Besuchen Sie Golem.de wie gewohnt mit Werbung und Tracking,
 indem Sie der Nutzung aller Cookies zustimmen.
 Details zum Tracking finden Sie im Privacy Center.
Skript wurde nicht geladen. Informat… [+607 chars]",,de,'Preis'
https://www.welt.de/politik/ausland/us-wahl/article253367098/Putin-will-Harris-im-Praesidentschaftswahlkampf-unterstuetzen.html,https://www.welt.de/politik/ausland/us-wahl/article253367098/Putin-will-Harris-im-Praesidentschaftswahlkampf-unterstuetzen.html,0,www.welt.de,Putin will Harris im Präsidentschaftswahlkampf „unterstützen“,"Kamala Harris „lacht so ansteckend“ – das sagte der russische Präsident Wladimir Putin über die Präsidentschaftskandidatin der Demokraten. Im gleichen Zuge erklärte er, sie im Wahlkampf „unterstützen“ zu wollen – obwohl er eigentlich als Sympathisant ihres Ri…",https://img.welt.de/img/politik/ausland/us-wahl/mobile253367070/3957937217-ci16x9-w1200/Russian-President-Putin-attends-Eastern-Economic-Forum-in-Vladivostok.jpg,2024-09-05T10:06:41Z,,"Kamala Harris lacht so ansteckend das sagte der russische Präsident Wladimir Putin über die Präsidentschaftskandidatin der Demokraten. Im gleichen Zuge erklärte er, sie im Wahlkampf unterstützen zu w… [+2449 chars]",,de,'Wladimir Putin'
