index,url,valid,domain,title,description,image,published,archive,content,quote,language,keyword
https://www.faz.net/aktuell/politik/ukraine-liveticker-kiew-russisches-militaer-macht-druck-auf-neue-frontlinie-faz-19030454.html,https://www.faz.net/aktuell/politik/ukraine-liveticker-kiew-russisches-militaer-macht-druck-auf-neue-frontlinie-faz-19030454.html,0,www.faz.net,Ukraine-Liveblog: Kiew: Druck auf neue Frontlinie,Kommunikation der Luftwaffe womöglich von Russland abgehört +++ Macron: Aussage zu Bodentruppen durchdacht +++ USA: Keine Anzeichen für Einsatz russicher Atomwaffen +++ Alle Entwicklungen im Liveblog,https://media0.faz.net/ppmedia/aktuell/politik/258299719/1.9538994/facebook_teaser/ukrainische-soldaten-feuern.jpg,2024-03-02T04:15:22Z,,"Frankreich bestellt 2000 Kamikaze-Drohnen und will einige von ihnen an die Ukraine liefern. ""Ich habe die Entscheidung getroffen, 2000 Stück ferngesteuerte Munition zu bestellen, für den Bedarf der f… [+793 chars]",,de,'Russland'
https://www.zeit.de/news/2024-03/02/menschen-trauern-weiter-um-nawalny-auf-friedhof-in-moskau,https://www.zeit.de/news/2024-03/02/menschen-trauern-weiter-um-nawalny-auf-friedhof-in-moskau,0,www.zeit.de,Russland: Menschen trauern weiter um Nawalny auf Friedhof in Moskau,Hier finden Sie Informationen zu dem Thema „Russland“. Lesen Sie jetzt „Menschen trauern weiter um Nawalny auf Friedhof in Moskau“.,https://img.zeit.de/news/2024-03/02/menschen-trauern-weiter-um-nawalny-auf-friedhof-in-moskau-image-group/wide__1300x731,2024-03-02T09:38:36Z,,Nach der Beerdigung des im Straflager gestorbenen Kremlgegners Alexej Nawalny haben sich auch heute trotz Polizeiaufgebots weiter Menschen an seinem Grab auf dem Friedhof Borissowskoje in Moskau von … [+2642 chars],,de,'Russland'
https://www.zeit.de/politik/deutschland/2024-03/taurus-luftwaffe-spionage-russland-forderungen,https://www.zeit.de/politik/deutschland/2024-03/taurus-luftwaffe-spionage-russland-forderungen,0,www.zeit.de,Taurus-Marschflugkörper: Union fordert verschärfte Sicherheitsvorschriften,Wegen eines angeblich von Russland abgehörten Gesprächs zweier Bundeswehroffiziere werden Forderungen aus der Politik laut. Die FDP warnt vor Naivität.,https://img.zeit.de/politik/deutschland/2024-03/union-verschaerfte-sicherheitsvorschriften-taurus-bild/wide__1300x731,2024-03-02T12:02:14Z,https://web.archive.org/web/20240302154134/https://www.zeit.de/politik/deutschland/2024-03/taurus-luftwaffe-spionage-russland-forderungen,"Die Union hat angesichts der Berichte über ein angeblich von
Russland abgehörtes Gespräch von Bundeswehroffizieren über den Marschflugkörper
Taurus und dessen Einsatz in der Ukraine die Bundesregie… [+3883 chars]",,de,'Russland'
