index,url,valid,domain,title,description,image,published,archive,content,quote,language,keyword
https://www.tagesspiegel.de/internationales/wirtschaftspakt-ohne-sicherheitsgarantien-was-uber-den-rohstoffdeal-von-ukraine-und-den-usa-bekannt-ist-13622158.html,https://www.tagesspiegel.de/internationales/wirtschaftspakt-ohne-sicherheitsgarantien-was-uber-den-rohstoffdeal-von-ukraine-und-den-usa-bekannt-ist-13622158.html,0,www.tagesspiegel.de,Wirtschaftspakt ohne Sicherheitsgarantien: Was über den Rohstoffdeal von Ukraine und den USA bekannt ist,"Abbau von Seltenen Erden, Wiederaufbaufonds, aber keine Sicherheitsgarantien: Nach langem Ringen haben Kiew und Washington ein Abkommen geschlossen. Doch noch sind nicht alle Details veröffentlicht.",https://www.tagesspiegel.de/images/13622233/alternates/BASE_16_9_W1400/1746089252000/iron-ore-open-pit-mine-in-kryvyi-rih.jpeg,2025-05-01T09:15:28Z,,Die Ukraine und die USA haben ein von Präsident Donald Trump gefordertes Rohstoffabkommen unterzeichnet. Es gewährt den Vereinigten Staaten bevorzugten Zugang zu ukrainischen Bodenschätzen wie den Se… [+7931 chars],,de,'Angriff'
https://www.bild.de/regional/baden-wuerttemberg/festnahme-in-rastatt-bundespolizei-verhaftet-gesuchte-frau-6813420ee4b9a572ec7aadf8,https://www.bild.de/regional/baden-wuerttemberg/festnahme-in-rastatt-bundespolizei-verhaftet-gesuchte-frau-6813420ee4b9a572ec7aadf8,0,www.bild.de,Rastatt - Frau (20) wegen Angriff auf Polizisten verhaftet,Rastatt – Ein 20-jähriger Frau wurde am Bahnhof Rastatt von der Bundespolizei festgenommen. Die deutsche Staatsangehörige war per Ha...,"https://images.bild.de/6813420ee4b9a572ec7aadf8/419754f4c1db510bf947af0b2a86ca7e-landscape,61dd6835?w=1280",2025-05-01T09:53:05Z,https://web.archive.org/web/20250501123049/http://www.bild.de/regional/baden-wuerttemberg/festnahme-in-rastatt-bundespolizei-verhaftet-gesuchte-frau-6813420ee4b9a572ec7aadf8,"Rastatt Ein 20-jähriger Frau wurde am Bahnhof Rastatt von der Bundespolizei festgenommen.
Die deutsche Staatsangehörige war per Haftbefehl gesucht, da sie wegen eines tätlichen Angriffs auf Vollstre… [+192 chars]",,de,'Angriff'
https://www.tagesschau.de/wirtschaft/weltwirtschaft/usa-ukraine-abkommen-faq-102.html,https://www.tagesschau.de/wirtschaft/weltwirtschaft/usa-ukraine-abkommen-faq-102.html,0,www.tagesschau.de,Was in dem Abkommen zwischen den USA und der Ukraine steht,"Nach monatelangen Verhandlungen mit heftigen Wendungen wie dem Eklat im Oval Office, haben sich die USA und die Ukraine auf ein Wirtschaftsabkommen geeinigt. Was darüber bislang bekannt ist.",https://images.tagesschau.de/image/b6025926-588b-4a66-87f6-cc7fa481860c/AAABlotNWbs/AAABkZLhkrw/16x9-1280/maschine-cockpit-tagebau-100.jpg,2025-05-01T10:04:27Z,https://web.archive.org/web/20250501104547/https://www.tagesschau.de/wirtschaft/weltwirtschaft/usa-ukraine-abkommen-faq-102.html,"Stand: 01.05.2025 12:04 Uhr
Nach monatelangen Verhandlungen mit heftigen Wendungen wie dem Eklat im Oval Office, haben sich die USA und die Ukraine auf ein Wirtschaftsabkommen geeinigt. Was darüber … [+5836 chars]",,de,'Ukraine'
https://www.n-tv.de/politik/Rohstoffdeal-steht-das-ist-bisher-darueber-bekannt-article25739754.html,https://www.n-tv.de/politik/Rohstoffdeal-steht-das-ist-bisher-darueber-bekannt-article25739754.html,0,www.n-tv.de,USA und Ukraine schließen Pakt: Rohstoffdeal steht - das ist bisher darüber bekannt,"Seltene Erden, Graphit, Lithium, Kohle - die Ukraine verfügt über immense Bodenschätze. Die USA verschaffen sich mit dem nun geschlossenen Deal Zugriff auf diese Rohstoffe. Doch auch die Ukraine profitiert - sowohl sicherheitspolitisch als auch wirtschaftlich.",https://www.n-tv.de/img/incoming/crop25739765/3411329972-cImg_16_9-w1200/6b614e294152f6a958e628fdfcbd62a0.jpg,2025-05-01T10:12:12Z,https://web.archive.org/web/20250501110028/https://www.n-tv.de/politik/Rohstoffdeal-steht-das-ist-bisher-darueber-bekannt-article25739754.html,Nach wochenlangen Verhandlungen haben die USA und die Ukraine ein Abkommen über den Abbau ukrainischer Rohstoffe und den Wiederaufbau des vom Krieg zerstörten Landes unterzeichnet. Sicherheitsgaranti… [+6094 chars],,de,'Angriff'
https://www.zeit.de/politik/ausland/2025-04/donald-trump-100-tage-amtszeit-ok-america,https://www.zeit.de/politik/ausland/2025-04/donald-trump-100-tage-amtszeit-ok-america,0,www.zeit.de,"Donald Trump: 100 Tage geschafft, 1.361 kommen noch","Alles auf Angriff: Donald Trump hat in den ersten 100 Tagen seiner zweiten Präsidentschaft begonnen, das Land umzubauen und die Welt umzukrempeln. Das Thema im US-Podcast",https://img.zeit.de/politik/ausland/2025-04/donald-trump-100-tage-amtszeit-ok-america-bild/wide__1300x731,2025-05-01T11:56:15Z,http://archive.md/20250501121840/https://www.zeit.de/politik/ausland/2025-04/donald-trump-100-tage-amtszeit-ok-america,"Hat in Michigan seine ersten 100 Tage im Amt gefeiert: US-Präsident Donald Trump© Mandel Ngan/AFP/Getty Images
Donald Trump hat in der Nähe von Detroit, Michigan, die ""erfolgreichsten ersten 100 Tag… [+1404 chars]",,de,'Angriff'
https://www.welt.de/politik/ausland/article256047072/Gebiet-Cherson-Russland-meldet-ukrainischen-Drohnenangriff-mit-9-Toten.html,https://www.welt.de/politik/ausland/article256047072/Gebiet-Cherson-Russland-meldet-ukrainischen-Drohnenangriff-mit-9-Toten.html,0,www.welt.de,Russland meldet ukrainischen Drohnenangriff mit 9 Toten,Auf einem belebten Markt sollen am 1. Mai Drohnen eingeschlagen sein – so stellt es die russische Besatzung im Süden der Ukraine dar. Mitgelieferte Videobeweise lassen aber Fragen offen.,https://img.welt.de/img/politik/ausland/mobile256047070/9657933027-ci16x9-w1200/Drohne-in-der-Ukraine.jpg,2025-05-01T12:25:18Z,https://web.archive.org/web/20250501134136/https://www.welt.de/politik/ausland/article256047072/Gebiet-Cherson-Russland-meldet-ukrainischen-Drohnenangriff-mit-9-Toten.html,Durch einen Drohnenangriff des ukrainischen Militärs sollen nach Angaben der russischen Besatzungsmacht im südukrainischen Gebiet Cherson neun Menschen getötet und mehr als 20 verletzt worden sein. D… [+645 chars],,de,'Angriff'
https://www.tagesspiegel.de/internationales/pakistan-rechnet-mit-indischem-angriff-in-den-nachsten-stunden-einen-krieg-konnen-sich-beide-lander-eigentlich-gar-nicht-leisten-13619347.html,https://www.tagesspiegel.de/internationales/pakistan-rechnet-mit-indischem-angriff-in-den-nachsten-stunden-einen-krieg-konnen-sich-beide-lander-eigentlich-gar-nicht-leisten-13619347.html,0,www.tagesspiegel.de,Pakistan rechnet mit indischem Angriff in nächsten Stunden: „Einen Krieg können sich beide Länder eigentlich gar nicht leisten“,"Indien hat den Luftraum für Flugzeuge aus Pakistan gesperrt. Die Regierung dort ist in höchster Alarmbereitschaft – und erklärte, ab wann sie Atomwaffen einsetzen würde.",https://www.tagesspiegel.de/images/13622725/alternates/BASE_16_9_W1400/1746095069000/security-heightened-in-kashmir-after-pahalgam-attack.jpeg,2025-05-01T12:35:02Z,http://archive.md/20250501124345/https://www.tagesspiegel.de/internationales/pakistan-rechnet-mit-indischem-angriff-in-den-nachsten-stunden-einen-krieg-konnen-sich-beide-lander-eigentlich-gar-nicht-leisten-13619347.html,"Einfach waren die Beziehungen zwischen Indien und Pakistan nie, große Spannungen gab es immer. Doch nun könnte sich der Grenzstreit zu einem größeren Konflikt entwickeln.",,de,'Angriff'
https://www.sueddeutsche.de/politik/syrien-viele-tote-bei-angriffen-auf-drusen-li.3245426,https://www.sueddeutsche.de/politik/syrien-viele-tote-bei-angriffen-auf-drusen-li.3245426,0,www.sueddeutsche.de,Syrien: Viele Tote bei Angriffen auf Drusen,,https://www.sueddeutsche.de/szde-assets/img/szde-article-sharing-image-no-teaser-image-fallback.png,2025-05-01T12:54:06Z,,"Nach tödlichen Auseinandersetzungen in Syrien sind nach Angaben von Aktivisten erneut mehrere Drusen getötet worden. 23 Angehörige der religiösen Minderheit seien in einem Hinterhalt getötet worden, … [+673 chars]",,de,'Angriff'
https://www.n-tv.de/politik/Russland-ueberzieht-Ukraine-mit-Drohnenangriffen-article25739951.html,https://www.n-tv.de/politik/Russland-ueberzieht-Ukraine-mit-Drohnenangriffen-article25739951.html,0,www.n-tv.de,Mindestens zwei Tote in Odessa: Russland überzieht Ukraine mit Drohnenangriffen,"Die Ukraine und die USA besiegeln ihr Rohstoffabkommen. Dessen ungeachtet überzieht Russland das Land mit Drohnen und Raketen. In Odessa sterben mindestens zwei Menschen. Russland behauptet, seinerseits von der Ukraine angegriffen worden zu sein. Videos lasse…",https://www.n-tv.de/img/incoming/crop25739962/5091324016-cImg_16_9-w1200/2025-05-01T062738Z-1479857826-RC2U8EAT7QUR-RTRMADP-3-UKRAINE-CRISIS-ATTACK-ODESA.jpg,2025-05-01T13:20:45Z,https://web.archive.org/web/20250501150408/https://www.n-tv.de/politik/Russland-ueberzieht-Ukraine-mit-Drohnenangriffen-article25739951.html,"Die Ukraine und die USA besiegeln ihr Rohstoffabkommen. Dessen ungeachtet überzieht Russland das Land mit Drohnen und Raketen. In Odessa sterben mindestens zwei Menschen. Russland behauptet, seinerse… [+3720 chars]",,de,'Ukraine'
https://www.sueddeutsche.de/muenchen/muenchen-marienplatz-demo-1-mai-gewerkschaften-koalitionsvertrag-li.3244236,https://www.sueddeutsche.de/muenchen/muenchen-marienplatz-demo-1-mai-gewerkschaften-koalitionsvertrag-li.3244236,0,www.sueddeutsche.de,"Tag der Arbeit in München: „Was im Koalitionsvertrag so harmlos klingt, ist in Wahrheit ein Angriff auf den Arbeitsschutz“",Bei der Kundgebung am 1. Mai treten auf dem Marienplatz mehrere Tausend Arbeitnehmer für den Acht-Stunden-Tag und eine soziale Stadt ein. Manche Pläne der neuen Bundesregierung wecken Befürchtungen.,https://www.sueddeutsche.de/2025/05/01/08e89852-c582-4479-94c7-b5160358f089.jpeg?q=60&fm=webp&width=1200&rect=0%2C209%2C4000%2C2250,2025-05-01T13:59:57Z,,"Schulter an Schulter, laut, sichtbar und entschlossen müssen die Gewerkschaften für ihre Rechte eintreten, sagt Hauptredner Robert Feiger, Bundesvorsitzender der Industriegewerkschaft Bauen-Agrar-Umw… [+3429 chars]",,de,'Angriff'
