index,url,valid,domain,title,description,image,published,archive,content,quote,language,keyword
https://www.n-tv.de/politik/00-12-Selenskyj-bedankt-sich-bei-Schweden-fuer-neues-Hilfspaket--article23143824.html,https://www.n-tv.de/politik/00-12-Selenskyj-bedankt-sich-bei-Schweden-fuer-neues-Hilfspaket--article23143824.html,0,www.n-tv.de,Ukraine-Krieg im Liveticker: +++ 00:12 Selenskyj bedankt sich bei Schweden für neues Hilfspaket +++,Lesen Sie alle aktuellen Entwicklungen und Nachrichten über den russischen Angriffskrieg auf die Ukraine im Liveticker von ntv.de.,https://bilder3.n-tv.de/img/incoming/crop25117070/4231326595-cImg_16_9-w1200/Ukraine-Liveticker.jpg,2024-09-08T22:24:00Z,,"Der ukrainische Präsident Selenskyj bedankt sich bei Schweden für ein Verteidigungspaket im Wert von 445 Millionen Dollar. ""Diese wichtige Hilfe, die unter anderem Flugabwehrsysteme, Panzerabwehrwaff… [+28418 chars]",,de,'Heizen'
https://www.n-tv.de/politik/19-43-Lawrow-Der-Westen-will-nicht-ehrlich-verhandeln--article23143824.html,https://www.n-tv.de/politik/19-43-Lawrow-Der-Westen-will-nicht-ehrlich-verhandeln--article23143824.html,0,www.n-tv.de,"Ukraine-Krieg im Liveticker: +++ 19:43 Lawrow: ""Der Westen will nicht ehrlich verhandeln"" +++",Lesen Sie alle aktuellen Entwicklungen und Nachrichten über den russischen Angriffskrieg auf die Ukraine im Liveticker von ntv.de.,https://bilder3.n-tv.de/img/incoming/crop25117070/4231326595-cImg_16_9-w1200/Ukraine-Liveticker.jpg,2024-09-08T22:24:00Z,,"Russland hat dem Westen nach dem diplomatischen Vorstoß von Bundeskanzler Olaf Scholz Unehrlichkeit im Ukraine-Streit vorgeworfen. ""Der Westen will nicht ehrlich verhandeln"", sagte Russlands Außenmin… [+24361 chars]",,de,'Angriff'
https://www.n-tv.de/politik/22-17-Auswaertiges-Amt-Russland-groesste-Bedrohung-fuer-Frieden-direkt-an-Nato-Ostflanke--article23143824.html,https://www.n-tv.de/politik/22-17-Auswaertiges-Amt-Russland-groesste-Bedrohung-fuer-Frieden-direkt-an-Nato-Ostflanke--article23143824.html,0,www.n-tv.de,"Ukraine-Krieg im Liveticker: +++ 22:17 Auswärtiges Amt: Russland ""größte Bedrohung für Frieden"" direkt an Nato-Ostflanke +++",Lesen Sie alle aktuellen Entwicklungen und Nachrichten über den russischen Angriffskrieg auf die Ukraine im Liveticker von ntv.de.,https://bilder3.n-tv.de/img/incoming/crop25117070/4231326595-cImg_16_9-w1200/Ukraine-Liveticker.jpg,2024-09-08T22:24:00Z,,"Nach dem Eindringen russischer Drohnen nach Lettland und Rumänien hat das Auswärtige Amt Russland unter Präsident Wladimir Putin als ""größte Bedrohung für Frieden und Sicherheit"" bezeichnet. ""Leider … [+27804 chars]",,de,'Russland'
https://www.morgenpost.de/berlin/article407210160/nach-der-spaetsommer-hitze-kaelte-einbruch-in-berlin.html,https://www.morgenpost.de/berlin/article407210160/nach-der-spaetsommer-hitze-kaelte-einbruch-in-berlin.html,0,www.morgenpost.de,Nach der Spätsommer-Hitze – Kälte-Einbruch in Berlin,"Wind, Regen und die Temperaturen rauschen herunter. Der Herbst ist endgültig in Berlin und Brandenburg angekommen. Die Vorhersage.",https://img.sparknews.funkemedien.de/406052896/406052896_1725864825_v16_9_1600.jpeg,2024-09-09T06:53:45Z,https://web.archive.org/web/20240909082204/https://www.morgenpost.de/berlin/article407210160/nach-der-spaetsommer-hitze-kaelte-einbruch-in-berlin.html,"Berlin. Wind, Regen und die Temperaturen rauschen herunter. Der Herbst ist endgültig in Berlin und Brandenburg angekommen. Die Vorhersage.
Tschüss, Spätsommer, Sonne und Hitze: In Berlin und Branden… [+908 chars]",,de,'Kälte'
https://www.zeit.de/news/2024-09/09/verdaechtiger-nach-messerangriff-in-karlsruhe-auf-der-flucht,https://www.zeit.de/news/2024-09/09/verdaechtiger-nach-messerangriff-in-karlsruhe-auf-der-flucht,0,www.zeit.de,Hauptbahnhof: Verdächtiger nach Messerangriff in Karlsruhe auf der Flucht,Hier finden Sie Informationen zu dem Thema „Hauptbahnhof“. Lesen Sie jetzt „Verdächtiger nach Messerangriff in Karlsruhe auf der Flucht“.,https://img.zeit.de/news/2024-09/09/verdaechtiger-nach-messerangriff-in-karlsruhe-auf-der-flucht-image-group/wide__1300x731,2024-09-09T07:23:21Z,,"Nach dem Messerangriff auf einen 32-Jährigen am Karlsruher Bahnhof ist der Täter noch immer auf der Flucht. Der Unbekannte habe den Mann am Freitag mit einem Messer angegriffen und schwer verletzt, t… [+720 chars]",,de,'Flucht'
https://www.faz.net/aktuell/politik/inland/krise-bei-volkswagen-ein-hochpolitischer-sanierungsfall-19971387.html,https://www.faz.net/aktuell/politik/inland/krise-bei-volkswagen-ein-hochpolitischer-sanierungsfall-19971387.html,0,www.faz.net,Krise bei Volkswagen: Ein hochpolitischer Sanierungsfall,"Die Krise bei Volkswagen trifft Niedersachsen ins Mark. Das liegt auch am Verhältnis von Management, Landespolitik und IG Metall. Einblicke in ein besonderes Beziehungsgeflecht.",https://media1.faz.net/ppmedia/aktuell/3169579781/1.9971385/facebook_teaser/die-lage-ist-ernst-im-juli.jpg,2024-09-09T07:28:58Z,https://web.archive.org/web/20240909073700/https://www.faz.net/aktuell/politik/inland/krise-bei-volkswagen-ein-hochpolitischer-sanierungsfall-19971387.html,"Anfang des Jahres reichte VW jedoch ei­ne Abrissanzeige für den Telemoritz ein. Die Nachricht traf die Stadt ins Mark. Eine Initiative bildete sich, der Oberbürgermeister schaltete sich ein, und der … [+16460 chars]",,de,'Frieren'
https://www.zeit.de/news/2024-09/09/denkzettel-fuer-stadtoberhaupt-von-st-petersburg,https://www.zeit.de/news/2024-09/09/denkzettel-fuer-stadtoberhaupt-von-st-petersburg,0,www.zeit.de,Abstimmungen in Russland: Denkzettel für Stadtoberhaupt von St. Petersburg,Hier finden Sie Informationen zu dem Thema „Abstimmungen in Russland“. Lesen Sie jetzt „Denkzettel für Stadtoberhaupt von St. Petersburg“.,https://img.zeit.de/news/2024-09/09/denkzettel-fuer-stadtoberhaupt-von-st-petersburg-image-group/wide__1300x731,2024-09-09T08:58:12Z,https://web.archive.org/web/20240909091534/https://www.zeit.de/news/2024-09/09/denkzettel-fuer-stadtoberhaupt-von-st-petersburg,Bei den russischen Regionalwahlen hat die Kreml-Partei Geeintes Russland nach offiziellen Angaben alle ihre Kandidaten für Gouverneursposten durchgesetzt. Einen Denkzettel gab es aber für den Gouvern… [+1525 chars],,de,'Wladimir Putin'
https://www.zeit.de/news/2024-09/09/einsatz-von-streumunition-meiste-opfer-in-der-ukraine,https://www.zeit.de/news/2024-09/09/einsatz-von-streumunition-meiste-opfer-in-der-ukraine,0,www.zeit.de,Geächtete Waffen: Einsatz von Streumunition: meiste Opfer in der Ukraine,Hier finden Sie Informationen zu dem Thema „Geächtete Waffen“. Lesen Sie jetzt „Einsatz von Streumunition: meiste Opfer in der Ukraine“.,https://img.zeit.de/news/2024-09/09/einsatz-von-streumunition-meiste-opfer-in-der-ukraine-image-group/wide__1300x731,2024-09-09T12:00:36Z,,"Die Zahl der gemeldeten Opfer von Streumunition ist im vergangenen Jahr deutlich zurückgegangen. Das habe aber damit zu tun, dass in Konfliktzonen nicht alle Fälle registriert und gemeldet würden, be… [+2440 chars]",,de,'Ukraine'
https://www.faz.net/aktuell/gesellschaft/menschen/russlands-hochzeit-des-jahres-zwei-putin-anhaenger-geben-sich-das-jawort-19973199.html,https://www.faz.net/aktuell/gesellschaft/menschen/russlands-hochzeit-des-jahres-zwei-putin-anhaenger-geben-sich-das-jawort-19973199.html,0,www.faz.net,Ehe in Russland: Zwei Putin-Jünger geben einander das Jawort,Der Geschäftsmann Malofejew heiratet die Kinderrechtsbeauftragte Lwowa-Belowa. Gegen sie hat der Internationale Strafgerichtshof Haftbefehl erlassen – eine neurussische Liebe.,https://media0.faz.net/ppmedia/aktuell/politik/2145127136/1.9973212/facebook_teaser_fplus/die-russische.jpg,2024-09-09T15:06:25Z,http://archive.md/20240917072243/https://www.faz.net/aktuell/gesellschaft/menschen/russlands-hochzeit-des-jahres-zwei-putin-anhaenger-geben-sich-das-jawort-19973199.html,"Man muss wohl von Russlands Hochzeit des Jahres sprechen. Sie soll am Sonntag stattgefunden haben und im Restaurant Villa Rotonda gefeiert worden sein, einem Rundbau mit Lüstern, Bögen und Säulen in … [+441 chars]",,de,'Russland'
https://www.zeit.de/news/2024-09/09/angriff-mit-schraubenzieher-20-jaehriger-schwer-verletzt,https://www.zeit.de/news/2024-09/09/angriff-mit-schraubenzieher-20-jaehriger-schwer-verletzt,0,www.zeit.de,Nach Streit: Angriff mit Schraubenzieher: 20-Jähriger schwer verletzt,Hier finden Sie Informationen zu dem Thema „Nach Streit“. Lesen Sie jetzt „Angriff mit Schraubenzieher: 20-Jähriger schwer verletzt“.,https://img.zeit.de/news/2024-09/09/angriff-mit-schraubenzieher-20-jaehriger-schwer-verletzt-image-group/wide__1300x731,2024-09-09T15:34:34Z,,"Ein 20-Jähriger ist in Gelsenkirchen bei einem Angriff mit einem Schraubenzieher schwer verletzt worden. Der Polizei zufolge gab der Mann an, sich zunächst zusammen mit einer Gruppe in einer Wohnung … [+684 chars]",,de,'Angriff'
https://www.basicthinking.de/blog/2024/09/09/besten-waermepumpen/,https://www.basicthinking.de/blog/2024/09/09/besten-waermepumpen/,0,www.basicthinking.de,Die besten Wärmepumpen? 11 Modelle im Vergleich,"Sie gelten als nachhaltig, umweltfreundlich und sind bei guter Dämmung auch wirtschaftlich: Wärmepumpen spielen beim Heizen ein immer größere Rolle. Doch nicht jedes Gerät funktioniert gleich gut. In unserem wöchentlichen Ranking zeigen wir dir deshalb elf Wä…",https://www.basicthinking.de/blog/wp-content/uploads/2024/09/besten-waermepumpen-vergleich.jpg,2024-09-09T18:00:44Z,,"Sie gelten als nachhaltig, umweltfreundlich und sind bei guter Dämmung auch wirtschaftlich: Wärmepumpen spielen beim Heizen ein immer größere Rolle. Doch nicht jedes Gerät funktioniert gleich gut. In… [+2067 chars]",,de,'Heizen'
https://www.zeit.de/news/2024-09/10/mann-in-hamburg-angeschossen-taeter-auf-der-flucht,https://www.zeit.de/news/2024-09/10/mann-in-hamburg-angeschossen-taeter-auf-der-flucht,0,www.zeit.de,Kriminalität: Mann in Hamburg angeschossen - Täter auf der Flucht,Hier finden Sie Informationen zu dem Thema „Kriminalität“. Lesen Sie jetzt „Mann in Hamburg angeschossen - Täter auf der Flucht“.,https://img.zeit.de/news/2024-09/10/mann-in-hamburg-angeschossen-taeter-auf-der-flucht-image-group/wide__1300x731,2024-09-09T22:03:16Z,,Nach einem Streit vor einem Lokal im Hamburger Schanzenviertel ist ein Mann am Abend von einem Unbekannten angeschossen worden. Mit einem Streifschuss und einer weiteren Schussverletzung im Rückenber… [+327 chars],,de,'Flucht'
https://www.n-tv.de/politik/20-52-Russischer-Oppositionspolitiker-warnt-davor-Putin-gesichtswahrenden-Ausweg-zu-ermoeglichen--article25215850.html,https://www.n-tv.de/politik/20-52-Russischer-Oppositionspolitiker-warnt-davor-Putin-gesichtswahrenden-Ausweg-zu-ermoeglichen--article25215850.html,0,www.n-tv.de,"Ukraine-Krieg im Liveticker: +++ 20:52 Russischer Oppositionspolitiker warnt davor, Putin ""gesichtswahrenden Ausweg"" zu ermöglichen +++",Lesen Sie alle aktuellen Entwicklungen und Nachrichten über den russischen Angriffskrieg auf die Ukraine im Liveticker von ntv.de.,https://bilder3.n-tv.de/img/incoming/crop25117070/4231326595-cImg_16_9-w1200/Ukraine-Liveticker.jpg,2024-09-10T04:09:06Z,,"Der führende russische Oppositionspolitiker Wladimir Kara-Mursa hat den Westen davor gewarnt, dem russischen Präsidenten Wladimir Putin einen ""gesichtswahrenden Ausweg"" aus dem Ukraine-Krieg zu gewäh… [+26134 chars]",,de,'Ukraine'
https://www.faz.net/aktuell/politik/ukraine/ukraine-liveticker-drohnenangriff-auf-russland-moskau-schliesst-flughafen-faz-19030454.html,https://www.faz.net/aktuell/politik/ukraine/ukraine-liveticker-drohnenangriff-auf-russland-moskau-schliesst-flughafen-faz-19030454.html,0,www.faz.net,Ukraine-Liveblog: Drohnenangriff auf Russland – Moskau schließt Flughafen,Britischer Geheimdienst: Große Schäden an russischer Luftwaffenbasis +++ Ukrainischer Drohnenangriff bei Wolgograd +++ CDU-Politiker Kiesewetter kritisiert Scholz: „Scheinfrieden“ +++ alle Entwicklungen im Liveblog,https://media0.faz.net/ppmedia/aktuell/politik/4137230908/1.9932556/facebook_teaser/von-der-moskwa-aus-ist-hinter.jpg,2024-09-10T05:00:04Z,,Die russische Flugabwehr hat in der Nacht offiziellen Angaben zufolge zahlreiche Drohnen mit dem Ziel Moskau abgefangen. Die Luftverteidigung habe mehr als ein Dutzend Drohnen in der Hauptstadt und i… [+1111 chars],,de,'Ukraine'
https://www.tagesschau.de/ausland/europa/ukraine-russland-drohnenangriffe-108.html,https://www.tagesschau.de/ausland/europa/ukraine-russland-drohnenangriffe-108.html,0,www.tagesschau.de,Russland meldet massive Drohnenangriffe durch Ukraine,Die Ukraine soll Russland mit mehr als 140 Drohnen angegriffen haben. Auf drei Moskauer Flughäfen wurde der Betrieb kurzzeitig gestoppt. Kanzler Scholz knüpft eine Teilnahme Russlands an einer Friedenskonferenz an Bedingungen.,https://images.tagesschau.de/image/61dcb981-6e95-4580-9d1c-24682526fcaf/AAABkdqWvCA/AAABkZLhkrw/16x9-1280/russlands-angriffe-ramenskoje-100.jpg,2024-09-10T06:19:57Z,https://web.archive.org/web/20240910081035/https://www.tagesschau.de/ausland/europa/ukraine-russland-drohnenangriffe-108.html,"Stand: 10.09.2024 08:19 Uhr
Die Ukraine soll Russland mit mehr als 140 Drohnen angegriffen haben. Auf drei Moskauer Flughäfen wurde der Betrieb kurzzeitig gestoppt. Kanzler Scholz knüpft eine Teilna… [+4002 chars]",,de,'Russland'
https://www.zeit.de/news/2024-09/10/wilhelm-raabe-preis-geht-an-schriftsteller-sa-a-stani-i,https://www.zeit.de/news/2024-09/10/wilhelm-raabe-preis-geht-an-schriftsteller-sa-a-stani-i,0,www.zeit.de,Preis der Stadt Braunschweig: Wilhelm-Raabe-Preis geht an Schriftsteller Saša Stanišić,Hier finden Sie Informationen zu dem Thema „Preis der Stadt Braunschweig“. Lesen Sie jetzt „Wilhelm-Raabe-Preis geht an Schriftsteller Saša Stanišić“.,https://img.zeit.de/news/2024-09/10/wilhelm-raabe-preis-geht-an-schriftsteller-sa-a-stani-i-image-group/wide__1300x731,2024-09-10T08:38:32Z,,"Saa Stanii wird mit dem Wilhelm Raabe-Literaturpreis ausgezeichnet. Der Schriftsteller erhält die Auszeichnung für sein Buch «Möchte die Witwe angesprochen werden, platziert sie auf dem Grab die Gieß… [+1550 chars]",,de,'Preis'
https://www.n-tv.de/politik/politik_person_der_woche/Ploetzlich-zeigt-sich-Putin-offen-fuer-Friedensgespraeche-article25216160.html,https://www.n-tv.de/politik/politik_person_der_woche/Ploetzlich-zeigt-sich-Putin-offen-fuer-Friedensgespraeche-article25216160.html,0,www.n-tv.de,Person der Woche: Wladimir Putin: Plötzlich zeigt sich Putin offen für Friedensgespräche,"Es kommt Bewegung in die Friedensdiplomatie. Sowohl die Ukraine als auch Russland signalisieren Gesprächsbereitschaft. Bundeskanzler Scholz sieht eine Chance. Der Kreml lässt wissen, es komme nun auf die USA an und stellt Bedingungen. Der Einstieg in den Krie…",https://bilder3.n-tv.de/img/incoming/crop25216278/6651329991-cImg_16_9-w1200/482032228.jpg,2024-09-10T09:12:24Z,,"Es kommt Bewegung in die Friedensdiplomatie. Sowohl die Ukraine als auch Russland signalisieren Gesprächsbereitschaft. Bundeskanzler Scholz sieht eine Chance. Der Kreml lässt wissen, es komme nun auf… [+6755 chars]",,de,'Russland'
https://www.zeit.de/news/2024-09/10/pirmasens-vorerst-keine-kriegsfluechtlinge-aus-der-ukraine,https://www.zeit.de/news/2024-09/10/pirmasens-vorerst-keine-kriegsfluechtlinge-aus-der-ukraine,0,www.zeit.de,Migration: Pirmasens: Vorerst keine Kriegsflüchtlinge aus der Ukraine,Hier finden Sie Informationen zu dem Thema „Migration“. Lesen Sie jetzt „Pirmasens: Vorerst keine Kriegsflüchtlinge aus der Ukraine“.,https://img.zeit.de/administratives/sharing/fallback-image/wide__1300x731,2024-09-10T14:50:33Z,,"Pirmasens muss vorerst keine Kriegsflüchtlinge aus der Ukraine mehr aufnehmen. Die pfälzische Kommune biete besonders vielen solcher Menschen derzeit Schutz, teilte das rheinland-pfälzische Integrati… [+523 chars]",,de,'Ukraine'
https://www.stern.de/wirtschaft/news/vw-kuendigt-tarifvertraege---entlassungen-ab-juli-2025-moeglich-35053330.html,https://www.stern.de/wirtschaft/news/vw-kuendigt-tarifvertraege---entlassungen-ab-juli-2025-moeglich-35053330.html,0,www.stern.de,Konzern-Krise: VW kündigt Tarifverträge: Entlassungen ab Juli 2025 möglich,Im Streit um die neuen Sparpläne bei VW schafft der Konzern erste Fakten: Die seit 1994 geltende Job-Garantie wurde nun aufgekündigt. Der Betriebsrat kündigt Widerstand an.,https://image.stern.de/35053368/t/1g/v2/w1440/r1.7778/-/vw-golf-arbeiter.jpg,2024-09-10T15:07:00Z,,"Im Streit um die neuen Sparpläne bei VW schafft der Konzern erste Fakten: Die seit 1994 geltende Job-Garantie wurde nun aufgekündigt. Der Betriebsrat kündigt Widerstand an.
Volkswagen hat die seit 1… [+2207 chars]",,de,'Angriff'
https://www.welt.de/wirtschaft/article253446482/VW-streicht-Job-Garantie-IG-Metall-spricht-von-beispiellosem-Angriff.html,https://www.welt.de/wirtschaft/article253446482/VW-streicht-Job-Garantie-IG-Metall-spricht-von-beispiellosem-Angriff.html,0,www.welt.de,VW streicht Job-Garantie – IG Metall spricht von „beispiellosem Angriff“,"Der kriselnde Autohersteller Volkswagen hat eine Reihe von Tarifverträgen gekündigt, darunter den sogenannten Zukunftstarifvertrag zur Beschäftigungssicherung, der betriebsbedingte Kündigungen bis 2029 ausschließt. Erste Entlassungen könnten ab Juli 2025 mögl…",https://img.welt.de/img/regionales/niedersachsen/mobile253446582/3657935087-ci16x9-w1200/Volkswagen-Sachsen-Betriebsversammlung.jpg,2024-09-10T15:09:50Z,,"Der kriselnde Autohersteller Volkswagen hat eine Reihe von Tarifverträgen gekündigt, darunter den sogenannten Zukunftstarifvertrag zur Beschäftigungssicherung, der betriebsbedingte Kündigungen bis 20… [+3119 chars]",,de,'Angriff'
https://www.bild.de/politik/ausland-und-internationales/putins-sieges-propaganda-entlarvt-hohe-verluste-aus-video-weggeschnitten-66ddb42ecb918e55decaa609,https://www.bild.de/politik/ausland-und-internationales/putins-sieges-propaganda-entlarvt-hohe-verluste-aus-video-weggeschnitten-66ddb42ecb918e55decaa609,0,www.bild.de,Schnitt-Trick fliegt auf - Peinlich! Putins Sieges-Filmchen entlarvt,Propaganda-Schlappe für Russlands diktatorische Militärführung. Zwei Perspektiven auf denselben russischen Angriff offenbare die Kreml-Propaganda.,"https://images.bild.de/66ddb42ecb918e55decaa609/15738e69371d96310032868b54b28a0e,744c7224?w=1280",2024-09-10T15:10:53Z,,Propaganda-Panne in Russlands Armee: Ein von Putins Truppen aufgenommenes Video zeigt ihre Eroberung des strategisch wichtigen Dorfes Prechystivka. Doch die Szenen hoher Verluste auf russischer Seite… [+2457 chars],,de,'Russland'
https://www.stern.de/gesellschaft/regional/hessen/angriff-in-wohnung--versuchter-totschlag----prozess-gegen-trio-gestartet-35053588.html,https://www.stern.de/gesellschaft/regional/hessen/angriff-in-wohnung--versuchter-totschlag----prozess-gegen-trio-gestartet-35053588.html,0,www.stern.de,Angriff in Wohnung: Versuchter Totschlag? - Prozess gegen Trio gestartet,"Sie sollen einen 47-Jährigen in seiner Wohnung angegriffen haben, dabei sollen auch Schüsse gefallen sein - seit Dienstag müssen sich drei Männer deshalb vor Gericht verantworten.",https://image.stern.de/35053590/t/6M/v1/w1440/r1.7778/-/10--p4ijgjdbm7v10axw800h600jpeg---809cc43f8e8499cb.jpg,2024-09-10T15:32:13Z,,"Sie sollen einen 47-Jährigen in seiner Wohnung angegriffen haben, dabei sollen auch Schüsse gefallen sein - seit Dienstag müssen sich drei Männer deshalb vor Gericht verantworten.
In dem Prozess geg… [+1816 chars]",,de,'Angriff'
https://www.zeit.de/news/2024-09/10/versuchter-totschlag-prozess-gegen-trio-gestartet,https://www.zeit.de/news/2024-09/10/versuchter-totschlag-prozess-gegen-trio-gestartet,0,www.zeit.de,Angriff in Wohnung: Versuchter Totschlag? - Prozess gegen Trio gestartet,Hier finden Sie Informationen zu dem Thema „Angriff in Wohnung“. Lesen Sie jetzt „Versuchter Totschlag? - Prozess gegen Trio gestartet“.,https://img.zeit.de/news/2024-09/10/versuchter-totschlag-prozess-gegen-trio-gestartet-image-group/wide__1300x731,2024-09-10T15:32:13Z,,In dem Prozess gegen drei Männer wegen versuchten Totschlags und gefährlicher Körperverletzung haben die Angeklagten zum Prozessauftakt vor dem Landgericht Hanau den Ablauf der vorgeworfenen Tat best… [+1666 chars],,de,'Angriff'
https://www.tagesschau.de/ausland/asien/luftangriff-schutzzone-gaza-100.html,https://www.tagesschau.de/ausland/asien/luftangriff-schutzzone-gaza-100.html,0,www.tagesschau.de,Verzweiflung nach Angriff auf Schutzzone im Gazastreifen,Das Al-Mawasi-Camp im Gazastreifen ist einer der größten Rückzugsorte für Flüchtlinge und eine ausgewiesene Schutzzone. Trotzdem soll es dort bei einem israelischen Luftangriff viele Tote und Verletzte gegeben haben. Von B. Meier.,https://images.tagesschau.de/image/7b083cc3-5cae-4f45-a1b6-3781c1931caf/AAABkdyo_9Q/AAABkZLhkrw/16x9-1280/luftangriff-schutzzone-gaza-102.jpg,2024-09-10T15:59:09Z,,"Stand: 10.09.2024 17:59 Uhr
Das Al-Mawasi-Camp im Gazastreifen ist einer der größten Rückzugsorte für Flüchtlinge und eine ausgewiesene Schutzzone. Trotzdem soll es dort bei einem israelischen Lufta… [+2939 chars]",,de,'Angriff'
https://www.focus.de/politik/zurueckweisungen-videoueberwachung-waffenverbot-mit-elf-punkte-plan-will-stuttgarter-ob-die-messergewalt-bekaempfen_id_260300599.html,https://www.focus.de/politik/zurueckweisungen-videoueberwachung-waffenverbot-mit-elf-punkte-plan-will-stuttgarter-ob-die-messergewalt-bekaempfen_id_260300599.html,0,www.focus.de,"Zurückweisungen, Videoüberwachung, Waffenverbot - Mit Elf-Punkte-Plan will Stuttgarter OB die Messergewalt bekämpfen","Wie lässt sich die Messerkriminalität in Stuttgart eindämmen? Im Rathaus ist ein Maßnahmen- und Vorschlagskatalog des Oberbürgermeisters aufgetaucht. Kann das Papier halten, was es verspricht?",https://p6.focus.de/img/regional/berlin/id_260300738/messer-symbolbild.jpg?im=Crop%3D%280%2C209%2C2048%2C1024%29%3BResize%3D%281200%2C627%29&impolicy=perceptual&quality=mediumHigh&hash=2ddb26e36ac1379e2b896fb2a25c1d99c4060eb383d892e4bff5797aa63a776e,2024-09-10T17:18:58Z,,"Mobile Videoüberwachung, persönliches Waffentrageverbot für Intensivtäter, bessere Vernetzung der Behörden und reichlich Forderungen an Bund und Land: Mit einem Elf-Punkte-Plan will Stuttgarts OB Fra… [+2963 chars]",,de,'Angriff'
https://www.stern.de/news/hamas-gesundheitsministerium--19-tote-bei-israelischem-angriff-in-humanitaerer-zone-35051100.html,https://www.stern.de/news/hamas-gesundheitsministerium--19-tote-bei-israelischem-angriff-in-humanitaerer-zone-35051100.html,0,www.stern.de,Hamas-Gesundheitsministerium: 19 Tote bei israelischem Angriff in humanitärer Zone,Bei einem israelischen Luftangriff in einer humanitären Zone im Gazastreifen sind nach Angaben des von der Hamas kontrollierten Gesundheitsministeriums mindestens 19 Menschen getötet und 60 weitere verletzt worden. Nach Angaben der israelischen Armee galt der…,https://image.stern.de/35053804/t/PW/v1/w1440/r1.7778/-/10--krater-nach-angriff-in-chan-junis---bf62b74376981951.jpg,2024-09-10T18:11:23Z,,Bei einem israelischen Luftangriff in einer humanitären Zone im Gazastreifen sind nach Angaben des von der Hamas kontrollierten Gesundheitsministeriums mindestens 19 Menschen getötet und 60 weitere v… [+3756 chars],,de,'Angriff'
https://www.n-tv.de/politik/23-22-US-Republikaner-Ukraine-soll-weitreichende-US-Waffen-in-Russland-einsetzen-duerfen--article25218535.html,https://www.n-tv.de/politik/23-22-US-Republikaner-Ukraine-soll-weitreichende-US-Waffen-in-Russland-einsetzen-duerfen--article25218535.html,0,www.n-tv.de,Ukraine-Krieg im Liveticker: +++ 23:22 US-Republikaner: Ukraine soll weitreichende US-Waffen in Russland einsetzen dürfen +++,Lesen Sie alle aktuellen Entwicklungen und Nachrichten über den russischen Angriffskrieg auf die Ukraine im Liveticker von ntv.de.,https://bilder3.n-tv.de/img/incoming/crop25117070/4231326595-cImg_16_9-w1200/Ukraine-Liveticker.jpg,2024-09-10T18:20:00Z,,"Wichtige Republikaner im US-Parlament fordern US-Präsident Biden dazu auf, der Ukraine den Einsatz weitreichender Raketensysteme gegen weitere Ziele in Russland zu erlauben. Es sei längst überfällig,… [+28356 chars]",,de,'Ukraine'
https://www.morgenpost.de/politik/article407034775/bergkarabach-armenien-aserbaidschan-konflikt-grenze-putin-erdogan.html,https://www.morgenpost.de/politik/article407034775/bergkarabach-armenien-aserbaidschan-konflikt-grenze-putin-erdogan.html,0,www.morgenpost.de,Krise im Kaukasus: „Leben hier wird nie mehr sein wie zuvor“,Seit Jahrzehnten gibt es Streit um die Grenzziehung. Zuletzt trat Armenien Gebiete ab. Bewohner der Grenzregion fürchten das Schlimmste.,https://img.sparknews.funkemedien.de/404916867/404916867_1725558848_v16_9_1600.jpeg,2024-09-10T20:08:17Z,,"Jerewan/Berlin. Seit Jahrzehnten gibt es Streit um die Grenzziehung. Zuletzt trat Armenien Gebiete ab. Bewohner der Grenzregion fürchten das Schlimmste.
Kurvenreich schlängelt sich die Straße nachKi… [+9440 chars]",,de,'Angriff'
