index,url,valid,domain,title,description,image,published,archive,content,quote,language,keyword
https://www.zeit.de/news/2023-01/04/flucht-vor-der-polizei-quadfahrer-wendet-auf-autobahn-480,https://www.zeit.de/news/2023-01/04/flucht-vor-der-polizei-quadfahrer-wendet-auf-autobahn-480,0,www.zeit.de,Gießen: Flucht vor der Polizei: Quadfahrer wendet auf Autobahn 480,,,2023-01-04T05:21:40Z,https://web.archive.org/web/20230104095702/https://www.zeit.de/news/2023-01/04/flucht-vor-der-polizei-quadfahrer-wendet-auf-autobahn-480,"When browsing with ads:
We collect personal data and also transmit it to third-party providers
 that help us improve and finance our digital content. Some of the information stored on your device, … [+732 chars]",,de,'Flucht'
https://www.stern.de/gesellschaft/regional/nordrhein-westfalen/energie--wasserstoffstrategie--lob-und-kritik-der-gaswirtschaft-33066394.html,https://www.stern.de/gesellschaft/regional/nordrhein-westfalen/energie--wasserstoffstrategie--lob-und-kritik-der-gaswirtschaft-33066394.html,0,www.stern.de,Energie: Wasserstoffstrategie: Lob und Kritik der Gaswirtschaft,"Ein Entwurf des Bundeswirtschaftsministeriums für eine Fortschreibung der Nationalen Wasserstoffstrategie stößt bei der Gaswirtschaft auf Zustimmung, aber auch Kritik. Das Ministerium setze in dem Vorschlag ""viele richtige Prioritäten"", sagte der Vorstand des…",https://image.stern.de/6681672/t/31/v5/w1440/r1.7778/-/video-fallback-image.jpg,2023-01-04T05:30:26Z,https://web.archive.org/web/20230104054255/https://www.stern.de/gesellschaft/regional/nordrhein-westfalen/energie--wasserstoffstrategie--lob-und-kritik-der-gaswirtschaft-33066394.html,"Ein Entwurf des Bundeswirtschaftsministeriums für eine Fortschreibung der Nationalen Wasserstoffstrategie stößt bei der Gaswirtschaft auf Zustimmung, aber auch Kritik. Das Ministerium setze in dem Vo… [+2397 chars]",,de,'Gas'
https://www.stern.de/gesellschaft/regional/rheinland-pfalz-saarland/industrie--ihk--nicht-ganz-so-pessimistisch--fuer-konjunktur-2023-33066408.html,https://www.stern.de/gesellschaft/regional/rheinland-pfalz-saarland/industrie--ihk--nicht-ganz-so-pessimistisch--fuer-konjunktur-2023-33066408.html,0,www.stern.de,"Industrie: IHK ""nicht ganz so pessimistisch"" für Konjunktur 2023","Politik und Behörden sind nach Ansicht der Industrie- und Handelskammer noch nicht richtig im Krisenmodus angekommen. Dort ist man oft ""coronamüde und digitalisierungsschwach"", wird kritisiert.",https://image.stern.de/6681672/t/31/v5/w1440/r1.7778/-/video-fallback-image.jpg,2023-01-04T05:35:59Z,https://web.archive.org/web/20230104054249/https://www.stern.de/gesellschaft/regional/rheinland-pfalz-saarland/industrie--ihk--nicht-ganz-so-pessimistisch--fuer-konjunktur-2023-33066408.html,"Politik und Behörden sind nach Ansicht der Industrie- und Handelskammer noch nicht richtig im Krisenmodus angekommen. Dort ist man oft ""coronamüde und digitalisierungsschwach"", wird kritisiert.
Trot… [+2543 chars]",,de,'Gas'
https://www.faz.net/aktuell/politik/ukraine-liveticker-caritas-rechnet-mit-fluechtlingswelle-18495964.html,https://www.faz.net/aktuell/politik/ukraine-liveticker-caritas-rechnet-mit-fluechtlingswelle-18495964.html,0,www.faz.net,Ukraine-Liveblog: Caritas rechnet mit Flüchtlingswelle aus Ukraine,Ukraine will auf Erneuerbare Energien setzen: „Russische Angriffe zwingen uns zu grundlegender Reform“ +++ Kurswechsel in Israel? Außenminister Sergej Lawrow und Eli Cohen telefonieren +++ alle Entwicklungen im Liveblog.,https://media0.faz.net/ppmedia/aktuell/826682854/1.8577650/facebook_teaser/ukrainische-fluechtlinge-im.jpg,2023-01-04T05:47:20Z,https://web.archive.org/web/20230104081417/https://www.faz.net/aktuell/politik/ukraine-liveticker-caritas-rechnet-mit-fluechtlingswelle-18495964.html,Nach den ukrainischen Angriffen auf eine russische Militärunterkunft in Makijiwka im Gebiet Donezk hat das Verteidigungsministerium in Moskau mehr Details zum Geschehen bekanntgegeben und Fehler eing… [+1954 chars],,de,'Angriff'
https://www.zeit.de/news/2023-01/04/erfolgreiche-flucht-vor-der-polizei-hat-einen-haken,https://www.zeit.de/news/2023-01/04/erfolgreiche-flucht-vor-der-polizei-hat-einen-haken,0,www.zeit.de,Schmalkalden-Meiningen: Erfolgreiche Flucht vor der Polizei hat einen Haken,,,2023-01-04T06:11:15Z,https://web.archive.org/web/20230104095640/https://www.zeit.de/news/2023-01/04/erfolgreiche-flucht-vor-der-polizei-hat-einen-haken,"When browsing with ads:
We collect personal data and also transmit it to third-party providers
 that help us improve and finance our digital content. Some of the information stored on your device, … [+732 chars]",,de,'Flucht'
https://www.bild.de/regional/frankfurt/frankfurt-aktuell/reiskirchen-flucht-vor-der-polizei-quad-fahrer-wendet-auf-der-autobahn-82437138.bild.html,https://www.bild.de/regional/frankfurt/frankfurt-aktuell/reiskirchen-flucht-vor-der-polizei-quad-fahrer-wendet-auf-der-autobahn-82437138.bild.html,0,www.bild.de,Flucht vor der Polizei - Quad-Fahrer wendet auf der Autobahn,Reiskirchen – Was für eine verantwortungslose Aktion: Ein Quad-Fahrer hat am späten Dienstagabend auf der Flucht vor der Polizei auf der A480 gewendet.,"https://images.bild.de/63b517b510fe5b78122dccc8/ac5759381b0985aeb9cc8f513ed1ad1c,cc82bf00?w=1280",2023-01-04T06:19:35Z,https://web.archive.org/web/20230104062754/https://www.bild.de/regional/frankfurt/frankfurt-aktuell/reiskirchen-flucht-vor-der-polizei-quad-fahrer-wendet-auf-der-autobahn-82437138.bild.html,Reiskirchen Was für eine verantwortungslose Aktion: Ein Quad-Fahrer hat am späten Dienstagabend auf der Flucht vor der Polizei auf der A480 in Hessen gewendet und ist gegen die Fahrtrichtung geflohen… [+779 chars],,de,'Gas'
https://www.faz.net/aktuell/wirtschaft/unternehmen/kirsten-fust-soll-hamburgs-energieversorgung-retten-18576492.html,https://www.faz.net/aktuell/wirtschaft/unternehmen/kirsten-fust-soll-hamburgs-energieversorgung-retten-18576492.html,0,www.faz.net,Kirsten Fust soll Hamburgs Energieversorgung retten,"Als die Chefin der Hamburger Energiewerke jung war, rebellierten Öko-Bewegte noch gegen Atomkraft. Heute hat die Elektro-Ingenieurin Verantwortung für den Klimaschutz.",https://media1.faz.net/ppmedia/aktuell/2757356472/1.8576489/facebook_teaser_fplus/kirsten-fust-chefin-der.jpg,2023-01-04T06:23:39Z,https://web.archive.org/web/20230104062531/http://www.faz.net/aktuell/wirtschaft/unternehmen/kirsten-fust-soll-hamburgs-energieversorgung-retten-18576492.html,"Zum Pressetermin hat Kirsten Fust einen Schwamm mitgebracht, groß wie ein Brotlaib. Die technische Geschäftsführerin der Hamburger Energiewerke nutzt gern den Vergleich mit Alltagsgegenständen, wenn … [+636 chars]",,de,'Klima'
https://www.wiwo.de/finanzen/immobilien/trotz-preisrueckgang-im-grosshandel-warum-gas-fuer-verbraucher-erstmal-nicht-guenstiger-wird/28900578.html,https://www.wiwo.de/finanzen/immobilien/trotz-preisrueckgang-im-grosshandel-warum-gas-fuer-verbraucher-erstmal-nicht-guenstiger-wird/28900578.html,0,www.wiwo.de,Trotz Preisrückgang im Großhandel: Warum Gas für Verbraucher erstmal nicht günstiger wird,"Während die Großhandelspreise für Gas einbrechen, wird es für Haushalte nur moderat preiswerter. Das liegt vor allem an den lange laufenden Lieferverträgen der Versorger.",https://www.wiwo.de/images/gasherd-mit-flamme/28900590/4-format11240.jpg,2023-01-04T06:40:18Z,,Der Gaspreis bewegt die Nation: Zum 1. Januar flatterten vielen privaten Haushalten saftige Preiserhöhungen ins Haus. Auch deshalb griff Bundeskanzler Olaf Scholz (SPD) den Gaspreis in seiner Neujahr… [+8312 chars],,de,'heizen'
https://www.n-tv.de/wirtschaft/Kohle-Comeback-macht-CO-Einsparungen-zunichte-article23820749.html,https://www.n-tv.de/wirtschaft/Kohle-Comeback-macht-CO-Einsparungen-zunichte-article23820749.html,0,www.n-tv.de,Ausbau der Erneuerbaren zu lahm: Kohle-Comeback macht CO₂-Einsparungen zunichte,Der Ausbau der Erneuerbaren Energien geht einer neuen Studie zufolge voran - für die selbst gesteckten Klimaziele der Ampel-Regierung jedoch noch viel zu langsam. Auch gehen die CO₂-Emission nicht zurück. Grund ist das kurzfristige Wiederhochfahren der Kohlev…,https://bilder4.n-tv.de/img/incoming/crop23820759/3651325436-cImg_16_9-w1200/390004064.jpg,2023-01-04T07:05:33Z,,Der Ausbau der Erneuerbaren Energien geht einer neuen Studie zufolge voran - für die selbst gesteckten Klimaziele der Ampel-Regierung jedoch noch viel zu langsam. Auch gehen die CO-Emission nicht zur… [+5506 chars],,de,'Klima'
https://www.faz.net/aktuell/politik/ausland/russland-gibt-den-toten-die-schuld-nach-angriff-von-makijiwka-18577580.html,https://www.faz.net/aktuell/politik/ausland/russland-gibt-den-toten-die-schuld-nach-angriff-von-makijiwka-18577580.html,0,www.faz.net,Verluste auf russischer Seite: Moskau gibt den Toten die Schuld,Russlands Verteidigungsministerium erhöht nach dem ukrainischen Angriff von Makijiwka die bisher genannte Zahl der Getöteten – und weist diesen die Verantwortung zu. Es geht um Schadenbegrenzung.,https://media1.faz.net/ppmedia/aktuell/3457429019/1.8577591/facebook_teaser/eine-gedenkveranstaltung-fuer.jpg,2023-01-04T07:22:10Z,https://web.archive.org/web/20230104104712/https://www.faz.net/aktuell/politik/ausland/russland-gibt-den-toten-die-schuld-nach-angriff-von-makijiwka-18577580.html,"Russlands Verteidigungsministerium hat eine eigene Erklärung zum tragischen Geschehen, so die Formel, von Makijiwka abgegeben. Eine in der Nacht auf Mittwoch auf Telegram veröffentliche Meldung gibt … [+4066 chars]",,de,'Angriff'
https://www.t-online.de/nachrichten/ukraine/id_100105808/ukraine-krieg-im-jahr-2023-putin-am-ende-erst-dann-schweigen-die-waffen.html,https://www.t-online.de/nachrichten/ukraine/id_100105808/ukraine-krieg-im-jahr-2023-putin-am-ende-erst-dann-schweigen-die-waffen.html,0,www.t-online.de,Ukraine-Krieg im Jahr 2023: Putin am Ende? Erst dann schweigen die Waffen - t-online,"<ol><li>Ukraine-Krieg im Jahr 2023: Putin am Ende? Erst dann schweigen die Waffen  t-online
</li><li>Ukraine-Krieg: Munition für den Frieden | ZEIT ONLINE  Die Zeit
</li><li>Ukraine-Krieg: Putin am Ende? Dann schweigen die Waffen  t-online
</li><li>Mehr zu…",https://images.t-online.de/2022/12/MytpkjB0oOa2/0x0:1920x1080/fit-in/1800x0/ein-russischer-raketenwerfer.jpg,2023-01-04T08:07:01Z,https://web.archive.org/web/20230104104316/https://www.t-online.de/nachrichten/ukraine/id_100105808/ukraine-krieg-im-jahr-2023-putin-am-ende-erst-dann-schweigen-die-waffen.html,"Der blutige Abnutzungskrieg in der Ukraine geht auch im Jahr 2023 weiter. Doch wie lange kann Russland seinen Angriff noch fortsetzen? Vier Prognosen. 
Sie sind wütend und schwören blutige Rache. Di… [+4493 chars]",,de,'Ukraine'
https://www.faz.net/aktuell/politik/ukraine-liveticker-russen-berichten-von-abgewehrtem-angriff-auf-die-krim-18495964.html,https://www.faz.net/aktuell/politik/ukraine-liveticker-russen-berichten-von-abgewehrtem-angriff-auf-die-krim-18495964.html,0,www.faz.net,Ukraine-Liveblog: Russen berichten von abgewehrtem Drohnenangriff auf die Krim,Caritas rechnet mit Flüchtlingswelle aus Ukraine +++ Ukraine will auf Erneuerbare Energien setzen +++ Kurswechsel in Israel? Außenminister Lawrow und Cohen telefonieren +++ alle Entwicklungen im Liveblog.,https://www.faz.net/img/faznet_logo_facebook_share.jpg?fb=1,2023-01-04T08:19:12Z,https://web.archive.org/web/20230104085112/https://www.faz.net/aktuell/politik/ukraine-liveticker-russen-berichten-von-abgewehrtem-angriff-auf-die-krim-18495964.html,Nach den ukrainischen Angriffen auf eine russische Militärunterkunft in Makijiwka im Gebiet Donezk hat das Verteidigungsministerium in Moskau mehr Details zum Geschehen bekanntgegeben und Fehler eing… [+1954 chars],,de,'Ukraine'
https://www.dw.com/de/goldene-zeit-f%C3%BCr-geothermie-tiefengeothermie-fernw%C3%A4rme-heizen-w%C3%A4rmepumpe-st%C3%A4dte/a-63930727,https://www.dw.com/de/goldene-zeit-f%C3%BCr-geothermie-tiefengeothermie-fernw%C3%A4rme-heizen-w%C3%A4rmepumpe-st%C3%A4dte/a-63930727,0,www.dw.com,Goldene Zeit für Geothermie?,"Erdgas ist klimaschädlich und seit Russlands Krieg teuer. Erdwärme wäre eine günstige und umweltfreundliche Alternative. Beginnt nun das goldene Zeitalter für Geothermie? Seit wann gibt es Geothermie?

In der Mitte unserer Erde ist es so heiß wie auf der Sonn…",https://static.dw.com/image/63929837_6.jpg,2023-01-04T08:49:00Z,https://web.archive.org/web/20230104093809/https://www.dw.com/de/goldene-zeit-f%C3%BCr-geothermie-tiefengeothermie-fernw%C3%A4rme-heizen-w%C3%A4rmepumpe-st%C3%A4dte/a-63930727,"Seit wann gibt es Geothermie?
In der Mitte unserer Erde ist es so heiß wie auf der Sonne, rund 6000 Grad. 2000 bis 5000 Meter tief unter der Erdoberfläche sind es dann noch 60 bis 200 Grad und in Vu… [+6619 chars]",,de,'Heizen'
https://www.focus.de/wissen/natur/wissen-umwelt-goldene-zeit-fuer-geothermie_id_182121341.html,https://www.focus.de/wissen/natur/wissen-umwelt-goldene-zeit-fuer-geothermie_id_182121341.html,0,www.focus.de,Umweltfreundliche Gas-Alternative - Goldene Zeit für Geothermie?,Erdgas ist klimaschädlich und seit Russlands Krieg teuer. Erdwärme wäre eine günstige und umweltfreundliche Alternative. Beginnt nun das goldene Zeitalter für Geothermie?,https://p6.focus.de/img/wissen/natur/id_182121320/mit-98-grad-heissem-wasser-aus-2400-metern-tiefe-heizen-ueber-6000-buerger-in-neustadt-glewe-bei-schwerin-ihre-haeuser.jpg?im=Crop%3D%280%2C29%2C940%2C470%29%3BResize%3D%281200%2C627%29&impolicy=perceptual&quality=medium&hash=cc743b99b4f56de29ff66c99cc24803f0feb1cbf32e5f3aac39f641be88f9cf4,2023-01-04T09:10:07Z,https://web.archive.org/web/20230104155444/https://www.focus.de/wissen/natur/wissen-umwelt-goldene-zeit-fuer-geothermie_id_182121341.html,"Seit wann gibt es Geothermie?
In der Mitte unserer Erde ist es so heiß wie auf der Sonne, rund 6000 Grad. 2000 bis 5000 Meter tief unter der Erdoberfläche sind es dann noch 60 bis 200 Grad und in Vu… [+6208 chars]",,de,'Heizen'
https://www.zeit.de/news/2023-01/04/verdacht-auf-mordversuch-frau-nach-angriff-in-psychiatrie,https://www.zeit.de/news/2023-01/04/verdacht-auf-mordversuch-frau-nach-angriff-in-psychiatrie,0,www.zeit.de,Kriminalität: Verdacht auf Mordversuch: Frau nach Angriff in Psychiatrie,,,2023-01-04T10:05:12Z,,"When browsing with ads:
We collect personal data and also transmit it to third-party providers
 that help us improve and finance our digital content. Some of the information stored on your device, … [+732 chars]",,de,'Angriff'
https://www.focus.de/finanzen/news/nicht-alle-hausbesitzer-betroffen-2023-muessen-heizungen-ausgetauscht-werden-ist-ihre-dabei_id_180903244.html,https://www.focus.de/finanzen/news/nicht-alle-hausbesitzer-betroffen-2023-muessen-heizungen-ausgetauscht-werden-ist-ihre-dabei_id_180903244.html,0,www.focus.de,Nicht alle Hausbesitzer betroffen - 2023 müssen Heizungen ausgetauscht werden - ist Ihre dabei?,"Wer eine Öl- oder Gasheizung besitzt, muss die Anlage früher oder später erneuern oder sanieren lassen. In vielen Fällen ist das sogar verpflichtend. FOCUS online sagt, wer seine Heizung 2023 austauschen muss.",https://p6.focus.de/img/regional/thueringen/id_50030151/ein-gaszaehler-haengt-im-keller-eines-einfamilienhauses..jpg?im=Crop%3D%280%2C171%2C2048%2C1024%29%3BResize%3D%281200%2C627%29&impolicy=perceptual&quality=medium&hash=f752843de6c86667f32ab40f13fb0155e70f80912965f2802c823aeaab88f06a,2023-01-04T10:34:16Z,https://web.archive.org/web/20230104112247/https://www.focus.de/finanzen/news/nicht-alle-hausbesitzer-betroffen-2023-muessen-heizungen-ausgetauscht-werden-ist-ihre-dabei_id_180903244.html,"Wer eine Öl- oder Gasheizung besitzt, muss die Anlage früher oder später erneuern oder sanieren lassen. In vielen Fällen ist das sogar verpflichtend. FOCUS online sagt, wer seine Heizung 2023 austaus… [+5403 chars]",,de,'Gas'
https://www.stern.de/wirtschaft/news/klimakrise--denkfabrik--deutschland-zu-langsam-beim-erneuerbaren-ausbau-33067596.html,https://www.stern.de/wirtschaft/news/klimakrise--denkfabrik--deutschland-zu-langsam-beim-erneuerbaren-ausbau-33067596.html,0,www.stern.de,Klimakrise: Denkfabrik: Deutschland zu langsam beim Erneuerbaren-Ausbau,"Die Bundesregierung tut viel zur Sicherung der Energieversorgung. Aber tut sie auch genug für das Klima? Eine aktuelle Untersuchung zeigt, wo Deutschland mit Blick auf selbst gesteckte Ziele steht.",https://image.stern.de/33067598/t/EK/v1/w1440/r1.7778/-/04--urnnewsmldpacom2009010123010499100226v3w800h600l640t384r1920b1152jpeg---1aea8b41e5d33fa4.jpg,2023-01-04T11:15:05Z,https://web.archive.org/web/20230104113018/https://www.stern.de/wirtschaft/news/klimakrise--denkfabrik--deutschland-zu-langsam-beim-erneuerbaren-ausbau-33067596.html,"Die Bundesregierung tut viel zur Sicherung der Energieversorgung. Aber tut sie auch genug für das Klima? Eine aktuelle Untersuchung zeigt, wo Deutschland mit Blick auf selbst gesteckte Ziele steht.
… [+4184 chars]",,de,'Klima'
https://www.morgenpost.de/wirtschaft/article237285989/Denkfabrik-Deutschland-zu-langsam-beim-Erneuerbaren-Ausbau.html,https://www.morgenpost.de/wirtschaft/article237285989/Denkfabrik-Deutschland-zu-langsam-beim-Erneuerbaren-Ausbau.html,0,www.morgenpost.de,Klimakrise: Denkfabrik: Deutschland zu langsam beim Erneuerbaren-Ausbau,"Die Bundesregierung tut viel zur Sicherung der Energieversorgung. Aber tut sie auch genug für das Klima? Eine aktuelle Untersuchung zeigt, wo Deutschland mit Blick auf selbst gesteckte Ziele steht.",https://img.morgenpost.de/img/wirtschaft/crop237285987/1712601297-w820-cv16_9-q85/Windkraft-und-Solarenergie.jpg,2023-01-04T11:28:50Z,https://web.archive.org/web/20230104113434/https://www.morgenpost.de/wirtschaft/article237285989/Denkfabrik-Deutschland-zu-langsam-beim-Erneuerbaren-Ausbau.html,Berlin. Zur Erreichung seiner selbst gesetzten Ziele muss Deutschland den Ausbau erneuerbarer Energien erheblich beschleunigen. Bei Solaranlagen müsste sich die Zubau-Geschwindigkeit nach Berechnunge… [+3977 chars],,de,'Heizen'
https://www.zeit.de/news/2023-01/04/taeter-nach-geldautomatensprengung-weiterhin-auf-der-flucht,https://www.zeit.de/news/2023-01/04/taeter-nach-geldautomatensprengung-weiterhin-auf-der-flucht,0,www.zeit.de,Kriminalität: Täter nach Geldautomatensprengung weiterhin auf der Flucht,,,2023-01-04T11:46:39Z,https://web.archive.org/web/20230104120854/https://www.zeit.de/news/2023-01/04/taeter-nach-geldautomatensprengung-weiterhin-auf-der-flucht,"When browsing with ads:
We collect personal data and also transmit it to third-party providers
 that help us improve and finance our digital content. Some of the information stored on your device, … [+732 chars]",,de,'Flucht'
https://www.wiwo.de/politik/deutschland/co2-bilanz-deutschland-verfehlt-seine-klimaziele-fuer-2022/28904326.html,https://www.wiwo.de/politik/deutschland/co2-bilanz-deutschland-verfehlt-seine-klimaziele-fuer-2022/28904326.html,0,www.wiwo.de,Energie: Deutschland verfehlt seine Klimaziele für 2022,"Die Bundesregierung tut viel zur Sicherung der Energieversorgung. Aber tut sie auch genug für das Klima? Eine aktuelle Untersuchung zeigt, wo Deutschland mit Blick auf selbst gesteckte Ziele steht.",https://www.wiwo.de/images/windkraft-und-solarenergie/28904324/1-format11240.jpg,2023-01-04T12:12:17Z,https://web.archive.org/web/20230104123257/https://www.wiwo.de/politik/deutschland/co2-bilanz-deutschland-verfehlt-seine-klimaziele-fuer-2022/28904326.html,Zur Erreichung seiner selbst gesetzten Ziele muss Deutschland den Ausbau erneuerbarer Energien erheblich beschleunigen. Bei Solaranlagen müsste sich die Zubau-Geschwindigkeit nach Berechnungen der De… [+4511 chars],,de,'Heizen'
https://www.tagesschau.de/ausland/amerika/kuba-massenflucht-101.html,https://www.tagesschau.de/ausland/amerika/kuba-massenflucht-101.html,0,www.tagesschau.de,Krise in Kuba: Ein historischer Massenexodus,Kuba leidet unter der schlimmsten Wirtschaftskrise seit den 1990er-Jahren. Allein in den vergangenen zwölf Monaten haben mindestens 200.000 Menschen das Land verlassen - auch wegen der staatlichen Repression. <em>Von C. F. Moebus.</em>,https://www.tagesschau.de/multimedia/bilder/migranten-kuba-103~_v-original.jpg,2023-01-04T13:43:32Z,https://web.archive.org/web/20230104134426/http://www.tagesschau.de/ausland/amerika/kuba-massenflucht-101.html,Kuba leidet unter der schlimmsten Wirtschaftskrise seit den 1990er-Jahren. Allein in den vergangenen zwölf Monaten haben mindestens 200.000 Menschen das Land verlassen - auch wegen der staatlichen Re… [+3432 chars],,de,'Krise'
https://www.welt.de/wirtschaft/article243026557/Bundesnetzagentur-Stromverbrauch-sinkt-um-vier-Prozent.html,https://www.welt.de/wirtschaft/article243026557/Bundesnetzagentur-Stromverbrauch-sinkt-um-vier-Prozent.html,0,www.welt.de,Stromverbrauch sinkt um vier Prozent – Erzeugung von grünem Strom steigt,"Der deutsche Stromverbrauch ist im vergangenen Jahr leicht gesunken. Gleichzeitig stieg die Produktion aus erneuerbaren Quellen kräftig. Die Energie aus Solar, Wind, Braun- und Steinkohle glich dabei den starken Rückgang der Stromproduktion mit Atomkraft aus.",https://img.welt.de/img/newsticker/dpa_nt/infoline_nt/wirtschaft_nt/mobile243025289/5211358267-ci16x9-w1200/Windraeder-hinter-Stromleitungen.jpg,2023-01-04T14:24:14Z,,"In Deutschland sind im vergangenen Jahr vier Prozent weniger Strom verbraucht worden als im Vorjahr. Die Netzlast betrug über das Jahr 484,2 Terawattstunden, wie die Bundesnetzagentur in Bonn am Mitt… [+1761 chars]",,de,'Atomkraft'
https://www.faz.net/aktuell/politik/ukraine-liveticker-putin-stellt-hyperschallraketen-auf-kriegsschiff-in-dienst-18495964.html,https://www.faz.net/aktuell/politik/ukraine-liveticker-putin-stellt-hyperschallraketen-auf-kriegsschiff-in-dienst-18495964.html,0,www.faz.net,Ukraine-Liveblog: Putin stellt Hyperschallraketen auf Kriegsschiff in Dienst,Russen berichten von abgewehrtem Drohnenangriff auf die Krim +++ Caritas rechnet mit Flüchtlingswelle aus Ukraine +++ Ukraine will auf Erneuerbare Energien setzen +++ alle Entwicklungen im Liveblog.,https://media0.faz.net/ppmedia/aktuell/4276426104/1.8578548/facebook_teaser/dieses-foto-das-die-staatliche.jpg,2023-01-04T14:27:42Z,,Nach den ukrainischen Angriffen auf eine russische Militärunterkunft in Makijiwka im Gebiet Donezk hat das Verteidigungsministerium in Moskau mehr Details zum Geschehen bekanntgegeben und Fehler eing… [+1954 chars],,de,'Ukraine'
https://www.n-tv.de/politik/Habeck-sieht-Verkehr-als-groesstes-Klima-Problem-article23821854.html,https://www.n-tv.de/politik/Habeck-sieht-Verkehr-als-groesstes-Klima-Problem-article23821854.html,0,www.n-tv.de,CO₂-Einsparung 2022 zu niedrig: Habeck sieht Verkehr als größtes Klima-Problem,"Der verstärkte Einsatz von Kohlekraftwerken als Gas-Ersatz und der Verkehrssektor bescheren Deutschland in 2022 eine schlechte CO₂-Bilanz. Während Wirtschaftsminister Habeck sich den Verkehr vorknöpft, fühlt sich die FDP in ihrer Haltung zur Atomkraft bestäti…",https://bilder2.n-tv.de/img/incoming/crop23821901/7121324368-cImg_16_9-w1200/389275820.jpg,2023-01-04T14:31:20Z,https://web.archive.org/web/20230104145739/https://www.n-tv.de/politik/Habeck-sieht-Verkehr-als-groesstes-Klima-Problem-article23821854.html,Der verstärkte Einsatz von Kohlekraftwerken als Gas-Ersatz und der Verkehrssektor bescheren Deutschland in 2022 eine schlechte CO-Bilanz. Während Wirtschaftsminister Habeck sich den Verkehr vorknöpft… [+2445 chars],,de,'Atomkraft'
https://www.focus.de/finanzen/energiekrise-in-deutschland-der-gaspreis-sinkt-aber-verbraucher-warten-weiter-auf-entlastung_id_182126287.html,https://www.focus.de/finanzen/energiekrise-in-deutschland-der-gaspreis-sinkt-aber-verbraucher-warten-weiter-auf-entlastung_id_182126287.html,0,www.focus.de,"Energiekrise in Deutschland - Der Gaspreis sinkt, aber Verbraucher warten weiter auf Entlastung","Nicht nur für Strom müssen Verbraucherinnen und Verbraucher in Deutschland seit Jahresbeginn tiefer in die Tasche greifen, auch Gas wurde mit dem Beginn des Krieges in der Ukraine immer teuer. Am Gasmarkt fällt der Preis nun auf einen Tiefstand. Private Haush…",https://p6.focus.de/img/fotos/id_182124987/europaeischer-gaspre-76473797.jpg?im=Crop%3D%280%2C411%2C3464%2C1732%29%3BResize%3D%281200%2C627%29&impolicy=perceptual&quality=medium&hash=56e6636e93c99ab6614835eaf7d4eeafa6468fc0f2f76ac31758cfa5ed90e2d0,2023-01-04T14:38:35Z,https://web.archive.org/web/20230104152446/https://www.focus.de/finanzen/energiekrise-in-deutschland-der-gaspreis-sinkt-aber-verbraucher-warten-weiter-auf-entlastung_id_182126287.html,"Nicht nur für Strom müssen Verbraucherinnen und Verbraucher in Deutschland seit Jahresbeginn tiefer in die Tasche greifen, auch Gas wurde mit dem Beginn des Krieges in der Ukraine immer teuer. Am Gas… [+5997 chars]",,de,'Preis'
https://www.faz.net/aktuell/politik/ausland/bulgariens-gasversorgung-ohne-russland-putins-plan-ging-nicht-auf-18576429.html,https://www.faz.net/aktuell/politik/ausland/bulgariens-gasversorgung-ohne-russland-putins-plan-ging-nicht-auf-18576429.html,0,www.faz.net,Gasversorgung in Bulgarien: Es geht auch ohne Russland,"Im April hat Putin Bulgarien das Gas abgedreht. Sein Machtspiel aber ging nicht auf. Dafür sorgten die EU, die USA, ein türkischer Autokrat, ein kaukasischer Diktator und internationale Energiekonzerne.",https://media0.faz.net/ppmedia/aktuell/2226125807/1.8576470/facebook_teaser/hoechste-prioritaet-im-oktober.jpg,2023-01-04T14:51:05Z,https://web.archive.org/web/20230104150609/http://www.faz.net/aktuell/politik/ausland/bulgariens-gasversorgung-ohne-russland-putins-plan-ging-nicht-auf-18576429.html,"Höchste Priorität: Im Oktober ging der Interkonnektor zwischen Griechenland und Bulgarien in Betrieb (hier eine Baustelle im griechischen Komotini im März) Bild: Bloomberg
Im April hat Putin Bulgari… [+2964 chars]",,de,'Russland'
