index,url,valid,domain,title,description,image,published,archive,content,quote,language,keyword
https://www.zeit.de/news/2025-01/05/medien-ukraine-hat-2024-rund-3600-quadratkilometer-verloren,https://www.zeit.de/news/2025-01/05/medien-ukraine-hat-2024-rund-3600-quadratkilometer-verloren,0,www.zeit.de,Russlands Angriffskrieg: Medien: Ukraine hat 2024 rund 3600 Quadratkilometer verloren,Hier finden Sie Informationen zu dem Thema „Russlands Angriffskrieg“. Lesen Sie jetzt „Medien: Ukraine hat 2024 rund 3600 Quadratkilometer verloren“.,https://img.zeit.de/news/2025-01/05/medien-ukraine-hat-2024-rund-3600-quadratkilometer-verloren-image-group/wide__1300x731,2025-01-05T08:53:49Z,,"Russland hat Medienberichten aus Kiew zufolge im vergangenen Jahr fast 3600 Quadratkilometer ukrainischen Gebiets erobert - eine Fläche fast 1,5-mal so groß wie das Saarland. Die höchsten Gebietsverl… [+1068 chars]",,de,'Ukraine'
https://www.faz.net/aktuell/politik/ukraine/ukraine-liveticker-ukraine-hat-neue-offensive-in-kursk-begonnen-faz-110172806.html,https://www.faz.net/aktuell/politik/ukraine/ukraine-liveticker-ukraine-hat-neue-offensive-in-kursk-begonnen-faz-110172806.html,0,www.faz.net,Ukraine-Liveblog: Ukraine hat neue Offensive in Kursk begonnen,Russische Armee: „Angriff abgewehrt“ +++ Blinken: Haben Ukraine vor Kriegsbeginn mit Waffen beliefert +++ Selenskyj: Schwere Verluste bei russischen und nordkoreanischen Truppen +++ alle Entwicklungen im Liveblog,https://media1.faz.net/ppmedia/aktuell/382269661/1.10212097/facebook_teaser/ukrainische-soldaten-nahe-der.jpg,2025-01-05T11:07:35Z,https://web.archive.org/web/20250105130714/https://www.faz.net/aktuell/politik/ukraine/ukraine-liveticker-ukraine-hat-neue-offensive-in-kursk-begonnen-faz-110172806.html,"Im Gebiet Kursk seien die Russen überrascht worden, ukrainische Angriffe liefen in mehrere Richtungen, sagte Andrij Kowalenko, der Leiter des Zentrums für die Bekämpfung von Desinformation beim Siche… [+852 chars]",,de,'Ukraine'
https://www.faz.net/aktuell/politik/ukraine/ukraine-liveticker-ukraine-hat-wohl-neue-offensive-in-kursk-begonnen-faz-110172806.html,https://www.faz.net/aktuell/politik/ukraine/ukraine-liveticker-ukraine-hat-wohl-neue-offensive-in-kursk-begonnen-faz-110172806.html,0,www.faz.net,Ukraine-Liveblog: Ukraine hat wohl neue Offensive in Kursk begonnen,Kiew: Russen sind überrascht worden +++ Blinken: Haben Ukraine vor Kriegsbeginn mit Waffen beliefert +++ Selenskyj: Schwere Verluste bei russischen und nordkoreanischen Truppen +++ alle Entwicklungen im Liveblog,https://media1.faz.net/ppmedia/aktuell/382269661/1.10212097/facebook_teaser/ukrainische-soldaten-nahe-der.jpg,2025-01-05T11:07:35Z,https://web.archive.org/web/20250108153943/https://www.faz.net/aktuell/politik/ukraine/ukraine-liveticker-ukraine-hat-wohl-neue-offensive-in-kursk-begonnen-faz-110172806.html,"Als Beispiele nannte Blinken Stinger-Flugabwehrraketen und Panzerabwehrwaffen vom Typ Javelin. Die Waffen hätten entscheidend dazu beigetragen, Russland daran zu hindern, Kiew einzunehmen, das Land z… [+412 chars]",,de,'Ukraine'
https://www.tagesschau.de/newsticker/liveblog-ukraine-sonntag-512.html,https://www.tagesschau.de/newsticker/liveblog-ukraine-sonntag-512.html,0,www.tagesschau.de,Ukraine-Liveblog: ++ Ukraine startet neue Offensive in Kursk ++,Die ukrainische Armee hat in der russischen Region Kursk eine neue Offensive gestartet. In der Nacht gab es ukrainischen Angaben zufolge 103 russische Drohnenangriffe. Die Entwicklungen im Liveblog.,https://images.tagesschau.de/image/5b073b67-29bf-4703-b6b1-71469e4c25bb/AAABjz78AfM/AAABkZLhkrw/16x9-1280/flagge-ukraine-truemmer-101.jpg,2025-01-05T11:09:36Z,https://web.archive.org/web/20250106011445/https://www.tagesschau.de/newsticker/liveblog-ukraine-sonntag-512.html,"Stand: 05.01.2025 12:09 Uhr
Die ukrainische Armee hat in der russischen Region Kursk eine neue Offensive gestartet. In der Nacht gab es ukrainischen Angaben zufolge 103 russische Drohnenangriffe. Di… [+2928 chars]",,de,'Ukraine'
https://www.tagesspiegel.de/internationales/mit-stacheldraht-und-soldaten-panama-sperrt-darien-dschungel-als-fluchtroute-12867823.html,https://www.tagesspiegel.de/internationales/mit-stacheldraht-und-soldaten-panama-sperrt-darien-dschungel-als-fluchtroute-12867823.html,0,www.tagesspiegel.de,Mit Stacheldraht und Soldaten: Panama sperrt Darién-Dschungel als Fluchtroute,"Panamas Präsident Mulino versprach, die Route Richtung USA zu „schließen“. Die Zahl der Geflüchteten soll dadurch deutlich gesunken sein. Was heißt das für die Menschen?",https://www.tagesspiegel.de/images/12869653/alternates/BASE_16_9_W1400/1734126530000/files-panama-us-migration-children.jpeg,2025-01-05T11:29:44Z,http://archive.md/20250105133641/https://www.tagesspiegel.de/internationales/mit-stacheldraht-und-soldaten-panama-sperrt-darien-dschungel-als-fluchtroute-12867823.html,"Mit diesem Satz im Wahlkampf um die panamaische Präsidentschaft im April 2023 erregte José Raúl Mulino großes Aufsehen: Wir werden den Darién schließen.
Die Tagesspiegel-App Aktuelle Nachrichten, Hi… [+6375 chars]",,de,'Flucht'
https://www.zeit.de/politik/ausland/2025-01/ukraine-krieg-kursk-neue-gegenoffensive,https://www.zeit.de/politik/ausland/2025-01/ukraine-krieg-kursk-neue-gegenoffensive,0,www.zeit.de,Krieg in der Ukraine: Ukraine startet unerwartete Gegenoffensive im russischen Gebiet Kursk,Die Ukraine steht militärisch unter Druck. Nun hat das Militär überraschend einen Vorstoß in Kursk gemeldet. Russische Medien dementieren ein Vorrücken der Ukrainer.,https://img.zeit.de/politik/ausland/2025-01/ukraine-kursk-gegenoffensive-russland-bild/wide__1300x731,2025-01-05T11:59:15Z,https://web.archive.org/web/20250105124937/https://www.zeit.de/politik/ausland/2025-01/ukraine-krieg-kursk-neue-gegenoffensive,"Die unter Druck geratenen ukrainischen Streitkräfte haben im westrussischen Gebiet Kursk überraschend eine neue Offensive gestartet. ""Gebiet Kursk, gute Nachrichten: Russland erhält das, was es verdi… [+3619 chars]",,de,'Ukraine'
https://www.tagesspiegel.de/potsdam/mehrere-menschen-verletzt-55-jahriger-verursacht-vier-unfalle-12962656.html,https://www.tagesspiegel.de/potsdam/mehrere-menschen-verletzt-55-jahriger-verursacht-vier-unfalle-12962656.html,0,www.tagesspiegel.de,Mehrere Menschen verletzt: 55-Jähriger verursacht vier Unfälle,"Betrunken und ohne Führerschein baute ein Mann am Samstag einen Unfall. Als die Polizei alarmiert werden sollte, geriet er in Panik. Auf der Flucht verursachte er drei weitere Unfälle.",https://www.tagesspiegel.de/images/12963118/alternates/BASE_16_9_W1400/1736082761000/illustration-polizei.jpeg,2025-01-05T13:21:39Z,,"Betrunken und ohne Führerschein hat ein 55-Jähriger am frühen Samstagabend in Potsdam vier Unfälle verursacht und dabei mehrere Personen leicht verletzt. Wie die Polizei mitteilte, war der Mann zwisc… [+1120 chars]",,de,'Flucht'
https://www.n-tv.de/wirtschaft/Unabhaengig-von-Moskau-ist-Europa-noch-lange-nicht-article25465149.html,https://www.n-tv.de/wirtschaft/Unabhaengig-von-Moskau-ist-Europa-noch-lange-nicht-article25465149.html,0,www.n-tv.de,Kein Gas mehr über die Ukraine: Unabhängig von Moskau ist Europa noch lange nicht,Mit dem Ende des Transit-Abkommens bezieht Europa zum ersten Mal seit dem Kalten Krieg kein russisches Gas mehr über die Pipelines in der Ukraine. Aber am Tropf des Kremls hängt Deutschland trotzdem noch eine Weile - auch weil heimliche Energielieferungen wei…,https://bilder1.n-tv.de/img/incoming/crop25465180/764132488-cImg_16_9-w1200/2023-06-04T000000Z-824316448-RC2GC1A0MK72-RTRMADP-3-OIL-OPEC-RUSSIA-KREMLIN.jpg,2025-01-05T15:07:08Z,,Mit dem Ende des Transit-Abkommens bezieht Europa zum ersten Mal seit dem Kalten Krieg kein russisches Gas mehr über die Pipelines in der Ukraine. Aber am Tropf des Kremls hängt Deutschland trotzdem … [+4502 chars],,de,'Gas'
https://www.zeit.de/news/2025-01/05/syrskyj-drohnen-werden-immer-wichtiger,https://www.zeit.de/news/2025-01/05/syrskyj-drohnen-werden-immer-wichtiger,0,www.zeit.de,Krieg in der Ukraine: Syrskyj: Drohnen werden immer wichtiger,Hier finden Sie Informationen zu dem Thema „Krieg in der Ukraine“. Lesen Sie jetzt „Syrskyj: Drohnen werden immer wichtiger“.,https://img.zeit.de/news/2025-01/05/syrskyj-drohnen-werden-immer-wichtiger-image-group/wide__1300x731,2025-01-05T15:49:41Z,https://web.archive.org/web/20250106204142/https://www.zeit.de/news/2025-01/05/syrskyj-drohnen-werden-immer-wichtiger,Drohnen werden nach den Worten des ukrainischen Oberbefehlshabers Olexander Syrskyj immer mehr zu einem unverzichtbaren Teil der modernen Kriegsführung. «Ich beobachte auch die Dynamik bei der Steige… [+1892 chars],,de,'Ukraine'
https://www.morgenpost.de/ratgeber-wissen/article407999706/schatz-in-der-erde-koennte-uns-energie-fuer-200-jahre-sichern.html,https://www.morgenpost.de/ratgeber-wissen/article407999706/schatz-in-der-erde-koennte-uns-energie-fuer-200-jahre-sichern.html,0,www.morgenpost.de,Schatz in der Erde könnte uns Energie für 200 Jahre sichern,Forscher haben enorme Mengen eines Stoffes in der Tiefe der Erde entdeckt. Er könnte fossile Brennstoffe wie Öl und Gas überflüssig machen.,https://img.sparknews.funkemedien.de/408002261/408002261_1736092707_v16_9_1600.jpeg,2025-01-05T15:58:27Z,http://archive.md/20250107100336/https://www.morgenpost.de/ratgeber-wissen/article407999706/schatz-in-der-erde-koennte-uns-energie-fuer-200-jahre-sichern.html,"Berlin. Forscher haben enorme Mengen eines Stoffes in der Tiefe der Erde entdeckt. Er könnte fossile Brennstoffe wie Öl und Gas überflüssig machen.
Deutschland hat das Ziel, 2045 klimaneutral zu wer… [+4199 chars]",,de,'Gas'
https://www.bild.de/regional/nordrhein-westfalen/detmold-sek-jagt-den-gefaehrlichen-max-19-677a7eff0195b908c189aed7,https://www.bild.de/regional/nordrhein-westfalen/detmold-sek-jagt-den-gefaehrlichen-max-19-677a7eff0195b908c189aed7,0,www.bild.de,Soll bewaffnet sein - SEK-Einsätze erfolglos! Max (19) weiter auf Flucht,Die blutige Auseinandersetzung in Detmold könnte mit Drogen-Kriminalität zu tun haben. Der Zustand des  Syrers (43) hat sich verschlechtert – Lebensgefahr!,"https://images.bild.de/677a7eff0195b908c189aed7/8a834899787734da165b7d0cbd128712,381865f0?w=1280",2025-01-05T17:22:12Z,,Detmold Die Polizei fahndet bundesweit nach dem gefährlichen Max. Der 19-Jährige war mit einem seinem gleichaltrigen Kumpel in Detmold (NRW) in eine blutige Auseinandersetzung verwickelt  mit Kopfsch… [+2451 chars],,de,'Flucht'
https://www.n-tv.de/politik/08-15-Ukraine-Armee-zerstoert-ueber-170-russische-Drohnen--article23143824.html,https://www.n-tv.de/politik/08-15-Ukraine-Armee-zerstoert-ueber-170-russische-Drohnen--article23143824.html,0,www.n-tv.de,Ukraine-Krieg im Liveticker: +++ 08:15 Ukraine-Armee zerstört über 170 russische Drohnen +++,Lesen Sie alle aktuellen Entwicklungen und Nachrichten über den russischen Angriffskrieg auf die Ukraine im Liveticker von ntv.de.,https://bilder3.n-tv.de/img/incoming/crop25117070/4231326595-cImg_16_9-w1200/Ukraine-Liveticker.jpg,2025-01-05T23:32:00Z,,"Die Ukraine ist mit ihrem neuerlichen Vorstoß offenbar erfolgreich: Wie der Generalstab der Armee mitteilt, hätten Soldaten im Verlauf des Sonntags 1550 russische Armeeangehörige verletzt und getötet… [+9705 chars]",,de,'Ukraine'
https://www.n-tv.de/politik/07-50-Selenskyj-Trump-und-ich-werden-zu-einer-Einigung-kommen--article23143824.html,https://www.n-tv.de/politik/07-50-Selenskyj-Trump-und-ich-werden-zu-einer-Einigung-kommen--article23143824.html,0,www.n-tv.de,Ukraine-Krieg im Liveticker: +++ 07:27 Kursk-Vorstoß der Ukrainer effektiv koordiniert +++,Lesen Sie alle aktuellen Entwicklungen und Nachrichten über den russischen Angriffskrieg auf die Ukraine im Liveticker von ntv.de.,https://bilder3.n-tv.de/img/incoming/crop25117070/4231326595-cImg_16_9-w1200/Ukraine-Liveticker.jpg,2025-01-05T23:32:00Z,,"Wolodymyr Selenskyj zeigt sich zuversichtlich, dass der ""starke"" designierte US-Präsident Donald Trump Russland zu Friedensgesprächen zwingen und den Krieg in der Ukraine beenden kann. Im Interview m… [+9289 chars]",,de,'Angriff'
https://www.n-tv.de/politik/09-00-Russland-will-Weltraumtechnologie-mit-Nordkorea-teilen--article23143824.html,https://www.n-tv.de/politik/09-00-Russland-will-Weltraumtechnologie-mit-Nordkorea-teilen--article23143824.html,0,www.n-tv.de,Ukraine-Krieg im Liveticker: +++ 09:00 Russland will Weltraumtechnologie mit Nordkorea teilen +++,Lesen Sie alle aktuellen Entwicklungen und Nachrichten über den russischen Angriffskrieg auf die Ukraine im Liveticker von ntv.de.,https://bilder3.n-tv.de/img/incoming/crop25117070/4231326595-cImg_16_9-w1200/Ukraine-Liveticker.jpg,2025-01-05T23:32:00Z,,"US-Außenminister Antony Blinken warnt vor Plänen Russlands, moderne Weltraum- und Satellitentechnologie mit Nordkorea zu teilen. Dies sei eine Gegenleistung für Nordkoreas militärische Unterstützung … [+11196 chars]",,de,'Ukraine'
https://www.n-tv.de/politik/04-35-Selenskyj-wuenscht-sich-volle-Rueckendeckung-von-Musk--article23143824.html,https://www.n-tv.de/politik/04-35-Selenskyj-wuenscht-sich-volle-Rueckendeckung-von-Musk--article23143824.html,0,www.n-tv.de,Ukraine-Krieg im Liveticker: +++ 04:35 Selenskyj wünscht sich volle Rückendeckung von Musk +++,Lesen Sie alle aktuellen Entwicklungen und Nachrichten über den russischen Angriffskrieg auf die Ukraine im Liveticker von ntv.de.,https://bilder3.n-tv.de/img/incoming/crop25117070/4231326595-cImg_16_9-w1200/Ukraine-Liveticker.jpg,2025-01-05T23:32:00Z,,"Der ukrainische Präsident Wolodymyr Selenskyj erklärt, dass er den amerikanischen Milliardär und Trump-Verbündeten Elon Musk respektiere und sich wünsche, dass Musk die Ukraine uneingeschränkt unters… [+4159 chars]",,de,'Angriff'
https://www.n-tv.de/politik/08-32-Kreml-meldet-Einnahme-der-Stadt-Kurachowe--article23143824.html,https://www.n-tv.de/politik/08-32-Kreml-meldet-Einnahme-der-Stadt-Kurachowe--article23143824.html,0,www.n-tv.de,Ukraine-Krieg im Liveticker: +++ 08:32 Kreml meldet Einnahme der Stadt Kurachowe +++,Lesen Sie alle aktuellen Entwicklungen und Nachrichten über den russischen Angriffskrieg auf die Ukraine im Liveticker von ntv.de.,https://bilder3.n-tv.de/img/incoming/crop25117070/4231326595-cImg_16_9-w1200/Ukraine-Liveticker.jpg,2025-01-05T23:32:00Z,,"Die russische Armee hat die Stadt Kurachowe im Osten der Ukraine eingenommen. ""Während aktiver Offensivoperationen befreiten Einheiten der Truppengruppe 'Süd' die Stadt Kurachowo, das größte besiedel… [+10471 chars]",,de,'Ukraine'
https://www.tagesschau.de/newsticker/liveblog-ukraine-montag-454.html,https://www.tagesschau.de/newsticker/liveblog-ukraine-montag-454.html,0,www.tagesschau.de,Ukraine-Liveblog: ++ Selenskyj: Trump kann Krieg in Ukraine beenden ++,"Selenskyj glaubt, dass Trump Russland zu Friedensgesprächen zwingen kann. Die IAEA meldet laute Explosionen in der Nähe des AKW Saporischschja - allerdings ohne Folgen. Die Entwicklungen im Liveblog.",https://images.tagesschau.de/image/d4226563-3395-4e9b-b533-f880e59ab3e5/AAABlDkyyQI/AAABkZLhkrw/16x9-1280/ukraine-2242.jpg,2025-01-06T02:03:10Z,,"Stand: 06.01.2025 03:03 Uhr
Selenskyj glaubt, dass Trump Russland zu Friedensgesprächen zwingen kann. Die IAEA meldet laute Explosionen in der Nähe des AKW Saporischschja - allerdings ohne Folgen. D… [+1949 chars]",,de,'Ukraine'
https://www.freitag.de/autoren/elsa-koester/jagoda-marinic-svenja-flasspoehler-luegt-frau-wagenknecht-die-grenze-des-streits,https://www.freitag.de/autoren/elsa-koester/jagoda-marinic-svenja-flasspoehler-luegt-frau-wagenknecht-die-grenze-des-streits,0,www.freitag.de,"Wahrheitssuche | Jagoda Marinić, Svenja Flaßpöhler: Lügt Frau Wagenknecht? Über die Grenze eines Streits","Schwurbler, Putin-Freunde: Bei Corona und im Ukraine-Krieg wird Kritik schnell als abwegig abgetan. Wie gehen wir mit radikalen Meinungsverschiedenheiten um, und wo fängt Lüge an? Jagoda Marinić und Svenja Flaßpöhler streiten, aber richtig Eigentlich war es J…",https://www.freitag.de/autoren/elsa-koester/jagoda-marinic-svenja-flasspoehler-luegt-frau-wagenknecht-die-grenze-des-streits/@@images/image/great,2025-01-06T03:00:00Z,http://archive.md/20250106070006/https://www.freitag.de/autoren/elsa-koester/jagoda-marinic-svenja-flasspoehler-luegt-frau-wagenknecht-die-grenze-des-streits,"Eigentlich war es Jagoda Marinić, die den Streit begann: Auf der Frankfurter Buchmesse diskutierte die Autorin und Podcasterin mit Svenja Flaßpöhler und mir über die Grenzen des Streits in Zeiten des… [+536 chars]",,de,'Ukraine'
https://www.stern.de/panorama/wissen/psychologie--unsere-wahrnehmung-ist-zu-negativ---und-das-hat-folgen-35356578.html,https://www.stern.de/panorama/wissen/psychologie--unsere-wahrnehmung-ist-zu-negativ---und-das-hat-folgen-35356578.html,0,www.stern.de,Psychologie: Unsere Wahrnehmung ist zu negativ - und das hat Folgen,"Es gibt Zeiten, die fühlen sich besonders negativ an. Das vergangene Jahr war so eines. Zu allen Kriegen und Krisen kommt noch hinzu: Menschen nehmen negative Informationen stärker wahr als positive.",https://image.stern.de/35356580/t/Zw/v1/w1440/r1.7778/-/06--wbbhmlmdaov11axs2048jpeg---aea22e0d8e58334a.jpg,2025-01-06T04:00:41Z,,"Kopiere den aktuellen Link
Es gibt Zeiten, die fühlen sich besonders negativ an. Das vergangene Jahr war so eines. Zu allen Kriegen und Krisen kommt noch hinzu: Menschen nehmen negative Informatione… [+7724 chars]",,de,'Krise'
https://www.tagesspiegel.de/wissen/psychologie-unsere-wahrnehmung-ist-zu-negativ-und-das-hat-folgen-12964456.html,https://www.tagesspiegel.de/wissen/psychologie-unsere-wahrnehmung-ist-zu-negativ-und-das-hat-folgen-12964456.html,0,www.tagesspiegel.de,Psychologie: Unsere Wahrnehmung ist zu negativ - und das hat Folgen,"Es gibt Zeiten, die fühlen sich besonders negativ an. Das vergangene Jahr war so eines. Zu allen Kriegen und Krisen kommt noch hinzu: Menschen nehmen negative Informationen stärker wahr als positive.",https://www.tagesspiegel.de/images/12964453/alternates/BASE_16_9_W1400/1736136125000/illustration-daumen-runter.jpeg,2025-01-06T04:02:06Z,,"Manchmal ist es schwer, all die dunklen Nachrichten des vergangenen Jahres zu verarbeiten. In der Ukraine, im Nahen Osten und an vielen anderen Orten tobten und toben Kriege, die zerstrittene deutsch… [+8233 chars]",,de,'Ukraine'
https://www.nzz.ch/feuilleton/merkel-und-putin-deutsche-und-russen-verbindet-eine-lang-andauernde-hassliebe-ld.1863975,https://www.nzz.ch/feuilleton/merkel-und-putin-deutsche-und-russen-verbindet-eine-lang-andauernde-hassliebe-ld.1863975,0,www.nzz.ch,Russland ist ein Fiebertraum vieler Deutscher. Eine unerschütterliche Hassliebe verbindet die Länder,Von Rilke bis Merkel verläuft ein roter Faden: Russland ist für manche im Westen ein Raum fiebriger Projektionen.,"https://img.nzz.ch/2021/12/07/d83c3d36-d2aa-40e1-8a8c-487c21a3b938.jpeg?width=1200&height=674&fit=bounds&quality=75&auto=webp&crop=2658,1495,x0,y46&wmark=nzz",2025-01-06T04:30:00Z,http://archive.md/20250106045931/https://www.nzz.ch/feuilleton/merkel-und-putin-deutsche-und-russen-verbindet-eine-lang-andauernde-hassliebe-ld.1863975,"Die deutsche Kanzlerin Angela Merkel wird am 21. Januar 2007 von Wladimir Putin in Sotschi empfangen und macht bei der Gelegenheit auf unangenehme Weise auch Bekanntschaft mit dessen Hund.
Neulich w… [+9671 chars]",,de,'Russland'
https://www.nzz.ch/meinung/moskau-als-das-dritte-rom-ein-historisches-gespenst-wird-reanimiert-ld.1856622,https://www.nzz.ch/meinung/moskau-als-das-dritte-rom-ein-historisches-gespenst-wird-reanimiert-ld.1856622,0,www.nzz.ch,GASTKOMMENTAR - Moskau als das Dritte Rom – ein historisches Gespenst wird reanimiert,"Nach dem Untergang des heroischen Projekts der Sowjetunion versank Russland in Sinnlosigkeit. Präsident Jelzin lancierte einen Wettbewerb für eine neue russische Staatsidee. Derweil hat sich der Kreml neu erfunden – als Retter, der die Welt vor dem Westen bew…","https://img.nzz.ch/2024/12/24/37b1022a-e552-4e87-a1e0-55f0f6860f82.jpeg?width=1200&height=675&fit=bounds&quality=75&auto=webp&crop=5539,3116,x0,y220&wmark=nzz",2025-01-06T04:30:00Z,http://archive.md/20250106114938/https://www.nzz.ch/meinung/moskau-als-das-dritte-rom-ein-historisches-gespenst-wird-reanimiert-ld.1856622,"Russland als «Drittes Rom» versteht sich als universales Reich und Retter der Welt.
Recht bald nach dem Ende der Sowjetunion setzte in Russland die Suche nach neuen ideologischen Parametern anstelle… [+8482 chars]",,de,'Russland'
https://www.nzz.ch/wirtschaft/ukraine-krieg-russlands-wirtschaft-steht-vor-einem-schwierigen-2025-ld.1864476,https://www.nzz.ch/wirtschaft/ukraine-krieg-russlands-wirtschaft-steht-vor-einem-schwierigen-2025-ld.1864476,0,www.nzz.ch,Russlands Kriegswirtschaft ist aus den Fugen: 2025 droht der Stillstand,"Die Rüstung raubt Russlands Unternehmen die Ressourcen. Während der Krieg gegen die Ukraine weitergeht, scheint nur eines sicher: Alles wird immer teurer.","https://img.nzz.ch/2025/01/03/53f4b79f-2861-49c9-a2a0-72bfe73fb867.jpeg?width=1200&height=675&fit=bounds&quality=75&auto=webp&crop=6000,3375,x0,y501&wmark=nzz",2025-01-06T04:30:00Z,http://archive.md/20250106061548/https://www.nzz.ch/wirtschaft/ukraine-krieg-russlands-wirtschaft-steht-vor-einem-schwierigen-2025-ld.1864476,"Das Wirtschaftskarussell hat sich zu schnell gedreht: Silvesterszene auf dem Roten Platz in Moskau.
Was unterscheidet die russische Zentralbank von der Jugendorganisation der Kommunistischen Partei … [+5719 chars]",,de,'Ukraine'
https://www.zeit.de/news/2025-01/06/tschentscher-hamburg-auf-krisen-vorbereiten,https://www.zeit.de/news/2025-01/06/tschentscher-hamburg-auf-krisen-vorbereiten,0,www.zeit.de,Nato-Russland-Konflikt: Tschentscher: Hamburg auf Krisen vorbereiten,Hier finden Sie Informationen zu dem Thema „Nato-Russland-Konflikt“. Lesen Sie jetzt „Tschentscher: Hamburg auf Krisen vorbereiten“.,https://img.zeit.de/news/2025-01/06/tschentscher-hamburg-auf-krisen-vorbereiten-image-group/wide__1300x731,2025-01-06T04:30:37Z,,"Angesichts des Angriffskriegs in der Ukraine und zunehmender Spannungen zwischen Russland und der Nato bereitet sich Hamburg auf verschiedene Krisenszenarien vor. Mit ihrem Hafen, den Schienenwegen, … [+3846 chars]",,de,'Russland'
https://www.stern.de/gesellschaft/regional/hamburg-schleswig-holstein/nato-russland-konflikt--tschentscher--hamburg-auf-krisen-vorbereiten-35356602.html,https://www.stern.de/gesellschaft/regional/hamburg-schleswig-holstein/nato-russland-konflikt--tschentscher--hamburg-auf-krisen-vorbereiten-35356602.html,0,www.stern.de,Nato-Russland-Konflikt: Tschentscher: Hamburg auf Krisen vorbereiten,"Es ist der Fall, den sich keiner wünscht, sagt Hamburgs Bürgermeister Peter Tschentscher: Eine direkte Konfrontation Russlands mit der Nato. Die Stadt bereitet sich dennoch darauf vor.",https://image.stern.de/35356604/t/CL/v1/w1440/r1.7778/-/06--x3evqjzxtnv13axs2048jpeg---d25bd07619a961bc.jpg,2025-01-06T04:30:37Z,,"Kopiere den aktuellen Link
Es ist der Fall, den sich keiner wünscht, sagt Hamburgs Bürgermeister Peter Tschentscher: Eine direkte Konfrontation Russlands mit der Nato. Die Stadt bereitet sich dennoc… [+3737 chars]",,de,'Ukraine'
https://www.faz.net/aktuell/politik/ukraine/ukraine-krieg-wolodymyr-selenskyj-spekuliert-ueber-wege-zum-frieden-110213116.html,https://www.faz.net/aktuell/politik/ukraine/ukraine-krieg-wolodymyr-selenskyj-spekuliert-ueber-wege-zum-frieden-110213116.html,0,www.faz.net,Die Nacht in der Ukraine: Selenskyj spekuliert über Wege zum Frieden,In einem Podcast entwickelt Selenskyj Gedankenspiele zu einem möglichen Kriegsende. Nach dem überraschenden Gegenangriff ukrainischer Einheiten in der russischen Region Kursk toben derweil schwere Kämpfe.,https://media0.faz.net/ppmedia/aktuell/politik/2507752025/1.10213152/facebook_teaser/der-ukrainische-praesident.jpg,2025-01-06T04:32:07Z,,"Rechtlich gesehen ergeht eine Einladung der Nato an die Ukraine, und wir erkennen nicht alle anderen ukrainischen Gebiete an, aber die Nato kann in dem Teil operieren, der unter ukrainischer Kontroll… [+4165 chars]",,de,'Ukraine'
https://www.tagesspiegel.de/internationales/nato-mitgliedschaft-fur-die-ukraine-selenskyj-stellt-szenario-fur-kriegsende-vor-12964528.html,https://www.tagesspiegel.de/internationales/nato-mitgliedschaft-fur-die-ukraine-selenskyj-stellt-szenario-fur-kriegsende-vor-12964528.html,0,www.tagesspiegel.de,Nato-Mitgliedschaft für die Ukraine: Selenskyj stellt Szenario für Kriegsende vor,"Im Gespräch mit dem US-Podcaster Lex Fridmann spricht der ukrainische Präsident über Szenarien, wie der Krieg beendet werden könnte. Die Hauptrolle dabei spielt der designierte US-Präsident Trump.",https://www.tagesspiegel.de/images/12964534/alternates/BASE_16_9_W1400/1736138653000/treffen-von-trump-und-selenskyj-in-new-york.jpeg,2025-01-06T04:53:52Z,,"Der ukrainische Präsident Wolodymyr Selenskyj hat sich zuversichtlich gezeigt, dass der starke designierte US-Präsident Donald Trump Russland zu Friedensgesprächen zwingen und den Krieg in der Ukrain… [+4632 chars]",,de,'Ukraine'
