index,url,valid,domain,title,description,image,published,archive,content,quote,language,keyword
https://www.bild.de/politik/ausland/politik-ausland/kriegstreiber-fordern-rache-greift-russland-jetzt-selenskyjs-palast-an-83789916.bild.html,https://www.bild.de/politik/ausland/politik-ausland/kriegstreiber-fordern-rache-greift-russland-jetzt-selenskyjs-palast-an-83789916.bild.html,0,www.bild.de,Kriegstreiber fordern Rache - Greift Russland jetzt Selenskyjs Palast an?,WIE gefährlich wird diese Explosion Ukraine-Präsident Wolodymyr Selenskyj (45)?Foto: Heikki Saukkomaa/dpa,"https://images.bild.de/6452a5a30e47d11ae463e5f6/c6f372c1eef94e8307d375b819522721,9e3645fe?w=1280",2023-05-04T06:27:26Z,https://web.archive.org/web/20230504153507/https://www.bild.de/politik/ausland/politik-ausland/kriegstreiber-fordern-rache-greift-russland-jetzt-selenskyjs-palast-an-83789916.bild.html,"WIE gefährlich wird diese Explosion Ukraine-Präsident Wolodymyr Selenskyj (45)?
 Videos aus der Nacht zu Mittwoch zeigen, wie ein Flugobjekt auf den Kreml zufliegt und sich unmittelbar vor Einschlag… [+2941 chars]",,de,'Ukraine'
https://www.wiwo.de/politik/konjunktur/konjunktur-deutsche-exporte-brechen-im-maerz-ein-rueckgang-um-5-2-prozent-zum-vormonat/29131256.html,https://www.wiwo.de/politik/konjunktur/konjunktur-deutsche-exporte-brechen-im-maerz-ein-rueckgang-um-5-2-prozent-zum-vormonat/29131256.html,0,www.wiwo.de,"Konjunktur: Deutsche Exporte brechen im März ein – Rückgang um 5,2 Prozent zum Vormonat","Die USA, China und die EU haben deutlich weniger deutsche Waren bestellt. Die Stimmung unter den Exporteuren ist aber gut. Ausgerechnet nach Russland wurde mehr ausgeführt.",https://www.wiwo.de/images/gueterzug/29131178/2-format11240.jpg,2023-05-04T06:29:48Z,,"Die deutschen Exporteure haben im März nach einem starken Jahresauftakt einen unerwartet heftigen Rückschlag erlitten. Wegen der schwächeren Nachfrage aus den wichtigsten Märkten EU, USA und China br… [+2556 chars]",,de,'Russland'
https://www.stern.de/news/esken-wirft-unternehmen-angesichts-inflation--unanstaendiges--handeln-vor-33435116.html,https://www.stern.de/news/esken-wirft-unternehmen-angesichts-inflation--unanstaendiges--handeln-vor-33435116.html,0,www.stern.de,"Esken wirft Unternehmen angesichts Inflation ""unanständiges"" Handeln vor","SPD-Chefin Saskia Esken will wegen der hohen Inflation Firmengewinne genauer unter die Lupe nehmen. Die Parteichefin warf den Unternehmen angesichts der anhaltenden Inflation gegenüber dem ""Handelsblatt"" vom Donnerstag ein ""unanständiges"" Verhalten vor. Zwar …",https://image.stern.de/33435118/t/Pg/v1/w1440/r1.7778/-/04--spdchefin-saskia-esken---391568922b29f341.jpg,2023-05-04T06:36:54Z,,"SPD-Chefin Saskia Esken will wegen der hohen Inflation Firmengewinne genauer unter die Lupe nehmen. Die Parteichefin warf den Unternehmen angesichts der anhaltenden Inflation gegenüber dem ""Handelsbl… [+1462 chars]",,de,'Inflation'
https://taz.de/-Nachrichten-im-Ukraine-Krieg-/!5932311/,https://taz.de/-Nachrichten-im-Ukraine-Krieg-/!5932311/,0,taz.de,+++ Nachrichten im Ukraine-Krieg +++: Selenski besucht Niederlande,Der ukrainische Präsident Selenski ist überraschend in die Niederlande gereist. Eine finnische Zeitung versteckt Berichte zum Krieg im Online-Spiel „Counter-Strike“.,https://taz.de/picture/6244581/948/406873309-1.jpeg,2023-05-04T06:38:00Z,https://web.archive.org/web/20230505000520/https://taz.de/-Nachrichten-im-Ukraine-Krieg-/!5932311/,"Der ukrainische Präsident Selenski ist überraschend in die Niederlande gereist. Eine finnische Zeitung versteckt Berichte zum Krieg im Online-Spiel Counter-Strike.
Selenski soll in Den Haag eine Red… [+4853 chars]",,de,'Ukraine'
https://www.focus.de/politik/ausland/ukraine-krise/rasputiza-ein-unsichtbarer-feind-verhindert-die-gegenoffensive-der-ukraine_id_192688917.html,https://www.focus.de/politik/ausland/ukraine-krise/rasputiza-ein-unsichtbarer-feind-verhindert-die-gegenoffensive-der-ukraine_id_192688917.html,0,www.focus.de,Rasputiza - Ein besonderer Feind blockiert die Gegenoffensive der Ukraine,"Die ukrainische Armee bereitet sich auf die Gegenoffensive gegen die russischen Besatzer vor. Allerdings stellt der Schlamm, der durch heftige Regenfälle in der Ost- und Zentral-Ukraine entstanden ist, ein bedeutendes Hindernis dar.",https://p6.focus.de/img/fotos/id_190982915/rasputiza.jpg?im=Crop%3D%280%2C500%2C3000%2C1500%29%3BResize%3D%281200%2C627%29&hash=5a28549e82ea6a7c5e9d3a34ed806862f4e92b967533e4822f642f55ae7b7b17,2023-05-04T06:41:20Z,https://web.archive.org/web/20230504073738/https://www.focus.de/politik/ausland/ukraine-krise/rasputiza-ein-unsichtbarer-feind-verhindert-die-gegenoffensive-der-ukraine_id_192688917.html,"Die ukrainische Armee bereitet sich auf die Gegenoffensive gegen die russischen Besatzer vor. Allerdings stellt der Schlamm, der durch heftige Regenfälle in der Ost- und Zentral-Ukraine entstanden is… [+2610 chars]",,de,'Ukraine'
https://www.telepolis.de/features/Was-nach-dem-Drohnenangriff-auf-Putins-Amtssitz-zu-erwarten-ist-8986568.html,https://www.telepolis.de/features/Was-nach-dem-Drohnenangriff-auf-Putins-Amtssitz-zu-erwarten-ist-8986568.html,0,www.telepolis.de,Was nach dem Drohnenangriff auf Putins Amtssitz zu erwarten ist,Indizien sprechen für ukrainische Verantwortliche für Attacke auf Moskauer Kreml. Ging es um Putin oder die Bloßstellung Russlands. Erste Reaktionen weisen auf eine Eskalation hin.,https://heise.cloudimg.io/bound/1200x1200/q85.png-lossy-85.webp-lossy-85.foil1/_www-heise-de_/imgs/18/4/1/5/3/6/0/0/Red_Square_Kremlin_Senate_02__4102644645_-3e1281b299c2ea72.jpeg,2023-05-04T07:00:00Z,https://web.archive.org/web/20230504072419/https://www.telepolis.de/features/Was-nach-dem-Drohnenangriff-auf-Putins-Amtssitz-zu-erwarten-ist-8986568.html,"Indizien sprechen für ukrainische Verantwortliche für Attacke auf Moskauer Kreml. Ging es um Putin oder die Bloßstellung Russlands. Erste Reaktionen weisen auf eine Eskalation hin.
Russland prüft de… [+3815 chars]",,de,'Ukraine'
https://www.welt.de/politik/deutschland/article245140028/Saskia-Esken-wirft-Unternehmen-angesichts-Inflation-unanstaendiges-Handeln-vor.html,https://www.welt.de/politik/deutschland/article245140028/Saskia-Esken-wirft-Unternehmen-angesichts-Inflation-unanstaendiges-Handeln-vor.html,0,www.welt.de,Esken wirft Unternehmen angesichts Inflation „unanständiges“ Handeln vor,"Saskia Esken möchte Unternehmen und deren Gewinne genauer prüfen. Zwar seien der Ukraine-Krieg und die steigenden Energiepreise Hauptursache für hohe Preise, Unternehmen würden aber auch ihre „Gewinnmargen kräftig erhöhen“. Auch die Grünen warnen vor einer „G…",https://img.welt.de/img/regionales/mecklenburg-vorpommern/mobile244850776/8041353517-ci16x9-w1200/Saskia-Esken.jpg,2023-05-04T07:02:43Z,,SPD-Chefin Saskia Esken will wegen der hohen Inflation Firmengewinne genauer unter die Lupe nehmen. Die Parteichefin warf den Unternehmen angesichts der anhaltenden Inflation gegenüber dem Handelsbla… [+1429 chars],,de,'Preis'
https://www.faz.net/aktuell/feuilleton/medien/demagogie-beim-spiegel-die-ukraine-ist-keine-krankheit-18866435.html,https://www.faz.net/aktuell/feuilleton/medien/demagogie-beim-spiegel-die-ukraine-ist-keine-krankheit-18866435.html,0,www.faz.net,Demagogie beim „Spiegel“: Die Ukraine ist keine Krankheit,"Was Thomas Fischer bei „Spiegel.de“ zu einem Artikel von mir und zum russischen Angriffskrieg einfällt, ist ein Lehrbeispiel für Demagogie. Rassismus, indirekte Hassrede – ist alles da.",https://media0.faz.net/ppmedia/aktuell/feuilleton/218422501/1.8866946/facebook_teaser_fplus/thomas-fischer.jpg,2023-05-04T07:15:54Z,http://archive.md/20230504074059/https://www.faz.net/aktuell/feuilleton/medien/demagogie-beim-spiegel-die-ukraine-ist-keine-krankheit-18866435.html,"Ein Thomas Fischer aus dem Sauerland, einst Postbote, Richter am Bundesgerichtshof, seit 2021 beratender Rechtsanwalt in der Münchner Kanzlei Gauweiler &amp; Sauter, legte bei Spiegel.de seine Sicht … [+1397 chars]",,de,'Ukraine'
https://www.stern.de/gesellschaft/regional/berlin-brandenburg/verwaltungsgericht--gericht-prueft-klage-von-altkanzler-schroeder-gegen-bundestag--33434604.html,https://www.stern.de/gesellschaft/regional/berlin-brandenburg/verwaltungsgericht--gericht-prueft-klage-von-altkanzler-schroeder-gegen-bundestag--33434604.html,0,www.stern.de,Verwaltungsgericht: Gericht prüft Klage von Altkanzler Schröder gegen Bundestag,"Ehemalige Kanzler und Bundespräsidenten erhalten nach Ende ihrer Amtszeit ein Büro. SPD-Politiker Gerhard Schröder, der wegen seiner engen Verbindungen nach Russland in der Kritik steht, sind solche Privilegien entzogen worden. Dagegen wehrt er sich vor Geric…",https://image.stern.de/33434606/t/Zh/v3/w1440/r1.7778/-/04--urnnewsmldpacom2009010123050399546773v3w800h600l688t263r1845b1653jpeg---4fa2a7e0878a32f8.jpg,2023-05-04T07:21:47Z,,"Ehemalige Kanzler und Bundespräsidenten erhalten nach Ende ihrer Amtszeit ein Büro. SPD-Politiker Gerhard Schröder, der wegen seiner engen Verbindungen nach Russland in der Kritik steht, sind solche … [+4232 chars]",,de,'Russland'
https://www.tagesspiegel.de/internationales/zensur-umgangen-russen-konnen-sich-mit-einem-computerspiel-uber-den-ukrainekrieg-informieren-9761618.html,https://www.tagesspiegel.de/internationales/zensur-umgangen-russen-konnen-sich-mit-einem-computerspiel-uber-den-ukrainekrieg-informieren-9761618.html,0,www.tagesspiegel.de,Zensur umgangen: Russen können sich mit einem Computerspiel über den Ukrainekrieg informieren,Informationen über russische Massaker werden in einem Ego-Shooter versteckt: Eine finnische Zeitung nutzt „Counter-Strike“ als Nachrichtenportal.,https://www.tagesspiegel.de/images/imago0168633642hjpg/alternates/BASE_16_9_W1400/imago0168633642hjpg.jpeg,2023-05-04T07:22:12Z,,Die Nichtregierungsorganisation Reporter ohne Grenzen sieht Russland bei der Pressefreiheit auf Platz 164 von 180. Im Vergleich zu 2022 ging es neu Plätze bergab. Seit die russische Armee in der Ukra… [+2972 chars],,de,'Ukraine'
https://consent.google.com/ml?continue=https://news.google.com/rss/articles/CBMilwFodHRwczovL3d3dy50YWdlc3NwaWVnZWwuZGUvaW50ZXJuYXRpb25hbGVzL2V4cGxvc2lvbi1hdWYtZGVtLWtyZW1sLWRhY2gtd2FzLXViZXItZGVuLW11dG1hc3NsaWNoZW4tZHJvaG5lbmFuZ3JpZmYtaW4tcnVzc2xhbmQtYmVrYW5udC1pc3QtOTc1ODA2My5odG1s0gEA?oc%3D5&gl=FR&hl=en-US&cm=2&pc=n&src=1,https://consent.google.com/ml?continue=https://news.google.com/rss/articles/CBMilwFodHRwczovL3d3dy50YWdlc3NwaWVnZWwuZGUvaW50ZXJuYXRpb25hbGVzL2V4cGxvc2lvbi1hdWYtZGVtLWtyZW1sLWRhY2gtd2FzLXViZXItZGVuLW11dG1hc3NsaWNoZW4tZHJvaG5lbmFuZ3JpZmYtaW4tcnVzc2xhbmQtYmVrYW5udC1pc3QtOTc1ODA2My5odG1s0gEA?oc%3D5&gl=FR&hl=en-US&cm=2&pc=n&src=1,0,consent.google.com,Explosion auf dem Kreml-Dach: Was über den mutmaßlichen Drohnenangriff in Russland bekannt ist - Tagesspiegel,"<ol><li>Explosion auf dem Kreml-Dach: Was über den mutmaßlichen Drohnenangriff in Russland bekannt ist  Tagesspiegel
</li><li>Kreml: Ukraine wollte Putin töten – Angeblicher Drohnen-Angriff | Politik  BILD
</li><li>Verdächtige Details in den Aufnahmen: Hat …",,2023-05-04T07:26:00Z,,"We use cookies and data to<ul><li>Deliver and maintain Google services</li><li>Track outages and protect against spam, fraud, and abuse</li><li>Measure audience engagement and site statistics to unde… [+1131 chars]",,de,'Angriff'
https://www.capital.de/wirtschaft-politik/nouriel-roubini---wir-koennen-die-inflation-nicht-ohne-rezession-brechen--33435396.html,https://www.capital.de/wirtschaft-politik/nouriel-roubini---wir-koennen-die-inflation-nicht-ohne-rezession-brechen--33435396.html,0,www.capital.de,"Starökonom: Nouriel Roubini: ""Wir können die Inflation nicht ohne Rezession brechen""","Der New Yorker Starökonom sagte die Finanzkrise 2008 präzise vorher, und gilt seitdem als ""Dr. Doom"". Im Interview warnt er vor einer neuen globalen Krise. Die Wirtschaft werde aus gleich zehn verschiedenen Richtungen bedroht.",https://image.stern.de/33437164/t/_F/v4/w1440/r1.7778/-/nouriel-roubini.jpg,2023-05-04T16:50:00Z,https://web.archive.org/web/20230505004659/https://www.capital.de/wirtschaft-politik/nouriel-roubini---wir-koennen-die-inflation-nicht-ohne-rezession-brechen--33435396.html,"04.05.2023, 18:50
 9 Min.
Der New Yorker Starökonom sagte die Finanzkrise 2008 präzise vorher, und gilt seitdem als ""Dr. Doom"". Im Interview warnt er vor einer neuen globalen Krise. Die Wirtschaft … [+16044 chars]",,de,'Krise'
https://www.stern.de/gesundheit/lieferengpaesse--wie-sich-der-arzneimangel-in-den-apotheken-auswirkt-33433604.html,https://www.stern.de/gesundheit/lieferengpaesse--wie-sich-der-arzneimangel-in-den-apotheken-auswirkt-33433604.html,0,www.stern.de,Lieferengpässe: Wie sich der Medikamentenmangel in den Apotheken auswirkt – und was das für Verbraucher bedeutet,"Medikamente sind in Deutschland aktuell Mangelware. Der Lieferengpass stellt Apotheker:innen vor neue Herausforderungen. Thomas Preis, Vorsitzender des Apothekerverbandes Nordrhein berichtet aus dem neuen Berufsalltag – und findet im Gespräch mit dem stern Lö…",https://image.stern.de/33433668/t/e2/v1/w1440/r1.7778/-/apotheke.jpg,2023-05-04T17:41:00Z,https://web.archive.org/web/20230505002626/https://www.stern.de/gesundheit/lieferengpaesse--wie-sich-der-arzneimangel-in-den-apotheken-auswirkt-33433604.html,"Immer wieder wurden in letzter Zeit Medikamente knapp. Aktuell schlagen vor allem Kinderärzt:innen Alarm, weil Antibiotikasäfte für Kinder Mangelware sind. In den Apotheken, wo die Medikamente ausgeg… [+8689 chars]",,de,'Preis'
https://www.ifun.de/die-guten-fire-tv-sticks-sind-gerade-wieder-guenstiger-209186/,https://www.ifun.de/die-guten-fire-tv-sticks-sind-gerade-wieder-guenstiger-209186/,0,www.ifun.de,Die guten Fire TV Sticks sind gerade wieder günstiger,"Amazon bietet seine beiden „großen“ Fire TV Sticks gerade für jeden Preis an, zu dem man sonst nur die Einsteigermodelle bekommt. Der Fire TV Stick 4K kostet vorübergehend 34,99 Euro und damit genau so viel, wie der Fire TV Stick Lite. Den Fire TV Stick Max g…",https://images.ifun.de/wp-content/uploads/2022/04/fire-tv-hoergeraet-feature.jpg,2023-05-04T17:53:33Z,https://web.archive.org/web/20230505001521/https://www.ifun.de/die-guten-fire-tv-sticks-sind-gerade-wieder-guenstiger-209186/,"Amazon bietet seine beiden großen Fire TV Sticks gerade für jeden Preis an, zu dem man sonst nur die Einsteigermodelle bekommt. Der Fire TV Stick 4K kostet vorübergehend 34,99 Euro und damit genau so… [+1769 chars]",,de,'Preis'
https://www.stern.de/gesellschaft/regional/hamburg-schleswig-holstein/auszeichnung--biontech-mitbegruenderin-bekommt-300-000-euro-medizinpreis-33434530.html,https://www.stern.de/gesellschaft/regional/hamburg-schleswig-holstein/auszeichnung--biontech-mitbegruenderin-bekommt-300-000-euro-medizinpreis-33434530.html,0,www.stern.de,Auszeichnung: Biontech-Mitbegründerin bekommt 300.000-Euro-Medizinpreis,"Sie zählen zu den höchstdotierten Medizinpreisen und werden einmal im Jahr in Hamburg von einer Stiftung vergeben: die Auszeichnungen der Jung-Stiftung. In diesem Jahr bekommt eine Frau den Jung-Preis, deren Forschung in der Zeit der Corona-Pandemie Leben ger…",https://image.stern.de/33434532/t/Ur/v2/w1440/r1.7778/-/04--urnnewsmldpacom2009010123050399546624v2w800h600l3174t391r5892b3718jpeg---7ed7ab8f7109dfc5.jpg,2023-05-04T17:58:55Z,https://web.archive.org/web/20230505123404/https://www.stern.de/gesellschaft/regional/hamburg-schleswig-holstein/auszeichnung--biontech-mitbegruenderin-bekommt-300-000-euro-medizinpreis-33434530.html,Sie zählen zu den höchstdotierten Medizinpreisen und werden einmal im Jahr in Hamburg von einer Stiftung vergeben: die Auszeichnungen der Jung-Stiftung. In diesem Jahr bekommt eine Frau den Jung-Prei… [+1959 chars],,de,'Preis'
https://snipz.de/2023/superfire-led-stirnlampe/,https://snipz.de/2023/superfire-led-stirnlampe/,0,snipz.de,"SuperFire LED Stirnlampe für 10,28€ inkl. Prime-Versand (statt 15,99€)","Bei Amazon gibt es heute die SuperFire Stirnlampe für nur 10,28€ inkl. Prime-Versand. Auf den Preis kommt ihr durch den Einsatz des Couponcodes PYXS4KHO an der Kasse. Tipp: Um keine neuen Deals zu verpassen, folgt uns gerne auf Telegram. Im Preisvergleich gib…",https://gadgetwelt.de/wp-content/uploads/2023/05/superfire-k.png,2023-05-04T18:12:03Z,,"Bei Amazon gibt es heute die SuperFire Stirnlampe für nur 10,28 inkl. Prime-Versand.
Auf den Preis kommt ihr durch den Einsatz des Couponcodes PYXS4KHOan der Kasse.
Tipp: Um keine neuen Deals zu ve… [+447 chars]",,de,'Preis'
https://www.apfelpage.de/news/immer-teurer-iphone-durchschnittspreise-steigen-immer-weiter/,https://www.apfelpage.de/news/immer-teurer-iphone-durchschnittspreise-steigen-immer-weiter/,0,www.apfelpage.de,Immer Teurer: iPhone-Durchschnittspreise steigen immer weiter,Das iPhone wird immer teurer: Apple konnte den durchschnittlichen Preis pro verkaufter Einheit zuletzt weiter steigern. Im Vorfeld der Quartalszahlen ist dies eine für den Apple-Ausblick positive statistische Erkenntnis. Seit Jahren wird das iPhone […],https://www.apfelpage.de/wp-content/uploads/2022/09/DSC07684-scaled.jpg,2023-05-04T19:13:39Z,https://web.archive.org/web/20230504191354/https://www.apfelpage.de/news/immer-teurer-iphone-durchschnittspreise-steigen-immer-weiter/,Das iPhone wird immer teurer: Apple konnte den durchschnittlichen Preis pro verkaufter Einheit zuletzt weiter steigern. Im Vorfeld der Quartalszahlen ist dies eine für den Apple-Ausblick positive sta… [+1707 chars],,de,'Preis'
https://orf.at/stories/3314753/,https://orf.at/stories/3314753/,0,orf.at,Europas Poker um ukrainisches Getreide,"Wochenlang hat eine Flut an günstigem ukrainischem Getreide für Aufschrei in östlichen EU-Staaten gesorgt. Die Silos sind voll, die Preise fallen und die Sommerernte steht erst bevor. Polen, Ungarn, Bulgarien und die Slowakei zogen mit nationalen Importstopps…",https://ibs.orf.at/news?image=https%3A%2F%2Fassets.orf.at%2Fmims%2F2023%2F18%2F22%2Fcrops%2Fw%3D1200%2Ch%3D630%2Cq%3D75%2F1775482_master_659522_eu_ukraine_getreideimporte_analyse_ap.jpg%3Fs%3D8fdc4002281edc197046ff4a04373068496a4907,2023-05-04T21:59:59Z,https://web.archive.org/web/20230505081913/https://orf.at/stories/3314753/,"Die Einigung, die die EU-Kommission jüngst verkündet hatte, soll dafür sorgen, dass ukrainisches Getreide wie ursprünglich beabsichtigt auf dem Weltmarkt landet und nicht im Osten Europas hängen blei… [+8828 chars]",,de,'Preis'
https://consent.google.com/ml?continue=https://news.google.com/rss/articles/CBMihgFodHRwczovL3d3dy5zcGllZ2VsLmRlL2F1c2xhbmQvcnVzc2xhbmQtdWtyYWluZS1rcmllZy1kYXMtZ2VzY2hhaC1pbi1kZXItbmFjaHQtenUtZnJlaXRhZy01LW1haS1hLWY1NGQxZjI5LWM5MWUtNGU4My05ZWQzLWIyYmU3NWZkZjlmYdIBAA?oc%3D5&gl=FR&hl=en-US&cm=2&pc=n&src=1,https://consent.google.com/ml?continue=https://news.google.com/rss/articles/CBMihgFodHRwczovL3d3dy5zcGllZ2VsLmRlL2F1c2xhbmQvcnVzc2xhbmQtdWtyYWluZS1rcmllZy1kYXMtZ2VzY2hhaC1pbi1kZXItbmFjaHQtenUtZnJlaXRhZy01LW1haS1hLWY1NGQxZjI5LWM5MWUtNGU4My05ZWQzLWIyYmU3NWZkZjlmYdIBAA?oc%3D5&gl=FR&hl=en-US&cm=2&pc=n&src=1,0,consent.google.com,"Russischer Angriffskrieg: Russland warnt vor Hochwasser am AKW, Wagenknecht kritisiert Preis für Selenskyj - DER SPIEGEL","<ol><li>Russischer Angriffskrieg: Russland warnt vor Hochwasser am AKW, Wagenknecht kritisiert Preis für Selenskyj  DER SPIEGEL
</li><li>SELENSKYJ IN DEN NIEDERLANDEN: Darum ist der Besuch vom ukrainisches Präsidenten so wichtig  WELT Nachrichtensender
</li…",,2023-05-05T02:58:16Z,,"We use cookies and data to<ul><li>Deliver and maintain Google services</li><li>Track outages and protect against spam, fraud, and abuse</li><li>Measure audience engagement and site statistics to unde… [+1131 chars]",,de,'Preis'
https://www.n-tv.de/wirtschaft/Gasverbrauch-ist-2022-massiv-gesunken-article24100451.html,https://www.n-tv.de/wirtschaft/Gasverbrauch-ist-2022-massiv-gesunken-article24100451.html,0,www.n-tv.de,Sparvorgaben übertroffen: Gasverbrauch ist 2022 massiv gesunken,Die Bundesregierung hat nach Beginn des russischen Angriffskriegs gegen die Ukraine zu Gaseinsparungen aufgerufen. Eine Studie zeigt: Privathaushalte und Industrie haben die Sparziele deutlich übertroffen. Beeinflusst hat den Verbrauch demzufolge aber vor all…,https://bilder3.n-tv.de/img/incoming/crop24100458/9491322441-cImg_16_9-w1200/396293935.jpg,2023-05-05T03:18:31Z,https://web.archive.org/web/20230505031911/https://www.n-tv.de/wirtschaft/Gasverbrauch-ist-2022-massiv-gesunken-article24100451.html,Die Bundesregierung hat nach Beginn des russischen Angriffskriegs gegen die Ukraine zu Gaseinsparungen aufgerufen. Eine Studie zeigt: Privathaushalte und Industrie haben die Sparziele deutlich übertr… [+2737 chars],,de,'Gas'
https://www.tagesspiegel.de/internationales/massive-verluste-auf-russischer-seite-niemand-im-kreml-schert-sich-darum-wie-viele-leute-sterben-9763940.html,https://www.tagesspiegel.de/internationales/massive-verluste-auf-russischer-seite-niemand-im-kreml-schert-sich-darum-wie-viele-leute-sterben-9763940.html,0,www.tagesspiegel.de,"Massive Verluste auf russischer Seite: „Niemand im Kreml schert sich darum, wie viele Leute sterben“",Seit Dezember sollen mindestens 100.000 russische Soldaten getötet oder verwundet worden sein. Dabei steht die ukrainische Gegenoffensive noch bevor. Wie lange kann Russland die hohen Verluste aushalten?,https://www.tagesspiegel.de/images/imago0245504710hjpg/alternates/BASE_16_9_W1400/imago0245504710hjpg.jpeg,2023-05-05T09:38:48Z,https://web.archive.org/web/20230505102006/https://www.tagesspiegel.de/internationales/massive-verluste-auf-russischer-seite-niemand-im-kreml-schert-sich-darum-wie-viele-leute-sterben-9763940.html,"Die Zahl der Verluste auf russischer Seite ist zuletzt sprunghaft gestiegen. Wie das Weiße Haus Anfang der Woche bekanntgab, sind nach Einschätzung von US-Geheimdiensten allein seit vergangenem Dezem… [+6991 chars]",,de,'Waffen'
https://www.stern.de/gesellschaft/regional/bayern/dok-fest-muenchen---following-valeria----mit-tiktok-und-humor-gegen-den-krieg-33439606.html,https://www.stern.de/gesellschaft/regional/bayern/dok-fest-muenchen---following-valeria----mit-tiktok-und-humor-gegen-den-krieg-33439606.html,0,www.stern.de,"Dok.fest München: ""Following Valeria"" - Mit Tiktok und Humor gegen den Krieg",Mit Humor und Selbstironie den Alltag in der zerbombten Ukraine zeigen: Für ihre Tiktok-Videos erhielt Valeria Shashenok Lob und Kritik. Nun zeigt ein Dokumentarfilm das Leben der 21-Jährigen.,https://image.stern.de/33439608/t/co/v2/w1440/r1.7778/-/05--urnnewsmldpacom2009010123050599570679v3w800h600l640t425r1920b1278jpeg---683a917131122e5b.jpg,2023-05-05T10:48:59Z,https://web.archive.org/web/20230505185436/https://www.stern.de/gesellschaft/regional/bayern/dok-fest-muenchen---following-valeria----mit-tiktok-und-humor-gegen-den-krieg-33439606.html,"Mit Humor und Selbstironie den Alltag in der zerbombten Ukraine zeigen: Für ihre Tiktok-Videos erhielt Valeria Shashenok Lob und Kritik. Nun zeigt ein Dokumentarfilm das Leben der 21-Jährigen.
Dem K… [+1927 chars]",,de,'Waffen'
https://www.diepresse.com/6284177/praesident-kuendigt-nach-erneuter-amoktat-in-serbien-entwaffnungskampagne-an,https://www.diepresse.com/6284177/praesident-kuendigt-nach-erneuter-amoktat-in-serbien-entwaffnungskampagne-an,0,www.diepresse.com,"Präsident spricht nach erneuter Amoktat in Serbien von ""Angriff auf das ganze Land""",Innerhalb von zwei Tagen erschüttern zwei mit Schusswaffenangriffe Serbien. Aleksandar Vucic kündigt Änderungen im Waffengesetz vor.,https://media.diepresse.com/social_diepresse_nachrichten/images/uploads_1200/3/9/1/6284177/EF2CDF3B-F170-45C1-9585-10E2C910C5C7_v0_l.jpg,2023-05-05T10:58:00Z,,"Innerhalb von zwei Tagen erschüttern zwei mit Schusswaffenangriffe Serbien. Aleksandar Vucic fordert strengere Waffenkontrollen.
Serbiens Präsident Aleksandar Vucic hat am Freitag den Schusswaffenan… [+2717 chars]",,de,'Angriff'
https://www.n-tv.de/politik/Praesident-Vucic-will-Serbien-nach-Amoklaeufen-entwaffnen-article24101704.html,https://www.n-tv.de/politik/Praesident-Vucic-will-Serbien-nach-Amoklaeufen-entwaffnen-article24101704.html,0,www.n-tv.de,17 Tote in einer Woche: Präsident Vucic will Serbien nach Amokläufen entwaffnen,Serbien muss nach zwei Amoktaten 17 Todesopfer und zahlreiche Verletzte binnen weniger Tage beklagen. Präsident Vucic reagiert schnell und kündigt eine großangelegte Entwaffnungskampagne an. In dem Ex-Bürgerkriegsland sind Hunderttausende Waffen in privater H…,https://bilder3.n-tv.de/img/incoming/crop24101706/3081322098-cImg_16_9-w1200/406876468.jpg,2023-05-05T11:15:43Z,https://web.archive.org/web/20230505132253/https://www.n-tv.de/politik/Praesident-Vucic-will-Serbien-nach-Amoklaeufen-entwaffnen-article24101704.html,Serbien muss nach zwei Amoktaten 17 Todesopfer und zahlreiche Verletzte binnen weniger Tage beklagen. Präsident Vucic reagiert schnell und kündigt eine großangelegte Entwaffnungskampagne an. In dem E… [+1473 chars],,de,'Waffen'
