index,url,valid,domain,title,description,image,published,archive,content,quote,language,keyword
https://www.morgenpost.de/politik/article409162540/sabotage-und-spionage-so-stark-ist-der-ukrainische-geheimdienst.html,https://www.morgenpost.de/politik/article409162540/sabotage-und-spionage-so-stark-ist-der-ukrainische-geheimdienst.html,0,www.morgenpost.de,Sabotage und Spionage: So stark ist der ukrainische Geheimdienst,"Morde, Sprengstoffanschläge und nun offenbar ein massiver Drohnenangriff auf Russland. Warum ukrainische Spione so stark geworden sind.",https://img.sparknews.funkemedien.de/409162192/409162192_1748791122_v16_9_1600.jpeg,2025-06-02T03:42:42Z,https://web.archive.org/web/20250602035243/https://www.morgenpost.de/politik/article409162540/sabotage-und-spionage-so-stark-ist-der-ukrainische-geheimdienst.html,"Berlin/Kiew. Morde, Sprengstoffanschläge und nun offenbar ein massiver Drohnenangriff auf Russland. Warum ukrainische Spione so stark geworden sind.
Glaubt man den Kremlsprechern, dann war die Nacht… [+9374 chars]",,de,'Waffen'
https://www.zeit.de/politik/2025-06/waffenexporte-israel-johann-wadephul-nahost-nachrichtenpodcast,https://www.zeit.de/politik/2025-06/waffenexporte-israel-johann-wadephul-nahost-nachrichtenpodcast,0,www.zeit.de,Waffenexporte Israel: Würde ein Waffenstopp Israels Politik ändern?,Außenminister Wadephul will deutsche Waffenexporte nach Israel prüfen und eventuell stoppen. Würde das Israels Vorgehen in Gaza ändern? Und: Produktfälschungen auf Temu,https://img.zeit.de/politik/2017-09/illu-podcast-news/wide__8ed8a6__1300x731,2025-06-02T04:03:15Z,http://archive.md/20250602041916/https://www.zeit.de/politik/2025-06/waffenexporte-israel-johann-wadephul-nahost-nachrichtenpodcast,Die Bundesregierung äußert sich immer kritischer zu Israels Vorgehen im Gazastreifen. So auch Außenminister Johann Wadephul. Er möchte Deutschlands Waffenexporte nach Israel überprüfen und untersuche… [+1648 chars],,de,'Waffen'
https://www.stern.de/politik/ausland/grossbritannien-will-sich-mit-neuen-atom-u-booten-vor-russland-schuetzen-35772902.html,https://www.stern.de/politik/ausland/grossbritannien-will-sich-mit-neuen-atom-u-booten-vor-russland-schuetzen-35772902.html,0,www.stern.de,Aufrüstung: Großbritannien will sich mit neuen Atom-U-Booten vor Russland schützen,Großbritannien stellt seine Verteidigung auf den Prüfstand. Klar ist schon jetzt: Die Regierung möchte ein Dutzend Angriffs-U-Boote der nächsten Generation bauen lassen.,https://image.stern.de/35772914/t/x6/v1/w1440/r1.7778/-/grossbritannien-u-boot.jpg,2025-06-02T04:28:00Z,https://web.archive.org/web/20250602044837/https://www.stern.de/politik/ausland/grossbritannien-will-sich-mit-neuen-atom-u-booten-vor-russland-schuetzen-35772902.html,"Kopiere den aktuellen Link
Zur Merkliste hinzufügen
Großbritannien stellt seine Verteidigung auf den Prüfstand. Klar ist schon jetzt: Die Regierung möchte ein Dutzend Angriffs-U-Boote der nächsten … [+1331 chars]",,de,'Angriff'
https://www.zeit.de/news/2025-06/02/kaffeepreis-steigt-deutlich-staerker-als-die-inflation,https://www.zeit.de/news/2025-06/02/kaffeepreis-steigt-deutlich-staerker-als-die-inflation,0,www.zeit.de,Ernteausfälle: Kaffeepreis steigt deutlich stärker als die Inflation,Hier finden Sie Informationen zu dem Thema „Ernteausfälle“. Lesen Sie jetzt „Kaffeepreis steigt deutlich stärker als die Inflation“.,https://img.zeit.de/news/2025-06/02/kaffeepreis-steigt-deutlich-staerker-als-die-inflation-image-group/wide__1300x731,2025-06-02T07:32:20Z,,"Für Kaffee müssen die Menschen in Deutschland tiefer in die Tasche greifen. Die Verbraucherpreise für Bohnenkaffee haben sich im April um gut zwölf Prozent gegenüber dem Vorjahresmonat erhöht, wie da… [+1293 chars]",,de,'Inflation'
https://www.stern.de/wirtschaft/news/ernteausfaelle--kaffeepreis-steigt-deutlich-staerker-als-die-inflation-35773286.html,https://www.stern.de/wirtschaft/news/ernteausfaelle--kaffeepreis-steigt-deutlich-staerker-als-die-inflation-35773286.html,0,www.stern.de,Ernteausfälle: Kaffeepreis steigt deutlich stärker als die Inflation,Wiesbaden - Für Kaffee müssen die Menschen in Deutschland tiefer in die Tasche greifen. Die Verbraucherpreise für Bohnenkaffee haben sich im April um,https://image.stern.de/35773288/t/u6/v1/w1440/r1.7778/-/02--pwlgseqwzwv5axs2048jpeg---da5636de7327fc83.jpg,2025-06-02T07:32:20Z,,"Kopiere den aktuellen Link
Zur Merkliste hinzufügen
Die Deutschen lassen sich ihr Lieblingsgetränk einiges kosten. Trotz stetig steigender Preise wird immer mehr Kaffee eingeführt.
Für Kaffee müss… [+1437 chars]",,de,'Inflation'
https://www.golem.de/sonstiges/zustimmung/auswahl.html?from=https://www.golem.de/news/strategische-bomber-ukraine-fuehrt-drohnenangriff-auf-russische-luftwaffe-durch-2506-196740.html&referer=https://t.co/5255501cff,https://www.golem.de/sonstiges/zustimmung/auswahl.html?from=https://www.golem.de/news/strategische-bomber-ukraine-fuehrt-drohnenangriff-auf-russische-luftwaffe-durch-2506-196740.html&referer=https://t.co/5255501cff,0,www.golem.de,Strategische Bomber: Ukraine führt Drohnenangriff auf russische Luftwaffe durch,"Der ukrainische Geheimdienst hat einen Angriff mit kleinen Drohnen auf russische strategische Bomber in Sibirien durchgeführt. (Militär, Politik)",,2025-06-02T07:56:02Z,,"Besuchen Sie Golem.de wie gewohnt mit Werbung und Tracking,
 indem Sie der Nutzung aller Cookies zustimmen.
 Details zum Tracking finden Sie im Privacy Center.
Skript wurde nicht geladen. Informat… [+607 chars]",,de,'Ukraine'
https://www.zeit.de/wirtschaft/2025-06/kaffee-inlfation-ernteausfall,https://www.zeit.de/wirtschaft/2025-06/kaffee-inlfation-ernteausfall,0,www.zeit.de,Ernteausfall: Kaffeepreis steigt deutlich stärker als Inflation,Dürre und Waldbrände beeinträchtigten 2024 die Kaffeeernte in Brasilien. Der Preis für Kaffeebohnen in Deutschland stieg deshalb um 12 Prozent innerhalb eines Jahres.,https://img.zeit.de/wirtschaft/2025-06/kaffee-inlfation-ernteausfall-bild/wide__1300x731,2025-06-02T08:01:53Z,,"Durch Ernteausfälle in wichtigen Anbauländern sind die Preise für Rohkaffee stark gestiegen. Nach Angaben des Statistischen Bundesamts war Bohnenkaffee in Deutschland diesen April um 12,2 Prozent teu… [+1047 chars]",,de,'Inflation'
https://www.zeit.de/news/2025-06/02/dhl-erhoeht-preise-fuer-bestimmte-paket-sendungen,https://www.zeit.de/news/2025-06/02/dhl-erhoeht-preise-fuer-bestimmte-paket-sendungen,0,www.zeit.de,Pakete: DHL erhöht Preise für bestimmte Paket-Sendungen,Hier finden Sie Informationen zu dem Thema „Pakete“. Lesen Sie jetzt „DHL erhöht Preise für bestimmte Paket-Sendungen“.,https://img.zeit.de/news/2025-06/02/dhl-erhoeht-preise-fuer-bestimmte-paket-sendungen-image-group/wide__1300x731,2025-06-02T09:05:44Z,,"Beim Paketversand ins Ausland erhöht der Post-Konzern DHL die Preise. Der Transport eines bis zu zwei Kilogramm schweren Päckchens, das in EU-Staaten geschickt wird und das online frankiert wurde, ko… [+1138 chars]",,de,'Preis'
https://www.zeit.de/news/2025-06/02/19-jaehrige-nach-angriff-ausser-lebensgefahr,https://www.zeit.de/news/2025-06/02/19-jaehrige-nach-angriff-ausser-lebensgefahr,0,www.zeit.de,Versuchte Tötung: 19-Jährige nach Angriff außer Lebensgefahr,Hier finden Sie Informationen zu dem Thema „Versuchte Tötung“. Lesen Sie jetzt „19-Jährige nach Angriff außer Lebensgefahr“.,https://img.zeit.de/news/2025-06/02/19-jaehrige-nach-angriff-ausser-lebensgefahr-image-group/wide__1300x731,2025-06-02T09:48:42Z,,Nach einem schweren Angriff in Berlin-Lichtenberg schwebt das 19 Jahre alte Opfer nicht mehr in Lebensgefahr. Das teilte ein Sprecher der Staatsanwaltschaft auf Anfrage mit. Die junge Frau hatte bei … [+827 chars],,de,'Angriff'
https://www.zeit.de/news/2025-06/02/automatisierung-und-robotik-im-krisenjahr,https://www.zeit.de/news/2025-06/02/automatisierung-und-robotik-im-krisenjahr,0,www.zeit.de,Industrie: Automatisierung und Robotik im Krisenjahr,Hier finden Sie Informationen zu dem Thema „Industrie“. Lesen Sie jetzt „Automatisierung und Robotik im Krisenjahr“.,https://img.zeit.de/news/2025-06/02/automatisierung-und-robotik-im-krisenjahr-image-group/wide__1300x731,2025-06-02T10:51:15Z,https://web.archive.org/web/20250603055833/https://www.zeit.de/news/2025-06/02/automatisierung-und-robotik-im-krisenjahr,"Die deutsche Robotik- und Automatisierungsbranche ist in der Krise. Für das laufende Jahr erwartet die Branche einen Einbruch ihres Umsatzes um 10 Prozent auf 14,5 Milliarden Euro, wie der Verband VD… [+1970 chars]",,de,'Krise'
https://www.tagesschau.de/ausland/asien/ukraine-verhandlungen-istanbul-106.html,https://www.tagesschau.de/ausland/asien/ukraine-verhandlungen-istanbul-106.html,0,www.tagesschau.de,Ukraine und Russland: Verhandlungen beendet - neuer Gefangenenaustausch?,"Die direkten Verhandlungen zwischen der Ukraine und Russland sind in die zweite Runde gegangen, auch dieses Mal in Istanbul. Wie die türkischen Vermittler bestätigten, war die Sitzung nach etwa einer Stunde wieder zu Ende.",https://images.tagesschau.de/image/1cabc0d0-4a9f-485a-9825-430db2cd317e/AAABlzCqMD8/AAABkZLhkrw/16x9-1280/delegation-ukraine-100.jpg,2025-06-02T13:39:59Z,,"Stand: 02.06.2025 15:39 Uhr
Die direkten Verhandlungen zwischen der Ukraine und Russland sind in die zweite Runde gegangen, auch dieses Mal in Istanbul. Wie die türkischen Vermittler bestätigten, wa… [+3574 chars]",,de,'Russland'
https://www.zeit.de/news/2025-06/02/russland-veroeffentlicht-plan-fuer-eine-friedensloesung,https://www.zeit.de/news/2025-06/02/russland-veroeffentlicht-plan-fuer-eine-friedensloesung,0,www.zeit.de,"Krieg in der Ukraine: Russland veröffentlicht Plan für eine ""Friedenslösung""","Hier finden Sie Informationen zu dem Thema „Krieg in der Ukraine“. Lesen Sie jetzt „Russland veröffentlicht Plan für eine ""Friedenslösung""“.",https://img.zeit.de/news/2025-06/02/russland-veroeffentlicht-plan-fuer-eine-friedensloesung-image-group/wide__1300x731,2025-06-02T17:52:15Z,,Russland hat erstmals sein Memorandum mit Forderungen an die Ukraine für einen möglichen künftigen Friedensvertrag veröffentlicht. Verlangt wird von der Ukraine in Punkt eins eine international binde… [+2046 chars],,de,'Russland'
https://www.zeit.de/news/2025-06/03/ruestungsexporte-fuer-fast-eine-halbe-milliarde-euro-an-israel,https://www.zeit.de/news/2025-06/03/ruestungsexporte-fuer-fast-eine-halbe-milliarde-euro-an-israel,0,www.zeit.de,Seit Hamas-Angriff: Rüstungsexporte für fast eine halbe Milliarde Euro an Israel,Hier finden Sie Informationen zu dem Thema „Seit Hamas-Angriff“. Lesen Sie jetzt „Rüstungsexporte für fast eine halbe Milliarde Euro an Israel“.,https://img.zeit.de/news/2025-06/03/ruestungsexporte-fuer-fast-eine-halbe-milliarde-euro-an-israel-image-group/wide__1300x731,2025-06-03T02:34:45Z,,Seit dem Terrorangriff der Hamas vor fast 20 Monaten hat die Bundesregierung Rüstungsexporte für fast eine halbe Milliarde Euro an Israel genehmigt. Vom 7. Oktober 2023 bis zum 13. Mai 2025 wurde die… [+1706 chars],,de,'Waffen'
https://www.zeit.de/politik/ausland/2025-06/bundesregierung-ruestungsexporte-israel-halbe-milliarde,https://www.zeit.de/politik/ausland/2025-06/bundesregierung-ruestungsexporte-israel-halbe-milliarde,0,www.zeit.de,Nahost: Deutschland genehmigte Waffenexporte an Israel für 485 Millionen Euro,"Seit dem 7. Oktober 2023 hat die Bundesregierung Israel Rüstung im Wert von fast 500 Millionen Euro zugesagt. Ob es weitere Zusagen gibt, lässt der Außenminister prüfen.",https://img.zeit.de/politik/ausland/2025-06/bundesregierung-ruestungsexporte-israel-halbe-milliarde-bild/wide__1300x731,2025-06-03T03:15:23Z,,"Seit dem Terrorangriff der Hamas auf Israel vor fast 20 
Monaten hat die Bundesregierung Rüstungsexporte für fast eine halbe 
Milliarde Euro für das Land genehmigt. Vom 7. Oktober 2023 bis zum 13. … [+1669 chars]",,de,'Waffen'
https://www.faz.net/aktuell/politik/ukraine/die-nacht-in-der-ukraine-kiew-wirft-moskau-spiel-auf-zeit-vor-110514201.html,https://www.faz.net/aktuell/politik/ukraine/die-nacht-in-der-ukraine-kiew-wirft-moskau-spiel-auf-zeit-vor-110514201.html,0,www.faz.net,Die Nacht in der Ukraine: Kiew wirft Moskau Spiel auf Zeit vor,"Die Ukraine und Russland vereinbaren in Istanbul einen weiteren Gefangenenaustausch. Dennoch wirft die Ukraine der russischen Seite vor, bei den Friedensgesprächen Zeit zu schinden. Der Überblick.",https://media0.faz.net/ppmedia/aktuell/2218164584/1.10514214/facebook_teaser/ein-anwohner-steht-vor-einem.jpg,2025-06-03T03:50:41Z,https://web.archive.org/web/20250603040414/https://www.faz.net/aktuell/politik/ukraine/die-nacht-in-der-ukraine-kiew-wirft-moskau-spiel-auf-zeit-vor-110514201.html,"Nach einer neuen Verhandlungsrunde zwischen Moskau und Kiew wirft der ukrainische Verhandlungsführer Russland vor, auf Zeit zu spielen. Auf Facebook bezichtigte der ukrainische Verteidigungsminister … [+5819 chars]",,de,'Ukraine'
https://www.tagesschau.de/newsticker/liveblog-ukraine-dienstag-464.html,https://www.tagesschau.de/newsticker/liveblog-ukraine-dienstag-464.html,0,www.tagesschau.de,Ukraine-Liveblog: ++ Ukraine wirft Kreml Spiel auf Zeit vor ++,"Der ukrainische Verteidigungsminister Umjerow wirft Russland vor, auf Verzögerungstaktik statt auf echte Verhandlungen zu setzen. Bei erneuten russischen Angriffen sollen in der Ukraine mindestens fünf Menschen getötet worden sein.",https://images.tagesschau.de/image/5b073b67-29bf-4703-b6b1-71469e4c25bb/AAABldopTPc/AAABkZLhkrw/16x9-1280/flagge-ukraine-truemmer-101.jpg,2025-06-03T04:22:49Z,,"Stand: 03.06.2025 06:22 Uhr
Der ukrainische Verteidigungsminister Umjerow wirft Russland vor, auf Verzögerungstaktik statt auf echte Verhandlungen zu setzen. Bei erneuten russischen Angriffen sollen… [+4069 chars]",,de,'Gas'
https://taz.de/Ruestungsexporte-in-Kriegsgebiet/!6092004/,https://taz.de/Ruestungsexporte-in-Kriegsgebiet/!6092004/,0,taz.de,Rüstungsexporte in Kriegsgebiet: Waffen für fast eine halbe Milliarde Euro,"Deutschland hat nach dem Angriff der Hamas in großem Stil Rüstungsgüter nach Israel geliefert. Ob die neue Regierung diese Praxis fortführt, ist offen.",https://taz.de/picture/7732552/1200/38495103-1.jpeg,2025-06-03T07:09:00Z,,"Deutschland hat nach dem Angriff der Hamas in großem Stil Rüstungsgüter nach Israel geliefert. Ob die neue Regierung diese Praxis fortführt, ist offen. mehr...",,de,'Waffen'
https://www.stern.de/news/hamas-zivilschutz--15-tote-bei-angriff-nahe-verteilzentrum-im-gazastreifen-35777244.html,https://www.stern.de/news/hamas-zivilschutz--15-tote-bei-angriff-nahe-verteilzentrum-im-gazastreifen-35777244.html,0,www.stern.de,Hamas-Zivilschutz: 15 Tote bei Angriff nahe Verteilzentrum im Gazastreifen,Wenige Tage nach tödlichen Schüssen an einem Verteilzentrum für Hilfsgüter im Süden des Gazastreifens hat die israelische Armee nach Angaben des von der radikalislamischen Hamas kontrollierten Zivilschutzes erneut Schüsse auf Zivilisten nahe dem Verteilzentru…,https://image.stern.de/35777246/t/pO/v1/w1440/r1.7778/-/03--ein-palaestinensisches-maedchen-in-einem-verteilzentrum---2cf647003dee1085.jpg,2025-06-03T08:57:45Z,,"Kopiere den aktuellen Link
Zur Merkliste hinzufügen
Wenige Tage nach tödlichen Schüssen an einem Verteilzentrum für Hilfsgüter im Süden des Gazastreifens hat die israelische Armee nach Angaben des … [+2598 chars]",,de,'Angriff'
https://www.n-tv.de/politik/London-droht-Abramowitsch-nach-Chelsea-Verkauf-mit-Klage-article25809164.html,https://www.n-tv.de/politik/London-droht-Abramowitsch-nach-Chelsea-Verkauf-mit-Klage-article25809164.html,0,www.n-tv.de,Milliarden für Ukraine: London droht Abramowitsch nach Chelsea-Verkauf mit Klage,Roman Abramowitsch übernimmt 2003 den FC Chelsea. Der russische Oligarch steckt über die Jahre Milliarden in den englischen Fußballklub. Im Zuge des Ukraine-Kriegs muss der Putin-Vertraute Chelsea jedoch verkaufen. Der Erlös sollte eigentlich der Ukraine helf…,https://www.n-tv.de/img/incoming/crop25809178/6521326530-cImg_16_9-w1200/AFP-20220722-32F868G-v1-HighRes-TurkeyUkraineRussiaUnDiplomacyAgricultureConfli.jpg,2025-06-03T09:18:45Z,https://web.archive.org/web/20250603092835/https://www.n-tv.de/politik/London-droht-Abramowitsch-nach-Chelsea-Verkauf-mit-Klage-article25809164.html,Roman Abramowitsch übernimmt 2003 den FC Chelsea. Der russische Oligarch steckt über die Jahre Milliarden in den englischen Fußballklub. Im Zuge des Ukraine-Kriegs muss der Putin-Vertraute Chelsea je… [+2135 chars],,de,'Angriff'
https://www.stern.de/politik/ausland/krieg-ukraine-russland--kiews-aktion--spinnennetz---neue-zahl-zerstoerter-flugzeuge-35775904.html,https://www.stern.de/politik/ausland/krieg-ukraine-russland--kiews-aktion--spinnennetz---neue-zahl-zerstoerter-flugzeuge-35775904.html,0,www.stern.de,"Krieg Ukraine-Russland: Kiews Aktion ""Spinnennetz"": Neue Zahl zerstörter Flugzeuge",Der ukrainische Geheimdienst SBU feierte seine geheime Drohnenattacke auf russische Flughäfen als großen Erfolg. In Kiew nennt der Generalstab nun weniger zerstörte Flugzeuge als der SBU.,https://image.stern.de/35777342/t/1f/v1/w1440/r1.7778/-/03--ti5tjbyhb4v2axs2048jpeg---81f207f4a6e7eaa9.jpg,2025-06-03T09:23:31Z,,"Kopiere den aktuellen Link
Zur Merkliste hinzufügen
Der ukrainische Geheimdienst SBU feierte seine geheime Drohnenattacke auf russische Flughäfen als großen Erfolg. In Kiew nennt der Generalstab nu… [+2697 chars]",,de,'Angriff'
https://www.bild.de/regional/nordrhein-westfalen/ibbenbueren-zeugen-nach-koerperverletzung-auf-der-weberstrasse-gesucht-683ec26dde084c0b052b8389,https://www.bild.de/regional/nordrhein-westfalen/ibbenbueren-zeugen-nach-koerperverletzung-auf-der-weberstrasse-gesucht-683ec26dde084c0b052b8389,0,www.bild.de,Ibbenbüren - Polizei sucht Zeugen nach Angriff an Weberstraße,Ibbenbüren – In Ibbenbüren hat eine Gruppe junger Männer in der Nacht zum 04.05.2025 auf der Weberstraße einen Mann angegriffen und ...,"https://images.bild.de/683ec26dde084c0b052b8389/419754f4c1db510bf947af0b2a86ca7e-landscape,61dd6835?w=1280",2025-06-03T09:40:29Z,https://web.archive.org/web/20250603100334/https://www.bild.de/regional/nordrhein-westfalen/ibbenbueren-zeugen-nach-koerperverletzung-auf-der-weberstrasse-gesucht-683ec26dde084c0b052b8389,"Nach Beschluss zu Asyl-Zurückweisungen: Merz-Machtwort zu Grenzkontrollen
Nach Beschluss zu Asyl-Zurückweisungen: Merz-Machtwort zu Grenzkontrollen
Nach Beschluss zu Asyl-Zurückweisungen: Merz-Mach… [+548 chars]",,de,'Angriff'
https://www.morgenpost.de/politik/article409165362/tupolew-tu-95-bomber-russland-ukraine-drohnen-angriff-putin.html,https://www.morgenpost.de/politik/article409165362/tupolew-tu-95-bomber-russland-ukraine-drohnen-angriff-putin.html,0,www.morgenpost.de,Drohnen-Attacke zerstört Putins „Bär“ – So fatal ist der Verlust,Der ukrainische Drohnen-Angriff zerstörte wohl auch viele Atomwaffen-Bomber. Was können die Flugzeuge? Und wie schwer wiegt ihr Verlust?,https://img.sparknews.funkemedien.de/409175762/409175762_1748944042_v16_9_1600.jpeg,2025-06-03T09:47:21Z,http://archive.md/20250603095816/https://www.morgenpost.de/politik/article409165362/tupolew-tu-95-bomber-russland-ukraine-drohnen-angriff-putin.html,"Berlin. Der ukrainische Drohnen-Angriff zerstörte wohl auch viele Atomwaffen-Bomber. Was können die Flugzeuge? Und wie schwer wiegt ihr Verlust?
Zusammenfassung
<ul><li>Der ukrainische Geheimdienst… [+7772 chars]",,de,'Angriff'
https://www.stern.de/gesellschaft/regional/hessen/energie-sparen--schule-in-suedhessen-gewinnt-klimaschutz-preis-35777594.html,https://www.stern.de/gesellschaft/regional/hessen/energie-sparen--schule-in-suedhessen-gewinnt-klimaschutz-preis-35777594.html,0,www.stern.de,Energie sparen: Schule in Südhessen gewinnt Klimaschutz-Preis,Griesheim (lhe) - Die Gerhart-Hauptmann-Schule in Griesheim (Kreis Darmstadt-Dieburg) hat den Energiesparmeister-Wettbewerb in Hessen gewonnen. Die,https://image.stern.de/35777596/t/zA/v1/w1440/r1.7778/-/03--7b4yxky6p4v4axs2048jpeg---ed02846562f82eb4.jpg,2025-06-03T10:12:52Z,https://web.archive.org/web/20250603102921/https://www.stern.de/gesellschaft/regional/hessen/energie-sparen--schule-in-suedhessen-gewinnt-klimaschutz-preis-35777594.html,"Kopiere den aktuellen Link
Zur Merkliste hinzufügen
Wie lässt sich Energie beim Heizen sparen? Eine Schule in Griesheim hat dafür eine überzeugende Idee.
Die Gerhart-Hauptmann-Schule in Griesheim … [+750 chars]",,de,'Preis'
https://www.n-tv.de/politik/Ukraine-Krieg-Selenskyj-droht-Russland-mit-noch-ein-paar-mehr-Massnahmen-article25809142.html,https://www.n-tv.de/politik/Ukraine-Krieg-Selenskyj-droht-Russland-mit-noch-ein-paar-mehr-Massnahmen-article25809142.html,0,www.n-tv.de,"Kiew erwägt ""mehr Maßnahmen"": Plant die Ukraine die nächsten Überraschungsangriffe?","Der ukrainische Staatschef Selenskyj kritisiert das Auftreten der Delegation aus Moskau bei den Verhandlungen in Istanbul. Kurz nach den aufsehenerregenden Attacken auf vier russische Militärflughäfen zieht er weitere Schritte in Betracht, um Druck auszuüben.",https://www.n-tv.de/img/incoming/crop25809407/5031328726-cImg_16_9-w1200/imago821252520.jpg,2025-06-03T10:24:53Z,https://web.archive.org/web/20250603102840/https://www.n-tv.de/politik/Ukraine-Krieg-Selenskyj-droht-Russland-mit-noch-ein-paar-mehr-Massnahmen-article25809142.html,Der ukrainische Staatschef Selenskyj kritisiert das Auftreten der Delegation aus Moskau bei den Verhandlungen in Istanbul. Kurz nach den aufsehenerregenden Attacken auf vier russische Militärflughäfe… [+2194 chars],,de,'Ukraine'
https://www.tagesspiegel.de/internationales/schlimmster-tag-seit-herbst-2022-was-russische-blogger-uber-die-operation-spinnennetz-schreiben-13794709.html,https://www.tagesspiegel.de/internationales/schlimmster-tag-seit-herbst-2022-was-russische-blogger-uber-die-operation-spinnennetz-schreiben-13794709.html,0,www.tagesspiegel.de,„Schlimmster Tag seit Herbst 2022“: Was russische Blogger über die „Operation Spinnennetz“ schreiben,Mehr als ein Dutzend strategische russische Bomber hat der ukrainische Geheimdienst zerstört. Der Kreml spielt den Ausmaß des Angriffs herunter – Kriegsblogger fordern Konsequenzen.,https://www.tagesspiegel.de/images/13795132/alternates/BASE_16_9_W1400/1748946784000/russia-ukraine-conflict.jpeg,2025-06-03T10:40:04Z,https://web.archive.org/web/20250603161029/https://www.tagesspiegel.de/internationales/schlimmster-tag-seit-herbst-2022-was-russische-blogger-uber-die-operation-spinnennetz-schreiben-13794709.html,"Das russische Verteidigungsministerium war von Beginn an versucht, den ukrainischen Angriff auf seine strategischen Bomber herunterzuspielen. Das Feuer wurde gelöscht. Es gibt keine Opfer unter den S… [+4996 chars]",,de,'Angriff'
https://www.stern.de/news/selenskyj-wirft-russland--vorsaetzlichen-angriff--auf-zivilisten-in-sumy-vor-35777708.html,https://www.stern.de/news/selenskyj-wirft-russland--vorsaetzlichen-angriff--auf-zivilisten-in-sumy-vor-35777708.html,0,www.stern.de,"Selenskyj wirft Russland ""vorsätzlichen Angriff"" auf Zivilisten in Sumy vor","Nach russischen Raketenangriffen auf die Stadt Sumy mit drei Toten hat der ukrainische Präsident Wolodymyr Selenskyj Moskau den vorsätzlichen Beschuss von Zivilisten vorgeworfen. Russland habe ""direkt"" auf die Stadt gezielt, schrieb Selenskyj am Dienstag in e…",https://image.stern.de/35777710/t/FB/v1/w1440/r1.7778/-/03--ukrainische-rettungskraefte-in-sumy---fd260a5094899c5b.jpg,2025-06-03T10:42:33Z,,"Kopiere den aktuellen Link
Zur Merkliste hinzufügen
Nach russischen Raketenangriffen auf die Stadt Sumy mit drei Toten hat der ukrainische Präsident Wolodymyr Selenskyj Moskau den vorsätzlichen Bes… [+1385 chars]",,de,'Russland'
https://www.bild.de/politik/ausland-und-internationales/hier-baute-kiew-seine-bomber-drohnen-zusammen-683da0e45f7a8d25a5beba48,https://www.bild.de/politik/ausland-und-internationales/hier-baute-kiew-seine-bomber-drohnen-zusammen-683da0e45f7a8d25a5beba48,0,www.bild.de,Sprengstoff aus Kasachstan? - Hier baute Kiew seine Bomber-Drohnen zusammen,Die Drohnen für den ukrainischen Angriff auf Russlands Luftwaffe sollen in einem Lagerhaus in der russischen Großstadt Tscheljabinsk montiert worden sein.,"https://images.bild.de/683da0e45f7a8d25a5beba48/d7a53c10ec9b2c40776fa913e3b6653c,a2717279?w=1280",2025-06-03T10:47:16Z,https://web.archive.org/web/20250603105540/https://www.bild.de/politik/ausland-und-internationales/hier-baute-kiew-seine-bomber-drohnen-zusammen-683da0e45f7a8d25a5beba48,Kiew/Moskau Mit der Operation Spinnennetz hat die Ukraine am Wochenende vier russische Luftwaffenstützpunkte ins Visier genommen und mit Drohnen angegriffen. Dabei wurden nach Angaben westlicher Gehe… [+2151 chars],,de,'Russland'
