index,url,valid,domain,title,description,image,published,archive,content,quote,language,keyword
https://www.stern.de/gesellschaft/interview-mit--klima-shakira---aktivistin-soll-oesterreich-verlassen-35623656.html,https://www.stern.de/gesellschaft/interview-mit--klima-shakira---aktivistin-soll-oesterreich-verlassen-35623656.html,0,www.stern.de,"Deutsche Klima-Aktivistin: ""Ich werde des Landes verwiesen? Das macht doch keinen Sinn!""","Gegen die deutsche Aktivistin Anja Windl wurde ein Aufenthaltsverbot in Österreich ausgesprochen. Im Interview erzählt sie, wie es für sie weitergeht, und ob sie ihre Aktionen bereut.",https://image.stern.de/35623662/t/zT/v3/w1440/r1.7778/-/anja-windl-aufmacher.jpg,2025-04-10T06:54:00Z,https://web.archive.org/web/20250410093512/https://www.stern.de/gesellschaft/interview-mit--klima-shakira---aktivistin-soll-oesterreich-verlassen-35623656.html,"Kopiere den aktuellen Link
Zur Merkliste hinzufügen
Gegen die deutsche Aktivistin Anja Windl wurde ein Aufenthaltsverbot in Österreich ausgesprochen. Im Interview erzählt sie, wie es für sie weiter… [+1247 chars]",,de,'Klima'
https://www.diepresse.com/19565720/klimaminister-totschnig-will-weg-zur-co2-speicherung-frei-machen,https://www.diepresse.com/19565720/klimaminister-totschnig-will-weg-zur-co2-speicherung-frei-machen,0,www.diepresse.com,Klimaminister Totschnig will Weg zur CO2-Speicherung frei machen,Die Regierung will CO2-Speicherung ermöglichen. Doch die Umsetzung bringt technische und finanzielle Herausforderungen.,https://img.diepresse.com/public/incoming/3xiukj-imago780309231.jpg/alternates/DPR_SOCIAL_NACHRICHTEN/imago780309231.jpg,2025-04-10T07:23:18Z,,"Die Regierung will CO2-Speicherung ermöglichen. Doch die Umsetzung bringt technische und finanzielle Herausforderungen.
Klima- und Landwirtschaftsminister Norbert Totschnig (ÖVP) hat sich für die Au… [+2538 chars]",,de,'Klima'
https://www.zeit.de/news/2025-04/10/18-jaehriger-aus-psychiatrie-entwichen,https://www.zeit.de/news/2025-04/10/18-jaehriger-aus-psychiatrie-entwichen,0,www.zeit.de,Flucht aus dem Maßregelvollzug: 18-Jähriger aus Psychiatrie entwichen,Hier finden Sie Informationen zu dem Thema „Flucht aus dem Maßregelvollzug“. Lesen Sie jetzt „18-Jähriger aus Psychiatrie entwichen“.,https://img.zeit.de/news/2025-04/10/18-jaehriger-aus-psychiatrie-entwichen-image-group/wide__1300x731,2025-04-10T08:43:40Z,,"Die Polizei sucht einen 18-Jährigen, der seit viereinhalb Jahren wegen eines Tötungsdelikts in der Psychiatrie-Klinik in Viersen-Süchteln untergebracht gewesen ist. Gegen Mitternacht sei aufgefallen,… [+906 chars]",,de,'Flucht'
https://www.faz.net/aktuell/feuilleton/medien-und-film/kino/the-amateur-im-kino-rami-malek-auf-ausgekluegelter-moerderjagd-110409634.html,https://www.faz.net/aktuell/feuilleton/medien-und-film/kino/the-amateur-im-kino-rami-malek-auf-ausgekluegelter-moerderjagd-110409634.html,0,www.faz.net,Kinofilm „The Amateur“: Leg dich nicht mit dem Bastler an,"Was tun, wenn man Rache nehmen will, aber Waffen nicht ausstehen kann? Rami Malek hat im Kino-Agententhriller „The Amateur“ bei der Mörderjagd ausgeklügelte Ideen.",https://media1.faz.net/ppmedia/aktuell/1110389670/1.10409633/facebook_teaser/rami-malek-als-cia.jpg,2025-04-10T09:10:23Z,https://web.archive.org/web/20250410101221/https://www.faz.net/aktuell/feuilleton/medien-und-film/kino/the-amateur-im-kino-rami-malek-auf-ausgekluegelter-moerderjagd-110409634.html,"Wenn Männer in Filmen Rache für ihre getötete Geliebte schwören, geht es danach meist blutig und brutal zu. Ridley Scott nahm das Thema als Ausgangspunkt für sein Historiendrama Gladiator (römischer … [+5912 chars]",,de,'Waffen'
https://www.bild.de/politik/washington-russland-laesst-ballerina-xenia-karelina-frei-67f78b9e38c3276cfc92b60a,https://www.bild.de/politik/washington-russland-laesst-ballerina-xenia-karelina-frei-67f78b9e38c3276cfc92b60a,0,www.bild.de,Außenminister Rubio teilt mit - Russland lässt Ballerina Xenia Karelina frei,Russland hat die US-russische Ballerina Xenia Karelina freigelassen.,"https://images.bild.de/67f78b9e38c3276cfc92b60a/75635be4f4fade013fb955dc545f16db,583028f6?w=1280",2025-04-10T09:16:38Z,http://archive.md/20250410100416/https://www.bild.de/politik/washington-russland-laesst-ballerina-xenia-karelina-frei-67f78b9e38c3276cfc92b60a,"Russland hat die US-russische Ballerina Xenia Karelina freigelassen. Das teilte Auenminister Marco Rubio am Donnerstag in Washington mit.
Karelina war im August des vergangenen Jahres unter fadensch… [+232 chars]",,de,'Wladimir Putin'
https://www.zeit.de/news/2025-04/10/prozess-gegen-waffensammler-aus-nordfriesland-hat-begonnen,https://www.zeit.de/news/2025-04/10/prozess-gegen-waffensammler-aus-nordfriesland-hat-begonnen,0,www.zeit.de,Prozesse: Prozess gegen Waffensammler aus Nordfriesland hat begonnen,Hier finden Sie Informationen zu dem Thema „Prozesse“. Lesen Sie jetzt „Prozess gegen Waffensammler aus Nordfriesland hat begonnen“.,https://img.zeit.de/news/2025-04/10/prozess-gegen-waffensammler-aus-nordfriesland-hat-begonnen-image-group/wide__1300x731,2025-04-10T09:28:32Z,,Flensburg/Husum (dpa/lno)- Gegen einen 68 Jahre alter Waffensammler aus Nordfriesland hat vor dem Amtsgericht Husum der Prozess wegen Verstoßes gegen das Waffengesetz begonnen. Dem Mann wird vorgewor… [+1012 chars],,de,'Waffen'
https://www.zeit.de/wirtschaft/2025-04/wirtschaftslage-krise-wachstum-konjunktur-gutachten-diw-ifo,https://www.zeit.de/wirtschaft/2025-04/wirtschaftslage-krise-wachstum-konjunktur-gutachten-diw-ifo,0,www.zeit.de,Gemeinschaftsdiagnose: Institute rechnen mit weiterer Stagnation deutscher Wirtschaft,Führende Wirtschaftsinstitute sehen Deutschland weiter in der Krise. Laut ihrer Frühjahrsprognose wird das Bruttoinlandsprodukt 2025 nur minimal steigen.,https://img.zeit.de/wirtschaft/2025-04/fruehjahrsprognose-wirtschaft-bild/wide__1300x731,2025-04-10T09:30:26Z,http://archive.md/20250410101137/https://www.zeit.de/wirtschaft/2025-04/wirtschaftslage-krise-wachstum-konjunktur-gutachten-diw-ifo,"Die führenden Wirtschaftsinstitute Deutschlands rechnen für 2025 mit einem kaum spürbaren Wachstum. Laut ihrem Frühjahrsgutachten steigt das Bruttoinlandsprodukt im laufenden Jahr nur um 0,1 Prozent,… [+4727 chars]",,de,'Krise'
https://www.zeit.de/news/2025-04/10/medien-usa-und-russland-tauschen-gefangene-aus,https://www.zeit.de/news/2025-04/10/medien-usa-und-russland-tauschen-gefangene-aus,0,www.zeit.de,Geheimdienst-Operation: Medien: USA und Russland tauschen Gefangene aus,Hier finden Sie Informationen zu dem Thema „Geheimdienst-Operation“. Lesen Sie jetzt „Medien: USA und Russland tauschen Gefangene aus“.,https://img.zeit.de/news/2025-04/10/medien-usa-und-russland-tauschen-gefangene-aus-image-group/wide__1300x731,2025-04-10T09:37:44Z,,Die USA und Russland haben laut Medienberichten in einem neuen Gefangenenaustausch in Dubai zwei Verurteilte auf freien Fuß gesetzt. Das «Wall Street Journal» berichtete unter Berufung auf CIA-Direkt… [+1236 chars],,de,'Russland'
https://www.stern.de/politik/ausland/geheimdienst-operation--medien--usa-und-russland-tauschen-gefangene-aus-35629110.html,https://www.stern.de/politik/ausland/geheimdienst-operation--medien--usa-und-russland-tauschen-gefangene-aus-35629110.html,0,www.stern.de,Geheimdienst-Operation: Medien: USA und Russland tauschen Gefangene aus,Nach dem großen Gefangenenaustausch im August haben Moskau und Washington erneut zwei Inhaftierte entlassen. Laut Berichten kamen eine Doppelstaatlerin in Russland und ein verhafteter Russe frei.,https://image.stern.de/35629112/t/am/v1/w1440/r1.7778/-/10--kemcx2ia73v18axs2048jpeg---793b95ca1edf3192.jpg,2025-04-10T09:37:44Z,,"Kopiere den aktuellen Link
Zur Merkliste hinzufügen
Nach dem großen Gefangenenaustausch im August haben Moskau und Washington erneut zwei Inhaftierte entlassen. Laut Berichten kamen eine Doppelstaa… [+1447 chars]",,de,'Russland'
https://www.golem.de/sonstiges/zustimmung/auswahl.html?from=https://www.golem.de/news/dekarbonisierung-ohne-fossile-brennstoffe-steigt-die-energiesicherheit-2504-195219.html&referer=https://t.co/d5ec708656,https://www.golem.de/sonstiges/zustimmung/auswahl.html?from=https://www.golem.de/news/dekarbonisierung-ohne-fossile-brennstoffe-steigt-die-energiesicherheit-2504-195219.html&referer=https://t.co/d5ec708656,0,www.golem.de,Dekarbonisierung: Ohne fossile Brennstoffe steigt die Energiesicherheit,"Der Import von Öl und Gas hat weltweit Abhängigkeiten geschaffen. Zwei wichtige Punkte erneuerbarer Energien könnten diese zum Vorteil aller auflösen. (Energiewende, Solarenergie)",,2025-04-10T09:45:02Z,https://web.archive.org/web/20250413034029/https://www.golem.de/sonstiges/zustimmung/auswahl.html?from=https:%2F%2Fwww.golem.de%2Fnews%2Fdekarbonisierung-ohne-fossile-brennstoffe-steigt-die-energiesicherheit-2504-195219.html&referer=https:%2F%2Ft.co%2Fd5ec708656,"Besuchen Sie Golem.de wie gewohnt mit Werbung und Tracking,
 indem Sie der Nutzung aller Cookies zustimmen.
 Details zum Tracking finden Sie im Privacy Center.
Skript wurde nicht geladen. Informat… [+607 chars]",,de,'Gas'
https://www.zeit.de/news/2025-04/10/northvolt-anleihe-weitere-akten-sollen-oeffentlich-werden,https://www.zeit.de/news/2025-04/10/northvolt-anleihe-weitere-akten-sollen-oeffentlich-werden,0,www.zeit.de,Krise bei Batteriehersteller: Northvolt-Anleihe – Weitere Akten sollen öffentlich werden,Hier finden Sie Informationen zu dem Thema „Krise bei Batteriehersteller“. Lesen Sie jetzt „Northvolt-Anleihe – Weitere Akten sollen öffentlich werden“.,https://img.zeit.de/news/2025-04/10/northvolt-anleihe-weitere-akten-sollen-oeffentlich-werden-image-group/wide__1300x731,2025-04-10T10:25:25Z,https://web.archive.org/web/20250411135719/https://www.zeit.de/news/2025-04/10/northvolt-anleihe-weitere-akten-sollen-oeffentlich-werden,"Die Regierung in Schleswig-Holstein will dem Landtag weitere Informationen zur Bürgschaft für den schwedischen Batterieproduzenten Northvolt geben. Dabei handelt es sich um 782 Seiten, die nun freige… [+2570 chars]",,de,'Krise'
https://www.n-tv.de/politik/Russland-Deutscher-und-US-russische-Ballerina-kommen-frei-Gefangenenaustausch-zwischen-Russland-und-den-USA-article25694567.html,https://www.n-tv.de/politik/Russland-Deutscher-und-US-russische-Ballerina-kommen-frei-Gefangenenaustausch-zwischen-Russland-und-den-USA-article25694567.html,0,www.n-tv.de,"""Trump hat Freilassung erwirkt"": Moskau lässt Ballerina frei - Gefangenenaustausch mit USA","Während sich in Istanbul Delegationen der USA und Russlands treffen, gibt es in Abu Dhabi einen Gefangenenaustausch. Ein Russland-Deutscher kommt frei - und die Ballerina Xenia Karelina, die wegen 50 Dollar wegen ""Hochverrats"" verurteilt worden war.",https://www.n-tv.de/img/incoming/crop25694577/9041324522-cImg_16_9-w1200/baa97c05865973e9863989878099b579.jpg,2025-04-10T10:31:59Z,,"Während sich in Istanbul Delegationen der USA und Russlands treffen, gibt es in Abu Dhabi einen Gefangenenaustausch. Ein Russland-Deutscher kommt frei - und die Ballerina Xenia Karelina, die wegen 50… [+2493 chars]",,de,'Russland'
https://www.tagesspiegel.de/berlin/am-berliner-alexanderplatz-mann-bei-angriff-in-strassenbahn-mit-messer-verletzt-13519525.html,https://www.tagesspiegel.de/berlin/am-berliner-alexanderplatz-mann-bei-angriff-in-strassenbahn-mit-messer-verletzt-13519525.html,0,www.tagesspiegel.de,Am Berliner Alexanderplatz: Mann bei Angriff in Straßenbahn mit Messer verletzt,"Nachdem er in einer Straßenbahn herumgeschrien hatte, greift ein Unbekannter einen 57-Jährigen unvermittelt mit einem Messer an. Der Täter flüchtet, das Opfer muss im Krankenhaus behandelt werden.",https://www.tagesspiegel.de/images/13519516/alternates/BASE_16_9_W1400/1744281247000/polizei-symbolbild.jpeg,2025-04-10T10:38:18Z,,In einer Straßenbahn am Alexanderplatz hat ein Unbekannter einen 57-Jährigen mit einem Messer verletzt. Das teilte die Berliner Polizei am Donnerstag mit. Demnach soll der Angegriffene sich am frühen… [+1884 chars],,de,'Angriff'
https://www.tagesspiegel.de/internationales/manover-ramstein-flag-deutsche-luftwaffe-ubt-mit-nato-partnern-die-abwehr-einer-russischen-invasion-13518358.html,https://www.tagesspiegel.de/internationales/manover-ramstein-flag-deutsche-luftwaffe-ubt-mit-nato-partnern-die-abwehr-einer-russischen-invasion-13518358.html,0,www.tagesspiegel.de,Manöver „Ramstein Flag“: Deutsche Luftwaffe übt mit Nato-Partnern die Abwehr einer russischen Invasion,"Geheimdienste gehen davon aus, dass Russland spätestens 2030 in der Lage sein dürfte, in Europa einen weiteren Krieg zu beginnen. Die Nato-Luftstreitkräfte bereiten sich darauf vor.",https://www.tagesspiegel.de/images/13518619/alternates/BASE_16_9_W1400/1744275515000/netherlands-nato-defence-exercise.jpeg,2025-04-10T10:48:12Z,,Mehrfach wurde in jüngerer Vergangenheit vor einem russischen Angriff auf Nato-Gebiet in den kommenden Jahren gewarnt. Militärexperte Carlo Masala etwa nannte Estland als mögliches Ziel. Sollte das p… [+4672 chars],,de,'Russland'
https://www.tagesspiegel.de/internationales/geheimdienst-operation-geheimdienst-usa-und-russland-tauschen-gefangene-aus-13519735.html,https://www.tagesspiegel.de/internationales/geheimdienst-operation-geheimdienst-usa-und-russland-tauschen-gefangene-aus-13519735.html,0,www.tagesspiegel.de,Geheimdienst-Operation: Geheimdienst: USA und Russland tauschen Gefangene aus,Nach dem großen Gefangenenaustausch im August haben Moskau und Washington erneut zwei Inhaftierte entlassen. Eine Doppelstaatlerin in Russland und ein verhafteter Russe aus den USA sind frei.,https://www.tagesspiegel.de/images/13519732/alternates/BASE_16_9_W1400/1744282179000/xenia-karelina.jpeg,2025-04-10T10:49:39Z,,"Die USA und Russland haben in einem neuen Gefangenenaustausch in Abu Dhabi zwei Inhaftierte auf freien Fuß gesetzt. Das Wall Street Journal berichtete unter Berufung auf CIA-Direktor John Ratcliffe, … [+3288 chars]",,de,'Russland'
https://www.berliner-zeitung.de/news/chinesen-im-ukrainekrieg-unsere-freiwilligen-kommen-aus-laendern-die-uns-unterstuetzen-li.2315497,https://www.berliner-zeitung.de/news/chinesen-im-ukrainekrieg-unsere-freiwilligen-kommen-aus-laendern-die-uns-unterstuetzen-li.2315497,0,www.berliner-zeitung.de,"Chinesen im Ukrainekrieg? „Unsere Freiwilligen kommen aus Ländern, die uns unterstützen“","In einem neuen Interview sprach Andrij Jermak über Trumps Verhandlungen mit Russland und der Ukraine, chinesische Gefangene im Krieg und künftige Wahlen.",https://berliner-zeitung.imgix.net/2025/04/10/4504d760-3ebe-4bb9-b26a-79ec2aee926d.jpeg?w=1024&auto=format,2025-04-10T11:23:51Z,https://web.archive.org/web/20250410130106/https://www.berliner-zeitung.de/news/chinesen-im-ukrainekrieg-unsere-freiwilligen-kommen-aus-laendern-die-uns-unterstuetzen-li.2315497,"Der Chef des Präsidialamtes der Ukraine, Andrij Jermak, hat in einem neuen Interview erklärt, dass die angebliche Beteiligung chinesischer Rekruten in der Ukraine aufseiten Russlands eine ernste Ange… [+3176 chars]",,de,'Ukraine'
https://www.dw.com/de/neuer-gefangenenaustausch-zwischen-den-usa-und-russland/a-72197793,https://www.dw.com/de/neuer-gefangenenaustausch-zwischen-den-usa-und-russland/a-72197793,0,www.dw.com,Neuer Gefangenenaustausch zwischen den USA und Russland,"Die russisch-amerikanische Ballerina Xenia Karelina ist aus russischer Haft freigekommen, im Gegenzug entließen die Amerikaner den Deutsch-Russen Artur Petrow.",https://static.dw.com/image/72197380_6.jpg,2025-04-10T11:38:00Z,,Xenia Karelina war im August in Russland wegen Hochverrats zu einer zwölfjährigen Haftstrafe verurteilt worden. Die gebürtige Russin aus Los Angeles war im Februar 2024 während eines Familienbesuchs … [+2005 chars],,de,'Russland'
https://www.golem.de/sonstiges/zustimmung/auswahl.html?from=https://www.golem.de/news/anzeige-tragbare-powerstation-von-jackery-zum-halben-preis-sichern-2504-195228.html&referer=https://t.co/73f6d37fcd,https://www.golem.de/sonstiges/zustimmung/auswahl.html?from=https://www.golem.de/news/anzeige-tragbare-powerstation-von-jackery-zum-halben-preis-sichern-2504-195228.html&referer=https://t.co/73f6d37fcd,0,www.golem.de,Anzeige: Tragbare Powerstation von Jackery zum halben Preis sichern,"Wenn unterwegs oder zu Hause plötzlich der Strom fehlt, bietet die Powerstation von Jackery eine leise und mobile Lösung - ganz ohne Benzin. (Technik/Hardware, Powerstation)",,2025-04-10T11:44:01Z,,"Besuchen Sie Golem.de wie gewohnt mit Werbung und Tracking,
 indem Sie der Nutzung aller Cookies zustimmen.
 Details zum Tracking finden Sie im Privacy Center.
Skript wurde nicht geladen. Informat… [+607 chars]",,de,'Preis'
https://www.tagesspiegel.de/berlin/staatsschutz-ermittelt-mann-pobelt-in-berliner-hostel-und-zeigt-hitlergruss-13520683.html,https://www.tagesspiegel.de/berlin/staatsschutz-ermittelt-mann-pobelt-in-berliner-hostel-und-zeigt-hitlergruss-13520683.html,0,www.tagesspiegel.de,Staatsschutz ermittelt: Mann pöbelt in Berliner Hostel und zeigt Hitlergruß,"Ein ehemaliger Gast pöbelt alkoholisiert vor einem Hostel im Berliner Zentrum. Als Polizeikräfte eintreffen, wird die Szene skurril: Zuerst wirft er einem Polizisten Rassismus vor, dann zeigt er selber den Hitlergruß.",https://www.tagesspiegel.de/images/13520554/alternates/BASE_16_9_W1400/1744286370000/polizei-symbolbild.jpeg,2025-04-10T12:11:19Z,,"Die Berliner Polizei hat einen Mann festgenommen, der in einem Hostel in Mitte gepöbelt und im Anschluss den Hitlergruß gezeigt haben soll. Zunächst erschienen Einsatzkräfte gegen 11.30 Uhr am Mittwo… [+2236 chars]",,de,'Gas'
https://www.stern.de/news/usa-und-russland-tauschen-gefangene-aus---us-russische-taenzerin-karelina-frei-35629140.html,https://www.stern.de/news/usa-und-russland-tauschen-gefangene-aus---us-russische-taenzerin-karelina-frei-35629140.html,0,www.stern.de,USA und Russland tauschen Gefangene aus - US-russische Tänzerin Karelina frei,"Russland und die USA haben am Donnerstag zwei Gefangene ausgetauscht: Moskau übergab am Flughafen von Abu Dhabi in den Vereinigten Arabischen Emiraten die US-russische Ballerina Xenia Karelina, Washington den Deutsch-Russen Arthur Petrow, wie erklärte US-Auße…",https://image.stern.de/35630242/t/2-/v1/w1440/r1.7778/-/10--xenia-karelina-vor-gericht---157ad70b45c0d732.jpg,2025-04-10T12:40:03Z,,"Kopiere den aktuellen Link
Zur Merkliste hinzufügen
Russland und die USA haben am Donnerstag zwei Gefangene ausgetauscht: Moskau übergab am Flughafen von Abu Dhabi in den Vereinigten Arabischen Emi… [+3708 chars]",,de,'Wladimir Putin'
https://www.golem.de/sonstiges/zustimmung/auswahl.html?from=https://www.golem.de/news/anzeige-mobiles-klimageraet-von-midea-im-limitierten-angebot-2504-195230.html&referer=https://t.co/84a8b20917,https://www.golem.de/sonstiges/zustimmung/auswahl.html?from=https://www.golem.de/news/anzeige-mobiles-klimageraet-von-midea-im-limitierten-angebot-2504-195230.html&referer=https://t.co/84a8b20917,0,www.golem.de,Anzeige: Mobiles Klimagerät von Midea im limitierten Angebot,"Der Sommer steht bevor. Passend dazu gibt es derzeit bei Amazon ein mobiles Klimagerät im Angebot. Es ist um 53 Prozent reduziert. (Klima, Amazon)",,2025-04-10T12:48:02Z,,"Besuchen Sie Golem.de wie gewohnt mit Werbung und Tracking,
 indem Sie der Nutzung aller Cookies zustimmen.
 Details zum Tracking finden Sie im Privacy Center.
Skript wurde nicht geladen. Informat… [+607 chars]",,de,'Klima'
https://www.telepolis.de/features/Inflations-Tsunami-Mittelschicht-droht-der-Absturz-10347763.html,https://www.telepolis.de/features/Inflations-Tsunami-Mittelschicht-droht-der-Absturz-10347763.html,0,www.telepolis.de,Inflations-Tsunami: Mittelschicht droht der Absturz,Die Inflation frisst die Ersparnisse der Deutschen auf. Das mittlere Vermögen sank um 16 Prozent. Stürzt die Mittelschicht jetzt komplett ab?,https://heise.cloudimg.io/bound/1200x1200/q85.png-lossy-85.webp-lossy-85.foil1/_www-heise-de_/imgs/18/4/8/3/5/4/1/0/inflation_ho_1_-cab43922340eb73d.png,2025-04-10T13:00:00Z,http://archive.md/20250411150930/https://www.telepolis.de/features/Inflations-Tsunami-Mittelschicht-droht-der-Absturz-10347763.html,"Die Inflation frisst die Ersparnisse der Deutschen auf. Das mittlere Vermögen sank um 16 Prozent. Stürzt die Mittelschicht jetzt komplett ab?
Die Inflation der letzten Jahre hat in Deutschland ein g… [+3648 chars]",,de,'Inflation'
https://www.morgenpost.de/ratgeber-wissen/article408297110/heizung-fluessiggas-gasheizung-erneuerbare-energie.html,https://www.morgenpost.de/ratgeber-wissen/article408297110/heizung-fluessiggas-gasheizung-erneuerbare-energie.html,0,www.morgenpost.de,Gasheizung mit Flüssiggas: Ab wann gilt die als erneuerbar?,Flüssiggas kann eine umweltfreundlichere Alternative zur Heizung mit Erdgas sein. Wann ist diese Heizung sinnvoll? Wir haben nachgefragt.,https://img.sparknews.funkemedien.de/408309957/408309957_1739542061_v16_9_1600.jpeg,2025-04-10T13:05:00Z,https://web.archive.org/web/20250410155701/https://www.morgenpost.de/ratgeber-wissen/article408297110/heizung-fluessiggas-gasheizung-erneuerbare-energie.html,"Flüssiggas kann eine umweltfreundlichere Alternative zum Erdgas sein. Die Heizung ist vor allem für bestimmte Gegenden interessant.
Viele Eigenheimbesitzer sind über die Zukunft ihrer Heizung veruns… [+8022 chars]",,de,'Gas'
https://www.stern.de/gesellschaft/regional/berlin-brandenburg/kriminalitaet--macheten-angriff-auf-tochter---prozess-wegen-mordversuchs-35630450.html,https://www.stern.de/gesellschaft/regional/berlin-brandenburg/kriminalitaet--macheten-angriff-auf-tochter---prozess-wegen-mordversuchs-35630450.html,0,www.stern.de,Kriminalität: Macheten-Angriff auf Tochter – Prozess wegen Mordversuchs,Ein Vater attackiert in einem Pflegeheim seine Tochter. Mit einem großen Messer bringt er die Frau beinahe um. Das Gericht prüft den Fall nun in Abwesenheit des an Demenz erkranken Seniors.,https://image.stern.de/35630452/t/3L/v1/w1440/r1.7778/-/10--2tmhou6qbzv19axs2048jpeg---5e2b2a81355517be.jpg,2025-04-10T13:16:14Z,,"Kopiere den aktuellen Link
Zur Merkliste hinzufügen
Ein Vater attackiert in einem Pflegeheim seine Tochter. Mit einem großen Messer bringt er die Frau beinahe um. Das Gericht prüft den Fall nun in … [+2169 chars]",,de,'Angriff'
https://www.zeit.de/news/2025-04/10/macheten-angriff-auf-tochter-prozess-wegen-mordversuchs,https://www.zeit.de/news/2025-04/10/macheten-angriff-auf-tochter-prozess-wegen-mordversuchs,0,www.zeit.de,Kriminalität: Macheten-Angriff auf Tochter – Prozess wegen Mordversuchs,Hier finden Sie Informationen zu dem Thema „Kriminalität“. Lesen Sie jetzt „Macheten-Angriff auf Tochter – Prozess wegen Mordversuchs“.,https://img.zeit.de/news/2025-04/10/macheten-angriff-auf-tochter-prozess-wegen-mordversuchs-image-group/wide__1300x731,2025-04-10T13:16:14Z,,Nach einem Macheten-Angriff auf eine 44-Jährige in einem Pflegeheim wird der Fall vor dem Berliner Landgericht verhandelt. Dem 75 Jahre alten Vater der Frau wird versuchter Mord zur Last gelegt. Die … [+1964 chars],,de,'Angriff'
https://www.tagesspiegel.de/berlin/vater-hatte-44-jahrige-beinahe-getotet-nach-macheten-angriff-auf-tochter--prozess-wegen-mordversuchs-vor-berliner-landgericht-13521967.html,https://www.tagesspiegel.de/berlin/vater-hatte-44-jahrige-beinahe-getotet-nach-macheten-angriff-auf-tochter--prozess-wegen-mordversuchs-vor-berliner-landgericht-13521967.html,0,www.tagesspiegel.de,Vater hatte 44-Jährige beinahe getötet: Nach Macheten-Angriff auf Tochter – Prozess wegen Mordversuchs vor Berliner Landgericht,Ein Vater attackiert in einem Pflegeheim seine Tochter. Mit einem großen Messer bringt er die Frau beinahe um. Das Gericht prüft den Fall nun in Abwesenheit des an Demenz erkranken Seniors.,https://www.tagesspiegel.de/images/13521964/alternates/BASE_16_9_W1400/1744291232000/justiz.jpeg,2025-04-10T13:17:07Z,,Nach einem Macheten-Angriff auf eine 44-Jährige in einem Pflegeheim wird der Fall vor dem Berliner Landgericht verhandelt. Dem 75 Jahre alten Vater der Frau wird versuchter Mord zur Last gelegt. Die … [+3013 chars],,de,'Angriff'
https://www.tagesspiegel.de/berlin/macheten-angriff-in-berliner-seniorenheim-papa-hatte-angerufen-weil-der-kuhlschrank-angeblich-nicht-funktionierte-13521967.html,https://www.tagesspiegel.de/berlin/macheten-angriff-in-berliner-seniorenheim-papa-hatte-angerufen-weil-der-kuhlschrank-angeblich-nicht-funktionierte-13521967.html,0,www.tagesspiegel.de,"Macheten-Angriff in Berliner Seniorenheim: „Papa hatte angerufen, weil der Kühlschrank angeblich nicht funktionierte“",In einem Reinickendorfer Pflegeheim soll ein 75-Jähriger seine Tochter beinahe mit einer Machete getötet haben. Nun beginnt der Prozess wegen versuchten Mordes – ohne den Angeklagten.,https://www.tagesspiegel.de/images/13521964/alternates/BASE_16_9_W1400/1744291232000/justiz.jpeg,2025-04-10T13:17:07Z,,"Die Tochter wollte nur kurz nach dem Kühlschrank sehen, den sie ihrem Vater zwei Tage zuvor ins Pflegeheim gebracht hatte. Das war an einem Samstag, als ich im Krankenhaus aufwachte, war es Freitag, … [+2576 chars]",,de,'Angriff'
