index,url,valid,domain,title,description,image,published,archive,content,quote,language,keyword
https://www.freitag.de/autoren/lutz-herden/wenn-die-wuerfel-fallen,https://www.freitag.de/autoren/lutz-herden/wenn-die-wuerfel-fallen,0,www.freitag.de,Ukraine | Wenn die Würfel fallen,"Russland und die USA sind sich in vielen Punkten einig. Jedoch müssen Kiew und Moskau ebenfalls verhandeln Bei Friedensverträgen gibt es häufig Sieger und Verlierer, Überlegene und Unterlegene, Konzessionen und Kompromisse, nie aber einen solchen Interessenau…",https://www.freitag.de/autoren/lutz-herden/wenn-die-wuerfel-fallen/@@images/image/great,2025-05-01T02:00:00Z,http://archive.md/20250501152623/https://www.freitag.de/autoren/lutz-herden/wenn-die-wuerfel-fallen,"Russland und die USA sind sich in vielen Punkten einig. Jedoch müssen Kiew und Moskau ebenfalls verhandeln
Das war Rom. Donald Trump gönnte Wolodymyr Selenskyj 15 Minuten
 Foto: Imago Images
Bei F… [+5504 chars]",,de,'Ukraine'
https://www.welt.de/politik/ausland/article256044660/Ukraine-Krieg-Mit-diesem-Deal-erhoeht-Trump-den-Druck-auf-Putin-massiv.html,https://www.welt.de/politik/ausland/article256044660/Ukraine-Krieg-Mit-diesem-Deal-erhoeht-Trump-den-Druck-auf-Putin-massiv.html,0,www.welt.de,Mit diesem Deal erhöht Trump den Druck auf Putin massiv,"Während Moskau eine dauerhafte Waffenruhe im Krieg gegen die Ukraine verweigert, nähern sich Kiew und Washington durch ein neues Abkommen an. Das ist nicht der einzige Hebel, den die USA jetzt ansetzen wollen, um Moskau zum Einlenken zu bewegen.",https://img.welt.de/img/politik/ausland/mobile256046796/9377931637-ci16x9-w1200/President-Trump-Delivers-Remarks-From-The-White-House-On-Investing-In-America.jpg,2025-05-01T02:31:45Z,https://web.archive.org/web/20250501125042/https://www.welt.de/politik/ausland/article256044660/Ukraine-Krieg-Mit-diesem-Deal-erhoeht-Trump-den-Druck-auf-Putin-massiv.html,"Während Moskau eine dauerhafte Waffenruhe im Krieg gegen die Ukraine verweigert, nähern sich Kiew und Washington durch ein neues Abkommen an. Das ist nicht der einzige Hebel, den die USA jetzt ansetz… [+3723 chars]",,de,'Waffen'
https://www.sueddeutsche.de/politik/rohstoffabkommen-usa-ukraine-details-hintergruende-li.3245005,https://www.sueddeutsche.de/politik/rohstoffabkommen-usa-ukraine-details-hintergruende-li.3245005,0,www.sueddeutsche.de,Diplomatie: Was über das Rohstoffabkommen der USA und der Ukraine bekannt ist,"Die Verhandlungen drohten in einem großen Eklat zu scheitern. Nun haben sich Washington und Kiew doch noch auf einen Deal über den Abbau wichtiger Mineralien und den Wiederaufbau des Landes einigen können. Aber es ist auffällig, wer sich mit Kommentaren darüb…",https://www.sueddeutsche.de/2025/02/26/7dd79832-d994-48d4-81c0-6056c1ad7a27.jpeg?q=60&fm=webp&width=1200&rect=0%2C156%2C3000%2C1687,2025-05-01T03:27:30Z,http://archive.md/20250501040839/https://www.sueddeutsche.de/politik/rohstoffabkommen-usa-ukraine-details-hintergruende-li.3245005,"Beide Länder haben nun einen sogenannten Investitionsfonds für Wiederaufbau beschlossen, die USA sollen dabei bevorzugten Zugang zu Öl, Gas und Seltenen Erden der Ukraine bekommen. Unklar ist, was ge… [+5711 chars]",,de,'Ukraine'
https://www.faz.net/aktuell/politik/ukraine/usa-und-ukraine-einigen-sich-auf-rohstoffabkommen-110449234.html,https://www.faz.net/aktuell/politik/ukraine/usa-und-ukraine-einigen-sich-auf-rohstoffabkommen-110449234.html,0,www.faz.net,Rohstoffdeal USA-Ukraine: Erfolg nach dem Eklat,Die Einigung auf ein Rohstoffabkommen zwischen den USA und der Ukraine kommt zwei Monate später als geplant. Washington nutzt das Abkommen für ein Signal an Moskau. Kiew hebt die „gleichberechtige Zusammenarbeit“ hervor.,https://media0.faz.net/ppmedia/aktuell/feuilleton/336104605/1.10449240/facebook_teaser/der-ukrainische-praesident.jpg,2025-05-01T03:33:53Z,http://archive.md/20250501042407/https://www.faz.net/aktuell/politik/ukraine/usa-und-ukraine-einigen-sich-auf-rohstoffabkommen-110449234.html,"Die Mitteilung kam zwei Monate und viele Unstimmigkeiten später als geplant. Am Mittwochabend gab der amerikanische Finanzminister Scott Bessent schließlich bekannt, Washington und Kiew hätten sich a… [+4837 chars]",,de,'Ukraine'
https://www.morgenpost.de/politik/article408905345/warum-es-in-russland-wieder-einen-flughafen-stalingrad-gibt.html,https://www.morgenpost.de/politik/article408905345/warum-es-in-russland-wieder-einen-flughafen-stalingrad-gibt.html,0,www.morgenpost.de,Warum es in Russland wieder einen Flughafen Stalingrad gibt,"Wladimir Putin biegt sich die Geschichte zurecht, wie er sie braucht. Nun soll der Flughafen von Wolgograd auch wieder Stalins Namen tragen.",https://img.sparknews.funkemedien.de/408905770/408905770_1746089068_v16_9_1600.jpeg,2025-05-01T08:44:29Z,https://web.archive.org/web/20250501104411/https://www.morgenpost.de/politik/article408905345/warum-es-in-russland-wieder-einen-flughafen-stalingrad-gibt.html,"Berlin. Wladimir Putin biegt sich die Geschichte zurecht, wie er sie braucht. Nun soll der Flughafen von Wolgograd auch wieder Stalins Namen tragen.
Fragt man Russinnen und Russen, wen sie für die b… [+2382 chars]",,de,'Wladimir Putin'
https://www.tagesspiegel.de/internationales/wirtschaftspakt-ohne-sicherheitsgarantien-was-uber-den-rohstoffdeal-von-ukraine-und-den-usa-bekannt-ist-13622158.html,https://www.tagesspiegel.de/internationales/wirtschaftspakt-ohne-sicherheitsgarantien-was-uber-den-rohstoffdeal-von-ukraine-und-den-usa-bekannt-ist-13622158.html,0,www.tagesspiegel.de,Wirtschaftspakt ohne Sicherheitsgarantien: Was über den Rohstoffdeal von Ukraine und den USA bekannt ist,"Abbau von Seltenen Erden, Wiederaufbaufonds, aber keine Sicherheitsgarantien: Nach langem Ringen haben Kiew und Washington ein Abkommen geschlossen. Doch noch sind nicht alle Details veröffentlicht.",https://www.tagesspiegel.de/images/13622233/alternates/BASE_16_9_W1400/1746089252000/iron-ore-open-pit-mine-in-kryvyi-rih.jpeg,2025-05-01T09:15:28Z,,Die Ukraine und die USA haben ein von Präsident Donald Trump gefordertes Rohstoffabkommen unterzeichnet. Es gewährt den Vereinigten Staaten bevorzugten Zugang zu ukrainischen Bodenschätzen wie den Se… [+7931 chars],,de,'Angriff'
https://www.bild.de/politik/ausland-und-internationales/trump-enthuellt-details-zu-selenskyj-gespraech-russland-ist-viel-groesser-und-viel-staerker-68131ed7e4b9a572ec7aa90e,https://www.bild.de/politik/ausland-und-internationales/trump-enthuellt-details-zu-selenskyj-gespraech-russland-ist-viel-groesser-und-viel-staerker-68131ed7e4b9a572ec7aa90e,0,www.bild.de,Neue Details zu Selenskyj-Gespräch - Trump: „Russland ist viel größer und viel stärker“,"Es war das Vieraugengespräch, das kaum jemand erwartet hatte: Am Rande der Trauerfeier für Papst Franziskus (†88) trafen sich Trump und Selenskyj zu einem vertraulichen Gespräch. Jetzt enthüllte der US-Präsident, worüber er mit Selenskyj gesprochen hat, beric…","https://images.bild.de/68131ed7e4b9a572ec7aa90e/dd0cf70433f71552ba0171ac74b8c95b,73883189?w=1280",2025-05-01T09:23:10Z,https://web.archive.org/web/20250501093950/https://www.bild.de/politik/ausland-und-internationales/trump-enthuellt-details-zu-selenskyj-gespraech-russland-ist-viel-groesser-und-viel-staerker-68131ed7e4b9a572ec7aa90e,"Es war eine Szene, die kaum jemand erwartet hatte: Am Rande der Trauerfeier für Papst Franziskus (88) am 26. April trafen sich US-Präsident Donald Trump und der ukrainische Präsident Wolodymyr Selens… [+2814 chars]",,de,'Russland'
https://www.bild.de/regional/baden-wuerttemberg/festnahme-in-rastatt-bundespolizei-verhaftet-gesuchte-frau-6813420ee4b9a572ec7aadf8,https://www.bild.de/regional/baden-wuerttemberg/festnahme-in-rastatt-bundespolizei-verhaftet-gesuchte-frau-6813420ee4b9a572ec7aadf8,0,www.bild.de,Rastatt - Frau (20) wegen Angriff auf Polizisten verhaftet,Rastatt – Ein 20-jähriger Frau wurde am Bahnhof Rastatt von der Bundespolizei festgenommen. Die deutsche Staatsangehörige war per Ha...,"https://images.bild.de/6813420ee4b9a572ec7aadf8/419754f4c1db510bf947af0b2a86ca7e-landscape,61dd6835?w=1280",2025-05-01T09:53:05Z,https://web.archive.org/web/20250501123049/http://www.bild.de/regional/baden-wuerttemberg/festnahme-in-rastatt-bundespolizei-verhaftet-gesuchte-frau-6813420ee4b9a572ec7aadf8,"Rastatt Ein 20-jähriger Frau wurde am Bahnhof Rastatt von der Bundespolizei festgenommen.
Die deutsche Staatsangehörige war per Haftbefehl gesucht, da sie wegen eines tätlichen Angriffs auf Vollstre… [+192 chars]",,de,'Angriff'
https://www.tagesschau.de/wirtschaft/weltwirtschaft/usa-ukraine-abkommen-faq-102.html,https://www.tagesschau.de/wirtschaft/weltwirtschaft/usa-ukraine-abkommen-faq-102.html,0,www.tagesschau.de,Was in dem Abkommen zwischen den USA und der Ukraine steht,"Nach monatelangen Verhandlungen mit heftigen Wendungen wie dem Eklat im Oval Office, haben sich die USA und die Ukraine auf ein Wirtschaftsabkommen geeinigt. Was darüber bislang bekannt ist.",https://images.tagesschau.de/image/b6025926-588b-4a66-87f6-cc7fa481860c/AAABlotNWbs/AAABkZLhkrw/16x9-1280/maschine-cockpit-tagebau-100.jpg,2025-05-01T10:04:27Z,https://web.archive.org/web/20250501104547/https://www.tagesschau.de/wirtschaft/weltwirtschaft/usa-ukraine-abkommen-faq-102.html,"Stand: 01.05.2025 12:04 Uhr
Nach monatelangen Verhandlungen mit heftigen Wendungen wie dem Eklat im Oval Office, haben sich die USA und die Ukraine auf ein Wirtschaftsabkommen geeinigt. Was darüber … [+5836 chars]",,de,'Ukraine'
https://www.n-tv.de/politik/Rohstoffdeal-steht-das-ist-bisher-darueber-bekannt-article25739754.html,https://www.n-tv.de/politik/Rohstoffdeal-steht-das-ist-bisher-darueber-bekannt-article25739754.html,0,www.n-tv.de,USA und Ukraine schließen Pakt: Rohstoffdeal steht - das ist bisher darüber bekannt,"Seltene Erden, Graphit, Lithium, Kohle - die Ukraine verfügt über immense Bodenschätze. Die USA verschaffen sich mit dem nun geschlossenen Deal Zugriff auf diese Rohstoffe. Doch auch die Ukraine profitiert - sowohl sicherheitspolitisch als auch wirtschaftlich.",https://www.n-tv.de/img/incoming/crop25739765/3411329972-cImg_16_9-w1200/6b614e294152f6a958e628fdfcbd62a0.jpg,2025-05-01T10:12:12Z,https://web.archive.org/web/20250501110028/https://www.n-tv.de/politik/Rohstoffdeal-steht-das-ist-bisher-darueber-bekannt-article25739754.html,Nach wochenlangen Verhandlungen haben die USA und die Ukraine ein Abkommen über den Abbau ukrainischer Rohstoffe und den Wiederaufbau des vom Krieg zerstörten Landes unterzeichnet. Sicherheitsgaranti… [+6094 chars],,de,'Angriff'
https://www.zeit.de/news/2025-05/01/mehr-politik-als-wirtschaft-us-rohstoffdeal-mit-der-ukraine,https://www.zeit.de/news/2025-05/01/mehr-politik-als-wirtschaft-us-rohstoffdeal-mit-der-ukraine,0,www.zeit.de,Krieg in der Ukraine: Mehr Politik als Wirtschaft: US-Rohstoffdeal mit der Ukraine,Hier finden Sie Informationen zu dem Thema „Krieg in der Ukraine“. Lesen Sie jetzt „Mehr Politik als Wirtschaft: US-Rohstoffdeal mit der Ukraine“.,https://img.zeit.de/news/2025-05/01/mehr-politik-als-wirtschaft-us-rohstoffdeal-mit-der-ukraine-image-group/wide__1300x731,2025-05-01T10:24:03Z,https://web.archive.org/web/20250502021740/https://www.zeit.de/news/2025-05/01/mehr-politik-als-wirtschaft-us-rohstoffdeal-mit-der-ukraine,"Die Ukraine räumt den USA Zugang zu wertvollen Bodenschätzen ein, um die Supermacht als Verbündeten gegen die russische Aggression zu halten. Wochenlang wurde über die Vereinbarung verhandelt und übe… [+5809 chars]",,de,'Wladimir Putin'
https://www.stern.de/politik/ausland/krieg-in-der-ukraine--mehr-politik-als-wirtschaft--us-rohstoffdeal-mit-der-ukraine-35684718.html,https://www.stern.de/politik/ausland/krieg-in-der-ukraine--mehr-politik-als-wirtschaft--us-rohstoffdeal-mit-der-ukraine-35684718.html,0,www.stern.de,Krieg in der Ukraine: Mehr Politik als Wirtschaft: US-Rohstoffdeal mit der Ukraine,"Kiew/Washington - Die Ukraine räumt den USA Zugang zu wertvollen Bodenschätzen ein, um die Supermacht als Verbündeten gegen die russische Aggression zu",https://image.stern.de/35684720/t/_9/v1/w1440/r1.7778/-/01--xakyauvl5ev10axs2048jpeg---29501669b75f48eb.jpg,2025-05-01T10:24:03Z,https://web.archive.org/web/20250501111952/https://www.stern.de/politik/ausland/krieg-in-der-ukraine--mehr-politik-als-wirtschaft--us-rohstoffdeal-mit-der-ukraine-35684718.html,"Kopiere den aktuellen Link
Zur Merkliste hinzufügen
Die USA und die Ukraine haben nach monatelangen Verhandlungen ein Rohstoffabkommen abgeschlossen. Doch die Umsetzung wirft viele Fragen auf.
Die… [+5867 chars]",,de,'Wladimir Putin'
https://www.tagesspiegel.de/internationales/krieg-in-der-ukraine-mehr-politik-als-wirtschaft-us-rohstoffdeal-mit-der-ukraine-13622746.html,https://www.tagesspiegel.de/internationales/krieg-in-der-ukraine-mehr-politik-als-wirtschaft-us-rohstoffdeal-mit-der-ukraine-13622746.html,0,www.tagesspiegel.de,Krieg in der Ukraine: Mehr Politik als Wirtschaft: US-Rohstoffdeal mit der Ukraine,Die USA und die Ukraine haben nach monatelangen Verhandlungen ein Rohstoffabkommen abgeschlossen. Doch die Umsetzung wirft viele Fragen auf.,https://www.tagesspiegel.de/images/13622743/alternates/BASE_16_9_W1400/1746095108000/bodenschatze-in-der-ukraine.jpeg,2025-05-01T10:25:08Z,https://web.archive.org/web/20250502035406/https://www.tagesspiegel.de/internationales/krieg-in-der-ukraine-mehr-politik-als-wirtschaft-us-rohstoffdeal-mit-der-ukraine-13622746.html,"Die Ukraine räumt den USA Zugang zu wertvollen Bodenschätzen ein, um die Supermacht als Verbündeten gegen die russische Aggression zu halten. Wochenlang wurde über die Vereinbarung verhandelt und übe… [+7099 chars]",,de,'Ukraine'
https://www.zeit.de/politik/ausland/2025-04/donald-trump-100-tage-amtszeit-ok-america,https://www.zeit.de/politik/ausland/2025-04/donald-trump-100-tage-amtszeit-ok-america,0,www.zeit.de,"Donald Trump: 100 Tage geschafft, 1.361 kommen noch","Alles auf Angriff: Donald Trump hat in den ersten 100 Tagen seiner zweiten Präsidentschaft begonnen, das Land umzubauen und die Welt umzukrempeln. Das Thema im US-Podcast",https://img.zeit.de/politik/ausland/2025-04/donald-trump-100-tage-amtszeit-ok-america-bild/wide__1300x731,2025-05-01T11:56:15Z,http://archive.md/20250501121840/https://www.zeit.de/politik/ausland/2025-04/donald-trump-100-tage-amtszeit-ok-america,"Hat in Michigan seine ersten 100 Tage im Amt gefeiert: US-Präsident Donald Trump© Mandel Ngan/AFP/Getty Images
Donald Trump hat in der Nähe von Detroit, Michigan, die ""erfolgreichsten ersten 100 Tag… [+1404 chars]",,de,'Angriff'
https://www.welt.de/politik/ausland/article256047072/Gebiet-Cherson-Russland-meldet-ukrainischen-Drohnenangriff-mit-9-Toten.html,https://www.welt.de/politik/ausland/article256047072/Gebiet-Cherson-Russland-meldet-ukrainischen-Drohnenangriff-mit-9-Toten.html,0,www.welt.de,Russland meldet ukrainischen Drohnenangriff mit 9 Toten,Auf einem belebten Markt sollen am 1. Mai Drohnen eingeschlagen sein – so stellt es die russische Besatzung im Süden der Ukraine dar. Mitgelieferte Videobeweise lassen aber Fragen offen.,https://img.welt.de/img/politik/ausland/mobile256047070/9657933027-ci16x9-w1200/Drohne-in-der-Ukraine.jpg,2025-05-01T12:25:18Z,https://web.archive.org/web/20250501134136/https://www.welt.de/politik/ausland/article256047072/Gebiet-Cherson-Russland-meldet-ukrainischen-Drohnenangriff-mit-9-Toten.html,Durch einen Drohnenangriff des ukrainischen Militärs sollen nach Angaben der russischen Besatzungsmacht im südukrainischen Gebiet Cherson neun Menschen getötet und mehr als 20 verletzt worden sein. D… [+645 chars],,de,'Angriff'
https://www.tagesspiegel.de/internationales/pakistan-rechnet-mit-indischem-angriff-in-den-nachsten-stunden-einen-krieg-konnen-sich-beide-lander-eigentlich-gar-nicht-leisten-13619347.html,https://www.tagesspiegel.de/internationales/pakistan-rechnet-mit-indischem-angriff-in-den-nachsten-stunden-einen-krieg-konnen-sich-beide-lander-eigentlich-gar-nicht-leisten-13619347.html,0,www.tagesspiegel.de,Pakistan rechnet mit indischem Angriff in nächsten Stunden: „Einen Krieg können sich beide Länder eigentlich gar nicht leisten“,"Indien hat den Luftraum für Flugzeuge aus Pakistan gesperrt. Die Regierung dort ist in höchster Alarmbereitschaft – und erklärte, ab wann sie Atomwaffen einsetzen würde.",https://www.tagesspiegel.de/images/13622725/alternates/BASE_16_9_W1400/1746095069000/security-heightened-in-kashmir-after-pahalgam-attack.jpeg,2025-05-01T12:35:02Z,http://archive.md/20250501124345/https://www.tagesspiegel.de/internationales/pakistan-rechnet-mit-indischem-angriff-in-den-nachsten-stunden-einen-krieg-konnen-sich-beide-lander-eigentlich-gar-nicht-leisten-13619347.html,"Einfach waren die Beziehungen zwischen Indien und Pakistan nie, große Spannungen gab es immer. Doch nun könnte sich der Grenzstreit zu einem größeren Konflikt entwickeln.",,de,'Angriff'
https://www.tagesspiegel.de/politik/neue-regierung-muss-sich-klar-positionieren-abgeordnete-von-spd-grunen-und-linken-wollen-israel-keine-waffen-mehr-liefern-13622962.html,https://www.tagesspiegel.de/politik/neue-regierung-muss-sich-klar-positionieren-abgeordnete-von-spd-grunen-und-linken-wollen-israel-keine-waffen-mehr-liefern-13622962.html,0,www.tagesspiegel.de,"„Neue Regierung muss sich klar positionieren“: Abgeordnete von SPD, Grünen und Linken wollen Israel keine Waffen mehr liefern","Weil Israel seit März Lebensmittellieferungen in den Gaza-Streifen blockiert, fordern einige Abgeordnete ein Ende von deutschen Waffenlieferungen. Kritik kommt von der Union.",https://www.tagesspiegel.de/images/11737757/alternates/BASE_16_9_W1400/1717002816000/nahostkonflikt-grenze-zwischen-israel-und-gaza.jpeg,2025-05-01T12:46:15Z,https://web.archive.org/web/20250501184916/https://www.tagesspiegel.de/politik/neue-regierung-muss-sich-klar-positionieren-abgeordnete-von-spd-grunen-und-linken-wollen-israel-keine-waffen-mehr-liefern-13622962.html,"Die Forderung an die kommende Bundesregierung ist weitreichend. Ein sofortiges Ende der militärischen und politischen Unterstützung für Netanjahus Regierung ist dringend geboten, heißt es in dem Schr… [+8802 chars]",,de,'Waffen'
https://www.sueddeutsche.de/politik/syrien-viele-tote-bei-angriffen-auf-drusen-li.3245426,https://www.sueddeutsche.de/politik/syrien-viele-tote-bei-angriffen-auf-drusen-li.3245426,0,www.sueddeutsche.de,Syrien: Viele Tote bei Angriffen auf Drusen,,https://www.sueddeutsche.de/szde-assets/img/szde-article-sharing-image-no-teaser-image-fallback.png,2025-05-01T12:54:06Z,,"Nach tödlichen Auseinandersetzungen in Syrien sind nach Angaben von Aktivisten erneut mehrere Drusen getötet worden. 23 Angehörige der religiösen Minderheit seien in einem Hinterhalt getötet worden, … [+673 chars]",,de,'Angriff'
https://www.sueddeutsche.de/medien/gaza-journalisten-pressefreiheit-fatima-hassouna-shrouq-al-aila-li.3240888,https://www.sueddeutsche.de/medien/gaza-journalisten-pressefreiheit-fatima-hassouna-shrouq-al-aila-li.3240888,0,www.sueddeutsche.de,Pressefreiheit: „Die Menschen haben Angst vor Journalisten“,"Fast 200 Medienschaffende wurden seit Kriegsbeginn in Gaza getötet. Wie man dort trotzdem lebt und arbeitet, berichtet Shrouq al-Aila, Preisträgerin des International Press Freedom Award.",https://www.sueddeutsche.de/2025/05/01/e7cf05bf-6167-4861-96a6-e26ec1e0c13d.jpeg?q=60&fm=webp&width=1200&rect=0%2C0%2C3200%2C1800,2025-05-01T13:16:01Z,https://web.archive.org/web/20250501163957/https://www.sueddeutsche.de/medien/gaza-journalisten-pressefreiheit-fatima-hassouna-shrouq-al-aila-li.3240888,"Fast 200 Medienschaffende wurden seit Kriegsbeginn in Gaza getötet. Wie man dort trotzdem lebt und arbeitet, berichtet Shrouq al-Aila, Preisträgerin des International Press Freedom Award.Ihre Fotogra… [+556 chars]",,de,'Preis'
https://www.n-tv.de/politik/Russland-ueberzieht-Ukraine-mit-Drohnenangriffen-article25739951.html,https://www.n-tv.de/politik/Russland-ueberzieht-Ukraine-mit-Drohnenangriffen-article25739951.html,0,www.n-tv.de,Mindestens zwei Tote in Odessa: Russland überzieht Ukraine mit Drohnenangriffen,"Die Ukraine und die USA besiegeln ihr Rohstoffabkommen. Dessen ungeachtet überzieht Russland das Land mit Drohnen und Raketen. In Odessa sterben mindestens zwei Menschen. Russland behauptet, seinerseits von der Ukraine angegriffen worden zu sein. Videos lasse…",https://www.n-tv.de/img/incoming/crop25739962/5091324016-cImg_16_9-w1200/2025-05-01T062738Z-1479857826-RC2U8EAT7QUR-RTRMADP-3-UKRAINE-CRISIS-ATTACK-ODESA.jpg,2025-05-01T13:20:45Z,https://web.archive.org/web/20250501150408/https://www.n-tv.de/politik/Russland-ueberzieht-Ukraine-mit-Drohnenangriffen-article25739951.html,"Die Ukraine und die USA besiegeln ihr Rohstoffabkommen. Dessen ungeachtet überzieht Russland das Land mit Drohnen und Raketen. In Odessa sterben mindestens zwei Menschen. Russland behauptet, seinerse… [+3720 chars]",,de,'Ukraine'
https://www.sueddeutsche.de/muenchen/muenchen-marienplatz-demo-1-mai-gewerkschaften-koalitionsvertrag-li.3244236,https://www.sueddeutsche.de/muenchen/muenchen-marienplatz-demo-1-mai-gewerkschaften-koalitionsvertrag-li.3244236,0,www.sueddeutsche.de,"Tag der Arbeit in München: „Was im Koalitionsvertrag so harmlos klingt, ist in Wahrheit ein Angriff auf den Arbeitsschutz“",Bei der Kundgebung am 1. Mai treten auf dem Marienplatz mehrere Tausend Arbeitnehmer für den Acht-Stunden-Tag und eine soziale Stadt ein. Manche Pläne der neuen Bundesregierung wecken Befürchtungen.,https://www.sueddeutsche.de/2025/05/01/08e89852-c582-4479-94c7-b5160358f089.jpeg?q=60&fm=webp&width=1200&rect=0%2C209%2C4000%2C2250,2025-05-01T13:59:57Z,,"Schulter an Schulter, laut, sichtbar und entschlossen müssen die Gewerkschaften für ihre Rechte eintreten, sagt Hauptredner Robert Feiger, Bundesvorsitzender der Industriegewerkschaft Bauen-Agrar-Umw… [+3429 chars]",,de,'Angriff'
https://www.nzz.ch/international/die-ukraine-versucht-trump-mit-ihren-rohstoffen-an-sich-zu-binden-putin-beeindruckt-dies-kaum-ld.1882451,https://www.nzz.ch/international/die-ukraine-versucht-trump-mit-ihren-rohstoffen-an-sich-zu-binden-putin-beeindruckt-dies-kaum-ld.1882451,0,www.nzz.ch,Die Ukraine versucht Trump mit ihren Rohstoffen an sich zu binden – Putin beeindruckt dies kaum,"Mit dem Rohstoffabkommen hat die Ukraine ein Zugeständnis an Trump gemacht. Ob Kiew den US-Präsidenten damit für sich gewinnen kann, ist allerdings offen. Für einen dauerhaften Frieden braucht es mehr Druck auf Putin. Das will Trump noch nicht verstehen.","https://img.nzz.ch/2025/05/01/271681b4-0f08-43a7-bf18-8426166795c1.jpeg?width=1200&height=674&fit=bounds&quality=75&auto=webp&crop=5272,2965,x0,y360&wmark=nzz",2025-05-01T17:12:32Z,http://archive.md/20250501174052/https://www.nzz.ch/international/die-ukraine-versucht-trump-mit-ihren-rohstoffen-an-sich-zu-binden-putin-beeindruckt-dies-kaum-ld.1882451,"Luftaufnahme einer Mine für seltene Erden in der ukrainischen Region Schitomir.
Glaubt man der amerikanischen Regierung, könnte sich das Schicksal der Ukraine in den nächsten Tagen entscheiden. Dies… [+5370 chars]",,de,'Ukraine'
https://www.n-tv.de/politik/14-44-Insider-Milliarden-von-Russlands-eingefrorenem-Vermoegen-in-EU-gehen-an-Investoren--article23143824.html,https://www.n-tv.de/politik/14-44-Insider-Milliarden-von-Russlands-eingefrorenem-Vermoegen-in-EU-gehen-an-Investoren--article23143824.html,0,www.n-tv.de,Ukraine-Krieg im Liveticker: +++ 14:44 Insider: Milliarden von Russlands eingefrorenem Vermögen in EU gehen an Investoren +++,Lesen Sie alle aktuellen Entwicklungen und Nachrichten über den russischen Angriffskrieg auf die Ukraine im Liveticker von ntv.de.,https://www.n-tv.de/img/incoming/crop25117070/4231326595-cImg_16_9-w1200/Ukraine-Liveticker.jpg,2025-05-01T22:02:00Z,https://web.archive.org/web/20250502130511/https://www.n-tv.de/politik/14-44-Insider-Milliarden-von-Russlands-eingefrorenem-Vermoegen-in-EU-gehen-an-Investoren--article23143824.html,"Der zentrale europäische Wertpapier-Verwahrer Euroclear gibt Insidern zufolge eingefrorene russische Gelder in Milliardenhöhe an westliche Investoren frei. Diese sollten dafür entschädigt werden, das… [+15726 chars]",,de,'Angriff'
https://www.n-tv.de/politik/12-07-TV-Doku-soll-Einblick-in-Putins-Kreml-Wohnung-geben--article23143824.html,https://www.n-tv.de/politik/12-07-TV-Doku-soll-Einblick-in-Putins-Kreml-Wohnung-geben--article23143824.html,0,www.n-tv.de,Ukraine-Krieg im Liveticker: +++ 12:07 TV-Doku soll Einblick in Putins Kreml-Wohnung geben +++,Lesen Sie alle aktuellen Entwicklungen und Nachrichten über den russischen Angriffskrieg auf die Ukraine im Liveticker von ntv.de.,https://www.n-tv.de/img/incoming/crop25117070/4231326595-cImg_16_9-w1200/Ukraine-Liveticker.jpg,2025-05-01T22:02:00Z,https://web.archive.org/web/20250502102755/https://www.n-tv.de/politik/12-07-TV-Doku-soll-Einblick-in-Putins-Kreml-Wohnung-geben--article23143824.html,"Am Sonntag zeigt das russische Fernsehen die Dokumentation ""Russland. Kreml. Putin. 25 Jahre."" Erstmals in der Geschichte durfte ein Filmteam Putin in seiner Privatwohnung neben seinem Büro im Kreml … [+13106 chars]",,de,'Ukraine'
