index,url,valid,domain,title,description,image,published,archive,content,quote,language,keyword
https://www.freitag.de/autoren/helena-steinhaus/wehe-wenn-lindner-ideen-hat,https://www.freitag.de/autoren/helena-steinhaus/wehe-wenn-lindner-ideen-hat,0,www.freitag.de,"Diskurs | Bürgergeld: Wehe, wenn Lindner Ideen hat","Das gesellschaftliche Klima verschärft sich, zugleich tun sich neue Haushaltslücken auf. Und was fällt Regierung und Opposition offenbar immer als Erstes ein? Arme ausgrenzen und beim Bürgergeld weiter zu kürzen Was könnte dran sein, wenn die Bild-Zeitung ein…",https://www.freitag.de/autoren/helena-steinhaus/wehe-wenn-lindner-ideen-hat/@@images/image/great,2024-11-01T03:00:00Z,,"Was könnte dran sein, wenn die Bild-Zeitung einen „Bürgergeld-Irrtum enthüllt“ haben will und sich von diesem „Bürgergeld-Schock“ kaum mehr zu erholen scheint? So geschehen vergangene Woche, verbreit… [+7188 chars]",,de,'Klima'
https://www.zeit.de/politik/ausland/2024-11/russland-nordkorea-ukraine-krieg-einsatz-antony-blinken-warnung,https://www.zeit.de/politik/ausland/2024-11/russland-nordkorea-ukraine-krieg-einsatz-antony-blinken-warnung,0,www.zeit.de,Krieg in der Ukraine: Nordkoreaner nach US-Einschätzung kurz vor Ukraine-Einsatz,"Die USA erwarten, dass nordkoreanische Soldaten binnen Tagen in der Ukraine eingesetzt werden. Das mache sie zu legitimen Zielen im Krieg, warnt Außenminister Blinken.",https://img.zeit.de/politik/ausland/2024-11/russland-nordkorea-ukraine-krieg-einsatz-antony-blinken-warnung-bild/wide__1300x731,2024-11-01T04:47:42Z,http://archive.md/20241101055542/https://www.zeit.de/politik/ausland/2024-11/russland-nordkorea-ukraine-krieg-einsatz-antony-blinken-warnung,Nach Ansicht der USA stehen nordkoreanische Soldaten an der Seite Russlands kurz vor ihrem Einsatz im Krieg gegen die Ukraine. Bis zu 8.000 befinden sich demnach nahe der ukrainischen Grenze. US-Auße… [+4268 chars],,de,'Ukraine'
https://www.zeit.de/politik/ausland/2024-11/iran-medienberichte-raketen-angriff-israel,https://www.zeit.de/politik/ausland/2024-11/iran-medienberichte-raketen-angriff-israel,0,www.zeit.de,Nahost-Krise: Iran plant laut Medienberichten nächsten Raketen-Angriff auf Israel,Die israelischen Geheimdienste rechnen Berichten zufolge noch vor der US-Wahl mit einem iranischen Angriff. Generalstabschef Halevi droht mit harten Konsequenzen.,https://img.zeit.de/politik/ausland/2024-11/iran-medienberichte-raketen-angriff-israel-bild/wide__1300x731,2024-11-01T04:50:55Z,http://archive.md/20241101185400/https://www.zeit.de/politik/ausland/2024-11/iran-medienberichte-raketen-angriff-israel,Nach dem israelischen Angriff auf den Iran plant die Regierung in Teheran Medienberichten zufolge bereits einen erneuten Gegenschlag. Ein Angriff mit Drohnen und ballistischen Raketen könnte vom Irak… [+3150 chars],,de,'Krise'
https://www.faz.net/aktuell/finanzen/so-gefaehrlich-sind-die-wetten-auf-harris-und-trump-110081833.html,https://www.faz.net/aktuell/finanzen/so-gefaehrlich-sind-die-wetten-auf-harris-und-trump-110081833.html,0,www.faz.net,US-Wahlkampf: So gefährlich sind die Wetten auf Harris und Trump,"Die Wettbüros sehen Trump klar vorn – doch das spiegelt nicht die Realität wider. Das liegt viel mehr an windigen Milliardären, Kryptowährungen – und mutmaßlich auch an Russland oder China.",https://media0.faz.net/ppmedia/aktuell/politik/3277534350/1.10081924/facebook_teaser_fplus/sie-essen-die-katzen-sie-essen.jpg,2024-11-01T07:26:43Z,http://archive.md/20241101100125/https://www.faz.net/aktuell/finanzen/so-gefaehrlich-sind-die-wetten-auf-harris-und-trump-110081833.html,"Die Wahlen in den Vereinigten Staaten elektrisieren die ganze Welt. Dort werden am 5. November das Repräsentantenhaus und ein Teil des Senats gewählt und es entscheidet sich, ob mit Kamala Harris ein… [+426 chars]",,de,'Russland'
https://www.faz.net/aktuell/wirtschaft/klima-nachhaltigkeit/gruener-wasserstoff-robert-habecks-hoffnungswert-wankt-110081966.html,https://www.faz.net/aktuell/wirtschaft/klima-nachhaltigkeit/gruener-wasserstoff-robert-habecks-hoffnungswert-wankt-110081966.html,0,www.faz.net,Grüner Wasserstoff: Habecks Hoffnungswert wankt,"Ohne Wasserstoff wird die deutsche Industrie nicht grün. Doch die Zweifel wachsen, ob es davon ausreichende Mengen zu bezahlbaren Preisen geben wird.",https://media1.faz.net/ppmedia/aktuell/politik/16233419/1.10083459/facebook_teaser/wirtschaftsminister-habeck.jpg,2024-11-01T10:12:15Z,http://archive.md/20241101101909/https://www.faz.net/aktuell/wirtschaft/klima-nachhaltigkeit/gruener-wasserstoff-robert-habecks-hoffnungswert-wankt-110081966.html,"Kaum eine Auslandsreise von Habeck vergeht ohne solche Termine, solche Abkommen. Wasserstoff ist der Eckpfeiler für die Transformation der Industrie hin zur Klimaneutralität. Wo heute noch Gas Produk… [+7092 chars]",,de,'Preis'
https://www.welt.de/politik/deutschland/article254300126/Klima-und-Energiepolitik-Wissenschaftler-Weimann-zerpflueckt-sie-Kompletter-Blindflug.html,https://www.welt.de/politik/deutschland/article254300126/Klima-und-Energiepolitik-Wissenschaftler-Weimann-zerpflueckt-sie-Kompletter-Blindflug.html,0,www.welt.de,„Befinden uns im kompletten Blindflug“ – Wissenschaftler zerpflückt deutsche Klimapolitik,"Wirtschaftswissenschaftler Joachim Weimann kritisiert die deutsche Klima- und Energiepolitik scharf: Die Klimaziele seien eine Last, Atomkraft hingegen sinnvoll. Die Energiewende koste Geld, das an anderer Stelle fehle.",https://img.welt.de/img/politik/deutschland/mobile254300374/3157931587-ci16x9-w1200/JD-9092-16.jpg,2024-11-01T10:35:52Z,http://archive.md/20241101130638/https://www.welt.de/politik/deutschland/article254300126/Klima-und-Energiepolitik-Wissenschaftler-Weimann-zerpflueckt-sie-Kompletter-Blindflug.html,"Wirtschaftswissenschaftler Joachim Weimann kritisiert die deutsche Klima- und Energiepolitik scharf: Die Klimaziele seien eine Last, Atomkraft hingegen sinnvoll. Die Energiewende koste Geld, das an a… [+1131 chars]",,de,'Atomkraft'
https://www.zeit.de/news/2024-11/01/randale-zu-halloween-angriff-auf-buergermeister-in-nrw,https://www.zeit.de/news/2024-11/01/randale-zu-halloween-angriff-auf-buergermeister-in-nrw,0,www.zeit.de,Halloween-Nacht: Randale zu Halloween - Angriff auf Bürgermeister in NRW,Hier finden Sie Informationen zu dem Thema „Halloween-Nacht“. Lesen Sie jetzt „Randale zu Halloween - Angriff auf Bürgermeister in NRW“.,https://img.zeit.de/news/2024-11/01/randale-zu-halloween-angriff-auf-buergermeister-in-nrw-image-group/wide__1300x731,2024-11-01T13:30:18Z,,In der Halloween-Nacht ist es in mehreren deutschen Städten zu Angriffen auf Einsatzkräfte und Randale gekommen. Allein in Berlin nahmen Polizisten nach einer ersten Bilanz 132 Menschen vorübergehend… [+3131 chars],,de,'Angriff'
https://www.zeit.de/politik/deutschland/2024-11/brandenburg-spd-bsw-sondierung-waffenlieferung-ukraine,https://www.zeit.de/politik/deutschland/2024-11/brandenburg-spd-bsw-sondierung-waffenlieferung-ukraine,0,www.zeit.de,Brandenburg: SPD hält trotz Vereinbarung mit dem BSW Waffenlieferungen für richtig,In Brandenburg stehen die ersten Koalitionsgespräche zwischen SPD und BSW an. Der SPD-Landesverband macht nun klar: Die militärische Unterstützung für die Ukraine steht.,https://img.zeit.de/politik/deutschland/2024-11/brandenburg-spd-bsw-sondierung-waffenlieferung-ukraine-bild/wide__1300x731,2024-11-01T18:23:49Z,,Ungeachtet ihrer Sondierungsvereinbarung mit dem potenziellen Regierungspartner BSW hält die brandenburgische SPD Waffenlieferungen an die Ukraine für richtig. Wegen des russischen Angriffskriegs geg… [+3420 chars],,de,'Ukraine'
https://www.zeit.de/news/2024-11/01/usa-sagen-ukraine-weitere-militaerhilfe-zu,https://www.zeit.de/news/2024-11/01/usa-sagen-ukraine-weitere-militaerhilfe-zu,0,www.zeit.de,Russlands Angriffskrieg: USA sagen Ukraine weitere Militärhilfe zu,Hier finden Sie Informationen zu dem Thema „Russlands Angriffskrieg“. Lesen Sie jetzt „USA sagen Ukraine weitere Militärhilfe zu“.,https://img.zeit.de/news/2024-11/01/usa-sagen-ukraine-weitere-militaerhilfe-zu-image-group/wide__1300x731,2024-11-01T19:38:40Z,,Die USA stellen der Ukraine zur Abwehr des russischen Angriffskriegs weitere Militärausrüstung zur Verfügung. Das neue Paket habe einen Umfang von rund 425 Millionen US-Dollar (rund 392 Millionen Eur… [+891 chars],,de,'Ukraine'
https://www.zeit.de/wirtschaft/unternehmen/2024-11/volkswagen-jubilaeumspraemie-striechung,https://www.zeit.de/wirtschaft/unternehmen/2024-11/volkswagen-jubilaeumspraemie-striechung,0,www.zeit.de,Autobauer in der Krise: Volkswagen schlägt Streichung von Jubiläumsprämien vor,Der VW-Vorstand will seinen Sparkurs bei den Tarifverhandlungen durchsetzen. Nun steht auch der Wegfall von Bonuszahlungen an langjährige Mitarbeiter zur Debatte.,https://img.zeit.de/administratives/sharing/fallback-image/wide__1300x731,2024-11-02T14:14:48Z,http://archive.md/20241102145115/https://www.zeit.de/wirtschaft/unternehmen/2024-11/volkswagen-jubilaeumspraemie-striechung,"Bei den laufenden Tarifverhandlungen
hat Volkswagen vorgeschlagen, Bonuszahlungen an langjährige Mitarbeitende zu streichen. So sollen unter anderem die
Jubiläumsgratifikationen wegfallen. ""Wir hab… [+1169 chars]",,de,'Krise'
https://www.faz.net/aktuell/politik/us-wahl/liveticker-us-wahl-2024-harris-tritt-bei-saturday-night-live-auf-faz-19444916.html,https://www.faz.net/aktuell/politik/us-wahl/liveticker-us-wahl-2024-harris-tritt-bei-saturday-night-live-auf-faz-19444916.html,0,www.faz.net,Liveblog zur US-Wahl 2024: Harris tritt bei „Saturday Night Live“ auf,Russland weist Vorwurf der Videofälschung zurück +++ Supreme Court durchkreuzt Pläne der Republikaner in Pennsylvania +++ Wahlleiter von Georgia warnt vor russischer Einmischung +++ Alle Neuigkeiten im Liveblog.,https://media0.faz.net/ppmedia/aktuell/politik/1995110804/1.10086446/facebook_teaser/das-double-und-die-echte.jpg,2024-11-03T04:35:02Z,,"Der republikanische Präsidentschaftskandidat Donald Trump geht die Republikanerin Liz Cheney nach Kritik an seinen Aussagen über die parteiinterne Widersacherin weiterhin scharf an. Ich sage nur, das… [+1043 chars]",,de,'Russland'
https://www.faz.net/aktuell/wirtschaft/klima-nachhaltigkeit/viele-in-der-union-sind-jetzt-fuers-klimageld-110086494.html,https://www.faz.net/aktuell/wirtschaft/klima-nachhaltigkeit/viele-in-der-union-sind-jetzt-fuers-klimageld-110086494.html,0,www.faz.net,Viele in der Union sind jetzt fürs Klimageld,"Wer wenig CO2 verbraucht, bekommt unterm Strich Geld zurück – so die Idee des Klimagelds. Die Ampel hat es noch nicht hinbekommen. Nun erwärmen sich in der Union immer mehr dafür. Aber wie unkompliziert kann es werden?",https://media1.faz.net/ppmedia/aktuell/politik/859650437/1.10086501/facebook_teaser/aktivisten-von-verdi-awo-dem.jpg,2024-11-03T06:53:47Z,,"Wenn die Einnahmen im Klima- und Transformationsfonds von heute 22 Milliarden Euro auf 30 Milliarden stiegen, könne das Klimageld zur Auszahlung kommen.
Schon von Ampelkoalition geplant
SPD, Grüne … [+3025 chars]",,de,'Klima'
https://www.zeit.de/politik/ausland/2024-11/ukraine-russland-kriegsgefangene-streit,https://www.zeit.de/politik/ausland/2024-11/ukraine-russland-kriegsgefangene-streit,0,www.zeit.de,Ukraine-Krieg: Ukraine weist russische Vorwürfe zu Gefangenenaustausch zurück,"Russland wirft der Ukraine vor, Hunderte Kriegsgefangene nicht würdig für einen Austausch gehalten und abgelehnt zu haben. Das Land weist das zurück und fordert Belege.",https://img.zeit.de/politik/ausland/2024-11/gefangenenaustausch-ukraine-russland-bild/wide__1300x731,2024-11-03T10:43:45Z,,"Die Ukraine hat Behauptungen des russischen Außenministeriums zurückgewiesen, das Land habe Hunderte für einen Austausch vorgeschlagene Kriegsgefangene nicht zurückhaben wollen. ""Wir sind jederzeit b… [+2676 chars]",,de,'Russland'
https://www.faz.net/aktuell/politik/krieg-in-nahost/liveblog-zum-krieg-in-nahost-irans-naechster-angriff-soll-laut-us-bericht-viel-aggressiver-ausfallen-faz-19972506.html,https://www.faz.net/aktuell/politik/krieg-in-nahost/liveblog-zum-krieg-in-nahost-irans-naechster-angriff-soll-laut-us-bericht-viel-aggressiver-ausfallen-faz-19972506.html,0,www.faz.net,"Liveblog zum Krieg in Nahost: Irans nächster Angriff laut US-Bericht ""viel aggressiver""","Irans nächster Angriff soll laut US-Bericht ""viel aggressiver"" ausfallen +++ Iranischer Kommandeur droht weiteren Angriff auf Israel an +++ 19 Verletzte nach Raketenangriff auf Zentral-Israel +++ alle Entwicklungen im Liveblog",https://media0.faz.net/ppmedia/aktuell/politik/1380728540/1.10087984/facebook_teaser/spuren-von-raketen-die-von-der.jpg,2024-11-04T01:40:54Z,,"Die USA haben einem Medienbericht zufolge Iran in den vergangenen Tagen vor einem weiteren Angriff auf Israel gewarnt. Bei einer Attacke Irans werde Washington nicht in der Lage sein, Israel zurückzu… [+449 chars]",,de,'Angriff'
https://www.faz.net/aktuell/politik/ausland/moldau-wahl-pro-europaeerin-maria-sandu-gewinnt-knapp-110087899.html,https://www.faz.net/aktuell/politik/ausland/moldau-wahl-pro-europaeerin-maria-sandu-gewinnt-knapp-110087899.html,0,www.faz.net,Präsidentschaftswahl: Pro-Europäerin Sandu erklärt sich zur Wahlsiegerin in Moldau,Maia Sandu gewinnt die Präsidentschaftswahl in Moldau mit knapp 55 Prozent gegen den russlandfreundlichen Alexandr Stoianoglu. Aufsehen erregen am Wahltag mutmaßlich organisierte Wählertransporte aus Russland.,https://media1.faz.net/ppmedia/aktuell/politik/4190883453/1.10087951/facebook_teaser/maia-sandu-feiert-mit.jpg,2024-11-04T02:14:42Z,,"Sandu siegte vor allem dank Stimmen der zu Hunderttausenden im Ausland vor allem in der EU lebenden Moldauer, die die Politikerin traditionell unterstützen. Die Staatschefin von der Partei Aktion und… [+4030 chars]",,de,'Russland'
https://www.faz.net/aktuell/politik/ukraine/ukraine-erwartet-neue-angriffe-von-russland-auf-atomkraftwerke-110085787.html,https://www.faz.net/aktuell/politik/ukraine/ukraine-erwartet-neue-angriffe-von-russland-auf-atomkraftwerke-110085787.html,0,www.faz.net,Energiesystem im Ukrainekrieg: „Dann braucht es Vergeltungsangriffe in Russland“,"Russland greift das Energiesystem der Ukraine massiv an. Falls wieder Kernkraftwerke attackiert werden, hält der ukrainische Energiefachmann Mychajlo Gontschar Vergeltung auf russischem Gebiet für nötig.",https://media1.faz.net/ppmedia/aktuell/politik/1484372686/1.10087943/facebook_teaser_fplus/gezielte-angriffe-russlands.jpg,2024-11-04T08:04:51Z,http://archive.md/20241105151626/https://www.faz.net/aktuell/politik/ukraine/ukraine-erwartet-neue-angriffe-von-russland-auf-atomkraftwerke-110085787.html,"Herr Gontschar, wie werden sich die vielen russischen Angriffe auf die ukrainische Energieinfrastruktur im kommenden Winter auswirken?
In jedem Fall wird es zu einem Strommangel kommen, wenn der Str… [+514 chars]",,de,'Russland'
https://www.golem.de/sonstiges/zustimmung/auswahl.html?from=https://www.golem.de/news/umweltschutz-bienen-beenden-metas-kernkraftplaene-2411-190455.html&referer=https://t.co/38c779d82f,https://www.golem.de/sonstiges/zustimmung/auswahl.html?from=https://www.golem.de/news/umweltschutz-bienen-beenden-metas-kernkraftplaene-2411-190455.html&referer=https://t.co/38c779d82f,0,www.golem.de,Umweltschutz: Bienen beenden Metas Kernkraftpläne,"Mit Atomkraft soll KI umweltfreundlicher werden - wenn nicht die Umwelt einen Strich durch die Rechnung macht. Auch AWS hat Probleme mit seinem Atomprogramm. (Atomkraft, Google)",,2024-11-04T15:27:02Z,,"Besuchen Sie Golem.de wie gewohnt mit Werbung und Tracking,
 indem Sie der Nutzung aller Cookies zustimmen.
 Details zum Tracking finden Sie im Privacy Center.
Skript wurde nicht geladen. Informat… [+607 chars]",,de,'Atomkraft'
https://www.faz.net/aktuell/wirtschaft/der-grosse-lindner-tuev-was-taugt-sein-wirtschaftspapier-110089251.html,https://www.faz.net/aktuell/wirtschaft/der-grosse-lindner-tuev-was-taugt-sein-wirtschaftspapier-110089251.html,0,www.faz.net,FDP-Papier: Der große Lindner-TÜV,"Klima, Rente, Steuern, Arbeit: Der Finanzminister verlangt weitreichende Wirtschaftsreformen. Führende Fachleute prüfen für die F.A.Z. seine Ideen auf Herz und Nieren.",https://media0.faz.net/ppmedia/aktuell/politik/1862705729/1.10089234/facebook_teaser/geht-er-christian-lindner-fdp.jpg,2024-11-04T15:53:33Z,http://archive.md/20241104161430/https://www.faz.net/aktuell/wirtschaft/der-grosse-lindner-tuev-was-taugt-sein-wirtschaftspapier-110089251.html,"1. Unternehmenssteuern senken
Deutschland positioniert sich im internationalen Standortwettbewerb als ein Land, das keine Investitionen und keine Gewinne haben will. So beschreibt der Ökonom Clemens… [+11907 chars]",,de,'Klima'
https://taz.de/Krise-der-Ampel/!6043977/,https://taz.de/Krise-der-Ampel/!6043977/,0,taz.de,Krise der Ampel: Lindner spielt das Angsthasenspiel,"Der Finanzminister stellt mit seinem Papier unerfüllbare Maximalforderungen. So handelt nur jemand, der längst mit dem Rücken zur Wand steht.",https://taz.de/picture/7334306/1200/36941888-1.jpeg,2024-11-04T16:46:00Z,,"Der Finanzminister stellt mit seinem Papier unerfüllbare Maximalforderungen. So handelt nur jemand, der längst mit dem Rücken zur Wand steht. mehr...",,de,'Krise'
https://www.tagesschau.de/inland/innenpolitik/habeck-gruene-ampel-100.html,https://www.tagesschau.de/inland/innenpolitik/habeck-gruene-ampel-100.html,0,www.tagesschau.de,"Krise in der Ampelkoalition: Habecks Botschaft, Habecks Angebot","Der Ampel-Regierung droht ein vorzeitiges Aus. Vizekanzler Habeck versucht noch einmal, das Bündnis zu retten. Mit einem Angebot an die FDP. Und nicht ganz ohne Eigennutz. Von Tina Handel.",https://images.tagesschau.de/image/73c2a9e6-2979-4c43-80f7-ae81c11e07e5/AAABkvgHBbI/AAABkZLhkrw/16x9-1280/habeck-578.jpg,2024-11-04T17:06:25Z,http://archive.md/20241104171414/https://www.tagesschau.de/inland/innenpolitik/habeck-gruene-ampel-100.html,"Stand: 04.11.2024 18:06 Uhr
Der Ampel-Regierung droht ein vorzeitiges Aus. Vizekanzler Habeck versucht noch einmal, das Bündnis zu retten. Mit einem Angebot an die FDP. Und nicht ganz ohne Eigennutz… [+5812 chars]",,de,'Krise'
https://www.welt.de/politik/deutschland/article254336420/Ampel-Streit-Scholz-verlangt-von-Koalition-Pragmatismus-statt-Ideologie.html,https://www.welt.de/politik/deutschland/article254336420/Ampel-Streit-Scholz-verlangt-von-Koalition-Pragmatismus-statt-Ideologie.html,0,www.welt.de,Scholz verlangt von Koalition „Pragmatismus“ statt „Ideologie“,Kanzler Olaf Scholz hat in den entscheidenden Ampel-Absprachen Kompromissbereitschaft und „seriöse Arbeit“ eingefordert. Derweil macht Robert Habeck einen Schritt in Richtung Christian Lindner. Alle Entwicklungen zur Ampel-Krise im Liveticker.,https://img.welt.de/img/politik/deutschland/mobile254336474/0187931457-ci16x9-w1200/US-Praesident-Biden-in-Berlin.jpg,2024-11-04T17:07:00Z,https://web.archive.org/web/20241104171609/https://www.welt.de/politik/deutschland/article254336420/Ampel-Streit-Scholz-verlangt-von-Koalition-Pragmatismus-statt-Ideologie.html,Kanzler Olaf Scholz hat in den entscheidenden Ampel-Absprachen Kompromissbereitschaft und seriöse Arbeit eingefordert. Derweil macht Robert Habeck einen Schritt in Richtung Christian Lindner. Alle En… [+14386 chars],,de,'Krise'
https://www.n-tv.de/politik/Scholz-und-Habeck-gestehen-das-ganze-Ausmass-der-Krise-article25335171.html,https://www.n-tv.de/politik/Scholz-und-Habeck-gestehen-das-ganze-Ausmass-der-Krise-article25335171.html,0,www.n-tv.de,Hat FDP fertig mit der Ampel?: Scholz und Habeck gestehen das ganze Ausmaß der Krise,"Die Ampel ruft die ""Woche der Entscheidungen"" aus: Nach dem Krisentreffen im Kanzleramt versuchen der Kanzler und sein Vize, die FDP mit Verweis auf die Weltlage in die Pflicht zu nehmen. Doch der kleinste Koalitionspartner pocht auf sehr grundsätzliche Entsc…",https://bilder3.n-tv.de/img/incoming/crop25336498/1671321402-cImg_16_9-w1200/488119778.jpg,2024-11-04T17:56:00Z,https://web.archive.org/web/20241104202133/https://www.n-tv.de/politik/Scholz-und-Habeck-gestehen-das-ganze-Ausmass-der-Krise-article25335171.html,"Die Ampel ruft die ""Woche der Entscheidungen"" aus: Nach dem Krisentreffen im Kanzleramt versuchen der Kanzler und sein Vize, die FDP mit Verweis auf die Weltlage in die Pflicht zu nehmen. Doch der kl… [+8460 chars]",,de,'Krise'
https://www.bild.de/leben-wissen/angst-vor-sozialem-abstieg-immer-mehr-deutsche-fuerchten-armut-6728ecf7ebdb8724738e88dd,https://www.bild.de/leben-wissen/angst-vor-sozialem-abstieg-immer-mehr-deutsche-fuerchten-armut-6728ecf7ebdb8724738e88dd,0,www.bild.de,Steigende Armut - Immer mehr Deutsche haben Abstiegsängste,"Eine neue Studie der Hans-Böckler-Stiftung enthüllt eine besorgniserregende Zunahme der Armut in Deutschland, beeinflusst durch Inflation und Corona-Krise.","https://images.bild.de/6728ecf7ebdb8724738e88dd/2a46b8bb8a430ffba2a058a40b97a452,20681f25?w=1280",2024-11-04T17:58:27Z,,"Inflation, Corona, geringes Einkommen und niedrige Renten: In Deutschland wächst die Angst vor dem sozialen Abstieg und das auch in der Mittelschicht.
Eine neue Untersuchung der Hans-Böckler-Stiftun… [+1323 chars]",,de,'Krise'
https://www.welt.de/wirtschaft/article254354024/Habecks-grosses-Entgegenkommen-versperrt-Lindner-einen-Fluchtweg-aus-der-Ampel.html,https://www.welt.de/wirtschaft/article254354024/Habecks-grosses-Entgegenkommen-versperrt-Lindner-einen-Fluchtweg-aus-der-Ampel.html,0,www.welt.de,Habecks großes Entgegenkommen versperrt Lindner einen Fluchtweg aus der Ampel,Über das Wochenende hatte Robert Habeck zur Krise der Ampel geschwiegen. Damit ist jetzt Schluss. Der Wirtschaftsminister macht mit der Bereitstellung der Intel-Milliarden für den Haushalt einen großen Schritt auf Lindner zu. Der Rückzug aus der Koalition wir…,https://img.welt.de/img/wirtschaft/mobile254354140/9177935107-ci16x9-w1200/Ampel-Koalition-in-der-Krise-Habeck.jpg,2024-11-04T18:22:50Z,http://archive.md/20241104185739/https://www.welt.de/wirtschaft/article254354024/Habecks-grosses-Entgegenkommen-versperrt-Lindner-einen-Fluchtweg-aus-der-Ampel.html,Über das Wochenende hatte Robert Habeck zur Krise der Ampel geschwiegen. Damit ist jetzt Schluss. Der Wirtschaftsminister macht mit der Bereitstellung der Intel-Milliarden für den Haushalt einen groß… [+7859 chars],,de,'Flucht'
https://www.welt.de/wirtschaft/video254354310/Streit-in-der-Koalition-Habeck-fordert-Ampel-zu-grosser-Kraftanstrengung-auf.html,https://www.welt.de/wirtschaft/video254354310/Streit-in-der-Koalition-Habeck-fordert-Ampel-zu-grosser-Kraftanstrengung-auf.html,0,www.welt.de,Habeck fordert Ampel zu „großer Kraftanstrengung“ auf,"Wirtschaftsminister Robert Habeck (Grüne) hat die Ampel zu einer „großen Kraftanstrengung“ aufgefordert, um die Krise der Koalition zu überwinden. Habeck sagte in Berlin, die Regierung sei einem schweren Fahrwasser.",https://img.welt.de/img/wirtschaft/mobile254354314/5427930737-ci16x9-w1200/Ampel-Koalition-in-der-Krise-Habeck.jpg,2024-11-04T18:55:08Z,,"Wirtschaftsminister Robert Habeck (Grüne) hat die Ampel zu einer großen Kraftanstrengung aufgefordert, um die Krise der Koalition zu überwinden. Habeck sagte in Berlin, die Regierung sei einem schwer… [+59 chars]",,de,'Krise'
https://www.bild.de/politik/inland/gute-vorschlaege-experten-streit-ueber-lindners-zoff-papier-67277496deb4ad36f415400c,https://www.bild.de/politik/inland/gute-vorschlaege-experten-streit-ueber-lindners-zoff-papier-67277496deb4ad36f415400c,0,www.bild.de,Scheidungs-Brief oder gute Vorschläge? - Experten-Streit über Lindners Zoff-Papier,Am Freitag überraschte FDP-Chef Christian Lindner (45) mit einem Wirtschaftspapier seine Ampel-Koalitionspartner. Seitdem herrscht in der Regierung Krise...,"https://images.bild.de/67277496deb4ad36f415400c/b59777f11abac96a64ec8c66aab0d346,3fe4ea63?w=1280",2024-11-04T19:21:54Z,,"Am Freitag überraschte FDP-Chef Christian Lindner (45) mit einem Wirtschaftspapier seine Ampel-Koalitionspartner. Seitdem herrscht in der Regierung Krisenstimmung! 
Auf 18 Seiten fordert der Bundesf… [+2105 chars]",,de,'Krise'
https://www.zeit.de/arbeit/2024-11/mitarbeiter-volkswagen-krise-stellenabbau-gehalt-luigi-catapano-ig-metall,https://www.zeit.de/arbeit/2024-11/mitarbeiter-volkswagen-krise-stellenabbau-gehalt-luigi-catapano-ig-metall,0,www.zeit.de,"Mitarbeiter bei Volkswagen: ""Der Lohn war eine Art Schmerzensgeld""","Arbeiter bei VW konnten sich jahrzehntelang wie Beamte fühlen: sicherer Job, gutes Geld. Das ändert sich nun, auch für Familie Catapano. Wie geht es ihnen in der Krise?",https://img.zeit.de/arbeit/2024-11/mitarbeiter-volkswagen-krise-stellenabbau-gehalt-luigi-catapano-ig-metall-aufmacherbild/wide__1300x731,2024-11-04T19:31:02Z,http://archive.md/20241104193318/https://www.zeit.de/arbeit/2024-11/mitarbeiter-volkswagen-krise-stellenabbau-gehalt-luigi-catapano-ig-metall,"Der kleine Ort Bahrdorf, 23 Autominuten von der Autostadt Wolfsburg entfernt. Tanja Catapano öffnet die Tür. Im Wohnzimmer bollert der Kamin, brennen Kerzen, der Fernseher flackert stumm. N-tv läuft.… [+726 chars]",,de,'Krise'
