index,url,valid,domain,title,description,image,published,archive,content,quote,language,keyword
https://www.diepresse.com/19763268/ukrainische-drohnen-legen-stromnetz-in-saporischschja-und-cherson-lahm,https://www.diepresse.com/19763268/ukrainische-drohnen-legen-stromnetz-in-saporischschja-und-cherson-lahm,0,www.diepresse.com,Ukrainische Drohnen legen Stromnetz in Saporischschja und Cherson lahm,Zehntausende Menschen in den von Russland besetzten Gebieten in der Ukraine sind ohne Strom. Die Ukraine meldet russische Angriffe auf Charkiw.,https://img.diepresse.com/public/incoming/r9w692-UKRAINE-RUSSIA-CONFLICT-WAR/alternates/DPR_SOCIAL_NACHRICHTEN/UKRAINE-RUSSIA-CONFLICT-WAR,2025-06-05T04:53:32Z,https://web.archive.org/web/20250605055803/https://www.diepresse.com/19763268/ukrainische-drohnen-legen-stromnetz-in-saporischschja-und-cherson-lahm,"Zehntausende Menschen in den von Russland besetzten Gebieten in der Ukraine sind ohne Strom. Die Ukraine meldet russische Angriffe auf Charkiw.
Die russische Besatzung im Süden der Ukraine meldet er… [+4000 chars]",,de,'Russland'
https://www.stern.de/news/nordkorea-sichert-russland-im-ukraine-krieg--bedingungslose-unterstuetzung--zu-35783908.html,https://www.stern.de/news/nordkorea-sichert-russland-im-ukraine-krieg--bedingungslose-unterstuetzung--zu-35783908.html,0,www.stern.de,"Nordkorea sichert Russland im Ukraine-Krieg ""bedingungslose Unterstützung"" zu","Nordkoreas Machthaber Kim Jong Un hat Russland im Krieg gegen die Ukraine Staatsmedien zufolge ""bedingungslose Unterstützung"" zugesichert. Kim habe bei einem Treffen mit dem Sekretär des Nationalen Sicherheitsrats Russlands, Sergej Schoigu, am Donnerstag in P…",https://image.stern.de/35783910/t/z5/v1/w1440/r1.7778/-/05--kim-jong-un-r-und-sergej-schoigu---4898f32a4dc5d657.jpg,2025-06-05T05:08:59Z,https://web.archive.org/web/20250605052715/https://www.stern.de/news/nordkorea-sichert-russland-im-ukraine-krieg--bedingungslose-unterstuetzung--zu-35783908.html,"Kopiere den aktuellen Link
Zur Merkliste hinzufügen
Nordkoreas Machthaber Kim Jong Un hat Russland im Krieg gegen die Ukraine Staatsmedien zufolge ""bedingungslose Unterstützung"" zugesichert. Kim ha… [+1467 chars]",,de,'Ukraine'
https://www.telepolis.de/features/Olympia-Skandal-Boxverband-entschuldigt-sich-fuer-voreilige-Geschlechts-Anschuldigung-10426062.html,https://www.telepolis.de/features/Olympia-Skandal-Boxverband-entschuldigt-sich-fuer-voreilige-Geschlechts-Anschuldigung-10426062.html,0,www.telepolis.de,Olympia-Skandal: Boxverband entschuldigt sich für voreilige Geschlechts-Anschuldigung,Boxverband rudert nach Vorwürfen zurück. Neue Entwicklungen heizen die Debatte an. Was wird das offizielle Gutachten ergeben? (Leserdebatte),https://heise.cloudimg.io/bound/1200x1200/q85.png-lossy-85.webp-lossy-85.foil1/_www-heise-de_/imgs/18/4/8/6/6/3/2/6/shutterstock_2498041531-d4d143a220f3810c.jpeg,2025-06-05T06:00:00Z,,"Khelif bei den Olympischen Spielen in Paris. Bild: ProPhoto1234/ Shutterstock.com
Boxverband rudert nach Vorwürfen zurück. Neue Entwicklungen heizen die Debatte an. Was wird das offizielle Gutachten… [+3458 chars]",,de,'heizen'
https://www.stern.de/news/realloehne-in-deutschland-im-ersten-quartal-um-1-2-prozent-gestiegen-35784084.html,https://www.stern.de/news/realloehne-in-deutschland-im-ersten-quartal-um-1-2-prozent-gestiegen-35784084.html,0,www.stern.de,"Reallöhne in Deutschland im ersten Quartal um 1,2 Prozent gestiegen","Die Nominallöhne in Deutschland sind im ersten Quartal im Vergleich zum Vorjahreszeitraum um 3,6 Prozent gestiegen. Die Inflation lag in diesem Zeitraum bei 2,3 Prozent, der Reallohnzuwachs demnach bei 1,2 Prozent, wie das Statistische Bundesamt in Wiesbaden …",https://image.stern.de/35784086/t/-8/v1/w1440/r1.7778/-/05--arbeiter-in-vwproduktionsstaette-in-salzgitter---dd92701ccd6e5402.jpg,2025-06-05T06:55:13Z,,"Kopiere den aktuellen Link
Zur Merkliste hinzufügen
Die Nominallöhne in Deutschland sind im ersten Quartal im Vergleich zum Vorjahreszeitraum um 3,6 Prozent gestiegen. Die Inflation lag in diesem Z… [+926 chars]",,de,'Inflation'
https://www.stern.de/wirtschaft/news/zum-achten-mal-in-folge--realloehne-im-ersten-quartal-gestiegen-35784160.html,https://www.stern.de/wirtschaft/news/zum-achten-mal-in-folge--realloehne-im-ersten-quartal-gestiegen-35784160.html,0,www.stern.de,Zum achten Mal in Folge: Reallöhne im ersten Quartal gestiegen,Steigende Löhne und zurückgehende Inflation: Unter dem Strich können sich viele Menschen mehr leisten. Allerdings fällt das Lohnplus nicht mehr ganz so stark aus.,https://image.stern.de/35784162/t/5J/v1/w1440/r1.7778/-/05--3xftkazv43v9axs2048jpeg---6cbdfe4700fc8c82.jpg,2025-06-05T07:24:53Z,,"Kopiere den aktuellen Link
Zur Merkliste hinzufügen
Steigende Löhne und zurückgehende Inflation: Unter dem Strich können sich viele Menschen mehr leisten. Allerdings fällt das Lohnplus nicht mehr g… [+1418 chars]",,de,'Inflation'
https://www.tagesspiegel.de/wirtschaft/zum-achten-mal-in-folge-reallohne-im-ersten-quartal-gestiegen-13806127.html,https://www.tagesspiegel.de/wirtschaft/zum-achten-mal-in-folge-reallohne-im-ersten-quartal-gestiegen-13806127.html,0,www.tagesspiegel.de,Zum achten Mal in Folge: Reallöhne im ersten Quartal gestiegen,Steigende Löhne und zurückgehende Inflation: Unter dem Strich können sich viele Menschen mehr leisten. Allerdings fällt das Lohnplus nicht mehr ganz so stark aus.,https://www.tagesspiegel.de/images/13806124/alternates/BASE_16_9_W1400/1749108368000/mehr-geld-im-portemonnaie.jpeg,2025-06-05T07:26:08Z,,"Die Reallöhne in Deutschland sind zum achten Mal in Folge gestiegen - allerdings nicht mehr so stark wie in den Vorquartalen. 1,2 Prozent mehr als ein Jahr zuvor hatten Arbeitnehmerinnen und Arbeitne… [+1965 chars]",,de,'Inflation'
https://www.diepresse.com/19761738/wachstum-trotz-zins-hokuspokus,https://www.diepresse.com/19761738/wachstum-trotz-zins-hokuspokus,0,www.diepresse.com,Wachstum trotz Zins-Hokuspokus,"Die türkische Wirtschaftsleistung soll heuer um 2,8 Prozent zulegen. Die überhöhte Inflationsrate dürfte aber weiter für Probleme sorgen.",https://img.diepresse.com/public/incoming/7z0lhy-FILE-PHOTO-People-shop-at-a-fresh-market-in-Istanbul/alternates/DPR_SOCIAL_NACHRICHTEN/FILE%20PHOTO%20People%20shop%20at%20a%20fresh%20market%20in%20Istanbul,2025-06-05T08:36:58Z,,"Die türkische Wirtschaftsleistung soll heuer um 2,8 Prozent zulegen. Die überhöhte Inflationsrate dürfte aber weiter für Probleme sorgen. 
Werden Ökonomen der alten (sprich wissensbasierten) Schule … [+2888 chars]",,de,'Inflation'
https://www.stern.de/wirtschaft/versicherung/baldige-rentenerhoehung--so-viel-mehr-bekommen-rentner-ab-dem-1--juli-35532388.html,https://www.stern.de/wirtschaft/versicherung/baldige-rentenerhoehung--so-viel-mehr-bekommen-rentner-ab-dem-1--juli-35532388.html,0,www.stern.de,"Rentenerhöhung: Diese Tabelle zeigt, wie viel Rente Sie ab 1. Juli mehr kriegen","Die Rentenerhöhung steht fest: Zum 1. Juli steigt die Rente um 3,74 Prozent – stärker als sie Inflation. Wie hoch die Rente künftig ausfällt, zeigt unsere Tabelle.",https://image.stern.de/35532820/t/m6/v2/w1440/r1.7778/-/rentenerhoehung-1--juli-mehr-rente.jpg,2025-06-05T09:13:00Z,,"Kopiere den aktuellen Link
Zur Merkliste hinzufügen
Die Rentenerhöhung steht fest: Zum 1. Juli steigt die Rente um 3,74 Prozent stärker als sie Inflation. Wie hoch die Rente künftig ausfällt, zeigt… [+6081 chars]",,de,'Inflation'
https://www.diepresse.com/19764510/ngos-fordern-sozialen-klimabonus-fuer-armutsbetroffene,https://www.diepresse.com/19764510/ngos-fordern-sozialen-klimabonus-fuer-armutsbetroffene,0,www.diepresse.com,NGOs fordern „sozialen Klimabonus“ für Armutsbetroffene,"Die Sparpläne der Regierung würden Alleinerziehende, Langzeitarbeitslose, Sozialhilfebezieher und Mindestpensionisten „massiv“ betreffen, kritisieren Hilfsorganisation.",https://img.diepresse.com/public/incoming/2x9fm8-kein-Titel/alternates/DPR_SOCIAL_NACHRICHTEN/kein%20Titel,2025-06-05T09:39:59Z,,"Die Sparpläne der Regierung würden Alleinerziehende, Langzeitarbeitslose, Sozialhilfebezieher und Mindestpensionisten massiv betreffen, kritisieren Hilfsorganisation.
Die Bundesarbeitsgemeinschaft F… [+1846 chars]",,de,'Inflation'
https://www.stern.de/gesellschaft/regional/thueringen/lohnentwicklung--inflation-frisst-lohnerhoehungen-nicht-mehr-auf-35784998.html,https://www.stern.de/gesellschaft/regional/thueringen/lohnentwicklung--inflation-frisst-lohnerhoehungen-nicht-mehr-auf-35784998.html,0,www.stern.de,Lohnentwicklung: Inflation frisst Lohnerhöhungen nicht mehr auf,"Erfurt (th) - In Thüringen sind im ersten Quartal dieses Jahres die Löhne schneller gestiegen als die Verbraucherpreise. Die Reallöhne fielen 1,7 Prozent",https://image.stern.de/35785000/t/x8/v1/w1440/r1.7778/-/05--mfe3mxuebbv12axs2048jpeg---51febaa76c641375.jpg,2025-06-05T10:24:14Z,,"Kopiere den aktuellen Link
Zur Merkliste hinzufügen
Lohnerhöhungen sind in letzter Zeit oft verpufft, weil die Verbraucherpreise schneller stiegen. Das ist bisher in diesem Jahr anders.
In Thüring… [+1159 chars]",,de,'Inflation'
https://www.zeit.de/news/2025-06/05/prien-verurteilt-angriff-auf-antisemitismusbeauftragten,https://www.zeit.de/news/2025-06/05/prien-verurteilt-angriff-auf-antisemitismusbeauftragten,0,www.zeit.de,Antisemitismus: Prien verurteilt Angriff auf Antisemitismusbeauftragten,Hier finden Sie Informationen zu dem Thema „Antisemitismus“. Lesen Sie jetzt „Prien verurteilt Angriff auf Antisemitismusbeauftragten“.,https://img.zeit.de/news/2025-06/05/prien-verurteilt-angriff-auf-antisemitismusbeauftragten-image-group/wide__1300x731,2025-06-05T11:24:45Z,,Bundesfamilienministerin Karin Prien (CDU) hat den mutmaßlich antisemitischen Vorfall gegen den Hamburger Antisemitismusbeauftragten Stefan Hensel scharf verurteilt. «Solch ein antisemitischer Akt is… [+1725 chars],,de,'Angriff'
https://www.n-tv.de/wirtschaft/EZB-setzt-Leitzins-auf-zwei-Prozent-herab-article25815865.html,https://www.n-tv.de/wirtschaft/EZB-setzt-Leitzins-auf-zwei-Prozent-herab-article25815865.html,0,www.n-tv.de,Achte Zinssenkung: EZB setzt Leitzins auf zwei Prozent herab,"Die Inflation sinkt unter das EZB-Ziel, aber die Konjunktur schwächelt: Für die EZB heißt das, erneut die Zinsen zu senken. Der Leitzins liegt nun bei 2,0 Prozent. Wie es weitergeht, dazu wagen die Währungshüter jedoch noch keine Prognose.",https://www.n-tv.de/img/incoming/crop25815868/7521328593-cImg_16_9-w1200/511612838.jpg,2025-06-05T12:15:40Z,,"Die Inflation sinkt unter das EZB-Ziel, aber die Konjunktur schwächelt: Für die EZB heißt das, erneut die Zinsen zu senken. Der Leitzins liegt nun bei 2,0 Prozent. Wie es weitergeht, dazu wagen die W… [+2555 chars]",,de,'Inflation'
https://www.bild.de/geld/wirtschaft/ezb-treibt-senkungskurs-voran-leitzins-faellt-auf-zwei-prozent-68418a6e15a5fe5bd25478a7,https://www.bild.de/geld/wirtschaft/ezb-treibt-senkungskurs-voran-leitzins-faellt-auf-zwei-prozent-68418a6e15a5fe5bd25478a7,0,www.bild.de,EZB treibt Senkungskurs voran - Leitzins fällt auf zwei Prozent,Die Europäische Zentralbank (EZB) setzt ihren Zinssenkungskurs fort: Angesichts der sinkenden Inflation und der schwachen Konjunktur im Euroraum beschlos...,"https://images.bild.de/68418a6e15a5fe5bd25478a7/abcb2257d431bbf7a2d1eac3f9001c2d,afea2339?w=1280",2025-06-05T12:16:25Z,,"Um den TTS Player darzustellen, brauchen wir deine Zustimmung. 
 externen Inhalt aktivieren Um eingebettete Inhalte anzuzeigen, ist Ihre jederzeit widerrufliche Einwilligung (über den Schalter oder … [+1843 chars]",,de,'Inflation'
https://www.tagesspiegel.de/wirtschaft/inflation-schwindet-schnell-achte-zinssenkung-seit-sommer-2024-macht-die-ezb-nun-pause-13808689.html,https://www.tagesspiegel.de/wirtschaft/inflation-schwindet-schnell-achte-zinssenkung-seit-sommer-2024-macht-die-ezb-nun-pause-13808689.html,0,www.tagesspiegel.de,Inflation schwindet schnell: Achte Zinssenkung seit Sommer 2024: Macht die EZB nun Pause?,"Die Inflation flaut ab, die Wirtschaft braucht im Zollstreit Unterstützung: Grund genug für die Europäische Zentralbank, Geld noch günstiger zu machen. Es könnte die vorerst letzte Zinssenkung sein.",https://www.tagesspiegel.de/images/13810159/alternates/BASE_16_9_W1400/1749132424000/ezb-ratssitzung.jpeg,2025-06-05T12:16:34Z,,Druck auf Europas Wirtschaft im Zollstreit mit den USA und eine schnell sinkende Inflation: Nach acht Zinssenkungen innerhalb eines Jahres könnte die Europäische Zentralbank (EZB) eine Pause auf ihre… [+5112 chars],,de,'Inflation'
https://www.tagesspiegel.de/wirtschaft/nachste-lockerung-ezb-stutzt-konjunktur-mit-achter-zinssenkung-seit-juni-2024-13808689.html,https://www.tagesspiegel.de/wirtschaft/nachste-lockerung-ezb-stutzt-konjunktur-mit-achter-zinssenkung-seit-juni-2024-13808689.html,0,www.tagesspiegel.de,Nächste Lockerung: EZB stützt Konjunktur mit achter Zinssenkung seit Juni 2024,"Die Inflation flaut ab, die Wirtschaft braucht im Zollstreit Unterstützung: Grund genug für die Europäische Zentralbank, Geld noch günstiger zu machen. Es könnte die vorerst letzte Zinssenkung sein.",https://www.tagesspiegel.de/images/13808758/alternates/BASE_16_9_W1400/1749126115000/ezb.jpeg,2025-06-05T12:16:34Z,,Die von hohen US-Zöllen bedrohte Wirtschaft im Euroraum darf auf günstigere Kredite hoffen: Zum achten Mal seit Juni 2024 senkt die Europäische Zentralbank (EZB) die Leitzinsen im Euroraum. Damit wir… [+4118 chars],,de,'Inflation'
https://www.nzz.ch/wirtschaft/die-ezb-senkt-die-leitzinsen-auf-zwei-prozent-doch-christine-lagarde-hat-noch-ein-anderes-problem-als-die-geldpolitik-ld.1886743,https://www.nzz.ch/wirtschaft/die-ezb-senkt-die-leitzinsen-auf-zwei-prozent-doch-christine-lagarde-hat-noch-ein-anderes-problem-als-die-geldpolitik-ld.1886743,0,www.nzz.ch,Die EZB senkt die Leitzinsen auf zwei Prozent – doch Christine Lagarde hat noch ein anderes Problem als die Geldpolitik,"Zum achten Mal in einem Jahr hat die Europäische Zentralbank die Leitzinsen um 0,25 Prozentpunkte gesenkt. Das Zinsniveau liegt nun im neutralen Bereich – und die Inflation hat den Zielwert erreicht.","https://img.nzz.ch/2025/05/29/b5cc881a-6d1f-476d-a6e1-ae8ac8103037.jpeg?width=1200&height=674&fit=bounds&quality=75&auto=webp&crop=4500,2531,x0,y57&wmark=nzz",2025-06-05T12:17:33Z,,"EZB-Präsidentin Christine Lagarde: Die Französin muss sich Gerüchten stellen, wonach sie ein vorzeitiges Ende ihrer Amtszeit erwogen habe.
Die Personalie Christine Lagarde überschattete am Donnersta… [+5950 chars]",,de,'Inflation'
https://www.sueddeutsche.de/wirtschaft/ezb-leitzinsen-inflation-trump-li.3264026,https://www.sueddeutsche.de/wirtschaft/ezb-leitzinsen-inflation-trump-li.3264026,0,www.sueddeutsche.de,Geldpolitik: EZB senkt Leitzinsen zum achten Mal hintereinander,"Die Europäische Zentralbank hat die Leitzinsen aufgrund rückläufiger Inflation auf 2,00 Prozent gesenkt. Dies hat Auswirkungen auf Zinserträge und Kreditkosten in der Euro-Zone.",https://www.sueddeutsche.de/2025/06/05/59a46e3a-e941-450d-b309-0b8e8f795761.jpeg?q=60&fm=webp&width=1200&rect=0%2C0%2C2497%2C1405,2025-06-05T12:19:47Z,,"Die Entscheidung der EZB ist wenig überraschend, nachdem die Inflation in der Euro-Zone im Mai auf 1,9 Prozent gesunken war. Im April lag der Wert noch bei 2,2 Prozent. Die EZB strebt eine durchschni… [+3141 chars]",,de,'Inflation'
https://www.stern.de/news/naechste-lockerung--ezb-stuetzt-konjunktur-mit-achter-zinssenkung-seit-juni-2024-35785544.html,https://www.stern.de/news/naechste-lockerung--ezb-stuetzt-konjunktur-mit-achter-zinssenkung-seit-juni-2024-35785544.html,0,www.stern.de,Nächste Lockerung: EZB stützt Konjunktur mit achter Zinssenkung seit Juni 2024,"Die Inflation flaut ab, die Wirtschaft braucht im Zollstreit Unterstützung: Grund genug für die Europäische Zentralbank, Geld noch günstiger zu machen. Es könnte die vorerst letzte Zinssenkung sein.",https://image.stern.de/35785546/t/il/v2/w1440/r1.7778/-/05--qfxnobu3b2v1axs2048jpeg---3370eeb047fad8c3.jpg,2025-06-05T12:20:21Z,,"Kopiere den aktuellen Link
Zur Merkliste hinzufügen
Die Inflation flaut ab, die Wirtschaft braucht im Zollstreit Unterstützung: Grund genug für die Europäische Zentralbank, Geld noch günstiger zu m… [+4410 chars]",,de,'Inflation'
https://www.tagesspiegel.de/wirtschaft/geringerer-inflation-erwartet-ezb-senkt-leitzins-auf-zwei-prozent-13808767.html,https://www.tagesspiegel.de/wirtschaft/geringerer-inflation-erwartet-ezb-senkt-leitzins-auf-zwei-prozent-13808767.html,0,www.tagesspiegel.de,Geringerer Inflation erwartet: EZB senkt Leitzins auf zwei Prozent,"Die Währungshüter setzen den am Finanzmarkt maßgeblichen Einlagensatz, der Leitzins im Euroraum, am Donnerstag auf 2,0 von 2,25 Prozent nach unten. Auch weil sie mit wenig Wachstum rechnen.",https://www.tagesspiegel.de/images/13808803/alternates/BASE_16_9_W1400/1749126541000/ezb-ratssitzung-mit-zinsentscheidung.jpeg,2025-06-05T12:24:21Z,,Die Europäische Zentralbank (EZB) setzt angesichts der sinkenden Inflation und der schwachen Konjunktur im Euroraum ihren Zinssenkungskurs fort. Der EZB-Rat um Notenbankchefin Christine Lagarde besch… [+3480 chars],,de,'Finanz'
https://www.stern.de/news/ezb-senkt-leitzinsen-erneut---sparzins-jetzt-bei-2-0-prozent-35785604.html,https://www.stern.de/news/ezb-senkt-leitzinsen-erneut---sparzins-jetzt-bei-2-0-prozent-35785604.html,0,www.stern.de,"EZB senkt Leitzinsen erneut - Sparzins jetzt bei 2,0 Prozent","Die Europäische Zentralbank (EZB) hat ihre Leitzinsen vor dem Hintergrund der abgeschwächten Inflation und der US-Zollpolitik erneut um 0,25 Prozentpunkte gesenkt. Der zentrale Leitzins, der auch für Sparerinnen und Sparer wichtige Einlagenzins, liegt damit b…",https://image.stern.de/35785606/t/h4/v1/w1440/r1.7778/-/05--ezbhauptquartier-in-frankfurt-am-main---6f4b8c0c7ccede25.jpg,2025-06-05T12:30:11Z,,"Kopiere den aktuellen Link
Zur Merkliste hinzufügen
Die Europäische Zentralbank (EZB) hat ihre Leitzinsen vor dem Hintergrund der abgeschwächten Inflation und der US-Zollpolitik erneut um 0,25 Proz… [+1988 chars]",,de,'Inflation'
https://www.zeit.de/news/2025-06/05/staedtetag-finanznot-hat-sich-zugespitzt,https://www.zeit.de/news/2025-06/05/staedtetag-finanznot-hat-sich-zugespitzt,0,www.zeit.de,Leere Kassen: Städtetag: Finanznot hat sich zugespitzt,Hier finden Sie Informationen zu dem Thema „Leere Kassen“. Lesen Sie jetzt „Städtetag: Finanznot hat sich zugespitzt“.,https://img.zeit.de/news/2025-06/05/staedtetag-finanznot-hat-sich-zugespitzt-image-group/wide__1300x731,2025-06-05T12:58:48Z,,Hessens Städte geraten immer mehr in Finanznöte und dies wird auch für Bürgerinnen und Bürger zunehmend spürbar werden. Die finanzielle Situation habe sich den vergangenen Monaten nochmal dramatisch … [+1846 chars],,de,'Finanz'
https://stadt-bremerhaven.de/waermepumpen-dominieren-neubauten-anteil-steigt-auf-fast-70-prozent/,https://stadt-bremerhaven.de/waermepumpen-dominieren-neubauten-anteil-steigt-auf-fast-70-prozent/,0,stadt-bremerhaven.de,Wärmepumpen dominieren Neubauten – Anteil steigt auf fast 70 Prozent,Wärmepumpen sind beim Heizen neuer Wohnhäuser in Deutschland inzwischen die klare Nummer eins. Laut Statistischem Bundesamt wurden 2024 in fast 70 % der fertiggestellten Neubauten Wärmepumpen als primäre Heizquelle eingesetzt. Vor zehn Jahren lag der Anteil n…,https://stadt-bremerhaven.de/wp-content/uploads/2023/04/news_solution_offering_neue_Wa-rmepumpen-Generation_Header_.jpg,2025-06-05T15:30:32Z,,"Luft/Wasser-Wärmepumpen in Monoblock- und Split-Bauweise von Viessmann
Wärmepumpen sind beim Heizen neuer Wohnhäuser in Deutschland inzwischen die klare Nummer eins. Laut Statistischem Bundesamt wur… [+1220 chars]",,de,'heizen'
https://www.nzz.ch/meinung/die-ezb-sollte-die-zinssenkungen-jetzt-stoppen-und-abwarten-wie-sich-die-lage-entwickelt-ld.1887774,https://www.nzz.ch/meinung/die-ezb-sollte-die-zinssenkungen-jetzt-stoppen-und-abwarten-wie-sich-die-lage-entwickelt-ld.1887774,0,www.nzz.ch,"KOMMENTAR - Die EZB sollte die Zinssenkungen jetzt stoppen – und abwarten, wie sich die Lage entwickelt",Die Europäische Zentralbank (EZB) hat die Inflation in den Griff bekommen. Weitere Zinssenkungen würden die Realzinsen ins Minus drücken. Das ist derzeit nicht nötig.,"https://img.nzz.ch/2023/05/04/3477b58f-c465-4040-a95a-0eacf1da84ed.jpeg?width=1200&height=675&fit=bounds&quality=75&auto=webp&crop=3500,1969,x0,y118&wmark=nzz",2025-06-05T15:31:08Z,,"Hauptgebäude der EZB im Frankfurter Ostend: Die Währungsbehörde hat die Leitzinsen seit Juni 2024 in acht Schritten auf 2 Prozent reduziert.
Im Juni vergangenen Jahres hat die EZB die Zinswende eing… [+4218 chars]",,de,'Inflation'
https://www.tagesschau.de/wirtschaft/finanzen/ezb-zinssenkung-analyse-100.html,https://www.tagesschau.de/wirtschaft/finanzen/ezb-zinssenkung-analyse-100.html,0,www.tagesschau.de,EZB senkt Zinsen - und denkt über Pause nach,Vor dem Hintergrund nachlassenden Inflationsdrucks hat die EZB heute zum achten Mal in Folge die Leitzinsen gesenkt. Doch wie geht es weiter? Rückt eine Zinspause näher? Von Klaus-Rainer Jackisch.,https://images.tagesschau.de/image/616c0f81-7519-4a61-b380-60a02ec75bf7/AAABlzmz1Yc/AAABkZLhkrw/16x9-1280/ezb-520.jpg,2025-06-05T16:07:53Z,,"Stand: 05.06.2025 18:07 Uhr
Vor dem Hintergrund nachlassenden Inflationsdrucks hat die EZB heute zum achten Mal in Folge die Leitzinsen gesenkt. Doch wie geht es weiter? Rückt eine Zinspause näher?… [+4328 chars]",,de,'Inflation'
https://www.zeit.de/politik/ausland/2025-06/pete-hegseth-nato-verteidigungsminister-bruessel-usa,https://www.zeit.de/politik/ausland/2025-06/pete-hegseth-nato-verteidigungsminister-bruessel-usa,0,www.zeit.de,Pete Hegseth: Die Nato wird europäischer,Auf dem Nato-Treffen in Brüssel lässt sich der US-Verteidigungsminister Pete Hegseth nur kurz blicken. Dabei wurden dort die Weichen gestellt für mehr Geld und Waffen.,https://img.zeit.de/politik/ausland/2025-06/pete-hegseth-nato-verteidigungsminister-bruessel-usa-bild/wide__1300x731,2025-06-05T18:00:24Z,http://archive.md/20250605180250/https://www.zeit.de/politik/ausland/2025-06/pete-hegseth-nato-verteidigungsminister-bruessel-usa,Pete Hegseth hat nicht viel Zeit. Zum Treffen der Nato-Verteidigungsminister in Brüssel an diesem Donnerstag reist er erst am Vorabend an. Zu spät für das Treffen der Ukraine-Unterstützerstaaten am M… [+776 chars],,de,'Waffen'
https://www.telepolis.de/features/EZB-senkt-Leitzinsen-erneut-Inflation-faellt-unter-Zwei-Prozent-Ziel-10433162.html,https://www.telepolis.de/features/EZB-senkt-Leitzinsen-erneut-Inflation-faellt-unter-Zwei-Prozent-Ziel-10433162.html,0,www.telepolis.de,EZB senkt Leitzinsen erneut: Inflation fällt unter Zwei-Prozent-Ziel,"Die Europäische Zentralbank hat die Zinsen zum achten Mal gesenkt, nachdem die Inflation unter zwei Prozent gefallen ist. Die Zinssenkung wird nicht die letzte sein. Ein Überblick.",https://heise.cloudimg.io/bound/1200x1200/q85.png-lossy-85.webp-lossy-85.foil1/_www-heise-de_/imgs/18/4/8/6/9/8/8/0/shutterstock_2272060577-5ed84c03f1c3aaa6.jpeg,2025-06-05T22:00:00Z,,"Die EZB hat den Euro-Leitzins auf zwei Prozent gesenkt
(Bild: DesignRage/Shutterstock.com)
Die Europäische Zentralbank hat die Zinsen zum achten Mal gesenkt, nachdem die Inflation unter zwei Prozen… [+3097 chars]",,de,'Inflation'
https://www.zeit.de/news/2025-06/06/bericht-massiver-russischer-angriff-auf-ukraine-im-gange,https://www.zeit.de/news/2025-06/06/bericht-massiver-russischer-angriff-auf-ukraine-im-gange,0,www.zeit.de,Krieg: Bericht: Massiver russischer Angriff auf Ukraine im Gange,Hier finden Sie Informationen zu dem Thema „Krieg“. Lesen Sie jetzt „Bericht: Massiver russischer Angriff auf Ukraine im Gange“.,https://img.zeit.de/news/2025-06/06/bericht-massiver-russischer-angriff-auf-ukraine-im-gange-image-group/wide__1300x731,2025-06-06T01:13:27Z,,Russland hat die Ukraine in der Nacht einem Medienbericht zufolge mit einer ungewöhnlich heftigen Welle von Drohnenangriffen und Marschflugkörpern attackiert. Ziele seien die Hauptstadt Kiew sowie an… [+894 chars],,de,'Ukraine'
https://www.freitag.de/autoren/guenter-klein/fussball-echte-derbys-sind-in-deutschland-rar-der-sportreporter-guenter-klein,https://www.freitag.de/autoren/guenter-klein/fussball-echte-derbys-sind-in-deutschland-rar-der-sportreporter-guenter-klein,0,www.freitag.de,Endlich wieder echte Derbys: Köln und HSV heizen der Bundesliga 2025 ein,"Die Bundesliga 2025/26 wird heiß: Mit dem HSV und dem 1. FC Köln kehren zwei Traditionsklubs zurück. Fans dürfen sich auf ein echtes Derby freuen – St. Pauli gegen den HSV! Endlich wieder große Namen, Rivalität und Emotionen in Liga eins Die erste Fußball-Bun…",https://www.freitag.de/autoren/guenter-klein/fussball-echte-derbys-sind-in-deutschland-rar-der-sportreporter-guenter-klein/@@images/image/great,2025-06-06T02:00:00Z,https://web.archive.org/web/20250604110701/https://www.freitag.de/autoren/guenter-klein/fussball-echte-derbys-sind-in-deutschland-rar-der-sportreporter-guenter-klein,"Die erste Fußball-Bundesliga ist schon voller Vorfreude auf die Saison 2025/26. Denn sie wird attraktiver. Gut, die Entscheidung über den letzten freien Platz zwischen dem 1. FC Heidenheim und der SV… [+567 chars]",,de,'heizen'
