index,url,valid,domain,title,description,image,published,archive,content,quote,language,keyword
https://www.welt.de/wirtschaft/plus254348080/Ausbildung-Wieder-mehr-Bewerber-doch-eine-Trendumkehr-ist-ein-Irrglaube.html,https://www.welt.de/wirtschaft/plus254348080/Ausbildung-Wieder-mehr-Bewerber-doch-eine-Trendumkehr-ist-ein-Irrglaube.html,0,www.welt.de,Der Irrglaube von der „Trendumkehr“ in der Azubi-Krise,Nach jahrelangem Rückgang nimmt die Zahl der Bewerber für eine Berufsausbildung in Deutschland wieder leicht zu. Im Arbeitsministerium spricht man schon von einer „Trendumkehr“. Doch die Details in den Zahlen zeigen eine ganz andere Entwicklung.,https://img.welt.de/img/wirtschaft/mobile254349006/1637930087-ci16x9-w1200-fnov-fpotl-fpi157750653/Worker-in-metal-worshop.jpg,2024-11-04T19:49:09Z,http://archive.md/20241105061154/https://www.welt.de/wirtschaft/plus254348080/Ausbildung-Wieder-mehr-Bewerber-doch-eine-Trendumkehr-ist-ein-Irrglaube.html,Nach jahrelangem Rückgang nimmt die Zahl der Bewerber für eine Berufsausbildung in Deutschland wieder leicht zu. Im Arbeitsministerium spricht man schon von einer Trendumkehr. Doch die Details in den… [+43 chars],,de,'Krise'
https://www.bild.de/politik/inland/lindner-zu-besuch-in-nrw-minister-redet-sich-mit-humor-durch-die-krise-6728ba1aebdb8724738e8515,https://www.bild.de/politik/inland/lindner-zu-besuch-in-nrw-minister-redet-sich-mit-humor-durch-die-krise-6728ba1aebdb8724738e8515,0,www.bild.de,Christian Lindner zu Besuch in NRW - Minister redet sich mit Humor durch die Krise,Nur zur Ampel-Zukunft gab sich der Finanzminister schweigsam.,"https://images.bild.de/6728ba1aebdb8724738e8515/93ce9035998b3096560ccd33164f8ddc,f2c5b33f?w=1280",2024-11-04T19:53:51Z,,Kommt der Ampel-Kollaps oder raufen sich die zermürbten Streithähne noch ein letztes Mal zusammen? Nach einem Turbo-Tag in Berlin mit Krisengipfel im Kanzleramt und einem Treffen mit Wirtschaftsbosse… [+2527 chars],,de,'Krise'
https://www.jungewelt.de/artikel/487198.koalition-in-der-krise-ende-offen.html,https://www.jungewelt.de/artikel/487198.koalition-in-der-krise-ende-offen.html,0,www.jungewelt.de,Koalition in der Krise: Ende offen,"Streit in der Ampel: SPD, FDP und Grüne bemühen sich vor Sitzung von Koalitionsausschuss um versöhnliche Töne. Union fordert Neuwahlen.",https://www.jungewelt.de/img/1100/201687.jpg,2024-11-04T20:56:02Z,,"Die Spekulationen über das Aus der Ampelkoalition schießen ins Kraut, seit das Grundsatzpapier von Bundesfinanzminister Christian Lindner (FDP), in dem er eine »Wirtschaftswende« fordert, am Freitag … [+3887 chars]",,de,'Krise'
https://www.jungewelt.de/artikel/487221.arbeitsmarkt-österreich-zehn-prozent-mehr-erwerbslose.html,https://www.jungewelt.de/artikel/487221.arbeitsmarkt-österreich-zehn-prozent-mehr-erwerbslose.html,0,www.jungewelt.de,Arbeitsmarkt Österreich: Zehn Prozent mehr Erwerbslose [Online-Abo],Nach zwei Jahren Rezession in Österreich: Arbeitsmarkt wird von Krise erfasst. Wirtschaftsminister verbreitet Zweckoptimismus.,https://www.jungewelt.de/img/1100/201676.jpg,2024-11-04T20:56:03Z,,"Uneingeschränkter Zugriff auf alle Inhalte: Erleben Sie die Tageszeitung junge Welt in gedruckter oder digitaler Form oder beides kombiniert.
Nachrichtenauswahl und -aufbereitung erfordern finanziel… [+458 chars]",,de,'Krise'
https://www.stern.de/politik/ausland/trump-vs--harris--was-die-us-wahl-fuer-deutschland-und-europa-bedeutet-35199150.html,https://www.stern.de/politik/ausland/trump-vs--harris--was-die-us-wahl-fuer-deutschland-und-europa-bedeutet-35199150.html,0,www.stern.de,Trump vs. Harris: Was die US-Wahl für Deutschland und Europa bedeutet,"Ob Handel, Klimaschutz oder Sicherheit: Europa ist in vielen Bereichen abhängig von guten transatlantischen Beziehungen. Deswegen schaut man auch in Brüssel und Berlin gebannt auf den Wahlausgang.",https://image.stern.de/35199152/t/BX/v1/w1440/r1.7778/-/05--4e52om4hhiv1axw800h600jpeg---d8b29dd32c2672e3.jpg,2024-11-05T02:45:36Z,,"Kopiere den aktuellen Link
Ob Handel, Klimaschutz oder Sicherheit: Europa ist in vielen Bereichen abhängig von guten transatlantischen Beziehungen. Deswegen schaut man auch in Brüssel und Berlin geb… [+7583 chars]",,de,'Klima'
https://www.tagesspiegel.de/internationales/trump-vs-harris-was-die-us-wahl-fur-deutschland-und-europa-bedeutet-12645980.html,https://www.tagesspiegel.de/internationales/trump-vs-harris-was-die-us-wahl-fur-deutschland-und-europa-bedeutet-12645980.html,0,www.tagesspiegel.de,Trump vs. Harris: Was die US-Wahl für Deutschland und Europa bedeutet,"Ob Handel, Klimaschutz oder Sicherheit: Europa ist in vielen Bereichen abhängig von guten transatlantischen Beziehungen. Deswegen schaut man auch in Brüssel und Berlin gebannt auf den Wahlausgang.",https://www.tagesspiegel.de/images/12645977/alternates/BASE_16_9_W1400/1730774836000/wahlkampf-usa.jpeg,2024-11-05T02:47:16Z,,Donald Trump oder Kamala Harris? Auch für Deutschland und Europa ist die Abstimmung über die Nachfolge von US-Präsident Joe Biden eine Schicksalswahl. Die Verflechtungen mit den Vereinigten Staaten s… [+7467 chars],,de,'Klima'
https://www.bild.de/sport/fussball/fortuna-duesseldorf-jamil-siebert-und-marcel-sobottka-waeren-jetzt-wichtig-6728b6e9ebdb8724738e84ee,https://www.bild.de/sport/fussball/fortuna-duesseldorf-jamil-siebert-und-marcel-sobottka-waeren-jetzt-wichtig-6728b6e9ebdb8724738e84ee,0,www.bild.de,Fortuna braucht das Kämpfer-Duo - Warum Siebert und Sobottka jetzt so wichtig wären,Fortuna Düsseldorf droht die erste Krise unter Trainer Daniel Thioune. Verhindern könnten die Jamil Siebert und Marcel Sobottka.,"https://images.bild.de/6728b6e9ebdb8724738e84ee/7c2206483df018e10fc335d90f9a9dec,955829cc?w=1280",2024-11-05T04:00:22Z,,"Fortuna Düsseldorf braucht ganz dringend die Wende...
Nach drei Pleiten aus den letzten vier Spielen und dem Verlust der Tabellenführung droht dem Klub die erste Krise in fast drei Jahren unter Dani… [+2814 chars]",,de,'Krise'
https://www.stern.de/politik/deutschland/koalitionskrise--habeck--die-anderen-sollen-auch-vorschlaege-machen-35199290.html,https://www.stern.de/politik/deutschland/koalitionskrise--habeck--die-anderen-sollen-auch-vorschlaege-machen-35199290.html,0,www.stern.de,Koalitionskrise: Habeck: Die anderen sollen auch Vorschläge machen,Im Koalitionsstreit ruft der Wirtschaftsminister zum Durchhalten auf und kommt Finanzminister Lindner entgegen. Doch auch die anderen sollten liefern. Abgewendet scheint das Ampel-Aus noch nicht.,https://image.stern.de/35199292/t/Gy/v1/w1440/r1.7778/-/05--kff4yyzvcbv20axw800h600jpeg---930f337eb23ac11f.jpg,2024-11-05T04:00:40Z,,"Kopiere den aktuellen Link
Im Koalitionsstreit ruft der Wirtschaftsminister zum Durchhalten auf und kommt Finanzminister Lindner entgegen. Doch auch die anderen sollten liefern. Abgewendet scheint d… [+4183 chars]",,de,'Krise'
https://www.tagesspiegel.de/politik/koalitionskrise-habeck-die-anderen-sollen-auch-vorschlage-machen-12646037.html,https://www.tagesspiegel.de/politik/koalitionskrise-habeck-die-anderen-sollen-auch-vorschlage-machen-12646037.html,0,www.tagesspiegel.de,Koalitionskrise: Habeck: Die anderen sollen auch Vorschläge machen,Im Koalitionsstreit ruft der Wirtschaftsminister zum Durchhalten auf und kommt Finanzminister Lindner entgegen. Doch auch die anderen sollten liefern. Abgewendet scheint das Ampel-Aus noch nicht.,https://www.tagesspiegel.de/images/12646028/alternates/BASE_16_9_W1400/1730779347000/habeck-und-lindner.jpeg,2024-11-05T04:02:27Z,,"Im Streit der Koalition aus SPD, Grünen und FDP sind die Wogen noch immer nicht geglättet und der Koalitionsausschuss am Mittwoch rückt näher. Wirtschaftsminister Robert Habeck (Grüne) rief angesicht… [+4693 chars]",,de,'Finanz'
https://www.tagesspiegel.de/politik/koalitionskrise-ringen-um-die-zukunft-der-ampel-dreiertreffen-im-kanzleramt-12646037.html,https://www.tagesspiegel.de/politik/koalitionskrise-ringen-um-die-zukunft-der-ampel-dreiertreffen-im-kanzleramt-12646037.html,0,www.tagesspiegel.de,Koalitionskrise: Ringen um die Zukunft der Ampel: Dreiertreffen im Kanzleramt,"„Diese Koalition wird auch keine Liebesbeziehung mehr werden“, sagt der Wirtschaftsminister. Platzen lassen will er sie nicht. Er kommt dem Finanzminister entgegen. Doch auch andere sollen liefern.",https://www.tagesspiegel.de/images/12646028/alternates/BASE_16_9_W1400/1730779347000/habeck-und-lindner.jpeg,2024-11-05T04:02:27Z,,"Wirtschaftsminister Robert Habeck (Grüne) sieht in der Krise der Koalition nun SPD und FDP am Zug, um ein vorzeitiges Aus des Bündnisses abzuwenden. Habeck hatte sich am Montag bereiterklärt, frei we… [+4882 chars]",,de,'Finanz'
https://www.tagesschau.de/wirtschaft/technologie/elektroautos-wertverlust-batterietechnik-100.html,https://www.tagesschau.de/wirtschaft/technologie/elektroautos-wertverlust-batterietechnik-100.html,0,www.tagesschau.de,Wie die Batterietechnik den E-Auto-Markt bremst,"Die deutschen Autobauer stecken auch wegen der schwachen Nachfrage nach Elektroautos in der Krise. Ein Grund für die Zurückhaltung liegt auch an der Batterietechnik, die noch teuer und nicht ausgereift ist. Von Till Bücker.",https://images.tagesschau.de/image/b923206d-a656-4268-999a-b8115e229ee5/AAABkthfuWI/AAABkZLhkrw/16x9-1280/e-auto-164.jpg,2024-11-05T04:15:24Z,http://archive.md/20241105164839/https://www.tagesschau.de/wirtschaft/technologie/elektroautos-wertverlust-batterietechnik-100.html,"Stand: 05.11.2024 05:15 Uhr
Die deutschen Autobauer stecken auch wegen der schwachen Nachfrage nach Elektroautos in der Krise. Ein Grund für die Zurückhaltung liegt auch an der Batterietechnik, die … [+8569 chars]",,de,'Krise'
https://www.nzz.ch/wirtschaft/jorge-paulo-lemann-vom-visionaeren-investor-zum-bilanzbetrugsfall-ld.1854777,https://www.nzz.ch/wirtschaft/jorge-paulo-lemann-vom-visionaeren-investor-zum-bilanzbetrugsfall-ld.1854777,0,www.nzz.ch,Jorge Paulo Lemann war einmal 30 Milliarden schwer. Doch dann verlor der brasilianisch-schweizerische Investor die Hälfte seines Vermögens,"Corona, Burger King und Kraft Heinz: Jahrzehntelang galt der ehemalige Tennisprofi Jorge Paulo Lemann als Midas der Finanzmärkte, der alles zu Gold machte, was er anfasste. Doch ein Betrugsskandal hat seinen Ruf ramponiert.","https://img.nzz.ch/2023/11/23/a7cd245f-c8bd-4cbf-a3d4-93c90d6a9491.jpeg?width=1200&height=675&fit=bounds&quality=75&auto=webp&crop=2000,1125,x0,y339&wmark=nzz",2024-11-05T04:30:00Z,http://archive.md/20241105064403/https://www.nzz.ch/wirtschaft/jorge-paulo-lemann-vom-visionaeren-investor-zum-bilanzbetrugsfall-ld.1854777,"Jorge Paulo Lemann war ein erfolgsverwöhnter Investor. Dann flog der wohl grösste Betrugsskandal der brasilianischen Wirtschaftsgeschichte auf.
«Im Allgemeinen war ich sehr erfolgreich, aber in den … [+11494 chars]",,de,'Krise'
https://www.faz.net/aktuell/politik/inland/habeck-diese-koalition-wird-keine-liebesbeziehung-mehr-werden-110090225.html,https://www.faz.net/aktuell/politik/inland/habeck-diese-koalition-wird-keine-liebesbeziehung-mehr-werden-110090225.html,0,www.faz.net,Habeck: „Diese Koalition wird keine Liebesbeziehung mehr werden“,Angesichts von US-Wahl und Ukrainekrieg ruft Bundeswirtschaftsminister Habeck die Ampel-Koalition zum Durchhalten auf. Nach einem Zugeständnis an FDP-Chef Lindner hat er aber auch eine Forderung an die Koalitionspartner.,https://media1.faz.net/ppmedia/aktuell/politik/3515984388/1.10090231/facebook_teaser/bundeswirtschaftsminister.jpg,2024-11-05T04:46:28Z,,"Bundeskanzler Olaf Scholz (SPD), Finanzminister Christian Lindner (FDP) und Habeck wollen nach Informationen der Deutschen Presse-Agentur heute abermals zu einem Gespräch zusammenkommen. Dabei soll w… [+3310 chars]",,de,'Krise'
https://www.zeit.de/video/2024-11/6364191023112/krieg-in-der-ukraine-baerbock-sichert-ukraine-200-millionen-euro-fuer-winternothilfe-zu,https://www.zeit.de/video/2024-11/6364191023112/krieg-in-der-ukraine-baerbock-sichert-ukraine-200-millionen-euro-fuer-winternothilfe-zu,0,www.zeit.de,Krieg in der Ukraine: Baerbock sichert Ukraine 200 Millionen Euro für Winternothilfe zu,Bundesaußenministerin Annalena Baerbock hat der Ukraine 200 Millionen Euro an Winterhilfen zugesichert. Diese Soforthilfen seien etwa für Heizmaterial und Winterkleidung.,https://img.zeit.de/video/2024-11/6364191023112-still/wide__1300x731,2024-11-05T13:58:53Z,,"Schließen
Hier können Sie interessante Artikel speichern, um sie später zu lesen und wiederzufinden.
Sie haben bereits ein Konto?
 Hier anmelden.",,de,'Ukraine'
https://www.welt.de/wirtschaft/plus254368278/Uniper-Beteiligung-Die-guten-Geschaefte-des-Bundes-mit-Atomkraft.html,https://www.welt.de/wirtschaft/plus254368278/Uniper-Beteiligung-Die-guten-Geschaefte-des-Bundes-mit-Atomkraft.html,0,www.welt.de,Die guten Geschäfte des Bundes mit Atomkraft,"Der verstaatlichte Energiekonzern Uniper überweist Millionenbeträge an den Bundeshaushalt. Ein Teil der Einnahmen stammt aus dem Betrieb von Atomkraftwerken, die sich derzeit als besonders profitabel erweisen. Die Nachfrage nach der Zukunfts-Energie Wassersto…",https://img.welt.de/img/bildergalerien/mobile254369318/1017930367-ci16x9-w1200-fnov-fpotl-fpi157750653/Nuclear-Power-Plant.jpg,2024-11-05T17:50:33Z,http://archive.md/20241105194642/https://www.welt.de/wirtschaft/plus254368278/Uniper-Beteiligung-Die-guten-Geschaefte-des-Bundes-mit-Atomkraft.html,"Der verstaatlichte Energiekonzern Uniper überweist Millionenbeträge an den Bundeshaushalt. Ein Teil der Einnahmen stammt aus dem Betrieb von Atomkraftwerken, die sich derzeit als besonders profitabel… [+83 chars]",,de,'Atomkraft'
