index,url,valid,domain,title,description,image,published,archive,content,quote,language,keyword
https://www.stern.de/gesellschaft/regional/thueringen/rudolstadt-festival--weltmusikpreis-ruth-geht-an-kuenstlerin-dota-kehr-37188210.html,https://www.stern.de/gesellschaft/regional/thueringen/rudolstadt-festival--weltmusikpreis-ruth-geht-an-kuenstlerin-dota-kehr-37188210.html,0,www.stern.de,Rudolstadt Festival: Weltmusikpreis Ruth geht an Künstlerin Dota Kehr,Sie vertont Großstadtlyrik der 1920er Jahre und bekommt dafür nun einen Preis auf dem Rudolstadt Festival überreicht. Das hat Dota Kehr mit dem Preisgeld vor.,https://image.stern.de/37188212/t/7l/v1/w1440/r1.7778/-/03--7erfjcizy2v3axs2048jpeg---3d67407cd473f45a.jpg,2026-03-03T16:09:59Z,,"Kopiere den aktuellen Link
Zur Merkliste hinzufügen
Sie vertont Großstadtlyrik der 1920er Jahre und bekommt dafür nun einen Preis auf dem Rudolstadt Festival überreicht. Das hat Dota Kehr mit dem P… [+600 chars]",,de,'Preis'
https://www.faz.net/aktuell/feuilleton/buecher/lena-winkels-comictheoriebuch-tiere-richtig-zeichnen-110845070.html,https://www.faz.net/aktuell/feuilleton/buecher/lena-winkels-comictheoriebuch-tiere-richtig-zeichnen-110845070.html,0,www.faz.net,Sachcomics: Die Lehren der Professoren Raptor und Ratte,"Sachcomics sind ein relativ junges Genre, das aber immer mehr Aufmerksamkeit findet – auch bei renommierten Preisen. Eine grandiose Verbindung von Wissenschaft und Bildergeschichte bietet Lena Winkels „Tiere richtig zeichnen“.",https://media0.faz.net/image/w1200h627/5749e41c0686/w3430h1792x0y2138o/202602/0b54513a-47ba-4c89-9977-91066643c29e/selbstironie-der.webp,2026-03-03T16:12:41Z,,In dieser Woche ist die Berliner Comiczeichnerin Ulli Lust mit Die Frau als Mensch für den Preis der Leipziger Buchmesse in der Kategorie Sachbuch/Essayistik nominiert worden. Berücksichtigungen von … [+10007 chars],,de,'Preis'
https://www.horizont.net/agenturen/nachrichten/preis-der-deutschen-werbefilmakademie-warum-der-neue-ai-creativity-award-ein-signal-an-die-branche-ist-233333,https://www.horizont.net/agenturen/nachrichten/preis-der-deutschen-werbefilmakademie-warum-der-neue-ai-creativity-award-ein-signal-an-die-branche-ist-233333,0,www.horizont.net,Preis der Deutschen Werbefilmakademie: Warum der neue AI Creativity Award ein Signal an die Branche ist,Mit einem neuen Award für KI will die Deutsche Werbefilmakademie den Einsatz generativer Technologien im Werbefilm würdigen. Der AI Creativity Award soll reale Kundenprojekte auszeichnen – und zugleich mit verbreiteten Mythen über KI-Produktionen aufräumen.,https://www.horizont.net/news/media/50/AICA-AI-Creativity-Award-492149.png,2026-03-03T16:22:00Z,,Mit einem neuen Award für KI will die Deutsche Werbefilmakademie den Einsatz generativer Technologien im Werbefilm würdigen. Der AI Creativity Award soll reale Kundenprojekte auszeichnen – und zuglei… [+5112 chars],,de,'Preis'
https://www.welt.de/politik/ausland/article69a291a07c787f6a1cef1bc5/krieg-in-nahost-grossbritannien-und-frankreich-senden-kriegsschiffe-nach-zypern-liveticker.html,https://www.welt.de/politik/ausland/article69a291a07c787f6a1cef1bc5/krieg-in-nahost-grossbritannien-und-frankreich-senden-kriegsschiffe-nach-zypern-liveticker.html,0,www.welt.de,Großbritannien und Frankreich senden Kriegsschiffe nach Zypern,Sowohl Großbritannien als auch Frankreich entsenden Kriegsschiffe nach Zypern. Dort war ein britischer Luftwaffenstützpunkt von einer Drohne getroffen worden. Das US-Militär nutzt offenbar neue Waffen im Kampf gegen den Iran. Mehr im Liveticker.,https://images.welt.de/69a291a07c787f6a1cef1bc5/0740a372ac18b5ba226944da344a7f88/ci16x9-w1200/243337479-jpg,2026-03-03T16:22:00Z,,Sowohl Großbritannien als auch Frankreich entsenden Kriegsschiffe nach Zypern. Dort war ein britischer Luftwaffenstützpunkt von einer Drohne getroffen worden. Das US-Militär nutzt offenbar neue Waffe… [+20156 chars],,de,'Preis'
https://www.welt.de/politik/ausland/article69a6fb77be2b3018d7c1a10f/exklusiv-interview-ihnen-gehen-die-abschussrampen-aus-sagt-donald-trump-ueber-den-iran.html,https://www.welt.de/politik/ausland/article69a6fb77be2b3018d7c1a10f/exklusiv-interview-ihnen-gehen-die-abschussrampen-aus-sagt-donald-trump-ueber-den-iran.html,0,www.welt.de,"„Ihnen gehen die Abschussrampen aus“, sagt Donald Trump über den Iran","Die Frage, wie lange der Iran den Krieg gegen Israel und die USA noch durchhalten kann, wird weltweit diskutiert – auch innerhalb der amerikanischen Regierung. In einem Exklusiv-Interview deutet der US-Präsident nun an, wie es um Teherans Angriffsfähigkeiten …",https://images.welt.de/69a6fb77be2b3018d7c1a10f/6c92c93f8e877ac001379896e0dfd636-master/ci16x9-w1200/1772502289732-afp-99nn9g4-jpg,2026-03-03T16:34:31Z,,"Die Frage, wie lange der Iran den Krieg gegen Israel und die USA noch durchhalten kann, wird weltweit diskutiert auch innerhalb der amerikanischen Regierung. In einem Exklusiv-Interview deutet der US… [+4256 chars]",,de,'Angriff'
https://www.focus.de/politik/ausland/alles-was-am-sonntag-im-iran-passierte_311e2878-9524-473a-bbbc-ee69eaf314b3.html,https://www.focus.de/politik/ausland/alles-was-am-sonntag-im-iran-passierte_311e2878-9524-473a-bbbc-ee69eaf314b3.html,0,www.focus.de,"Alles, was am Sonntag im Iran passierte","Trump will Iran angreifen, ""bis alle unsere Ziele erfüllt sind""22.56 Uhr: US-Präsident Donald Trump will die Angriffe auf den Iran fortsetzen, bis all",https://quadro.burda-forward.de/ctf/882f8f9b-91ce-4d4b-8d88-c1740f7f56fb.83b44135-4884-4489-a766-144c5aa6bd23.jpeg?im=RegionOfInterestCrop%3D%281200%2C630%29%2CregionOfInterest%3D%281024%2C683%29&hash=e048445e56153020e890a4ff904bed339eb278707f88101cdc35679ebf3fc0ec,2026-03-03T16:36:00Z,,"Trump will Iran angreifen, ""bis alle unsere Ziele erfüllt sind""
22.56 Uhr: US-Präsident Donald Trump will die Angriffe auf den Iran fortsetzen, bis alle Kriegsziele erreicht sind. ""Die Kampfhandlung… [+38462 chars]",,de,'Angriff'
https://www.focus.de/politik/israel-startete-angriff-auf-den-iran-am-samstagmorgen_22d3c537-c976-42f0-98d3-cef25f9940e2.html,https://www.focus.de/politik/israel-startete-angriff-auf-den-iran-am-samstagmorgen_22d3c537-c976-42f0-98d3-cef25f9940e2.html,0,www.focus.de,Israel startete Angriff auf den Iran am Samstagmorgen,"Die Angriffe seitens der USA und Israels gegen den Iran gehen weiter. Der Oberste Führer des Irans, Ali Chamenei, wurde getötet. Laut Trump könnten die Kämpfe noch vier Wochen andauern.",https://quadro.burda-forward.de/ctf/5e7e94a7-8f26-43b1-b0ef-f09abde6a2ae.40183eaa-773f-45ab-b4d0-52acfe6e50fa.jpg?im=RegionOfInterestCrop%3D%281200%2C630%29%2CregionOfInterest%3D%282820%2C1244%29&hash=769b18ffb92ceef9104c8f18d410c096079853ae15a9a871ffdc9958ad7284b1,2026-03-03T16:36:00Z,,"Alle Inhalte, insbesondere die Texte und Bilder von Agenturen, sind
 urheberrechtlich geschützt und dürfen nur im Rahmen der gewöhnlichen
 Nutzung des Angebots vervielfältigt, verbreitet oder sonst… [+43 chars]",,de,'Angriff'
https://www.zeit.de/politik/2026-03/friedrich-merz-donald-trump-washington-usa-livestream,https://www.zeit.de/politik/2026-03/friedrich-merz-donald-trump-washington-usa-livestream,0,www.zeit.de,Friedrich Merz bei Donald Trump: Das sagen der Bundeskanzler und der US-Präsident zur Lage im Iran,"Friedrich Merz trifft in Washington Donald Trump, um über den Iran, die Ukraine und über Zölle zu sprechen. Sehen Sie hier den gemeinsamen Presseauftritt live.",https://img.zeit.de/politik/2026-03/2026-03-03t060013z-1670706959-rc23bha0on7w-rtrmadp-3-usa-germany-bild/wide__1300x731,2026-03-03T16:49:33Z,,"An dieser Stelle ist ein externer Inhalt eingebunden
Zum Anschauen benötigen wir Ihre Zustimmung",,de,'Ukraine'
https://www.freitag.de/autoren/torsten-woehlert/irankrieg-schadet-auch-golfstaaten-das-ende-eines-sicheren-geschaeftsmodells,https://www.freitag.de/autoren/torsten-woehlert/irankrieg-schadet-auch-golfstaaten-das-ende-eines-sicheren-geschaeftsmodells,0,www.freitag.de,Kriegsfolgen | Das Ende eines sicheren Geschäftsmodells? Wie der Irankrieg auch den Golfstaaten schadet,"Bisher boten sich Oman, Katar, Saudi-Arabien, Kuwait und die Arabischen Emirate als sicherer Ort für den Ölhandel, Finanzdienstleistungen und einen hochpreisigen Tourismus an. Mit dem Krieg gegen Iran ist das vorbei, zumindest vorübergehend Je länger der völk…",https://www.freitag.de/autoren/torsten-woehlert/irankrieg-schadet-auch-golfstaaten-das-ende-eines-sicheren-geschaeftsmodells/@@images/image/great,2026-03-03T17:08:00Z,,"Je länger der völkerrechtswidrige Krieg gegen das iranische Regime andauert, desto deutlicher wird, in welchem Ausmaß dies ein israelisch-iranischer Waffengang ist. Ein Regime-Change-War, den die USA… [+4898 chars]",,de,'Finanz'
https://www.stern.de/news/-fairer-tausch---selenskyj-bietet-golfstaaten-drohnenabwehr-gegen-luftabwehrraketen-an-37188422.html,https://www.stern.de/news/-fairer-tausch---selenskyj-bietet-golfstaaten-drohnenabwehr-gegen-luftabwehrraketen-an-37188422.html,0,www.stern.de,"""Fairer Tausch"": Selenskyj bietet Golfstaaten Drohnenabwehr gegen Luftabwehrraketen an","Drohnenabwehr gegen mehr  Raketenabwehr: Der ukrainische Präsident Wolodymyr Selenskyj hat den US-Verbündeten im Nahen Osten im Zuge der massiven iranischen Angriffe ein Geschäft vorgeschlagen. ""Sprechen wir über die Waffen, die uns fehlen: PAC-3-Raketen"", sa…",https://image.stern.de/37188424/t/2n/v1/w1440/r1.7778/-/03--wolodymyr-selenskyj-bei-pressekonferenz-am-3-maerz-in-kiew---baef3fa2f07f7024.jpg,2026-03-03T17:15:59Z,,"Kopiere den aktuellen Link
Zur Merkliste hinzufügen
Drohnenabwehr gegen mehr  Raketenabwehr: Der ukrainische Präsident Wolodymyr Selenskyj hat den US-Verbündeten im Nahen Osten im Zuge der massiven… [+2405 chars]",,de,'Angriff'
https://www.n-tv.de/wirtschaft/Warum-die-Energiekrise-noch-nicht-zurueckkehrt-id30426106.html,https://www.n-tv.de/wirtschaft/Warum-die-Energiekrise-noch-nicht-zurueckkehrt-id30426106.html,0,www.n-tv.de,Keine Panik wie 2022: Warum die Energiekrise (noch) nicht zurückkehrt,An den Börsen schnellen die Preise für Gas und Öl in die Höhe. Warnungen vor einer Rückkehr der Inflation werden laut und Erinnerungen an die Energiekrise ab 2022 wach. Doch der Energiemarkt hat sich grundlegend verändert.,https://www.n-tv.de/img/30426167/1772545380/Img_16_9/1200/A-man-fills-his-fuel-canister-at-an-Aral-gas-station-in-Berlin-Germany-March-2-2026.jpg,2026-03-03T17:22:41Z,,"An den Tankstellen ist der steigende Ölpreis sofort zu spüren. (Foto: REUTERS)
An den Börsen schnellen die Preise für Gas und Öl in die Höhe. Warnungen vor einer Rückkehr der Inflation werden laut u… [+5380 chars]",,de,'Inflation'
https://www.stern.de/politik/ausland/irankrieg-news--friedrich-merz-trifft-donald-trump---und-lobt-angriff-auf-iran-37087516.html,https://www.stern.de/politik/ausland/irankrieg-news--friedrich-merz-trifft-donald-trump---und-lobt-angriff-auf-iran-37087516.html,0,www.stern.de,Irankrieg: Friedrich Merz trifft Donald Trump – und lobt US-Angriff auf den Iran,Israel marschiert im Südlibanon ein. Erster Flieger aus Dubai in Frankfurt gelandet. Offenbar Angriff auf Flughafen Teheran. Alle Entwicklungen im Liveblog.,https://image.stern.de/37188372/t/8b/v1/w1440/r1.7778/-/merz-trump-oval-office-iran-2.jpg,2026-03-03T17:35:00Z,,"Eine Frage an Merz und Trump lautet: Fürchten Sie, dass die steigenden Öl- und Gaspreise der Wirtschaft beider Länder schaden?""Natürlich schadet der Krieg unserer Wirtschaft"", antwortet Merz. Trump s… [+124 chars]",,de,'Angriff'
https://www.zeit.de/news/2026-03/04/deutschlands-handwerkern-fehlen-200-000-mitarbeiter,https://www.zeit.de/news/2026-03/04/deutschlands-handwerkern-fehlen-200-000-mitarbeiter,0,www.zeit.de,Personalmangel trotz Krise: Deutschlands Handwerkern fehlen 200.000 Mitarbeiter,Hier finden Sie Informationen zu dem Thema „Personalmangel trotz Krise“. Lesen Sie jetzt „Deutschlands Handwerkern fehlen 200.000 Mitarbeiter“.,https://img.zeit.de/news/2026-03/04/deutschlands-handwerkern-fehlen-200-000-mitarbeiter-image-group/wide__1300x731,2026-03-04T04:00:24Z,,"Deutschlands Handwerkern fehlen geschätzt 200.000 Fachkräfte. Ende Dezember waren bei der Bundesagentur für Arbeit 119.565 offene Stellen im Handwerk gemeldet, wie der Zentralverband des Deutschen Ha… [+3675 chars]",,de,'Krise'
https://www.golem.de/sonstiges/zustimmung/auswahl.html?from=https://www.golem.de/news/feuertaufe-us-armee-setzt-erstmals-prsm-rakete-im-kampf-ein-2603-206064.html&referer=https://t.co/bf4740dd13,https://www.golem.de/sonstiges/zustimmung/auswahl.html?from=https://www.golem.de/news/feuertaufe-us-armee-setzt-erstmals-prsm-rakete-im-kampf-ein-2603-206064.html&referer=https://t.co/bf4740dd13,0,www.golem.de,Feuertaufe: US-Armee setzt erstmals PrSM-Rakete im Kampf ein,"Das US-Militär hat beim Angriff auf den Iran wohl die PrSM-Rakete eingesetzt - eine Waffe, die ihren Vorgänger ATACMS in der Reichweite deutlich übertrifft. (Militär, Politik)",,2026-03-04T07:54:01Z,,"Besuchen Sie Golem.de wie gewohnt mit Werbung und Tracking,
 indem Sie der Nutzung aller Cookies zustimmen.
 Details zum Tracking finden Sie im Privacy Center.
Skript wurde nicht geladen. Informat… [+607 chars]",,de,'Angriff'
https://www.welt.de/videos/video69a7f329625a8415070adc78/inflation-durch-krieg-das-wuerde-jeder-einzelne-im-portemonnaie-spueren.html,https://www.welt.de/videos/video69a7f329625a8415070adc78/inflation-durch-krieg-das-wuerde-jeder-einzelne-im-portemonnaie-spueren.html,0,www.welt.de,„Das würde jeder Einzelne im Portemonnaie spüren“,"Wenn sich der Krieg im Nahen Osten ziehen sollte, könnten die Folgen auch hier deutlich spürbar werden. Die Inflation würde anziehen, die Verbraucherpreise dadurch steigen.",https://images.welt.de/69a7f329625a8415070adc78/264338b0a1468d17db79e2f59d4522db/ci16x9-w1200/2026-03-02t141332z-1972868938-rc2bwjatwjkf-rtrmadp-3-iran-crisis-germany-fuel-jpg,2026-03-04T08:58:03Z,,"Wenn sich der Krieg im Nahen Osten ziehen sollte, könnten die Folgen auch hier deutlich spürbar werden. Die Inflation würde anziehen, die Verbraucherpreise dadurch steigen.
© Axel Springer Deutschla… [+32 chars]",,de,'Inflation'
https://www.zeit.de/gesellschaft/zeitgeschehen/2026-03/rassistisch-angriff-mordversuch-schule-bayern,https://www.zeit.de/gesellschaft/zeitgeschehen/2026-03/rassistisch-angriff-mordversuch-schule-bayern,0,www.zeit.de,Rassistischer Angriff: Staatsanwalt klagt Schüler wegen mutmaßlich rassistischen Angriff an,"Ein 15-Jähriger wollte in Bayern angeblich ""Muslime und Ausländer töten."" Davon geht die Generalstaatsanwaltschaft München aus. Sie erhob Anklage gegen den Schüler.",https://img.zeit.de/administratives/sharing/fallback-image-die-zeit/wide__1300x731,2026-03-04T10:30:27Z,,Die Generalstaatsanwaltschaft München hat Anklage gegen einen 15-Jährigen wegen mutmaßlich rassistisch und islamfeindlich motivierten Mordversuchs erhoben. Die Generalstaatsanwaltschaft gehe davon au… [+1062 chars],,de,'Angriff'
https://www.welt.de/videos/video69a81878563ae9c42dea4068/krieg-treibt-preise-hoch-was-jetzt-auf-deutsche-verbraucher-zukommt.html,https://www.welt.de/videos/video69a81878563ae9c42dea4068/krieg-treibt-preise-hoch-was-jetzt-auf-deutsche-verbraucher-zukommt.html,0,www.welt.de,Krieg treibt Preise hoch – Was jetzt auf deutsche Verbraucher zukommt,"Wenn sich der Krieg im Nahen Osten ziehen sollte, könnten die Folgen auch hier deutlich spürbar werden. Die Inflation würde anziehen, die Verbraucherpreise dadurch steigen. Sehen Sie diese und weitere Nachrichten bei WELT TV.",https://images.welt.de/69a81878563ae9c42dea4068/1ca43fbc6cf7a70d0e35f4657b7339c3/ci16x9-w1200/dpa-com-20090101-260304-911-005919-jpg,2026-03-04T11:33:34Z,,"Wenn sich der Krieg im Nahen Osten ziehen sollte, könnten die Folgen auch hier deutlich spürbar werden. Die Inflation würde anziehen, die Verbraucherpreise dadurch steigen. Sehen Sie diese und weiter… [+85 chars]",,de,'Inflation'
https://www.focus.de/finanzen/iran-krieg-treibt-preise-sprit-lebensmittel-inflation_43d888dd-01f5-4323-88e8-d58b93389ca9.html,https://www.focus.de/finanzen/iran-krieg-treibt-preise-sprit-lebensmittel-inflation_43d888dd-01f5-4323-88e8-d58b93389ca9.html,0,www.focus.de,"Iran-Krieg treibt Preise: Sprit, Lebensmittel, Inflation","Der Iran-Krieg lässt Ölpreise steigen. Experten warnen vor teurerem Sprit, Heizkosten und höheren Lebensmittelpreisen in Deutschland.",https://quadro.burda-forward.de/ctf/f11d85fb-0baa-4f48-8577-8103b72a7728.20d12afa-ec89-4279-81b9-d0f6b906350d.jpeg?im=RegionOfInterestCrop%3D%281200%2C630%29%2CregionOfInterest%3D%281051%2C588%29&hash=2e38122d1f301e8096e391faadf7f3fd904e1809826e3e33b369a8bb8b87addc,2026-03-04T12:01:00Z,,Der Dieselpreis ist infolge der Verwerfungen des Iran-Krieges auf mehr als zwei Euro geklettert. Benzin verteuerte sich um etwa 12 Cent. Bei durchschnittlicher Fahrleistung bedeutet das für viele Aut… [+3709 chars],,de,'Inflation'
https://www.faz.net/aktuell/wirtschaft/unternehmen/kultmarke-aus-thueringen-porzellanhersteller-kahla-ist-insolvent-200597513.html,https://www.faz.net/aktuell/wirtschaft/unternehmen/kultmarke-aus-thueringen-porzellanhersteller-kahla-ist-insolvent-200597513.html,0,www.faz.net,Geschirrhersteller insolvent: In der Kahla-Porzellanfabrik soll der Ofen nicht ausgehen,Das thüringische Traditionsunternehmen leidet unter der Krise in der Gastronomie. Trotz des Insolvenzverfahrens und des die Energiepreise treibenden Irankriegs soll der Betrieb weiter laufen.,https://media0.faz.net/image/w1200h627/aef42a7d663d/w4252h2221x0y307o/201602/431.0.30668613/porzellan-mit-blumendekor-des.webp,2026-03-04T13:15:03Z,,Die Porzellanmanufaktur Kahla aus dem gleichnamigen Städtchen in Thüringen hat die Eröffnung eines Insolvenzverfahrens beantragt. Das Amtsgericht Gera hat in einer Bekanntmachung vom 2. März den Rech… [+2619 chars],,de,'Inflation'
https://www.sueddeutsche.de/wirtschaft/spritpreise-deutschland-tankrabatt-diesel-e10-energiepreise-spritpreisbremse-li.3440057,https://www.sueddeutsche.de/wirtschaft/spritpreise-deutschland-tankrabatt-diesel-e10-energiepreise-spritpreisbremse-li.3440057,0,www.sueddeutsche.de,Kartellrecht: Auch E10 teurer als zwei Euro – Reiche lässt hohe Spritpreise überprüfen,"Der Iran-Krieg macht sich in Deutschland auch an den Zapfsäulen bemerkbar. Die Wirtschaftsministerin prüft, was sie gegen überhöhte Preise tun kann. „Es darf keine Abzocke geben“, warnt der Finanzminister.",https://www.sueddeutsche.de/2026/03/04/86cbea5b-9169-4d0e-b0fa-a6a6a4d71c5f.jpg?q=60&fm=webp&width=1200&rect=0%2C427%2C3636%2C2045,2026-03-04T13:40:16Z,,"Bundesfinanzminister Lars Klingbeil drohte Mineralölkonzernen mit Konsequenzen, sollten sie versuchen, aus dem Iran-Krieg und der aktuellen Lage Kapital zu schlagen. Also es darf da jetzt keine Abzoc… [+5880 chars]",,de,'Preis'
https://www.welt.de/videos/video69a828b2625a8415070ae2d3/tenhagen-zu-gasvertraegen-schutz-vor-inflation-dann-ist-man-auf-der-sicheren-seite.html,https://www.welt.de/videos/video69a828b2625a8415070ae2d3/tenhagen-zu-gasvertraegen-schutz-vor-inflation-dann-ist-man-auf-der-sicheren-seite.html,0,www.welt.de,Schutz vor Inflation – „Dann ist man auf der sicheren Seite“,"Der Krieg im Iran treibt Energie- und Lebensmittelpreise in Deutschland spürbar nach oben. Finanztip-Chefredakteur Hermann-Josef Tenhagen empfiehlt Verbrauchern, Gasverträge frühzeitig zu verlängern.",https://images.welt.de/69a828b2625a8415070ae2d3/493eb46439c7a05a7c656d669e9fe6b7-master/ci16x9-w1200/579519395-jpg,2026-03-04T14:06:34Z,,Die WELT als ePaper: Die vollständige Ausgabe steht Ihnen bereits am Vorabend zur Verfügung so sind Sie immer hochaktuell informiert. Weitere Informationen https://epaper.welt.de,,de,'Gas'
https://www.zeit.de/2026/11/boersen-iran-angriff-gaspreise-oel-abhaengigkeit,https://www.zeit.de/2026/11/boersen-iran-angriff-gaspreise-oel-abhaengigkeit,0,www.zeit.de,Börsen nach dem Iran-Angriff: Ein starkes Stück,"Nach dem Angriff auf den Iran blieb der große Schock an den Börsen aus. Firmen und Anleger haben gelernt, mit Krisen umzugehen. Doch diese neue Resilienz hat Grenzen.",https://img.zeit.de/wirtschaft/2026-03/boersen-iran-angriff-gaspreise-oel-abhaengigkeit-bild-2/wide__1300x731,2026-03-04T14:33:54Z,,"Wie abgebrüht können Börsenhändler eigentlich sein? Wenige Stunden nachdem amerikanische und israelische Flugzeuge den Iran bombardiert hatten, war an den wichtigsten Finanzmärkten erst mal wenig dav… [+334 chars]",,de,'Krise'
https://www.stern.de/wirtschaft/versicherung/rentenerhoehung--so-viel-geld-gibt-es-in-diesem-jahr-mehr-35532388.html,https://www.stern.de/wirtschaft/versicherung/rentenerhoehung--so-viel-geld-gibt-es-in-diesem-jahr-mehr-35532388.html,0,www.stern.de,"Rentenerhöhung: Diese Tabelle zeigt, wie viel Rente Sie dieses Jahr mehr bekommen","Die Rente steigt 2026 stärker als die Inflation – ein klarer Pluspunkt für alle Rentner. Unsere Tabelle zeigt, wie viel mehr Geld Ihnen zusteht.",https://image.stern.de/36184064/t/EI/v3/w1440/r1.7778/-/rentenanpassung-2026.jpg,2026-03-04T14:40:00Z,,"Kopiere den aktuellen Link
Zur Merkliste hinzufügen
Die Rente steigt 2026 um 3,7 Prozent stärker als die Inflation. Wie viel Sie durch die Rentenerhöhung erhalten, zeigt unsere Tabelle.
Die Rente … [+6228 chars]",,de,'Inflation'
https://www.n-tv.de/wirtschaft/Warum-der-Iran-Schock-vor-allem-Dieselfahrer-trifft-id30430968.html,https://www.n-tv.de/wirtschaft/Warum-der-Iran-Schock-vor-allem-Dieselfahrer-trifft-id30430968.html,0,www.n-tv.de,Blick aufs Rohöl täuscht: Warum der Iran-Schock vor allem Dieselfahrer trifft,Benzin und Diesel werden beide aus Rohöl destilliert. Dennoch gibt es für beide unterschiedliche Märkte mit unterschiedlichen Preisentwicklungen. Im Gegensatz zum Superbenzin schlägt beim Diesel der Irankrieg direkt auf den Tankstellenpreis in Deutschland dur…,https://www.n-tv.de/img/30430950/1772635120/Img_16_9/1200/Typenschild-eines-Mercedes-240D-Diesel-Oldtimers-aufgenommen-im-Februar-2018.jpg,2026-03-04T14:47:41Z,,"Selbst das steuerliche Dieselprivileg reicht derzeit nicht, um den Kraftstoff billiger als Benzin zu machen. (Foto: picture alliance / Frank Duenzl)
Benzin und Diesel werden beide aus Rohöl destilli… [+4318 chars]",,de,'Russland'
https://www.welt.de/wirtschaft/plus69a82df6906b538390b65ce9/russland-warnt-neuerdings-seine-soldaten-vor-dieser-deutschen-ki-drohne-von-helsing.html,https://www.welt.de/wirtschaft/plus69a82df6906b538390b65ce9/russland-warnt-neuerdings-seine-soldaten-vor-dieser-deutschen-ki-drohne-von-helsing.html,0,www.welt.de,Russland warnt neuerdings seine Soldaten vor dieser deutschen KI-Drohne,An den ersten Drohnen des deutschen Start-ups Helsing hatte es Kritik gegeben. Nun kommt eine Bestätigung der Fähigkeiten des neuen Modells HX2: Ausgerechnet Experten aus Russland warnen vor den von KI gelenkten Waffen.,https://images.welt.de/69a82df6906b538390b65ce9/a61057aca2d74673cb273fbb31899ad5/ci16x9-w1200/1772050148497-afp-98xy4tx-jpg,2026-03-04T15:04:57Z,,Die WELT als ePaper: Die vollständige Ausgabe steht Ihnen bereits am Vorabend zur Verfügung so sind Sie immer hochaktuell informiert. Weitere Informationen https://epaper.welt.de,,de,'Waffen'
https://www.dw.com/de/merz-trump-und-der-abschied-von-der-regelbasierten-ordnung/a-76215458,https://www.dw.com/de/merz-trump-und-der-abschied-von-der-regelbasierten-ordnung/a-76215458,0,www.dw.com,"Merz, Trump und der Abschied von der regelbasierten Ordnung",Keine deutschen Belehrungen mehr: Seit den Angriffen der USA und Israels auf den Iran scheint Bundeskanzler Friedrich Merz das Völkerrecht weniger wichtig zu sein. Steckt eine neue Strategie dahinter?,https://static.dw.com/image/76204706_6.jpg,2026-03-04T15:22:00Z,,"Bundeskanzler Friedrich Merz wollte Donald Trump nicht über das Völkerrecht belehren. Und das tat er auch nicht, jedenfalls nicht im öffentlichen Teil des Besuchs im Weißen Haus. Dabei sind sich die … [+7270 chars]",,de,'Angriff'
https://www.zeit.de/news/2026-03/04/36-jaehriger-nach-angriff-auf-grossmutter-festgenommen,https://www.zeit.de/news/2026-03/04/36-jaehriger-nach-angriff-auf-grossmutter-festgenommen,0,www.zeit.de,Kriminalität: 36-Jähriger nach Angriff auf Großmutter festgenommen,Hier finden Sie Informationen zu dem Thema „Kriminalität“. Lesen Sie jetzt „36-Jähriger nach Angriff auf Großmutter festgenommen“.,https://img.zeit.de/news/2026-03/04/36-jaehriger-nach-angriff-auf-grossmutter-festgenommen-image-group/wide__1300x731,2026-03-04T15:23:06Z,,Die Polizei hat einen 36-jährigen Mann in Kaiserslautern festgenommen. Er soll den Angaben nach bei einem Streit seine 73-jährige Großmutter schwer verletzt haben. Die Frau sei aufgrund ihrer Verletz… [+354 chars],,de,'Angriff'
