index,url,valid,domain,title,description,image,published,archive,content,quote,language,keyword
https://www.zeit.de/wirtschaft/2026-03/super-benzin-preis-iran-krieg-oelpreis-gxe,https://www.zeit.de/wirtschaft/2026-03/super-benzin-preis-iran-krieg-oelpreis-gxe,0,www.zeit.de,Irankrieg: Preis für den Liter Super E10 steigt auf mehr als zwei Euro,Nach dem Dieselpreis ist auch der Preis für E10-Benzin auf mehr als zwei Euro pro Liter gestiegen. Durch den Irankrieg hat sich Öl zuletzt um fast 20 Prozent verteuert.,https://img.zeit.de/wirtschaft/2026-03/super-benzin-preis-iran-krieg-oelpreis-bild/wide__1300x731,2026-03-05T09:06:12Z,,Der durchschnittliche Preis für Super E10 in Deutschland ist auf mehr als zwei Euro pro Liter gestiegen. Das geht aus einer Mitteilung des ADAC hervor. Demnach kostete die Benzinsorte am Donnerstagmo… [+3981 chars],,de,'Preis'
https://www.morgenpost.de/berlin/article411376494/weimer-schliesst-linke-buchlaeden-von-preis-aus-auch-berliner-geschaeft.html,https://www.morgenpost.de/berlin/article411376494/weimer-schliesst-linke-buchlaeden-von-preis-aus-auch-berliner-geschaeft.html,0,www.morgenpost.de,Weimer schließt linke Buchläden von Preis aus – auch Berliner Geschäft,Kulturstaatsminister Wolfram Weimer ließ die Läden wegen Extremismusverdachts von der Liste streichen. Doch die Branche wirft Fragen auf.,https://img.sparknews.funkemedien.de/411376479/411376479_1772703269_v16_9_1600.jpeg,2026-03-05T09:34:30Z,,Kulturstaatsminister Wolfram Weimer (parteilos) hat nach einem Medienbericht drei linke Buchläden wegen Extremismusverdachts von der Liste für den staatlichen Deutschen Buchhandlungspreis gestrichen.… [+4257 chars],,de,'Klima'
https://www.zeit.de/feuilleton/2026-03/deutscher-buchhandlungspreis-wolfram-weimer-verfassungsschutz-kritik-gxe,https://www.zeit.de/feuilleton/2026-03/deutscher-buchhandlungspreis-wolfram-weimer-verfassungsschutz-kritik-gxe,0,www.zeit.de,Deutscher Buchhandlungspreis: Börsenverein kritisiert Ausschluss von Buchhandlungen bei Preisvergabe,"Unter Berufung auf den Verfassungsschutz hatte Wolfram Weimer drei Läden vom Buchhandlungspreis ausgeschlossen. Der Börsenverein nennt den Vorgang ""äußerst fragwürdig"".",https://img.zeit.de/feuilleton/2026-03/deutscher-buchhandlungspreis-wolfram-weimer/wide__1300x731,2026-03-05T09:46:32Z,,"Der Börsenverein des Deutschen Buchhandels hat erhebliche Zweifel an dem Verfahren geäußert, mit dem Kulturstaatsminister Wolfram Weimer drei linke Buchhandlungen vom Deutschen Buchhandlungspreis aus… [+2639 chars]",,de,'Preis'
https://www.stern.de/kultur/kulturstaatsminister--weimer-streicht-buchlaeden-von-preisliste---und-erntet-kritik-37193126.html,https://www.stern.de/kultur/kulturstaatsminister--weimer-streicht-buchlaeden-von-preisliste---und-erntet-kritik-37193126.html,0,www.stern.de,Kulturstaatsminister: Weimer streicht Buchläden von Preisliste - und erntet Kritik,Der Deutsche Buchhandlungspreis würdigt die Rolle kleiner Buchläden. Doch diesmal widerspricht der Kulturstaatsminister in drei Fällen der Jury - wegen Erkenntnissen des Verfassungsschutzes. Und nun?,https://image.stern.de/37193718/t/Q3/v1/w1440/r1.7778/-/05--mtrpw7bts7v6axs2048jpeg---34875ff0cce3b43b.jpg,2026-03-05T10:26:00Z,,"Kopiere den aktuellen Link
Zur Merkliste hinzufügen
Der Deutsche Buchhandlungspreis würdigt die Rolle kleiner Buchläden. Doch diesmal widerspricht der Kulturstaatsminister in drei Fällen der Jury -… [+5431 chars]",,de,'Preis'
https://www.n-tv.de/politik/Kritik-nach-Weimers-Ausschluss-dreier-Buchlaeden-von-Preisvergabe-id30433880.html,https://www.n-tv.de/politik/Kritik-nach-Weimers-Ausschluss-dreier-Buchlaeden-von-Preisvergabe-id30433880.html,0,www.n-tv.de,"""Schmaler Grad"", ""Willkür"": Kritik nach Weimers Ausschluss dreier Buchläden von Preisvergabe","Wegen Extremismusverdachts lässt Kulturstaatsminister Weimer drei Läden von der Liste für den Deutschen Buchhandlungspreis nehmen. Der Ausschluss stößt bei den betroffenen Geschäften, dem Dachverband der Branche und Politikern auf Unverständnis. Weimer vertei…",https://www.n-tv.de/img/30433953/1772708288/Img_16_9/1200/05-03-2026-Niedersachsen-Goettingen-Der-Buchladen-Rote-Strasse-Kulturstaatsminister-Weimer-hat-drei-Buchhandlungen-aus-dem-linken-Spektrum-wegen-verfassungsschutzrelevanter-Erkenntnisse-von-der-Liste-der-Einrichtungen-gestrichen-die-fuer-den-Deutschen-Buchhandlungspreis-vorgesehen-waren-darunter-den-Buchladen-Rote-Strasse.jpg,2026-03-05T10:45:41Z,,"""Schmaler Grad"", ""Willkür""Kritik nach Weimers Ausschluss dreier Buchläden von Preisvergabe
Weimer schloss die drei Buchgeschäfte in Berlin, Bremen und Göttingen laut Bericht wegen ""verfassungsschutz… [+4032 chars]",,de,'Klima'
https://www.n-tv.de/politik/Bas-Renten-steigen-am-1-Juli-um-4-24-Prozent-id30434667.html,https://www.n-tv.de/politik/Bas-Renten-steigen-am-1-Juli-um-4-24-Prozent-id30434667.html,0,www.n-tv.de,"Anstieg stärker als Inflation: Bas: Renten steigen am 1. Juli um 4,24 Prozent",Die mehr als 20 Millionen Rentner in Deutschland bekommen ab Juli deutlich mehr Geld. Laut Arbeitsministerin Bas steigen ihre Bezüge um über vier Prozent. Grundlage ist demnach die gute Lohnentwicklung.,https://www.n-tv.de/img/30434785/1772717583/Img_16_9/1200/Ein-Senior-und-eine-Seniorin-machen-in-der-morgendlichen-Sonne-einen-Spaziergang-durch-einen-Park-aufgenommen-in-Berlin-20-10-2025.jpg,2026-03-05T12:02:30Z,,"Für eine Standardrente bedeutet die Anhebung ein monatliches Plus von fast 78 Euro. (Foto: picture alliance / photothek.de)
Die mehr als 20 Millionen Rentner in Deutschland bekommen ab Juli deutlich… [+2142 chars]",,de,'Inflation'
https://www.stern.de/kultur/kulturstaatsminister--von-preisliste-gestrichen---buchlaeden-wollen-klagen-37193126.html,https://www.stern.de/kultur/kulturstaatsminister--von-preisliste-gestrichen---buchlaeden-wollen-klagen-37193126.html,0,www.stern.de,Kulturstaatsminister: Von Preisliste gestrichen - Buchläden wollen klagen,"Wegen Erkenntnissen des Verfassungsschutzes sollen drei Läden nicht am Deutsche Buchhandlungspreis teilnehmen dürfen, entscheidet der Kulturstaatsminister. Die Geschäfte geben sich nicht geschlagen.",https://image.stern.de/37194270/t/RV/v1/w1440/r1.7778/-/05--jiznqgbfhwv1axs2048jpeg---4063f9de893c405f.jpg,2026-03-05T12:21:26Z,,"Kopiere den aktuellen Link
Zur Merkliste hinzufügen
Wegen Erkenntnissen des Verfassungsschutzes sollen drei Läden nicht am Deutsche Buchhandlungspreis teilnehmen dürfen, entscheidet der Kulturstaat… [+2158 chars]",,de,'Preis'
https://www.zeit.de/arbeit/2026-03/renten-erhoehung-juli-baerbel-bas,https://www.zeit.de/arbeit/2026-03/renten-erhoehung-juli-baerbel-bas,0,www.zeit.de,"Rentenanpassung: Bas verkündet Anstieg der Rente um 4,24 Prozent von Juli an",Bundesarbeitsministerin Bärbel Bas hat die Rentenerhöhung für 2026 bekanntgegeben. Diese liegt über der zu erwartenden Inflationsrate.,https://img.zeit.de/administratives/sharing/fallback-image-die-zeit/wide__1300x731,2026-03-05T12:28:52Z,,"Die rund 23 Millionen Rentnerinnen und Rentner in Deutschland sollen vom 1. Juli 2026 an mehr Geld bekommen. Ihre Bezüge steigen um 4,24 Prozent, sagte Bundesarbeitsministerin Bärbel Bas der Nachrich… [+446 chars]",,de,'Inflation'
https://www.zeit.de/news/2026-03/05/neuer-raketenangriff-irans-auf-israel-sirenen-in-tel-aviv,https://www.zeit.de/news/2026-03/05/neuer-raketenangriff-irans-auf-israel-sirenen-in-tel-aviv,0,www.zeit.de,Iran-Krieg: Iran dementiert Angriff auf Aserbaidschan,Hier finden Sie Informationen zu dem Thema „Iran-Krieg“. Lesen Sie jetzt „Iran dementiert Angriff auf Aserbaidschan“.,https://img.zeit.de/news/2026-03/05/neuer-raketenangriff-irans-auf-israel-sirenen-in-tel-aviv-image-group/wide__1300x731,2026-03-05T12:41:08Z,,"Der iranische Generalstab weist Berichte über Drohnenangriffe auf Aserbaidschan zurück. In einer Erklärung hieß es, der Iran respektiere insbesondere die Souveränität der islamischen und benachbarten… [+825 chars]",,de,'Angriff'
https://www.welt.de/debatte/plus69a96d79c8473971749b2952/fastenpredigt-merkels-abgrund.html,https://www.welt.de/debatte/plus69a96d79c8473971749b2952/fastenpredigt-merkels-abgrund.html,0,www.welt.de,Merkels Abgrund,"Kaum etwas hat Deutschland seit dem Zweiten Weltkrieg so sehr geschadet wie Angela Merkels Klima- und Energiepolitik. Jetzt hat die Kanzlerin a.D. in einer Predigt bedauert, nicht noch mehr davon durchgezogen zu haben.",https://images.welt.de/69a96d79c8473971749b2952/6801d62886d108285ff726c2dbf3627c/ci16x9-w1200/dpa-com-20090101-260304-911-029805-jpg,2026-03-05T13:50:00Z,,"Kaum etwas hat Deutschland seit dem Zweiten Weltkrieg so sehr geschadet wie Angela Merkels Klima- und Energiepolitik. Jetzt hat die Kanzlerin a.D. in einer Predigt bedauert, nicht noch mehr davon dur… [+18 chars]",,de,'Klima'
https://www.welt.de/debatte/plus69a96d79c8473971749b2952/migration-bei-einer-fastenpredigt-hat-merkel-einen-verstoerenden-einblick-in-ihre-motive-gegeben.html,https://www.welt.de/debatte/plus69a96d79c8473971749b2952/migration-bei-einer-fastenpredigt-hat-merkel-einen-verstoerenden-einblick-in-ihre-motive-gegeben.html,0,www.welt.de,Merkels Eitelkeit,Kaum etwas hat Deutschland seit dem Zweiten Weltkrieg so sehr geschadet wie Angela Merkels Klima- und Energiepolitik. Bei einer Fastenpredigt hat die Kanzlerin a.D. nun einen verstörenden Einblick in ihre Motive gegeben,https://images.welt.de/69a96d79c8473971749b2952/6801d62886d108285ff726c2dbf3627c/ci16x9-w1200/dpa-com-20090101-260304-911-029805-jpg,2026-03-05T13:50:00Z,,Die WELT als ePaper: Die vollständige Ausgabe steht Ihnen bereits am Vorabend zur Verfügung so sind Sie immer hochaktuell informiert. Weitere Informationen https://epaper.welt.de,,de,'Klima'
https://www.bild.de/leben-wissen/bojanowskis-klima-kolumne-wie-gehts-dem-klima-wirklich-69aaa7937ce3c08db9d23de1,https://www.bild.de/leben-wissen/bojanowskis-klima-kolumne-wie-gehts-dem-klima-wirklich-69aaa7937ce3c08db9d23de1,0,www.bild.de,Bojanowskis Klima-Kolumne - Wie geht’s dem Klima wirklich?,"Klarheit in der Klimadebatte, ohne Alarmismus oder Verharmlosung. Jetzt den Newsletter abonnieren.","https://images.bild.de/69aaa7937ce3c08db9d23de1/8b622504c45888fdbdb49ce687601efc,cc774162?w=1280",2026-03-05T14:00:00Z,,"TTS-Player überspringenArtikel weiterlesenPaarungsverhalten, Kriege, Baseballpunkte, Flugturbulenzen kaum etwas, für das der Klimawandel nicht verantwortlich gemacht wird. Interessengruppen nutzen da… [+718 chars]",,de,'Klima'
https://www.nzz.ch/feuilleton/extremismus-im-buchladen-wolfram-weimer-schliesst-drei-linke-geschaefte-von-preis-aus-wegen-der-gesinnung-ld.1927818,https://www.nzz.ch/feuilleton/extremismus-im-buchladen-wolfram-weimer-schliesst-drei-linke-geschaefte-von-preis-aus-wegen-der-gesinnung-ld.1927818,0,www.nzz.ch,Extremismus im Buchladen: Wolfram Weimer schliesst drei linke Geschäfte von Preis aus – wegen der Gesinnung?,Der Kulturstaatsminister lässt Bücherläden vom Verfassungsschutz durchleuchten. Schleierhaft bleibt die Begründung dafür. Die Kulturszene sieht sich in ihrer Freiheit bedroht.,"https://img.nzz.ch/2026/03/05/f085aa98-ff59-4c4e-a764-943f5b022f47.jpg?width=1200&height=674&fit=bounds&quality=75&auto=webp&crop=2676,1505,x0,y279&wmark=nzz",2026-03-05T14:44:07Z,,"Der Kulturstaatsminister lässt Bücherläden vom Verfassungsschutz durchleuchten. Schleierhaft bleibt die Begründung dafür. Die Kulturszene sieht sich in ihrer Freiheit bedroht.
Niels Bossert05.03.202… [+4461 chars]",,de,'Preis'
https://www.zeit.de/news/2026-03/05/irans-streitkraefte-melden-angriff-auf-us-flugzeugtraeger,https://www.zeit.de/news/2026-03/05/irans-streitkraefte-melden-angriff-auf-us-flugzeugtraeger,0,www.zeit.de,Iran-Krieg: Irans Streitkräfte melden Angriff auf US-Flugzeugträger,Hier finden Sie Informationen zu dem Thema „Iran-Krieg“. Lesen Sie jetzt „Irans Streitkräfte melden Angriff auf US-Flugzeugträger“.,https://img.zeit.de/news/2026-03/05/irans-streitkraefte-melden-angriff-auf-us-flugzeugtraeger-image-group/wide__1300x731,2026-03-05T18:22:02Z,,"Irans Streitkräfte haben nach eigenen Angaben einen US-Flugzeugträger attackiert. Der Flugzeugträger «USS Abraham Lincoln» sei von Kampfdrohnen der Marine der Revolutionsgarden getroffen worden, beri… [+397 chars]",,de,'Angriff'
https://www.zeit.de/news/2026-03/06/israel-angriff-auf-chameneis-unterirdischen-bunker,https://www.zeit.de/news/2026-03/06/israel-angriff-auf-chameneis-unterirdischen-bunker,0,www.zeit.de,Militärische Eskalation: Israel: Angriff auf Chameneis unterirdischen Bunker,Hier finden Sie Informationen zu dem Thema „Militärische Eskalation“. Lesen Sie jetzt „Israel: Angriff auf Chameneis unterirdischen Bunker“.,https://img.zeit.de/news/2026-03/06/israel-angriff-auf-chameneis-unterirdischen-bunker-image-group/wide__1300x731,2026-03-06T12:49:28Z,,Israels Armee hat eigenen Angaben zufolge den unterirdischen Militärbunker des getöteten Staatsoberhaupts und Religionsführers Ajatollah Ali Chamenei angegriffen. Der unterirdische Komplex befinde si… [+1048 chars],,de,'Angriff'
https://www.faz.net/aktuell/technik-motor/wie-teures-benzin-zu-innovation-fuehren-kann-110849032.html,https://www.faz.net/aktuell/technik-motor/wie-teures-benzin-zu-innovation-fuehren-kann-110849032.html,0,www.faz.net,Preise treiben Innovation: Billiges Benzin,"Angesichts hoher Benzinpreise werden die Rufe nach staatlicher Intervention höher. Doch die könnte Innovation hemmen, zeigt ein Blick in die siebziger Jahre.",https://media0.faz.net/image/w1200h627/83e850d9a538/w3000h1567x0y311o/201207/431.0.46885823/alles-war-1967-scheinbar-gut.webp,2026-03-06T13:15:55Z,,"Sie tun es wieder. Kaum steigen die Preise für Benzin und Diesel, melden sich Politiker jeglicher Couleur, auch solche, die ansonsten die Marktwirtschaft hochhalten, und fordern Tankrabatte oder ande… [+1721 chars]",,de,'Preis'
https://www.tagesschau.de/wissen/klima/klimawandek-erderwaermung-folgen-100.html,https://www.tagesschau.de/wissen/klima/klimawandek-erderwaermung-folgen-100.html,0,www.tagesschau.de,Studie: Erderwärmung geht seit 2015 wirklich schneller voran,"Hinweise gab es schon, nun bestätigt eine neue Studie des Potsdam-Instituts für Klimafolgenforschung: Die Erde hat sich in den vergangenen zehn Jahren deutlich schneller erwärmt als in den Jahrzehnten davor. Von Ulrike Brandt.",https://images.tagesschau.de/image/b57a14f6-bae2-4f85-86dc-f2c0f5a20bd2/AAABnMMS__w/AAABmyZE0EA/16x9-big/treibholz-100.jpg?width=1280,2026-03-06T14:00:44Z,,"Stand: 06.03.2026 15:00 Uhr
Hinweise gab es schon, nun bestätigt eine neue Studie des Potsdam-Instituts für Klimafolgenforschung: Die Erde hat sich in den vergangenen zehn Jahren deutlich schneller … [+3549 chars]",,de,'Klima'
https://taz.de/Muss-Greenpeace-USA-Insolvenz-anmelden/!6160476/,https://taz.de/Muss-Greenpeace-USA-Insolvenz-anmelden/!6160476/,0,taz.de,Muss Greenpeace USA Insolvenz anmelden?: Die 3 wichtigsten Klima-News der Woche,Reiche will kleine Solaranlagen nicht mehr fördern. Ein Ölkonzern hat Greenpeace auf Schadensersatz verklagt. Der Meeresspiegel wird unterschätzt.,https://taz.de/picture/8300728/1200/00-QuadratMitTaz.jpeg,2026-03-06T17:04:00Z,,Reiche will kleine Solaranlagen nicht mehr fördern. Ein Ölkonzern hat Greenpeace auf Schadensersatz verklagt. Der Meeresspiegel wird unterschätzt. mehr...,,de,'Klima'
https://www.zeit.de/news/2026-03/06/angriff-auf-87-jaehrigen-senior-kommt-ins-krankenhaus,https://www.zeit.de/news/2026-03/06/angriff-auf-87-jaehrigen-senior-kommt-ins-krankenhaus,0,www.zeit.de,Kriminalität: Angriff auf 87-Jährigen - Senior kommt ins Krankenhaus,Hier finden Sie Informationen zu dem Thema „Kriminalität“. Lesen Sie jetzt „Angriff auf 87-Jährigen - Senior kommt ins Krankenhaus“.,https://img.zeit.de/news/2026-03/06/angriff-auf-87-jaehrigen-senior-kommt-ins-krankenhaus-image-group/wide__1300x731,2026-03-06T21:01:25Z,,"Ein 87 Jahre alter Mann ist in Ludwigshafen angegriffen, getreten und geschlagen worden. Zu dem Angriff sei es am Nachmittag nach einem kurzen Streitgespräch gekommen, das der Senior mit einem 21-Jäh… [+352 chars]",,de,'Angriff'
