index,url,valid,domain,title,description,image,published,archive,content,quote,language,keyword
https://www.zeit.de/news/2025-06/09/mann-nach-angriff-in-stockelsdorf-schwer-verletzt,https://www.zeit.de/news/2025-06/09/mann-nach-angriff-in-stockelsdorf-schwer-verletzt,0,www.zeit.de,Kriminalität: Mann nach Angriff in Stockelsdorf schwer verletzt,Hier finden Sie Informationen zu dem Thema „Kriminalität“. Lesen Sie jetzt „Mann nach Angriff in Stockelsdorf schwer verletzt“.,https://img.zeit.de/news/2025-06/09/mann-nach-angriff-in-stockelsdorf-schwer-verletzt-image-group/wide__1300x731,2025-06-09T07:22:15Z,,Ein Mann ist in der Nacht zu Montag in Stockelsdorf (Kreis Ostholstein) von mehreren Angreifern attackiert und schwer verletzt worden. Drei Männer hatten sich dem Passanten zunächst in einem Fahrzeug… [+716 chars],,de,'Angriff'
https://www.telepolis.de/features/Sancta-Greta-Thunbergs-Suendenfall-Vom-Klima-Engel-zum-Gaza-Daemon-10437303.html,https://www.telepolis.de/features/Sancta-Greta-Thunbergs-Suendenfall-Vom-Klima-Engel-zum-Gaza-Daemon-10437303.html,0,www.telepolis.de,Sancta Greta Thunbergs Sündenfall: Vom Klima-Engel zum Gaza-Dämon,"Einst gefeiert, nun geächtet im kalten Wind. Gretas frühere Fans kritisieren ihren Einsatz für Gaza als antisemitisch. Was steckt hinter dem radikalen Imagewandel? (Leserdebatte)",https://heise.cloudimg.io/bound/1200x1200/q85.png-lossy-85.webp-lossy-85.foil1/_www-heise-de_/imgs/18/4/8/7/1/9/6/7/master_greta-8757edf7416ed6e7.jpeg,2025-06-09T08:00:00Z,,"Greta Thunberg in Stockholm, April 2024. Bild: Shutterstock.com
Einst gefeiert, nun geächtet im kalten Wind. Gretas frühere Fans kritisieren ihren Einsatz für Gaza als antisemitisch. Was steckt hint… [+9380 chars]",,de,'Klima'
https://orf.at/stories/3396226/,https://orf.at/stories/3396226/,0,orf.at,479 Drohnen: Ukraine meldet großen russischen Angriff,,https://orf.at/mojo/1_4_1/storyserver//news/common/images/og-fallback-news.png,2025-06-09T08:26:02Z,,Russland hat die Ukraine nach Angaben der ukrainischen Luftstreitkräfte mit dem bisher größten Drohnenangriff seit Kriegsbeginn überzogen. Das Gebiet der Ukraine sei mit 479 Drohnen sowie zusätzlich … [+1148 chars],,de,'Angriff'
https://www.focus.de/politik/ukraine-krieg-alle-aktuellen-news-im-ticker_f4095450-8b49-4e7c-bc7c-12b2022f4e37.html,https://www.focus.de/politik/ukraine-krieg-alle-aktuellen-news-im-ticker_f4095450-8b49-4e7c-bc7c-12b2022f4e37.html,0,www.focus.de,Ukraine-Krieg: Alle aktuellen News im Ticker,"Dem ukrainischen Geheimdienst ist mit dem Schlag gegen die russische Bomberflotte ein Coup gelungen, während gleichzeitig die Armeeführung wegen Fehlern in Kritik geriet.",https://quadro.burda-forward.de/ctf/5bf81b32-5d52-491d-8375-2992cd1eaacc.aa3d3880-00b0-40d1-9e7e-3689e81aa451.png?im=RegionOfInterestCrop%3D%281200%2C630%29%2CregionOfInterest%3D%28471%2C401%29&hash=c061e6d5793f86582eda27e91cfce64631b3cc2b157e94dce74670473b01bf5e,2025-06-09T08:30:58Z,,"Ukraine meldet größten russischen Drohnenangriff seit Kriegsbeginn
10.27 Uhr: Nach Angaben der Luftwaffe hat Russland die Ukraine mit dem bislang größten Drohnenangriff seit Kriegsbeginn überzogen. … [+12086 chars]",,de,'Ukraine'
https://www.stern.de/politik/ausland/ukraine-meldet-groessten-russischen-angriff-seit-kriegsbeginn-35793794.html,https://www.stern.de/politik/ausland/ukraine-meldet-groessten-russischen-angriff-seit-kriegsbeginn-35793794.html,0,www.stern.de,Ukraine-Krieg: 479 russische Drohnen – Ukraine meldet größten Angriff seit Kriegsbeginn,Putin eskaliert den Krieg in der Ukraine weiter. Kiew meldet die größte Angriffswelle seit Beginn der Invasion: Fast 500 Drohnen und Raketen seien auf die Ukraine niedergegangen.,https://image.stern.de/35793800/t/1m/v1/w1440/r1.7778/-/ukraine-angriff.jpg,2025-06-09T08:35:00Z,,"Kopiere den aktuellen Link
Zur Merkliste hinzufügen
Putin eskaliert den Krieg in der Ukraine weiter. Kiew meldet die größte Angriffswelle seit Beginn der Invasion: Fast 500 Drohnen und Raketen seie… [+400 chars]",,de,'Angriff'
https://taz.de/-Nachrichten-im-Ukraine-Krieg--/!6093367/,https://taz.de/-Nachrichten-im-Ukraine-Krieg--/!6093367/,0,taz.de,+++ Nachrichten im Ukraine-Krieg +++: Ukraine meldet größten russischen Angriff seit Kriegsbeginn,"Mit fast 500 Drohnen und Raketen wurde in der Nacht das Land attackiert, meldet die Ukraine. Die meisten seien abgewehrt worden. Joschka Fischer für Wehrpflicht.",https://taz.de/picture/7743921/1200/38576177-1.jpeg,2025-06-09T08:39:00Z,,"Mit fast 500 Drohnen und Raketen wurde in der Nacht das Land attackiert, meldet die Ukraine. Die meisten seien abgewehrt worden. Joschka Fischer für Wehrpflicht. mehr...",,de,'Ukraine'
https://www.tagesschau.de/newsticker/liveblog-ukraine-montag-502.html,https://www.tagesschau.de/newsticker/liveblog-ukraine-montag-502.html,0,www.tagesschau.de,Ukraine-Liveblog: ++ Ukraine meldet größten russischen Luftangriff ++,Nach Angaben der ukrainischen Luftwaffe hat Russland bei seinem bislang größten Angriff 479 Drohnen eingesetzt. Auch Kiew ist erneut Ziel russischer Angriffe geworden. Die Entwicklungen im Liveblog.,https://images.tagesschau.de/image/5b073b67-29bf-4703-b6b1-71469e4c25bb/AAABldopTPc/AAABkZLhkrw/16x9-1280/flagge-ukraine-truemmer-101.jpg,2025-06-09T08:42:56Z,,"Stand: 09.06.2025 10:42 Uhr
Nach Angaben der ukrainischen Luftwaffe hat Russland bei seinem bislang größten Angriff 479 Drohnen eingesetzt. Auch Kiew ist erneut Ziel russischer Angriffe geworden. Di… [+2725 chars]",,de,'Angriff'
https://www.berliner-zeitung.de/news/anrgiff-drohnen-russland-ukraine-li.2331760,https://www.berliner-zeitung.de/news/anrgiff-drohnen-russland-ukraine-li.2331760,0,www.berliner-zeitung.de,Ukrainekrieg: Größter Angriff Russlands seit Kriegsbeginn,Fast 500 Drohnen soll Russland auf die Ukraine abgefeuert haben. Es ist der bislang größte Angriff seit Beginn des Krieges 2022.,https://berliner-zeitung.imgix.net/2025/06/09/a67cf926-26a3-4239-a2e6-466b6df5afee.jpeg?w=1024&auto=format,2025-06-09T08:56:43Z,,Russland hat die Ukraine nach Angaben der Luftwaffe in Kiew mit dem bislang größten Drohnenangriff seit Kriegsbeginn überzogen. Das Gebiet der Ukraine sei mit 479 Drohnen sowie zusätzlich mit 20 Mars… [+1040 chars],,de,'Angriff'
https://www.diepresse.com/19776147/479-drohnen-ukraine-meldet-bisher-groessten-russischen-angriff,https://www.diepresse.com/19776147/479-drohnen-ukraine-meldet-bisher-groessten-russischen-angriff,0,www.diepresse.com,479 Drohnen: Ukraine meldet bisher größten russischen Angriff,"Neben den Drohnen sollen auch mit 20 Marschflugkörpern angegriffen worden sein, berichtet die ukrainische Luftwaffe. An zehn Orten seien „Einschläge“ festgestellt worden.",https://img.diepresse.com/public/incoming/wcdoq5-imago-images-0821747235/alternates/DPR_SOCIAL_NACHRICHTEN/imago%20images%200821747235,2025-06-09T09:04:59Z,,"Neben den Drohnen soll auch mit 20 Marschflugkörpern angegriffen worden sein, berichtet die ukrainische Luftwaffe. An zehn Orten seien Einschläge festgestellt worden.
Russland hat die Ukraine nach A… [+1453 chars]",,de,'Angriff'
https://www.tagesspiegel.de/internationales/krieg-in-der-ukraine-moskau-und-kiew-tauschen-gefangene-massive-luftangriffe-13823944.html,https://www.tagesspiegel.de/internationales/krieg-in-der-ukraine-moskau-und-kiew-tauschen-gefangene-massive-luftangriffe-13823944.html,0,www.tagesspiegel.de,Krieg in der Ukraine: Moskau und Kiew tauschen Gefangene - massive Luftangriffe,Mit einem Gefangenenaustausch wird die Diplomatie im russischen Angriffskrieg gegen die Ukraine vorangetrieben. Gleichzeitig nimmt die Intensität russischer Drohnenattacken auf das Nachbarland zu.,https://www.tagesspiegel.de/images/13824994/alternates/BASE_16_9_W1400/1749475587000/ukraine-krieg-gefangenenaustausch.jpeg,2025-06-09T09:37:34Z,,"Russland und die Ukraine haben mit einem weiteren Gefangenenaustausch begonnen. Die erste Gruppe russischer Soldaten unter 25 Jahren sei aus ukrainischer Gefangenschaft entlassen worden, teilte das V… [+4644 chars]",,de,'Angriff'
https://www.n-tv.de/politik/Ukraine-meldet-bislang-groessten-russischen-Drohnenangriff-article25822096.html,https://www.n-tv.de/politik/Ukraine-meldet-bislang-groessten-russischen-Drohnenangriff-article25822096.html,0,www.n-tv.de,Polen startet Kampfjets: Ukraine meldet bislang größten russischen Drohnenangriff,"Nach Angaben aus Kiew attackiert Russland die Ukraine mit einer Höchstzahl an Drohnen in einer Nacht. Das Nachbarland Polen reagiert auf Angriffe in der Grenzregion. Derweil muss eine Fabrik bei Moskau, die Drohnenteile produzieren soll, ihre Arbeit vorüberge…",https://www.n-tv.de/img/incoming/crop25822111/1361322961-cImg_16_9-w1200/527123858.jpg,2025-06-09T09:43:33Z,,Nach Angaben aus Kiew attackiert Russland die Ukraine mit einer Höchstzahl an Drohnen in einer Nacht. Das Nachbarland Polen reagiert auf Angriffe in der Grenzregion. Derweil muss eine Fabrik bei Mosk… [+2368 chars],,de,'Angriff'
https://www.stern.de/news/479-drohnen--ukraine-meldet-groessten-russischen-angriff-seit-kriegsbeginn-35793932.html,https://www.stern.de/news/479-drohnen--ukraine-meldet-groessten-russischen-angriff-seit-kriegsbeginn-35793932.html,0,www.stern.de,479 Drohnen: Ukraine meldet größten russischen Angriff seit Kriegsbeginn,"Russland hat die Ukraine nach Angaben der Luftwaffe in Kiew mit dem bislang größten Drohnenangriff seit Kriegsbeginn überzogen. Das Gebiet der Ukraine sei mit 479 Drohnen sowie zusätzlich mit 20 Marschflugkörpern angegriffen worden, erklärte die Luftwaffe am …",https://image.stern.de/35793934/t/K2/v1/w1440/r1.7778/-/09--shaheddrohne-iranischer-bauart-ueber-dem-himmel-der-ukraine---29018a073b277957.jpg,2025-06-09T09:44:53Z,,"Kopiere den aktuellen Link
Zur Merkliste hinzufügen
Russland hat die Ukraine nach Angaben der Luftwaffe in Kiew mit dem bislang größten Drohnenangriff seit Kriegsbeginn überzogen. Das Gebiet der Uk… [+1304 chars]",,de,'Ukraine'
https://www.morgenpost.de/politik/article409202437/drohnen-coup-der-ukraine-droht-jetzt-die-atomare-eskalation.html,https://www.morgenpost.de/politik/article409202437/drohnen-coup-der-ukraine-droht-jetzt-die-atomare-eskalation.html,0,www.morgenpost.de,Drohnen-Coup der Ukraine: Droht jetzt die atomare Eskalation?,"Wie die Operation „Spider Web“ Russlands strategische Fähigkeiten geschwächt hat. Wie Putin jetzt reagieren könnte, welches Risiko Atomexperten noch befürchten.",https://img.sparknews.funkemedien.de/409207923/409207923_1749225661_v16_9_1600.jpeg,2025-06-09T10:01:23Z,,"Berlin. Nach der Operation Spider Web: Wie sehr ist Russlands Atomflotte geschwächt? Eine Bilanz und was Experten im Westen jetzt befürchten. 
Der ukrainische Drohnenangriff auf die atomwaffenfähige… [+9599 chars]",,de,'Russland'
https://orf.at/stories/3396227/,https://orf.at/stories/3396227/,0,orf.at,Ukraine meldet bisher größten Angriff,"Russland hat die Ukraine nach Angaben der Luftstreitkräfte in Kiew mit dem bisher größten Drohnenangriff seit Kriegsbeginn überzogen. Das Gebiet der Ukraine sei mit 479 Drohnen sowie zusätzlich mit 20 Marschflugkörpern angegriffen worden, hieß es am Montag.",https://ibs.orf.at/news?image=https%3A%2F%2Fassets.orf.at%2Fmims%2F2025%2F24%2F27%2Fcrops%2Fw%3D1200%2Ch%3D630%2Cq%3D75%2F2656036_master_1020927_ukraine-mykolaiv.jpg%3Fs%3Df97641d94fda93fec3ed29d55f3a918b60f2bab2,2025-06-09T10:07:48Z,,"460 Drohnen sowie 19 Marschflugkörper seien abgefangen worden, so die ukrainischen Luftstreitkräfte. An zehn Orten seien Einschläge festgestellt worden.
In der gesamten Ukraine herrschte ab kurz nac… [+2707 chars]",,de,'Ukraine'
https://www.bild.de/politik/ausland-und-internationales/putins-neue-terror-strategie-drohnen-bomben-und-raketen-6845843128e5c13c1b056dec,https://www.bild.de/politik/ausland-und-internationales/putins-neue-terror-strategie-drohnen-bomben-und-raketen-6845843128e5c13c1b056dec,0,www.bild.de,Größter Angriff seit Kriegsbeginn - Putins Drohnen-Terror hat zwei brutale Ziele,"Allein in dieser Woche feuerte Russland 1114 Raketen, Marschflugkörper und Kamikaze-Drohnen auf die Ukraine. Mehr als 200 Zivilisten wurden getötet oder verletzt.","https://images.bild.de/6845843128e5c13c1b056dec/deeda1ad19f0c03fece0cbe6ab39ab8d,42b42596?w=1280",2025-06-09T10:44:10Z,,"Es ist der größte Angriff seit Kriegsbeginn: Mit fast 500 Drohnen und Raketen bombardiert Putin die Ukraine!
Jetzt wird klar: Putins Terror-Strategie hat ZWEI konkrete Ziele.
Lesen Sie alles über P… [+42 chars]",,de,'Angriff'
https://www.nzz.ch/feuilleton/migration-ist-keine-naturgewalt-der-man-einfach-ausgeliefert-ist-sagt-ayaan-hirsi-ali-ld.1887922,https://www.nzz.ch/feuilleton/migration-ist-keine-naturgewalt-der-man-einfach-ausgeliefert-ist-sagt-ayaan-hirsi-ali-ld.1887922,0,www.nzz.ch,"INTERVIEW - «Migration ist keine Naturgewalt, der man einfach ausgeliefert ist», sagt Ayaan Hirsi Ali","Die bekannte Islamkritikerin findet, Deutschland habe seine Grundsätze verraten – und zahle nun einen hohen Preis dafür. Die Schweiz sieht sie trotz der hohen Einwanderung als Vorbild.","https://img.nzz.ch/2024/09/10/a1234e5a-8210-4047-85e8-e93b334bbc56.jpeg?width=1200&height=675&fit=bounds&quality=75&auto=webp&crop=3280,1845,x0,y313&wmark=nzz",2025-06-09T14:30:00Z,,"Die Politologin und Frauenrechtlerin Ayaan Hirsi Ali kann seit Jahren nur noch mit Bodyguards auf die Strasse.
Ihre sanfte Stimme steht in Kontrast zu ihren messerscharfen Aussagen: Die Politologin … [+13169 chars]",,de,'Preis'
https://www.tagesspiegel.de/berlin/er-raste-auf-dem-burgersteig-und-mehrfach-uber-rot-34-jahriger-ohne-fuhrerschein-nach-wilder-flucht-in-berlin-festgenommen-13825426.html,https://www.tagesspiegel.de/berlin/er-raste-auf-dem-burgersteig-und-mehrfach-uber-rot-34-jahriger-ohne-fuhrerschein-nach-wilder-flucht-in-berlin-festgenommen-13825426.html,0,www.tagesspiegel.de,Er raste auf dem Bürgersteig und mehrfach über Rot : 34-Jähriger ohne Führerschein nach wilder Flucht in Berlin festgenommen,"Zivilfahnder entdecken einen Verdächtigen und nehmen die Verfolgung auf. Doch dieser denkt gar nicht daran, sich einer Kontrolle zu stellen. Später gibt der 34-Jährige an, Drogen konsumiert zu haben.",https://www.tagesspiegel.de/images/13825423/alternates/BASE_16_9_W1400/1749481723000/blaulicht-auf-einem-polizeiauto.jpeg,2025-06-09T15:08:43Z,,Ein 34-Jähriger ohne Führerschein ist in einem gestohlenen Auto vor der Polizei geflohen und stand dabei mutmaßlich unter Drogen. Auf seiner Flucht durch Berlin-Schöneberg bretterte er am Sonntagnach… [+1254 chars],,de,'Flucht'
https://www.bild.de/regional/hamburg/polizeieinsatz-in-hamburg-mann-verletzt-taeter-auf-der-flucht-684730591ce36f5bb44bb258,https://www.bild.de/regional/hamburg/polizeieinsatz-in-hamburg-mann-verletzt-taeter-auf-der-flucht-684730591ce36f5bb44bb258,0,www.bild.de,"Ein Verletzter, Zeugen hörten Schüsse - Großeinsatz in Hamburg! Täter auf der Flucht","Augenzeugen sprechen von Schüssen im Bullskamp. Ein Mann wurde verletzt. Die Polizei in Hamburg befindet sich im Großeinsatz, der Täter ist flüchtig.","https://images.bild.de/684730591ce36f5bb44bb258/50995e951942245b005b87cd681dad1f,2926419c?w=1280",2025-06-09T19:55:26Z,,"Hamburg Ein ruhiger Feiertag endet für Bewohner in Farmsen mit einem Schock. Am späten Pfingstmontag kam es in dem Hamburger Stadtteil zu einem dramatischen Großeinsatz der Polizei. 
Gegen 19.28 Uhr… [+972 chars]",,de,'Flucht'
https://www.n-tv.de/politik/04-02-Ukraine-meldet-Angriff-auf-Odessa-Ein-Toter-und-mehrere-Verletzte--article23143824.html,https://www.n-tv.de/politik/04-02-Ukraine-meldet-Angriff-auf-Odessa-Ein-Toter-und-mehrere-Verletzte--article23143824.html,0,www.n-tv.de,Ukraine-Krieg im Liveticker: +++ 04:02 Ukraine meldet Angriff auf Odessa: Ein Toter und mehrere Verletzte ++,Lesen Sie alle aktuellen Entwicklungen und Nachrichten über den russischen Angriffskrieg auf die Ukraine im Liveticker von ntv.de.,https://www.n-tv.de/img/incoming/crop25117070/8311326854-cImg_16_9-w1200/Ukraine-Liveticker.jpg,2025-06-09T22:35:00Z,,In der südukrainischen Schwarzmeerstadt Odessa wurden nach örtlichen Behördenangaben bei einem russischen Luftangriff mindestens ein Mensch getötet und vier weitere verletzt. Bei dem Toten handelt es… [+9560 chars],,de,'Angriff'
https://www.n-tv.de/politik/08-07-Kiew-Mehr-als-900-russische-Soldaten-innerhalb-eines-Tages-eliminiert--article23143824.html,https://www.n-tv.de/politik/08-07-Kiew-Mehr-als-900-russische-Soldaten-innerhalb-eines-Tages-eliminiert--article23143824.html,0,www.n-tv.de,"Ukraine-Krieg im Liveticker: +++ 08:07 Kiew: Mehr als 900 russische Soldaten innerhalb eines Tages ""eliminiert"" +++",Lesen Sie alle aktuellen Entwicklungen und Nachrichten über den russischen Angriffskrieg auf die Ukraine im Liveticker von ntv.de.,https://www.n-tv.de/img/incoming/crop25117070/8311326854-cImg_16_9-w1200/Ukraine-Liveticker.jpg,2025-06-09T22:35:00Z,,Die personellen Verluste auf russischer Seite bleiben laut offiziellen Zahlen aus Kiew hoch: Binnen eines Tages sind demnach 960 russische Soldaten im Krieg ums Leben gekommen oder können nicht mehr … [+11524 chars],,de,'Waffen'
https://www.n-tv.de/politik/18-02-Merz-Diskussion-ueber-Nato-Ziel-geht-in-richtige-Richtung--article23143824.html,https://www.n-tv.de/politik/18-02-Merz-Diskussion-ueber-Nato-Ziel-geht-in-richtige-Richtung--article23143824.html,0,www.n-tv.de,Ukraine-Krieg im Liveticker: +++ 18:02 Merz: Diskussion über Nato-Ziel geht in richtige Richtung +++,Lesen Sie alle aktuellen Entwicklungen und Nachrichten über den russischen Angriffskrieg auf die Ukraine im Liveticker von ntv.de.,https://www.n-tv.de/img/incoming/crop25117070/8311326854-cImg_16_9-w1200/Ukraine-Liveticker.jpg,2025-06-09T22:35:00Z,,"Die Diskussion unter den europäischen Nato-Staaten über höhere Zahlungen für Verteidigungsausgaben geht nach Ansicht von Kanzler Friedrich Merz in die richtige Richtung. ""Wir werden alles tun, damit … [+23189 chars]",,de,'Angriff'
https://www.n-tv.de/politik/14-22-Umfrage-Mehr-als-die-Haelfte-der-Ukrainer-lehnt-territoriale-Zugestaendnisse-an-Russland-kategorisch-ab--article23143824.html,https://www.n-tv.de/politik/14-22-Umfrage-Mehr-als-die-Haelfte-der-Ukrainer-lehnt-territoriale-Zugestaendnisse-an-Russland-kategorisch-ab--article23143824.html,0,www.n-tv.de,Ukraine-Krieg im Liveticker: +++ 14:22 Umfrage: Mehr als die Hälfte der Ukrainer lehnt territoriale Zugeständnisse an Russland kategorisch ab +++,Lesen Sie alle aktuellen Entwicklungen und Nachrichten über den russischen Angriffskrieg auf die Ukraine im Liveticker von ntv.de.,https://www.n-tv.de/img/incoming/crop25117070/8311326854-cImg_16_9-w1200/Ukraine-Liveticker.jpg,2025-06-09T22:35:00Z,,"Mehr als die Hälfte der Ukrainerinnen und Ukrainer lehnt jegliche territoriale Zugeständnisse an Russland kategorisch ab. Das ergibt eine Umfrage des Kiewer Instituts für Soziologie (KIIS), wie die s… [+18957 chars]",,de,'Angriff'
https://www.n-tv.de/politik/04-35-Russische-Luftfahrtbehoerde-Flugverkehr-auf-vier-grossen-Flughaefen-eingestellt--article23143824.html,https://www.n-tv.de/politik/04-35-Russische-Luftfahrtbehoerde-Flugverkehr-auf-vier-grossen-Flughaefen-eingestellt--article23143824.html,0,www.n-tv.de,Ukraine-Krieg im Liveticker: +++ 04:35 Russische Luftfahrtbehörde: Flugverkehr auf vier großen Flughäfen eingestellt ++,Lesen Sie alle aktuellen Entwicklungen und Nachrichten über den russischen Angriffskrieg auf die Ukraine im Liveticker von ntv.de.,https://www.n-tv.de/img/incoming/crop25117070/8311326854-cImg_16_9-w1200/Ukraine-Liveticker.jpg,2025-06-09T22:35:00Z,,"Die russische Zivilluftfahrtbehörde Rosaviatsia hat am frühen Mmorgen aus Sicherheitsgründen den Flugverkehr auf allen vier großen Flughäfen, die Moskau anfliegen, vorübergehend eingestellt. Grund da… [+9924 chars]",,de,'Angriff'
https://www.n-tv.de/politik/10-57-Moskau-102-Drohnen-in-der-Nacht-ueber-russischem-Territorium-und-der-Krim-abgeschossen--article23143824.html,https://www.n-tv.de/politik/10-57-Moskau-102-Drohnen-in-der-Nacht-ueber-russischem-Territorium-und-der-Krim-abgeschossen--article23143824.html,0,www.n-tv.de,Ukraine-Krieg im Liveticker: +++ 10:57 Moskau: 102 Drohnen in der Nacht über russischem Territorium und der Krim abgeschossen +++,Lesen Sie alle aktuellen Entwicklungen und Nachrichten über den russischen Angriffskrieg auf die Ukraine im Liveticker von ntv.de.,https://www.n-tv.de/img/incoming/crop25117070/8311326854-cImg_16_9-w1200/Ukraine-Liveticker.jpg,2025-06-09T22:35:00Z,,Die russische Luftabwehr hat nach Angaben des russischen Verteidigungsministeriums in der vergangenen Nacht 102 Drohnen über russischem Territorium und über der besetzten ukrainischen Krim abgeschoss… [+14266 chars],,de,'Ukraine'
https://www.n-tv.de/politik/12-07-Nato-Chef-Rutte-Wir-brauchen-eine-400-prozentige-Verstaerkung-der-Luft-und-Raketenabwehr--article23143824.html,https://www.n-tv.de/politik/12-07-Nato-Chef-Rutte-Wir-brauchen-eine-400-prozentige-Verstaerkung-der-Luft-und-Raketenabwehr--article23143824.html,0,www.n-tv.de,"Ukraine-Krieg im Liveticker: +++ 12:07 Nato-Chef Rutte: ""Wir brauchen eine 400-prozentige Verstärkung der Luft- und Raketenabwehr"" +++",Lesen Sie alle aktuellen Entwicklungen und Nachrichten über den russischen Angriffskrieg auf die Ukraine im Liveticker von ntv.de.,https://www.n-tv.de/img/incoming/crop25117070/8311326854-cImg_16_9-w1200/Ukraine-Liveticker.jpg,2025-06-09T22:35:00Z,,Angesichts der Bedrohung durch Russland haben sich die Verteidigungsminister der Nato laut Generalsekretär Mark Rutte auf neue ehrgeizige Ziele geeinigt. Das sagte der Chef des Militärbündnisses bei … [+15977 chars],,de,'Angriff'
https://www.n-tv.de/politik/19-10-Russland-verurteilt-Kolumbianer-wegen-Kampfeinsatz-fuer-Ukraine--article23143824.html,https://www.n-tv.de/politik/19-10-Russland-verurteilt-Kolumbianer-wegen-Kampfeinsatz-fuer-Ukraine--article23143824.html,0,www.n-tv.de,Ukraine-Krieg im Liveticker: +++ 19:10 Russland verurteilt Kolumbianer wegen Kampfeinsatz für Ukraine +++,Lesen Sie alle aktuellen Entwicklungen und Nachrichten über den russischen Angriffskrieg auf die Ukraine im Liveticker von ntv.de.,https://www.n-tv.de/img/incoming/crop25117070/8311326854-cImg_16_9-w1200/Ukraine-Liveticker.jpg,2025-06-09T22:35:00Z,,"Ein Kolumbianer, der sich den ukrainischen Streitkräften angeschlossen haben soll, ist in Russland zu 28 Jahren Gefängnis verurteilt worden. Der Mann namens Pablo Puentes Borges habe unter anderem in… [+24740 chars]",,de,'Waffen'
https://www.n-tv.de/politik/07-35-Ukrainische-Drohne-zerstoert-drei-russische-Felddepots-bei-Kupjansk--article23143824.html,https://www.n-tv.de/politik/07-35-Ukrainische-Drohne-zerstoert-drei-russische-Felddepots-bei-Kupjansk--article23143824.html,0,www.n-tv.de,Ukraine-Krieg im Liveticker: +++ 07:35 Ukrainische Drohne zerstört drei russische Felddepots bei Kupjansk +++,Lesen Sie alle aktuellen Entwicklungen und Nachrichten über den russischen Angriffskrieg auf die Ukraine im Liveticker von ntv.de.,https://www.n-tv.de/img/incoming/crop25117070/8311326854-cImg_16_9-w1200/Ukraine-Liveticker.jpg,2025-06-09T22:35:00Z,,"Nahe der ukrainischen Stadt Kupjansk haben ukrainische Verteidigungseinheiten eigenen Angaben zufolge mit einer Drohne drei russische Felddepots mit Treibstoff, Munition und Proviant zerstört. Das me… [+10565 chars]",,de,'Waffen'
https://www.n-tv.de/politik/10-09-Rutte-Weg-der-Ukraine-in-die-Nato-ist-unumkehrbar--article23143824.html,https://www.n-tv.de/politik/10-09-Rutte-Weg-der-Ukraine-in-die-Nato-ist-unumkehrbar--article23143824.html,0,www.n-tv.de,"Ukraine-Krieg im Liveticker: +++ 10:09 Rutte: Weg der Ukraine in die Nato ist ""unumkehrbar"" +++",Lesen Sie alle aktuellen Entwicklungen und Nachrichten über den russischen Angriffskrieg auf die Ukraine im Liveticker von ntv.de.,https://www.n-tv.de/img/incoming/crop25117070/8311326854-cImg_16_9-w1200/Ukraine-Liveticker.jpg,2025-06-09T22:35:00Z,,"Nato-Generalsekretär Mark Rutte bekräftigt, dass das politische Bekenntnis zur künftigen Nato-Mitgliedschaft der Ukraine unverändert bleibt, auch wenn es im Abschlusskommuniqué des bevorstehenden Gip… [+13971 chars]",,de,'Angriff'
https://www.n-tv.de/politik/01-44-CDU-Politiker-Daniel-Guenther-und-Norbert-Roettgen-setzten-SPD-wegen-Wehrpflicht-unter-Druck--article23143824.html,https://www.n-tv.de/politik/01-44-CDU-Politiker-Daniel-Guenther-und-Norbert-Roettgen-setzten-SPD-wegen-Wehrpflicht-unter-Druck--article23143824.html,0,www.n-tv.de,Ukraine-Krieg im Liveticker: +++ 01:44 CDU-Politiker Daniel Günther und Norbert Röttgen setzten SPD wegen Wehrpflicht unter Druck +++,Lesen Sie alle aktuellen Entwicklungen und Nachrichten über den russischen Angriffskrieg auf die Ukraine im Liveticker von ntv.de.,https://www.n-tv.de/img/incoming/crop25117070/8311326854-cImg_16_9-w1200/Ukraine-Liveticker.jpg,2025-06-09T22:35:00Z,,"Aus der CDU kommt Druck auf den Koalitionspartner SPD, den geplanten freiwilligen Wehrdienst in eine Wehrpflicht umzuwidmen oder mit verpflichtenden Elementen zu versehen. ""Das Thema hat im Moment hö… [+8247 chars]",,de,'Waffen'
