index,url,valid,domain,title,description,image,published,archive,content,quote,language,keyword
https://www.zeit.de/politik/ausland/2026-03/usa-iran-israel-angriff-un-sicherheitsrat-voelkerrecht,https://www.zeit.de/politik/ausland/2026-03/usa-iran-israel-angriff-un-sicherheitsrat-voelkerrecht,0,www.zeit.de,UN-Sicherheitsrat: USA sehen Angriff auf Iran vom internationalen Recht gedeckt,"Der Iran wirft den USA Völkerrechtsbruch vor, die US-Regierung weist das in einer UN-Krisensitzung zurück. Beide Staaten berufen sich auf ihr Selbstverteidigungsrecht.",https://img.zeit.de/politik/ausland/2026-03/iran-usa-sicherheitsrat-un/wide__1300x731,2026-03-01T01:26:18Z,,Die jüngsten amerikanisch-israelischen Angriffe auf den Iran stehen nach Ansicht der USA im Einklang mit internationalem Recht. Die US-Regierung habe in enger Abstimmung mit Israel rechtmäßige Maßnah… [+3341 chars],,de,'Angriff'
https://www.nzz.ch/international/krieg-gegen-iran-internationaler-flugverkehr-wird-auf-tage-schwer-gestoert-sein-ld.1927127,https://www.nzz.ch/international/krieg-gegen-iran-internationaler-flugverkehr-wird-auf-tage-schwer-gestoert-sein-ld.1927127,0,www.nzz.ch,Krieg gegen Iran: Internationaler Flugverkehr wird tagelang schwer gestört sein,"Dubai, Abu Dhabi, Doha: Einige der verkehrsreichsten Flughäfen der Welt sind wegen der Angriffe in Nahost geschlossen. Die Folgen sind weltweit zu spüren, für Passagiere wie für den Frachtverkehr.","https://img.nzz.ch/2026/03/01/fb46a584-4825-41aa-99b0-4e741ecef34b.jpg?width=1200&height=675&fit=bounds&quality=75&auto=webp&crop=5500,3094,x0,y331&wmark=nzz",2026-03-01T02:28:35Z,,"Dubai, Abu Dhabi, Doha: Einige der verkehrsreichsten Flughäfen der Welt sind wegen der Angriffe in Nahost geschlossen. Die Folgen sind weltweit zu spüren, für Passagiere wie für den Frachtverkehr.
0… [+3775 chars]",,de,'Angriff'
https://www.tagesspiegel.de/internationales/sanktionen-belgien-oltanker-von-russischer-schattenflotte-geentert-15304642.html,https://www.tagesspiegel.de/internationales/sanktionen-belgien-oltanker-von-russischer-schattenflotte-geentert-15304642.html,0,www.tagesspiegel.de,Sanktionen: Belgien: Öltanker von russischer Schattenflotte geentert,Immer wieder werden in Europa Tanker von Russlands Schattenflotte festgesetzt. Nun will Belgien erfolgreich zugeschlagen haben.,https://www.tagesspiegel.de/images/15304641/alternates/BASE_16_9_W1400/1772337500000/tanker-eventin-vor-insel-rugen.jpeg,2026-03-01T03:58:21Z,,"Belgien hat nach eigenen Angaben in der Nacht einen Öltanker der russischen Schattenflotte gekapert. Die belgischen Streitkräfte hätten das Schiff mit Unterstützung Frankreichs festgesetzt, schrieb B… [+1102 chars]",,de,'Russland'
https://www.focus.de/politik/ausland/belgien-oeltanker-von-russischer-schattenflotte-geentert_f21dd033-44d8-43b9-9b87-cfefa5c0611e.html,https://www.focus.de/politik/ausland/belgien-oeltanker-von-russischer-schattenflotte-geentert_f21dd033-44d8-43b9-9b87-cfefa5c0611e.html,0,www.focus.de,Belgien: Öltanker von russischer Schattenflotte geentert,Immer wieder werden in Europa Tanker von Russlands Schattenflotte festgesetzt. Nun will Belgien erfolgreich zugeschlagen haben.,https://quadro.burda-forward.de/ctf/4d6016e5-6f15-4497-a4ae-896f42f1ee79.414b03ef-ee57-4c8c-85f3-500ba899d2b8.jpeg?im=RegionOfInterestCrop%3D%281200%2C630%29%2CregionOfInterest%3D%281024%2C667%29&hash=d69c78276dfeabd0f5a707eae540268bb19bdf44afec61bf79b634257b3b879f,2026-03-01T04:01:00Z,,"Belgien hat nach eigenen Angaben in der Nacht einen Öltanker der russischen Schattenflotte gekapert. Die belgischen Streitkräfte hätten das Schiff mit Unterstützung Frankreichs festgesetzt, schrieb B… [+976 chars]",,de,'Russland'
https://www.nzz.ch/feuilleton/tanzen-fuer-die-freiheit-das-nationalballett-der-ukraine-trotzt-dem-krieg-ld.1926450,https://www.nzz.ch/feuilleton/tanzen-fuer-die-freiheit-das-nationalballett-der-ukraine-trotzt-dem-krieg-ld.1926450,0,www.nzz.ch,Tanzen für die Freiheit – das Nationalballett der Ukraine trotzt dem Krieg,"Die Tänzerinnen und Tänzer der Kiewer Kompanie treten unter schwierigsten Bedingungen weiterhin auf und gastieren auch im Ausland. Im Festspielhaus Baden-Baden war zu erleben, wie umfassend der Krieg das Leben der Künstler, aber auch die Kunst selbst veränder…","https://img.nzz.ch/2026/02/25/627cbd20-86a4-46a4-b971-33f9d4fde4d3.jpg?width=1200&height=674&fit=bounds&quality=75&auto=webp&crop=2655,1493,x0,y277&wmark=nzz",2026-03-01T04:30:00Z,,"Jeden Morgen um 9 steht in Kiew die Welt eine Minute lang still. Die Menschen verharren auf den Gehsteigen, etliche gehen auf die Knie, senken die Köpfe, schweigen. Danach wird die Nationalhymne gesp… [+19431 chars]",,de,'Ukraine'
https://www.stern.de/news/irans-geistliches-oberhaupt-chamenei-bei-massiven-angriffen-der-usa-und-israels-getoetet-37180394.html,https://www.stern.de/news/irans-geistliches-oberhaupt-chamenei-bei-massiven-angriffen-der-usa-und-israels-getoetet-37180394.html,0,www.stern.de,Irans geistliches Oberhaupt Chamenei bei massiven Angriffen der USA und Israels getötet,"Ayatollah Ali Chamenei bestimmte mehr als 30 Jahre lang die Geschicke des Iran, nun wurde er bei massiven US-israelischen Luftangriffen getötet: Das iranische Staatsfernsehen hat am Sonntag den Tod des 86-Jährigen bestätigt. US-Präsident Donald Trump erklärte…",https://image.stern.de/37180396/t/2w/v1/w1440/r1.7778/-/01--irans-geistliches-oberhaupt-ali-chamenei---df33b5866ca362ad.jpg,2026-03-01T04:58:13Z,,"Kopiere den aktuellen Link
Zur Merkliste hinzufügen
Ayatollah Ali Chamenei bestimmte mehr als 30 Jahre lang die Geschicke des Iran, nun wurde er bei massiven US-israelischen Luftangriffen getötet: … [+5753 chars]",,de,'Russland'
https://www.welt.de/politik/ausland/article699bef01ee35d0f0647c4345/ukraine-krieg-belgien-kapert-tanker-der-russischen-schattenflotte-liveticker.html,https://www.welt.de/politik/ausland/article699bef01ee35d0f0647c4345/ukraine-krieg-belgien-kapert-tanker-der-russischen-schattenflotte-liveticker.html,0,www.welt.de,Belgien kapert Tanker der russischen Schattenflotte,"Bundeskanzler Friedrich Merz steht Gesprächen mit dem Kreml grundsätzlich offen gegenüber, sagt er. Derzeit seien solche Formate angesichts der russischen Kriegsführung aber sinnlos. Und: Rund um das Atomkraftwerk Saporischschja soll eine Waffenruhe gelten. M…",https://images.welt.de/699bef01ee35d0f0647c4345/f70f4d7d153cd291194ca0718cd66a2d/ci16x9-w1200/260301-belgium-schattenflotte-jpeg,2026-03-01T05:12:00Z,,Belgien hat einen Tanker der russischen Schattenflotte gekapert. Das Schiff soll in den Hafen von Seebrügge geschleppt werden. Frankreich unterstützte die Operation. Mehr im Liveticker.Die Ukraine se… [+19007 chars],,de,'Atomkraft'
https://www.faz.net/aktuell/wirtschaft/brauche-ich-eine-waermepumpe-accg-110845271.html,https://www.faz.net/aktuell/wirtschaft/brauche-ich-eine-waermepumpe-accg-110845271.html,0,www.faz.net,Heizungsfrage: Funktioniert die Wärmepumpe sogar im Fachwerkhaus?,"Gasheizungen bleiben erlaubt. Der Eigentümer eines Fachwerkhauses fragt sich, was jetzt besser ist – eine Wärmepumpe oder doch die Grüngasheizung?",https://media0.faz.net/image/w1200h627/4dccc5fe17d7/w3000h1567x0y152o/202412/43601.0.741662566/fachwerkhaeuser-praegen-das.webp,2026-03-01T08:16:30Z,,Wie wollen wir in Zukunft heizen? Darüber machen sich in Deutschland nicht nur Millionen Haushalte mit teilweise hochbetagten Öl- und Gasheizungen Gedanken. Auch die schwarz-rote Bundesregierung hat … [+224 chars],,de,'Gas'
https://www.zeit.de/news/2026-03/01/angriff-an-afd-stand-kandidat-fuer-kommunalwahl-verletzt,https://www.zeit.de/news/2026-03/01/angriff-an-afd-stand-kandidat-fuer-kommunalwahl-verletzt,0,www.zeit.de,Kommunalwahl: Angriff an AfD-Stand – Kandidat für Kommunalwahl verletzt,Hier finden Sie Informationen zu dem Thema „Kommunalwahl“. Lesen Sie jetzt „Angriff an AfD-Stand – Kandidat für Kommunalwahl verletzt“.,https://img.zeit.de/news/2026-03/01/angriff-an-afd-stand-kandidat-fuer-kommunalwahl-verletzt-image-group/wide__1300x731,2026-03-01T11:12:43Z,,Ein AfD-Kandidat ist nach Angaben der Polizei an einem Infostand zur Kommunalwahl in Oberbayern angegriffen und verletzt worden. Drei junge Leute seien nach einem verbalen Streit an dem Stand in Rose… [+475 chars],,de,'Angriff'
https://www.stern.de/news/afp-auswertung--besonders-viele-naechtliche-russische-raketenangriffe-auf-ukraine-im-februar-37181254.html,https://www.stern.de/news/afp-auswertung--besonders-viele-naechtliche-russische-raketenangriffe-auf-ukraine-im-februar-37181254.html,0,www.stern.de,AFP-Auswertung: Besonders viele nächtliche russische Raketenangriffe auf Ukraine im Februar,"Russland hat im vergangenen Monat so viele nächtliche Raketenangriffe auf die Ukraine verübt wie seit mindestens drei Jahren nicht mehr. Ziel der 288 im Februar abgefeuerten Raketen war vor allem die Energieinfrastruktur, wie eine am Sonntag veröffentlichte A…",https://image.stern.de/37181256/t/6U/v1/w1440/r1.7778/-/01--graffiti-eines-soldaten-in-kiew---a09681c92253cfdc.jpg,2026-03-01T13:31:50Z,,"Kopiere den aktuellen Link
Zur Merkliste hinzufügen
Russland hat im vergangenen Monat so viele nächtliche Raketenangriffe auf die Ukraine verübt wie seit mindestens drei Jahren nicht mehr. Ziel der… [+2353 chars]",,de,'Ukraine'
https://www.zeit.de/news/2026-03/01/demonstrationen-in-hannover-nach-angriff-auf-den-iran,https://www.zeit.de/news/2026-03/01/demonstrationen-in-hannover-nach-angriff-auf-den-iran,0,www.zeit.de,Kundgebungen: Demonstrationen in Hannover nach Angriff auf den Iran,Hier finden Sie Informationen zu dem Thema „Kundgebungen“. Lesen Sie jetzt „Demonstrationen in Hannover nach Angriff auf den Iran“.,https://img.zeit.de/news/2026-03/01/demonstrationen-in-hannover-nach-angriff-auf-den-iran-image-group/wide__1300x731,2026-03-01T15:01:46Z,,Dutzende Menschen sind nach dem Angriff Israels und der USA auf den Iran auch in Hannover zu mehreren Demonstrationen auf die Straße gegangen. Für heute Nachmittag hatte eine Privatperson eine Versam… [+1521 chars],,de,'Angriff'
https://www.zeit.de/news/2026-03/02/israels-armee-meldet-angriff-aus-dem-libanon,https://www.zeit.de/news/2026-03/02/israels-armee-meldet-angriff-aus-dem-libanon,0,www.zeit.de,Nahost: Israels Armee meldet Angriff aus dem Libanon,Hier finden Sie Informationen zu dem Thema „Nahost“. Lesen Sie jetzt „Israels Armee meldet Angriff aus dem Libanon“.,https://img.zeit.de/news/2026-03/02/israels-armee-meldet-angriff-aus-dem-libanon-image-group/wide__1300x731,2026-03-01T23:27:08Z,,"Israel ist nach Angaben des Militärs aus dem nördlichen Nachbarland Libanon beschossen worden. In der Nacht heulten in mehreren Gebieten im Norden Israels die Sirenen, nachdem Geschosse aus dem Liban… [+605 chars]",,de,'Angriff'
https://www.zeit.de/news/2026-03/02/russland-will-weiter-mit-usa-im-ukraine-krieg-verhandeln,https://www.zeit.de/news/2026-03/02/russland-will-weiter-mit-usa-im-ukraine-krieg-verhandeln,0,www.zeit.de,Krieg in der Ukraine: Russland will weiter mit USA im Ukraine-Krieg verhandeln,Hier finden Sie Informationen zu dem Thema „Krieg in der Ukraine“. Lesen Sie jetzt „Russland will weiter mit USA im Ukraine-Krieg verhandeln“.,https://img.zeit.de/news/2026-03/02/russland-will-weiter-mit-usa-im-ukraine-krieg-verhandeln-image-group/wide__1300x731,2026-03-02T11:12:24Z,,Moskau bleibt nach Kremlangaben ungeachtet seiner Kritik an den US-Angriffen auf den Iran offen für eine Vermittlerrolle Washingtons im russischen Angriffskrieg gegen die Ukraine. «Wir schätzen weite… [+1657 chars],,de,'Russland'
https://www.zeit.de/news/2026-03/02/wirtschaft-fuerchtet-hoehere-energiepreise-und-lieferstoerungen,https://www.zeit.de/news/2026-03/02/wirtschaft-fuerchtet-hoehere-energiepreise-und-lieferstoerungen,0,www.zeit.de,Angriff auf den Iran: Wirtschaft fürchtet höhere Energiepreise und Lieferstörungen,Hier finden Sie Informationen zu dem Thema „Angriff auf den Iran“. Lesen Sie jetzt „Wirtschaft fürchtet höhere Energiepreise und Lieferstörungen“.,https://img.zeit.de/news/2026-03/02/wirtschaft-fuerchtet-hoehere-energiepreise-und-lieferstoerungen-image-group/wide__1300x731,2026-03-02T11:53:38Z,,"Der Angriff der USA und Israels auf den Iran wird nach Einschätzung der bayerischen Wirtschaft Folgeschäden für die heimischen Unternehmen nach sich ziehen. Neben einem Anstieg der Öl-, Benzin- und G… [+1509 chars]",,de,'Gas'
https://www.zeit.de/news/2026-03/02/mini-atomkraftwerke-rwe-chef-krebber-ist-skeptisch,https://www.zeit.de/news/2026-03/02/mini-atomkraftwerke-rwe-chef-krebber-ist-skeptisch,0,www.zeit.de,Atomkraft: Mini-Atomkraftwerke? RWE-Chef Krebber ist skeptisch,Hier finden Sie Informationen zu dem Thema „Atomkraft“. Lesen Sie jetzt „Mini-Atomkraftwerke? RWE-Chef Krebber ist skeptisch“.,https://img.zeit.de/news/2026-03/02/mini-atomkraftwerke-rwe-chef-krebber-ist-skeptisch-image-group/wide__1300x731,2026-03-02T12:02:50Z,,"Der Chef von Deutschlands größtem Stromerzeuger RWE, Markus Krebber, hält Investitionen in kleine Atomreaktoren (SMR) derzeit für wirtschaftlich nicht vertretbar. «Wir sind ein technologieoffenes Unt… [+2529 chars]",,de,'Klima'
https://www.stern.de/wirtschaft/news/folgen-fuer-die-wirtschaft--iran-krieg-trifft-deutschland--sprit-und-gas-deutlich-teurer-37183546.html,https://www.stern.de/wirtschaft/news/folgen-fuer-die-wirtschaft--iran-krieg-trifft-deutschland--sprit-und-gas-deutlich-teurer-37183546.html,0,www.stern.de,Folgen für die Wirtschaft: Iran-Krieg trifft Deutschland: Sprit und Gas deutlich teurer,Der Irankonflikt hat Folgen für Verbraucher und Wirtschaft - von steigenden Kosten für Heizen und Tanken über sinkende Aktienkurse bis Sorgen um die Konjunktur. Viel hängt von der Dauer des Kriegs ab.,https://image.stern.de/37183790/t/9r/v1/w1440/r1.7778/-/02--qod5shm4n3v1axs2048jpeg---2c09ea15c4e45baf.jpg,2026-03-02T12:39:30Z,,"Kopiere den aktuellen Link
Zur Merkliste hinzufügen
Der Irankonflikt hat Folgen für Verbraucher und Wirtschaft - von steigenden Kosten für Heizen und Tanken über sinkende Aktienkurse bis Sorgen um … [+6329 chars]",,de,'Heizen'
https://www.zeit.de/news/2026-03/02/luxuswagen-illegal-nach-russland-verkauft-sechs-jahre-haft,https://www.zeit.de/news/2026-03/02/luxuswagen-illegal-nach-russland-verkauft-sechs-jahre-haft,0,www.zeit.de,Illegale Geschäfte: Luxuswagen illegal nach Russland verkauft - Sechs Jahre Haft,Hier finden Sie Informationen zu dem Thema „Illegale Geschäfte“. Lesen Sie jetzt „Luxuswagen illegal nach Russland verkauft - Sechs Jahre Haft“.,https://img.zeit.de/news/2026-03/02/luxuswagen-illegal-nach-russland-verkauft-sechs-jahre-haft-image-group/wide__1300x731,2026-03-02T12:41:20Z,,"Das Landgericht Würzburg hat einen Autohändler vom Untermain zu sechs Jahren Haft verurteilt, der trotz Verbots Luxusautos nach Russland verkauft haben soll. Eine mutmaßliche Komplizin des 49-Jährige… [+1899 chars]",,de,'Russland'
https://www.zeit.de/politik/ausland/2026-03/angriff-usa-iran-donald-trump-bundesregierung,https://www.zeit.de/politik/ausland/2026-03/angriff-usa-iran-donald-trump-bundesregierung,0,www.zeit.de,Angriff der USA auf den Iran: Dieser Angriff ist ein großes Unrecht,"Für den Krieg gegen den Iran hat Donald Trump keine Gründe und keinen Plan. Die Folgen wird Europa spüren. Umso fataler, wie sich die Bundesregierung wegduckt.",https://img.zeit.de/politik/ausland/2026-03/angriff-usa-iran-donald-trump-bundesregierung-bild/wide__1300x731,2026-03-02T15:08:47Z,,"Nichts wird dieser Angriff auf den Iran besser machen. Er
wird die Welt nicht sicherer machen. Er wird die Menschheit nicht von
Bösewichten und Bedrohungen befreien. Er wird Chaos zeugen, Hass säen… [+919 chars]",,de,'Angriff'
https://www.telepolis.de/article/Europas-Klima-Rueckzieher-Kippt-jetzt-der-Emissionshandel-11196468.html,https://www.telepolis.de/article/Europas-Klima-Rueckzieher-Kippt-jetzt-der-Emissionshandel-11196468.html,0,www.telepolis.de,Europas Klima-Rückzieher: Kippt jetzt der Emissionshandel?,Italien greift das Herzstück der EU-Klimapolitik an. Auch Deutschland sendet irritierende Signale. Treibt Trumps Kurs Europas De-Dekarbonisierung an?,https://heise.cloudimg.io/bound/1200x1200/q85.png-lossy-85.webp-lossy-85.foil1/_www-heise-de_/imgs/18/5/0/3/7/9/3/8/master_Decarb-24ac138c85edf514.jpg,2026-03-03T08:00:00Z,,"KI-generierte Grafik.
Italien greift das Herzstück der EU-Klimapolitik an. Auch Deutschland sendet irritierende Signale. Treibt Trumps Kurs Europas De-Dekarbonisierung an?
Die italienische Regierun… [+10090 chars]",,de,'Klima'
https://www.stern.de/wirtschaft/news/iran-krieg--spritpreis-steigt-immer-weiter---diesel-ueberholt-e10-37185878.html,https://www.stern.de/wirtschaft/news/iran-krieg--spritpreis-steigt-immer-weiter---diesel-ueberholt-e10-37185878.html,0,www.stern.de,Iran-Krieg: Spritpreis steigt immer weiter - Diesel überholt E10,"München - Der Iran-Krieg lässt die Preise für Sprit und Heizöl weiter steigen. Am Morgen setzte sich der Anstieg der vergangenen Tage fort, wie Daten",https://image.stern.de/37186208/t/AJ/v1/w1440/r1.7778/-/03--v6vfuwiwpkv5axs2048jpeg---ed7b307d4ba594e2.jpg,2026-03-03T09:15:37Z,,"Kopiere den aktuellen Link
Zur Merkliste hinzufügen
Der Krieg im Nahen Osten macht Rohöl und damit auch Tanken und Heizen teurer. Am Dienstag geht der Anstieg weiter, wie erste Daten des ADAC zeige… [+3017 chars]",,de,'Preis'
https://taz.de/Landtagswahl-in-Baden-Wuerttemberg/!6159346/,https://taz.de/Landtagswahl-in-Baden-Wuerttemberg/!6159346/,0,taz.de,Landtagswahl in Baden-Württemberg: CDU wirft Grünen nach Sexismus-Video unfairen Wahlkampf vor,Die Umfragen für die Union sind schlecht. Das Video von Spitzenkandidat Hagel vergiftet das Klima zwischen Schwarz und Grün.,https://taz.de/picture/8290297/1200/Wahlkampf-Baden-Wurttemberg-Sexismus-Video-Hagel-Ozdemir.jpeg,2026-03-03T09:37:00Z,,Die Umfragen für die Union sind schlecht. Das Video von Spitzenkandidat Hagel vergiftet das Klima zwischen Schwarz und Grün. mehr...,,de,'Klima'
https://www.welt.de/finanzen/plus69a5b2c12ecb6a0d6559e00f/wohneigentum-vermoegensinflation-macht-traum-der-buerger-immer-weniger-erschwinglich.html,https://www.welt.de/finanzen/plus69a5b2c12ecb6a0d6559e00f/wohneigentum-vermoegensinflation-macht-traum-der-buerger-immer-weniger-erschwinglich.html,0,www.welt.de,Verkannte Vermögens-Inflation – dieser Index zeigt das neue Problem der Mittelschicht,2025 übertraf die Inflation der Vermögenswerte jene der Verbraucherpreise deutlich. Eine aktuelle Studie zeigt: Der Aufbau von Vermögen wie Wohneigentum ist selbst für die Mittelschicht immer schwerer erreichbar.,https://images.welt.de/69a5b2c12ecb6a0d6559e00f/0ee0f536e2ddaebbebf8bdda460866be/ci16x9-w1200/gettyimages-1191030828-jpg,2026-03-03T12:18:35Z,,Die WELT als ePaper: Die vollständige Ausgabe steht Ihnen bereits am Vorabend zur Verfügung so sind Sie immer hochaktuell informiert. Weitere Informationen https://epaper.welt.de,,de,'Inflation'
https://www.faz.net/aktuell/wirtschaft/arm-und-reich/ig-metall-christiane-benner-ueber-teilzeit-und-krise-accg-110846927.html,https://www.faz.net/aktuell/wirtschaft/arm-und-reich/ig-metall-christiane-benner-ueber-teilzeit-und-krise-accg-110846927.html,0,www.faz.net,"Sozialstaat in der Krise: „Glaubt irgendjemand, dass sich die Krise unserer Industrie so überwinden lässt?“","Ob Rente, Teilzeit oder Sozialabgaben: IG-Metall-Chefin Christiane Benner ist genervt von polarisierendem Streit um Reformen. Statt aber nur auf die Politik zu zeigen, will ihre Gewerkschaft jetzt auch selbst die Wirtschaft stärken",https://media0.faz.net/image/w1200h627/31c31387969e/w3000h1567x0y217o/202512/43601.0.1613322013/christiane-benner-vorsitzende.webp,2026-03-03T12:52:40Z,,"Frau Benner, glauben Sie wirklich, dass es die Demokratie gefährdet, wenn man über Paragraph 8, Absatz 4 des Teilzeit- und Befristungsgesetzes diskutiert? 
Es gefährdet die Demokratie, wenn sich Men… [+14728 chars]",,de,'Krise'
https://www.stern.de/news/-rekordprofite--fuer-energiekonzerne--linken-chefin-fordert-uebergewinnsteuer-37187420.html,https://www.stern.de/news/-rekordprofite--fuer-energiekonzerne--linken-chefin-fordert-uebergewinnsteuer-37187420.html,0,www.stern.de,"""Rekordprofite"" für Energiekonzerne: Linken-Chefin fordert Übergewinnsteuer","Linken-Parteichefin Ines Schwerdtner hat sich angesichts der steigenden Preise für Öl und Gas wegen des Iran-Krieges für eine Übergewinnsteuer ausgesprochen. ""Während Familien jeden Euro umdrehen, dürfen Konzerne keine Krisenrenditen einfahren"", kritisierte S…",https://image.stern.de/37187422/t/vh/v1/w1440/r1.7778/-/03--linkenkochefin-schwerdtner---bf1b47ebb26099df.jpg,2026-03-03T13:24:15Z,,"Kopiere den aktuellen Link
Zur Merkliste hinzufügen
Linken-Parteichefin Ines Schwerdtner hat sich angesichts der steigenden Preise für Öl und Gas wegen des Iran-Krieges für eine Übergewinnsteuer au… [+1988 chars]",,de,'Preis'
https://www.zeit.de/news/2026-03/03/angriff-auf-buero-von-afd-landtagsabgeordneten,https://www.zeit.de/news/2026-03/03/angriff-auf-buero-von-afd-landtagsabgeordneten,0,www.zeit.de,Kriminalität: Angriff auf Büro von AfD-Landtagsabgeordneten,Hier finden Sie Informationen zu dem Thema „Kriminalität“. Lesen Sie jetzt „Angriff auf Büro von AfD-Landtagsabgeordneten“.,https://img.zeit.de/news/2026-03/03/angriff-auf-buero-von-afd-landtagsabgeordneten-image-group/wide__1300x731,2026-03-03T13:59:18Z,,"Das Wahlkreisbüro eines AfD-Landtagsabgeordneten ist in Sternberg (Landkreis Ludwigslust-Parchim) von einem Unbekannten beschädigt worden. Am Montagabend wurde eine Eingangstür beschädigt, wie die Po… [+578 chars]",,de,'Angriff'
https://www.teltarif.de/telekom-preiserhoehung-magentatv/news/102286.html,https://www.teltarif.de/telekom-preiserhoehung-magentatv/news/102286.html,0,www.teltarif.de,Weitere Telekom-Preiserhöhungen: Jetzt ist MagentaTV dran,Die Deutsche Telekom erhöht nach Plus- und Multikarten sowie Bestandskunden-Tarifen im Festnetz jetzt auch die Preise bei MagentaTV.,https://www.teltarif.de/img/arch/2026/kw10/telekom-preiserhoehung-magentatv-1og.jpg,2026-03-03T15:44:00Z,,"Die Deutsche Telekom hat eine Aktion gestartet, um Neukunden für MagentaTV zu gewinnen. Wer sich als Neukunde für MagentaTV Smart inter­essiert und einen Vertrag über 24 Monate Laufzeit abschließt, z… [+2167 chars]",,de,'Preis'
https://www.welt.de/videos/video69a6dae08e29d3d438222225/steigende-preise-wegen-iran-dann-haben-wir-eine-fette-erhoehung-der-inflation.html,https://www.welt.de/videos/video69a6dae08e29d3d438222225/steigende-preise-wegen-iran-dann-haben-wir-eine-fette-erhoehung-der-inflation.html,0,www.welt.de,„Dann haben wir eine fette Erhöhung der Inflation“,"Krieg führt zu steigenden Energiepreisen: Öl in Europa zwölf Prozent teurer, Gaspreis verdoppelt. Auswirkungen auf Lieferketten und Lebenshaltungskosten durch den Konflikt von Israel und USA mit Iran sind spürbar. Wirtschaftsredakteur Holger Zschäpitz ordnet …",https://images.welt.de/69a6dae08e29d3d438222225/539bc89eafe11c1eb5d71449ad157a86-master/ci16x9-w1200/dpa-com-20090101-260303-935-1190570-jpg,2026-03-03T15:50:41Z,,"Krieg führt zu steigenden Energiepreisen: Öl in Europa zwölf Prozent teurer, Gaspreis verdoppelt. Auswirkungen auf Lieferketten und Lebenshaltungskosten durch den Konflikt von Israel und USA mit Iran… [+123 chars]",,de,'Gas'
https://www.nzz.ch/wirtschaft/der-iran-krieg-kommt-an-den-schweizer-tankstellen-an-aber-am-staerksten-steigen-die-preise-fuer-heizoel-ld.1927467,https://www.nzz.ch/wirtschaft/der-iran-krieg-kommt-an-den-schweizer-tankstellen-an-aber-am-staerksten-steigen-die-preise-fuer-heizoel-ld.1927467,0,www.nzz.ch,Der Iran-Krieg kommt an den Schweizer Tankstellen an – aber am stärksten steigen die Preise für Heizöl,Der Rohstoff Erdöl hat sich wegen des Iran-Krieges deutlich verteuert. Das spüren nun auch die Konsumenten in der Schweiz.,"https://img.nzz.ch/2026/03/03/8d365760-4fbd-461f-8e25-0e02c03a5c31.jpg?width=1200&height=675&fit=bounds&quality=75&auto=webp&crop=7089,3988,x0,y117&wmark=nzz",2026-03-03T15:58:59Z,,"Der Rohstoff Erdöl hat sich wegen des Iran-Krieges deutlich verteuert. Das spüren nun auch die Konsumenten in der Schweiz.
Zusammenfassung
Merken
Schweizer Autofahrer müssen mit höheren Kosten pro… [+5343 chars]",,de,'Preis'
https://stadt-bremerhaven.de/mwc-2026-telefonica-zeigt-mobiles-5g-notfallnetz-fuer-krisengebiete/,https://stadt-bremerhaven.de/mwc-2026-telefonica-zeigt-mobiles-5g-notfallnetz-fuer-krisengebiete/,0,stadt-bremerhaven.de,MWC 2026: Telefónica zeigt mobiles 5G-Notfallnetz für Krisengebiete,"Telefónica hat auf dem Mobile World Congress 2026 in Barcelona ein System im Gepäck, das im Katastrophenfall die Kommunikation retten soll. Wenn in Krisengebieten die Infrastruktur am Boden liegt, lässt sich mit der gezeigten Lösung fix ein eigenes Netz aufzi…",https://stadt-bremerhaven.de/wp-content/uploads/2025/10/Telefonica_Logo.svg-2.jpg,2026-03-03T16:00:24Z,,"Telefónica hat auf dem Mobile World Congress 2026 in Barcelona ein System im Gepäck, das im Katastrophenfall die Kommunikation retten soll. Wenn in Krisengebieten die Infrastruktur am Boden liegt, lä… [+2076 chars]",,de,'Krise'
