index,url,valid,domain,title,description,image,published,archive,content,quote,language,keyword
https://www.zeit.de/news/2026-05/03/militaerbischof-overbeck-fuer-wehrpflicht-und-hormus-einsatz,https://www.zeit.de/news/2026-05/03/militaerbischof-overbeck-fuer-wehrpflicht-und-hormus-einsatz,0,www.zeit.de,Bundeswehr: Militärbischof Overbeck für Wehrpflicht und Hormus-Einsatz,Hier finden Sie Informationen zu dem Thema „Bundeswehr“. Lesen Sie jetzt „Militärbischof Overbeck für Wehrpflicht und Hormus-Einsatz“.,https://img.zeit.de/news/2026-05/03/militaerbischof-overbeck-fuer-wehrpflicht-und-hormus-einsatz-image-group/wide__1300x731,2026-05-03T03:00:09Z,,Der katholische Militärbischof Franz-Josef Overbeck hat sich für eine rasche Rückkehr zur Wehrpflicht ausgesprochen und plädiert für eine deutsche Beteiligung an einem möglichen Einsatz in der Straße… [+3765 chars],,de,'Hormus'
https://www.nzz.ch/wirtschaft/warum-feiert-die-boerse-obwohl-der-iran-krieg-das-wachstum-bremst-der-grund-ist-die-bestechende-form-der-superstarkonzerne-ld.10005107,https://www.nzz.ch/wirtschaft/warum-feiert-die-boerse-obwohl-der-iran-krieg-das-wachstum-bremst-der-grund-ist-die-bestechende-form-der-superstarkonzerne-ld.10005107,0,www.nzz.ch,"Warum feiert die Börse, obwohl der Iran-Krieg das Wachstum bremst? Der Grund ist die bestechende Form der Superstar-Konzerne","Die Investoren lassen sich von der Hoffnung treiben, dass die künstliche Intelligenz auf Dauer höhere Gewinne ermöglicht. Bis jetzt geht die Rechnung auf.","https://img-msp-prod.nzz.ch/2026/04/29/f463077a-f919-4a24-a087-b6a414bdba7b.jpg?width=1200&height=675&fit=bounds&quality=75&auto=webp&crop=4000,2250,x0,y454&wmark=nzz",2026-05-03T03:30:00Z,,"Die Investoren lassen sich von der Hoffnung treiben, dass die künstliche Intelligenz auf Dauer höhere Gewinne ermöglicht. Bis jetzt geht die Rechnung auf.
Zusammenfassung
Merken
Eingang der New Yo… [+3484 chars]",,de,'Iran'
https://www.bild.de/news/wetter/der-kaelteeinbruch-kommt-frueher-wie-eisig-werden-die-eisheiligen-wirklich-69f5c2626fe2dee7bfb1062d,https://www.bild.de/news/wetter/der-kaelteeinbruch-kommt-frueher-wie-eisig-werden-die-eisheiligen-wirklich-69f5c2626fe2dee7bfb1062d,0,www.bild.de,Der Kälteeinbruch kommt früher - Wie eisig werden die Eisheiligen wirklich?,Mai-Verderber im Anmarsch: In diesem Jahr rückt das Wetterphänomen deutlich früher an.,"https://images.bild.de/69f5c2626fe2dee7bfb1062d/bbd3217c9ec62a01517558d68a1cad41,b91f3a8a?w=1280",2026-05-03T05:39:18Z,,"TTS-Player überspringenArtikel weiterlesenBerlin Sie haben unzählige Obstblüten, Jungpflanzen und Frühlingsgefühle auf dem Gewissen, aber das ist diesen ungebetenen Gästen piepegal. Die Eisheiligen s… [+2629 chars]",,de,'Kälte'
https://www.zeit.de/2026/19/heuschnupfen-klimawandel-pollenflug-allergie-pflanzen,https://www.zeit.de/2026/19/heuschnupfen-klimawandel-pollenflug-allergie-pflanzen,0,www.zeit.de,Heuschnupfen: Klima? Hatschi!,"Durch die Erderwärmung steigt die Pollenbelastung. Eine internationale Studie zeigt, woran das liegt.",https://img.zeit.de/2026/19/klima-hatschi-bild-2/wide__1300x731,2026-05-03T07:03:21Z,,"Gute Nachrichten für die Papiertaschentuch-herstellende Industrie: Künftig gilt es, Schnupfen und Schnodder in ungeahnten Mengen aufzufangen. Ihrem Schnäuz-Zubehör ist eine goldene Zukunft gewiss, je… [+456 chars]",,de,'Klima'
https://www.zeit.de/news/2026-05/03/dritte-pleite-in-serie-fck-schlittert-weiter-in-die-krise,https://www.zeit.de/news/2026-05/03/dritte-pleite-in-serie-fck-schlittert-weiter-in-die-krise,0,www.zeit.de,2. Bundesliga: Dritte Pleite in Serie: FCK schlittert weiter in die Krise,Hier finden Sie Informationen zu dem Thema „2. Bundesliga“. Lesen Sie jetzt „Dritte Pleite in Serie: FCK schlittert weiter in die Krise“.,https://img.zeit.de/news/2026-05/03/dritte-pleite-in-serie-fck-schlittert-weiter-in-die-krise-image-group/wide__1300x731,2026-05-03T07:50:24Z,,Bei der Pressekonferenz vor der Partie des Fußball-Zweitligisten 1. FC Kaiserslautern bei Dynamo Dresden am vergangenen Donnerstag hatte FCK-Trainer Torsten Lieberknecht Gerüchte über Differenzen zwi… [+1997 chars],,de,'Krise'
https://www.focus.de/finanzen/vae-wollen-strasse-von-hormus-umgehen-mit-spezial-pipeline_6f66fa27-85be-46f1-987a-8b70c8d9528a.html,https://www.focus.de/finanzen/vae-wollen-strasse-von-hormus-umgehen-mit-spezial-pipeline_6f66fa27-85be-46f1-987a-8b70c8d9528a.html,0,www.focus.de,VAE wollen Straße von Hormus umgehen – mit Spezial-Pipeline,Die Vereinigten Arabischen Emirate könnten eine wichtige Rolle bei der Umgehung der Straße von Hormus spielen. Entscheidend ist der Hafen Fudschaira.,"https://quadro.burda-forward.de/ctf/e5466ba1-c80f-4d98-832e-1942c7df8272.2884a1cc-f94e-4fe5-9ace-22ec06a1d367.jpg?im=RegionOfInterestCrop=(1200,630),regionOfInterest=(1803,1075)&hash=230dab749dec288e2f19cc608a8c927456e7a70ba4230e964043f99d6a240fd6",2026-05-03T10:46:00Z,,"Der Hafen Fudschaira liegt östlich der Straße von Hormus am Golf von Oman. Vor dem Krieg ging etwa die Hälfte der Ölexporte der VAE per Habshan-Pipeline nach Fudschaira: 1,8 Millionen Barrel pro Tag … [+2939 chars]",,de,'Hormus'
https://www.dw.com/de/jahre-nach-frauenprotesten-wird-im-iran-weitere-hinrichtung-vollstreckt/a-77023649,https://www.dw.com/de/jahre-nach-frauenprotesten-wird-im-iran-weitere-hinrichtung-vollstreckt/a-77023649,0,www.dw.com,Iran: Erneute Hinrichtung nach Protesten von 2022,"Im Iran ebbt die Welle von Hinrichtungen nicht ab. Nun wurde ein Todesurteil vollstreckt, das im Zusammenhang mit den Protesten nach dem Tod der jungen Kurdin Jina Mahsa Amini vor mehr als drei Jahren steht.",https://static.dw.com/image/63644400_6.jpg,2026-05-03T11:14:00Z,,"Mehrab Abdollahsadeh wurde zur Last gelegt, bei den damaligen blutigen Protesten in der nordwestlichen Stadt Urmia im Iran eine Sicherheitskraft getötet zu haben. Das berichteten iranische Staatsmedi… [+1626 chars]",,de,'Iran'
https://www.focus.de/finanzen/boerse/wir-muessen-uns-auf-das-worst-case-szenario-vorbereiten_c411c1ff-ed40-4d73-ac0f-c24765e6bb00.html,https://www.focus.de/finanzen/boerse/wir-muessen-uns-auf-das-worst-case-szenario-vorbereiten_c411c1ff-ed40-4d73-ac0f-c24765e6bb00.html,0,www.focus.de,„Wir müssen uns auf das Worst-Case-Szenario vorbereiten”,Europäer müssen eventuell ihre Sommerreisepläne überdenken: Die Blockade der Straße von Hormus verteuert Kerosin und zwingt Airlines zu Einschnitten. Was macht die EU?,"https://quadro.burda-forward.de/ctf/0c17f310-2d43-484d-8c93-9de3503a6bd4.1ceaf5ab-949f-4372-869c-1e7f4d1f18da.png?im=RegionOfInterestCrop=(1200,630),regionOfInterest=(600,338)&hash=dcbc09031acc777ccfc5ae6476b841a68b3f26881c19106916494b3fe4b1d0bc",2026-05-03T11:30:00Z,,"Die Kerosinpreise haben sich verdoppelt, seit die USA und Israel den Iran erstmals im Februar angegriffen haben. Der Grund: Sowohl der Iran als auch die USA haben zu unterschiedlichen Zeitpunkten die… [+7068 chars]",,de,'Iran'
https://www.stern.de/politik/ausland/iran-krieg--trump-prueft-neuen-iran-plan---drohung-bleibt-bestehen-37363058.html,https://www.stern.de/politik/ausland/iran-krieg--trump-prueft-neuen-iran-plan---drohung-bleibt-bestehen-37363058.html,0,www.stern.de,Iran-Krieg: Trump prüft neuen Iran-Plan - Drohung bleibt bestehen,Über zwei Monate nach Kriegsbeginn liegt ein neuer iranischer Vorschlag für ein Ende des Konflikts auf dem Tisch. Donald Trump will diesen prüfen - macht aber zugleich wenig Hoffnung auf Frieden.,https://image.stern.de/37364134/t/Pd/v1/w1440/r1.7778/-/03--2iyg4pt3s5v1axs2048jpeg---a8c18470ee371370.jpg,2026-05-03T11:44:39Z,,"Kopiere den aktuellen Link
Zur Merkliste hinzufügen
Über zwei Monate nach Kriegsbeginn liegt ein neuer iranischer Vorschlag für ein Ende des Konflikts auf dem Tisch. Donald Trump will diesen prüfen… [+5228 chars]",,de,'Iran'
https://www.stern.de/news/neue-gegenseitige-drohungen-im-ringen-um-ende-des-iran-kriegs-37364156.html,https://www.stern.de/news/neue-gegenseitige-drohungen-im-ringen-um-ende-des-iran-kriegs-37364156.html,0,www.stern.de,Neue gegenseitige Drohungen im Ringen um Ende des Iran-Kriegs,"Im Ringen um ein Ende des Iran-Krieges zeichnet sich weiter kein Durchbruch ab. US-Präsident Donald Trump erklärte am Samstag (Ortszeit) mit Blick auf einen weiteren Verhandlungsvorschlag aus Teheran, er könne sich ""nicht vorstellen, dass er annehmbar wäre"". …",https://image.stern.de/37364158/t/Up/v1/w1440/r1.7778/-/03--trump---1a77a63444a54482.jpg,2026-05-03T11:49:18Z,,"Kopiere den aktuellen Link
Zur Merkliste hinzufügen
Im Ringen um ein Ende des Iran-Krieges zeichnet sich weiter kein Durchbruch ab. US-Präsident Donald Trump erklärte am Samstag (Ortszeit) mit Blic… [+4476 chars]",,de,'Iran'
https://www.stern.de/wirtschaft/news/erdoel--opec--hebt-oelproduktions-ziel-weiter-an---nun-ohne-emirate-37364194.html,https://www.stern.de/wirtschaft/news/erdoel--opec--hebt-oelproduktions-ziel-weiter-an---nun-ohne-emirate-37364194.html,0,www.stern.de,Erdöl: Opec+ hebt Ölproduktions-Ziel weiter an - nun ohne Emirate,Wichtige Förderländer wollen den Ölhahn weiter aufdrehen - doch nun sind sie nur noch zu siebt. Wichtiger als ihre jüngste Entscheidung wiegen aber die Probleme an der Meeresenge von Hormus.,https://image.stern.de/37364196/t/FN/v1/w1440/r1.7778/-/03--usdipcwvzov4axs2048jpeg---67808bc26b185971.jpg,2026-05-03T12:15:59Z,,"Kopiere den aktuellen Link
Zur Merkliste hinzufügen
Wichtige Förderländer wollen den Ölhahn weiter aufdrehen - doch nun sind sie nur noch zu siebt. Wichtiger als ihre jüngste Entscheidung wiegen ab… [+1509 chars]",,de,'Erdöl'
https://www.zeit.de/news/2026-05/03/opec-hebt-oelproduktions-ziel-weiter-an-nun-ohne-emirate,https://www.zeit.de/news/2026-05/03/opec-hebt-oelproduktions-ziel-weiter-an-nun-ohne-emirate,0,www.zeit.de,Erdöl: Opec+ hebt Ölproduktions-Ziel weiter an - nun ohne Emirate,Hier finden Sie Informationen zu dem Thema „Erdöl“. Lesen Sie jetzt „Opec+ hebt Ölproduktions-Ziel weiter an - nun ohne Emirate“.,https://img.zeit.de/news/2026-05/03/opec-hebt-oelproduktions-ziel-weiter-an-nun-ohne-emirate-image-group/wide__1300x731,2026-05-03T12:15:59Z,,Die Ölförderstaaten der Gruppe Opec+ setzen nach dem Austritt der Vereinigten Arabischen Emirate ihre Strategie der schrittweisen Produktionserhöhung fort. Eine Kerngruppe aus nunmehr sieben Ländern … [+1302 chars],,de,'Erdöl'
https://www.tagesspiegel.de/wirtschaft/erdol-opec-hebt-olproduktions-ziel-weiter-an-nun-ohne-emirate-15551226.html,https://www.tagesspiegel.de/wirtschaft/erdol-opec-hebt-olproduktions-ziel-weiter-an-nun-ohne-emirate-15551226.html,0,www.tagesspiegel.de,Erdöl: Opec+ hebt Ölproduktions-Ziel weiter an - nun ohne Emirate,Wichtige Förderländer wollen den Ölhahn weiter aufdrehen - doch nun sind sie nur noch zu siebt. Wichtiger als ihre jüngste Entscheidung wiegen aber die Probleme an der Meeresenge von Hormus.,https://www.tagesspiegel.de/images/15551225/alternates/BASE_16_9_W1400/1777810616000/iran-krieg-stra-e-von-hormus.jpeg,2026-05-03T12:16:56Z,,Die Ölförderstaaten der Gruppe Opec+ setzen nach dem Austritt der Vereinigten Arabischen Emirate ihre Strategie der schrittweisen Produktionserhöhung fort. Eine Kerngruppe aus nunmehr sieben Ländern … [+1358 chars],,de,'Erdöl'
https://www.zeit.de/wirtschaft/2026-05/opec-erdoel-foerderquote-austritt-vereinigte-arabische-emirate-gxe,https://www.zeit.de/wirtschaft/2026-05/opec-erdoel-foerderquote-austritt-vereinigte-arabische-emirate-gxe,0,www.zeit.de,Erdöl: Opec-Staaten beschließen erneut erhöhte Ölproduktion,Sieben Opec-Staaten setzen nach dem Austritt der Vereinigten Arabischen Emirate ihre Strategie der Produktionserhöhung fort: Im Juni wollen sie täglich mehr Öl fördern.,https://img.zeit.de/wirtschaft/2026-05/opec-erdoel-foerderquote-austritt-vereinigte-arabische-emirate-bild/wide__1300x731,2026-05-03T13:33:59Z,,"Nach dem überraschenden Austritt der Vereinigten Arabischen Emirate aus der Opec+ haben sieben führende Mitgliedsländer ihre Ölförderquote erhöht: Saudi-Arabien, Russland und fünf weitere Förderlände… [+3795 chars]",,de,'Erdöl'
https://www.zeit.de/news/2026-05/04/trump-usa-wollen-ab-montag-feststeckenden-schiffen-helfen,https://www.zeit.de/news/2026-05/04/trump-usa-wollen-ab-montag-feststeckenden-schiffen-helfen,0,www.zeit.de,Iran-Krieg: Trump: USA wollen ab Montag feststeckenden Schiffen helfen,Hier finden Sie Informationen zu dem Thema „Iran-Krieg“. Lesen Sie jetzt „Trump: USA wollen ab Montag feststeckenden Schiffen helfen“.,https://img.zeit.de/news/2026-05/04/trump-usa-wollen-ab-montag-feststeckenden-schiffen-helfen-image-group/wide__1300x731,2026-05-03T22:33:32Z,,"Die USA wollen nach Angaben von Präsident Donald Trump an diesem Montag eine Initiative starten, um Schiffen zu helfen, die wegen der Blockade der Straße von Hormus feststecken. Länder aus der ganzen… [+4080 chars]",,de,'Iran'
https://www.bild.de/leben-wissen/auto/kaugummi-im-autositz-effektiv-entfernen-69f30b6a6ae0ff2bebbd3674,https://www.bild.de/leben-wissen/auto/kaugummi-im-autositz-effektiv-entfernen-69f30b6a6ae0ff2bebbd3674,0,www.bild.de,Diese Hausmittel helfen - So entfernen Sie Kaugummi aus dem Autositz,"Kälte und Essig helfen, hartnäckige Kaugummireste schonend aus Autositzen zu entfernen. Tipps für Stoff- und Ledersitze.","https://images.bild.de/69f30b6a6ae0ff2bebbd3674/f58789205a90249040159885a4290e98,4b18b311?w=1280",2026-05-04T05:31:20Z,,"TTS-Player überspringenArtikel weiterlesenEin Kaugummi im Autositz kann den schönsten Tag ruinieren.Doch mit ein paar Tricks lässt sich das klebrige Malheur beheben!
Der Schlüssel zur Entfernung ist… [+940 chars]",,de,'Kälte'
https://www.stern.de/kultur/tv/40-jahre--fernsehgarten---so-feiert-andrea-kiewel-die-jubilaeums-staffel-im-zdf-37365198.html,https://www.stern.de/kultur/tv/40-jahre--fernsehgarten---so-feiert-andrea-kiewel-die-jubilaeums-staffel-im-zdf-37365198.html,0,www.stern.de,"ZDF-Fernsehgarten: 40 Jahre ""Fernsehgarten"": So feiert Andrea Kiewel die Jubiläums-Staffel im ZDF","Ein Kultformat feiert großes Jubiläum: Seit 40 Jahren unterhält der ""ZDF-Fernsehgarten"" sein Publikum mit einer einzigartigen TV-Mixtur. Gastgeberin Andrea Kiewel begeht die Jubiläumsstaffel angemessen mit bester Unterhaltung und allerlei Überraschungen.",https://image.stern.de/37365194/t/Kl/v1/w1440/r1.7778/-/zdf-fernsehgarten--1-.jpg,2026-05-04T06:00:04Z,,"Kopiere den aktuellen Link
Zur Merkliste hinzufügen
Ein Kultformat feiert großes Jubiläum: Seit 40 Jahren unterhält der ""ZDF-Fernsehgarten"" sein Publikum mit einer einzigartigen TV-Mixtur. Gastgebe… [+3790 chars]",,de,'Kälte'
https://www.faz.net/aktuell/politik/ausland/strasse-von-hormus-iran-gegen-trumps-projekt-freiheit-200795458.html,https://www.faz.net/aktuell/politik/ausland/strasse-von-hormus-iran-gegen-trumps-projekt-freiheit-200795458.html,0,www.faz.net,Straße von Hormus: Iran stellt sich Trumps „Projekt Freiheit“ entgegen,"Donald Trump stellt Handelsschiffen eine sichere Durchfahrt durch die Straße von Hormus in Aussicht. Iran will das verhindern – und behauptet, ein US-Schiff angegriffen zu haben.",https://media0.faz.net/image/w1200h627/8135bd65dbd5/w6000h3135x0y338o/202605/43601.0.2046027805/oeltanker-am-4-mai-in-der.webp,2026-05-04T12:25:28Z,,"Seinen jüngsten Versuch, Iran die Kontrolle über die Straße von Hormus zu entreißen, hat Donald Trump Projekt Freiheit getauft. Das US-Militär soll Handelsschiffen eine sichere Durchfahrt durch die M… [+5863 chars]",,de,'Hormus'
https://www.zeit.de/politik/ausland/2026-05/zwei-us-kriegsschiffe-durchfahren-nach-us-angaben-strasse-von-hormus,https://www.zeit.de/politik/ausland/2026-05/zwei-us-kriegsschiffe-durchfahren-nach-us-angaben-strasse-von-hormus,0,www.zeit.de,Zwei US-Kriegsschiffe durchfahren nach US-Angaben Straße von Hormus,Lesen Sie jetzt „Zwei US-Kriegsschiffe durchfahren nach US-Angaben Straße von Hormus“.,https://img.zeit.de/administratives/eilmeldung/fallback-bild/wide__1300x731,2026-05-04T13:30:24Z,,"Schließen
Artikelzusammenfassung
Die US-Marine startet Befreiungsaktion für festsitzende Schiffe im Persischen Golf. US-Zerstörer durchqueren die Straße von Hormus, so das Regionalkommando Centcom.… [+271 chars]",,de,'Hormus'
https://www.faz.net/aktuell/politik/ausland/liveblog-iran-krieg-us-armee-amerikanische-kriegsschiffe-durchfahren-strasse-von-hormus-faz-200583539.html,https://www.faz.net/aktuell/politik/ausland/liveblog-iran-krieg-us-armee-amerikanische-kriegsschiffe-durchfahren-strasse-von-hormus-faz-200583539.html,0,www.faz.net,Liveblog Irankrieg: US-Armee: Amerikanische Kriegsschiffe durchfahren Straße von Hormus,CENTCOM: Zerstörer nun im Persischen Golf +++ Iranische Medien melden Vorfall mit US-Kriegsschiff +++ US-Initiative „Projekt Freiheit“ in der Straße von Hormus +++ alle Entwicklungen im Liveblog,https://media0.faz.net/image/w1200h627/a451b78052e4/w5500h2873x0y111o/202605/43601.0.2045735304/schiffe-am-4-mai-in-der.webp,2026-05-04T13:47:25Z,,"Iranische Streitkräfte wollen US-Verbände daran gehindert haben, in die Straße von Hormus einzufahren. Durch Warnungen seien die feindlichen Zerstörer an der Einfahrt gehindert worden, berichtete die… [+1369 chars]",,de,'Hormus'
https://www.zeit.de/news/2026-05/04/minenjagdboot-fulda-mit-ziel-mittelmeer-gestartet,https://www.zeit.de/news/2026-05/04/minenjagdboot-fulda-mit-ziel-mittelmeer-gestartet,0,www.zeit.de,Straße von Hormus: Minenjagdboot «Fulda» mit Ziel Mittelmeer gestartet,Hier finden Sie Informationen zu dem Thema „Straße von Hormus“. Lesen Sie jetzt „Minenjagdboot «Fulda» mit Ziel Mittelmeer gestartet“.,https://img.zeit.de/news/2026-05/04/minenjagdboot-fulda-mit-ziel-mittelmeer-gestartet-image-group/wide__1300x731,2026-05-04T14:09:22Z,,Im Vorgriff auf einen möglichen Einsatz in der Straße von Hormus ist das Minenjagdboot «Fulda» der Deutschen Marine von Kiel aus in Richtung Mittelmeer unterwegs. Begleitet von den Klängen des Marine… [+3010 chars],,de,'Hormus'
https://www.zeit.de/news/2026-05/04/umweltminister-beraten-zu-wasser-klima-und-co,https://www.zeit.de/news/2026-05/04/umweltminister-beraten-zu-wasser-klima-und-co,0,www.zeit.de,"Umweltministerkonferenz: Umweltminister beraten zu Wasser, Klima und Co","Hier finden Sie Informationen zu dem Thema „Umweltministerkonferenz“. Lesen Sie jetzt „Umweltminister beraten zu Wasser, Klima und Co“.",https://img.zeit.de/news/2026-05/04/umweltminister-beraten-zu-wasser-klima-und-co-image-group/wide__1300x731,2026-05-04T14:15:15Z,,"Vom Schutz der Meere bis zum Verbot von Einweg-E-Zigaretten, von Gipsrecycling bis zu Risiken der Wasserversorgung: Die Umweltminister von Bund und Länder haben sich für ihre Frühjahrstagung in Leipz… [+965 chars]",,de,'Klima'
https://www.zeit.de/news/2026-05/04/minenjagdboot-fulda-unterwegs-ins-mittelmeer,https://www.zeit.de/news/2026-05/04/minenjagdboot-fulda-unterwegs-ins-mittelmeer,0,www.zeit.de,Straße von Hormus: Minenjagdboot «Fulda» unterwegs ins Mittelmeer,Hier finden Sie Informationen zu dem Thema „Straße von Hormus“. Lesen Sie jetzt „Minenjagdboot «Fulda» unterwegs ins Mittelmeer“.,https://img.zeit.de/news/2026-05/04/minenjagdboot-fulda-unterwegs-ins-mittelmeer-image-group/wide__1300x731,2026-05-04T14:42:25Z,,Im Vorgriff auf einen möglichen Einsatz in der Straße von Hormus ist das Minenjagdboot «Fulda» der Deutschen Marine von Kiel aus in Richtung Mittelmeer unterwegs. Verabschiedet von Angehörigen und be… [+4101 chars],,de,'Hormus'
https://www.zeit.de/wissen/2026-05/erderwaermung-mikroplastik-klimawandel-sonnenlicht-studie,https://www.zeit.de/wissen/2026-05/erderwaermung-mikroplastik-klimawandel-sonnenlicht-studie,0,www.zeit.de,Erderwärmung: Wie Mikroplastik das Klima aufheizen,Winzige bunte Plastikpartikel schweben in der Atmosphäre – und absorbieren Sonnenlicht. Eine neue Studie zeigt: Ihr Erwärmungseffekt ist überraschend groß.,https://img.zeit.de/wissen/2026-05/erderwaermung-mikroplastik-klimawandel-sonnenlicht-studie-bild/wide__1300x731,2026-05-04T15:18:53Z,,"Schließen
Artikelzusammenfassung
Der Great Pacific Garbage Patch im Pazifik ist ein Symbol für die Plastikverschmutzung, aber auch für die bisher unterschätzte Wirkung von Mikroplastik auf den Klim… [+758 chars]",,de,'Klima'
https://www.tagesschau.de/ausland/asien/strasse-von-hormus-schiffe-104.html,https://www.tagesschau.de/ausland/asien/strasse-von-hormus-schiffe-104.html,0,www.tagesschau.de,US-Zerstörer durchfahren offenbar Straße von Hormus,"Seit Monaten blockiert Iran die für den Welthandel wichtige Straße von Hormus. Die USA haben jetzt offenbar Kriegsschiffe in die Meerenge geschickt, um etwas dagegen zu tun. Ein Experte sagt: Normaler Handel sei trotzdem auf absehbare Zeit nicht möglich.",https://images.tagesschau.de/image/61dea5bb-2138-4a6d-85d9-dcab408724a7/AAABnYdRLEg/AAABnSSvrFg/16x9-big/hormus-114.jpg?width=1280,2026-05-04T15:24:40Z,,"Stand: 04.05.2026 17:24 Uhr
Seit Monaten blockiert Iran die für den Welthandel wichtige Straße von Hormus. Die USA haben jetzt offenbar Kriegsschiffe in die Meerenge geschickt, um etwas dagegen zu t… [+3586 chars]",,de,'Iran'
https://www.faz.net/aktuell/politik/ausland/liveblog-iran-krieg-grossbrand-in-arabischen-emiraten-nach-drohnenangriff-faz-200583539.html,https://www.faz.net/aktuell/politik/ausland/liveblog-iran-krieg-grossbrand-in-arabischen-emiraten-nach-drohnenangriff-faz-200583539.html,0,www.faz.net,Liveblog Irankrieg: Großbrand in Arabischen Emiraten nach Drohnenangriff,Arabische Emirate melden abgefangene Drohnen aus Iran +++ US-Armee: Amerikanische Kriegsschiffe durchfahren Straße von Hormus +++ alle Entwicklungen im Liveblog,https://media0.faz.net/image/w1200h627/71982f018e9e/w6144h3210x0y763o/202604/43601.0.1948150278/am-14-maerz-steigen-in.webp,2026-05-04T15:55:39Z,,"Iranische Streitkräfte wollen US-Verbände daran gehindert haben, in die Straße von Hormus einzufahren. Durch Warnungen seien die feindlichen Zerstörer an der Einfahrt gehindert worden, berichtete die… [+1369 chars]",,de,'Hormus'
https://www.n-tv.de/politik/Wir-haben-ein-zweites-ukrainisches-Wunder-erlebt-id30784073.html,https://www.n-tv.de/politik/Wir-haben-ein-zweites-ukrainisches-Wunder-erlebt-id30784073.html,0,www.n-tv.de,"Reisners Blick auf die Front: ""Wir haben ein zweites ukrainisches Wunder erlebt""","Russland überzieht die Urkaine weiter mit heftigen Drohnenangriffen - im März waren es so viele wie nie zuvor. Oberst Reisner spricht von einer neuen Eskalationsstufe. Doch er sieht weiter Lichtblicke, spricht gar von einem ukrainischen Wunder. Doch gewonnen …",https://www.n-tv.de/img/30784114/1777906279/Img_16_9/1200/FILE-In-this-image-taken-from-video-released-by-Gov-Veniamin-Kondratyev-s-Telegram-channel-smoke-rises-after-a-drone-attack-on-the-oil-refinery-and-terminal-in-Tuapse-Russia-Wednesday-April-29-2026-Gov.jpg,2026-05-04T16:27:18Z,,"Bei den Angriffen in der russischen Hafenstadt richteten ukrainische Drohnen schwere Schäden an. (Foto: AP)
Russland überzieht die Ukraine weiter mit heftigen Drohnenangriffen - im März waren es so … [+8237 chars]",,de,'Erdöl'
https://www.n-tv.de/politik/Russland-verliert-erstmals-seit-fast-drei-Jahren-Gebiete-in-der-Ukraine-id30785323.html,https://www.n-tv.de/politik/Russland-verliert-erstmals-seit-fast-drei-Jahren-Gebiete-in-der-Ukraine-id30785323.html,0,www.n-tv.de,120 Quadratkilometer im April: Russland verliert erstmals seit fast drei Jahren Gebiete in der Ukraine,Seit Sommer 2023 verzeichnet Russland quasi durchgängig Gebietsgewinne bei seinem Krieg in der Ukraine. In den vergangenen Monaten verlangsamt sich der Trend jedoch. Jetzt können die Truppen Kiews sogar Land zurückerobern. Dafür gibt es offenbar mehrere Gründ…,https://www.n-tv.de/img/30785333/1777926064/Img_16_9/1200/FILE-PHOTO-A-serviceman-of-the-154th-Brigade-of-the-Ukrainian-Armed-Forces-attends-a-military-exercise-between-combat-missions-amid-Russia-s-attack-on-Ukraine-in-Zaporizhzhia-region-Ukraine-April-4-2026.jpg,2026-05-04T18:55:21Z,,"Ein Soldat der 154. Brigade der ukrainischen Streitkräfte in der Region Saporischschja. (Foto: REUTERS)
Seit Sommer 2023 verzeichnet Russland quasi durchgängig Gebietsgewinne bei seinem Krieg in der… [+2692 chars]",,de,'Ukraine'
https://www.morgenpost.de/politik/article411893669/trump-stoppt-tomahawks-wie-schuetzen-wir-uns-jetzt-vor-putins-raketen.html,https://www.morgenpost.de/politik/article411893669/trump-stoppt-tomahawks-wie-schuetzen-wir-uns-jetzt-vor-putins-raketen.html,0,www.morgenpost.de,Trump stoppt Tomahawks – wie schützt sich Deutschland jetzt vor Putins Raketen?,"Aus für die Stationierung von US-Mittelstreckenraketen: Um welche Waffen es geht, wie gefährlich die Folgen sind, was Deutschland tut.",https://img.sparknews.funkemedien.de/411895890/411895890_1777910837_v16_9_1600.jpeg,2026-05-04T18:56:00Z,,"Es war ein strategisch wichtiger Schachzug des Kanzlers: Am Rande des Nato-Gipfels vereinbarte der deutsche Regierungschef mit dem US-Präsidenten, erstmals seit dem Kalten Krieg wieder weitreichende … [+11672 chars]",,de,'Waffen'
