index,url,valid,domain,title,description,image,published,archive,content,quote,language,keyword
https://www.diepresse.com/29879313/iran-hindert-oeltanker-an-durchfahrt-durch-strasse-von-hormus,https://www.diepresse.com/29879313/iran-hindert-oeltanker-an-durchfahrt-durch-strasse-von-hormus,0,www.diepresse.com,Iran hindert Öltanker an Durchfahrt durch Straße von Hormus,Iranische Streitkräfte haben Staatsmedien ⁠zufolge ⁠einen Öltanker an der Durchfahrt ​durch die Straße von Hormus gehindert.,https://img.diepresse.com/public/incoming/tsa2a2-imago-images-0858332444/alternates/WEBP_WIDE_1200/imago%20images%200858332444,2026-06-12T04:46:34Z,,"Die iranische Militärführung hatte am Donnerstag die Schließung der Meerenge für Öltanker und Handelsschiffe bekanntgegeben. Dabei drohte sie, auf jedes Schiff zu feuern, das eine Durchfahrt versuche… [+714 chars]",,de,'Iran'
https://www.zeit.de/news/2026-06/12/tankrabatt-drueckt-inflation-voruebergehend,https://www.zeit.de/news/2026-06/12/tankrabatt-drueckt-inflation-voruebergehend,0,www.zeit.de,Verbraucherpreise im Mai: Tankrabatt drückt Inflation vorübergehend,Hier finden Sie Informationen zu dem Thema „Verbraucherpreise im Mai“. Lesen Sie jetzt „Tankrabatt drückt Inflation vorübergehend“.,https://img.zeit.de/news/2026-06/12/tankrabatt-drueckt-inflation-voruebergehend-image-group/wide__1300x731,2026-06-12T06:18:51Z,,"Der Tankrabatt hat den Inflationsschub in Deutschland gebremst. Im Mai lagen die Verbraucherpreise um 2,6 Prozent über dem Niveau des Vorjahresmonats, wie das Statistische Bundesamt bestätigte. Noch … [+2072 chars]",,de,'Inflation'
https://www.focus.de/politik/ausland/russland-koennte-bis-zu-80-000-soldaten-an-finnlands-grenze-verlegen-satellitenaufnahmen-zeigen-aufruestung-im-norden_ef584676-d726-4cc7-81e5-34ac42222757.html,https://www.focus.de/politik/ausland/russland-koennte-bis-zu-80-000-soldaten-an-finnlands-grenze-verlegen-satellitenaufnahmen-zeigen-aufruestung-im-norden_ef584676-d726-4cc7-81e5-34ac42222757.html,0,www.focus.de,Russland könnte bis zu 80.000 Soldaten an Finnlands Grenze verlegen: Satellitenaufnahmen zeigen Aufrüstung im Norden,Russland baut nahe Finnland neue Kasernen und Militäranlagen. Im Norden entsteht damit Platz für deutlich mehr Soldaten.,"https://quadro.burda-forward.de/ctf/ffb3257b-cdae-4f42-ab1b-610ba76dbeed.acf9ee70-ed93-49e8-a98f-aca4b155bbb9.jpg?im=RegionOfInterestCrop=(1200,630),regionOfInterest=(454,411)&hash=ca7f9a95dbcbe6d5c3e432e47f165ce539180ca645f1203406457eec5a57422c",2026-06-12T06:43:00Z,,"Russland schafft nahe der finnischen Grenze neue Unterkünfte, lagert Munition ein und zieht mehr Militärfahrzeuge im Norden zusammen. Das zeigen neue Satellitenbilder, die der schwedische Sender SVT … [+2853 chars]",,de,'Ukraine'
https://www.focus.de/politik/ausland/finnlands-streitkraefte-haben-aus-dem-ukraine-krieg-gelernt-sogar-programmierer-werden-jetzt-soldaten_573d45c9-1c86-4105-b4bd-391371cb8b67.html,https://www.focus.de/politik/ausland/finnlands-streitkraefte-haben-aus-dem-ukraine-krieg-gelernt-sogar-programmierer-werden-jetzt-soldaten_573d45c9-1c86-4105-b4bd-391371cb8b67.html,0,www.focus.de,Finnlands Streitkräfte haben aus dem Ukraine-Krieg gelernt – sogar Programmierer werden jetzt Soldaten,"Der Ukraine-Krieg verändert Europas Streitkräfte. In Finnland werden inzwischen nicht nur Soldaten, sondern auch IT-Spezialisten gezielt für den Einsatz ausgebildet. Das Land bereitet sich auf neue Formen der Kriegsführung vor.","https://quadro.burda-forward.de/ctf/b96d8328-0fe5-48b8-909c-8cb147ccd1c8.fe746eb7-7d8f-4d43-80bd-19409e486325.jpg?im=RegionOfInterestCrop=(1200,630),regionOfInterest=(2160,1117)&hash=6242e490914aa22fc74f8d40b201c11b2d97d1c923b20ae0ab79235b47e5a244",2026-06-12T06:44:00Z,,Der Krieg in der Ukraine hat die Sicherheitslage in Europa grundlegend verändert. Besonders deutlich zeigt sich das in Finnland. Das Nato-Mitglied teilt eine rund 1300 Kilometer lange Grenze mit Russ… [+2241 chars],,de,'Ukraine'
https://www.welt.de/wirtschaft/plus6a2a8c50fbd55a72ddb57520/gebaeudemodernisierungsgesetz-die-seltsame-allianz-von-e-on-und-deutscher-umwelthilfe-gegen-katherina-reiche.html,https://www.welt.de/wirtschaft/plus6a2a8c50fbd55a72ddb57520/gebaeudemodernisierungsgesetz-die-seltsame-allianz-von-e-on-und-deutscher-umwelthilfe-gegen-katherina-reiche.html,0,www.welt.de,Die seltsame Allianz von E.on und Deutscher Umwelthilfe gegen Katherina Reiche,"Der Bundestag streitet über den Nachfolger für Habecks Heizungsgesetz. Klimaschützer, Linke und Grüne kritisieren die als Ersatz gedachte „Biotreppe“. Überraschend schlägt sich auch der E.on-Konzern offen auf die Seite der Gas-Gegner.",https://images.welt.de/6a2a8c50fbd55a72ddb57520/629f5ba4aae292fc410c11f9a8a94b68/ci16x9-w1200/dpa-com-260611-935-1401645-jpg,2026-06-12T06:46:15Z,,"Der Bundestag streitet über den Nachfolger für Habecks Heizungsgesetz. Klimaschützer, Linke und Grüne kritisieren die als Ersatz gedachte Biotreppe. Überraschend schlägt sich auch der E.on-Konzern of… [+32 chars]",,de,'Gas'
https://www.tagesschau.de/newsticker/liveblog-iran-104.html,https://www.tagesschau.de/newsticker/liveblog-iran-104.html,0,www.tagesschau.de,Nahost-Liveblog: ++ Iran stoppt offenbar Öltanker ++,"Teheran hindert in der Straße von Hormus offenbar einen Tanker an der Durchfahrt. Das US-Militär schießt in der Meerenge zwei iranische Drohnen ab, berichtet ein Insider.",https://images.tagesschau.de/image/5d002b39-97da-4e0a-909b-7952c407bd11/AAABnc3SjeI/AAABnSSvrFg/16x9-big/persischer-golf-100.jpg?width=1280,2026-06-12T06:47:11Z,,"Stand: 12.06.2026 08:47 Uhr
Teheran hindert in der Straße von Hormus offenbar einen Tanker an der Durchfahrt. Das US-Militär schießt in der Meerenge zwei iranische Drohnen ab, berichtet ein Insider.… [+2146 chars]",,de,'Hormus'
https://www.faz.net/aktuell/politik/ukraine/ukraine-liveticker-ein-drittel-weniger-us-kampfjets-fuer-nato-in-europa-faz-110683325.html,https://www.faz.net/aktuell/politik/ukraine/ukraine-liveticker-ein-drittel-weniger-us-kampfjets-fuer-nato-in-europa-faz-110683325.html,0,www.faz.net,Liveblog Ukrainekrieg: Ein Drittel weniger US-Kampfjets für NATO in Europa,Medienbericht: Nur noch 100 statt 150 F-16- und ‌F-15E-Flugzeuge +++ Ukrainischer Botschafter dankt deutschen Steuerzahlern +++ Bundeswehrübung in Litauen +++ alle Neuigkeiten im Liveblog,https://media0.faz.net/image/w1200h627/a20d3fbb7ba4/w3443h1798x0y253o/202605/43601.0.2148665809/drei-amerikanische-f-16.webp,2026-06-12T06:47:49Z,,"Die Botschafter Deutschlands, Großbritanniens und Frankreichs sind am Donnerstag im russischen Außenministerium empfangen worden. Wie Letzteres mitteilte, sei dies auf Bitten der Diplomaten erfolgt, … [+867 chars]",,de,'Ukraine'
https://www.telepolis.de/article/Shahed-136-Die-Drohne-die-zur-Weltwaffe-wurde-11329742.html,https://www.telepolis.de/article/Shahed-136-Die-Drohne-die-zur-Weltwaffe-wurde-11329742.html,0,www.telepolis.de,"Shahed-136: Die Drohne, die zur Weltwaffe wurde",Iran entwickelte sie. Russland perfektionierte sie. Jetzt kopieren Staaten rund um den Globus das erfolgreichste Drohnenkonzept der Gegenwart.,https://heise.cloudimg.io/bound/1200x1200/q85.png-lossy-85.webp-lossy-85.foil1/_www-heise-de_/imgs/18/5/0/9/9/1/6/6/Master_Lange1-65d4827d21c51725.jpg,2026-06-12T07:15:00Z,,"KI-generierte Grafik.
Iran entwickelte sie. Russland perfektionierte sie. Jetzt kopieren Staaten rund um den Globus das erfolgreichste Drohnenkonzept der Gegenwart.
Über 900 Drohnen hat Saudi-Arabi… [+8365 chars]",,de,'Russland'
https://www.faz.net/aktuell/wirtschaft/unternehmen/business-liveticker-ki-kenntnisse-schlagen-uni-diplom-faz-200452404.html,https://www.faz.net/aktuell/wirtschaft/unternehmen/business-liveticker-ki-kenntnisse-schlagen-uni-diplom-faz-200452404.html,0,www.faz.net,Business-Ticker: Manche Firmen stellen lieber KI-Kräfte statt Absolventen ein,Künstliche Intelligenz schlägt Hochschulexamen +++ Größter US-Börsengang aller Zeiten am Freitag +++ Trump: Ich liebe die Inflation +++ Hybridsupermarkt übernimmt 36 Tegut-Filialen +++ Neuigkeiten im Unternehmen-Liveblog.,https://media0.faz.net/image/w1200h627/01c1d0ee40b6/w6000h3135x0y433o/202606/43601.0.2206704354/welchen-wert-hat-ein.webp,2026-06-12T07:25:00Z,,Der Autobauer Mercedes-Benz möchte mit dem Drohnen-Start-up Tytan Technologies zusammenarbeiten. Beide Unternehmen unterzeichneten am Rande der Internationalen Luft- und Raumfahrtausstellung in Berli… [+1173 chars],,de,'Inflation'
https://www.focus.de/politik/ausland/wegen-us-engpaessen-ukraine-plant-patriot-ersatz-mit-europa_f28d27b4-ad4e-4b11-87fb-c62177509c1b.html,https://www.focus.de/politik/ausland/wegen-us-engpaessen-ukraine-plant-patriot-ersatz-mit-europa_f28d27b4-ad4e-4b11-87fb-c62177509c1b.html,0,www.focus.de,Wegen US-Engpässen: Ukraine plant Patriot-Ersatz mit Europa,Die Ukraine sucht Schutz vor neuen russischen Raketenangriffen. Großbritannien soll beim Bau eines europäischen Patriot-Ersatzes helfen.,"https://quadro.burda-forward.de/ctf/89c6ef00-579d-4558-951e-da78f51698b7.8d6ea20d-b842-4535-8b38-736890230c70.jpg?im=RegionOfInterestCrop=(1200,630),regionOfInterest=(2120,1284)&hash=9c65fae48ca35d961a73a4bfcd1198749348070a383c055d67c61db1ad4caf0c",2026-06-12T07:34:00Z,,Die Ukraine will mit Großbritannien und weiteren europäischen Partnern ein eigenes Abwehrsystem gegen ballistische Raketen entwickeln. Präsident Wolodymyr Selenskyj reagiert damit auf Engpässe bei de… [+2531 chars],,de,'Ukraine'
https://www.bild.de/news/ausland/drohnenangriff-auf-mariupol-ukraine-legt-russisch-besetzten-hafen-lahm-6a2bafd77e682fc37fbf6c6c,https://www.bild.de/news/ausland/drohnenangriff-auf-mariupol-ukraine-legt-russisch-besetzten-hafen-lahm-6a2bafd77e682fc37fbf6c6c,0,www.bild.de,Drohnenangriff auf Mariupol - Ukraine legt russisch besetzten Hafen lahm,Ukrainische Streitkräfte haben nach Angaben der Regierung in Kiew mehrere Tage lang wichtige Anlagen im russisch besetzten Hafen von Mariupol angegriffen...,"https://images.bild.de/6a2bafd77e682fc37fbf6c6c/1004504529415f2c2e4ad95c127289e5,97b10769?w=1280",2026-06-12T07:45:38Z,,"+++Plus 6,5 Prozent: Mehr Firmenpleiten im ersten Quartal
+++Plus 6,5 Prozent: Mehr Firmenpleiten im ersten Quartal
+++Plus 6,5 Prozent: Mehr Firmenpleiten im ersten Quartal
+++Plus 6,5 Prozent: M… [+388 chars]",,de,'Ukraine'
https://www.golem.de/sonstiges/zustimmung/auswahl.html?from=https://www.golem.de/news/ukraine-billige-abfangrakete-soll-patriot-luecke-schliessen-2606-209685.html&referer=https://t.co/1c984428f2,https://www.golem.de/sonstiges/zustimmung/auswahl.html?from=https://www.golem.de/news/ukraine-billige-abfangrakete-soll-patriot-luecke-schliessen-2606-209685.html&referer=https://t.co/1c984428f2,0,www.golem.de,Ukraine: Billige Abfangrakete soll Patriot-Lücke schließen,"700.000 Dollar statt 3,8 Millionen, und trotzdem soll die von der Ukraine entwickelte Abfangrakete andere Raketen abfangen können. (Lockheed Martin, Politik)",,2026-06-12T07:47:02Z,,"Besuchen Sie Golem.de wie gewohnt mit Werbung und Tracking,
 indem Sie der Nutzung aller Cookies zustimmen.
 Details zum Tracking finden Sie im Privacy Center.
Skript wurde nicht geladen. Informat… [+607 chars]",,de,'Ukraine'
https://www.focus.de/politik/ausland/the-telegraph-die-ukraine-hat-der-welt-gezeigt-wie-man-den-feind-effizient-bekaempft_03fc924c-f24a-4f53-9e23-c91b20a6a267.html,https://www.focus.de/politik/ausland/the-telegraph-die-ukraine-hat-der-welt-gezeigt-wie-man-den-feind-effizient-bekaempft_03fc924c-f24a-4f53-9e23-c91b20a6a267.html,0,www.focus.de,"„The Telegraph“: Die Ukraine hat der Welt gezeigt, wie man den Feind effizient bekämpft",Der Krieg dauert inzwischen länger als der Erste Weltkrieg. Militärfachleute sehen erstaunliche Parallelen und zugleich den Beginn einer völlig neuen Art der Kriegsführung.,"https://quadro.burda-forward.de/ctf/323b3653-eed3-4e4f-908c-e6f4498039ee.935da8d7-a35a-4b8d-8523-2937a43c1b55.jpg?im=RegionOfInterestCrop=(1200,630),regionOfInterest=(476,337)&hash=be57288c0f2dbcef9e85e4d42a729a0a4da7bad567d545dd8e8537c35c8093a7",2026-06-12T07:52:00Z,,"Der Ukraine-Krieg hat eine historische Marke überschritten. Mit inzwischen mehr als 1560 Tagen dauert der Konflikt länger als der Erste Weltkrieg.
Der frühere britische Panzerkommandeur Hamish de Br… [+1482 chars]",,de,'Ukraine'
https://www.zeit.de/news/2026-06/12/insolvenzen-von-verbrauchern-und-firmen-steigen-in-der-krise,https://www.zeit.de/news/2026-06/12/insolvenzen-von-verbrauchern-und-firmen-steigen-in-der-krise,0,www.zeit.de,Finanzen: Insolvenzen von Verbrauchern und Firmen steigen in der Krise,Hier finden Sie Informationen zu dem Thema „Finanzen“. Lesen Sie jetzt „Insolvenzen von Verbrauchern und Firmen steigen in der Krise“.,https://img.zeit.de/news/2026-06/12/insolvenzen-von-verbrauchern-und-firmen-steigen-in-der-krise-image-group/wide__1300x731,2026-06-12T07:56:21Z,,"Inmitten der Wirtschaftskrise reißt die Welle der Firmenpleiten in Deutschland nicht ab. Im ersten Quartal wurden 6.275 Unternehmensinsolvenzen bei den Amtsgerichten beantragt und damit 6,5 Prozent m… [+1788 chars]",,de,'Finanz'
https://www.diepresse.com/29910792/russland-meldet-zwei-tote-bei-ukrainischen-angriffen,https://www.diepresse.com/29910792/russland-meldet-zwei-tote-bei-ukrainischen-angriffen,0,www.diepresse.com,Russland meldet zwei Tote bei ukrainischen Angriffen,Bei wechselseitigen Angriffen Russlands und der Ukraine wurden in der Nacht auf Freitag mindestens drei Zivilisten getötet.,https://www.diepresse.com/assets_v2/images/diepresse_nachrichten.png,2026-06-12T08:06:26Z,,Russland und die Ukraine haben einander in der Nacht auf Freitag erneut mit Angriffen überzogen. Dabei wurden laut Behörden mindestens drei Zivilisten getötet. In der westrussischen Grenzregion Brjan… [+509 chars],,de,'Angriff'
https://www.stern.de/wirtschaft/news/neues-sanktionspaket-der-eu--sanktionen-der-eu-drohen-fischstaebchen-hersteller-zu-treffen-37533528.html,https://www.stern.de/wirtschaft/news/neues-sanktionspaket-der-eu--sanktionen-der-eu-drohen-fischstaebchen-hersteller-zu-treffen-37533528.html,0,www.stern.de,Neues Sanktionspaket der EU: Sanktionen der EU drohen Fischstäbchen-Hersteller zu treffen,"Droht in Deutschland wegen Russland-Sanktionen der EU eine Fischstäbchenkrise? Strengere Einfuhrregeln könnten nicht nur Hersteller, sondern auch Verbraucher direkt im Supermarkt treffen.",https://image.stern.de/37533530/t/qR/v1/w1440/r1.7778/-/12--prrwkdez6ov2axs2048jpeg---11effc6a68b71afe.jpg,2026-06-12T09:16:23Z,,"Kopiere den aktuellen Link
Zur Merkliste hinzufügen
Droht in Deutschland wegen Russland-Sanktionen der EU eine Fischstäbchenkrise? Strengere Einfuhrregeln könnten nicht nur Hersteller, sondern auch… [+4504 chars]",,de,'Russland'
https://www.tagesspiegel.de/wirtschaft/neues-sanktionspaket-der-eu-russland-sanktionen-deutschland-droht-fischstabchen-krise-15708251.html,https://www.tagesspiegel.de/wirtschaft/neues-sanktionspaket-der-eu-russland-sanktionen-deutschland-droht-fischstabchen-krise-15708251.html,0,www.tagesspiegel.de,Neues Sanktionspaket der EU: Russland-Sanktionen: Deutschland droht Fischstäbchen-Krise,"Droht in Deutschland wegen Russland-Sanktionen der EU eine Fischstäbchenkrise? Strengere Einfuhrregeln könnten nicht nur Hersteller, sondern auch Verbraucher direkt im Supermarkt treffen.",https://www.tagesspiegel.de/images/15708250/alternates/BASE_16_9_W1400/1781255883000/fischstabchen.jpeg,2026-06-12T09:18:03Z,,"Das nächste EU-Sanktionspaket gegen Russland könnte erhebliche Konsequenzen für deutsche Produzenten und Konsumenten von Fischstäbchen, Schlemmerfilets und anderen Tiefkühl-Fischgerichten haben. Nach… [+4664 chars]",,de,'Russland'
https://www.tagesspiegel.de/wirtschaft/neues-sanktionspaket-der-eu-sanktionen-der-eu-drohen-fischstabchen-hersteller-zu-treffen-15708251.html,https://www.tagesspiegel.de/wirtschaft/neues-sanktionspaket-der-eu-sanktionen-der-eu-drohen-fischstabchen-hersteller-zu-treffen-15708251.html,0,www.tagesspiegel.de,Neues Sanktionspaket der EU: Sanktionen der EU drohen Fischstäbchen-Hersteller zu treffen,"Droht in Deutschland wegen Russland-Sanktionen der EU eine Fischstäbchenkrise? Strengere Einfuhrregeln könnten nicht nur Hersteller, sondern auch Verbraucher direkt im Supermarkt treffen.",https://www.tagesspiegel.de/images/15708250/alternates/BASE_16_9_W1400/1781255883000/fischstabchen.jpeg,2026-06-12T09:18:03Z,,"Das nächste EU-Sanktionspaket gegen Russland könnte erhebliche Konsequenzen für deutsche Produzenten und Konsumenten von Fischstäbchen, Schlemmerfilets und anderen Tiefkühl-Fischgerichten haben. Nach… [+4363 chars]",,de,'Russland'
https://www.focus.de/politik/ausland/wir-werden-die-krim-isolieren-ukraine-verstaerkt-angriffe-auf-logistik_53b3a91f-78d7-4af6-be17-70924d7fe364.html,https://www.focus.de/politik/ausland/wir-werden-die-krim-isolieren-ukraine-verstaerkt-angriffe-auf-logistik_53b3a91f-78d7-4af6-be17-70924d7fe364.html,0,www.focus.de,„Wir werden die Krim isolieren“: Ukraine verstärkt Angriffe auf Logistik,"Ukraine intensiviert Drohnenangriffe auf russische Nachschubrouten zur Krim. Ziel ist es, die Halbinsel schrittweise von Versorgung und Militärlogistik abzuschneiden.","https://quadro.burda-forward.de/ctf/6ab1448c-6e95-4aed-8891-19bf349568d5.3b7153b7-ccfa-4f7b-bb03-54555a16cd78.jpg?im=RegionOfInterestCrop=(1200,630),regionOfInterest=(1488,562)&hash=d5e99ba4bb47e0683f8098f39b836a42bde704f39719df88cadf11eced308c20",2026-06-12T09:21:00Z,,Die Ukraine intensiviert ihre Drohnenangriffe in den besetzten Gebieten und setzt vor allem die russischen Nachschubwege zur Krim unter Druck. Nach Angaben des Kommandeurs der ukrainischen Unmanned S… [+2348 chars],,de,'Ukraine'
https://taz.de/Krieg-im-Westen-der-Ukraine/!6185820/,https://taz.de/Krieg-im-Westen-der-Ukraine/!6185820/,0,taz.de,Krieg im Westen der Ukraine: Den Alltag verteidigen,"Russland nimmt verstärkt den Westen der Ukraine ins Visier, immer mehr Zivilisten sterben. Wer überlebt, versucht so gut es geht Normalität zu retten.",https://taz.de/picture/8489751/1200/40799033.jpeg,2026-06-12T09:26:00Z,,"Russland nimmt verstärkt den Westen der Ukraine ins Visier, immer mehr Zivilisten sterben. Wer überlebt, versucht so gut es geht Normalität zu retten. mehr...",,de,'Ukraine'
https://www.stern.de/news/pistorius--deutschland-kann-von-leistungsfaehigkeit-der-ukraine-lernen-37533704.html,https://www.stern.de/news/pistorius--deutschland-kann-von-leistungsfaehigkeit-der-ukraine-lernen-37533704.html,0,www.stern.de,Pistorius: Deutschland kann von Leistungsfähigkeit der Ukraine lernen,"Deutschland kann nach Auffassung von Bundesverteidigungsminister Boris Pistorius (SPD) von der Leistungsfähigkeit der Ukraine im Verteidigungskrieg gegen Russland lernen. „Die Erfahrungen der Ukraine auf dem Gefechtsfeld sind für uns von allerhöchstem Wert“, …",https://image.stern.de/37533706/t/7-/v1/w1440/r1.7778/-/12--bundesverteidigungsminister-boris-pistorius-am-freitag-bei-der-ila-in-berlin---6bbb46158d5e35d7.jpg,2026-06-12T09:40:32Z,,"Kopiere den aktuellen Link
Zur Merkliste hinzufügen
Deutschland kann nach Auffassung von Bundesverteidigungsminister Boris Pistorius (SPD) von der Leistungsfähigkeit der Ukraine im Verteidigungskri… [+2708 chars]",,de,'Ukraine'
https://www.focus.de/politik/ausland/neue-satellitenbilder-zeigen-bedrohung-die-wir-ernst-nehmen-sollten-russland-bereitet-sich-auf-moeglichen-krieg-mit-nato-staaten-vor_b97e26cb-cc02-4344-a98e-f7667e0e5fd4.html,https://www.focus.de/politik/ausland/neue-satellitenbilder-zeigen-bedrohung-die-wir-ernst-nehmen-sollten-russland-bereitet-sich-auf-moeglichen-krieg-mit-nato-staaten-vor_b97e26cb-cc02-4344-a98e-f7667e0e5fd4.html,0,www.focus.de,"Neue Satellitenbilder zeigen „Bedrohung, die wir ernst nehmen sollten”: Russland bereitet sich auf möglichen Krieg mit Nato-Staaten vor","Neue Satellitenbilder, die ein dänischer Sender verbreitet, zeigen russische Aufrüstung entlang der Nato-Grenze. Militärs und Geheimdienste warnen vor einem gefährlichen Zeitfenster in den kommenden Jahren – besonders im Ostseeraum.","https://quadro.burda-forward.de/ctf/3934ddd4-c81d-40eb-ab2d-2885a08704e0.ef9dc985-7f45-4a6f-989e-992b5e4dfe1b.jpg?im=RegionOfInterestCrop=(1200,630),regionOfInterest=(668,416)&hash=edc1c6707e52dc84f6010baae4431cb6c0f77d9d2f210fabb037e1c381382906",2026-06-12T09:51:00Z,,"Neue Satellitenbilder deuten einem Medienbericht zufolge auf eine verstärkte russische Aufrüstung entlang der Grenze zu Nordeuropa und dem Baltikum hin. Sie zeigen nach Angaben von Militärexperten, m… [+3629 chars]",,de,'Russland'
https://www.zeit.de/news/2026-06/12/protest-in-berlin-ig-metall-bangt-um-zehntausende-stahljobs,https://www.zeit.de/news/2026-06/12/protest-in-berlin-ig-metall-bangt-um-zehntausende-stahljobs,0,www.zeit.de,Stahlindustrie in der Krise: Protest in Berlin: IG Metall bangt um Zehntausende Stahljobs,Hier finden Sie Informationen zu dem Thema „Stahlindustrie in der Krise“. Lesen Sie jetzt „Protest in Berlin: IG Metall bangt um Zehntausende Stahljobs“.,https://img.zeit.de/news/2026-06/12/protest-in-berlin-ig-metall-bangt-um-zehntausende-stahljobs-image-group/wide__1300x731,2026-06-12T10:27:47Z,,Mit Kundgebungen in Berlin und Völklingen machen Beschäftigte der Stahlindustrie Druck auf die Bundesregierung. Unter dem Motto «Stahl hat Zukunft bei uns!» marschierten Stahlarbeiter vom Brandenburg… [+2243 chars],,de,'Krise'
https://www.dw.com/de/kann-gastgeber-usa-bei-der-wm-2026-f%C3%BCr-euphorie-sorgen/a-77518963,https://www.dw.com/de/kann-gastgeber-usa-bei-der-wm-2026-f%C3%BCr-euphorie-sorgen/a-77518963,0,www.dw.com,Kann Gastgeber USA bei der WM 2026 für Euphorie sorgen?,"Die USA sind nach 32 Jahren wieder Gastgeber einer Fußball-WM. Soccer hat sich stark entwickelt, ist aber weit von einem Volkssport entfernt. Nun soll eine erfolgreiche WM einen Schub bringen. Ist das realistisch?",https://static.dw.com/image/77520330_6.jpg,2026-06-12T10:28:00Z,,"""Wir sind ein Land, das Basketball und American Football liebt. Es ist schwer, die einzufangen"", sagt Joe Scally, Abwehrspieler bei Borussia Mönchengladbach in der Fußball-Bundesliga gegenüber der De… [+7748 chars]",,de,'Russland'
https://www.tagesspiegel.de/wirtschaft/stahlindustrie-in-der-krise-bangen-um-jobs-treibt-tausende-stahlarbeiter-auf-die-strasse-15708761.html,https://www.tagesspiegel.de/wirtschaft/stahlindustrie-in-der-krise-bangen-um-jobs-treibt-tausende-stahlarbeiter-auf-die-strasse-15708761.html,0,www.tagesspiegel.de,Stahlindustrie in der Krise: Bangen um Jobs treibt Tausende Stahlarbeiter auf die Straße,"Billigstahl aus Asien, teure Energie und Klimavorgaben machen der Stahlindustrie zu schaffen. In Berlin und dem Saarland beteiligen sich Tausende an Protesten. Gewerkschafter sehen Jobs in Gefahr.",https://www.tagesspiegel.de/images/15709669/alternates/BASE_16_9_W1400/1781268787000/kundgebung-der-ig-metall-fur-die-zukunft-der-stahlindustrie.jpeg,2026-06-12T10:28:52Z,,"Wirtschaftsflaute, Billigstahl aus Asien, hohe US-Zölle: Angesichts der Krise der Stahlindustrie haben Tausende Arbeiter bei Kundgebungen in Berlin und Völklingen für den Erhalt ihrer Jobs demonstrie… [+4375 chars]",,de,'Russland'
https://www.focus.de/politik/ausland/g7-gipfel-in-evian-dreht-sich-um-trump-und-krisen_f7fc6b07-e183-48ea-8af3-cb5c93261d4a.html,https://www.focus.de/politik/ausland/g7-gipfel-in-evian-dreht-sich-um-trump-und-krisen_f7fc6b07-e183-48ea-8af3-cb5c93261d4a.html,0,www.focus.de,G7-Gipfel in Évian dreht sich um Trump und Krisen,"Beim G7-Gipfel kreist vieles um Donald Trump und den Umgang mit Konflikten. Gastgeber Macron versucht, Streit und einen Eklat zu vermeiden.","https://quadro.burda-forward.de/ctf/d15089de-539e-4694-bc5c-6a6f02c8e8bb.a4832c5f-40c8-43e4-a8fa-388c9bb58645.jpg?im=RegionOfInterestCrop=(1200,630),regionOfInterest=(776,462)&hash=318f78703a977720f0d152a58c1d76f8bf27fd3affba272460d1d69db4fd4476",2026-06-12T10:36:00Z,,"Der G7-Gipfel im französischen Évian-les-Bains steht in diesem Jahr stark im Zeichen der USA und von Donald Trump. Offiziell geht es um Weltwirtschaft, Kriege und neue Technik, doch vieles dreht sich… [+3767 chars]",,de,'Russland'
https://www.focus.de/politik/ausland/medwedew-zeigt-ki-video-auf-x-und-wird-mit-spott-ueberzogen_0dc97d67-addc-41a4-b9df-03c53f7b608b.html,https://www.focus.de/politik/ausland/medwedew-zeigt-ki-video-auf-x-und-wird-mit-spott-ueberzogen_0dc97d67-addc-41a4-b9df-03c53f7b608b.html,0,www.focus.de,Medwedew zeigt KI-Video auf X und wird mit Spott überzogen,"Der russische Spitzenpolitiker Dmitri Medwedew bejubelt den „Tag Russlands“ am Freitag mit einem KI-Video, das er auf X veröffentlicht.","https://quadro.burda-forward.de/ctf/b0a55a08-5d39-4a9a-a30d-8661101b4316.3be34ebe-c368-45b5-90ad-d7f58c9212da.jpg?im=RegionOfInterestCrop=(1200,630),regionOfInterest=(1553,426)&hash=786b8113b3519d7d01f60806e6246bd8066af959376711337e32cfd7cd8ad58d",2026-06-12T11:08:00Z,,"Darin schreddert das digitale Ebenbild des früheren Kreml-Chefs Fotos von Friedrich Merz, Ursula von der Leyen und Keir Starmer. Dazu schreibt er: Kein Feind kann das Wachstum und den Wohlstand unser… [+1419 chars]",,de,'Russland'
