index,url,valid,domain,title,description,image,published,archive,content,quote,language,keyword
https://www.stern.de/gesellschaft/regional/thueringen/unfall--flucht-vor-polizeikontrolle--mann-faehrt-auto-zu-schrott-33078802.html,https://www.stern.de/gesellschaft/regional/thueringen/unfall--flucht-vor-polizeikontrolle--mann-faehrt-auto-zu-schrott-33078802.html,0,www.stern.de,Unfall: Flucht vor Polizeikontrolle: Mann fährt Auto zu Schrott,"Bei der Flucht vor der Polizei hat ein Autofahrer in Greiz seinen Wagen zu Schrott gefahren. Zugleich wurden zwei Insassen leicht verletzt. Polizisten wollten den Mann in den Morgenstunden kontrollieren, doch er habe mit hohem Tempo die Flucht ergriffen, teil…",https://image.stern.de/33078804/t/NP/v1/w1440/r1.7778/-/08--urnnewsmldpacom2009010123010899142830v1w800h600l1320t481r4869b4569jpeg---de7fdfeb27537505.jpg,2023-01-08T10:04:45Z,,Bei der Flucht vor der Polizei hat ein Autofahrer in Greiz seinen Wagen zu Schrott gefahren. Zugleich wurden zwei Insassen leicht verletzt. Polizisten wollten den Mann in den Morgenstunden kontrollie… [+989 chars],,de,'Flucht'
https://www.zeit.de/news/2023-01/08/flucht-vor-polizeikontrolle-mann-faehrt-auto-zu-schrott,https://www.zeit.de/news/2023-01/08/flucht-vor-polizeikontrolle-mann-faehrt-auto-zu-schrott,0,www.zeit.de,Unfall: Flucht vor Polizeikontrolle: Mann fährt Auto zu Schrott,,,2023-01-08T10:04:45Z,https://web.archive.org/web/20230109142748/https://www.zeit.de/news/2023-01/08/flucht-vor-polizeikontrolle-mann-faehrt-auto-zu-schrott,"When browsing with ads:
We collect personal data and also transmit it to third-party providers
 that help us improve and finance our digital content. Some of the information stored on your device, … [+732 chars]",,de,'Flucht'
https://www.golem.de/sonstiges/zustimmung/auswahl.html?from=https://www.golem.de/news/gegen-die-energiekrise-japaner-wollen-aus-schnee-strom-erzeugen-2301-171038.html&referer=https://t.co/7987d437bb,https://www.golem.de/sonstiges/zustimmung/auswahl.html?from=https://www.golem.de/news/gegen-die-energiekrise-japaner-wollen-aus-schnee-strom-erzeugen-2301-171038.html&referer=https://t.co/7987d437bb,0,www.golem.de,Gegen die Energiekrise: Japaner wollen aus Schnee Strom erzeugen,"Die Schneestromsysteme sollen sich einmal ähnlich wie heutige Solaranlagen auch von Privatleuten nutzen lassen. (Energie & Klima, GreenIT)",,2023-01-08T10:27:02Z,https://web.archive.org/web/20230110021030/https://www.golem.de/sonstiges/zustimmung/auswahl.html?from=https:%2F%2Fwww.golem.de%2Fnews%2Fgegen-die-energiekrise-japaner-wollen-aus-schnee-strom-erzeugen-2301-171038.html&amp;referer=https:%2F%2Ft.co%2F7987d437bb,"Besuchen Sie Golem.de wie gewohnt mit Werbung und Tracking,
 indem Sie der Nutzung aller Cookies zustimmen.
 Details zum Tracking finden Sie im Privacy Center.
Skript wurde nicht geladen. Informat… [+607 chars]",,de,'Klima'
https://taz.de/Selbstgestricktes-gegen-die-Kaelte/!5903209/,https://taz.de/Selbstgestricktes-gegen-die-Kaelte/!5903209/,0,taz.de,Selbstgestricktes gegen die Kälte: Wolle und wollen,"Wer friert, weil gerade Energie gespart werden muss, ist selber schuld, meint unsere Autorin. Es gibt schließlich leicht Abhilfe.",https://taz.de/picture/6013226/948/Stricken-1.jpeg,2023-01-08T10:48:00Z,https://web.archive.org/web/20230108105013/https://taz.de/Selbstgestricktes-gegen-die-Kaelte/!5903209/,"Wer friert, weil gerade Energie gespart werden muss, ist selber schuld, meint unsere Autorin. Es gibt schließlich leicht Abhilfe.
Junge Frau, strickend Foto: Angel Santana Garcia/Westend 61/imago
A… [+6623 chars]",,de,'Kälte'
https://www.focus.de/panorama/welt/rekonstruktion-des-fluchttages-so-fluechtete-der-kiosk-moerder_id_182476075.html,https://www.focus.de/panorama/welt/rekonstruktion-des-fluchttages-so-fluechtete-der-kiosk-moerder_id_182476075.html,0,www.focus.de,Kletterte aus Gerichtsfenster - Rekonstruktion seiner Flucht: Wie der Kiosk-Mörder verschwand,Die Polizei fahndet auf Hochtouren nach dem geflüchteten Mörder Rachid Chouakri - doch noch immer fehlt eine heiße Spur. Dabei kommen immer mehr Details von seiner Flucht ans Licht.Von FOCUS-online-Autorin Sarah Werner,https://p6.focus.de/img/fotos/id_182233604/moerder.jpg?im=Crop%3D%280%2C192%2C1200%2C600%29%3BResize%3D%281200%2C627%29&impolicy=perceptual&quality=medium&hash=c56c7fd58ba7063556492d30848a22e67614a992515beb0c2683b2456b2308b8,2023-01-08T10:52:37Z,https://web.archive.org/web/20230108111339/https://www.focus.de/panorama/welt/rekonstruktion-des-fluchttages-so-fluechtete-der-kiosk-moerder_id_182476075.html,"Die Polizei fahndet auf Hochtouren nach dem geflüchteten Mörder Rachid Chouakri - doch noch immer fehlt eine heiße Spur. Dabei kommen immer mehr Details von seiner Flucht ans Licht.
 Auch drei Tage … [+4309 chars]",,de,'Flucht'
https://www.dw.com/de/bundesnetzagentur-gasmangellage-ist-%C3%BCberwunden/a-64317444,https://www.dw.com/de/bundesnetzagentur-gasmangellage-ist-%C3%BCberwunden/a-64317444,0,www.dw.com,Bundesnetzagentur: Gasmangellage ist überwunden,"Der Chef der Bundesnetzagentur, Klaus Müller, ist optimistisch: Er geht davon aus, dass die Gasspeicher am Ende des Winters noch zu 50 Prozent gefüllt sind. Trotzdem warnt Müller vor nachlassendem Einspar-Eifer.",https://static.dw.com/image/62095872_6.jpg,2023-01-08T11:17:00Z,https://web.archive.org/web/20230108114925/https://www.dw.com/de/bundesnetzagentur-gasmangellage-ist-%C3%BCberwunden/a-64317444,"""Bei aller Restunsicherheit: Ich rechne nicht damit, dass diesen Winter noch etwas schiefgeht"", sagte der Präsident der Bundesnetzagentur, Klaus Müller, der ""Bild am Sonntag"". Er gehe davon aus, dass… [+2239 chars]",,de,'Gas'
https://www.n-tv.de/politik/17-28-Keine-Hinweise-auf-angeblich-von-Russland-getoetete-600-Soldaten--article23143824.html,https://www.n-tv.de/politik/17-28-Keine-Hinweise-auf-angeblich-von-Russland-getoetete-600-Soldaten--article23143824.html,0,www.n-tv.de,Ukraine-Krieg im Liveticker: +++ 17:28 Keine Hinweise auf angeblich von Russland getötete 600 Soldaten +++,"Berlin, Washington, Br\u00fcssel - \u00fcberall. n-tv berichtet von allen wichtigen Schaupl\u00e4tzen der Innen- und Au\u00dfenpolitik.",https://bilder2.n-tv.de/img/incoming/crop23332537/9041326157-cImg_16_9-w1200/Liveticker1-grau-1-Kopie.jpg,2023-01-08T12:30:00Z,,"Nach einem russischen Raketenangriff auf die ostukrainische Stadt Kramatorsk gibt es einem Augenzeugen zufolge kein Hinweis auf hohe ukrainische Verluste. Es seien Schäden entstanden, aber zerstörte … [+23185 chars]",,de,'Russland'
https://www.n-tv.de/politik/15-32-Russland-und-Ukraine-tauschen-50-Gefangene-aus--article23143824.html,https://www.n-tv.de/politik/15-32-Russland-und-Ukraine-tauschen-50-Gefangene-aus--article23143824.html,0,www.n-tv.de,Ukraine-Krieg im Liveticker: +++ 15:32 Russland und Ukraine tauschen 50 Gefangene aus +++,"Berlin, Washington, Br\u00fcssel - \u00fcberall. n-tv berichtet von allen wichtigen Schaupl\u00e4tzen der Innen- und Au\u00dfenpolitik.",https://bilder2.n-tv.de/img/incoming/crop23332537/9041326157-cImg_16_9-w1200/Liveticker1-grau-1-Kopie.jpg,2023-01-08T12:30:00Z,,"Russland und die Ukraine haben den ersten Gefangenaustausch nach dem Jahreswechsel vollzogen. ""Am 8. Januar wurden im Resultat des Verhandlungsprozesses 50 russische Soldaten, denen in Gefangenschaft… [+19632 chars]",,de,'Russland'
https://www.n-tv.de/politik/18-06-Landmine-explodiert-Zivilist-in-der-Oblast-Cherson-verletzt--article23143824.html,https://www.n-tv.de/politik/18-06-Landmine-explodiert-Zivilist-in-der-Oblast-Cherson-verletzt--article23143824.html,0,www.n-tv.de,Ukraine-Krieg im Liveticker: +++ 18:06 Landmine explodiert - Zivilist in der Oblast Cherson verletzt +++,"Berlin, Washington, Br\u00fcssel - \u00fcberall. n-tv berichtet von allen wichtigen Schaupl\u00e4tzen der Innen- und Au\u00dfenpolitik.",https://bilder2.n-tv.de/img/incoming/crop23332537/9041326157-cImg_16_9-w1200/Liveticker1-grau-1-Kopie.jpg,2023-01-08T12:30:00Z,,Ein Zivilist wurde bei der Explosion einer russischen Landmine in Velyka Oleksandrivka in der Oblast Cherson verletzt. Das schreibt der Gouverneur Yaroslav Yanushevych in seinem Telegramkanal. Demnac… [+23696 chars],,de,'Russland'
https://www.sueddeutsche.de/wirtschaft/frankreich-atomkraft-atomkraftwerke-emmanuel-macron-edf-energiekrise-1.5728318,https://www.sueddeutsche.de/wirtschaft/frankreich-atomkraft-atomkraftwerke-emmanuel-macron-edf-energiekrise-1.5728318,0,www.sueddeutsche.de,Atomkraft: Frankreich fehlt die Energie,Jahrzehntelang setzte Paris vor allem auf Strom aus Kernkraft. Ausgerechnet jetzt aber sind Dutzende Meiler außer Betrieb - und kommenden Winter dürfte es kaum besser werden.,https://www.sueddeutsche.de/image/sz.1.5728319/1200x675?v=1673181749,2023-01-08T12:38:28Z,,Jahrzehntelang setzte Paris vor allem auf Strom aus Kernkraft. Ausgerechnet jetzt aber sind Dutzende Meiler außer Betrieb - und kommenden Winter dürfte es kaum besser werden.Anfang Dezember sah es fü… [+7540 chars],,de,'Russland'
https://www.morgenpost.de/politik/ausland/article237314937/London-Russland-fuerchtet-ukrainische-Offensiven.html,https://www.morgenpost.de/politik/ausland/article237314937/London-Russland-fuerchtet-ukrainische-Offensiven.html,0,www.morgenpost.de,Krieg in der Ukraine: London: Russland fürchtet ukrainische Offensiven,Britische Geheimdienstexperten sehen Russland in einem Dilemma: Ein Durchbruch ukrainischer Streitkräfte bei Saporischschja könnte die Versorgung russischer Truppen beeinträchtigen.,https://img.morgenpost.de/img/ausland/crop237314933/005260603-w820-cv16_9-q85/Ukrainische-Panzerartillerie.jpg,2023-01-08T12:53:57Z,,"London. Britische Militärexperten sehen in der Stärkung russischer Verteidigungsstellungen in der Ukraine Hinweise darauf, dass die Befehlshaber ukrainische Offensiven befürchten. In den vergangenen … [+1692 chars]",,de,'Russland'
https://www.zeit.de/news/2023-01/08/london-russland-fuerchtet-ukrainische-offensiven,https://www.zeit.de/news/2023-01/08/london-russland-fuerchtet-ukrainische-offensiven,0,www.zeit.de,Krieg in der Ukraine: London: Russland fürchtet ukrainische Offensiven,,,2023-01-08T12:53:57Z,,"When browsing with ads:
We collect personal data and also transmit it to third-party providers
 that help us improve and finance our digital content. Some of the information stored on your device, … [+732 chars]",,de,'Russland'
https://www.stern.de/politik/ausland/krieg-in-der-ukraine--london--russland-fuerchtet-ukrainische-offensiven-33079318.html,https://www.stern.de/politik/ausland/krieg-in-der-ukraine--london--russland-fuerchtet-ukrainische-offensiven-33079318.html,0,www.stern.de,Krieg in der Ukraine: London: Russland fürchtet ukrainische Offensiven,Britische Geheimdienstexperten sehen Russland in einem Dilemma: Ein Durchbruch ukrainischer Streitkräfte bei Saporischschja könnte die Versorgung russischer Truppen beeinträchtigen.,https://image.stern.de/33079320/t/r3/v1/w1440/r1.7778/-/08--urnnewsmldpacom2009010123010899144186v4w800h600l1796t889r2784b2362jpeg---c6b3d9b4be1cdf5d.jpg,2023-01-08T12:53:57Z,,"Britische Geheimdienstexperten sehen Russland in einem Dilemma: Ein Durchbruch ukrainischer Streitkräfte bei Saporischschja könnte die Versorgung russischer Truppen beeinträchtigen.
Britische Militä… [+1757 chars]",,de,'Russland'
https://www.tagesspiegel.de/politik/umfrage-burger-sehen-panzer-lieferungen-mehrheitlich-skeptisch-9146646.html,https://www.tagesspiegel.de/politik/umfrage-burger-sehen-panzer-lieferungen-mehrheitlich-skeptisch-9146646.html,0,www.tagesspiegel.de,Umfrage : Bürger sehen Panzer-Lieferungen mehrheitlich skeptisch,Laut einer Insa-Umfrage sehen Bürger in Deutschland Panzer-Lieferungen an die Ukraine mehrheitlich skeptisch.,https://www.tagesspiegel.de/images/schutzenpanzer-marder3/alternates/BASE_16_9_W1400/schuetzenpanzer-marder.jpeg,2023-01-08T13:16:37Z,,"Die Entscheidung der Bundesregierung, Marder-Schützenpanzer an die Ukraine zu liefern, stößt bei den Menschen in Deutschland einer Umfrage zufolge auf ein geteiltes Echo. In einer Befragung des Meinu… [+2486 chars]",,de,'Ukraine'
https://www.welt.de/politik/ausland/plus243059565/Ukraine-Krieg-Der-Riss-in-der-Nato-zeigt-sich-an-Deutschland-und-Polen.html,https://www.welt.de/politik/ausland/plus243059565/Ukraine-Krieg-Der-Riss-in-der-Nato-zeigt-sich-an-Deutschland-und-Polen.html,0,www.welt.de,Der Riss in der Nato zeigt sich an Deutschland und Polen,"Einige Nato-Mitglieder – darunter Deutschland – scheinen so bald wie möglich ein Ende der Kampfhandlungen in der Ukraine zu wollen, auch wenn das Land territoriale Konzessionen machen müsste. Polen hingegen will Moskau langfristig schwächen – Russland müsse „…",https://img.welt.de/img/politik/ausland/mobile243059563/2271353377-ci16x9-w1200-fnov-fpotl-fpi157750653/DWO-Teaser-Deutschland-Polen-nato-ms-jpg.jpg,2023-01-08T13:32:20Z,,"utulpeke Butlllhel poleekeu loatlek enp, vep Gttlelette lu Benlpekteup upel Bleuhlelek plek Oelpl ulekl enpenpoleekeu lleneu nup nOlelQeu peOll eluep lklel Glleapelete: uoOtlek pepp Bnppteup lu pelue… [+5771 chars]",,de,'Russland'
https://www.zeit.de/news/2023-01/08/mann-nach-toedlichen-stichen-auf-der-flucht,https://www.zeit.de/news/2023-01/08/mann-nach-toedlichen-stichen-auf-der-flucht,0,www.zeit.de,Landshut: Mann nach tödlichen Stichen auf der Flucht,,,2023-01-08T13:42:14Z,https://web.archive.org/web/20230108140758/https://www.zeit.de/news/2023-01/08/mann-nach-toedlichen-stichen-auf-der-flucht,"When browsing with ads:
We collect personal data and also transmit it to third-party providers
 that help us improve and finance our digital content. Some of the information stored on your device, … [+732 chars]",,de,'Flucht'
https://web.de/magazine/politik/russland-krieg-ukraine/feiernder-russischer-politiker-mexiko-erzeugt-aerger-heimat-37625340,https://web.de/magazine/politik/russland-krieg-ukraine/feiernder-russischer-politiker-mexiko-erzeugt-aerger-heimat-37625340,0,web.de,Feiernder russischer Politiker in Mexiko erzeugt Ärger in der Heimat - WEB.DE News,"<ol><li>Feiernder russischer Politiker in Mexiko erzeugt Ärger in der Heimat  WEB.DE News
</li><li>Ukraine-Krieg im Liveticker: +++ 12:10 Kaim zu Putins Eskalationswillen: ""Sorge vor Atomkrieg ist keine ernsthafte Größe mehr"" +++  n-tv NACHRICHTEN
</li><li>…","https://i0.web.de/image/084/37625084,pd=2,f=opengraph/roman-starowoit.jpg",2023-01-08T13:52:08Z,,"<ul><li>Während in seiner Heimat Krieg herrscht, amüsiert sich ein russischer Politiker im Luxus-Urlaub in Mexiko. </li><li>Dem Kursker Gouverneur Roman Starowoit platzt im Zuge dessen der Kragen. </… [+2001 chars]",,de,'Ukraine'
https://orf.at/stories/3300566/,https://orf.at/stories/3300566/,0,orf.at,Russland: Haben mehr als 600 ukrainische Soldaten getötet,,https://orf.at/mojo/1_4_1/storyserver//news/common/images/og-fallback-news.png,2023-01-08T13:57:18Z,,"Russland hat nach eigenen Angaben mit einem Raketenangriff mehr als 600 ukrainische Soldaten getötet. Es habe sich um einen Angriff auf zwei Gebäude in Kramatorsk in der Ostukraine gehandelt, teilte … [+389 chars]",,de,'Russland'
https://www.diepresse.com/6199225/russland-will-hunderte-ukrainische-soldaten-bei-raketenangriff-getoetet-haben,https://www.diepresse.com/6199225/russland-will-hunderte-ukrainische-soldaten-bei-raketenangriff-getoetet-haben,0,www.diepresse.com,Russland will Hunderte ukrainische Soldaten bei Raketenangriff getötet haben,Das russische Verteidigungsministerium spricht von Rache für den ukrainischen Angriff auf russische Rekruten in Makijwka. Nach dem Ende der von Russland deklarierten Feuerpause meldet die Ukraine neue Explosionen aus Charkiw und anderen Gebieten.,https://media.diepresse.com/social_diepresse_nachrichten/images/uploads_1200/7/b/9/6199225/EAFAD180-254B-453B-9CBC-7BF45FCEFCDD_v0_h.jpg,2023-01-08T14:14:00Z,,Das russische Verteidigungsministerium spricht von Rache für den ukrainischen Angriff auf russische Rekruten in Makijwka. Nach dem Ende der von Russland deklarierten Feuerpause meldet die Ukraine neu… [+46 chars],,de,'Ukraine'
https://www.faz.net/aktuell/politik/ukraine-liveticker-russland-und-ukraine-tauschen-50-gefangene-aus-18495964.html,https://www.faz.net/aktuell/politik/ukraine-liveticker-russland-und-ukraine-tauschen-50-gefangene-aus-18495964.html,0,www.faz.net,Ukraine-Liveblog: London: Russland und Ukraine tauschen 50 Gefangene aus,London: Russland bereitet sich an zwei Fronten auf ukrainische Gegenoffensive vor +++ Göring-Eckardt und Kubicki für Lieferung deutscher Kampfpanzer +++ alle Entwicklungen im Liveblog.,https://media1.faz.net/ppmedia/aktuell/48924160/1.8587525/facebook_teaser/das-foto-das-am-8-januar-bei.jpg,2023-01-08T15:53:53Z,https://web.archive.org/web/20230108160130/https://www.faz.net/aktuell/politik/ukraine-liveticker-russland-und-ukraine-tauschen-50-gefangene-aus-18495964.html,Das britische Verteidigungsministerium schreibt in seinem täglichen Lagebericht zum Krieg in der Ukraine:In den letzten Wochen hat Russland seine Verteidigungsanlagen in der zentralen Oblast Saporisc… [+895 chars],,de,'Ukraine'
https://www.morgenpost.de/wirtschaft/article237316303/gas-deutschland-mangel-bundesnetzagentur-mueller.html,https://www.morgenpost.de/wirtschaft/article237316303/gas-deutschland-mangel-bundesnetzagentur-mueller.html,0,www.morgenpost.de,Heizen: Bundesnetzagentur: Keine Gefahr für Gasmangel diesen Winter,"Der Chef der Bundesnetzagentur, Klaus Müller, sieht derzeit keinen Gasmangel auf Deutschland zukommen. Trotzdem hat er eine Empfehlung.",https://img.morgenpost.de/img/politik/crop237171277/4412607687-w820-cv16_9-q85/20ce5ade-7d3e-11ed-9cb1-cd435cdba9cb.jpg,2023-01-08T16:02:09Z,https://web.archive.org/web/20230108162116/https://www.morgenpost.de/wirtschaft/article237316303/gas-deutschland-mangel-bundesnetzagentur-mueller.html,"Berlin. Nach Ansicht des Präsidenten der Bundesnetzagentur, Klaus Müller, ist die Gefahr einer Gasmangellage diesen Winter für überwunden. In einem Interview mit der Bild am Sonntag sagte er: Bei all… [+2405 chars]",,de,'Heizen'
https://www.sueddeutsche.de/politik/klimaproteste-luetzerath-fridays-for-future-1.5728328,https://www.sueddeutsche.de/politik/klimaproteste-luetzerath-fridays-for-future-1.5728328,0,www.sueddeutsche.de,Grüne und Klimapolitik: Kann das weg?,Das Kohledorf Lützerath steht vor der Räumung. Klimaaktivisten kritisieren die Grünen dafür scharf. Die Öko-Partei will nun ihren Klimakurs verschärfen.,https://www.sueddeutsche.de/image/sz.1.5728329/1200x675?v=1673194022,2023-01-08T16:07:23Z,https://web.archive.org/web/20230108163106/https://www.sueddeutsche.de/politik/klimaproteste-luetzerath-fridays-for-future-1.5728328,"Das Kohledorf Lützerath steht vor der Räumung. Klimaaktivisten kritisieren die Grünen dafür scharf. Die Öko-Partei will nun ihren Klimakurs verschärfen.Sie ahnen, dass der Untergang näher rückt. Weic… [+5365 chars]",,de,'Klima'
https://www.zeit.de/wissen/2022-12/palaeoklimatologie-klimaforschung-vergangenheit-fs,https://www.zeit.de/wissen/2022-12/palaeoklimatologie-klimaforschung-vergangenheit-fs,0,www.zeit.de,Paläoklimatologie: In einem Klima vor unserer Zeit,"Längst vergangenes Klima zu entschlüsseln, ist Detektivarbeit. Weltweit lagern Indizien in den Archiven der Natur: unschätzbares Wissen, um den Klimawandel zu verstehen.",,2023-01-08T16:29:15Z,https://web.archive.org/web/20230107214618/https://www.zeit.de/wissen/2022-12/palaeoklimatologie-klimaforschung-vergangenheit-fs,"When browsing with ads:
We collect personal data and also transmit it to third-party providers
 that help us improve and finance our digital content. Some of the information stored on your device, … [+732 chars]",,de,'Klima'
https://www.zeit.de/politik/ausland/2023-01/ukraine-ueberblick-gefangenenaustausch-russland-manoever-belarus,https://www.zeit.de/politik/ausland/2023-01/ukraine-ueberblick-gefangenenaustausch-russland-manoever-belarus,0,www.zeit.de,"Ukraine-Überblick: Russland und Ukraine tauschen Gefangene aus, Manöver in Belarus",Jeweils 50 gefangene russische und ukrainische Soldaten sind ausgetauscht worden. Russland und Belarus wollen gemeinsame Manöver intensivieren. Das war der Tag.,,2023-01-08T17:45:02Z,https://web.archive.org/web/20230108175022/https://www.zeit.de/politik/ausland/2023-01/ukraine-ueberblick-gefangenenaustausch-russland-manoever-belarus,"When browsing with ads:
We collect personal data and also transmit it to third-party providers
 that help us improve and finance our digital content. Some of the information stored on your device, … [+732 chars]",,de,'Ukraine'
https://www.tagesschau.de/newsticker/liveblog-ukraine-montag-219.html,https://www.tagesschau.de/newsticker/liveblog-ukraine-montag-219.html,0,www.tagesschau.de,Ukraine-Liveblog: ++ Ukraine wehrt Angriffe im Donbass ab ++,"Laut ukrainischem Präsidenten gelingt es russischen Truppen nicht, im Osten des Landes durchzubrechen. Die OSZE-Chefin hält eine Mitgliedschaft Russlands in ihrer Organisation für ""sinnvoll"". Die aktuellen Entwicklungen im Liveblog.",https://www.tagesschau.de/multimedia/bilder/bachmut-119~_v-original.jpg,2023-01-09T04:13:24Z,https://web.archive.org/web/20230109041408/http://www.tagesschau.de/newsticker/liveblog-ukraine-montag-219.html,"Zum ersten Mal in diesem Jahr haben die Kriegsparteien Gefangene ausgetauscht. Die OSZE-Chefin hält eine Mitgliedschaft Russlands in ihrer Organisation für ""sinnvoll"". Die aktuellen Entwicklungen im … [+2538 chars]",,de,'Ukraine'
https://orf.at/stories/3295579/,https://orf.at/stories/3295579/,0,orf.at,Hoffen auf ein Grüngas-Wunder,Im Kampf gegen die Klimakrise muss auch Österreich in den kommenden Jahrzehnten weg von fossilen Energieträgern – und dafür viele Hebel in Bewegung setzen. Eine auf den ersten Blick sehr schnelle Maßnahme könnte der Ausbau der Biogasproduktion sein. Doch was …,https://ibs.orf.at/news?image=https%3A%2F%2Fassets.orf.at%2Fmims%2F2022%2F49%2F98%2Fcrops%2Fw%3D1200%2Ch%3D630%2Cq%3D75%2F1589005_master_581798_biogas_ausbau_stagnation_a.jpg%3Fs%3D786eb3f117267210732bbee14e7fcd03bb8a4eb2,2023-01-09T05:15:37Z,https://web.archive.org/web/20230109055118/https://orf.at/stories/3295579/,"Wer etwas über das Prinzip Hoffnung lernen will, sollte mit Franz Kirchmeyr reden. Seit Jahren leitet er den Fachbereich Biogas im Kompost &amp; Biogas Verband Österreich. Er ist damit so etwas wie d… [+9385 chars]",,de,'Heizen'
https://www.faz.net/aktuell/politik/ausland/chaos-in-brasilia-brasiliens-sturm-aufs-kapitol-18588213.html,https://www.faz.net/aktuell/politik/ausland/chaos-in-brasilia-brasiliens-sturm-aufs-kapitol-18588213.html,0,www.faz.net,Chaos in Brasilia: Brasiliens Sturm aufs Kapitol,"Radikale Bolsonaro-Anhänger verwüsten in der Hauptstadt Brasilia Regierungssitz, Kongress und Verfassungsgericht. Die Situation war erst nach mehreren Stunden unter Kontrolle. Die Suche nach den Verantwortlichen wird das politische Klima weiter anheizen.",https://media0.faz.net/ppmedia/aktuell/politik/3237775428/1.8588218/facebook_teaser/luiz-inacio-lula-da-silva.jpg,2023-01-09T05:51:20Z,,"Der 8. Januar wird als denkwürdiger Tag in die brasilianische Geschichte eingehen. Chaos und blinde Zerstörungswut hielten die Hauptstadt Brasilia über Stunden in Atem, nachdem Hunderte radikalisiert… [+2888 chars]",,de,'heizen'
https://www.faz.net/aktuell/politik/ausland/bolsonaro-anhaenger-auf-welcher-seite-stehen-die-sicherheitskraefte-18588213.html,https://www.faz.net/aktuell/politik/ausland/bolsonaro-anhaenger-auf-welcher-seite-stehen-die-sicherheitskraefte-18588213.html,0,www.faz.net,Aufstand der Bolsonaristen: Auf wessen Seite stehen die Sicherheitskräfte?,"Radikale Bolsonaro-Anhänger verwüsten Regierungssitz, Kongress und Verfassungsgericht in Brasilia. Die Situation war erst nach mehreren Stunden unter Kontrolle. Die Suche nach den Verantwortlichen wird das politische Klima weiter anheizen.",https://media0.faz.net/ppmedia/aktuell/politik/3237775428/1.8588218/facebook_teaser/luiz-inacio-lula-da-silva.jpg,2023-01-09T05:51:20Z,,"Der 8. Januar wird als denkwürdiger Tag in die brasilianische Geschichte eingehen. Chaos und blinde Zerstörungswut hielten die Hauptstadt Brasilia über Stunden in Atem, nachdem Hunderte radikaler Anh… [+2900 chars]",,de,'Klima'
https://www.focus.de/panorama/focus-online-exklusiv-irre-flucht-des-killers-aus-gericht-sein-anwalt-sah-noch-die-schuhsohlen_id_182552545.html,https://www.focus.de/panorama/focus-online-exklusiv-irre-flucht-des-killers-aus-gericht-sein-anwalt-sah-noch-die-schuhsohlen_id_182552545.html,0,www.focus.de,Rachid Chouakri floh aus Gericht - „Bin immer noch geschockt“: Anwalt spricht exklusiv über Mörder-Flucht,Der verurteilte Mörder Rachid Chouakri (40) floh vergangene Woche filmreif aus dem Amtsgericht Regensburg und konnte trotz Großfahndung bislang nicht gefasst werden. Jetzt spricht erstmals der Anwalt des hochgefährlichen Algeriers über den Moment der Flucht.V…,https://p6.focus.de/img/fotos/id_182552849/coooo.png?im=Crop%3D%28322%2C0%2C3690%2C1845%29%3BResize%3D%281200%2C627%29&impolicy=perceptual&quality=medium&hash=47153ff91459b1d0cc811644a9dca8c9f36daef21163023d4c80e63ecf00e5e4,2023-01-09T07:16:53Z,https://web.archive.org/web/20230109072802/https://www.focus.de/panorama/focus-online-exklusiv-irre-flucht-des-killers-aus-gericht-sein-anwalt-sah-noch-die-schuhsohlen_id_182552545.html,Der verurteilte Mörder Rachid Chouakri (40) floh vergangene Woche filmreif aus dem Amtsgericht Regensburg und konnte trotz Großfahndung bislang nicht gefasst werden. Jetzt spricht erstmals der Anwalt… [+4468 chars],,de,'Flucht'
