index,url,valid,domain,title,description,image,published,archive,content,quote,language,keyword
https://www.nzz.ch/international/eine-heikle-fracht-explosionen-und-ein-mysterioeser-untergang-wurde-vor-spanien-ein-schiff-der-russischen-schattenflotte-versenkt-ld.10007683,https://www.nzz.ch/international/eine-heikle-fracht-explosionen-und-ein-mysterioeser-untergang-wurde-vor-spanien-ein-schiff-der-russischen-schattenflotte-versenkt-ld.10007683,0,www.nzz.ch,"Eine heikle Fracht, Explosionen und ein mysteriöser Untergang: Wurde vor Spanien ein Schiff der russischen Schattenflotte versenkt?","Der Frachter «Ursa Major» war jahrelang für Russland unterwegs. Im Dezember 2024 sank das Schiff vor der spanischen Küste plötzlich, zwei Personen starben. Nun gibt es neue Hinweise darauf, was hinter dem Untergang stecken könnte.","https://img-msp-prod.nzz.ch/2026/06/02/1aee0905-53fc-46d4-bcd3-638421672c3f.png?width=1200&height=675&fit=bounds&quality=75&auto=webp&crop=8001,4501,x0,y293&wmark=nzz",2026-06-06T03:30:00Z,,"Als sich spanische Rettungsboote der «Ursa Major» am Nachmittag des 23.Dezember 2024 nähern, hat der Frachter bereits merklich Schlagseite.
Kurz vor Weihnachten 2024 sorgte der Untergang eines russi… [+12705 chars]",,de,'Ukraine'
https://noe.orf.at/stories/3357297/,https://noe.orf.at/stories/3357297/,0,noe.orf.at,Austausch über Windkraft: Rückenwind für Energiewende,Niederösterreich und Niedersachsen (Deutschland) wollen Vorreiter bei der Energiewende sein. Sie setzen auf Wind- und Sonnenkraft. Künftig wollen sie ihre Erfahrungen beim Ausstieg aus Erdöl und Erdgas austauschen. Das war Thema bei einem Arbeitstreffen in Ha…,https://ibs.orf.at/noe?image=https%3A%2F%2Foekastatic.orf.at%2Fmims%2F2022%2F17%2F34%2Fcrops%2Fw%3D1200%2Ch%3D627%2Cq%3D75%2F1540791_master_473034_abd0024.jpg%3Fs%3D4cfa9a52a85d631f7ee298f2280f42782337de30,2026-06-06T04:18:14Z,,"Windkraft-Anlagen auf dem offenen Meer: Darauf setzt das deutsche Bundesland Niedersachsen. Aber auch an Land spielen die Windräder eine große Rolle.
Für die Stromerzeugung in Niedersachsen habe die… [+2543 chars]",,de,'Erdöl'
https://www.dw.com/de/40-jahre-umweltministerium-kampf-f%C3%BCr-klima-und-natur/a-77406329,https://www.dw.com/de/40-jahre-umweltministerium-kampf-f%C3%BCr-klima-und-natur/a-77406329,0,www.dw.com,40 Jahre Umweltministerium: Kampf für Klima und Natur,Das Umweltministerium wurde 1986 nach der Reaktorkatastrophe von Tschernobyl gegründet. Zum 40-jährigen Bestehen blickt es auf Fortschritte beim Klimaschutz und beim Abbau von Treibhausgasen zurück.,https://static.dw.com/image/77406964_6.jpg,2026-06-06T04:21:00Z,,"Sechs frühere Bundesumweltministerinnen und -minister sitzen im ""Café Moskau"" im Herzen Berlins nebeneinander, auch der aktuelle Amtsinhaber Carsten Schneider (SPD) ist dabei. Sie kommen aus CDU/CSU,… [+6298 chars]",,de,'Atomkraft'
https://www.stern.de/politik/ausland/drohnenkrieg--ukraine-greift-russland-erneut-massiv-mit-kampfdrohnen-an-37502152.html,https://www.stern.de/politik/ausland/drohnenkrieg--ukraine-greift-russland-erneut-massiv-mit-kampfdrohnen-an-37502152.html,0,www.stern.de,Drohnenkrieg: Ukraine greift Russland erneut massiv mit Kampfdrohnen an,Wie am ersten Tag des internationalen Wirtschaftsforums in St. Petersburg hat die Ukraine die Millionenstadt erneut mit Kampfdrohnen angriffen. Auch andere russische Regionen melden Attacken.,https://image.stern.de/37502154/t/vQ/v1/w1440/r1.7778/-/06--5y3vaufvo3v9axs2048jpeg---15c865b064f93e61.jpg,2026-06-06T06:45:52Z,,"Kopiere den aktuellen Link
Zur Merkliste hinzufügen
Wie am ersten Tag des internationalen Wirtschaftsforums in St. Petersburg hat die Ukraine die Millionenstadt erneut mit Kampfdrohnen angriffen. A… [+2479 chars]",,de,'Ukraine'
https://www.zeit.de/news/2026-06/06/ukraine-greift-russland-erneut-massiv-mit-kampfdrohnen-an,https://www.zeit.de/news/2026-06/06/ukraine-greift-russland-erneut-massiv-mit-kampfdrohnen-an,0,www.zeit.de,Drohnenkrieg: Ukraine greift Russland erneut massiv mit Kampfdrohnen an,Hier finden Sie Informationen zu dem Thema „Drohnenkrieg“. Lesen Sie jetzt „Ukraine greift Russland erneut massiv mit Kampfdrohnen an“.,https://img.zeit.de/news/2026-06/06/ukraine-greift-russland-erneut-massiv-mit-kampfdrohnen-an-image-group/wide__1300x731,2026-06-06T06:45:52Z,,Am letzten Tag des internationalen Wirtschaftsforums in St. Petersburg haben die ukrainischen Streitkräfte die Millionenstadt erneut unter Beschuss genommen. Gouverneur Alexander Beglow und auch der … [+2282 chars],,de,'Russland'
https://www.tagesspiegel.de/internationales/drohnenkrieg-ukraine-greift-russland-erneut-massiv-mit-kampfdrohnen-an-15686007.html,https://www.tagesspiegel.de/internationales/drohnenkrieg-ukraine-greift-russland-erneut-massiv-mit-kampfdrohnen-an-15686007.html,0,www.tagesspiegel.de,Drohnenkrieg: Ukraine greift Russland erneut massiv mit Kampfdrohnen an,Wie am ersten Tag des internationalen Wirtschaftsforums in St. Petersburg hat die Ukraine die Millionenstadt erneut mit Kampfdrohnen angriffen. Auch andere russische Regionen melden Attacken.,https://www.tagesspiegel.de/images/15686006/alternates/BASE_16_9_W1400/1780728428000/ukraine-krieg-st-petersburg.jpeg,2026-06-06T06:47:09Z,,Am letzten Tag des internationalen Wirtschaftsforums in St. Petersburg haben die ukrainischen Streitkräfte die Millionenstadt erneut unter Beschuss genommen. Gouverneur Alexander Beglow und auch der … [+2328 chars],,de,'Ukraine'
https://www.tagesspiegel.de/internationales/drohnenkrieg-kiew-greift-russland-mit-drohnen-an-brande-und-schaden-15686007.html,https://www.tagesspiegel.de/internationales/drohnenkrieg-kiew-greift-russland-mit-drohnen-an-brande-und-schaden-15686007.html,0,www.tagesspiegel.de,Drohnenkrieg: Kiew greift Russland mit Drohnen an - Brände und Schäden,Wie am ersten Tag des Wirtschaftsforums in St. Petersburg hat die Ukraine die Stadt mit Kampfdrohnen angriffen. Auch andere russische Regionen melden Attacken. Und Präsident Selenskyj meldet sich.,https://www.tagesspiegel.de/images/15687139/alternates/BASE_16_9_W1400/1780748379000/ukraine-krieg-st-petersburg.jpeg,2026-06-06T06:47:09Z,,Am letzten Tag des internationalen Wirtschaftsforums in St. Petersburg haben die ukrainischen Streitkräfte die Millionenstadt erneut unter Beschuss genommen. Gouverneur Alexander Beglow und auch der … [+4485 chars],,de,'Ukraine'
https://www.sueddeutsche.de/politik/ukraine-krieg-newsblog-sankt-petersburg-angriffe-russland-li.3490156,https://www.sueddeutsche.de/politik/ukraine-krieg-newsblog-sankt-petersburg-angriffe-russland-li.3490156,0,www.sueddeutsche.de,Krieg in der Ukraine: Ukraine greift erneut Sankt Petersburg an,Auch am letzten Tag des internationalen Wirtschaftsforums beschießt das ukrainische Militär die Millionenstadt. Aus anderen Gebieten werden ebenfalls Drohneneinschläge gemeldet.,https://www.sueddeutsche.de/2026/06/06/5f738d0b-0000-4245-b373-233c1c42d1ca.jpg?q=60&fm=webp&width=1200&rect=0%2C155%2C4000%2C2250,2026-06-06T07:00:00Z,,Am letzten Tag des internationalen Wirtschaftsforums in Sankt Petersburg haben die ukrainischen Streitkräfte die Millionenstadt erneut unter Beschuss genommen. Gouverneur Alexander Beglow und auch de… [+1824 chars],,de,'Ukraine'
https://www.dw.com/de/putin-selenskyj-ukraine-krieg-iran-usa-hantavirus-argentinien-eu-kommission-grenzkontrollen-papst/a-77442962,https://www.dw.com/de/putin-selenskyj-ukraine-krieg-iran-usa-hantavirus-argentinien-eu-kommission-grenzkontrollen-papst/a-77442962,0,www.dw.com,Putin lehnt Treffen mit Selenskyj ab - News kompakt: Das Wichtigste kurz gefasst,Nach einem Gesprächsangebot des ukrainischen Präsidenten lehnt Russlands Machthaber Putin ab. Der Iran und die USA haben sich trotz Waffenruhe wieder gegenseitig angegriffen. Der DW-Nachrichtenüberblick. Kremlchef Wladimir Putin will sich nicht zu einem direk…,https://static.dw.com/image/77438907_6.jpg,2026-06-06T07:00:00Z,,"Kremlchef Wladimir Putin will sich nicht zu einem direkten Gespräch mit dem ukrainischen Präsidenten Wolodymyr Selenskyj treffen. Er sehe dafür derzeit keinen Grund, sagte der russische Staatschef be… [+5603 chars]",,de,'Iran'
https://www.faz.net/aktuell/politik/ukraine/ukraine-liveticker-russland-ukraine-greift-wieder-sankt-petersburg-an-faz-110683325.html,https://www.faz.net/aktuell/politik/ukraine/ukraine-liveticker-russland-ukraine-greift-wieder-sankt-petersburg-an-faz-110683325.html,0,www.faz.net,Liveblog Ukrainekrieg: Ukraine greift wieder Sankt Petersburg an,Gouverneur: „Großangelegter Angriff durch militärische Drohnen“ +++ Ukraine entschuldigt sich bei Athen für Drohnenvorfall +++  Kreml: Vieraugengespräch zwischen Putin und Schröder +++ alle Neuigkeiten im Liveblog,https://media0.faz.net/image/w1200h627/b88335ecd9c8/w6515h3404x0y815o/202606/43601.0.2185457685/rauch-ueber-sankt-petersburg.webp,2026-06-06T07:42:14Z,,Im April war der Düsseldorfer Karnevalswagenbauer Jacques Tilly in Moskau in Abwesenheit zu achteinhalb Jahren Haft verurteilt worden jetzt kündigt sich ein Revisionsprozess an. Das Auswärtige Amt ha… [+1323 chars],,de,'Ukraine'
https://www.faz.net/aktuell/feuilleton/kolumnen/kolumne-lost-and-found-gedenktag-fuer-die-im-krieg-getoeteten-kinder-accg-200899702.html,https://www.faz.net/aktuell/feuilleton/kolumnen/kolumne-lost-and-found-gedenktag-fuer-die-im-krieg-getoeteten-kinder-accg-200899702.html,0,www.faz.net,Lost and Found: Gedenktag für die im Krieg getöteten Kinder,"Unsere Kolumnistin ist in Palermo. Und muss, in dieser Stadt mit ihrem Totenkult, an den Krieg in der Ukraine denken.",https://media0.faz.net/image/w1200h627/2edc8ab5a10e/w2903h1516x0y179o/202606/43601.0.2185025144/schwer-bewaffnete-ritter.webp,2026-06-06T10:00:09Z,,"Ich fuhr zum Strand von Castellammare. Sizilien, Heimat meiner Seele so gerne würde ich es sagen, so gerne wäre ich von hier. Rechts von mir erstreckte sich eine felsige Meeresküste. Der Tag versprac… [+5931 chars]",,de,'Ukraine'
https://www.zeit.de/politik/ausland/2026-06/drohnenangriffe-sankt-petersburg-ukraine-russland-gxe,https://www.zeit.de/politik/ausland/2026-06/drohnenangriffe-sankt-petersburg-ukraine-russland-gxe,0,www.zeit.de,Drohnenangriffe auf St. Petersburg: Ukraine greift St. Petersburg mit Kampfdrohnen an,"Während das Wirtschaftsforum in St. Petersburg stattfindet, wird die Stadt mit ukrainischen Drohnen attackiert. Sogar der Flughafen wurde für einige Stunden gesperrt.",https://img.zeit.de/politik/ausland/2026-06/drohnenangriffe-sankt-petersburg-ukraine-russland-bild/wide__1300x731,2026-06-06T10:01:26Z,,Am letzten Tag des internationalen Wirtschaftsforums in St. Petersburg haben die ukrainischen Streitkräfte die Millionenstadt erneut mit Kampfdrohnen angegriffen. Gouverneur Alexander Beglow und auch… [+3035 chars],,de,'Wladimir Putin'
https://www.n-tv.de/wirtschaft/Die-Sonne-knipst-die-franzoesischen-Atomkraftwerke-aus-id30891601.html,https://www.n-tv.de/wirtschaft/Die-Sonne-knipst-die-franzoesischen-Atomkraftwerke-aus-id30891601.html,0,www.n-tv.de,Solare Wucht stresst Reaktoren : Die Sonne knipst die französischen Atomkraftwerke aus,In Frankreich liefern 57 Atomreaktoren zuverlässig Dauerstrom. Gleichzeitig setzt Frankreich wie Deutschland auf Solar- und Windenergie. Deren Wankelmütigkeit zwingt die französischen Reaktoren in die Flexibilität. Dafür wurden sie aber nicht gebaut. Der Betr…,https://www.n-tv.de/img/30891554/1780576182/Img_16_9/1200/View-on-cooling-towers-of-nuclear-power-plant-thermal-power-station-in-which-heat-source-is-nuclear-reactor-France-Europe-cheap-energy-source.jpg,2026-06-06T12:03:05Z,,"An sonnigen Tagen werden die französischen Atomkraftwerke nicht mehr benötigt. (Foto: picture alliance / Visually)
In Frankreich liefern 57 Atomreaktoren zuverlässig Dauerstrom. Gleichzeitig setzt F… [+9632 chars]",,de,'Atomkraft'
https://www.faz.net/aktuell/rhein-main/frankfurt/ausstellung-in-frankfurt-stellt-juedisch-muslimische-partnerschaften-vor-accg-200900052.html,https://www.faz.net/aktuell/rhein-main/frankfurt/ausstellung-in-frankfurt-stellt-juedisch-muslimische-partnerschaften-vor-accg-200900052.html,0,www.faz.net,Ausstellung in Frankfurt: Jüdisch-muslimische Duos – was hält sie zusammen?,"Die Frankfurter Schau „Zusammenhalt in der Krise“ porträtiert jüdisch-muslimische Beziehungen. Hanifa Haqani und Manfred Levy zeigen, wie Dialog Vorurteile aufbrechen kann.",https://media0.faz.net/image/w1200h627/68afded3f334/w4364h2280x477y941o/202606/43601.0.2174021552/gespraechsbereit-hanifa-haqani.webp,2026-06-06T14:07:58Z,,"Die Taktzahl der Schlagzeilen, die das Verhältnis von Juden und Muslimen als einen ständigen Konflikt beschreiben, ist hoch. Der Krieg im Nahen Osten, der Terrorangriff auf Israel sind nur Teile davo… [+4121 chars]",,de,'Krise'
https://www.faz.net/aktuell/wirtschaft/die-welt-von-morgen-ueberall-pinien-die-bahn-ohne-fahrplan-accg-200813026.html,https://www.faz.net/aktuell/wirtschaft/die-welt-von-morgen-ueberall-pinien-die-bahn-ohne-fahrplan-accg-200813026.html,0,www.faz.net,"Zukunftsvision: Die Welt von morgen: Überall Pinien, die Bahn ohne Fahrplan","Wir schreiben das Jahr 2050: Der Klimawandel schreitet voran, die Züge sind noch immer nicht pünktlich. Und sonst?",https://media0.faz.net/image/w1200h627/9bc27bd87b43/w4032h2106x0y501o/202602/43601.0.1756001766/wie-in-rom-pinien-koennten.webp,2026-06-06T14:24:15Z,,"Lange ist es nicht mehr hin. Knapp 25 Jahre noch, dann ist die Jahrhundertmitte erreicht. Lange ist es aber auch nicht her, dass wir die Jahrtausendwende begingen, damals eine Projektionsfläche für Z… [+9422 chars]",,de,'heizen'
https://www.faz.net/aktuell/finanzen/finanzmarkt/es-zaehlt-stabilitaet-kommentar-zur-nachfolge-von-lagarde-bei-der-ezb-200902406.html,https://www.faz.net/aktuell/finanzen/finanzmarkt/es-zaehlt-stabilitaet-kommentar-zur-nachfolge-von-lagarde-bei-der-ezb-200902406.html,0,www.faz.net,Lagarde-Nachfolge: Entscheidend ist der Kampf gegen die Inflation,"Für EZB-Präsidentin Christine Lagarde wird ein Nachfolger gesucht. Aus welchem Land er kommt, ist dabei zweitrangig.",https://media0.faz.net/image/w1200h627/7c98c19b499a/w7341h3835x0y187o/202604/43601.0.2034187075/noch-fuehrt-sie-die.webp,2026-06-06T14:56:20Z,,"Ist es wichtig, dass künftig jemand aus Deutschland an der Spitze der Europäischen Zentralbank steht? Nach Präsidenten aus den Niederlanden, Frankreich und Italien wäre das ja eigentlich mal an der Z… [+910 chars]",,de,'Inflation'
https://www.faz.net/aktuell/politik/inland/europaeische-union-sanktionen-gegen-hueseyin-doru-und-russische-propaganda-accg-200888969.html,https://www.faz.net/aktuell/politik/inland/europaeische-union-sanktionen-gegen-hueseyin-doru-und-russische-propaganda-accg-200888969.html,0,www.faz.net,Russlands Einflussnahme: Wie das BSW für Moskaus Propagandisten kämpft,"Hüseyin Doğru wurde von der EU sanktioniert, die Bundesregierung ist überzeugt, dass Russland hinter seiner Medienplattform „Red“ steht. Die Wagenknecht-Partei macht ihn nun zur Ikone der Pressefreiheit.",https://media0.faz.net/image/w1200h627/6a7d8f5ffcf4/w5455h2850x313y724o/202605/43601.0.2163556386/sahra-wagenknecht-im-mai-bei.webp,2026-06-06T15:13:46Z,,"Wird ein Journalist in Deutschland wegen seiner politischen Meinung wirtschaftlich vernichtet und entrechtet? So stellt es ein Aufruf dar, den die BSW-Politikerin Sevim Dadelen derzeit verbreitet. Wa… [+10580 chars]",,de,'Russland'
https://stadt-bremerhaven.de/c-seed-bugatti-n1-micro-led-tv-mit-sportwagen-kooperation-zum-entsprechenden-preis/,https://stadt-bremerhaven.de/c-seed-bugatti-n1-micro-led-tv-mit-sportwagen-kooperation-zum-entsprechenden-preis/,0,stadt-bremerhaven.de,C-Seed Bugatti N1: Micro-LED-TV mit Sportwagen-Kooperation – zum entsprechenden Preis,"Der österreichische Anbieter C-Seed hat vor einigen Jahren Micro-LED-Fernseher auf den Markt gebracht. Jetzt legt man diese neu auf und zwar in Zusammenarbeit mit der Sportwagenmarke Bugatti. Passt aus meiner Sicht ganz gut, denn auch preislich dürften die TV…",https://stadt-bremerhaven.de/wp-content/uploads/2026/06/C-Seed-Bugatti-N1.jpg,2026-06-06T18:30:20Z,,Der österreichische Anbieter C-Seed hat vor einigen Jahren Micro-LED-Fernseher auf den Markt gebracht. Jetzt legt man diese neu auf und zwar in Zusammenarbeit mit der Sportwagenmarke Bugatti. Passt a… [+2155 chars],,de,'Preis'
https://www.welt.de/wirtschaft/plus6a1af10c411d40cd4c74cbb8/strategiewechsel-der-anbieter-jetzt-offenbart-die-ki-ihren-wahren-preis.html,https://www.welt.de/wirtschaft/plus6a1af10c411d40cd4c74cbb8/strategiewechsel-der-anbieter-jetzt-offenbart-die-ki-ihren-wahren-preis.html,0,www.welt.de,Jetzt offenbart die KI ihren wahren Preis,"Bislang subventionieren KI-Anbieter die Nutzung ihrer Chatmodelle und Agenten. Doch der Verbrauch an Rechenleistung explodiert derart, dass die Firmen ihre Preismodelle nun umstellen. Die Kundschaft trifft dieser Strategiewechsel ziemlich unvorbereitet.",https://images.welt.de/6a1af10c411d40cd4c74cbb8/bada6437b96a1d87de5869cbbee8119f-master/ci16x9-w1200/gettyimages-885300378-3-jpg,2026-06-06T19:26:52Z,,"Bislang subventionieren KI-Anbieter die Nutzung ihrer Chatmodelle und Agenten. Doch der Verbrauch an Rechenleistung explodiert derart, dass die Firmen ihre Preismodelle nun umstellen. Die Kundschaft … [+53 chars]",,de,'Preis'
https://www.zeit.de/news/2026-06/07/us-militaer-zwei-iranische-drohnen-abgeschossen,https://www.zeit.de/news/2026-06/07/us-militaer-zwei-iranische-drohnen-abgeschossen,0,www.zeit.de,Iran-Krieg: US-Militär: Zwei iranische Drohnen abgeschossen,Hier finden Sie Informationen zu dem Thema „Iran-Krieg“. Lesen Sie jetzt „US-Militär: Zwei iranische Drohnen abgeschossen“.,https://img.zeit.de/news/2026-06/07/us-militaer-zwei-iranische-drohnen-abgeschossen-image-group/wide__1300x731,2026-06-07T01:28:24Z,,Das US-Militär hat nach eigenen Angaben im Bereich der Straße von Hormus zwei iranische Kampfdrohnen abgeschossen. Diese hätten eine Bedrohung für die internationale Schifffahrt in der Meerenge darge… [+1076 chars],,de,'Iran'
https://www.zeit.de/news/2026-06/07/wie-sich-kliniken-fuer-krisen-und-krieg-ruesten,https://www.zeit.de/news/2026-06/07/wie-sich-kliniken-fuer-krisen-und-krieg-ruesten,0,www.zeit.de,Lehren für den Ernstfall: Wie sich Kliniken für Krisen und Krieg rüsten,Hier finden Sie Informationen zu dem Thema „Lehren für den Ernstfall“. Lesen Sie jetzt „Wie sich Kliniken für Krisen und Krieg rüsten“.,https://img.zeit.de/news/2026-06/07/wie-sich-kliniken-fuer-krisen-und-krieg-ruesten-image-group/wide__1300x731,2026-06-07T02:00:19Z,,Vom Hubschrauber-Landeplatz auf dem Dach des Frankfurter Universitätsklinikums geht es direkt in den sogenannten Schockraum. In dem hoch spezialisierten Behandlungsraum liefert unter anderem ein Comp… [+4931 chars],,de,'Krise'
https://www.zeit.de/news/2026-06/07/ukraine-krieg-europaeer-draengen-an-den-verhandlungstisch,https://www.zeit.de/news/2026-06/07/ukraine-krieg-europaeer-draengen-an-den-verhandlungstisch,0,www.zeit.de,Gipfel mit Selenskyj: Ukraine-Krieg: Europäer drängen an den Verhandlungstisch,Hier finden Sie Informationen zu dem Thema „Gipfel mit Selenskyj“. Lesen Sie jetzt „Ukraine-Krieg: Europäer drängen an den Verhandlungstisch“.,https://img.zeit.de/news/2026-06/07/ukraine-krieg-europaeer-draengen-an-den-verhandlungstisch-image-group/wide__1300x731,2026-06-07T03:00:14Z,,Der neue Vorstoß des ukrainischen Präsidenten Wolodymyr Selenskyj für Gespräche mit Russland über ein Ende des Ukraine-Krieges ist zunächst ins Leere gelaufen. Der russische Staatschef Wladimir Putin… [+4066 chars],,de,'Ukraine'
https://www.zeit.de/2026/25/klimaszenarien-studie-ipcc-desinformation-donald-trump,https://www.zeit.de/2026/25/klimaszenarien-studie-ipcc-desinformation-donald-trump,0,www.zeit.de,"Klimaszenarien: Hä, welche Klimakrise denn?","Wird schon nicht so schlimm, wenn man es nur oft genug sagt: Wie Populisten Warnungen und Prognosen instrumentalisieren, um die Gefahren für die Welt kleinzureden.",https://img.zeit.de/2026/25/hae-welche-klimakrise-denn-bild-3/wide__1300x731,2026-06-07T03:26:12Z,,"Wrong! Wrong! Wrong!« Diese drei Wörter schickte Donald Trump vor ein paar Tagen über seine Plattform Truth Social in die Welt. Das höchste »UN-Klima-Komitee« habe zugegeben, dass seine Voraussagen f… [+666 chars]",,de,'Gas'
https://www.faz.net/aktuell/politik/ukraine/ukraine-liveticker-merz-starmer-und-macron-treffen-selenskyj-in-london-faz-110683325.html,https://www.faz.net/aktuell/politik/ukraine/ukraine-liveticker-merz-starmer-und-macron-treffen-selenskyj-in-london-faz-110683325.html,0,www.faz.net,"Liveblog Ukrainekrieg: Merz, Starmer und Macron treffen Selenskyj in London",Gespräche über weitere Unterstützung für die Ukraine +++ Ukraine greift wieder Sankt Petersburg an +++ IAEA: Stromleitung an AKW Saporischschja wiederhergestellt +++ alle Neuigkeiten im Liveblog,https://media0.faz.net/image/w1200h627/2b0136552a60/w4284h2238x0y436o/202606/43601.0.2185006029/treffen-in-london-am-08-12.webp,2026-06-07T03:55:00Z,,Im April war der Düsseldorfer Karnevalswagenbauer Jacques Tilly in Moskau in Abwesenheit zu achteinhalb Jahren Haft verurteilt worden jetzt kündigt sich ein Revisionsprozess an. Das Auswärtige Amt ha… [+1323 chars],,de,'Wladimir Putin'
https://www.zeit.de/politik/ausland/2026-06/ukraine-krieg-merz-macron-starmer-selenskyj-treffen-london-gxe,https://www.zeit.de/politik/ausland/2026-06/ukraine-krieg-merz-macron-starmer-selenskyj-treffen-london-gxe,0,www.zeit.de,"Ukrainekrieg: Merz, Macron und Starmer treffen Selenskyj in London",Ein Treffen mit Wolodymyr Selenskyj hat Wladimir Putin abgelehnt. Nun wollen die Europäer mit dem ukrainischen Präsidenten sprechen und den Druck auf Russland erhöhen.,https://img.zeit.de/politik/ausland/2026-06/ukrainekrieg-merz-selenskyj-starmer-macron-london-treffen-bildl/wide__1300x731,2026-06-07T04:25:40Z,,"Deutschland, Frankreich und Großbritannien wollen die stockenden 
Bemühungen um ein Ende des Ukrainekriegs wieder in Gang bringen. Bundeskanzler Friedrich Merz, Frankreichs Präsident Emmanuel Macron… [+1671 chars]",,de,'Wladimir Putin'
https://www.faz.net/aktuell/rhein-main/wirtschaft/eisdielenpreise-warum-das-eis-frueher-so-viel-billiger-war-accg-200888814.html,https://www.faz.net/aktuell/rhein-main/wirtschaft/eisdielenpreise-warum-das-eis-frueher-so-viel-billiger-war-accg-200888814.html,0,www.faz.net,Gastronomie: Warum das Eis früher so viel billiger war,Alle Jahre wieder erhitzen die Kosten für die kalten Kugeln die Gemüter. Über die Jahre hat sich Eis deutlich stärker verteuert als etwa Bratwurst – es war früher aber auch außergewöhnlich billig.,https://media0.faz.net/image/w1200h627/88a4a90b645f/w5292h2765x0y657o/202605/43601.0.2165878419/erfrischend-und-suess-trotz.webp,2026-06-07T08:31:41Z,,"Die Eisdiele ist ein Ort, der die Herzen von Kindern höher schlagen lässt aber vielen begegnet dort auch die Inflation zum ersten Mal. Denn die erste Kugel Eis im Frühling, so gut sie auch schmeckt, … [+52 chars]",,de,'Inflation'
https://www.freitag.de/autoren/gerd-meissner/in-deutschen-thinktanks-beginnt-die-debatte-ueber-auswege-aus-dem-ukraine-krieg,https://www.freitag.de/autoren/gerd-meissner/in-deutschen-thinktanks-beginnt-die-debatte-ueber-auswege-aus-dem-ukraine-krieg,0,www.freitag.de,In deutschen Thinktanks beginnt zögernd die Debatte über Auswege aus dem Ukraine-Krieg,"Die Ukraine-Politik steckt fest. Die Maxime von Kanzler Friedrich Merz – Kiew müsse den Krieg gewinnen, Russland ihn verlieren – ist nicht umsetzbar. Aber kein Regierungssprecher und kein Minister würde dies öffentlich einräumen In der Rauchstraße 17 in Berli…",https://www.freitag.de/autoren/gerd-meissner/in-deutschen-thinktanks-beginnt-die-debatte-ueber-auswege-aus-dem-ukraine-krieg/@@images/image/great,2026-06-07T12:00:00Z,,"In der Rauchstraße 17 in Berlin-Tiergarten, dem Sitz der Deutschen Gesellschaft für Auswärtige Politik, im Gebäude des einstigen Ministeriums für die besetzten Ostgebiete des Reichsleiters Alfred Ros… [+4800 chars]",,de,'frieren'
https://www.zeit.de/politik/ausland/2026-06/russland-ukraine-krieg-tschernobyl-drohnenangriff-kernenergie,https://www.zeit.de/politik/ausland/2026-06/russland-ukraine-krieg-tschernobyl-drohnenangriff-kernenergie,0,www.zeit.de,Krieg in der Ukraine: Russische Drohne trifft Atommülllager nahe Tschernobyl,"Die Ukraine meldet einen russischen Drohnenangriff nahe Tschernobyl. Die IAEA spricht von erheblichen Schäden, erhöhte Strahlenwerte gab es nicht.",https://img.zeit.de/politik/ausland/2026-06/russland-ukraine-krieg-tschernobyl-drohnenangriff-kernenergie-bild/wide__1300x731,2026-06-07T12:03:26Z,,Eine russische Drohne hat nach ukrainischen Angaben ein Lager für abgebrannte Brennelemente nahe dem stillgelegten Atomkraftwerk Tschernobyl getroffen. Präsident Wolodymyr Selenskyj sprach von einem … [+1945 chars],,de,'Ukraine'
https://www.faz.net/aktuell/finanzen/um-rund-188-000-fass-opec-hebt-foerderziele-trotz-hormus-blockade-an-accg-200906695.html,https://www.faz.net/aktuell/finanzen/um-rund-188-000-fass-opec-hebt-foerderziele-trotz-hormus-blockade-an-accg-200906695.html,0,www.faz.net,Um rund 188.000 Fass: Opec+ hebt Förderziele trotz Hormus-Blockade an,"Die sieben Kernmitglieder des Erdölkartells haben sich darauf verständigt, rund 188.000 Fass Erdöl am Tag mehr zu produzieren. Es ist die vierte Anhebung binnen vier Monaten.",https://media0.faz.net/image/w1200h627/6969152be4b8/w4464h2332x0y322o/202604/43601.0.2028062667/opec-logo-in-wien.webp,2026-06-07T15:33:10Z,,"Das Ölkartell Opec+ hat abermals beschlossen, seine Förderziele zu erhöhen. Die sieben Kernmitglieder der Gruppe verständigten sich darauf, ihre Quoten von Juli an um rund 188.000 Fass (Barrell zu je… [+1122 chars]",,de,'Hormus'
