index,url,valid,domain,title,description,image,published,archive,content,quote,language,keyword
https://www.tagesschau.de/inland/innenpolitik/afd-auswaertiger-ausschuss-100.html,https://www.tagesschau.de/inland/innenpolitik/afd-auswaertiger-ausschuss-100.html,0,www.tagesschau.de,Markus Frohnmaier ist neuer außenpolitischer Sprecher der AfD,"Markus Frohnmaier ist der neue außenpolitische Sprecher der AfD-Bundestagsfraktion. Sein Ziel ist es, eine Brücke zwischen den Russlandfreunden und Trump-Fans zu bauen. Doch seine Vergangenheit macht manche misstrauisch. Von Kilian Pfeffer.",https://images.tagesschau.de/image/43a55a5d-b582-45e6-b7c8-af3e2c2d056a/AAABlgWnQLs/AAABkZLhkrw/16x9-1280/frohnmaier-afd-101.jpg,2025-06-04T08:33:04Z,https://web.archive.org/web/20250604084408/https://www.tagesschau.de/inland/innenpolitik/afd-auswaertiger-ausschuss-100.html,"Stand: 04.06.2025 10:33 Uhr
Markus Frohnmaier ist der neue außenpolitische Sprecher der AfD-Bundestagsfraktion. Sein Ziel ist es, eine Brücke zwischen den Russlandfreunden und Trump-Fans zu bauen. D… [+5306 chars]",,de,'Russland'
https://www.bild.de/politik/ausland-und-internationales/russland-schwach-wie-lange-nicht-die-schockschlaege-taktik-der-ukraine-683ef7a5ebc8774e222db478,https://www.bild.de/politik/ausland-und-internationales/russland-schwach-wie-lange-nicht-die-schockschlaege-taktik-der-ukraine-683ef7a5ebc8774e222db478,0,www.bild.de,Russland schwach wie lange nicht - Die Schockschläge-Taktik der Ukraine,Der ukrainische Geheimdienst „SBU“ hat einen Pfeiler der russischen Krim-Brücke mit einer Sprengstoffexplosion unter Wasser ernsthaft beschädigt.,"https://images.bild.de/683ef7a5ebc8774e222db478/7378e0e765d59a0152e9a84c7bf48b41,bc718f19?w=1280",2025-06-04T08:36:11Z,http://archive.md/20250604084019/https://www.bild.de/politik/ausland-und-internationales/russland-schwach-wie-lange-nicht-die-schockschlaege-taktik-der-ukraine-683ef7a5ebc8774e222db478,"Kiew Der ukrainische Geheimdienst SBU hat einen Pfeiler der russischen Krim-Brücke mit einer Sprengstoffexplosion unter Wasser ernsthaft beschädigt. 
Faktisch ist die Brücke einsturzgefährdet, erklä… [+2853 chars]",,de,'Ukraine'
https://www.tagesschau.de/inland/innenpolitik/merz-antrittsbesuch-washington-100.html,https://www.tagesschau.de/inland/innenpolitik/merz-antrittsbesuch-washington-100.html,0,www.tagesschau.de,Antrittsbesuch in Washington: Was erwartet Merz bei Trump?,"Bundeskanzler Merz reist heute in die USA. Zölle, Ukraine, Gaza - auf der Liste der Gesprächsthemen stehen viele Streitpunkte. Wie ist Merz auf Trump vorbereitet und was erwartet ihn im Weißen Haus? Ein Überblick.",https://images.tagesschau.de/image/18f31021-c0b6-4a05-89c5-6675d86f339f/AAABlzny0N4/AAABkZLhkrw/16x9-1280/merz-792.jpg,2025-06-04T08:37:54Z,https://web.archive.org/web/20250604111102/https://www.tagesschau.de/inland/innenpolitik/merz-antrittsbesuch-washington-100.html,"Stand: 04.06.2025 10:37 Uhr
Bundeskanzler Merz reist heute in die USA. Zölle, Ukraine, Gaza - auf der Liste der Gesprächsthemen stehen viele Streitpunkte. Wie ist Merz auf Trump vorbereitet und was … [+5819 chars]",,de,'Ukraine'
https://www.n-tv.de/mediathek/videos/politik/Munz-Bruecke-zur-Krim-bleibt-sensibler-Punkt-fuer-Russland-article25811745.html,https://www.n-tv.de/mediathek/videos/politik/Munz-Bruecke-zur-Krim-bleibt-sensibler-Punkt-fuer-Russland-article25811745.html,0,www.n-tv.de,"Große Schäden abgestritten: Munz: ""Brücke zur Krim bleibt sensibler Punkt für Russland""","Erst ""Operation Spinnennetz"", jetzt die Explosion an der Krim-Brücke: Dass Russlands Militär zuletzt Demütigungen hinnehmen muss, wird vonseiten des Kreml kaum kommentiert. Auf die Kriegsentwicklung und die russische Wirtschaft blickt ntv-Korrespondent Rainer…",https://www.n-tv.de/img/incoming/crop25811913/0111325681-cImg_16_9-w1200/Munz.jpg,2025-06-04T09:04:34Z,https://web.archive.org/web/20250604101132/https://www.n-tv.de/mediathek/videos/politik/Munz-Bruecke-zur-Krim-bleibt-sensibler-Punkt-fuer-Russland-article25811745.html,,,de,'Russland'
https://www.stern.de/politik/ausland/grossmanoever--russland-kritisiert-nato-manoever-in-ostsee-als-provokation-35781220.html,https://www.stern.de/politik/ausland/grossmanoever--russland-kritisiert-nato-manoever-in-ostsee-als-provokation-35781220.html,0,www.stern.de,Großmanöver: Russland kritisiert Nato-Manöver in Ostsee als Provokation,"Nato-Manöver in der Nähe Russlands ziehen traditionell Kritik Moskaus auf sich. Nun äußert sich der Vize-Außenminister scharf zur Übung in der Ostsee, wo die Russen selbst Kampfszenarien durchspielen.",https://image.stern.de/35781222/t/2t/v1/w1440/r1.7778/-/04--zewz47ec6sv10axs2048jpeg---7194b2972d930f46.jpg,2025-06-04T09:13:18Z,https://web.archive.org/web/20250604092911/https://www.stern.de/politik/ausland/grossmanoever--russland-kritisiert-nato-manoever-in-ostsee-als-provokation-35781220.html,"Kopiere den aktuellen Link
Zur Merkliste hinzufügen
Nato-Manöver in der Nähe Russlands ziehen traditionell Kritik Moskaus auf sich. Nun äußert sich der Vize-Außenminister scharf zur Übung in der Os… [+2271 chars]",,de,'Russland'
https://www.tagesspiegel.de/internationales/russland-verurteilt-nato-grossmanover-in-der-ostsee-13800421.html,https://www.tagesspiegel.de/internationales/russland-verurteilt-nato-grossmanover-in-der-ostsee-13800421.html,0,www.tagesspiegel.de,Moskau verurteilt Nato-Manöver in der Ostsee: „Wir bewerten das als Vorbereitung auf militärische Zusammenstöße mit Russland“,Russlands Vize-Außenminister bewertet das am Donnerstag in Rostock beginnende Nato-Großmanöver als „äußerst provokativ“. Dabei führen die Russen in der Ostsee gerade selbst ein Manöver durch.,https://www.tagesspiegel.de/images/13800817/alternates/BASE_16_9_W1400/1749031260000/marine-manover-baltops.jpeg,2025-06-04T09:14:41Z,,Einen Tag vor Beginn des zweiwöchigen Nato-Marinemanövers Baltops in der Ostsee hat Russland die Übung als Provokation kritisiert. Moskaus Vize-Außenminister Alexander Gruschko warf dem westlichen Mi… [+2777 chars],,de,'Russland'
https://www.tagesspiegel.de/internationales/grossmanover-russland-kritisiert-nato-manover-in-ostsee-als-provokation-13800421.html,https://www.tagesspiegel.de/internationales/grossmanover-russland-kritisiert-nato-manover-in-ostsee-als-provokation-13800421.html,0,www.tagesspiegel.de,Großmanöver: Russland kritisiert Nato-Manöver in Ostsee als Provokation,"Nato-Manöver in der Nähe Russlands ziehen traditionell Kritik Moskaus auf sich. Nun äußert sich der Vize-Außenminister scharf zur Übung in der Ostsee, wo die Russen selbst Kampfszenarien durchspielen.",https://www.tagesspiegel.de/images/13800418/alternates/BASE_16_9_W1400/1749028480000/marine-manover-baltops.jpeg,2025-06-04T09:14:41Z,,Einen Tag vor Beginn des zweiwöchigen Nato-Marinemanövers Baltops in der Ostsee hat Russland die Übung als Provokation kritisiert. Moskaus Vize-Außenminister Alexander Gruschko warf dem westlichen Mi… [+2105 chars],,de,'Russland'
https://www.stern.de/politik/ausland/krieg-in-der-ukraine--russland--deutsches-flugabwehrsystem-in-der-ukraine-zerstoert-35781500.html,https://www.stern.de/politik/ausland/krieg-in-der-ukraine--russland--deutsches-flugabwehrsystem-in-der-ukraine-zerstoert-35781500.html,0,www.stern.de,Krieg in der Ukraine: Russland: Deutsches Flugabwehrsystem in der Ukraine zerstört,Russland sucht nach einer Antwort auf den Schlag gegen seine Bomberflotte. Nun soll ein von Berlin geliefertes Hightech-Flugabwehrsystem in der Ukraine zerstört worden sein. Die Bestätigung steht aus.,https://image.stern.de/35781502/t/FO/v1/w1440/r1.7778/-/04--iwj5ptyvx3v2axs2048jpeg---5ff864517f157906.jpg,2025-06-04T09:50:00Z,,"Kopiere den aktuellen Link
Zur Merkliste hinzufügen
Russland sucht nach einer Antwort auf den Schlag gegen seine Bomberflotte. Nun soll ein von Berlin geliefertes Hightech-Flugabwehrsystem in der U… [+1073 chars]",,de,'Russland'
https://www.focus.de/reisen/sicherheit-von-reiselaendern-frankreich-und-italien-nur-knapp-vor-russland_8430e37c-3e10-489f-a09b-73b2d4edf518.html,https://www.focus.de/reisen/sicherheit-von-reiselaendern-frankreich-und-italien-nur-knapp-vor-russland_8430e37c-3e10-489f-a09b-73b2d4edf518.html,0,www.focus.de,Sicherheit von Reiseländern: Frankreich und Italien nur knapp vor Russland,Europa führt die Liste der sichersten Länder für Reisende an. Doch Frankreich und Italien schneiden überraschend schlecht ab.,https://quadro.burda-forward.de/ctf/a80ce2b5-e3d8-4797-bb19-88ccc9e1eadc.fa3fb56a-d7d7-4d12-ba63-404430b8e371.jpg?im=RegionOfInterestCrop%3D%281200%2C630%29%2CregionOfInterest%3D%281205%2C506%29&hash=a1550d921cea212f7dcd793a5bfecd2729804819e7d3074f3a2e070066dfe116,2025-06-04T09:50:17Z,,"Naturkatastrophen, Gesundheitsinfrastruktur, alte und neue Konfliktherde. Urlauber sollten den aktuellen Sicherheitsindex von HelloSafe beachten, bevor sie ihr Urlaubsziel wählen.
Europa am sicherst… [+1837 chars]",,de,'Russland'
https://www.tagesspiegel.de/internationales/krieg-in-der-ukraine-russland-deutsches-flugabwehrsystem-in-der-ukraine-zerstort-13800718.html,https://www.tagesspiegel.de/internationales/krieg-in-der-ukraine-russland-deutsches-flugabwehrsystem-in-der-ukraine-zerstort-13800718.html,0,www.tagesspiegel.de,Krieg in der Ukraine: Russland: Deutsches Flugabwehrsystem in der Ukraine zerstört,Russland sucht nach einer Antwort auf den Schlag gegen seine Bomberflotte. Nun soll ein von Berlin geliefertes Hightech-Flugabwehrsystem in der Ukraine zerstört worden sein. Die Bestätigung steht aus.,https://www.tagesspiegel.de/images/13800715/alternates/BASE_16_9_W1400/1749030682000/flugabwehrkomplex-iris-t.jpeg,2025-06-04T09:51:22Z,https://web.archive.org/web/20250604102837/https://www.tagesspiegel.de/internationales/krieg-in-der-ukraine-russland-deutsches-flugabwehrsystem-in-der-ukraine-zerstort-13800718.html,Das russische Militär hat nach eigenen Angaben ein von Deutschland an die Ukraine geliefertes Flugabwehrsystem des Typs Iris-T zerstört. Die Anlage sei im Gebiet Dnipropetrowsk von einer Iskander-Rak… [+909 chars],,de,'Ukraine'
https://www.tagesspiegel.de/internationales/angriff-auf-putins-bomber-mit-stocken-und-steinen--russische-trucker-versuchten-die-ukrainischen-drohnen-zu-stoppen-13800019.html,https://www.tagesspiegel.de/internationales/angriff-auf-putins-bomber-mit-stocken-und-steinen--russische-trucker-versuchten-die-ukrainischen-drohnen-zu-stoppen-13800019.html,0,www.tagesspiegel.de,Angriff auf Putins Bomber: Mit Stöcken und Steinen – russische Trucker versuchten die ukrainischen Drohnen zu stoppen,"Militärisch hatte Russland der ukrainischen Operation „Spinnennetz“ wenig entgegenzusetzen. Stattdessen versuchten russische Lkw-Fahrer und Polizisten, die Angriffe aufzuhalten. Ohne Erfolg.",https://www.tagesspiegel.de/images/13800259/alternates/BASE_16_9_W1400/1749027439000/ukraine-krieg-region-irkutsk.jpeg,2025-06-04T09:55:20Z,http://archive.md/20250604103958/https://www.tagesspiegel.de/internationales/angriff-auf-putins-bomber-mit-stocken-und-steinen--russische-trucker-versuchten-die-ukrainischen-drohnen-zu-stoppen-13800019.html,"Russland, so sieht es zumindest Russlands Präsident Wladimir Putin, ist eine militärische Großmacht, ohne die weltpolitisch nichts geht. Hinter dieser Selbsteinschätzung steht auch das immer noch bee… [+3767 chars]",,de,'Angriff'
https://www.morgenpost.de/podcast/article409179216/zwischen-training-und-albtraum-junge-rekruten-in-der-hoelle-des-krieges.html,https://www.morgenpost.de/podcast/article409179216/zwischen-training-und-albtraum-junge-rekruten-in-der-hoelle-des-krieges.html,0,www.morgenpost.de,Zwischen Training und Albtraum: Junge Rekruten in der Hölle des Krieges,"Einblicke in ein ukrainisches Trainingscamp: Junge Rekruten bereiten sich unter härtesten Bedingungen auf den Einsatz an der Front vor. Zwischen Idealismus, finanziellen Anreizen und der harten Realität des Ukraine-Kriegs.",https://img.sparknews.funkemedien.de/409096837/409096837_1748680526_v16_9_1600.jpeg,2025-06-04T10:00:00Z,https://web.archive.org/web/20250604101717/https://www.morgenpost.de/podcast/article409179216/zwischen-training-und-albtraum-junge-rekruten-in-der-hoelle-des-krieges.html,"Ukraine. Einblicke in ein ukrainisches Trainingslager: Wie junge Männer mit Geld gelockt und für den Krieg gegen Russland ausgebildet werden.
Im mittlerweile vierten Jahr des russischen Angriffskrie… [+2927 chars]",,de,'Russland'
https://www.focus.de/politik/reaktion-auf-ukraine-coup-china-ruft-zur-maessigung-auf-aber-staerkt-weiter-putins-kriegswirtschaft_e8dcc270-2fe4-4ab8-9cbc-85c5037cb580.html,https://www.focus.de/politik/reaktion-auf-ukraine-coup-china-ruft-zur-maessigung-auf-aber-staerkt-weiter-putins-kriegswirtschaft_e8dcc270-2fe4-4ab8-9cbc-85c5037cb580.html,0,www.focus.de,Reaktion auf Ukraine-Coup: China ruft zur Mäßigung auf - aber stärkt weiter Putins Kriegswirtschaft,Nach dem ukrainischen Angriff auf die Krim-Brücke mahnt China zur Deeskalation. Doch die Nähe zu Russland wirft Fragen auf.,https://quadro.burda-forward.de/ctf/4c41d3ac-3fad-4f01-9af1-5a70e1d00aaf.91646711-9a4a-44d2-9ec8-027f3872b77a.png?im=RegionOfInterestCrop%3D%281200%2C630%29%2CregionOfInterest%3D%28600%2C338%29&hash=62a7596444f02d29c17642fcad44d5e9997b1dac1dd1c40de10ae5da1136abb4,2025-06-04T10:08:30Z,https://web.archive.org/web/20250604104151/https://www.focus.de/politik/reaktion-auf-ukraine-coup-china-ruft-zur-maessigung-auf-aber-staerkt-weiter-putins-kriegswirtschaft_e8dcc270-2fe4-4ab8-9cbc-85c5037cb580.html,"China reagiert auf den jüngsten Coup der Ukraine im Krieg mit Russland, bei der die Krim-Brücke, die die Halbinsel mit dem russischen Festland verbindet, mithilfe von 1.100 Kilogramm Sprengstoff schw… [+1639 chars]",,de,'Russland'
https://www.n-tv.de/politik/Luftwaffe-uebt-Deepstrikes-mit-praezisen-Gleitbomben-article25811885.html,https://www.n-tv.de/politik/Luftwaffe-uebt-Deepstrikes-mit-praezisen-Gleitbomben-article25811885.html,0,www.n-tv.de,"Eurofighter sollen weit fliegen: Luftwaffe übt ""Deepstrikes"" mit präzisen Gleitbomben","Russland stellt eine Bedrohung für die NATO dar. Die Luftwaffe der Bundeswehr probt für den Bündnisfall. Von einem Fliegerhorst in Nordrhein-Westfalen heben mehrere Eurofighter ab, um den Einsatz von Gleitbomben zu üben. Ihr Ziel liegt Tausende Kilometer entf…",https://www.n-tv.de/img/incoming/crop25811928/9131329563-cImg_16_9-w1200/5b6ea7322a75a338b86890684d7e48d1.jpg,2025-06-04T10:18:19Z,http://archive.md/20250605070644/https://www.n-tv.de/politik/Luftwaffe-uebt-Deepstrikes-mit-praezisen-Gleitbomben-article25811885.html,"Russland stellt eine Bedrohung für die NATO dar. Die Luftwaffe der Bundeswehr probt für den Bündnisfall. Von einem Fliegerhorst in Nordrhein-Westfalen heben mehrere Eurofighter ab, um den Einsatz von… [+1686 chars]",,de,'Russland'
https://www.zeit.de/news/2025-06/04/unbekannte-entsorgen-illegal-waffen-polizei-ermittelt,https://www.zeit.de/news/2025-06/04/unbekannte-entsorgen-illegal-waffen-polizei-ermittelt,0,www.zeit.de,Niederbayern: Unbekannte entsorgen illegal Waffen - Polizei ermittelt,Hier finden Sie Informationen zu dem Thema „Niederbayern“. Lesen Sie jetzt „Unbekannte entsorgen illegal Waffen - Polizei ermittelt“.,https://img.zeit.de/news/2025-06/04/unbekannte-entsorgen-illegal-waffen-polizei-ermittelt-image-group/wide__1300x731,2025-06-04T11:12:50Z,,"Unbekannte haben Waffen, die vermutlich aus der Zeit des Nationalsozialismus stammen, in Niederbayern illegal entsorgt. Der Betreiber eines Schrottplatzes in Triftern (Landkreis Rottal-Inn) fand die … [+762 chars]",,de,'Waffen'
https://www.zeit.de/news/2025-06/04/angriff-bei-fingiertem-date-angeklagter-gibt-messerstich-zu,https://www.zeit.de/news/2025-06/04/angriff-bei-fingiertem-date-angeklagter-gibt-messerstich-zu,0,www.zeit.de,Messerangriff: Angriff bei fingiertem Date: Angeklagter gibt Messerstich zu,Hier finden Sie Informationen zu dem Thema „Messerangriff“. Lesen Sie jetzt „Angriff bei fingiertem Date: Angeklagter gibt Messerstich zu“.,https://img.zeit.de/news/2025-06/04/angriff-bei-fingiertem-date-angeklagter-gibt-messerstich-zu-image-group/wide__1300x731,2025-06-04T12:20:58Z,,Aus Rache soll ein 23-Jähriger einen Bekannten zu einem vermeintlichen Date gelockt und niedergestochen haben. Sechs Monate später hat der mutmaßliche Täter vor dem Berliner Landgericht einen Messers… [+2433 chars],,de,'Angriff'
https://www.stern.de/news/eu-emissionshandel--deutlich-hoehere-kosten-fuer-mieter-und-vermieter-ab-2027-35782786.html,https://www.stern.de/news/eu-emissionshandel--deutlich-hoehere-kosten-fuer-mieter-und-vermieter-ab-2027-35782786.html,0,www.stern.de,EU-Emissionshandel: Deutlich höhere Kosten für Mieter und Vermieter ab 2027,"Die Ausweitung des EU-Emissionshandels auf die Bereiche Verkehr und Gebäude ab 2027 bringt einer Untersuchung zufolge ""erhebliche finanzielle Risiken"" für Vermieter und Mieter mit sich, die ihre Wohnungen und Häuser mit Erdgas oder Öl heizen. Wie das Unterneh…",https://image.stern.de/35782788/t/bw/v1/w1440/r1.7778/-/04--wohnhaeuser-in-dortmund---fd7483fbcc165603.jpg,2025-06-04T14:23:42Z,,"Kopiere den aktuellen Link
Zur Merkliste hinzufügen
Die Ausweitung des EU-Emissionshandels auf die Bereiche Verkehr und Gebäude ab 2027 bringt einer Untersuchung zufolge ""erhebliche finanzielle Ris… [+2176 chars]",,de,'heizen'
https://www.faz.net/podcasts/f-a-z-podcast-fuer-deutschland/trump-vertrauter-graham-wer-russland-hilft-ist-boese-110516819.html,https://www.faz.net/podcasts/f-a-z-podcast-fuer-deutschland/trump-vertrauter-graham-wer-russland-hilft-ist-boese-110516819.html,0,www.faz.net,"Trump-Vertrauter Graham: „Wer Russland hilft, ist böse“","US-Senator Lindsey Graham fordert eine härtere Russland-Strategie der USA, Zölle in Höhe von 500 Prozent und gibt Merz Ratschläge für seinen Antrittsbesuch.",https://media0.faz.net/ppmedia/aktuell/1807308494/1.10511780/facebook_teaser_fplus/foto-mit-dem-praesidenten.jpg,2025-06-04T15:30:37Z,,"Zugang zu allen FAZ+ Beiträgen12,80 
 jetzt nur 0,99 
Zugang zu allen FAZ+ Beiträgen12,80 
 jetzt nur 0,99 
<ul><li>Mit einem Klick online kündbar</li></ul>",,de,'Russland'
https://www.zeit.de/politik/deutschland/2025-06/prominente-appellieren-an-bundesregierung-wegen-gaza,https://www.zeit.de/politik/deutschland/2025-06/prominente-appellieren-an-bundesregierung-wegen-gaza,0,www.zeit.de,Gazakrieg: Prominente fordern Stopp deutscher Waffenlieferungen an Israel,"Zahlreiche Kulturschaffende appellieren an die Bundesregierung, keine Waffen nach Israel zu exportieren. In der Petition ist von Kriegsverbrechen und Völkermord die Rede.",https://img.zeit.de/politik/deutschland/2025-06/kulturschaffende-richten-appell-an-die-bundesregierung-bild/wide__1300x731,2025-06-04T17:30:04Z,https://web.archive.org/web/20250604174353/https://www.zeit.de/politik/deutschland/2025-06/prominente-appellieren-an-bundesregierung-wegen-gaza,"Mehrere deutsche Prominente haben die Bundesregierung in einer Onlinepetition dazu aufgefordert, die Waffenlieferungen an Israel zu beenden. In dem öffentlichen Appell verlangen die Unterzeichnerinne… [+2663 chars]",,de,'Waffen'
https://www.n-tv.de/politik/12-44-Mehrheit-der-Deutschen-fuer-hoehere-Verteidigungsausgaben-und-eine-Wehrpflicht--article23143824.html,https://www.n-tv.de/politik/12-44-Mehrheit-der-Deutschen-fuer-hoehere-Verteidigungsausgaben-und-eine-Wehrpflicht--article23143824.html,0,www.n-tv.de,Ukraine-Krieg im Liveticker: +++ 12:44 Mehrheit der Deutschen für höhere Verteidigungsausgaben - und eine Wehrpflicht +++,Lesen Sie alle aktuellen Entwicklungen und Nachrichten über den russischen Angriffskrieg auf die Ukraine im Liveticker von ntv.de.,https://www.n-tv.de/img/incoming/crop25117070/8311326854-cImg_16_9-w1200/Ukraine-Liveticker.jpg,2025-06-04T22:03:00Z,https://web.archive.org/web/20250605105142/https://www.n-tv.de/politik/12-44-Mehrheit-der-Deutschen-fuer-hoehere-Verteidigungsausgaben-und-eine-Wehrpflicht--article23143824.html,"Angesichts der neuen Bedrohungslage in Europa und der Ankündigung der USA, dass sie ihre europäischen Verbündeten künftig nicht mehr ohne Weiteres militärisch beschützen werden, will Deutschland sein… [+16046 chars]",,de,'Angriff'
https://www.n-tv.de/politik/12-09-Razzia-bei-regionalem-Medienportal-in-Russland--article23143824.html,https://www.n-tv.de/politik/12-09-Razzia-bei-regionalem-Medienportal-in-Russland--article23143824.html,0,www.n-tv.de,Ukraine-Krieg im Liveticker: +++ 12:09 Razzia bei regionalem Medienportal in Russland +++,Lesen Sie alle aktuellen Entwicklungen und Nachrichten über den russischen Angriffskrieg auf die Ukraine im Liveticker von ntv.de.,https://www.n-tv.de/img/incoming/crop25117070/8311326854-cImg_16_9-w1200/Ukraine-Liveticker.jpg,2025-06-04T22:03:00Z,https://web.archive.org/web/20250605101441/https://www.n-tv.de/politik/12-09-Razzia-bei-regionalem-Medienportal-in-Russland--article23143824.html,Russische Sicherheitsorgane haben die Büroräume des regionalen Medienportals Ura.Ru in der Millionenstadt Jekaterinburg durchsucht und drei Journalisten festgenommen. Ihnen drohe ein Verfahren wegen … [+15146 chars],,de,'Russland'
https://www.n-tv.de/politik/08-07-Russland-stuft-British-Council-als-unerwuenschte-Organisation-ein--article23143824.html,https://www.n-tv.de/politik/08-07-Russland-stuft-British-Council-als-unerwuenschte-Organisation-ein--article23143824.html,0,www.n-tv.de,Ukraine-Krieg im Liveticker: +++ 08:07 Russland stuft British Council als unerwünschte Organisation ein +++,Lesen Sie alle aktuellen Entwicklungen und Nachrichten über den russischen Angriffskrieg auf die Ukraine im Liveticker von ntv.de.,https://www.n-tv.de/img/incoming/crop25117070/8311326854-cImg_16_9-w1200/Ukraine-Liveticker.jpg,2025-06-04T22:03:00Z,https://web.archive.org/web/20250605061214/https://www.n-tv.de/politik/08-07-Russland-stuft-British-Council-als-unerwuenschte-Organisation-ein--article23143824.html,"Die russische Generalstaatsanwaltschaft hat die britische Kultureinrichtung British Council als unerwünschte Organisation eingestuft. Das British Council positioniere sich zwar als unabhängig, doch r… [+9929 chars]",,de,'Angriff'
https://www.n-tv.de/politik/15-58-Explosionen-in-Cherson-Russischer-Angriff-reisst-Loch-in-Verwaltungsgebaeude--article23143824.html,https://www.n-tv.de/politik/15-58-Explosionen-in-Cherson-Russischer-Angriff-reisst-Loch-in-Verwaltungsgebaeude--article23143824.html,0,www.n-tv.de,Ukraine-Krieg im Liveticker: +++ 15:58 Explosionen in Cherson: Russischer Angriff reißt Loch in Verwaltungsgebäude +++,Lesen Sie alle aktuellen Entwicklungen und Nachrichten über den russischen Angriffskrieg auf die Ukraine im Liveticker von ntv.de.,https://www.n-tv.de/img/incoming/crop25117070/8311326854-cImg_16_9-w1200/Ukraine-Liveticker.jpg,2025-06-04T22:03:00Z,https://web.archive.org/web/20250605140449/https://www.n-tv.de/politik/15-58-Explosionen-in-Cherson-Russischer-Angriff-reisst-Loch-in-Verwaltungsgebaeude--article23143824.html,Bei russischen Angriffen auf die ukrainische Stadt Cherson werden mehrere Menschen verletzt. Die Attacken mit mindestens vier Lenkbomben treffen auch ein Verwaltungsgebäude mit Symbolcharakter. Auf r… [+19913 chars],,de,'Angriff'
https://www.n-tv.de/politik/04-52-Schiffe-Drohnen-Waffensysteme-Niederlande-staerken-ukrainische-Marine--article23143824.html,https://www.n-tv.de/politik/04-52-Schiffe-Drohnen-Waffensysteme-Niederlande-staerken-ukrainische-Marine--article23143824.html,0,www.n-tv.de,"Ukraine-Krieg im Liveticker: +++ 04:52 Schiffe, Drohnen, Waffensysteme: Niederlande stärken ukrainische Marine+++",Lesen Sie alle aktuellen Entwicklungen und Nachrichten über den russischen Angriffskrieg auf die Ukraine im Liveticker von ntv.de.,https://www.n-tv.de/img/incoming/crop25117070/8311326854-cImg_16_9-w1200/Ukraine-Liveticker.jpg,2025-06-04T22:03:00Z,https://web.archive.org/web/20250605031527/https://www.n-tv.de/politik/04-52-Schiffe-Drohnen-Waffensysteme-Niederlande-staerken-ukrainische-Marine--article23143824.html,Die Niederlande wollen weitere Rüstungsgüter an die Ukraine liefern. Verteidigungsminister Ruben Brekelmans kündigt ein neues Unterstützungspaket für die maritime Sicherheit in Höhe von 400 Millionen… [+6102 chars],,de,'Angriff'
https://www.n-tv.de/politik/05-38-Nato-beginnt-Marine-Manoever-in-Rostock--article23143824.html,https://www.n-tv.de/politik/05-38-Nato-beginnt-Marine-Manoever-in-Rostock--article23143824.html,0,www.n-tv.de,Ukraine-Krieg im Liveticker: +++ 05:38 Nato beginnt Marine-Manöver in Rostock +++,Lesen Sie alle aktuellen Entwicklungen und Nachrichten über den russischen Angriffskrieg auf die Ukraine im Liveticker von ntv.de.,https://www.n-tv.de/img/incoming/crop25117070/8311326854-cImg_16_9-w1200/Ukraine-Liveticker.jpg,2025-06-04T22:03:00Z,https://web.archive.org/web/20250605034055/https://www.n-tv.de/politik/05-38-Nato-beginnt-Marine-Manoever-in-Rostock--article23143824.html,In Rostock beginnt am Morgen mit dem Auslaufen der ersten Marine-Schiffe das Nato-Großmanöver Baltops auf der Ostsee. An der US-geführten jährlichen Übung nehmen bis 20. Juni rund 50 Schiffe und Boot… [+6611 chars],,de,'Waffen'
