index,url,valid,domain,title,description,image,published,archive,content,quote,language,keyword
https://www.stern.de/politik/ausland/russisch-ukrainischer-krieg--selenskyj-kuendigt-waffenruhe-ab-mittwoch-an-37365188.html,https://www.stern.de/politik/ausland/russisch-ukrainischer-krieg--selenskyj-kuendigt-waffenruhe-ab-mittwoch-an-37365188.html,0,www.stern.de,Russisch-ukrainischer Krieg: Selenskyj kündigt Waffenruhe ab Mittwoch an,Russland verkündete einseitig eine zweitägige Waffenruhe zum Tag des Sieges am 9. Mai. Selenskyj kontert seinerseits mit einem Gegenvorschlag. Werden die Waffen zumindest kurzfristig schweigen?,https://image.stern.de/37368022/t/Xl/v1/w1440/r1.7778/-/04--3gu7p262wqv4axs2048jpeg---364d18cee286cad2.jpg,2026-05-04T19:39:07Z,,"Kopiere den aktuellen Link
Zur Merkliste hinzufügen
Russland verkündete einseitig eine zweitägige Waffenruhe zum Tag des Sieges am 9. Mai. Selenskyj kontert seinerseits mit einem Gegenvorschlag. We… [+2381 chars]",,de,'Waffen'
https://www.diepresse.com/22032308/russischer-vormarsch-stockt-moskau-verliert-im-april-gebiete-an-der,https://www.diepresse.com/22032308/russischer-vormarsch-stockt-moskau-verliert-im-april-gebiete-an-der,0,www.diepresse.com,Russischer Vormarsch stockt: Moskau verliert im April Gebiete an der ukrainischen Front,Erstmals seit Sommer 2023 hat Russland an der Front netto Gebiet verloren. Der Vormarsch verlangsamt sich seit Monaten. Wie viel Prozent des ukrainischen Staatsgebiets hat Russland besetzt?,https://img.diepresse.com/public/incoming/47zyi7-imago-images-0855653594/alternates/DPR_SOCIAL_NACHRICHTEN/imago%20images%200855653594,2026-05-04T19:57:50Z,,"Erstmals seit Sommer 2023 hat Russland an der Front netto Gebiet verloren. Der Vormarsch verlangsamt sich seit Monaten. Wie viel Prozent des ukrainischen Staatsgebiets hat Russland besetzt?
Erstmals… [+2102 chars]",,de,'Russland'
https://www.zeit.de/politik/ausland/2026-05/russland-ukraine-vorschlaege-feuerpause,https://www.zeit.de/politik/ausland/2026-05/russland-ukraine-vorschlaege-feuerpause,0,www.zeit.de,Krieg gegen die Ukraine: Russland und Ukraine verkünden jeweils einseitige Feuerpausen,"Nachdem Russland eine einseitige Waffenruhe rund um den Tag des Sieges am 9. Mai angekündigt hat, legt die Ukraine nach. Sie will schon früher eine Feuerpause ausrufen.",https://img.zeit.de/politik/ausland/2026-05/russland-ukraine-vorschlag-feuerpause-bild/wide__1300x731,2026-05-04T20:34:00Z,,Russland und die Ukraine haben getrennt voneinander unterschiedliche Feuerpausen angekündigt. Russlands Staatschef Putin rief eine einseitige Waffenruhe für den Zeitraum der Feierlichkeiten des Siege… [+925 chars],,de,'Russland'
https://orf.at/stories/3428813/,https://orf.at/stories/3428813/,0,orf.at,Kiew und Moskau kündigen Waffenruhe an,Nach der Ankündigung Russlands einer einseitigen Waffenruhe rund um den Weltkriegsgedenktag am 9. Mai hat der ukrainische Präsident Wolodymyr Selenskyj seinerseits eine Feuerpause verkündet. Diese werde in der Nacht von Dienstag auf Mittwoch um Mitternacht be…,https://ibs.orf.at/news?image=https%3A%2F%2Fassets.orf.at%2Fmims%2F2026%2F19%2F89%2Fcrops%2Fw%3D1200%2Ch%3D630%2Cq%3D75%2F3025602_master_1170489_ukraine_krieg_russland_waffenruhe_im.jpg%3Fs%3D560a26d8d9cd0411877c61caeb7c0cc74c90b055,2026-05-04T21:22:18Z,,"Das russische Militär hatte Montagabend eine Feuerpause für den 8. und 9. Mai verkündet. Diese sei von Präsident Wladimir Putin angeordnet worden, hieß es. Am 9. Mai gedenkt Russland des Sieges gegen… [+3087 chars]",,de,'Waffen'
https://www.stern.de/politik/ausland/irankrieg-news--usa-geleitet-handelsschiffe-durch-strasse-von-hormus-37087516.html,https://www.stern.de/politik/ausland/irankrieg-news--usa-geleitet-handelsschiffe-durch-strasse-von-hormus-37087516.html,0,www.stern.de,Irankrieg: Erste Handelschiffe von den USA durch Straße von Hormus eskortiert,Die USA haben zwei Handelsschiffe durch die Straße von Hormus geleitet. Zuvor griff der Iran die Vereinigten Arabischen Emirate an. Alle Entwicklungen im Newsblog.,https://image.stern.de/37354044/t/97/v1/w1440/r1.7778/-/tanker-hormus-neu.jpg,2026-05-05T02:15:00Z,,"In den Vereinigten Arabischen Emiraten bricht Behördenangaben zufolge nach einem iranischen Drohnenangriff ein Großbrand aus. Betroffen ist eine Industriezone der Hafenstadt Fudschaira, wie das Medie… [+609 chars]",,de,'Iran'
https://www.bild.de/news/wetter/kaeltewelle-trifft-deutschland-temperaturen-stuerzen-um-bis-zu-20-grad-ab-69f85e9ad3209c4cbd891532,https://www.bild.de/news/wetter/kaeltewelle-trifft-deutschland-temperaturen-stuerzen-um-bis-zu-20-grad-ab-69f85e9ad3209c4cbd891532,0,www.bild.de,Eisheilige kommen früher - Kältewelle klaut uns 20 Grad,Polarluft rollt über Deutschland und bringt Kälte sowie anhaltenden Regen.,"https://images.bild.de/69f85e9ad3209c4cbd891532/ab13a79d2bf75cc66f9c2f92a7b0aaee,3697b3b?w=1280",2026-05-05T03:51:14Z,,"TTS-Player überspringenArtikel weiterlesenJetzt kommt der WetterKnall: Statt Sonne satt bringt die neue Woche Regen, Kälte und einen Temperatursturz von regional bis zu 20 Grad! Es wird ungemütlich: … [+3283 chars]",,de,'frieren'
https://www.faz.net/aktuell/wirtschaft/katherina-reiche-vs-carsten-schneider-streit-um-energiewende-accg-200796095.html,https://www.faz.net/aktuell/wirtschaft/katherina-reiche-vs-carsten-schneider-streit-um-energiewende-accg-200796095.html,0,www.faz.net,Zweifel an drei Gesetzentwürfen: So subtil wäscht Carsten Schneider Katherina Reiche den Kopf,"Der Umweltminister kritisiert die Wirtschaftsministerin nicht offen, aber zwischen den Zeilen ist klar: Es gibt keine geeinte Klima- und Energiepolitik.",https://media0.faz.net/image/w1200h627/8e23e59bab57/w4475h2338x0y441o/202603/43601.0.1927068745/wirtschaftsministerin.webp,2026-05-05T04:16:48Z,,"Umweltminister Carsten Schneider (SPD) wirft seiner Kabinettskollegin Katherina Reiche (CDU) indirekt vor, nicht rechnen zu können und die Öffentlichkeit in der Energiepolitik an der Nase herumzuführ… [+5895 chars]",,de,'Klima'
https://www.faz.net/aktuell/politik/ausland/liveblog-iran-krieg-zwei-us-handelsschiffe-passieren-die-strasse-von-hormus-faz-200583539.html,https://www.faz.net/aktuell/politik/ausland/liveblog-iran-krieg-zwei-us-handelsschiffe-passieren-die-strasse-von-hormus-faz-200583539.html,0,www.faz.net,Liveblog Irankrieg: Zwei US-Handelsschiffe passieren die Straße von Hormus,US-Streitkräfte wehren Raketenangriffe während der Durchfahrt ab +++ USA ermutigen Reedereien zur Durchfahrt +++ Großbrand in Arabischen Emiraten nach Drohnenangriff +++ alle Entwicklungen im Liveblog,https://media0.faz.net/image/w1200h627/adfee7147493/w6000h3135x0y458o/202605/43601.0.2045946877/schiffe-in-der-strasse-von.webp,2026-05-05T05:32:19Z,,"Iran warnt die USA davor, die von ihm blockierte Straße von Hormus wieder für den internationalen Schiffsverkehr freizumachen. Projekt Freiheit ist Projekt Sackgasse, schrieb Irans Außenminister Abba… [+797 chars]",,de,'Hormus'
https://www.faz.net/aktuell/rhein-main/frankfurt/organisierte-klimakriminalitaet-illegaler-handel-mit-kaeltemitteln-blueht-accg-200794893.html,https://www.faz.net/aktuell/rhein-main/frankfurt/organisierte-klimakriminalitaet-illegaler-handel-mit-kaeltemitteln-blueht-accg-200794893.html,0,www.faz.net,Klimakriminalität: Hälfte aller Kältemittel kommt aus illegalen Quellen,"Synthetische Kältemittel kommen überall zum Einsatz, sind aber Klimakiller. Die EU will sie reduzieren, doch ihre Auflagen haben einen riesigen Schwarzmarkt entstehen lassen. Behörden bekommen ihn nicht unter Kontrolle.",https://media0.faz.net/image/w1200h627/26087189679f/w5000h2612x0y360o/202605/0eb71fd4-afc3-4610-b552-37cef6da931a/kuehlt-die-eiscreme-erwaermt.webp,2026-05-05T08:39:24Z,,"Es ist ein Schwarzmarkt, auf dem sich die unterschiedlichsten Kunden bedienen: Metzger und Restaurants, die für ihre Kühlanlagen günstige Kältemittel kaufen wollen. Oder Kfz-Werkstätten, die Klimaanl… [+6089 chars]",,de,'Kälte'
https://www.focus.de/politik/ausland/russische-truppen-decken-sich-mit-neuen-kalaschnikows-ein_ec73b7ac-cac3-4d3a-9ac1-964f775c07c3.html,https://www.focus.de/politik/ausland/russische-truppen-decken-sich-mit-neuen-kalaschnikows-ein_ec73b7ac-cac3-4d3a-9ac1-964f775c07c3.html,0,www.focus.de,Russische Truppen decken sich mit neuen Kalaschnikows ein,Russland stockt seine Sturmgewehre für den Ukraine-Krieg weiter auf. Neue AK-12-Varianten entstehen direkt aus den Erfahrungen an der Front.,"https://quadro.burda-forward.de/ctf/71a3dd86-632c-4c19-abae-d55a41661027.3ecd18d2-bd39-44a6-b472-ed9c13179ed8.jpg?im=RegionOfInterestCrop=(1200,630),regionOfInterest=(440,311)&hash=7eb7b7d24991bd82f518b014574bce6db95cb444d8444c7015dc1fe530552f6d",2026-05-05T12:54:00Z,,Die russischen Streitkräfte haben im Frühjahr 2026 eine große Lieferung des Sturmgewehrs AK-12 des Herstellers Kalaschnikow in der Version von 2023 erhalten. Sie sollen an die Front in der Ukraine ge… [+3094 chars],,de,'Kälte'
https://www.zeit.de/wirtschaft/2026-05/lagarde-ezb-fossile-erneuerbare-energie-ausbau,https://www.zeit.de/wirtschaft/2026-05/lagarde-ezb-fossile-erneuerbare-energie-ausbau,0,www.zeit.de,Christine Lagarde: EZB-Chefin mahnt Ausbau erneuerbarer Energien an,"Der Irankrieg offenbare die kostspielige Abhängigkeit Europas von fossilen Brennstoffen, sagt Christine Lagarde. Der beste Ausweg sei ein Ausbau alternativer Energien.",https://img.zeit.de/wirtschaft/2026-05/ezb-erneuerbare-energien-christine-lagarde-bild/wide__1300x731,2026-05-05T15:17:50Z,,"Die Präsidentin der Europäischen Zentralbank (EZB), Christine Lagarde, hat sich für einen stärkeren Ausbau der erneuerbaren Energien ausgesprochen. Die europäische Abhängigkeit von fossilen Brennstof… [+793 chars]",,de,'Iran'
https://www.welt.de/regionales/berlin/article69fa042728c8b45865918e37/roland-emmerich-warum-der-regisseur-nie-wieder-nach-deutschland-ziehen-will.html,https://www.welt.de/regionales/berlin/article69fa042728c8b45865918e37/roland-emmerich-warum-der-regisseur-nie-wieder-nach-deutschland-ziehen-will.html,0,www.welt.de,"Politische Filme? „Da muss man warten, bis Trump weg ist“",Star-Regisseur Roland Emmerich lebt seit Langem in den USA – und will auch nicht nach Deutschland zurück. Das Filmemachen sieht er in seiner Wahlheimat jedoch durch Sparzwänge und das politische Klima unter Druck.,https://images.welt.de/69fa042728c8b45865918e37/8b0c8b12050017429f46dcc665fc85ea-master/ci16x9-w1200/dpa-com-260505-99-335309-jpg,2026-05-05T15:33:47Z,,Star-Regisseur Roland Emmerich lebt seit Langem in den USA und will auch nicht nach Deutschland zurück. Das Filmemachen sieht er in seiner Wahlheimat jedoch durch Sparzwänge und das politische Klima … [+2960 chars],,de,'Klima'
https://www.tagesspiegel.de/wissen/mikroplastik-in-der-luft-wie-die-schwebteilchen-die-atmosphare-erwarmen-15558104.html,https://www.tagesspiegel.de/wissen/mikroplastik-in-der-luft-wie-die-schwebteilchen-die-atmosphare-erwarmen-15558104.html,0,www.tagesspiegel.de,Mikroplastik in der Luft: Wie die Schwebteilchen die Atmosphäre erwärmen,"Mikroplastik in der Luft hat nicht nur negative Folgen für die Umwelt, sondern auch fürs Klima. Besonders farbige Teilchen spielen dabei eine Rolle.",https://www.tagesspiegel.de/images/15560768/alternates/BASE_16_9_W1400/1777995194000/karolina-grabowska-gsqqgq2eflo-unsplash.jpeg,2026-05-05T15:36:20Z,,"Mikroplastik ist nicht nur ein Problem für Meere und Tiere neue Forschung deutet darauf hin, dass winzige Plastikteilchen in der Luft auch das Klima beeinflussen können. Sie können die Atmosphäre erw… [+96 chars]",,de,'Klima'
https://www.zeit.de/news/2026-05/05/ovg-weist-auch-klage-der-stadt-borkum-gegen-gasbohrungen-ab,https://www.zeit.de/news/2026-05/05/ovg-weist-auch-klage-der-stadt-borkum-gegen-gasbohrungen-ab,0,www.zeit.de,Umstrittenes Energieprojekt: OVG weist auch Klage der Stadt Borkum gegen Gasbohrungen ab,Hier finden Sie Informationen zu dem Thema „Umstrittenes Energieprojekt“. Lesen Sie jetzt „OVG weist auch Klage der Stadt Borkum gegen Gasbohrungen ab“.,https://img.zeit.de/news/2026-05/05/ovg-weist-auch-klage-der-stadt-borkum-gegen-gasbohrungen-ab-image-group/wide__1300x731,2026-05-05T15:43:17Z,,"Das Niedersächsische Oberverwaltungsgericht (OVG) hat die zweite Klage gegen die Gasförderung vor der Nordseeinsel Borkum abgewiesen. Die Stadt Borkum führte an, dass das niedersächsische Landesamt f… [+1799 chars]",,de,'Gas'
https://www.faz.net/aktuell/politik/inland/inka-von-puttkamer-minensucherin-fuer-strasse-von-hormus-200799375.html,https://www.faz.net/aktuell/politik/inland/inka-von-puttkamer-minensucherin-fuer-strasse-von-hormus-200799375.html,0,www.faz.net,Straße von Hormus: Deutschlands Minensucherin,Inka von Puttkamer führt das Vorauskommando für einen möglichen Einsatz der Marine in der Straße von Hormus. Die Laufbahn der Kommandeurin ist außergewöhnlich.,https://media0.faz.net/image/w1200h627/6a84faadbc93/w3000h1567x0y84o/202403/43601.0.232836174/fregattenkapitaen-inka-von.webp,2026-05-05T16:14:27Z,,"In der Marine ist Inka von Puttkamer schon lange eine Repräsentantin des Außergewöhnlichen. Als die gebürtige Wilhelmshavenerin und Tochter eines Marine-Offiziers 2001 in die Bundeswehr eintrat, galt… [+2797 chars]",,de,'Hormus'
https://www.golem.de/sonstiges/zustimmung/auswahl.html?from=https://www.golem.de/news/neues-heizungsgesetz-reiche-erlaubt-alles-was-irgendwie-warm-macht-2605-208343.html&referer=https://t.co/d56d9de44b,https://www.golem.de/sonstiges/zustimmung/auswahl.html?from=https://www.golem.de/news/neues-heizungsgesetz-reiche-erlaubt-alles-was-irgendwie-warm-macht-2605-208343.html&referer=https://t.co/d56d9de44b,0,www.golem.de,"Neues Heizungsgesetz: Reiche erlaubt alles, was irgendwie warm macht","Das Wirtschaftsministerium unter Ministerin Reiche hat den Entwurf für das neue Heizungsgesetz vorgelegt. Die Biotreppe endet schon 2040. (Klima & Umwelt, Smart Meter)",,2026-05-05T16:23:02Z,,"Besuchen Sie Golem.de wie gewohnt mit Werbung und Tracking,
 indem Sie der Nutzung aller Cookies zustimmen.
 Details zum Tracking finden Sie im Privacy Center.
Skript wurde nicht geladen. Informat… [+607 chars]",,de,'Klima'
https://orf.at/stories/3428879/,https://orf.at/stories/3428879/,0,orf.at,Budgetkürzungen bei Klima als Zeitbombe,"Wer heute bei Klimamaßnahmen kürzt, zahlt morgen doppelt. Das ist die Kernbotschaft einer am Dienstag veröffentlichten Studie der Uni Graz anlässlich des geplanten Doppelbudgets. Der Auftraggeber der Studie, die Naturschutzorganisation WWF, forderte von der R…",https://ibs.orf.at/news?image=https%3A%2F%2Fassets.orf.at%2Fmims%2F2026%2F19%2F18%2Fcrops%2Fw%3D1200%2Ch%3D630%2Cq%3D75%2F3026494_master_1170818_klima_budget_analyse_vik.jpg%3Fs%3D3ddda15e25524dd8d77cf00ba25a588f7e1732d1,2026-05-05T21:39:02Z,,"Eine Budgetsanierung ohne Klimapolitik sei mehrfach kontraproduktiv, heißt es in der Studie des Wegener Centers der Uni Graz. Schließlich würden Ausgabenkürzungen, wie sie derzeit diskutiert und teil… [+5456 chars]",,de,'Klima'
https://www.zeit.de/news/2026-05/06/hormus-trump-will-einsatz-fuer-blockade-aufhebung-aussetzen,https://www.zeit.de/news/2026-05/06/hormus-trump-will-einsatz-fuer-blockade-aufhebung-aussetzen,0,www.zeit.de,Krieg: Hormus: Trump will Einsatz für Blockade-Aufhebung aussetzen,Hier finden Sie Informationen zu dem Thema „Krieg“. Lesen Sie jetzt „Hormus: Trump will Einsatz für Blockade-Aufhebung aussetzen“.,https://img.zeit.de/administratives/sharing/fallback-image-die-zeit/wide__1300x731,2026-05-05T23:08:12Z,,US-Präsident Donald Trump will seine Initiative für eine sichere Durchfahrt von Schiffen durch die Straße von Hormus «für kurze Zeit» aussetzen. Während des Stopps von «Projekt Freiheit» solle geprüf… [+315 chars],,de,'Hormus'
https://www.stern.de/politik/ausland/irankrieg-news--rubio--trump-prueft-abkommen-mit-dem-iran-37087516.html,https://www.stern.de/politik/ausland/irankrieg-news--rubio--trump-prueft-abkommen-mit-dem-iran-37087516.html,0,www.stern.de,"Irankrieg: Trump lässt prüfen, ob Abkommen mit dem Iran unterzeichnet werden kann","Die USA setzen das „Projekt Freiheit“ aus, die Seeblockade bleibt. Trump deutet an, dass ein Abkommen mit dem Iran vorliegt. Alle Entwicklungen im Newsblog.",https://image.stern.de/37243442/t/iG/v3/w1440/r1.7778/-/donald-trump.jpg,2026-05-05T23:28:00Z,,"In den Vereinigten Arabischen Emiraten bricht Behördenangaben zufolge nach einem iranischen Drohnenangriff ein Großbrand aus. Betroffen ist eine Industriezone der Hafenstadt Fudschaira, wie das Medie… [+609 chars]",,de,'Iran'
https://www.zeit.de/news/2026-05/06/trump-setzt-einsatz-fuer-sichere-hormus-durchfahrt-aus,https://www.zeit.de/news/2026-05/06/trump-setzt-einsatz-fuer-sichere-hormus-durchfahrt-aus,0,www.zeit.de,Iran-Krieg: Trump setzt Einsatz für sichere Hormus-Durchfahrt aus,Hier finden Sie Informationen zu dem Thema „Iran-Krieg“. Lesen Sie jetzt „Trump setzt Einsatz für sichere Hormus-Durchfahrt aus“.,https://img.zeit.de/news/2026-05/06/trump-setzt-einsatz-fuer-sichere-hormus-durchfahrt-aus-image-group/wide__1300x731,2026-05-05T23:28:54Z,,Präsident Donald Trump will den US-Einsatz für eine sichere Durchfahrt von Schiffen durch die Straße von Hormus «für kurze Zeit» aussetzen. Während des Stopps von «Projekt Freiheit» solle geprüft wer… [+1622 chars],,de,'Hormus'
https://www.faz.net/aktuell/politik/ausland/irankrieg-us-armee-pausiert-einsatz-in-strasse-von-hormus-200802337.html,https://www.faz.net/aktuell/politik/ausland/irankrieg-us-armee-pausiert-einsatz-in-strasse-von-hormus-200802337.html,0,www.faz.net,Irankrieg: US-Armee pausiert Einsatz in Straße von Hormus,Die USA stoppen das erst am Montag gestartete „Projekt Freiheit“ zur Sicherung der Schifffahrt in der Straße von Hormus. US-Präsident Donald Trump spricht von „großen Fortschritten“ in den Friedensverhandlungen.,https://media0.faz.net/image/w1200h627/0e8d217d2973/w7506h3921x0y150o/202605/43601.0.2047744118/us-praesident-donald-trump.webp,2026-05-05T23:43:12Z,,"US-Präsident Donald Trump hat eine Aussetzung des US-Militäreinsatzes zur Sicherung der Schifffahrt in der Straße von Hormus bekanntgegeben. Das Projekt Freiheit werde für eine kurze Zeit pausiert, u… [+2003 chars]",,de,'Hormus'
https://www.stern.de/gesellschaft/regional/nordrhein-westfalen/vorfall-in-der-uniklinik--prozess-um-fahrlaessige-toetung-nach-legionellen-infektion-37372230.html,https://www.stern.de/gesellschaft/regional/nordrhein-westfalen/vorfall-in-der-uniklinik--prozess-um-fahrlaessige-toetung-nach-legionellen-infektion-37372230.html,0,www.stern.de,Vorfall in der Uniklinik: Prozess um fahrlässige Tötung nach Legionellen-Infektion,Mit Legionellen belastetes Kühlwasser soll 2020 an der Uniklinik Köln drei Tote gefordert haben. Ein für die Klimaanlage der Klinik Verantwortlicher kommt nun wegen fahrlässiger Tötung vor Gericht.,https://image.stern.de/37372232/t/LC/v1/w1440/r1.7778/-/06--qd67stlvjpv3axs2048jpeg---03d693d9c65d2f86.jpg,2026-05-06T01:30:08Z,,"Kopiere den aktuellen Link
Zur Merkliste hinzufügen
Mit Legionellen belastetes Kühlwasser soll 2020 an der Uniklinik Köln drei Tote gefordert haben. Ein für die Klimaanlage der Klinik Verantwortlic… [+1699 chars]",,de,'Klima'
https://www.zeit.de/news/2026-05/06/fast-alle-rohstoffe-verteuern-sich-erheblich,https://www.zeit.de/news/2026-05/06/fast-alle-rohstoffe-verteuern-sich-erheblich,0,www.zeit.de,Preise: Fast alle Rohstoffe verteuern sich erheblich,Hier finden Sie Informationen zu dem Thema „Preise“. Lesen Sie jetzt „Fast alle Rohstoffe verteuern sich erheblich“.,https://img.zeit.de/news/2026-05/06/fast-alle-rohstoffe-verteuern-sich-erheblich-image-group/wide__1300x731,2026-05-06T03:00:09Z,,Neben Öl und Gas haben sich in den vergangenen Monaten nahezu alle Metalle erheblich verteuert. Nach Berechnung der Vereinigung der bayerischen Wirtschaft (vbw) haben die Rohstoffpreise auf den Weltm… [+1041 chars],,de,'Preis'
https://www.nzz.ch/mobilitaet/idera-9x-der-heimliche-nachfolger-des-vw-touareg-faehrt-nur-in-china-ld.10005343,https://www.nzz.ch/mobilitaet/idera-9x-der-heimliche-nachfolger-des-vw-touareg-faehrt-nur-in-china-ld.10005343,0,www.nzz.ch,ID.Era 9X: Der heimliche Nachfolger des VW Touareg fährt nur in China,"Das neue E-SUV von Volkswagen ist das, was Phaeton und Touareg nie sein durften: ein bezahlbares, vollvernetztes Oberklasse-Flaggschiff. Doch EU-Regeln, höhere Preise und Angst vor der Konkurrenz im eigenen Konzern könnten den XXL-Stromer stoppen.","https://img-msp-prod.nzz.ch/2026/05/01/3c7d65b4-62af-48b7-b1b3-2da48a3a02a2.jpg?width=1200&height=675&fit=bounds&quality=75&auto=webp&crop=4000,2250,x0,y209&wmark=nzz",2026-05-06T03:30:00Z,,"Das neue E-SUV von Volkswagen ist das, was Phaeton und Touareg nie sein durften: ein bezahlbares, vollvernetztes Oberklasse-Flaggschiff. Doch EU-Regeln, höhere Preise und Angst vor der Konkurrenz im … [+6798 chars]",,de,'Preis'
https://www.nzz.ch/sport/weitere-sportarten/saudiarabien-sportstrategie-durch-iran-krieg-unter-druck-ld.10004149,https://www.nzz.ch/sport/weitere-sportarten/saudiarabien-sportstrategie-durch-iran-krieg-unter-druck-ld.10004149,0,www.nzz.ch,Saudiarabiens milliardenschwere Sportoffensive gerät ins Stocken – politisch bleibt sie unentbehrlich,Die Zeit willkürlicher Ausgaben ist vorbei: Infolge des Iran-Kriegs drosselt das Königreich die Investitionen in den Sport. Erste Turniere wie die LIV-Golf-Tour stehen vor dem Aus.,"https://img-msp-prod.nzz.ch/2026/03/18/a43348d6-77e9-43ac-b5c3-110ff803e853.jpg?width=1200&height=675&fit=bounds&quality=75&auto=webp&crop=4000,2250,x0,y133&wmark=nzz",2026-05-06T03:30:00Z,,"Die Zeit willkürlicher Ausgaben ist vorbei: Infolge des Iran-Kriegs drosselt das Königreich die Investitionen in den Sport. Erste Turniere wie die LIV-Golf-Tour stehen vor dem Aus.
Ronny Blaschke06.… [+7944 chars]",,de,'Iran'
https://www.nzz.ch/international/israel-usa-sicherheitsallianz-weniger-waffen-mehr-technologie-ld.10005222,https://www.nzz.ch/international/israel-usa-sicherheitsallianz-weniger-waffen-mehr-technologie-ld.10005222,0,www.nzz.ch,"Weniger Waffen, mehr Technologie: was für Israel bei der Sicherheitsallianz mit den USA auf dem Spiel steht",In den kommenden Wochen beginnen die offiziellen Verhandlungen über die künftige amerikanische Militärhilfe für Israel. Das könnte die Sicherheitsarchitektur des Nahen Ostens grundlegend verändern.,"https://img-msp-prod.nzz.ch/2026/04/30/b78b1f95-f7dc-47c9-9dcb-548367f55af3.jpg?width=1200&height=674&fit=bounds&quality=75&auto=webp&crop=2868,1613,x0,y240&wmark=nzz",2026-05-06T03:30:00Z,,"In den kommenden Wochen beginnen die offiziellen Verhandlungen über die künftige amerikanische Militärhilfe für Israel. Das könnte die Sicherheitsarchitektur des Nahen Ostens grundlegend verändern.
… [+9227 chars]",,de,'Iran'
https://www.diepresse.com/22298811/nach-nur-einem-tag-trump-setzt-us-militaereinsatz-in-strasse-von-hormus,https://www.diepresse.com/22298811/nach-nur-einem-tag-trump-setzt-us-militaereinsatz-in-strasse-von-hormus,0,www.diepresse.com,Nach nur einem Tag: Trump setzt US-Militäreinsatz in Straße von Hormus wieder aus,"Am Montag hatten die USA eine Initiative gestartet, die festsitzenden Schiffen helfen soll, die Straße von Hormus zu passieren. Der Iran reagierte darauf mit mehreren Angriffen. Nun schreibt US-Präsident Trump auf seiner Plattform Truth Social von „großen For…",https://img.diepresse.com/public/incoming/smh52-imago854121223jpg/alternates/DPR_SOCIAL_NACHRICHTEN/imago854121223.jpg,2026-05-06T03:38:42Z,,"Am Montag hatten die USA eine Initiative gestartet, die festsitzenden Schiffen helfen soll, die Straße von Hormus zu passieren. Der Iran reagierte darauf mit mehreren Angriffen. Nun schreibt US-Präsi… [+4093 chars]",,de,'Iran'
https://www.faz.net/aktuell/politik/ausland/projekt-freiheit-im-iran-krieg-us-armee-pausiert-einsatz-in-strasse-von-hormus-200802337.html,https://www.faz.net/aktuell/politik/ausland/projekt-freiheit-im-iran-krieg-us-armee-pausiert-einsatz-in-strasse-von-hormus-200802337.html,0,www.faz.net,„Projekt Freiheit“: US-Armee pausiert Einsatz zur sicheren Fahrt durch Straße von Hormus,Die USA stoppen das gerade erst gestartete „Projekt Freiheit“  in der Straße von Hormus. Präsident Trump spricht von „großen Fortschritten“ in den Friedensverhandlungen.,https://media0.faz.net/image/w1200h627/0e8d217d2973/w7506h3921x0y150o/202605/43601.0.2047744118/us-praesident-donald-trump.webp,2026-05-06T04:09:35Z,,"US-Präsident Donald Trump hat eine Aussetzung des US-Militäreinsatzes zur Sicherung der Schifffahrt in der Straße von Hormus bekanntgegeben. Das Projekt Freiheit werde für eine kurze Zeit pausiert, u… [+2003 chars]",,de,'Hormus'
https://www.diepresse.com/22299311/trump-macht-kehrtwende-in-strasse-von-hormus-hantavirus-darf-anlegen-im,https://www.diepresse.com/22299311/trump-macht-kehrtwende-in-strasse-von-hormus-hantavirus-darf-anlegen-im,0,www.diepresse.com,Trump macht Kehrtwende in Straße von Hormus • Hantavirus: Kreuzfahrtschiff darf anlegen • Arsenal steht im Champions-League-Finale,Guten Morgen am 6. Mai 2026. Hier sind die wichtigsten Nachrichten zum Start in den Tag.,https://www.diepresse.com/assets_v2/images/diepresse_nachrichten.png,2026-05-06T04:24:17Z,,"Guten Morgen am 6. Mai 2026. Hier sind die wichtigsten Nachrichten zum Start in den Tag.
Am Montag hatten die USA eine Initiative gestartet, die festsitzenden Schiffen helfen soll, die Straße von Ho… [+1269 chars]",,de,'Iran'
