index,url,valid,domain,title,description,image,published,archive,content,quote,language,keyword
https://www.focus.de/kultur/stars/wieder-wird-geschossen-verona-pooth-muss-wegen-iran-krieg-termin-in-deutschland-absagen_93c6220a-c306-4338-80a2-f3fd17bec03e.html,https://www.focus.de/kultur/stars/wieder-wird-geschossen-verona-pooth-muss-wegen-iran-krieg-termin-in-deutschland-absagen_93c6220a-c306-4338-80a2-f3fd17bec03e.html,0,www.focus.de,"""Wieder wird geschossen"": Verona Pooth muss wegen Iran-Krieg Termin in Deutschland absagen",Eigentlich sollte Verona Pooth eines der Highlights auf dem Hamburger OMR-Festival sein. Aufgrund der verschärften Sicherheitslage in ihrer Wahlheimat Dubai hat die Unternehmerin ihre Reise nach Deutschland gestrichen – die Sorge um Sohn Rocco war zu groß.,"https://quadro.burda-forward.de/ctf/85972442-8571-4326-9c7d-7a229dee73e7.e56092f2-cad5-48de-88f4-62dc0d711ec4.png?im=RegionOfInterestCrop=(1200,630),regionOfInterest=(1363,508)&hash=d1fa0edde9113b9ed92787b5837e7e5d431e3de7c296ae5f19bc2494b437a270",2026-05-06T04:25:00Z,,"Verona Pooth war bereit für das OMR-Festival, das größte Digital-Event Europas: ""Ich freue mich riesig"", schrieb die Moderatorin noch vor wenigen Stunden in ihre Instagram-Story. Doch die Realität im… [+1826 chars]",,de,'Iran'
https://steiermark.orf.at/stories/3352975/,https://steiermark.orf.at/stories/3352975/,0,steiermark.orf.at,Trockenheit verschärft Pollenbelastung,Die Allergiesaison hat begonnen und viele Menschen leiden an den Auswirkungen der Pollenbelastung. Experten warnen vor übereilter Selbstmedikation und raten zu exakter Diagnose. Auch das trockene Klima und die verstärkte Nutzung von Bildschirmen setzen den Au…,https://ibs.orf.at/stm?image=https%3A%2F%2Foekastatic.orf.at%2Fmims%2F2026%2F07%2F17%2Fcrops%2Fw%3D1200%2Ch%3D627%2Cq%3D75%2F2930719_master_1132717_themenbild_pollen_.jpg%3Fs%3Dbab9247ad61ee795c08d525e3247beed79b3c112,2026-05-06T06:04:00Z,,"Der Maximalpeak an Pollen in der Luft ist vorerst überwunden. Wir haben jetzt ja auch gerade die Birkenpollen-Zeit, die jetzt endet. Da fliegt noch ein bisschen was. Aber das Schlimmste ist jetzt zum… [+1375 chars]",,de,'Klima'
https://www.faz.net/aktuell/wissen/erde-klima/was-mikroplastik-in-der-atmosphaere-mit-dem-klima-macht-accg-200797848.html,https://www.faz.net/aktuell/wissen/erde-klima/was-mikroplastik-in-der-atmosphaere-mit-dem-klima-macht-accg-200797848.html,0,www.faz.net,Mikroplastik: Was Kunststoffpartikel in der Luft anrichten,Winzige Plastikteilchen in der Atmosphäre nehmen Sonnenlicht auf und geben Wärme ab. Noch ist der Effekt auf das Klima klein.,https://media0.faz.net/image/w1200h627/1993007daeca/w3000h1567x0y216o/202411/43601.0.697102342/plastikmuell-im-citarum-fluss.webp,2026-05-06T06:45:01Z,,"Mikro- und Nanoplastik tragen zur Klimaerwärmung bei, und der Effekt liegt etwa in der Größenordnung von Kondensstreifen aus dem Flugverkehr. Zu diesem Schluss kommen Wissenschaftler um Hongbo Fu aus… [+4670 chars]",,de,'Klima'
https://www.n-tv.de/wissen/Farbiges-Mikroplastik-heizt-die-Atmosphaere-auf-id30790542.html,https://www.n-tv.de/wissen/Farbiges-Mikroplastik-heizt-die-Atmosphaere-auf-id30790542.html,0,www.n-tv.de,Bislang unbeachtete Klima-Gefahr: Farbiges Mikroplastik heizt die Atmosphäre auf,Wissenschaftler warnen vor einem bisher wenig beachteten Klimafaktor: Winzige Kunststoff-Partikel in der Atmosphäre absorbieren Sonnenlicht und geben es als Wärme ab. Dabei ist ihre Farbe entscheidend für das Ausmaß des Effekts.,https://www.n-tv.de/img/30790547/1778053200/Img_16_9/1200/19-04-2024-Borkwalde-Brandenburg-Auf-einem-Zeigefinger-befindet-sich-Mikroplastik.jpg,2026-05-06T06:55:36Z,,"Dass Mikroplastik der Umwelt schadet, ist längst bekannt. Doch wie es sich auf das Klima auswirkt, hat nun ein Forschungsteam untersucht. (Foto: picture alliance / ZB)
Wissenschaftler warnen vor ein… [+4502 chars]",,de,'Klima'
https://www.zeit.de/2026/19/papageien-deutschland-halsbandsittich-alexandersittich-gelbkopfamazone,https://www.zeit.de/2026/19/papageien-deutschland-halsbandsittich-alexandersittich-gelbkopfamazone,0,www.zeit.de,Papageien in Deutschland: Es grünt!,Seit Jahrzehnten leben hier drei Papageienarten – im völlig falschen Klima. Wie sie dorthin kamen und trotz erfrorener Zehen überleben: ein Überblick in Grafiken.,https://img.zeit.de/2026/19/papageien-deutschland-halsbandsittich-alexandersittich-gelbkopfamazone-bild/wide__1300x731,2026-05-06T07:38:56Z,,"Von Nobelpreisträgern über Viren bis hin zu Hunderassen die Welt lässt sich in Zahlen und Grafiken beschreiben. Jede Woche neu in unserer Serie Wissen in Bildern.
<li>AG Papageienmonitoring</li><li>… [+162 chars]",,de,'Klima'
https://www.stern.de/gesellschaft/regional/hamburg-schleswig-holstein/nahverkehr-im-norden--busverbindungen-wackeln---land-und-kreise-im-finanzstreit-37373648.html,https://www.stern.de/gesellschaft/regional/hamburg-schleswig-holstein/nahverkehr-im-norden--busverbindungen-wackeln---land-und-kreise-im-finanzstreit-37373648.html,0,www.stern.de,Nahverkehr im Norden: Busverbindungen wackeln – Land und Kreise im Finanzstreit,Steigende Kosten gefährden Busverbindungen auf dem Land. Warum Opposition und Regierung in Schleswig-Holstein um die Verantwortung für den Nahverkehr ringen.,https://image.stern.de/37373766/t/wi/v1/w1440/r1.7778/-/06--vw5fkw2kzlv1axs2048jpeg---bf5a94c120e13c55.jpg,2026-05-06T09:47:20Z,,"Kopiere den aktuellen Link
Zur Merkliste hinzufügen
Steigende Kosten gefährden Busverbindungen auf dem Land. Warum Opposition und Regierung in Schleswig-Holstein um die Verantwortung für den Nahver… [+4287 chars]",,de,'Klima'
https://www.stern.de/gesellschaft/regional/nordrhein-westfalen/vorfall-in-der-uniklinik--koelner-uniklinik--prozess-nach-legionellen-toten-gestartet-37372230.html,https://www.stern.de/gesellschaft/regional/nordrhein-westfalen/vorfall-in-der-uniklinik--koelner-uniklinik--prozess-nach-legionellen-toten-gestartet-37372230.html,0,www.stern.de,Vorfall in der Uniklinik: Kölner Uniklinik: Prozess nach Legionellen-Toten gestartet,Mit Legionellen belasteter Wasserdampf soll 2020 an der Uniklinik Köln drei Tote gefordert haben. Ein für die Klimatechnik Verantwortlicher steht nun vor dem Kölner Landgericht.,https://image.stern.de/37373896/t/_A/v1/w1440/r1.7778/-/06--rupbbe4agyv6axs2048jpeg---0af20f6258e8929e.jpg,2026-05-06T10:11:26Z,,"Kopiere den aktuellen Link
Zur Merkliste hinzufügen
Mit Legionellen belasteter Wasserdampf soll 2020 an der Uniklinik Köln drei Tote gefordert haben. Ein für die Klimatechnik Verantwortlicher steht… [+1427 chars]",,de,'Klima'
https://kaernten.orf.at/stories/3353060/,https://kaernten.orf.at/stories/3353060/,0,kaernten.orf.at,Klimaktivisten besprühten Parteizentralen,Klimaaktivisten haben in der Nacht auf Mittwoch drei Parteizentralen in Klagenfurt beschmiert und Sticker und Plakate an den Außenfassaden angebracht. Die Polizei ermittelt und schaltete das Landesamt für Staatsschutz und Extremismusbekämpfung eingeschaltet.,https://ibs.orf.at/ktn?image=https%3A%2F%2Foekastatic.orf.at%2Fmims%2F2026%2F19%2F26%2Fcrops%2Fw%3D1200%2Ch%3D627%2Cq%3D75%2F3027451_master_1171226_foto2.jpeg%3Fs%3D2ace8792bbc4a8b795bed860e0a3afc46de70ca2,2026-05-06T10:54:08Z,,"Shame on you oder Wir sorgen für ein kaputtes Klima steht auf den selbst gedruckten Plakaten, die die Klimaaktivisten auf den Glasscheiben und Außenfassaden der Parteibüros von Grünen, SPÖ und Team K… [+1384 chars]",,de,'Klima'
https://www.zeit.de/politik/2026-05/energiekrise-israel-deutschland-kerosin-erdgas-lieferung,https://www.zeit.de/politik/2026-05/energiekrise-israel-deutschland-kerosin-erdgas-lieferung,0,www.zeit.de,Energiekrise: Israel plant Kerosinlieferungen an Deutschland,Vor dem Hintergrund möglicher Engpässe durch den Irankrieg will Israel Deutschland mit Kerosin beliefern. Die Bundesregierung äußerte sich bislang nicht zu den Plänen.,https://img.zeit.de/politik/deutschland/2026-05/israel-deutschland-kerosin-versorgung-bild/wide__1300x731,2026-05-06T11:48:17Z,,"Die israelische Regierung hat angekündigt, Deutschland mit Kerosin und Gas zu versorgen. Wie Israels Energie- und Außenministerium gemeinsam mitteilten, geschieht dies auf eine Bitte des deutschen En… [+2559 chars]",,de,'Gas'
https://www.faz.net/aktuell/politik/usa-unter-trump/irankrieg-donald-trumps-drei-probleme-mit-der-strategie-200803440.html,https://www.faz.net/aktuell/politik/usa-unter-trump/irankrieg-donald-trumps-drei-probleme-mit-der-strategie-200803440.html,0,www.faz.net,Straße von Hormus: Trumps Zickzack,Der Präsident setzt den militärischen Schutz für Handelsschiffe nach einem Tag wieder aus. Seine Strategie hat nun schon drei Probleme.,https://media0.faz.net/image/w1200h627/01b8ce9e34b0/w5661h2957x0y113o/202605/43601.0.2052125770/praesident-donald-trump-am.webp,2026-05-06T13:09:58Z,,"Der amerikanische Präsident Donald Trump hat im Irankrieg seine Strategie schon oft und immer wieder auch abrupt geändert. Jetzt hat er das Project Freedom, mit dem Handelsschiffen die Fahrt durch di… [+5492 chars]",,de,'Hormus'
https://www.stern.de/gesellschaft/regional/nordrhein-westfalen/klimatechniker-angeklagt--prozess-nach-legionellen-todesfaellen-an-uniklinik-begonnen-37372230.html,https://www.stern.de/gesellschaft/regional/nordrhein-westfalen/klimatechniker-angeklagt--prozess-nach-legionellen-todesfaellen-an-uniklinik-begonnen-37372230.html,0,www.stern.de,Klimatechniker angeklagt: Prozess nach Legionellen-Todesfällen an Uniklinik begonnen,Mit Legionellen belasteter Wasserdampf soll 2020 an der Uniklinik Köln drei Menschenleben gefordert haben. Ein für die Klimatechnik Verantwortlicher steht nun vor dem Kölner Landgericht.,https://image.stern.de/37374898/t/mh/v1/w1440/r1.7778/-/06--hn4x3b3pkav1axs2048jpeg---4cf87c73e877c1b4.jpg,2026-05-06T13:33:04Z,,"Kopiere den aktuellen Link
Zur Merkliste hinzufügen
Mit Legionellen belasteter Wasserdampf soll 2020 an der Uniklinik Köln drei Menschenleben gefordert haben. Ein für die Klimatechnik Verantwortlic… [+2465 chars]",,de,'Kälte'
https://www.stern.de/politik/ausland/energie--slowakei-hebt-hoehere-treibstoffpreise-fuer-auslaender-auf-37375228.html,https://www.stern.de/politik/ausland/energie--slowakei-hebt-hoehere-treibstoffpreise-fuer-auslaender-auf-37375228.html,0,www.stern.de,Energie: Slowakei hebt höhere Treibstoffpreise für Ausländer auf,"Wegen eines ""Erdöl-Notstands"" hatte die Slowakei Treibstoffe rationiert und höhere Preise für Ausländer verlangt. Nun gibt sie dem Druck der EU nach. Ab Freitag gelten wieder gleiche Preise für alle.",https://image.stern.de/37375230/t/pK/v1/w1440/r1.7778/-/06--5z4i4yz4mav9axs2048jpeg---8d0b56412a39b71d.jpg,2026-05-06T15:10:02Z,,"Kopiere den aktuellen Link
Zur Merkliste hinzufügen
Wegen eines ""Erdöl-Notstands"" hatte die Slowakei Treibstoffe rationiert und höhere Preise für Ausländer verlangt. Nun gibt sie dem Druck der EU n… [+2516 chars]",,de,'Erdöl'
https://www.nzz.ch/pro/hormuz-panamakanal-strasse-von-malakka-der-kampf-um-die-kontrolle-neuralgischer-meerengen-intensiviert-sich-ld.10004825,https://www.nzz.ch/pro/hormuz-panamakanal-strasse-von-malakka-der-kampf-um-die-kontrolle-neuralgischer-meerengen-intensiviert-sich-ld.10004825,0,www.nzz.ch,"Hormuz, Panamakanal, Strasse von Malakka: Der Kampf um die Kontrolle neuralgischer Meerengen intensiviert sich","Rund drei Viertel des Erdöltransports erfolgen über den Seeweg, beim Güterhandel ist der Anteil noch höher. Wer Wasserstrassen kontrolliert, hat ein grosses Faustpfand in geopolitischen Konflikten.","https://img-msp-prod.nzz.ch/2026/05/03/34ea41f4-7182-4d1f-b634-b50199ab2854.jpg?width=1200&height=675&fit=bounds&quality=75&auto=webp&crop=5500,3094,x0,y348&wmark=nzz",2026-05-07T03:30:00Z,,"Rund drei Viertel des Erdöltransports erfolgen über den Seeweg, beim Güterhandel ist der Anteil noch höher. Wer Wasserstrassen kontrolliert, hat ein grosses Faustpfand in geopolitischen Konflikten.
… [+10828 chars]",,de,'Erdöl'
https://www.faz.net/premium/weltwirtschaft/weltwissen/strasse-von-malakka-indonesien-hat-gebuehrenplaene-accg-200794878.html,https://www.faz.net/premium/weltwirtschaft/weltwissen/strasse-von-malakka-indonesien-hat-gebuehrenplaene-accg-200794878.html,0,www.faz.net,Straße von Malakka: Hormus 2.0,"Natürlich war es nur eine Frage der Zeit, bis die Methode, wie Iran die Welt in der Straße von Hormus erpresst, Nachahmer findet. Schon im März hatten wir auf die übrigen Engpässe der Welt hingewiesen. Nun geht es um die wichtigste Schifffahrtsstraße der Welt.",https://media0.faz.net/image/w1200h627/0e7ab35d54a6/w3500h1828x0y320o/202604/43601.0.2009987915/auf-dem-weg-in-die-strasse-von.webp,2026-05-07T04:50:00Z,,"F.A.Z. Premium Weltwirtschaft
Natürlich war es nur eine Frage der Zeit, bis die Methode, wie Iran die Welt in der Straße von Hormus erpresst, Nachahmer findet. Schon im März hatten wir auf die übrig… [+91 chars]",,de,'Hormus'
https://www.welt.de/politik/ausland/article69f8a63ad3209c4cbd891d8f/iran-krieg-us-militaer-schiesst-iranischen-tanker-manoevrierunfaehig-trump-macht-weiter-druck-auf-den-iran-liveticker.html,https://www.welt.de/politik/ausland/article69f8a63ad3209c4cbd891d8f/iran-krieg-us-militaer-schiesst-iranischen-tanker-manoevrierunfaehig-trump-macht-weiter-druck-auf-den-iran-liveticker.html,0,www.welt.de,US-Militär schießt iranischen Tanker manövrierunfähig – Trump macht weiter Druck auf den Iran,Die Spannungen in und rund um die Straße von Hormus halten trotz der Aussetzung eines dortigen US-Einsatzes an. US-Präsident Donald Trump zeigt sich zuversichtlich über ein mögliches Abkommen mit dem Iran. Mehr im Liveticker.,https://images.welt.de/69f8a63ad3209c4cbd891d8f/1a6d914bc5f00f94c610325eec6d8644/ci16x9-w1200/1776937191328-afp-a8pw9t4-jpg,2026-05-07T04:55:00Z,,Die Spannungen in und rund um die Straße von Hormus halten trotz der Aussetzung eines dortigen US-Einsatzes an. US-Präsident Donald Trump zeigt sich zuversichtlich über ein mögliches Abkommen mit dem… [+13479 chars],,de,'Hormus'
https://www.welt.de/videos/video69fc1272c6d2944c8df6b069/krieg-in-nahost-frankreich-verlegt-flugzeugtraeger-charles-de-gaulle-fuer-hormus-mission.html,https://www.welt.de/videos/video69fc1272c6d2944c8df6b069/krieg-in-nahost-frankreich-verlegt-flugzeugtraeger-charles-de-gaulle-fuer-hormus-mission.html,0,www.welt.de,Frankreich verlegt Flugzeugträger „Charles de Gaulle“ für Hormus-Mission,Frankreich verlegt in Vorbereitung einer neutralen Marine-Mission in der Straße von Hormus seinen Flugzeugträger „Charles de Gaulle“ und dessen Begleitschiffe näher an die Meerenge heran.,https://images.welt.de/69fc1272c6d2944c8df6b069/a3e65cedc6092bc57786a53cdc965155/ci16x9-w1200/dpa-com-260506-935-1326661-jpg,2026-05-07T04:58:13Z,,Die WELT als ePaper: Die vollständige Ausgabe steht Ihnen bereits am Vorabend zur Verfügung so sind Sie immer hochaktuell informiert. Weitere Informationen https://epaper.welt.de,,de,'Hormus'
https://www.zeit.de/news/2026-05/07/protest-in-herne-aktivisten-kritisieren-gaskraftwerksplaene,https://www.zeit.de/news/2026-05/07/protest-in-herne-aktivisten-kritisieren-gaskraftwerksplaene,0,www.zeit.de,Aktion am Morgen: Protest in Herne: Aktivisten kritisieren Gaskraftwerkspläne,Hier finden Sie Informationen zu dem Thema „Aktion am Morgen“. Lesen Sie jetzt „Protest in Herne: Aktivisten kritisieren Gaskraftwerkspläne“.,https://img.zeit.de/news/2026-05/07/protest-in-herne-aktivisten-kritisieren-gaskraftwerksplaene-image-group/wide__1300x731,2026-05-07T06:10:15Z,,Aus Protest gegen die Gaskraftwerksstrategie der Bundesregierung haben Klimaaktivisten der Umweltorganisation Robin Wood am Kraftwerk in Herne ein großes Transparent ausgerollt. Mitten in der Klimakr… [+1926 chars],,de,'Gas'
https://www.focus.de/politik/ausland/apache-und-seahawk-schlagen-zu-us-kampfhubschrauber-versenken-sechs-iranische-boote_d2ab8e13-e6c1-4d30-b4d4-17ccc592242c.html,https://www.focus.de/politik/ausland/apache-und-seahawk-schlagen-zu-us-kampfhubschrauber-versenken-sechs-iranische-boote_d2ab8e13-e6c1-4d30-b4d4-17ccc592242c.html,0,www.focus.de,Apache und Seahawk schlagen zu: US-Kampfhubschrauber versenken sechs iranische Boote,US-Kampfhubschrauber versenken sechs iranische Boote. Der Schlag trifft Irans Marine mitten in einer ohnehin explosiven Lage.,"https://quadro.burda-forward.de/ctf/cadb70d0-5726-4c52-a2bf-8327327b79e5.84e86e34-a68a-47b6-9ee5-62e4112c7727.jpg?im=RegionOfInterestCrop=(1200,630),regionOfInterest=(1861,1136)&hash=4409b3c671ea79701858a6af36c822a5e66cf1e288c13dc1c95dfc6157571571",2026-05-07T06:14:00Z,,"US-Kampfhubschrauber des Typs AH-64 Apache und MH-60 Seahawk haben in und um die Straße von Hormus sechs iranische Schnellboote versenkt, die Handelsschiffe bedroht haben sollen. Das berichtet Busine… [+2664 chars]",,de,'Hormus'
https://www.focus.de/finanzen/news/waehrend-europa-unter-der-hormus-krise-leidet-steigt-die-tuerkei-zum-maechtigen-energieriesen-auf_3772fb52-3a97-43cf-93c2-974f0465e8fa.html,https://www.focus.de/finanzen/news/waehrend-europa-unter-der-hormus-krise-leidet-steigt-die-tuerkei-zum-maechtigen-energieriesen-auf_3772fb52-3a97-43cf-93c2-974f0465e8fa.html,0,www.focus.de,"Während Europa unter der Hormus-Krise leidet, steigt die Türkei zum mächtigen Energieriesen auf","Die Hormus-Krise eröffnet der Türkei neue Machtchancen: Ankara baut Pipelines, LNG-Netze und Handelsrouten Richtung Europa aus.","https://quadro.burda-forward.de/ctf/9fe93b2d-84c2-4fe5-bf95-1230c3d183b7.d616bd01-498e-4ca1-bd52-863953f192fa.jpg?im=RegionOfInterestCrop=(1200,630),regionOfInterest=(728,393)&hash=4947ffabf2e64b64eb83fa3d22e25345496b3b0f525b4c07c823a80dc5cb043a",2026-05-07T06:58:00Z,,"Die Krise rund um die Straße von Hormus trifft die Weltwirtschaft an ihrem empfindlichsten Nerv. Die Krise offenbart schonungslos, wie verwundbar Europas Energieversorgung trotz aller Diversifizierun… [+8470 chars]",,de,'Krise'
https://www.diepresse.com/22594847/die-vergessenen-kriegsgefangenen-der-roten-armee,https://www.diepresse.com/22594847/die-vergessenen-kriegsgefangenen-der-roten-armee,0,www.diepresse.com,Die vergessenen Kriegsgefangenen der Roten Armee [premium],"Hunger, Kälte, Gewalt und katastrophale Lagerbedingungen: Mehr als die Hälfte der sowjetischen Soldatinnen und Soldaten starb in deutscher NS-Gefangenschaft.",https://img.diepresse.com/public/incoming/wv9f4q-apaimg334407086/alternates/WEBP_WIDE_1200/APAIMG_334407086,2026-05-07T09:00:00Z,,"Nach dem Krieg, erzählt die eine, habe sie kein Hühnerfleisch mehr schneiden wollen. Es ähnle optisch Menschenfleisch zu sehr. Andere wiederum konnten kein Blut mehr riechen oder die Farbe Rot nicht … [+5949 chars]",,de,'Kälte'
https://www.bild.de/leben-wissen/mein-geld-finanzportal/krisen-gewinner-an-der-boerse-juergen-schmitt-enthuellt-fuenf-werte-69f9cd5096fe1372395ea13f,https://www.bild.de/leben-wissen/mein-geld-finanzportal/krisen-gewinner-an-der-boerse-juergen-schmitt-enthuellt-fuenf-werte-69f9cd5096fe1372395ea13f,0,www.bild.de,Finanz-Profi verrät - Kriegs-Gewinner an der Börse! Wer jetzt heimlich profitiert,Jürgen Schmitt identifiziert fünf Krisen-Gewinner an der Börse. Und in welche Aktien man lieber nicht einsteigen sollte.,"https://images.bild.de/69f9cd5096fe1372395ea13f/a2d1da4bbf2f5c31938e240721d96199,45464420?w=1280",2026-05-07T09:08:25Z,,"Kriege, Ölknappheit, Cyberangriffe: In unsicheren Zeiten schießen die Kurse mancher Firmen hoch, andere brechen ein. Viele Anleger wissen nicht, wie sie mit diesen Risiken umgehen sollen. Börsen-Prof… [+316 chars]",,de,'Finanz'
https://www.welt.de/politik/ausland/article69f998866fe2dee7bfb131c7/israels-aussenminister-vielleicht-kommen-wir-in-einigen-bereichen-sogar-zu-einer-gemeinsamen-produktion-von-waffen.html,https://www.welt.de/politik/ausland/article69f998866fe2dee7bfb131c7/israels-aussenminister-vielleicht-kommen-wir-in-einigen-bereichen-sogar-zu-einer-gemeinsamen-produktion-von-waffen.html,0,www.welt.de,„Vielleicht kommen wir in einigen Bereichen sogar zu einer gemeinsamen Produktion von Waffen“,"Israel und Deutschland haben eine neue Phase ihrer Zusammenarbeit eingeläutet. Im Interview erklärt Außenminister Saar die Hintergründe. Er stellt auch klar, welche Ziele sein Land im Iran verfolgt und was Europa in diesem Krieg nicht versteht.",https://images.welt.de/69f998866fe2dee7bfb131c7/9cc0b5556b9cd2ac3b0f5b12e9d1c6d6-master/ci16x9-w1200/dscf3670-jpeg,2026-05-07T09:37:57Z,,"Israel und Deutschland haben eine neue Phase ihrer Zusammenarbeit eingeläutet. Im Interview erklärt Außenminister Saar die Hintergründe. Er stellt auch klar, welche Ziele sein Land im Iran verfolgt u… [+9575 chars]",,de,'Iran'
https://www.zeit.de/news/2026-05/07/eu-erlaubt-milliarden-hilfe-fuer-klimaschutz-in-industrie,https://www.zeit.de/news/2026-05/07/eu-erlaubt-milliarden-hilfe-fuer-klimaschutz-in-industrie,0,www.zeit.de,Industrie: EU erlaubt Milliarden-Hilfe für Klimaschutz in Industrie,Hier finden Sie Informationen zu dem Thema „Industrie“. Lesen Sie jetzt „EU erlaubt Milliarden-Hilfe für Klimaschutz in Industrie“.,https://img.zeit.de/news/2026-05/07/eu-erlaubt-milliarden-hilfe-fuer-klimaschutz-in-industrie-image-group/wide__1300x731,2026-05-07T10:09:42Z,,Deutschland darf seine Industrie beim Umstieg auf klimafreundlichere Produktionsweisen mit fünf Milliarden Euro unterstützen. Die Europäische Kommission hat für entsprechende Pläne der Bundesregierun… [+1461 chars],,de,'Klima'
https://www.bild.de/regional/koeln/prozess-in-koeln-3-legionellen-tote-an-klinik-hausmeister-vor-gericht-69fb000fcd4a28c47001da7e,https://www.bild.de/regional/koeln/prozess-in-koeln-3-legionellen-tote-an-klinik-hausmeister-vor-gericht-69fb000fcd4a28c47001da7e,0,www.bild.de,Prozess in Köln - Legionellen-Tote an Klinik! Hausmeister vor Gericht,Hausmeister steht wegen tödlicher Legionellen in Kölner Klinik vor Gericht. War er für die Untersuchung des Wassers in der Klimaanlage verantwortlich?,"https://images.bild.de/69fb000fcd4a28c47001da7e/0eda94fdd5033267612de291f6fc7a18,ba573a22?w=1280",2026-05-07T12:44:04Z,,"TTS-Player überspringenArtikel weiterlesenKöln Drei Krebspatienten (55, 61, 81) erleiden in der Uni-Klinik Köln eine Lungenentzündung. Sie sterben. Eine Untersuchung ergibt: Der Grund für die Infekti… [+1918 chars]",,de,'Klima'
https://www.zeit.de/news/2026-05/07/usa-und-iran-beschiessen-sich-in-strasse-von-hormus,https://www.zeit.de/news/2026-05/07/usa-und-iran-beschiessen-sich-in-strasse-von-hormus,0,www.zeit.de,Krieg: USA und Iran beschießen sich in Straße von Hormus,Hier finden Sie Informationen zu dem Thema „Krieg“. Lesen Sie jetzt „USA und Iran beschießen sich in Straße von Hormus“.,https://img.zeit.de/administratives/sharing/fallback-image-die-zeit/wide__1300x731,2026-05-07T21:55:56Z,,Trotz Waffenruhe haben sich die USA und der Iran gegenseitig in der Straße von Hormus beschossen. «US-Streitkräfte wehrten unprovozierte iranische Angriffe ab und reagierten mit Schlägen zur Selbstve… [+298 chars],,de,'Iran'
https://www.nzz.ch/pro/blackout-simulation-mit-herbert-saurugg-liefert-lehren-fuer-die-krise-ld.10003775,https://www.nzz.ch/pro/blackout-simulation-mit-herbert-saurugg-liefert-lehren-fuer-die-krise-ld.10003775,0,www.nzz.ch,«NZZ Pro» hat ein Blackout simuliert und das Chaos entdeckt. Fünf Lehren für die Krise,Herbert Saurugg gehört zu den bekanntesten Blackout-Experten im deutschsprachigen Raum. Mit einem Brettspiel macht er auf die Gefahren des Stromausfalls aufmerksam. «NZZ Pro» hat es gespielt.,"https://img-msp-prod.nzz.ch/2026/04/22/2d0c2d93-fdd2-4c78-bd9f-9cc3a2b2c983.jpg?width=1200&height=675&fit=bounds&quality=75&auto=webp&crop=4983,2803,x0,y58&wmark=nzz",2026-05-08T03:30:00Z,,"Es stinkt nach Fäkalien in Schwarzbach, die Menschen frieren, und nun werden auch noch die Vorräte knapp. In der Nacht auf Freitag strömen die Bürger zum Rathaus, sie sind wütend, die ersten rütteln … [+13821 chars]",,de,'Frieren'
https://www.golem.de/sonstiges/zustimmung/auswahl.html?from=https://www.golem.de/news/zed-1-0-bereit-fuer-den-angriff-auf-vs-code-2605-208447.html&referer=https://t.co/5066c23d44,https://www.golem.de/sonstiges/zustimmung/auswahl.html?from=https://www.golem.de/news/zed-1-0-bereit-fuer-den-angriff-auf-vs-code-2605-208447.html&referer=https://t.co/5066c23d44,0,www.golem.de,(g+) Zed 1.0: Bereit für den Angriff auf VS Code,"Viele Editoren versprechen Produktivität. Zed setzt an einer anderen Stelle an: beim Gefühl, wie schnell und selbstverständlich sich Arbeit am Code anfühlen kann. Ein Hands-on von Fabian Deitelhoff (Softwareentwicklung, KI)",,2026-05-08T11:30:02Z,,"Besuchen Sie Golem.de wie gewohnt mit Werbung und Tracking,
 indem Sie der Nutzung aller Cookies zustimmen.
 Details zum Tracking finden Sie im Privacy Center.
Skript wurde nicht geladen. Informat… [+607 chars]",,de,'Angriff'
https://www.zeit.de/news/2026-05/08/neue-angriffe-in-strasse-von-hormus-waffenruhe-wankt,https://www.zeit.de/news/2026-05/08/neue-angriffe-in-strasse-von-hormus-waffenruhe-wankt,0,www.zeit.de,Iran-Krieg: Neue Angriffe in Straße von Hormus – Waffenruhe wankt,Hier finden Sie Informationen zu dem Thema „Iran-Krieg“. Lesen Sie jetzt „Neue Angriffe in Straße von Hormus – Waffenruhe wankt“.,https://img.zeit.de/news/2026-05/08/neue-angriffe-in-strasse-von-hormus-waffenruhe-wankt-image-group/wide__1300x731,2026-05-08T13:22:21Z,,"Der Iran und die USA haben sich trotz einer Waffenruhe gegenseitig angegriffen. Der Iran attackierte US-Militärschiffe in der Meerenge mit Raketen und Schnellbooten, die USA griffen Ziele auf dem ira… [+5186 chars]",,de,'Hormus'
