index,url,valid,domain,title,description,image,published,archive,content,quote,language,keyword
https://www.zeit.de/video/2024-09/6361608637112/praesident-der-ukraine-selenskyj-fordert-langstreckenraketen-bei-konferenz-in-deutschland,https://www.zeit.de/video/2024-09/6361608637112/praesident-der-ukraine-selenskyj-fordert-langstreckenraketen-bei-konferenz-in-deutschland,0,www.zeit.de,Präsident der Ukraine: Selenskyj fordert Langstreckenraketen bei Konferenz in Deutschland,Beim Treffen auf dem US-Stützpunkt Ramstein hat Selenskyj erneut um Langstreckenraketen gebeten. Damit könnte das ukrainische Militär Ziele in Russland angreifen.,https://img.zeit.de/video/2024-09/6361608637112-still/wide__1300x731,2024-09-06T12:47:13Z,,"Schließen
Hier können Sie interessante Artikel speichern, um sie später zu lesen und wiederzufinden.
Sie haben bereits ein Konto?
 Hier anmelden.",,de,'Russland'
https://www.faz.net/aktuell/finanzen/russland-blockiert-verkauf-von-landesgesellschaft-der-raiffeisenbank-19968115.html,https://www.faz.net/aktuell/finanzen/russland-blockiert-verkauf-von-landesgesellschaft-der-raiffeisenbank-19968115.html,0,www.faz.net,Russland verfolgt westliche Unternehmen weiter,Ein Gerichtsurteil gegen Österreichs zweitgrößtes Geldhaus erinnert an das Vorgehen gegen den VW-Konzern. Es erschwert den Ausstieg aus dem Land und die Einhaltung von Sanktionen.,https://media0.faz.net/ppmedia/aktuell/89395815/1.9968114/facebook_teaser/das-raiffeisen-logo-foto-apa.jpg,2024-09-06T12:59:08Z,,"Demnach wurde es der Bank per einstweiliger Verfügung verboten, ihre russische Tochtergesellschaft an potentielle Käufer zu veräußern. Wie RBI am Donnerstagabend mitteilte, hält das Management am Vor… [+4232 chars]",,de,'Russland'
https://www.zeit.de/news/2024-09/06/mutmasslicher-islamist-will-polizisten-toeten,https://www.zeit.de/news/2024-09/06/mutmasslicher-islamist-will-polizisten-toeten,0,www.zeit.de,Terrorverdacht: Mutmaßlicher Islamist will Polizisten töten,Hier finden Sie Informationen zu dem Thema „Angriff auf Polizeiwache“. Lesen Sie jetzt „Mutmaßlicher Islamist wollte Polizisten töten“.,https://img.zeit.de/news/2024-09/06/mutmasslicher-islamist-will-polizisten-toeten-image-group/wide__1300x731,2024-09-06T13:04:22Z,,Ein mutmaßlicher Islamist hat in Linz am Rhein im Norden von Rheinland-Pfalz eine Polizeiwache angegriffen. Der mit einer Machete und einem Messer bewaffnete 29-Jährige wurde in einer Sicherheitsschl… [+3967 chars],,de,'Angriff'
https://www.welt.de/politik/ausland/video253393090/12-Panzerhaubitzen-fuer-Ukraine-Die-Botschaft-Wir-sind-in-einer-ausserordentlich-entscheidenden-Lage.html,https://www.welt.de/politik/ausland/video253393090/12-Panzerhaubitzen-fuer-Ukraine-Die-Botschaft-Wir-sind-in-einer-ausserordentlich-entscheidenden-Lage.html,0,www.welt.de,„Die Botschaft: Wir sind in einer außerordentlich entscheidenden Lage“,"Verteidigungsminister Boris Pistorius sagte am Freitag in Ramstein, dass Deutschland der Ukraine zwölf weitere Haubitzen vom Typ 2000 zur Verfügung stellt. „Selenskyj wird sich damit begnügen müssen“, sagt Generalleutnant a.D. Roland Kather bei WELT TV.",https://img.welt.de/img/incoming/mobile253393174/6897930157-ci16x9-w1200/Ukraine-Krieg.jpg,2024-09-06T13:09:41Z,,"Verteidigungsminister Boris Pistorius sagte am Freitag in Ramstein, dass Deutschland der Ukraine zwölf weitere Haubitzen vom Typ 2000 zur Verfügung stellt. Selenskyj wird sich damit begnügen müssen, … [+97 chars]",,de,'Ukraine'
https://www.n-tv.de/politik/Deutschland-liefert-der-Ukraine-zwoelf-weitere-Panzerhaubitzen-2000-das-kann-die-Artilleriewaffe-article25210042.html,https://www.n-tv.de/politik/Deutschland-liefert-der-Ukraine-zwoelf-weitere-Panzerhaubitzen-2000-das-kann-die-Artilleriewaffe-article25210042.html,0,www.n-tv.de,Artilleriewaffe für die Ukraine: Das kann die Panzerhaubitze 2000,"Die Panzerhaubitze 2000 ist eines der modernsten Waffensysteme, die in der Bundeswehr im Einsatz sind. Bislang hat Deutschland der Ukraine 18 Exemplare zur Verfügung gestellt. Nun sollen zwölf weitere folgen.",https://bilder2.n-tv.de/img/incoming/crop25210065/4081326672-cImg_16_9-w1200/470035381.jpg,2024-09-06T13:14:38Z,,"Die Panzerhaubitze 2000 ist eines der modernsten Waffensysteme, die in der Bundeswehr im Einsatz sind. Bislang hat Deutschland der Ukraine 18 Exemplare zur Verfügung gestellt. Nun sollen zwölf weiter… [+4510 chars]",,de,'Ukraine'
https://www.sueddeutsche.de/wirtschaft/inflation-ezb-fed-trump-lux.XcadqnJjx3hNHQGjh3aqLb,https://www.sueddeutsche.de/wirtschaft/inflation-ezb-fed-trump-lux.XcadqnJjx3hNHQGjh3aqLb,0,www.sueddeutsche.de,Geldpolitik: Die Zentralbanken haben viel Kredit verspielt,"Die EZB hat zu spät etwas gegen die Inflation unternommen. Kein Wunder, dass sich die Politik immer stärker einmischt. Das macht es aber nicht besser – im Gegenteil.",https://www.sueddeutsche.de/2024/09/06/9f26e479-a851-4108-b9e4-30733bfed724.jpeg?q=60&fm=webp&width=1200&rect=143%2C83%2C1958%2C1101,2024-09-06T13:22:01Z,,"Inzwischen ist der Preisdruck spürbar zurückgegangen. Die Inflation in Deutschland betrug im August 1,9 Prozent, in der Euro-Zone 2,2 Prozent. In der nächsten Woche hat die Notenbank Spielraum, um de… [+9435 chars]",,de,'Ukraine'
https://www.dw.com/de/deutschland-sagt-der-ukraine-weitere-panzerhaubitzen-zu/a-70154766,https://www.dw.com/de/deutschland-sagt-der-ukraine-weitere-panzerhaubitzen-zu/a-70154766,0,www.dw.com,Deutschland sagt der Ukraine weitere Panzerhaubitzen zu,"Die Bundesregierung kommt der Bitte des ukrainischen Präsidenten nach neuen Waffenlieferungen nach. Wolodymyr Selenskyj reiste eigens nach Deutschland, um den Ernst der Lage im Ukraine-Krieg deutlich zu machen.",https://static.dw.com/image/70154090_6.jpg,2024-09-06T13:25:00Z,,Deutschland wird der Ukraine für deren Abwehrkampf gegen russische Invasoren zwölf zusätzliche Panzerhaubitzen im Wert von 150 Millionen Euro zur Verfügung stellen. Sechs der modernen Artilleriegesch… [+3655 chars],,de,'Ukraine'
https://taz.de/Schweden-preppt-fuer-den-Ernstfall/!6031305/,https://taz.de/Schweden-preppt-fuer-den-Ernstfall/!6031305/,0,taz.de,"Schweden preppt für den Ernstfall: Stell dir vor, es ist Krieg","In Schweden soll die Bevölkerung in Kursen lernen, wie man sich auf Krisen und Kriege vorbereitet. Unsere Autorin war dabei. Und baut jetzt Gemüse an.",https://taz.de/picture/7224504/948/36352228-1.jpeg,2024-09-06T13:33:00Z,,"Yvonne erzählt von ihrem Sommerhaus. Sie scheint mir schon ganz gut gewappnet zu sein für diesen potenziellen Krieg, von dem in Schweden gerade so viel die Rede ist: Solarzellen, Wasser aus dem Brunn… [+19527 chars]",,de,'heizen'
https://www.n-tv.de/panorama/Fluechtige-RAF-Terroristen-LKA-findet-Videos-von-Garweg-article25209976.html,https://www.n-tv.de/panorama/Fluechtige-RAF-Terroristen-LKA-findet-Videos-von-Garweg-article25209976.html,0,www.n-tv.de,Auch seine Stimme zu hören: LKA fahndet bald mit neuem Video nach RAF-Terrorist Garweg,Nach jahrzehntelanger Flucht kann die Polizei im Februar die ehemalige RAF-Terroristin Klette in Berlin verhaften. Von ihren Komplizen Garweg und Staub fehlt weiterhin aber jede Spur. Mit zwei Videos will die Polizei eine neue Öffentlichkeitsfahndung starten.,https://bilder4.n-tv.de/img/incoming/crop25157191/7491328318-cImg_16_9-w1200/451458541.jpg,2024-09-06T13:46:44Z,,Nach jahrzehntelanger Flucht kann die Polizei im Februar die ehemalige RAF-Terroristin Klette in Berlin verhaften. Von ihren Komplizen Garweg und Staub fehlt weiterhin aber jede Spur. Mit zwei Videos… [+2200 chars],,de,'Flucht'
https://taz.de/Raketen-mit-hoher-Reichweite/!6035071/,https://taz.de/Raketen-mit-hoher-Reichweite/!6035071/,0,taz.de,Raketen mit hoher Reichweite: Selenskyj will Go von Verbündeten,"Der Winter naht, die Energieversorgung in der Ukraine steht unter Beschuss. Präsident Selenskyj drängt auf mehr Unterstützung bei den Verbündeten.",https://taz.de/picture/7228647/948/36383145-1.jpeg,2024-09-06T13:51:00Z,,"Der Winter naht, die Energieversorgung in der Ukraine steht unter Beschuss. Präsident Selenskyj drängt auf mehr Unterstützung bei den Verbündeten.
Auf Werbetour bei den Verbündeten: Der ukrainische … [+6627 chars]",,de,'Ukraine'
https://orf.at/stories/3368758/,https://orf.at/stories/3368758/,0,orf.at,EU stockt humanitäre Hilfe für Ukraine auf,,https://orf.at/mojo/1_4_1/storyserver//news/common/images/og-fallback-news.png,2024-09-06T14:01:33Z,,Die EU stockt nach den jüngsten russischen Angriffen auf die Energieinfrastruktur der Ukraine ihre humanitäre Hilfe auf. Vor dem kommenden Winter sollen zusätzliche 35 Millionen Euro bereitgestellt w… [+885 chars],,de,'Ukraine'
https://www.welt.de/politik/ausland/video253396072/Ukraine-Unterstuetzung-Das-Thema-Taurus-haengt-noch-in-der-Luft-das-waere-die-adaequate-Waffe.html,https://www.welt.de/politik/ausland/video253396072/Ukraine-Unterstuetzung-Das-Thema-Taurus-haengt-noch-in-der-Luft-das-waere-die-adaequate-Waffe.html,0,www.welt.de,„Das Thema Taurus hängt noch in der Luft – das wäre die adäquate Waffe“,"Die Bundesregierung hat der Ukraine im Krieg gegen Russland die Lieferung zusätzlicher Panzerhaubitzen zugesagt. Man solle der Ukraine die Mittel geben, um bestimmte militärische Ziele in Russland anzugreifen, sagt FDP-Politikerin Marie-Agnes Strack-Zimmerman…",https://img.welt.de/img/politik/ausland/mobile253398500/8297931777-ci16x9-w1200/Strack-Zimmermann-jpeg.jpg,2024-09-06T14:13:48Z,,"Die Bundesregierung hat der Ukraine im Krieg gegen Russland die Lieferung zusätzlicher Panzerhaubitzen zugesagt. Man solle der Ukraine die Mittel geben, um bestimmte militärische Ziele in Russland an… [+107 chars]",,de,'Russland'
https://www.dw.com/de/liefert-iran-ballistische-raketen-an-russland/a-70155479,https://www.dw.com/de/liefert-iran-ballistische-raketen-an-russland/a-70155479,0,www.dw.com,Liefert Iran ballistische Raketen an Russland?,"Seit der russischen Invasion in die Ukraine baut Moskau seine militärische Zusammenarbeit dem Iran aus. Irans neuer Präsident kann die Waffenlieferungen kaum stoppen. Am 2. September berichtete die Finanznachrichtenagentur Bloomberg, der Iran werde in Kürze b…",https://static.dw.com/image/67592162_6.jpg,2024-09-06T14:20:00Z,,"Am 2. September berichtete die Finanznachrichtenagentur Bloomberg, der Iran werde in Kürze ballistische Raketen an Russland liefern. Unter Berufung auf nicht namentlich genannte europäische Beamte sc… [+6636 chars]",,de,'Ukraine'
https://www.faz.net/aktuell/feuilleton/buecher/das-internationale-literaturfestival-berlin-ilb-eroeffnet-19968577.html,https://www.faz.net/aktuell/feuilleton/buecher/das-internationale-literaturfestival-berlin-ilb-eroeffnet-19968577.html,0,www.faz.net,Berliner Literaturfestival: International wörtlich genommen,"Ein Gastkurator, unbekannte Namen und die Überzeugung, dass Geschichten einem auch mal etwas zumuten müssen: Das Internationale Literaturfestival Berlin eröffnet und wagt eine Neujustierung",https://media0.faz.net/ppmedia/aktuell/3571927236/1.9968734/facebook_teaser/das-ilb-traegt-ihrer-beider.jpg,2024-09-06T14:31:53Z,,"Die Kriterien für die Auszeichnung sind vage, wie der Blick auf die Internetseite des Reisemagazins zeigt. Man war beeindruckt, dass Salman Rushdie im Mai im Rahmen des Internationalen Li­teraturfest… [+4430 chars]",,de,'Gas'
https://www.stern.de/news/scholz-bekraeftigt-beistand-fuer-ukraine-und-lobt--gutes-treffen--mit-selenskyj-35044208.html,https://www.stern.de/news/scholz-bekraeftigt-beistand-fuer-ukraine-und-lobt--gutes-treffen--mit-selenskyj-35044208.html,0,www.stern.de,"Scholz bekräftigt Beistand für Ukraine und lobt ""gutes Treffen"" mit Selenskyj","Nach seinem Treffen mit dem ukrainischen Präsidenten Wolodymyr Selenskyj hat Bundeskanzler Olaf Scholz (SPD) den Beistand der Bundesrepublik für die Ukraine bekräftigt. ""Deutschland ist und bleibt der stärkste Unterstützer der Ukraine in Europa. So lange wie …",https://image.stern.de/35044210/t/-l/v1/w1440/r1.7778/-/06--scholz-r-und-selenskyj-in-frankfurtmain---7432483be3c514ed.jpg,2024-09-06T14:38:37Z,,"Nach seinem Treffen mit dem ukrainischen Präsidenten Wolodymyr Selenskyj hat Bundeskanzler Olaf Scholz (SPD) den Beistand der Bundesrepublik für die Ukraine bekräftigt. ""Deutschland ist und bleibt de… [+637 chars]",,de,'Ukraine'
https://www.faz.net/aktuell/politik/ukraine/ukraine-liveticker-scholz-sichert-selenskyj-unterstuetzung-zu-faz-19030454.html,https://www.faz.net/aktuell/politik/ukraine/ukraine-liveticker-scholz-sichert-selenskyj-unterstuetzung-zu-faz-19030454.html,0,www.faz.net,Ukraine-Liveblog: Scholz sichert Selenskyj Unterstützung zu: „So lange wie nötig“,"Ukraine meldet Rückeroberung in Donezk +++ Lage in Ostukraine sei stabilisiert, aber weiter angespannt +++ Selenskyj gibt mit Pistorius und Austin Pressekonferenz in Ramstein +++ alle Entwicklungen im Liveblog",https://media0.faz.net/ppmedia/aktuell/politik/1496944269/1.9968936/facebook_teaser/wolodymyr-selenskyj-und-olaf.jpg,2024-09-06T14:41:51Z,,Zu Gesprächen über die weitere Unterstützung der Ukraine im russischen Angriffskrieg treffen sich am Freitagvormittag zahlreiche Verteidigungsminister und ranghohe Militärs auf dem US-Luftwaffenstütz… [+685 chars],,de,'Ukraine'
https://www.welt.de/politik/ausland/video253396914/Ex-Ukraine-Praesident-Poroschenko-Eure-Waffen-bringen-uns-dem-Frieden-naeher.html,https://www.welt.de/politik/ausland/video253396914/Ex-Ukraine-Praesident-Poroschenko-Eure-Waffen-bringen-uns-dem-Frieden-naeher.html,0,www.welt.de,„Eure Waffen bringen uns dem Frieden näher“,"Deutschland unterstützt die Ukraine mit zwölf weiteren Panzerhaubitzen im Wert von 150 Millionen Euro in ihrem Abwehrkampf gegen die russischen Invasoren. „Es geht nicht nur um Unterstützung. Es ist eine Investition“, sagt Ex-Ukraine Präsident Petro Poroschen…",https://img.welt.de/img/incoming/mobile253397520/5917930797-ci16x9-w1200/ONL-poroschenko-jpg.jpg,2024-09-06T14:51:46Z,,Deutschland unterstützt die Ukraine mit zwölf weiteren Panzerhaubitzen im Wert von 150 Millionen Euro in ihrem Abwehrkampf gegen die russischen Invasoren. Es geht nicht nur um Unterstützung. Es ist e… [+118 chars],,de,'Waffen'
https://www.sueddeutsche.de/politik/ukraine-russland-krieg-luftabwehr-putin-selenskyj-lux.UiEPtnrjyhg8RA1EpL7qJ7,https://www.sueddeutsche.de/politik/ukraine-russland-krieg-luftabwehr-putin-selenskyj-lux.UiEPtnrjyhg8RA1EpL7qJ7,0,www.sueddeutsche.de,Waffen für die Ukraine: Kampf gegen die Zeit,"Verteidigungsminister Pistorius sagt Wolodimir Selenskij bei einem Treffen in Ramstein zwölf weitere Panzerhaubitzen zu. Doch der ukrainische Präsident fordert auch andere Waffen, um der russischen Invasion widerstehen zu können.",https://www.sueddeutsche.de/2024/09/06/8e32cbad-a7eb-47e1-b080-22b63ab02b17.jpeg?q=60&fm=webp&width=1200&rect=0%2C0%2C3500%2C1969,2024-09-06T15:17:46Z,,"Vergangene Woche wurden Dutzende Menschen bei Angriffen im Land verletzt, mehr als 40 starben nach Medienangaben allein bei einem Raketenangriff auf die nur rund 160 Kilometer von Russland entfernte … [+2861 chars]",,de,'Ukraine'
https://www.zeit.de/politik/ausland/2024-09/ukraine-lage-poltawa-lwiw-selenskyj-ramstein-woche,https://www.zeit.de/politik/ausland/2024-09/ukraine-lage-poltawa-lwiw-selenskyj-ramstein-woche,0,www.zeit.de,Lage in der Ukraine: Selenskyjs Mission in Ramstein,Der ukrainische Präsident dringt zunehmend verzweifelt auf Unterstützung für seine Pläne. Unterdessen trauert die Ukraine um die Opfer von Poltawa. Der Wochenrückblick,https://img.zeit.de/politik/deutschland/2024-09/selenskyj-bei-treffen-der-ukraine-kontaktgruppe-in-ramstein/wide__1300x731,2024-09-06T15:33:03Z,,"Es war einer der schlimmsten Angriffe in der Ukraine seit Beginn des Krieges: Mindestens 55
Menschen wurden am Dienstagmorgen in Poltawa bei einem russischen Raketenangriff
getötet, mehr als 300 ve… [+15234 chars]",,de,'Ukraine'
https://www.golem.de/sonstiges/zustimmung/auswahl.html?from=https://www.golem.de/news/militaertechnik-ukraine-zeigt-sich-erfindungsreich-2409-188771.html&referer=https://t.co/5e209f5880,https://www.golem.de/sonstiges/zustimmung/auswahl.html?from=https://www.golem.de/news/militaertechnik-ukraine-zeigt-sich-erfindungsreich-2409-188771.html&referer=https://t.co/5e209f5880,0,www.golem.de,Militärtechnik: Ukraine zeigt sich erfindungsreich,"Eine Drohne, die Thermit auf feindliche Stellungen regnen lässt, ist nicht die einzige militärische Innovation der Ukraine. (Militär, Politik)",,2024-09-06T16:38:02Z,,"Besuchen Sie Golem.de wie gewohnt mit Werbung und Tracking,
 indem Sie der Nutzung aller Cookies zustimmen.
 Details zum Tracking finden Sie im Privacy Center.
Skript wurde nicht geladen. Informat… [+607 chars]",,de,'Ukraine'
https://www.zeit.de/news/2024-09/07/neue-waffen-und-humanitaere-hilfe-fuer-die-ukraine,https://www.zeit.de/news/2024-09/07/neue-waffen-und-humanitaere-hilfe-fuer-die-ukraine,0,www.zeit.de,Lage im Überblick: Neue Waffen und humanitäre Hilfe für die Ukraine,Hier finden Sie Informationen zu dem Thema „Lage im Überblick“. Lesen Sie jetzt „Neue Waffen und humanitäre Hilfe für die Ukraine“.,https://img.zeit.de/news/2024-09/07/neue-waffen-und-humanitaere-hilfe-fuer-die-ukraine-image-group/wide__1300x731,2024-09-07T02:53:36Z,,Die Ukraine hat beim Treffen der internationalen Verbündeten auf dem US-Luftwaffenstützpunkt im rheinland-pfälzischen Ramstein Zusagen für weitere militärische Unterstützung erhalten. Die offiziell v… [+5039 chars],,de,'Ukraine'
https://www.tagesschau.de/newsticker/liveblog-ukraine-sonnabend-106.html,https://www.tagesschau.de/newsticker/liveblog-ukraine-sonnabend-106.html,0,www.tagesschau.de,Ukraine-Liveblog: ++ Ukraine meldet massiven russischen Drohnenangriff ++,Die Ukraine meldet einen massiven russischen Drohnenangriff in elf Regionen. Der britische Premier Starmer trifft sich kommende Woche mit US-Präsident Biden. Die Entwicklungen im Liveblog,https://images.tagesschau.de/image/5b073b67-29bf-4703-b6b1-71469e4c25bb/AAABjz78AfM/AAABkZLhkrw/16x9-1280/flagge-ukraine-truemmer-101.jpg,2024-09-07T07:04:28Z,,"Stand: 07.09.2024 09:04 Uhr
Die Ukraine meldet einen massiven russischen Drohnenangriff in elf Regionen. Der britische Premier Starmer trifft sich kommende Woche mit US-Präsident Biden. Die Entwickl… [+2110 chars]",,de,'Ukraine'
https://www.focus.de/kultur/kino_tv/kolumne-zu-klitschko-sein-haertester-kampf-tv-doku-zeigt-den-mega-kaempfer-klitschko-und-offenbart-seinen-feind-im-eigenen-lager_id_260289170.html,https://www.focus.de/kultur/kino_tv/kolumne-zu-klitschko-sein-haertester-kampf-tv-doku-zeigt-den-mega-kaempfer-klitschko-und-offenbart-seinen-feind-im-eigenen-lager_id_260289170.html,0,www.focus.de,Kolumne zu „Klitschko – Sein härtester Kampf“ - TV-Doku zeigt den Mega-Kämpfer Klitschko und offenbart seinen Feind im eigenen Lager,"Was geschieht, wenn ein Oscar-Preisträger einen Box-Weltmeister in seinen politischen Schlagabtausch begleitet? Die Sky-Dokumentation „Klitschko – Sein härtester Kampf“ gibt die Antwort. Warnhinweis: Dieser Film könnte Sie emotional berühren und Ihnen eine ne…",https://p6.focus.de/img/fotos/id_260290759/l-klitschko-haerteste-kampf-so.jpg?im=Crop%3D%280%2C60%2C1920%2C960%29%3BResize%3D%281200%2C627%29&impolicy=perceptual&quality=mediumHigh&hash=4bdb00ee515197339903129b3e37067414df719a58809da457d46c5acb47de23,2024-09-07T07:32:30Z,,"Was geschieht, wenn ein Oscar-Preisträger einen Box-Weltmeister in seinen politischen Schlagabtausch begleitet? Die Sky-Dokumentation Klitschko Sein härtester Kampf gibt die Antwort. Warnhinweis: Die… [+5493 chars]",,de,'Flucht'
https://www.bild.de/regional/baden-wuerttemberg/karlsruhe-mann-im-hauptbahnhof-niedergestochen-66dc00c37ec3b15c6e1f481e,https://www.bild.de/regional/baden-wuerttemberg/karlsruhe-mann-im-hauptbahnhof-niedergestochen-66dc00c37ec3b15c6e1f481e,0,www.bild.de,Karlsruhe - Mann im Hauptbahnhof niedergestochen,"Wieder eine brutale Attacke an einem Hauptbahnhof! Opfer ist ein 32-Jähriger, der Täter ist auf der Flucht.","https://images.bild.de/66dc00c37ec3b15c6e1f481e/b655735b98185cc9b792ed97be68c33d,4ee50eb9?w=1280",2024-09-07T07:50:00Z,,"Karlsruhe Wieder eine brutale Attacke an einem Hauptbahnhof!
Diesmal ereignete sich der Vorfall in Karlsruhe (Baden-Württemberg). Ein 32-Jähriger wurde von einem Mann mit einem Messer verfolgt und s… [+923 chars]",,de,'Flucht'
https://www.focus.de/panorama/welt/grosseinsatz-der-polizei-mann-am-hauptbahnhof-karlsruhe-mit-messer-schwer-verletzt-taeter-auf-der-flucht_id_260291689.html,https://www.focus.de/panorama/welt/grosseinsatz-der-polizei-mann-am-hauptbahnhof-karlsruhe-mit-messer-schwer-verletzt-taeter-auf-der-flucht_id_260291689.html,0,www.focus.de,Großeinsatz der Polizei - Mann am Hauptbahnhof Karlsruhe mit Messer schwer verletzt - Täter auf der Flucht,Mitten im Bahnhof verfolgt ein Mann einen anderen Mann mit einem Messer. Er sticht zu und flüchtet. Ein Großeinsatz für die Bundespolizei.,https://p6.focus.de/img/regional/nordrhein-westfalen/id_260129464/ein-mann-soll-mehrere-bundespolizisten-unter-anderem-am-hauptbahnhof-karlsruhe-angegriffen-haben.-symbolfoto-.jpg?im=Crop%3D%280%2C191%2C2048%2C1024%29%3BResize%3D%281200%2C627%29&impolicy=perceptual&quality=mediumHigh&hash=3ad8ea42e6af20a1c7de621342b049dbb303661b043de8be27562e7f14168f06,2024-09-07T08:38:56Z,,Mitten im Bahnhof verfolgt ein Mann einen anderen Mann mit einem Messer. Er sticht zu und flüchtet. Ein Großeinsatz für die Bundespolizei.Ein 32-Jähriger ist am Karlsruher Hauptbahnhof von einem Mann… [+764 chars],,de,'Flucht'
https://www.welt.de/vermischtes/video253406104/Bundespolizei-im-Grosseinsatz-32-Jaehriger-am-Hauptbahnhof-Karlsruhe-mit-Messer-schwer-verletzt.html,https://www.welt.de/vermischtes/video253406104/Bundespolizei-im-Grosseinsatz-32-Jaehriger-am-Hauptbahnhof-Karlsruhe-mit-Messer-schwer-verletzt.html,0,www.welt.de,32-Jähriger am Hauptbahnhof Karlsruhe mit Messer schwer verletzt,Ein 32-Jähriger ist am Karlsruher Hauptbahnhof von einem Mann mit einem Messer verfolgt und schwer verletzt worden. Die Polizei geht von einem persönlichen Konflikt als Tatmotiv aus. Der Täter ist noch auf der Flucht.,https://img.welt.de/img/incoming/mobile253406102/5057939957-ci16x9-w1200/473969746-jpg.jpg,2024-09-07T09:00:00Z,,Ein 32-Jähriger ist am Karlsruher Hauptbahnhof von einem Mann mit einem Messer verfolgt und schwer verletzt worden. Die Polizei geht von einem persönlichen Konflikt als Tatmotiv aus. Der Täter ist no… [+63 chars],,de,'Flucht'
https://www.zeit.de/news/2024-09/07/nach-angriff-auf-polizeiwache-ermittlungen-dauern-an,https://www.zeit.de/news/2024-09/07/nach-angriff-auf-polizeiwache-ermittlungen-dauern-an,0,www.zeit.de,Extremismus: Nach Angriff auf Polizeiwache - Ermittlungen dauern an,Hier finden Sie Informationen zu dem Thema „Extremismus“. Lesen Sie jetzt „Nach Angriff auf Polizeiwache - Ermittlungen dauern an“.,https://img.zeit.de/news/2024-09/07/nach-angriff-auf-polizeiwache-ermittlungen-dauern-an-image-group/wide__1300x731,2024-09-07T09:38:33Z,,"Nach dem islamistisch motivierten Angriff auf eine Polizeiwache in Linz im Norden von Rheinland-Pfalz dauern die Ermittlungen an. Bisher habe der Beschuldigte keine Aussage gemacht, teilte Oberstaats… [+1994 chars]",,de,'Angriff'
https://www.stern.de/gesellschaft/regional/baden-wuerttemberg/hauptbahnhof-karlsruhe--mann-mit-messer-schwer-verletzt--taeter-weiter-auf-der-flucht-35045144.html,https://www.stern.de/gesellschaft/regional/baden-wuerttemberg/hauptbahnhof-karlsruhe--mann-mit-messer-schwer-verletzt--taeter-weiter-auf-der-flucht-35045144.html,0,www.stern.de,Hauptbahnhof Karlsruhe: Mann mit Messer schwer verletzt: Täter weiter auf der Flucht,Mitten im Hauptbahnhof von Karlsruhe wurde ein Mann mit einem Messer verletzt. Der Angreifer stach zu und entkam. Von ihm gibt es weiterhin keine Spur.,https://image.stern.de/35045366/t/-6/v1/w1440/r1.7778/-/07--3erbgojm5fv11axw800h600jpeg---21e17e9afc306d04.jpg,2024-09-07T09:51:18Z,,"Mitten im Hauptbahnhof von Karlsruhe wurde ein Mann mit einem Messer verletzt. Der Angreifer stach zu und entkam. Von ihm gibt es weiterhin keine Spur.
Nach der Messerattacke auf einen 32-Jährigen a… [+1037 chars]",,de,'Flucht'
https://www.welt.de/vermischtes/kriminalitaet/article253405902/Karlsruhe-Mann-am-Bahnhof-niedergestochen-Taeter-noch-auf-der-Flucht.html,https://www.welt.de/vermischtes/kriminalitaet/article253405902/Karlsruhe-Mann-am-Bahnhof-niedergestochen-Taeter-noch-auf-der-Flucht.html,0,www.welt.de,Mann am Bahnhof niedergestochen – Täter noch auf der Flucht,Am Freitagabend wurde am Hauptbahnhof in Karlsruhe ein Mann niedergestochen und schwer verletzt ins Krankenhaus gebracht. Die Polizei geht von einem persönlichen Konflikt aus. Der Täter ist noch auf der Flucht.,https://img.welt.de/img/vermischtes/kriminalitaet/mobile253406004/0697931237-ci16x9-w1200/INTERRAIL-PASS-RAIL-TRAVEL-BETWEEN-ANGERS-AND-ISTANBUL.jpg,2024-09-07T09:51:27Z,,"Im Hauptbahnhof Karlsruhe ist am Freitagabend ein Mann niedergestochen worden. Wie eine Polizeisprecherin am Samstag sagte, alarmierte ein Lokführer die Einsatzkräfte kurz vor 23.00 Uhr. Beamte der B… [+735 chars]",,de,'Flucht'
