index,url,valid,domain,title,description,image,published,archive,content,quote,language,keyword
https://www.dw.com/de/deutschland-mehr-denn-je-ziel-ausl%C3%A4ndischer-cyber-angriffe/a-72778930,https://www.dw.com/de/deutschland-mehr-denn-je-ziel-ausl%C3%A4ndischer-cyber-angriffe/a-72778930,0,www.dw.com,Deutschland mehr denn je Ziel ausländischer Cyber-Angriffe,Im BKA-Bundeslagebild Cybercrime zeigt der Trend in fast allen Bereichen nach oben – mit einer Ausnahme. Tatverdächtige werden oft in Russland vermutet.,https://static.dw.com/image/68648745_6.jpg,2025-06-03T15:44:00Z,https://web.archive.org/web/20250603214037/https://www.dw.com/de/deutschland-mehr-denn-je-ziel-ausl%25C3%25A4ndischer-cyber-angriffe/a-72778930,"""Deutschland wird nach unseren Erkenntnissen von Kriminellen im Ausland immer stärker ins Visier genommen"", sagt Innenminister Alexander Dobrindt beim Blick auf die Kriminalitätsentwicklung im digita… [+4472 chars]",,de,'Angriff'
https://www.tagesschau.de/ausland/ukraine-russland-krimbruecke-102.html,https://www.tagesschau.de/ausland/ukraine-russland-krimbruecke-102.html,0,www.tagesschau.de,Krieg gegen die Ukraine: Kiew meldet Anschlag auf Krim-Brücke,"<strong>Der ukrainische Geheimdienst SBU hat bestätigt, einen Anschlag auf die  für Russland strategisch wichtige Krim-Bücke verübt zu haben. </strong>Die <strong>Straßen- und Eisenbahnverbindung</strong> wurde seit Beginn des Krieges bereits zwei Mal angegri…",https://images.tagesschau.de/image/5b5f0f8f-3480-4ef4-bcaa-ee8d12e95443/AAABlzXl6NA/AAABkZLhkrw/16x9-1280/krim-sbu-100.jpg,2025-06-03T15:59:40Z,https://web.archive.org/web/20250603161134/https://www.tagesschau.de/ausland/ukraine-russland-krimbruecke-102.html,"Stand: 03.06.2025 17:59 Uhr
Der ukrainische Geheimdienst SBU hat bestätigt, einen Anschlag auf die für Russland strategisch wichtige Krim-Bücke verübt zu haben. Die Straßen- und Eisenbahnverbindung … [+2973 chars]",,de,'Russland'
https://www.morgenpost.de/politik/article409180489/ukraine-mit-neuem-geheimdienst-coup-diesmal-an-der-krimbruecke.html,https://www.morgenpost.de/politik/article409180489/ukraine-mit-neuem-geheimdienst-coup-diesmal-an-der-krimbruecke.html,0,www.morgenpost.de,Plötzlich detonieren 1100 Kilo Sprengstoff an der Krimbrücke,Die Ukraine setzt ihre wohl minutiös geplanten Angriffe fort. Diesmal war die Krim-Brücke ihr Ziel. Auch Unterwasserdrohnen waren wohl im Einsatz.,https://img.sparknews.funkemedien.de/409180710/409180710_1748967259_v16_9_1600.jpeg,2025-06-03T16:14:20Z,https://web.archive.org/web/20250603162443/https://www.morgenpost.de/politik/article409180489/ukraine-mit-neuem-geheimdienst-coup-diesmal-an-der-krimbruecke.html,"Wien. Die Ukraine setzt ihre wohl minutiös geplanten Angriffe fort. Diesmal war die Krim-Brücke ihr Ziel. Auch Unterwasserdrohnen waren wohl im Einsatz.
Russlands Luftwaffe ist um ein Drittel reduzi… [+4119 chars]",,de,'Angriff'
https://www.tagesspiegel.de/internationales/ukraine-invasion-tag-1196-was-putin-jetzt-an-den-verhandlungstisch-bringen-konnte-13798606.html,https://www.tagesspiegel.de/internationales/ukraine-invasion-tag-1196-was-putin-jetzt-an-den-verhandlungstisch-bringen-konnte-13798606.html,0,www.tagesspiegel.de,"Ukraine-Invasion, Tag 1196: Was Putin jetzt an den Verhandlungstisch bringen könnte","Ukraine attackiert russische Krim-Brücke, Verwirrung um Anzahl der zerstörten Flugzeuge in Russland, Trump zu Gespräch mit Putin und Selenskyj bereit. Der Überblick.",https://www.tagesspiegel.de/images/13796890/alternates/BASE_16_9_W1400/1748959788000/crimea-ukraine-russia-conflict.jpeg,2025-06-03T16:24:52Z,,"Die ukrainischen Angriffe auf Russlands strategische Luftwaffe und die Krimbrücke haben eine klare Botschaft übermittelt: Weiter Krieg zu führen, bringt ernsthafte Risiken für Wladimir Putin mit sich… [+6535 chars]",,de,'Russland'
https://www.stern.de/news/nawalny-witwe-startet-fernsehsender-gegen--zensur-in-russland--35779758.html,https://www.stern.de/news/nawalny-witwe-startet-fernsehsender-gegen--zensur-in-russland--35779758.html,0,www.stern.de,"Nawalny-Witwe startet Fernsehsender gegen ""Zensur in Russland""","Die Witwe des in russischer Haft gestorbenen russischen Oppositionellen Alexej Nawalny hat für Mittwoch den Start eines neuen Fernsehsenders für die Pressefreiheit angekündigt: Am 4. Juni, dem Geburtstag von Nawalny, wird der Sender mit dem Namen ""Zukunft Rus…",https://image.stern.de/35779760/t/vX/v1/w1440/r1.7778/-/03--julia-nawalnaja-in-paris---e49b166482c4694d.jpg,2025-06-03T16:25:18Z,https://web.archive.org/web/20250603165842/https://www.stern.de/news/nawalny-witwe-startet-fernsehsender-gegen--zensur-in-russland--35779758.html,"Kopiere den aktuellen Link
Zur Merkliste hinzufügen
Die Witwe des in russischer Haft gestorbenen russischen Oppositionellen Alexej Nawalny hat für Mittwoch den Start eines neuen Fernsehsenders für … [+1327 chars]",,de,'Russland'
https://www.bild.de/leben-wissen/mein-geld-finanzportal/hauskauf-nur-so-kommen-sie-zu-einem-fairen-immobilien-preis-683568f765affa2cddcdbdcf,https://www.bild.de/leben-wissen/mein-geld-finanzportal/hauskauf-nur-so-kommen-sie-zu-einem-fairen-immobilien-preis-683568f765affa2cddcdbdcf,0,www.bild.de,5 Experten-Tipps zum Hauskauf - Nur so kommen Sie sicher zum besten Immobilien-Preis,"Worauf Sie beim Hauskauf achten müssen, welche Faktoren bei der Wertermittlung zählen und wer helfen kann, damit der Preis fair ist – das lesen Sie bei BILD","https://images.bild.de/683568f765affa2cddcdbdcf/359c29b84ae1a36f2052ac05853f4c01,5f6a2553?w=1280",2025-06-03T16:43:19Z,https://web.archive.org/web/20250603165242/http://www.bild.de/leben-wissen/mein-geld-finanzportal/hauskauf-nur-so-kommen-sie-zu-einem-fairen-immobilien-preis-683568f765affa2cddcdbdcf,Der Traum von den eigenen vier Wänden endlich soll er wahr werden. Das Budget steht und sogar ein passendes Haus scheint gefunden. Die Besichtigung steht an. Doch Zweifel bleiben. Denn wer kann schon… [+429 chars],,de,'Preis'
https://www.zeit.de/politik/ausland/2025-06/nawalny-witwe-startet-fernsehsender-gegen-russische-zensur,https://www.zeit.de/politik/ausland/2025-06/nawalny-witwe-startet-fernsehsender-gegen-russische-zensur,0,www.zeit.de,Russland: Julia Nawalnaja startet neuen Fernsehsender für die Pressefreiheit,"Die Witwe des russischen Oppositionellen Alexej Nawalny startet einen neuen Fernsehsender. ""Zukunft Russlands"" soll Inhalte der russischen Opposition aus dem Exil zeigen.",https://img.zeit.de/politik/ausland/2025-06/russland-julia-nawalnaja-fernsehsender-gegen-zensur-bild/wide__1300x731,2025-06-03T16:57:04Z,https://web.archive.org/web/20250603171511/https://www.zeit.de/politik/ausland/2025-06/nawalny-witwe-startet-fernsehsender-gegen-russische-zensur,"Julia Nawalnaja hat den Start eines eigenen russischen TV-Senders angekündigt. Der Sender ""Russlands Zukunft"" solle die Pressefreiheit in ihrem Land stärken, teilte die Witwe des russischen Oppositio… [+501 chars]",,de,'Russland'
"https://www.gamestar.de/artikel/bester-grill-gas-kohle-weber-elektro-pellet-tipp-grillen-2025,3433551.html","https://www.gamestar.de/artikel/bester-grill-gas-kohle-weber-elektro-pellet-tipp-grillen-2025,3433551.html",0,www.gamestar.de,Deals: Gas- & Kohlegrills? - Altes Eisen! Diese neue Art von Grill ist 1000% Geschmack! [Anzeige],"Gasgrill, Kohlegrill, Weber-Grill - kann mir alles gestohlen bleiben. Ich habe eine neue Alternative zum klassischen Grill entdeckt, die ohne Strom, Gas oder Kohle auskommt. Wenn euch Aroma und Geschmack wichtig sind, dann werdet ihr das lieben.",https://images.cgames.de/images/gamestar/293/-bester-grill-gasgrill-pelletgrill-kohlegrill-weber-grill-alternative-angebot-black-friday-burnhard-flint-smoker-räuchern-ofen_6355876.jpg,2025-06-03T17:04:00Z,"https://web.archive.org/web/20250603172044/https://www.gamestar.de/artikel/bester-grill-gas-kohle-weber-elektro-pellet-tipp-grillen-2025,3433551.html","Der klassische Weber-Gasgrill kann für mich einpacken: Diese neue Art von Grill löst Gas und Kohle ab. 
Gasgrill? Habe ich schon. Kohlegrill? Ist bei mir vor Jahren rausgeflogen. Elektrogrill? Ist f… [+8338 chars]",,de,'Gas'
https://www.morgenpost.de/politik/article409180489/russland-ukraine-krim-bruecke-angriff.html,https://www.morgenpost.de/politik/article409180489/russland-ukraine-krim-bruecke-angriff.html,0,www.morgenpost.de,Plötzlich detonieren 1100 Kilo Sprengstoff an der Krim-Brücke,Die Ukraine setzt ihre wohl minutiös geplanten Angriffe fort. Diesmal war die Krim-Brücke ihr Ziel. Auch Unterwasserdrohnen waren wohl im Einsatz.,https://img.sparknews.funkemedien.de/409180710/409180710_1748967259_v16_9_1600.jpeg,2025-06-03T17:25:00Z,https://web.archive.org/web/20250603173422/https://www.morgenpost.de/politik/article409180489/russland-ukraine-krim-bruecke-angriff.html,"Wien. Die Ukraine setzt ihre wohl minutiös geplanten Angriffe fort. Diesmal war die Krim-Brücke ihr Ziel. Auch Unterwasserdrohnen waren wohl im Einsatz.
Russlands Luftwaffe ist um ein Drittel reduzi… [+4119 chars]",,de,'Angriff'
https://www.zeit.de/politik/ausland/2025-06/drohnenangriff-ukraine-russland-bomber-militaerflughaefen,https://www.zeit.de/politik/ausland/2025-06/drohnenangriff-ukraine-russland-bomber-militaerflughaefen,0,www.zeit.de,Drohnenangriff der Ukraine: Ein Fernfahrer rettet Russlands Bomber,Seit Tagen schweigt Wladimir Putin zum Angriff auf russische Flugplätze. Er muss seine Reaktion mit Bedacht wählen. Derweil arbeiten Staatsmedien an einem Heldenmythos.,https://img.zeit.de/politik/ausland/2025-06/drohnenangriff-ukraine-russland-bomber-militaerflughaefen-bild-2/wide__1300x731,2025-06-03T18:32:13Z,http://archive.md/20250603183419/https://www.zeit.de/politik/ausland/2025-06/drohnenangriff-ukraine-russland-bomber-militaerflughaefen,"Der ukrainische Drohnenangriff auf russische Flugplätze war
der bislang schwerste Schlag gegen Russlands Militär auf eigenem Boden seit dem
Zweiten Weltkrieg. Mindestens zwölf Langstreckenbomber vo… [+882 chars]",,de,'Wladimir Putin'
https://www.diepresse.com/19758330/nawalny-witwe-startet-fernsehsender-gegen-zensur-in-russland,https://www.diepresse.com/19758330/nawalny-witwe-startet-fernsehsender-gegen-zensur-in-russland,0,www.diepresse.com,Nawalny-Witwe startet Fernsehsender gegen „Zensur in Russland“,"Am 4. Juni, dem Geburtstag Nawalnys, wird der Sender mit dem Namen „Zukunft Russlands“ erstmals ausgestrahlt.",https://img.diepresse.com/public/incoming/k3o32-FILES-GERMANY-RUSSIA-POLITICS-OPPOSITION/alternates/DPR_SOCIAL_NACHRICHTEN/FILES-GERMANY-RUSSIA-POLITICS-OPPOSITION,2025-06-03T18:35:12Z,https://web.archive.org/web/20250604110606/https://www.diepresse.com/19758330/nawalny-witwe-startet-fernsehsender-gegen-zensur-in-russland,"Am 4. Juni, dem Geburtstag Nawalnys, wird der Sender mit dem Namen Zukunft Russlands erstmals ausgestrahlt. 
Die Witwe des in russischer Haft gestorbenen russischen Oppositionellen Alexej Nawalny ha… [+1417 chars]",,de,'Russland'
https://www.faz.net/aktuell/wirtschaft/spionage-sabotage-sanktionen-110511190.html,https://www.faz.net/aktuell/wirtschaft/spionage-sabotage-sanktionen-110511190.html,0,www.faz.net,"Russlands Schattenflotte: Spionage, Sabotage, Sanktionen","Russland umgeht mit der Schattenflotte den Ölpreisdeckel und steht im Verdacht, die Tanker gegen Seekabel einzusetzen. Kann das Seerecht Moskau stoppen? Welche Rolle spielen EU-Reeder?",https://media1.faz.net/ppmedia/aktuell/wirtschaft/4145284977/1.10511189/facebook_teaser/teil-der-russischen.jpg,2025-06-03T18:49:01Z,http://archive.md/20250603190116/https://www.faz.net/aktuell/wirtschaft/spionage-sabotage-sanktionen-110511190.html,"Es bleibt die große ungelöste Frage der Sanktionen gegen Russland: Wie kann die EU verhindern, dass Russland mit seiner inzwischen auf 500 bis 600 Tanker angewachsenen Schattenflotte das Ölembargo um… [+11151 chars]",,de,'Preis'
https://www.basicthinking.de/blog/2025/06/03/preis-reichweite-verhaeltnis-beste-e-autos-adac/,https://www.basicthinking.de/blog/2025/06/03/preis-reichweite-verhaeltnis-beste-e-autos-adac/,0,www.basicthinking.de,Preis-Reichweite-Verhältnis: Die besten E-Autos laut ADAC,"Der Beitrag Preis-Reichweite-Verhältnis: Die besten E-Autos laut ADAC erschien zuerst beim Online-Magazin BASIC thinking. Über unseren Newsletter UPDATE startest du jeden Morgen bestens informiert in den Tag.
Wie weit komme ich mit meinem E-Auto – und wie vie…",https://www.basicthinking.de/blog/wp-content/uploads/2025/06/aufmacher-platz-9-peugeot-e-3008-foto-peugeot.png,2025-06-03T19:00:32Z,,Wie weit komme ich mit meinem E-Auto und wie viel Geld muss ich dafür ausgeben? Diese Fragen stellen sich viele Interessierte vor einem Kauf. Wir stellen dir die zehn E-Autos mit dem besten Preis-Rei… [+1765 chars],,de,'Preis'
https://www.zeit.de/news/2025-06/03/selenskyj-stellt-militaerfuehrung-um-nach-russischem-schlag,https://www.zeit.de/news/2025-06/03/selenskyj-stellt-militaerfuehrung-um-nach-russischem-schlag,0,www.zeit.de,Krieg in der Ukraine: Selenskyj stellt Militärführung um nach russischem Schlag,Hier finden Sie Informationen zu dem Thema „Krieg in der Ukraine“. Lesen Sie jetzt „Selenskyj stellt Militärführung um nach russischem Schlag“.,https://img.zeit.de/news/2025-06/03/selenskyj-stellt-militaerfuehrung-um-nach-russischem-schlag-image-group/wide__1300x731,2025-06-03T20:30:57Z,https://web.archive.org/web/20250604042441/https://www.zeit.de/news/2025-06/03/selenskyj-stellt-militaerfuehrung-um-nach-russischem-schlag,Der ukrainische Präsident Wolodymyr Selenskyj hat Veränderungen an der Spitze der Militärführung vorgenommen. So sei der bisherige Heereschef Mychajlo Drapatyj von Organisationsaufgaben wie der Mobil… [+1626 chars],,de,'Ukraine'
https://www.stern.de/politik/ausland/krieg-in-der-ukraine--selenskyj-stellt-militaerfuehrung-um-nach-russischem-schlag-35779980.html,https://www.stern.de/politik/ausland/krieg-in-der-ukraine--selenskyj-stellt-militaerfuehrung-um-nach-russischem-schlag-35779980.html,0,www.stern.de,Krieg in der Ukraine: Selenskyj stellt Militärführung um nach russischem Schlag,"Dem ukrainischen Geheimdienst ist mit dem Schlag gegen die russische Bomberflotte ein Coup gelungen, während gleichzeitig die Armeeführung wegen Fehlern in Kritik geriet. Nun hat Selenskyj reagiert.",https://image.stern.de/35779982/t/jG/v1/w1440/r1.7778/-/03--7au3i6sfwjv2axs2048jpeg---d0209706768f4d78.jpg,2025-06-03T20:30:57Z,https://web.archive.org/web/20250603204542/https://www.stern.de/politik/ausland/krieg-in-der-ukraine--selenskyj-stellt-militaerfuehrung-um-nach-russischem-schlag-35779980.html,"Kopiere den aktuellen Link
Zur Merkliste hinzufügen
Dem ukrainischen Geheimdienst ist mit dem Schlag gegen die russische Bomberflotte ein Coup gelungen, während gleichzeitig die Armeeführung wegen … [+1840 chars]",,de,'Ukraine'
https://www.tagesspiegel.de/internationales/krieg-in-der-ukraine-selenskyj-stellt-militarfuhrung-um-nach-russischem-schlag-13799092.html,https://www.tagesspiegel.de/internationales/krieg-in-der-ukraine-selenskyj-stellt-militarfuhrung-um-nach-russischem-schlag-13799092.html,0,www.tagesspiegel.de,Krieg in der Ukraine: Selenskyj stellt Militärführung um nach russischem Schlag,"Dem ukrainischen Geheimdienst ist mit dem Schlag gegen die russische Bomberflotte ein Coup gelungen, während gleichzeitig die Armeeführung wegen Fehlern in Kritik geriet. Nun hat Selenskyj reagiert.",https://www.tagesspiegel.de/images/13799089/alternates/BASE_16_9_W1400/1748982736000/ukrainischer-prasident-wolodymyr-selenskyj.jpeg,2025-06-03T20:32:17Z,https://web.archive.org/web/20250604013559/https://www.tagesspiegel.de/internationales/krieg-in-der-ukraine-selenskyj-stellt-militarfuhrung-um-nach-russischem-schlag-13799092.html,Der ukrainische Präsident Wolodymyr Selenskyj hat Veränderungen an der Spitze der Militärführung vorgenommen. So sei der bisherige Heereschef Mychajlo Drapatyj von Organisationsaufgaben wie der Mobil… [+1678 chars],,de,'Wladimir Putin'
https://www.n-tv.de/politik/09-18-Operation-Spinnennetz-beschaedigte-mindestens-zwei-wertvolle-Uberwachungsflugzeuge--article23143824.html,https://www.n-tv.de/politik/09-18-Operation-Spinnennetz-beschaedigte-mindestens-zwei-wertvolle-Uberwachungsflugzeuge--article23143824.html,0,www.n-tv.de,"Ukraine-Krieg im Liveticker: +++ 09:18 ""Operation Spinnennetz"" beschädigte mindestens zwei wertvolle Überwachungsflugzeuge +++",Lesen Sie alle aktuellen Entwicklungen und Nachrichten über den russischen Angriffskrieg auf die Ukraine im Liveticker von ntv.de.,https://www.n-tv.de/img/incoming/crop25117070/8311326854-cImg_16_9-w1200/Ukraine-Liveticker.jpg,2025-06-03T22:03:00Z,https://web.archive.org/web/20250604073213/https://www.n-tv.de/politik/09-18-Operation-Spinnennetz-beschaedigte-mindestens-zwei-wertvolle-Uberwachungsflugzeuge--article23143824.html,Der ukrainische Angriff auf russische Flugplätze hat die Luftwaffe Putins an vielen Stellen dezimiert. Dabei wurden auch mindestens zwei Überwachungsflugzeuge vom Typ A-50 durch die ukrainischen Droh… [+11182 chars],,de,'Ukraine'
https://www.n-tv.de/politik/14-49-Russland-Krim-Bruecke-nach-ukrainischem-Angriff-unbeschaedigt--article23143824.html,https://www.n-tv.de/politik/14-49-Russland-Krim-Bruecke-nach-ukrainischem-Angriff-unbeschaedigt--article23143824.html,0,www.n-tv.de,Ukraine-Krieg im Liveticker: +++ 14:49 Russland: Krim-Brücke nach ukrainischem Angriff unbeschädigt +++,Lesen Sie alle aktuellen Entwicklungen und Nachrichten über den russischen Angriffskrieg auf die Ukraine im Liveticker von ntv.de.,https://www.n-tv.de/img/incoming/crop25117070/8311326854-cImg_16_9-w1200/Ukraine-Liveticker.jpg,2025-06-03T22:03:00Z,https://web.archive.org/web/20250604131042/https://www.n-tv.de/politik/14-49-Russland-Krim-Bruecke-nach-ukrainischem-Angriff-unbeschaedigt--article23143824.html,"Russland bestätigt einen ukrainischen Angriff auf die Krim-Brücke, bestreitet allerdings Schäden an dem riesigen Bauwerk. Es habe eine Explosion gegeben, die Brücke sei jedoch nicht beschädigt worden… [+20426 chars]",,de,'Russland'
https://www.n-tv.de/politik/17-53-Polen-und-Deutschland-wollen-Kooperation-vertiefen--article23143824.html,https://www.n-tv.de/politik/17-53-Polen-und-Deutschland-wollen-Kooperation-vertiefen--article23143824.html,0,www.n-tv.de,Ukraine-Krieg im Liveticker: +++ 17:53 Polen und Deutschland wollen Kooperation vertiefen +++,Lesen Sie alle aktuellen Entwicklungen und Nachrichten über den russischen Angriffskrieg auf die Ukraine im Liveticker von ntv.de.,https://www.n-tv.de/img/incoming/crop25117070/8311326854-cImg_16_9-w1200/Ukraine-Liveticker.jpg,2025-06-03T22:03:00Z,https://web.archive.org/web/20250604160855/https://www.n-tv.de/politik/17-53-Polen-und-Deutschland-wollen-Kooperation-vertiefen--article23143824.html,Außenminister Johann Wadephul und sein polnischer Kollege Radoslaw Sikorski wollen die Zusammenarbeit beider Länder ungeachtet des Siegs von EU-Skeptiker Karol Nawrocki bei der Präsidentschaftswahl i… [+26768 chars],,de,'Angriff'
https://www.n-tv.de/politik/07-11-Nato-Bundeswehr-wird-wohl-deutlich-wachsen-muessen--article23143824.html,https://www.n-tv.de/politik/07-11-Nato-Bundeswehr-wird-wohl-deutlich-wachsen-muessen--article23143824.html,0,www.n-tv.de,Ukraine-Krieg im Liveticker: +++ 07:11 Nato: Bundeswehr wird wohl deutlich wachsen müssen +++,Lesen Sie alle aktuellen Entwicklungen und Nachrichten über den russischen Angriffskrieg auf die Ukraine im Liveticker von ntv.de.,https://www.n-tv.de/img/incoming/crop25117070/8311326854-cImg_16_9-w1200/Ukraine-Liveticker.jpg,2025-06-03T22:03:00Z,https://web.archive.org/web/20250604051425/https://www.n-tv.de/politik/07-11-Nato-Bundeswehr-wird-wohl-deutlich-wachsen-muessen--article23143824.html,"Die neuen Planungsziele der Nato werden auch für Deutschland massive weitere Anstrengungen bedeuten. Für Deutschland gehen Militärs davon aus, dass die derzeit rund 182.000 Soldatinnen und Soldaten s… [+8792 chars]",,de,'Angriff'
https://www.n-tv.de/politik/18-33-140-Millionen-Russen-gehen-auf-30-Millionen-Ukrainer-los--article23143824.html,https://www.n-tv.de/politik/18-33-140-Millionen-Russen-gehen-auf-30-Millionen-Ukrainer-los--article23143824.html,0,www.n-tv.de,"Ukraine-Krieg im Liveticker: +++ 18:33 ""140 Millionen Russen gehen auf 30 Millionen Ukrainer los"" +++",Lesen Sie alle aktuellen Entwicklungen und Nachrichten über den russischen Angriffskrieg auf die Ukraine im Liveticker von ntv.de.,https://www.n-tv.de/img/incoming/crop25117070/8311326854-cImg_16_9-w1200/Ukraine-Liveticker.jpg,2025-06-03T22:03:00Z,https://web.archive.org/web/20250604165947/https://www.n-tv.de/politik/18-33-140-Millionen-Russen-gehen-auf-30-Millionen-Ukrainer-los--article23143824.html,"Die Ukraine steht im anhaltenden Angriffskrieg Russlands mit dem Rücken zur Wand. Materiell und personell fehlt es an allen Ecken. Trotz beachtlicher Anstrengungen, die Lücken mit eigener Produktion … [+28162 chars]",,de,'Ukraine'
https://www.n-tv.de/politik/08-46-Graham-Putin-ins-Gewissen-reden-haben-wir-versucht-es-funktioniert-nicht--article23143824.html,https://www.n-tv.de/politik/08-46-Graham-Putin-ins-Gewissen-reden-haben-wir-versucht-es-funktioniert-nicht--article23143824.html,0,www.n-tv.de,Ukraine-Krieg im Liveticker: +++ 08:46 Graham: Putin ins Gewissen reden haben wir versucht - es funktioniert nicht +++,Lesen Sie alle aktuellen Entwicklungen und Nachrichten über den russischen Angriffskrieg auf die Ukraine im Liveticker von ntv.de.,https://www.n-tv.de/img/incoming/crop25117070/8311326854-cImg_16_9-w1200/Ukraine-Liveticker.jpg,2025-06-03T22:03:00Z,https://web.archive.org/web/20250604065931/https://www.n-tv.de/politik/08-46-Graham-Putin-ins-Gewissen-reden-haben-wir-versucht-es-funktioniert-nicht--article23143824.html,"Der republikanische US-Senator Lindsey Graham hat einen härteren Kurs gegen den russischen Präsidenten Wladimir Putin angemahnt. ""Wir wollen Präsident Trump einen Hebel verschaffen. Seine Charmeoffen… [+10614 chars]",,de,'Wladimir Putin'
https://www.n-tv.de/politik/13-58-Rutte-Niemand-sollte-jemals-auf-die-Idee-kommen-uns-anzugreifen--article23143824.html,https://www.n-tv.de/politik/13-58-Rutte-Niemand-sollte-jemals-auf-die-Idee-kommen-uns-anzugreifen--article23143824.html,0,www.n-tv.de,"Ukraine-Krieg im Liveticker: +++ 13:58 Rutte: ""Niemand sollte jemals auf die Idee kommen, uns anzugreifen"" +++",Lesen Sie alle aktuellen Entwicklungen und Nachrichten über den russischen Angriffskrieg auf die Ukraine im Liveticker von ntv.de.,https://www.n-tv.de/img/incoming/crop25117070/8311326854-cImg_16_9-w1200/Ukraine-Liveticker.jpg,2025-06-03T22:03:00Z,https://web.archive.org/web/20250604121133/https://www.n-tv.de/politik/13-58-Rutte-Niemand-sollte-jemals-auf-die-Idee-kommen-uns-anzugreifen--article23143824.html,"Nato-Generalsekretär Mark Rutte mahnt eine entschlossene und zügige Umsetzung von geplanten neuen Zielen für die militärischen Kapazitäten der Bündnismitglieder an. ""Wir benötigen mehr Ressourcen, Tr… [+18386 chars]",,de,'Ukraine'
https://www.n-tv.de/politik/19-51-US-Senator-vergleicht-Operation-Spinnennetz-mit-Toetung-Osama-bin-Ladens--article23143824.html,https://www.n-tv.de/politik/19-51-US-Senator-vergleicht-Operation-Spinnennetz-mit-Toetung-Osama-bin-Ladens--article23143824.html,0,www.n-tv.de,"Ukraine-Krieg im Liveticker: +++ 19:51 US-Senator vergleicht ""Operation Spinnennetz"" mit Tötung Osama bin Ladens +++",Lesen Sie alle aktuellen Entwicklungen und Nachrichten über den russischen Angriffskrieg auf die Ukraine im Liveticker von ntv.de.,https://www.n-tv.de/img/incoming/crop25117070/8311326854-cImg_16_9-w1200/Ukraine-Liveticker.jpg,2025-06-03T22:03:00Z,https://web.archive.org/web/20250604180129/https://www.n-tv.de/politik/19-51-US-Senator-vergleicht-Operation-Spinnennetz-mit-Toetung-Osama-bin-Ladens--article23143824.html,"Der demokratische US-Senator Richard Blumenthal vergleicht die ukrainische ""Operation Spinnennetz"" mit der US-Operation zur Tötung von Osama bin Laden, Anführer des Terrornetzwerkes Al Kaida, im Jahr… [+30785 chars]",,de,'Ukraine'
https://www.n-tv.de/politik/11-33-Grossbritannien-sagt-der-Ukraine-100-000-Drohnen-zu--article23143824.html,https://www.n-tv.de/politik/11-33-Grossbritannien-sagt-der-Ukraine-100-000-Drohnen-zu--article23143824.html,0,www.n-tv.de,Ukraine-Krieg im Liveticker: +++ 11:33 Großbritannien sagt der Ukraine 100.000 Drohnen zu +++,Lesen Sie alle aktuellen Entwicklungen und Nachrichten über den russischen Angriffskrieg auf die Ukraine im Liveticker von ntv.de.,https://www.n-tv.de/img/incoming/crop25117070/8311326854-cImg_16_9-w1200/Ukraine-Liveticker.jpg,2025-06-03T22:03:00Z,https://web.archive.org/web/20250604095804/https://www.n-tv.de/politik/11-33-Grossbritannien-sagt-der-Ukraine-100-000-Drohnen-zu--article23143824.html,"Großbritannien will der von Russland angegriffenen Ukraine bis April 2026 rund 100.000 Drohnen zur Verfügung stellen. Das sei eine Verzehnfachung der bisherigen Zusagen, heißt es aus dem zuständigen … [+14613 chars]",,de,'Wladimir Putin'
