index,url,valid,domain,title,description,image,published,archive,content,quote,language,keyword
https://www.nzz.ch/wirtschaft/kof-nzz-umfrage-vier-von-fuenf-oekonomen-fordern-klimazoelle-klimaschutzgesetz-ld.1739930,https://www.nzz.ch/wirtschaft/kof-nzz-umfrage-vier-von-fuenf-oekonomen-fordern-klimazoelle-klimaschutzgesetz-ld.1739930,0,www.nzz.ch,KOF-NZZ-Umfrage: Vier von fünf Ökonomen fordern Klimazölle,"Das Klimaschutzgesetz spaltet die Ökonomen: Die eine Hälfte hält es für wirksam, die andere nicht. Überraschen mag, dass eine klare Mehrheit hinter Zöllen auf Produkten aus Ländern mit einer laschen Umweltpolitik steht.","https://img.nzz.ch/2023/01/05/f009bc5b-ef1d-4708-b841-245bd6a1d3c4.jpeg?width=1200&height=674&fit=bound&quality=75&auto=webp&crop=1300,731,x0,y122&wmark=nzz",2023-06-02T03:30:00Z,https://web.archive.org/web/20230602155342/https://www.nzz.ch/wirtschaft/kof-nzz-umfrage-vier-von-fuenf-oekonomen-fordern-klimazoelle-klimaschutzgesetz-ld.1739930,"Ein Blick auf den Griesgletscher im Wallis (2. September 2022). Er gehört zu den Gletschern, die derzeit besonders rasch schmelzen.
«Zwei Seelen wohnen, ach, in meiner Brust», sagt Goethes Faust. So… [+6508 chars]",,de,'Klima'
https://consent.google.com/ml?continue=https://news.google.com/rss/articles/CBMifGh0dHBzOi8vd2ViLmRlL21hZ2F6aW5lL3BvbGl0aWsvcG9saXRpc2NoZS10YWxrc2hvd3Mvdm9lbGxpZy11bmFuZ2VtZXNzZW4tbHVpc2EtbmV1YmF1ZXItbG9lc3QtbGFuei1oaXR6aWdlLWRlYmF0dGUtMzgyNzU0OTbSAQA?oc%3D5%26hl%3Den-CA%26gl%3DCA%26ceid%3DCA:en&gl=FR&hl=en-CA&cm=2&pc=n&src=1,https://consent.google.com/ml?continue=https://news.google.com/rss/articles/CBMifGh0dHBzOi8vd2ViLmRlL21hZ2F6aW5lL3BvbGl0aWsvcG9saXRpc2NoZS10YWxrc2hvd3Mvdm9lbGxpZy11bmFuZ2VtZXNzZW4tbHVpc2EtbmV1YmF1ZXItbG9lc3QtbGFuei1oaXR6aWdlLWRlYmF0dGUtMzgyNzU0OTbSAQA?oc%3D5%26hl%3Den-CA%26gl%3DCA%26ceid%3DCA:en&gl=FR&hl=en-CA&cm=2&pc=n&src=1,0,consent.google.com,"""Völlig unangemessen"": Luisa Neubauer löst bei Lanz hitzige Debatte aus - WEB.DE News","<ol><li>""Völlig unangemessen"": Luisa Neubauer löst bei Lanz hitzige Debatte aus  WEB.DE News
</li><li>""Klima-RAF"" & Co.: Neubauer kritisiert politisches ""Aufheizen"" der Union | Markus Lanz vom 1.6.2023  ZDFheute Nachrichten
</li><li>„Markus Lanz“: Wegen Kli…",,2023-06-02T04:20:49Z,,"We use cookies and data to<ul><li>Deliver and maintain Google services</li><li>Track outages and protect against spam, fraud, and abuse</li><li>Measure audience engagement and site statistics to unde… [+1131 chars]",,de,'heizen'
https://www.focus.de/finanzen/news/konjunktur/diesel-heizoel-milch-preise-sinken-zum-ersten-mal-in-diesem-jahr-was-jetzt-besonders-guenstig-ist_id_195224967.html,https://www.focus.de/finanzen/news/konjunktur/diesel-heizoel-milch-preise-sinken-zum-ersten-mal-in-diesem-jahr-was-jetzt-besonders-guenstig-ist_id_195224967.html,0,www.focus.de,"Diesel, Heizöl, Milch - Preise sinken erstmals in diesem Jahr: Was jetzt besonders günstig ist","Nach vorläufigen Zahlen sind die Preise in Deutschland im Mai gegenüber dem April um 0,2 Prozent gesunken. Das ist das erste Mal in diesem Jahr. Besonders sinkende Energiepreise tragen dazu bei. Insgesamt bleibt die Inflation jedoch hoch.Von FOCUS-online-Auto…",https://p6.focus.de/img/regional/mecklenburg-vorpommern/id_191081232/lebensmittel-liegen-in-einem-einkaufswagen-in-einem-supermarkt..jpg?im=Crop%3D%280%2C169%2C2048%2C1024%29%3BResize%3D%281200%2C627%29&impolicy=perceptual&quality=mediumHigh&hash=596078b81ada270e22460aa438c725a21138c540bcd4ca5ac2ec96f336cdbecd,2023-06-02T04:51:43Z,https://web.archive.org/web/20230602073832/https://www.focus.de/finanzen/news/konjunktur/diesel-heizoel-milch-preise-sinken-zum-ersten-mal-in-diesem-jahr-was-jetzt-besonders-guenstig-ist_id_195224967.html,"Nach vorläufigen Zahlen sind die Preise in Deutschland im Mai gegenüber dem April um 0,2 Prozent gesunken. Das ist das erste Mal in diesem Jahr. Besonders sinkende Energiepreise tragen dazu bei. Insg… [+4034 chars]",,de,'Inflation'
https://futurezone.at/meinung/klima-kuendigungen-bringen-arbeitgebende-ins-schwitzen/402470573,https://futurezone.at/meinung/klima-kuendigungen-bringen-arbeitgebende-ins-schwitzen/402470573,0,futurezone.at,Klima-Kündigungen bringen Arbeitgebende ins Schwitzen,Die Sorge um die Klimakrise wirkt sich zunehmend auf unsere Job-Entscheidungen aus.,https://image.futurezone.at/images/facebook/7921898/46-102405121.jpg,2023-06-02T05:00:00Z,https://web.archive.org/web/20230602084153/https://futurezone.at/meinung/klima-kuendigungen-bringen-arbeitgebende-ins-schwitzen/402470573,Die Sorge um die Klimakrise wirkt sich zunehmend auf unsere Job-Entscheidungen aus.,,de,'Klima'
https://www.focus.de/finanzen/experten-befuerchten-wohlstandsverluste-habeck-will-deutschland-auf-eine-energie-diaet-setzen_id_194834474.html,https://www.focus.de/finanzen/experten-befuerchten-wohlstandsverluste-habeck-will-deutschland-auf-eine-energie-diaet-setzen_id_194834474.html,0,www.focus.de,Experten befürchten Wohlstandsverluste - Habeck will Deutschland jetzt auf Energie-Diät setzen,Nach dem noch nicht beendeten Streit ums Gebäudeenergiegesetz ist vor dem Ärger ums Energieeffizienzgesetz. Denn damit will Klimaschutzminister Habeck Deutschlands Energieverbrauch verschlanken. Wirtschaftsexperten prognostizieren Wohlstandsverluste in der Bu…,https://p6.focus.de/img/fotos/id_194835134/habeck1.jpg?im=Crop%3D%280%2C288%2C3464%2C1732%29%3BResize%3D%281200%2C627%29&impolicy=perceptual&quality=mediumHigh&hash=5251e073c255b5797ee121acc680bca51e0abe8f46da17e15e8955a0ac972545,2023-06-02T05:27:46Z,,Nach dem noch nicht beendeten Streit ums Gebäudeenergiegesetz ist vor dem Ärger ums Energieeffizienzgesetz. Denn damit will Klimaschutzminister Habeck Deutschlands Energieverbrauch verschlanken. Wirt… [+10541 chars],,de,'Klima'
https://www.morgenpost.de/wirtschaft/article238535615/heizoelpreise-aktuell-heute-2-juni-heizung-heizoel-deutschland-energie.html,https://www.morgenpost.de/wirtschaft/article238535615/heizoelpreise-aktuell-heute-2-juni-heizung-heizoel-deutschland-energie.html,0,www.morgenpost.de,Energiepreise: Heizölpreise aktuell: Der Preis pro Liter heute am 2. Juni,"Rauf oder runter: Wie entwickeln sich die Heizölpreise aktuell? ○ Lesen Sie hier, wie viel ein Liter Heizöl heute am 2. Juni kostet.",https://img.morgenpost.de/img/politik/crop237240715/6832604013-w820-cv16_9-q85/Heizoel-OEl-Tank-Heizung.jpg,2023-06-02T07:44:00Z,https://web.archive.org/web/20230602092143/https://www.morgenpost.de/wirtschaft/article238535615/heizoelpreise-aktuell-heute-2-juni-heizung-heizoel-deutschland-energie.html,"Berlin. Grüner Wasserstoff statt klimaschädlichem Heizöl? Wenn es nach der FDP ginge, könnte die Zukunft des Heizens in Deutschland so aussehen. Die Grünen setzen dagegen verstärkt auf Wärmepumpen wa… [+6800 chars]",,de,'heizen'
https://www.handelsblatt.com/unternehmen/waermepumpe-oder-gasheizung-welche-heizung-lohnt-sich-langfristig/28822824.html,https://www.handelsblatt.com/unternehmen/waermepumpe-oder-gasheizung-welche-heizung-lohnt-sich-langfristig/28822824.html,0,www.handelsblatt.com,Serie: Ratgeber Wärmepumpe: Gasheizung: Lohnt sich die Wärmepumpe langfristig im Vergleich?,"Neue Regelungen und die Energiepreise drängen zum Umrüsten der Gasheizung. Was kosten die Alternativen Wärmepumpe, Fernwärme und Pelletheizung langfristig im Vergleich?",https://www.handelsblatt.com/images/heizkosten/29119500/2-format2003.jpg,2023-06-02T09:20:43Z,https://web.archive.org/web/20230602095322/https://www.handelsblatt.com/unternehmen/waermepumpe-oder-gasheizung-welche-heizung-lohnt-sich-langfristig/28822824.html,"HeizkostenBeim Erneuern oder Umrüsten einer Gasheizung auf Wärmepumpe, Fernwärme oder Pelletheizung summieren sich die Kosten.
(Foto: Getty Images)
Düsseldorf Viele Menschen denken daher darüber na… [+1342 chars]",,de,'Gas'
https://www.n-tv.de/wirtschaft/Wasserstoff-koennte-auch-zum-Heizen-relevant-werden-article24161875.html,https://www.n-tv.de/wirtschaft/Wasserstoff-koennte-auch-zum-Heizen-relevant-werden-article24161875.html,0,www.n-tv.de,"Expertin über H2-Potenzial: ""Wasserstoff könnte auch zum Heizen relevant werden""","Die Wasserstoffstrategie, noch von der Großen Koalition ausgearbeitet, kommt nur schleppend voran. Katharina Großmann, Leiterin eines führenden Wasserstoffprojekts, erklärt im Interview mit ntv.de, was Hersteller, Netzbetreiber und Endkunden jetzt brauchen, u…",https://bilder2.n-tv.de/img/incoming/crop24162057/9731329730-cImg_16_9-w1200/406705927.jpg,2023-06-02T11:10:56Z,https://web.archive.org/web/20230602111939/https://www.n-tv.de/wirtschaft/Wasserstoff-koennte-auch-zum-Heizen-relevant-werden-article24161875.html,"Wasserstoff dürfte eine zentrale Säule der Energieversorgung in einer klimaneutralen Welt werden. Doch die Wasserstoffstrategie, noch von der Großen Koalition ausgearbeitet, kommt nur schleppend vora… [+7785 chars]",,de,'heizen'
https://www.sueddeutsche.de/wirtschaft/heiz-gesetz-fernwaerme-waermepumpe-1.5896539,https://www.sueddeutsche.de/wirtschaft/heiz-gesetz-fernwaerme-waermepumpe-1.5896539,0,www.sueddeutsche.de,Heizungen: Klimaschutz funktioniert nicht von oben,"Das Gesetz rund ums Heizen war gut gemeint, hat aber alle nur verunsichert. Darin steckt eine Lektion für die, die es ernst meinen mit dem Klima.",https://www.sueddeutsche.de/assets/png/sz-ecb090256670a577bd629a9718686332.png,2023-06-02T12:04:41Z,https://web.archive.org/web/20230602150653/https://www.sueddeutsche.de/wirtschaft/heiz-gesetz-fernwaerme-waermepumpe-1.5896539,"Das Gesetz rund ums Heizen war gut gemeint, hat aber alle nur verunsichert. Darin steckt eine Lektion für die, die es ernst meinen mit dem Klima.Alles war bis ins Kleinste durchdacht. Revolutionen du… [+638 chars]",,de,'heizen'
https://www.morgenpost.de/wirtschaft/article238568823/Fuehrt-Gesetz-zu-Waermeplanung-zu-mehr-Datenerhebung.html,https://www.morgenpost.de/wirtschaft/article238568823/Fuehrt-Gesetz-zu-Waermeplanung-zu-mehr-Datenerhebung.html,0,www.morgenpost.de,Energie: Führt Gesetz zu Wärmeplanung zu mehr Datenerhebung?,"Städte und Gemeinden sollen zusammentragen, wie ihre Einwohner künftig heizen können. Das soll Eigentümern Sicherheit bringen - doch viele befürchten, dass detaillierte Daten weitergegeben werden.",https://img.morgenpost.de/img/wirtschaft/crop238568821/1672607682-w820-cv16_9-q85/Klara-Geywitz.jpg,2023-06-02T12:41:57Z,https://web.archive.org/web/20230602140903/https://www.morgenpost.de/wirtschaft/article238568823/Fuehrt-Gesetz-zu-Waermeplanung-zu-mehr-Datenerhebung.html,"Berlin. Bauministerin Klara Geywitz hat Kritik am vorgesehenen Umgang mit Daten bei der kommunalen Wärmeplanung zurückgewiesen.
Unser Gesetzentwurf wurde dem Bundesdatenschutzbeauftragten vorgelegt,… [+1989 chars]",,de,'heizen'
https://www.morgenpost.de/ratgeber/article238076389/heizung-30-jahre-austauschpflicht-oelheizung-gasheizung-hausbesitzer.html,https://www.morgenpost.de/ratgeber/article238076389/heizung-30-jahre-austauschpflicht-oelheizung-gasheizung-hausbesitzer.html,0,www.morgenpost.de,"""Austauschpflicht"" greift: Heizung über 30 Jahre alt: Diese Strafen drohen Verbrauchern","Die Gas- oder Ölheizung könnte schon jetzt unter die Austauschpflicht fallen. Wer diese kontrolliert und wie teuer es werden kann, erfahren Sie hier.",https://img.morgenpost.de/img/frontpage/crop237865751/400260706-w820-cv16_9-q85/Ausbau-einer-OElheizung-Alte-Anlage-steht-auf-der-Strasse.jpg,2023-06-02T13:19:00Z,https://web.archive.org/web/20230602133845/https://www.morgenpost.de/ratgeber/article238076389/heizung-30-jahre-austauschpflicht-oelheizung-gasheizung-hausbesitzer.html,"Berlin. <ul><li>Das Heizungsgesetz sorgt für Diskussionen. Dabei gibt es längst Regelungen für den Austausch einer Heizung</li><li>Wer trotz dieser Regelungen seine Heizung behält, muss mit Strafen r… [+5479 chars]",,de,'heizen'
https://www.focus.de/klima/analyse/panik-kaeufe-vor-dem-winter-jetzt-bleibt-europa-auf-seinen-riesigen-kohlebergen-sitzen_id_195322032.html,https://www.focus.de/klima/analyse/panik-kaeufe-vor-dem-winter-jetzt-bleibt-europa-auf-seinen-riesigen-kohlebergen-sitzen_id_195322032.html,0,www.focus.de,Panik-Käufe vor dem Winter - Jetzt bleibt Europa auf seinen riesigen Kohlebergen sitzen,"Panisch kauften die europäischen Staaten im letzten Jahr große Mengen Kohle für den Winter an, brachten sogar alte Kraftwerke ans Netz zurück. Doch jetzt zeigt sich: Der Kontinent hat die Kohle gar nicht gebraucht. Das ist gut fürs Klima - zumindest in der Th…",https://p6.focus.de/img/fotos/id_195330444/gettyimages-1244147865.jpg?im=Crop%3D%280%2C0%2C3463%2C1732%29%3BResize%3D%281200%2C627%29&impolicy=perceptual&quality=mediumHigh&hash=313f3a45958167bdb6ea4b706f18345b42887ada193cc347c07913049f1aa0a7,2023-06-02T14:41:30Z,https://web.archive.org/web/20230602155833/https://www.focus.de/klima/analyse/panik-kaeufe-vor-dem-winter-jetzt-bleibt-europa-auf-seinen-riesigen-kohlebergen-sitzen_id_195322032.html,"<ul><li>
Kommentare</li><li>
E-Mail</li><li>
Teilen</li><li>
Mehr</li><li>
Twitter</li><li>
Drucken</li><li>
Feedback</li><li>
Fehler meldenSie haben einen Fehler gefunden?
Bitte markieren S… [+5006 chars]",,de,'heizen'
https://www.faz.net/aktuell/politik/ukraine-liveticker-wagner-chef-truppen-zu-99-prozent-aus-bachmut-abgezogen-faz-18495964.html,https://www.faz.net/aktuell/politik/ukraine-liveticker-wagner-chef-truppen-zu-99-prozent-aus-bachmut-abgezogen-faz-18495964.html,0,www.faz.net,Ukraine-Liveblog: Wagner-Chef: Truppen zu 99 Prozent aus Bachmut abgezogen,Bleiben jedoch weiter im Gebiet Donezk stationiert +++ Berlin beschafft 66 Truppentransporter für Kiew +++ Amerika kauft Gepard-Luftabwehrsysteme für die Ukraine +++ alle Entwicklungen im Liveblog,https://media1.faz.net/ppmedia/aktuell/politik/513266099/1.8938737/facebook_teaser/jewgeni-prigoschin-chef-der.jpg,2023-06-02T18:59:56Z,https://web.archive.org/web/20230602191549/https://www.faz.net/aktuell/politik/ukraine-liveticker-wagner-chef-truppen-zu-99-prozent-aus-bachmut-abgezogen-faz-18495964.html,"Die Ukraine und Russland schließen nach Einschätzung Chinas die Möglichkeit von Friedensverhandlungen nicht aus. Er glaube, dass keine der beiden Konfliktparteien die Tür für Verhandlungen fest versc… [+995 chars]",,de,'Ukraine'
