index,url,valid,domain,title,description,image,published,archive,content,quote,language,keyword
https://taz.de/Komponistin-ueber-Flucht-als-Opern-Thema/!5928446/,https://taz.de/Komponistin-ueber-Flucht-als-Opern-Thema/!5928446/,0,taz.de,Komponistin über Flucht als Opern-Thema: „Wir stumpfen langsam ab“,"Die Komponistin Cat Hope zeigt ihre Oper „Speechless“ in Hamburg. Texte gibt es in dem Stück nicht, dafür aber Sän­ge­r*in­nen mit Fluchterfahrung.",https://taz.de/picture/6238893/948/277608454-1.jpeg,2023-05-02T13:00:00Z,,"Die Komponistin Cat Hope zeigt ihre Oper Speechless in Hamburg. Texte gibt es in dem Stück nicht, dafür aber Sän­ge­r*in­nen mit Fluchterfahrung.
Leben auf der Flucht: Blick in eine Notunterkunft in… [+3415 chars]",,de,'Flucht'
https://www.stern.de/politik/deutschland/petersberger-klimadialog---baerbock--klima-finanz-zusage-fuer-arme-laender-in-reichweite-33427122.html,https://www.stern.de/politik/deutschland/petersberger-klimadialog---baerbock--klima-finanz-zusage-fuer-arme-laender-in-reichweite-33427122.html,0,www.stern.de,Petersberger Klimadialog : Baerbock: Klima-Finanz-Zusage für arme Länder in Reichweite,Gerade Länder in heißeren Gebieten der Erde leiden oft besonders an den Auswirkungen des Klimawandels. Industrieländer haben schon lange mehr Hilfe versprochen - nun soll es Bewegung geben.,https://image.stern.de/33430018/t/Za/v1/w1440/r1.7778/-/02--urnnewsmldpacom2009010123050299527116v4w800h600l393t360r1768b1345jpeg---82afa671ed0c4799.jpg,2023-05-02T13:55:06Z,,"Gerade Länder in heißeren Gebieten der Erde leiden oft besonders an den Auswirkungen des Klimawandels. Industrieländer haben schon lange mehr Hilfe versprochen - nun soll es Bewegung geben.
Die reic… [+4472 chars]",,de,'Finanz'
https://www.n-tv.de/politik/Bereits-mehr-als-330-000-Binnenfluechtlinge-im-Sudan-article24092529.html,https://www.n-tv.de/politik/Bereits-mehr-als-330-000-Binnenfluechtlinge-im-Sudan-article24092529.html,0,www.n-tv.de,Hilfsorganisationen fehlt Geld: Bereits mehr als 330.000 Binnenflüchtlinge im Sudan,Im Sudan kämpfen seit Wochen Armeeeinheiten gegen die RSF-Miliz. Der Konflikt stürzt das Land und seine Bevölkerung in eine humanitäre Krise. Hunderttausende müssen ihre Heimatorte verlassen.,https://bilder2.n-tv.de/img/incoming/crop24092561/9211322626-cImg_16_9-w1200/668d26304a5b92774fbacb15609f3733.jpg,2023-05-02T14:01:34Z,,"Im Sudan kämpfen seit Wochen Armeeeinheiten gegen die RSF-Miliz. Der Konflikt stürzt das Land und seine Bevölkerung in eine humanitäre Krise. Hunderttausende müssen ihre Heimatorte verlassen.
Durch … [+1506 chars]",,de,'Flucht'
https://www.freitag.de/autoren/freitag-salon/ankuendigung-jakob-augstein-spricht-im-freitag-salon-mit-joseph-vogl,https://www.freitag.de/autoren/freitag-salon/ankuendigung-jakob-augstein-spricht-im-freitag-salon-mit-joseph-vogl,0,www.freitag.de,"Ankündigung | Klima, Krieg, Kapitalismus: Krisen und kein Ende? Jakob Augstein spricht mit Joseph Vogl","Obwohl die Corona-Pandemie vor wenigen Wochen offiziell beendet wurde, kehrt keine Ruhe ein im Weltgeschehen. Das Klima erwärmt sich weiter und der Krieg in der Ukraine dauert an. Über die „Polykrise“ spricht Jakob Augstein mit Joseph Vogl Klima, Krieg, Kapit…",https://www.freitag.de/autoren/freitag-salon/ankuendigung-jakob-augstein-spricht-im-freitag-salon-mit-joseph-vogl/@@images/image/lead_article,2023-05-02T14:15:00Z,,"Klima, Krieg, Kapitalismus: Krisen und kein Ende?
Obwohl die Corona-Pandemie vor wenigen Wochen offiziell beendet wurde, kehrt keine Ruhe ein im Weltgeschehen. Klimaaktivisten sehen uns auf eine Erd… [+2103 chars]",,de,'Krise'
https://www.dw.com/de/mehr-als-330000-menschen-im-sudan-auf-der-flucht/a-65493667,https://www.dw.com/de/mehr-als-330000-menschen-im-sudan-auf-der-flucht/a-65493667,0,www.dw.com,Mehr als 330.000 Menschen im Sudan auf der Flucht,Die schweren Kämpfe im Sudan haben UN-Angaben zufolge seit Mitte April hunderttausende Menschen in die Flucht getrieben.,https://static.dw.com/image/65490691_6.jpg,2023-05-02T15:01:00Z,https://web.archive.org/web/20230503222154/https://www.dw.com/de/mehr-als-330000-menschen-im-sudan-auf-der-flucht/a-65493667,"Allein innerhalb des Landes seien mehr als 330.000 Menschen geflohen, sagte ein Sprecher der Internationalen Organisation für Migration (IOM) in Genf. Vor Ort in Khartum berichteten Zeugen am Diensta… [+2387 chars]",,de,'Flucht'
https://www.stern.de/news/suedsudan-gibt-einigung-auf-siebentaegige-waffenruhe-im-sudan-bekannt-33429892.html,https://www.stern.de/news/suedsudan-gibt-einigung-auf-siebentaegige-waffenruhe-im-sudan-bekannt-33429892.html,0,www.stern.de,Südsudan gibt Einigung auf siebentägige Waffenruhe im Sudan bekannt,"Die Konfliktparteien im Sudan haben sich nach Angaben der südsudanesischen Regierung auf eine siebentägige Waffenruhe geeinigt. Wie das Außenministerium in Juba am Dienstag erklärte, einigten sich der sudanesische Armeechef Abdel Fattah al-Burhan und der Befe…",https://image.stern.de/33429894/t/uc/v1/w1440/r1.7778/-/02--smoke-billows-over-buildings-in-khartoum-during-the-third-week-of-battles-between-rival-generals---c66144e9cb9ca8b7.jpg,2023-05-02T15:55:57Z,,"Die Konfliktparteien im Sudan haben sich nach Angaben der südsudanesischen Regierung auf eine siebentägige Waffenruhe geeinigt. Wie das Außenministerium in Juba am Dienstag erklärte, einigten sich de… [+777 chars]",,de,'Waffen'
https://www.bild.de/regional/leipzig/leipzig-news/inflation-geld-sparen-das-haushaltsbuch-feiert-comeback-83767662.bild.html,https://www.bild.de/regional/leipzig/leipzig-news/inflation-geld-sparen-das-haushaltsbuch-feiert-comeback-83767662.bild.html,0,www.bild.de,"Egal, ob digital oder gedruckt - Das Haushaltsbuch feiert Comeback!","Leipzig – Mit spitzem Bleistift alle Ein- und Ausgaben notieren. „Das ist möglich, aber geht auch viel moderner“, sagt Madlen Müller (33), Finanz-Expertin.","https://images.bild.de/6450d9fcf3634a18196ba81f/d349024c94f76812c9070f5cb1d69269,34b566ef?w=1280",2023-05-02T15:57:13Z,,"Leipzig Mit spitzem Bleistift alle Ein- und Ausgaben notieren. Das ist möglich, aber geht auch viel moderner, sagt Madlen Müller (33), Finanz-Expertin bei der Verbraucherzentrale Sachsen.
Absolut je… [+2173 chars]",,de,'Finanz'
https://www.jungewelt.de/artikel/449987.flucht-und-migration-mehr-moria-wagen.html,https://www.jungewelt.de/artikel/449987.flucht-und-migration-mehr-moria-wagen.html,0,www.jungewelt.de,Flucht und Migration: Mehr Moria wagen,Grüne unterstützen Pläne von SPD-Innenministerin Faeser für Asylverfahren an EU-Außengrenze • Foto: Alkis Konstantinidis/REUTERS,https://www.jungewelt.de/img/1100/180365.jpg,2023-05-02T17:40:55Z,,Im Mai 1993 hat die SPD mit ihrer Zustimmung zum sogenannten Asylkompromiss die Demontage des Grundrechts auf Asyl in der Bundesrepublik ermöglicht. 30 Jahre später schickt sich mit Nancy Faeser eine… [+3200 chars],,de,'Flucht'
https://orf.at/stories/3314791/,https://orf.at/stories/3314791/,0,orf.at,Wirtschaftsforscher Felbermayr zur Inflation,,https://orf.at/mojo/1_4_1/storyserver//news/common/images/og-fallback-news.png,2023-05-02T17:41:23Z,,"Die Teuerung in Österreich hat sich im April beschleunigt und liegt deutlich über der Inflation in Deutschland und in der Euro-Zone. Im Studio der ZIB2 ist dazu Gabriel Felbermayr, Direktor des Wirts… [+595 chars]",,de,'Flucht'
https://www.welt.de/politik/ausland/article245119290/Suedsudan-vermittelt-Einigung-auf-Waffenruhe-im-Sudan.html,https://www.welt.de/politik/ausland/article245119290/Suedsudan-vermittelt-Einigung-auf-Waffenruhe-im-Sudan.html,0,www.welt.de,Einigung auf Waffenruhe im Sudan,Im Sudan sollen nach Vermittlung des Nachbarlandes Südsudan für sieben Tage die Waffen schweigen. Das erklärte der Präsident des Südsudan. In Juba sollen Verhandlungen zwischen Armee und den Paramilitärs der RSF stattfinden. Bisher ausgehandelte Waffenruhen w…,https://img.welt.de/img/politik/ausland/mobile245119292/4891353427-ci16x9-w1200/SUDAN-CONFLICT.jpg,2023-05-02T18:43:27Z,,Die Anführer der sudanesischen Armee und paramilitärischen Rapid Support Forces (RSF) haben einem siebentägigen Waffenstillstand vom 4. Mai bis 11. Mai zugestimmt. Das teilte das Außenministerium des… [+2183 chars],,de,'Waffen'
https://www.faz.net/aktuell/finanzen/sorgen-um-finanzstabilitaet-sind-stresstest-fuer-bankenaufseher-18863759.html,https://www.faz.net/aktuell/finanzen/sorgen-um-finanzstabilitaet-sind-stresstest-fuer-bankenaufseher-18863759.html,0,www.faz.net,Sorgen um Finanzstabilität sind Stresstest für Bankenaufseher,"Kunden können ihr Geld in Windeseile von Banken abziehen. Nun wird die Frage diskutiert, ob die Vorgaben für die Liquidität noch zeitgemäß sind.",https://media1.faz.net/ppmedia/aktuell/wirtschaft/1274397080/1.8863755/facebook_teaser_fplus/filiale-der-first-republic.jpg,2023-05-02T18:57:45Z,http://archive.md/20230503071117/https://www.faz.net/aktuell/finanzen/sorgen-um-finanzstabilitaet-sind-stresstest-fuer-bankenaufseher-18863759.html,"Die Finanzmärkte haben am Dienstag nach einem weiteren Wochenende, an dem eine in Schieflage geratene Bank aufgefangen worden ist, zunächst gelassen reagiert. Der Notverkauf der First Republic Bank a… [+1762 chars]",,de,'Flucht'
https://www.welt.de/vermischtes/article245120198/Texas-Mutmasslicher-Todesschuetze-nach-Fahndung-unter-Waescheberg-entdeckt.html,https://www.welt.de/vermischtes/article245120198/Texas-Mutmasslicher-Todesschuetze-nach-Fahndung-unter-Waescheberg-entdeckt.html,0,www.welt.de,Todesschütze von Texas unter Wäscheberg entdeckt,"Ein Mann im US-Staat Texas erschießt fünf Nachbarn, ist danach tagelang auf der Flucht. Am Dienstag schnappen ihn die Ermittler - versteckt unter Wäsche in einem Schrank. Der 38-Jährige ist für die Polizei kein Unbekannter.",https://img.welt.de/img/vermischtes/mobile245120220/5251351667-ci16x9-w1200/San-Jacinto-County-Sheriff-Greg-Capers-announces-the-capture-and.jpg,2023-05-03T03:43:19Z,,"Nach einer mehrtägigen Großfahndung ist ein Mann, der in Texas fünf seiner Nachbarn erschossen haben soll, unter einem Berg von Wäsche entdeckt worden. Das teilte das FBI am Dienstagabend (Ortszeit) … [+1344 chars]",,de,'Flucht'
https://www.businessinsider.de/gruenderszene/business/tencent-startup-investments-ling-ge/,https://www.businessinsider.de/gruenderszene/business/tencent-startup-investments-ling-ge/,0,www.businessinsider.de,Diese Tencent-Investorin outet sich als Fan von N26 und Hellofresh – warum sie deutsche Startups besonders interessant findet,"Tencent betreibt Wechat, engagiert sich aber auch als Startup-Investor. Wie Tencent-Investorin Ling Ge auf die aktuelle Krise blickt.",https://cdn.businessinsider.de/wp-content/uploads/2023/04/202304_GS_Artikel_Tencent_1800x1200.jpg?ver=1682616537,2023-05-03T06:00:00Z,,"Der chinesische Tech-Riese Tencent betreibt nicht nur Wechat, sondern ist auch Startup-Investor. Wie Tencent-Investorin Ling Ge auf die aktuelle Krise blickt und was sie an deutschen Firmen schätzt.T… [+13029 chars]",,de,'Krise'
https://www.bild.de/bild-plus/regional/hamburg/hamburg-aktuell/ermittlungen-gegen-putin-unterstuetzer-razzia-auf-origarchen-yacht-im-hamburger-83781208.bild.html,https://www.bild.de/bild-plus/regional/hamburg/hamburg-aktuell/ermittlungen-gegen-putin-unterstuetzer-razzia-auf-origarchen-yacht-im-hamburger-83781208.bild.html,0,www.bild.de,Ermittlungen gegen Putin-Unterstützer - Razzia auf Origarchen-Yacht im Hamburger Hafen,"Finanz-Razzia bei einem von Putins Kriegsunterstützern im Hamburger Hafen.Foto: Igor Kubedinov/TASS via Getty Images , Georg Wendt/dpa","https://images.bild.de/645240c5867b1f3bb971b940/b4bab567f88ade36e81bd1217c2cbd9b,29199489?w=1280",2023-05-03T11:49:48Z,,"Moskau behauptet Ukraine wollte nachts den Kreml bombardieren
Moskau behauptet Ukraine wollte nachts den Kreml bombardieren
Moskau behauptet Ukraine wollte nachts den Kreml bombardieren
Moskau beh… [+428 chars]",,de,'Finanz'
https://www.welt.de/regionales/hamburg/article245131458/SPD-Innenexperten-Wir-brauchen-eine-klare-Trennung-zwischen-Erwerbs-und-Asylmigration.html,https://www.welt.de/regionales/hamburg/article245131458/SPD-Innenexperten-Wir-brauchen-eine-klare-Trennung-zwischen-Erwerbs-und-Asylmigration.html,0,www.welt.de,„Wir brauchen eine klare Trennung zwischen Erwerbs- und Asylmigration“,"Die SPD-Innenexperten von Bund und Ländern appellieren an die EU, das europäische Asylsystem „endlich anständig zu gestalten“. Mit Blick auf überlastete Kommunen müsse sich auf jene Menschen konzentriert werden, die tatsächlich einen Asyl- oder Fluchtgrund ha…",https://img.welt.de/img/newsticker/dpa_nt/infoline_nt/politik_ausland_nt/mobile245107434/3601353497-ci16x9-w1200/Migranten-im-Mittelmeer.jpg,2023-05-03T14:32:49Z,https://web.archive.org/web/20230504000802/https://www.welt.de/regionales/hamburg/article245131458/SPD-Innenexperten-Wir-brauchen-eine-klare-Trennung-zwischen-Erwerbs-und-Asylmigration.html,Erstmals seit der Pandemie sind die innenpolitischen Sprecher der SPD-Fraktionen von Bund und Ländern wieder in Präsenz zusammengekommen in herausfordernden Zeiten. Und so fasste Gastgeber Sören Schu… [+5705 chars],,de,'Flucht'
https://www.zeit.de/news/2023-05/03/rheingau-literatur-preis-111-flaschen-wein-fuer-arno-geiger,https://www.zeit.de/news/2023-05/03/rheingau-literatur-preis-111-flaschen-wein-fuer-arno-geiger,0,www.zeit.de,Auszeichnung: Rheingau Literatur Preis: 111 Flaschen Wein für Arno Geiger,,,2023-05-03T16:31:13Z,,"When browsing with ads:
We collect personal data and also transmit it to third-party providers
 that help us improve and finance our digital content. Some of the information stored on your device, … [+732 chars]",,de,'Preis'
https://www.zeit.de/news/2023-05/04/das-muss-man-wissen-zum-grossen-preis-von-miami,https://www.zeit.de/news/2023-05/04/das-muss-man-wissen-zum-grossen-preis-von-miami,0,www.zeit.de,Formel 1: Das muss man wissen zum Großen Preis von Miami,,,2023-05-04T05:18:15Z,,"When browsing with ads:
We collect personal data and also transmit it to third-party providers
 that help us improve and finance our digital content. Some of the information stored on your device, … [+732 chars]",,de,'Preis'
https://www.focus.de/politik/ausland/ukraine-krieg-im-ticker-berichte-selenskyj-trifft-ueberraschend-zu-besuch-in-niederlanden-ein_id_57275780.html,https://www.focus.de/politik/ausland/ukraine-krieg-im-ticker-berichte-selenskyj-trifft-ueberraschend-zu-besuch-in-niederlanden-ein_id_57275780.html,0,www.focus.de,Ukraine-Krieg - Stimmen und Entwicklungen - Berichte: Selenskyj trifft überraschend zu Besuch in Niederlanden ein,"Selenskyj ist überraschend zu Besuch in Niederlanden eingetroffen. Russland wirft der Ukraine vor, mit Drohnen den Kreml attackiert zu haben. Der ukrainische Präsident Wolodymyr Selenskyj kommt im Mai auf Einladung von Olaf Scholz nach Berlin. Alle aktuellen …",https://p6.focus.de/img/politik/ausland/id_192831220/der-ukrainische-praesident-wolodymyr-selenskyj-reist-nach-seinem-besuch-im-finnischen-helsinki-weiter-in-die-niederlande..jpg?im=Crop%3D%280%2C0%2C2048%2C1024%29%3BResize%3D%281200%2C627%29&hash=e8a69fe3d7214faf9217cc4965a80273a67067eceb830960323cafaf09c3272d,2023-05-04T05:34:47Z,https://web.archive.org/web/20230504073634/https://www.focus.de/politik/ausland/ukraine-krieg-im-ticker-berichte-selenskyj-trifft-ueberraschend-zu-besuch-in-niederlanden-ein_id_57275780.html,"Selenskyj ist überraschend zu Besuch in Niederlanden eingetroffen. Russland wirft der Ukraine vor, mit Drohnen den Kreml attackiert zu haben. Der ukrainische Präsident Wolodymyr Selenskyj kommt im Ma… [+12874 chars]",,de,'Ukraine'
https://consent.google.com/ml?continue=https://news.google.com/rss/articles/CBMiiAFodHRwczovL3d3dy5mci5kZS9wb2xpdGlrL3VrcmFpbmUta3JpZWctZ2VnZW5vZmZlbnNpdmUtcnVzc2xhbmQtZ2VmZWNodGUtYW5ncmlmZi1raWV3LXNlbGVuc2t5ai1wdXRpbi1jaGF0LXNvbGRhdC1taWxpdGFlci05MjI1MzQ3OC5odG1s0gEA?oc%3D5&gl=FR&hl=en-US&cm=2&pc=n&src=1,https://consent.google.com/ml?continue=https://news.google.com/rss/articles/CBMiiAFodHRwczovL3d3dy5mci5kZS9wb2xpdGlrL3VrcmFpbmUta3JpZWctZ2VnZW5vZmZlbnNpdmUtcnVzc2xhbmQtZ2VmZWNodGUtYW5ncmlmZi1raWV3LXNlbGVuc2t5ai1wdXRpbi1jaGF0LXNvbGRhdC1taWxpdGFlci05MjI1MzQ3OC5odG1s0gEA?oc%3D5&gl=FR&hl=en-US&cm=2&pc=n&src=1,0,consent.google.com,Sorgen vor Ukraine-Gegenoffensive: Chat von Soldat offenbart drei Probleme - fr.de,"<ol><li>Sorgen vor Ukraine-Gegenoffensive: Chat von Soldat offenbart drei Probleme  fr.de
</li><li>Ein unsichtbarer Feind verhindert die Gegenoffensive der Ukraine  FOCUS Online
</li><li>Ukraine-Krieg: Frühjahrsoffensive kommt später – Das ist der Grund  Be…",,2023-05-04T05:37:00Z,,"We use cookies and data to<ul><li>Deliver and maintain Google services</li><li>Track outages and protect against spam, fraud, and abuse</li><li>Measure audience engagement and site statistics to unde… [+1131 chars]",,de,'Ukraine'
https://www.welt.de/politik/ausland/article245139280/Ukraine-News-Wieder-brennt-ein-russisches-Treibstoff-Lager-Bericht-ueber-Drohnenangriff.html,https://www.welt.de/politik/ausland/article245139280/Ukraine-News-Wieder-brennt-ein-russisches-Treibstoff-Lager-Bericht-ueber-Drohnenangriff.html,0,www.welt.de,Wieder brennt ein russisches Treibstoff-Lager – Bericht über Drohnenangriff,In einem Tanklager im Süden Russlands ist ein Brand ausgebrochen – die russische Staatsagentur Tass berichtete von einem Drohnenangriff. Unterdessen besucht der ukrainische Präsident Wolodymyr Selenskyj überraschend die Niederlande. Mehr im Liveticker.,https://img.welt.de/img/politik/ausland/mobile245139570/0831355467-ci16x9-w1200/Oil-depot-on-fire-in-Russia-s-Krasnodar-Region.jpg,2023-05-04T05:45:00Z,,"Im Süden Russlands ist zum zweiten Mal binnen kurzer Zeit ein Großbrand in einem Tanklager nahe der Halbinsel Krim ausgebrochen. Das Feuer sei durch einen Drohnenangriff ausgelöst worden, berichtete … [+9448 chars]",,de,'Ukraine'
https://www.welt.de/politik/ausland/video245139730/Krieg-in-der-Ukraine-Selenskyj-besucht-die-Niederlande-und-dementiert-Drohnenangriff-auf-Kreml.html,https://www.welt.de/politik/ausland/video245139730/Krieg-in-der-Ukraine-Selenskyj-besucht-die-Niederlande-und-dementiert-Drohnenangriff-auf-Kreml.html,0,www.welt.de,Selenskyj besucht die Niederlande – und dementiert Drohnenangriff auf Kreml,Überraschend besucht der ukrainische Präsident Wolodymyr Selenskyj die Niederlande. Das Land unterstützt die Ukraine militärisch. Unterdessen werfen sich Kiew und Moskau gegenseitig eine Beteiligung an der Drohnenattacke auf den Kreml vor.,https://img.welt.de/img/incoming/mobile245139724/2861359407-ci16x9-w1200/406892182-jpg.jpg,2023-05-04T05:59:04Z,,"Die WELT als ePaper: Die vollständige Ausgabe steht Ihnen bereits am Vorabend zur Verfügung so sind Sie immer hochaktuell informiert. Weitere Informationen: http://epaper.welt.de 
 Der Kurz-Link die… [+49 chars]",,de,'Ukraine'
https://www.morgenpost.de/wirtschaft/article238275457/heizoelpreise-aktuell-heute-4-mai-heizung-deutschland-heizen.html,https://www.morgenpost.de/wirtschaft/article238275457/heizoelpreise-aktuell-heute-4-mai-heizung-deutschland-heizen.html,0,www.morgenpost.de,Heizöl: Heizölpreise aktuell am 4. Mai: Das kostet Heizöl heute,Wie entwickeln sich die Heizölpreise in Deutschland? ○ Bahnen sich Preissprünge an? ○ Über die Preise für Heizöl am 4. Mai informieren wir Sie hier.,https://img.morgenpost.de/img/wohnen/crop237344583/2082606894-w820-cv16_9-q85/OElheizung.jpg,2023-05-04T06:00:00Z,,Berlin. Die Energiepreise in Deutschland sind seit der Energiekrise 2022 für viele Verbraucherinnen und Verbraucher von überragender Bedeutung. Besondere Nachfrage besteht bei Heizöl und Holzpellets.… [+6978 chars],,de,'Ukraine'
https://www.stern.de/politik/ausland/ukraine-news--selenskyj-ueberraschend-in-den-niederlanden-33434796.html,https://www.stern.de/politik/ausland/ukraine-news--selenskyj-ueberraschend-in-den-niederlanden-33434796.html,0,www.stern.de,Krieg in der Ukraine: Selenskyj überraschend in den Niederlanden – weiterer Großbrand in russischem Tanklager,Wagner-Chef: Ukrainische Gegenoffensive hat begonnen +++ Gericht entscheidet über Schröder-Klage +++ Selenskyj zu Besuch in Den Haag +++ Die Meldungen zum Krieg in der Ukraine im stern-Newsblog.,https://image.stern.de/33435000/t/FW/v2/w1440/r1.7778/-/selenskyj-und-rutte.jpg,2023-05-04T06:01:00Z,,"Zugang zu allen STERN PLUS-Inhalten und Artikeln aus dem Print-Magazin
werbefrei &amp; jederzeit kündbar
Bereits registriert?
Hier anmelden",,de,'Ukraine'
https://consent.google.com/ml?continue=https://news.google.com/rss/articles/CBMigwFodHRwczovL3d3dy53ZWx0LmRlL3BvbGl0aWsvYXVzbGFuZC9wbHVzMjQ1MTM4MDk4L0Ryb2huZW5hbmdyaWZmLWluLU1vc2thdS1XZXItaGludGVyLWRpZXNlci1EZW11ZXRpZ3VuZy1mdWVyLWRlbi1LcmVtbC1zdGVja3QuaHRtbNIBAA?oc%3D5%26hl%3Den-CA%26gl%3DCA%26ceid%3DCA:en&gl=FR&hl=en-CA&cm=2&pc=n&src=1,https://consent.google.com/ml?continue=https://news.google.com/rss/articles/CBMigwFodHRwczovL3d3dy53ZWx0LmRlL3BvbGl0aWsvYXVzbGFuZC9wbHVzMjQ1MTM4MDk4L0Ryb2huZW5hbmdyaWZmLWluLU1vc2thdS1XZXItaGludGVyLWRpZXNlci1EZW11ZXRpZ3VuZy1mdWVyLWRlbi1LcmVtbC1zdGVja3QuaHRtbNIBAA?oc%3D5%26hl%3Den-CA%26gl%3DCA%26ceid%3DCA:en&gl=FR&hl=en-CA&cm=2&pc=n&src=1,0,consent.google.com,Drohnenangriff in Moskau: Wer hinter dieser Demütigung für den Kreml steckt - WELT,"<ol><li>Drohnenangriff in Moskau: Wer hinter dieser Demütigung für den Kreml steckt  WELT
</li><li>Kreml: Ukraine wollte Putin töten – Angeblicher Drohnen-Angriff | Politik  BILD
</li><li>Video soll Drohnen-Angriff auf Kreml zeigen  FOCUS Online
</li><li>A…",,2023-05-04T06:02:13Z,,"We use cookies and data to<ul><li>Deliver and maintain Google services</li><li>Track outages and protect against spam, fraud, and abuse</li><li>Measure audience engagement and site statistics to unde… [+1131 chars]",,de,'Ukraine'
https://www.welt.de/politik/deutschland/article245139530/Joachim-Gauck-kritisiert-Altkanzler-Schroeder-wegen-Russland.html,https://www.welt.de/politik/deutschland/article245139530/Joachim-Gauck-kritisiert-Altkanzler-Schroeder-wegen-Russland.html,0,www.welt.de,„Einfach unerträglich“ – Gauck kritisiert Altkanzler Schröder wegen Russland-Verbindungen,"Gerhard Schröder lässt den früheren Bundespräsidenten Joachim Gauck nach eigener Aussage traurig werden. Es sei „inakzeptabel, wie der Ex-Kanzler das Ansehen Deutschlands seinen Privatinteressen untergeordnet hat“. Unterdessen wehrt sich Schröder gegen den En…",https://img.welt.de/img/politik/deutschland/mobile245139664/1021356687-ci16x9-w1200/Staatsakt-fuer-Hans-Koschnick.jpg,2023-05-04T06:08:22Z,,"Der frühere Bundespräsident Joachim Gauck hat Altkanzler Gerhard Schröder und dessen Verbindungen zu Russland scharf kritisiert. Wenn ich an die Figur von Gerhard Schröder denke, macht mich das traur… [+3664 chars]",,de,'Ukraine'
https://oe3.orf.at/stories/3033417/,https://oe3.orf.at/stories/3033417/,0,oe3.orf.at,Finnische Zeitung nutzt Online-Spiel zur Umgehung von russischer Zensur,"<ul><li>Ausländische unabhängige Medien werden im russischen Internet zensiert und sind nicht abrufbar.</li><li>Im Spiel Counterstrike hat die Zeitung jetzt eine Möglichkeit gefunden, Berichte und Fotos ihrer KorrespondentInnen über den Krieg in der Ukraine  …",https://tubestatic.orf.at/static/images/site/tube/20230518/counter-strike.5996376.jpg,2023-05-04T06:13:00Z,,"<ul><li>Ausländische unabhängige Medien werden im russischen Internet zensiert und sind nicht abrufbar.</li><li>Im Spiel Counterstrike hat die Zeitung jetzt eine Möglichkeit gefunden, Berichte und Fo… [+1961 chars]",,de,'Ukraine'
https://taz.de/Russlands-Angriffskrieg/!5932223/,https://taz.de/Russlands-Angriffskrieg/!5932223/,0,taz.de,Russlands Angriffskrieg: Ukraine spricht von „Ra­schis­mus“,Die Ukraine führt einen offiziellen Begriff für Russlands Kriegsideologie ein. Die Resolution ist auch an die internationale Gemeinschaft gerichtet.,https://taz.de/picture/6243445/948/32736346-1.jpeg,2023-05-04T06:17:00Z,,"Die Ukraine führt einen offiziellen Begriff für Russlands Kriegsideologie ein. Die Resolution ist auch an die internationale Gemeinschaft gerichtet.
Werbeplakat der russischen Regierung in Moskau um… [+3369 chars]",,de,'Russland'
https://orf.at/stories/3314954/,https://orf.at/stories/3314954/,0,orf.at,Moskau meldet neuen Angriff auf Tanklager,"Im Süden Russlands ist zum zweiten Mal binnen kurzer Zeit ein Großbrand in einem Tanklager nahe der Halbinsel Krim ausgebrochen. Das Feuer sei durch einen Drohnenangriff ausgelöst worden, berichtete die russische Staatsagentur TASS Donnerstagfrüh. Getroffen w…",https://ibs.orf.at/news?image=https%3A%2F%2Fassets.orf.at%2Fmims%2F2023%2F18%2F32%2Fcrops%2Fw%3D1200%2Ch%3D630%2Cq%3D75%2F1776117_master_659832_ukraine_russland_raffinierie_brand_body_im.jpg%3Fs%3D13b26d652ae504682f1a389414e0dadc53a80b32,2023-05-04T06:23:01Z,https://web.archive.org/web/20230504081715/https://orf.at/stories/3314954/,"In der Nacht auf Mittwoch war es zu einem ähnlichen Vorfall in der rund 50 Kilometer entfernten Siedlung Wolna im Bezirk Taman gekommen, der ebenfalls in der südrussischen Region Krasnodar liegt. Auc… [+5700 chars]",,de,'Ukraine'
