index,url,valid,domain,title,description,image,published,archive,content,quote,language,keyword
https://www.welt.de/regionales/hamburg/article255948270/Zoll-Illegale-Pyrotechnik-mit-insgesamt-140-Kilogramm-Sprengstoff-bei-Mann-in-Hamburg-sichergestellt.html,https://www.welt.de/regionales/hamburg/article255948270/Zoll-Illegale-Pyrotechnik-mit-insgesamt-140-Kilogramm-Sprengstoff-bei-Mann-in-Hamburg-sichergestellt.html,0,www.welt.de,Illegale Pyrotechnik mit insgesamt 140 Kilogramm Sprengstoff bei Mann in Hamburg sichergestellt,Ermittler des Zolls haben bei einem Hamburger neben 140 Kilo Sprengstoff auch Waffen und Marihuana gefunden. Den entscheidenden Hinweis lieferte ein bestelltes Paket.,https://img.welt.de/img/regionales/hamburg/mobile255948268/2667934647-ci16x9-w1200/Image-67fe62483ceb7108c4926d2d.jpg,2025-04-15T14:05:49Z,https://web.archive.org/web/20250415145652/https://www.welt.de/regionales/hamburg/article255948270/Zoll-Illegale-Pyrotechnik-mit-insgesamt-140-Kilogramm-Sprengstoff-bei-Mann-in-Hamburg-sichergestellt.html,Ermittler des Zolls haben bei einem Hamburger neben 140 Kilo Sprengstoff auch Waffen und Marihuana gefunden. Den entscheidenden Hinweis lieferte ein bestelltes Paket.Zollfahnder haben in Hamburg Pyro… [+761 chars],,de,'Waffen'
https://www.stern.de/gesellschaft/regional/baden-wuerttemberg/unfall--bei-unfallfahrt-auf-friedhof-rund-50-graeber-beschaedigt-35643664.html,https://www.stern.de/gesellschaft/regional/baden-wuerttemberg/unfall--bei-unfallfahrt-auf-friedhof-rund-50-graeber-beschaedigt-35643664.html,0,www.stern.de,Unfall: Bei Unfallfahrt auf Friedhof rund 50 Gräber beschädigt,"Ein Mann gibt unvermittelt Gas, er verliert die Kontrolle über sein Auto und landet mitten in einem Grabfeld. Dutzende Gräber werden beschädigt. Nun muss die Frage nach dem Schaden geklärt werden.",https://image.stern.de/35643666/t/iP/v1/w1440/r1.7778/-/15--alpjlazjt4v1axs2048jpeg---d537c187d851a3bf.jpg,2025-04-15T14:10:50Z,,"Kopiere den aktuellen Link
Zur Merkliste hinzufügen
Ein Mann gibt unvermittelt Gas, er verliert die Kontrolle über sein Auto und landet mitten in einem Grabfeld. Dutzende Gräber werden beschädigt. … [+843 chars]",,de,'Gas'
https://www.tagesschau.de/ausland/afrika/sudan-konferenz-hilfen-100.html,https://www.tagesschau.de/ausland/afrika/sudan-konferenz-hilfen-100.html,0,www.tagesschau.de,EU und Großbritannien stocken Sudan-Hilfe auf,"Im Sudan herrscht seit zwei Jahren Krieg, der eine der schwerwiegendsten humanitären Krisen der Gegenwart ausgelöst hat. Auf einer Konferenz in London haben nun mehrere Staaten mehr Hilfen zugesagt.",https://images.tagesschau.de/image/0a91f39b-b63e-4352-9a16-8789b8b60fdb/AAABljr8Lf8/AAABkZLhkrw/16x9-1280/sudan-konferenz-london-100.jpg,2025-04-15T19:45:28Z,https://web.archive.org/web/20250415195930/https://www.tagesschau.de/ausland/afrika/sudan-konferenz-hilfen-100.html,"Stand: 15.04.2025 21:45 Uhr
Im Sudan herrscht seit zwei Jahren Krieg, der eine der schwerwiegendsten humanitären Krisen der Gegenwart ausgelöst hat. Auf einer Konferenz in London haben nun mehrere S… [+2361 chars]",,de,'Waffen'
https://www.zeit.de/news/2025-04/15/selenskyj-nur-wir-duerfen-ueber-grenzen-der-ukraine-reden,https://www.zeit.de/news/2025-04/15/selenskyj-nur-wir-duerfen-ueber-grenzen-der-ukraine-reden,0,www.zeit.de,Russischer Angriffskrieg: Selenskyj: Nur wir dürfen über Grenzen der Ukraine reden,Hier finden Sie Informationen zu dem Thema „Russischer Angriffskrieg“. Lesen Sie jetzt „Selenskyj: Nur wir dürfen über Grenzen der Ukraine reden“.,https://img.zeit.de/news/2025-04/15/selenskyj-nur-wir-duerfen-ueber-grenzen-der-ukraine-reden-image-group/wide__1300x731,2025-04-15T20:09:53Z,,Der ukrainische Präsident Wolodymyr Selenskyj hat die US-Unterhändler in den Gesprächen mit Russland vor unzulässigen Zugeständnissen bei den besetzten Gebieten der Ukraine gewarnt. «Alle Territorien… [+1483 chars],,de,'Ukraine'
https://www.nzz.ch/feuilleton/in-der-russischen-stadt-jekaterinburg-wird-die-nachbildung-einer-pipeline-gefeiert-es-sollen-kreuzzuege-durch-das-rohr-fuehren-und-babys-darin-getauft-werden-ld.1880352,https://www.nzz.ch/feuilleton/in-der-russischen-stadt-jekaterinburg-wird-die-nachbildung-einer-pipeline-gefeiert-es-sollen-kreuzzuege-durch-das-rohr-fuehren-und-babys-darin-getauft-werden-ld.1880352,0,www.nzz.ch,Der patriotische Wahnsinn: In der russischen Stadt Jekaterinburg wird die Nachbildung einer Gaspipeline gefeiert. Es sollen Kreuzzüge durch das Rohr führen und Babys darin getauft werden,"Ein Rohr, durch das russische Soldaten krochen, wird nun bei der Kathedrale in Jekaterinburg ausgestellt. Die Autorin Irina Rastorgujewa schreibt, dass sich die russisch-orthodoxe Kirche vom Christentum entferne, um der Staatspropaganda zu dienen.","https://img.nzz.ch/2025/04/15/003011ed-27ee-4a75-9ab1-57c4f623486d.jpeg?width=1200&height=674&fit=bounds&quality=75&auto=webp&crop=2946,1657,x0,y0&wmark=nzz",2025-04-16T03:30:00Z,http://archive.md/20250416042241/https://www.nzz.ch/feuilleton/in-der-russischen-stadt-jekaterinburg-wird-die-nachbildung-einer-pipeline-gefeiert-es-sollen-kreuzzuege-durch-das-rohr-fuehren-und-babys-darin-getauft-werden-ld.1880352,"Bei der Jekaterinburger Kathedrale «auf dem Blut» wurde der Nachbau eines Stückes Gaspipeline ausgestellt. Als Mahnmal für Wahnsinn oder Mut.
Der politische Symbolismus hat in Russland eine neue Pha… [+7387 chars]",,de,'Gas'
https://www.nzz.ch/feuilleton/mussorgsky-chowanschtschina-in-salzburg-und-genf-das-kontinuum-der-russischen-geschichte-wird-fortgeschrieben-ld.1880257,https://www.nzz.ch/feuilleton/mussorgsky-chowanschtschina-in-salzburg-und-genf-das-kontinuum-der-russischen-geschichte-wird-fortgeschrieben-ld.1880257,0,www.nzz.ch,Das Kontinuum der russischen Geschichte wird fortgeschrieben,Die Salzburger Osterfestspiele und das Grand Théâtre in Genf zeigen Neuproduktionen von Mussorgskys politisch brisantestem Werk: «Chowanschtschina» ist die Oper der Stunde. Was aber hat sie mit dem heutigen Russland zu tun?,"https://img.nzz.ch/2025/04/15/b913e8fa-a5fb-4b8d-8387-208f20d40dc2.jpeg?width=1200&height=675&fit=bounds&quality=75&auto=webp&crop=4444,2500,x420,y313&wmark=nzz",2025-04-16T03:30:00Z,http://archive.md/20250416061703/https://www.nzz.ch/feuilleton/mussorgsky-chowanschtschina-in-salzburg-und-genf-das-kontinuum-der-russischen-geschichte-wird-fortgeschrieben-ld.1880257,"Calixto Bieito zeigt in «Chowanschtschina» am Grand Théâtre de Genève ein düsteres Russland.
Niemand hat die Tragödie Russlands zwingender in Klang übersetzt als dieser Komponist. Ein glockenartiges… [+6739 chars]",,de,'Gas'
https://www.zeit.de/news/2025-04/16/mann-bei-angriff-in-guestrow-schwer-verletzt,https://www.zeit.de/news/2025-04/16/mann-bei-angriff-in-guestrow-schwer-verletzt,0,www.zeit.de,Kriminalität: Mann bei Angriff in Güstrow schwer verletzt,Hier finden Sie Informationen zu dem Thema „Kriminalität“. Lesen Sie jetzt „Mann bei Angriff in Güstrow schwer verletzt“.,https://img.zeit.de/news/2025-04/16/mann-bei-angriff-in-guestrow-schwer-verletzt-image-group/wide__1300x731,2025-04-16T06:12:23Z,,"Ein 27-Jähriger ist bei einer Auseinandersetzung in Güstrow (Landkreis Rostock) schwer verletzt worden. Wie die Polizei mitteilte, war der Mann am späten Dienstagabend gemeinsam mit einem 24-jährigen… [+514 chars]",,de,'Angriff'
https://www.diepresse.com/19586756/brand-gas-unfall-alle-feuerwehrleute-in-wiener-neustadt-gleichzeitig-ausgerueckt,https://www.diepresse.com/19586756/brand-gas-unfall-alle-feuerwehrleute-in-wiener-neustadt-gleichzeitig-ausgerueckt,0,www.diepresse.com,"Brand, Gas, Unfall: Alle Feuerwehrleute in Wiener Neustadt gleichzeitig ausgerückt",Ein Einfamilienhaus stand im Vollbrand. Kurz darauf wurden ein Gas-Geruch sowie ein Verkehrsunfall gemeldet. Die Feuerwehr stieß an ihre Grenzen.,https://img.diepresse.com/public/panorama/c8djx2-Feuerwehr.jpg/alternates/DPR_SOCIAL_NACHRICHTEN/Feuerwehr.jpg,2025-04-16T06:52:12Z,,"Ein Einfamilienhaus stand im Vollbrand. Kurz darauf wurden ein Gas-Geruch sowie ein Verkehrsunfall gemeldet. Die Feuerwehr stieß an ihre Grenzen.
In Wiener Neustadt sind am Dienstagabend alle verfüg… [+2325 chars]",,de,'Gas'
https://www.zeit.de/news/2025-04/16/klimawandel-beeintraechtigt-weinproduktion-weltweit,https://www.zeit.de/news/2025-04/16/klimawandel-beeintraechtigt-weinproduktion-weltweit,0,www.zeit.de,Extreme Wetterereignisse: Klimawandel beeinträchtigt Weinproduktion weltweit,Hier finden Sie Informationen zu dem Thema „Extreme Wetterereignisse“. Lesen Sie jetzt „Klimawandel beeinträchtigt Weinproduktion weltweit“.,https://img.zeit.de/news/2025-04/16/klimawandel-beeintraechtigt-weinproduktion-weltweit-image-group/wide__1300x731,2025-04-16T07:25:35Z,http://archive.md/20250416074131/https://www.zeit.de/news/2025-04/16/klimawandel-beeintraechtigt-weinproduktion-weltweit,"Die weltweite Weinerzeugung ist 2024 nach Branchenangaben wegen extremer Witterungseinflüsse auf den niedrigsten Stand seit über 60 Jahren gesunken. Die Erzeugung sank auf 225,8 Millionen Hektoliter,… [+2410 chars]",,de,'Klima'
https://www.zeit.de/wirtschaft/2025-04/agrarpolitik-schwarz-rot-landwirtschaft-koalitionsvertrag-nachhaltigkeit,https://www.zeit.de/wirtschaft/2025-04/agrarpolitik-schwarz-rot-landwirtschaft-koalitionsvertrag-nachhaltigkeit,0,www.zeit.de,Agrarpolitik von Schwarz-rot: Wie Schwarz-Rot den Umwelt-Rollback plant,"Die neue Regierung reimt sich eine abenteuerliche Strategie im Agrarbereich zusammen. Das ist auch ökonomisch ruinös, warnt unser Gastautor. Diskutieren Sie mit ihm.",https://img.zeit.de/wirtschaft/2025-04/agrarpolitik-schwarz-rot-landwirtschaft-koalitionsvertrag-nachhaltigkeit-bild/wide__1300x731,2025-04-16T08:15:11Z,http://archive.md/20250416081702/https://www.zeit.de/wirtschaft/2025-04/agrarpolitik-schwarz-rot-landwirtschaft-koalitionsvertrag-nachhaltigkeit,"Felix
Ekardt forscht als Leiter der Leipziger
Forschungsstelle Nachhaltigkeit und Klimapolitik sowie Professor an der Uni
Rostock zu Politikkonzepten für mehr Nachhaltigkeit. Er sucht anlässlich
… [+7159 chars]",,de,'Wladimir Putin'
https://www.zeit.de/news/2025-04/16/miersch-zu-taurus-lieferung-entscheidung-gemeinsam-treffen,https://www.zeit.de/news/2025-04/16/miersch-zu-taurus-lieferung-entscheidung-gemeinsam-treffen,0,www.zeit.de,Ukraine-Krieg: Miersch zu Taurus-Lieferung: Entscheidung gemeinsam treffen,Hier finden Sie Informationen zu dem Thema „Ukraine-Krieg“. Lesen Sie jetzt „Miersch zu Taurus-Lieferung: Entscheidung gemeinsam treffen“.,https://img.zeit.de/news/2025-04/16/miersch-zu-taurus-lieferung-entscheidung-gemeinsam-treffen-image-group/wide__1300x731,2025-04-16T08:23:19Z,http://archive.md/20250416141119/https://www.zeit.de/news/2025-04/16/miersch-zu-taurus-lieferung-entscheidung-gemeinsam-treffen,In der Debatte um eine Lieferung von Taurus-Marschflugkörpern an die Ukraine hat SPD-Generalsekretär Matthias Miersch eine gemeinsame Entscheidung der absehbaren schwarz-roten Koalition gefordert. De… [+1941 chars],,de,'Waffen'
https://www.zeit.de/news/2025-04/16/energiepreise-treiben-sachsens-inflation-ueber-bundesschnitt,https://www.zeit.de/news/2025-04/16/energiepreise-treiben-sachsens-inflation-ueber-bundesschnitt,0,www.zeit.de,Inflation: Energiepreise treiben Sachsens Inflation über Bundesschnitt,Hier finden Sie Informationen zu dem Thema „Inflation“. Lesen Sie jetzt „Energiepreise treiben Sachsens Inflation über Bundesschnitt“.,https://img.zeit.de/news/2025-04/16/energiepreise-treiben-sachsens-inflation-ueber-bundesschnitt-image-group/wide__1300x731,2025-04-16T09:06:33Z,,"Für Menschen in Sachsen ist das Leben in den vergangenen zwei Jahren teurer geworden als im Rest der Republik. Hauptursache für die höhere Inflationsrate seien kräftigere Preissteigerungen bei Strom,… [+1123 chars]",,de,'Gas'
https://www.stern.de/gesellschaft/regional/sachsen/inflation--energiepreise-treiben-sachsens-inflation-ueber-bundesschnitt-35645564.html,https://www.stern.de/gesellschaft/regional/sachsen/inflation--energiepreise-treiben-sachsens-inflation-ueber-bundesschnitt-35645564.html,0,www.stern.de,Inflation: Energiepreise treiben Sachsens Inflation über Bundesschnitt,Dresden (sn) - Für Menschen in Sachsen ist das Leben in den vergangenen zwei Jahren teurer geworden als im Rest der Republik. Hauptursache für die höhere,https://image.stern.de/35645566/t/6J/v1/w1440/r1.7778/-/16--2byqkishfgv14axs2048jpeg---be8724e95f657622.jpg,2025-04-16T09:06:33Z,,"Kopiere den aktuellen Link
Zur Merkliste hinzufügen
In Sachsen steigen die Verbraucherpreise stärker als im Rest der Republik. Das belastet Haushalte seit Monaten überdurchschnittlich.
Für Mensche… [+1272 chars]",,de,'Gas'
https://www.faz.net/aktuell/wirtschaft/mehr-wirtschaft/wie-trump-asiens-superstar-vietnam-in-die-krise-stuerzt-110421389.html,https://www.faz.net/aktuell/wirtschaft/mehr-wirtschaft/wie-trump-asiens-superstar-vietnam-in-die-krise-stuerzt-110421389.html,0,www.faz.net,Wie Trump Asiens Superstar Vietnam in die Krise stürzt,"Ausgerechnet Donald Trump hat Vietnam zur aufstrebenden Wirtschaftsnation in Asien gemacht. Mit seinem Strafzoll zieht er das Land nun in den Abgrund. Die, die es trifft, können es kaum fassen.",https://media0.faz.net/ppmedia/aktuell/wirtschaft/1786170859/1.10421386/facebook_teaser_fplus/die-textilproduktion-ist-in.jpg,2025-04-16T09:37:35Z,http://archive.md/20250416094134/https://www.faz.net/aktuell/wirtschaft/mehr-wirtschaft/wie-trump-asiens-superstar-vietnam-in-die-krise-stuerzt-110421389.html,"Es ist natürlich nur Zufall, dass in Ho-Chi-Minh-Stadt die Rückfahrt von der Textilmesse am Mekong entlanggeht, an dessen Ufer die Regierung vor roten Fahnen eine Reihe Geschütze aufgebaut hat. Am 30… [+243 chars]",,de,'Krise'
https://www.bild.de/politik/inland/nach-ankuendigung-von-cdu-chef-merz-jetzt-haengt-alles-am-co2-preis-67fe1d8e3ceb7108c4923670,https://www.bild.de/politik/inland/nach-ankuendigung-von-cdu-chef-merz-jetzt-haengt-alles-am-co2-preis-67fe1d8e3ceb7108c4923670,0,www.bild.de,"Heizen, Tanken, Wohnen - Jetzt hängt alles am CO2-Preis","„Es wird zunächst einmal für alle teurer“, kündigte CDU-Chef Friedrich Merz am Sonntag bei „Caren Miosga“ an.","https://images.bild.de/67fe1d8e3ceb7108c4923670/161a324ed35e7c0e09431692718e13be,8af65ba?w=1280",2025-04-16T11:03:56Z,http://archive.md/20250416114851/https://www.bild.de/politik/inland/nach-ankuendigung-von-cdu-chef-merz-jetzt-haengt-alles-am-co2-preis-67fe1d8e3ceb7108c4923670,"Es wird zunächst einmal für alle teurer, kündigte CDU-Chef Friedrich Merz am Sonntag bei Caren Miosga an. Gemeint: der weiter steigende CO-Preis, der die Bürger beim Tanken und Heizen trifft.
Für Me… [+2363 chars]",,de,'Heizen'
https://www.zeit.de/news/2025-04/16/bn-zu-geplanter-jagdgesetz-reform-angriff-auf-artenschutz,https://www.zeit.de/news/2025-04/16/bn-zu-geplanter-jagdgesetz-reform-angriff-auf-artenschutz,0,www.zeit.de,Naturschutz: BN zu geplanter Jagdgesetz-Reform: Angriff auf Artenschutz,Hier finden Sie Informationen zu dem Thema „Naturschutz“. Lesen Sie jetzt „BN zu geplanter Jagdgesetz-Reform: Angriff auf Artenschutz“.,https://img.zeit.de/news/2025-04/16/bn-zu-geplanter-jagdgesetz-reform-angriff-auf-artenschutz-image-group/wide__1300x731,2025-04-16T13:08:46Z,,Der Bund Naturschutz (BN) sieht in der vom bayerischen Wirtschaftsministerium vorgesehenen Novelle des Jagdgesetzes einen Generalangriff auf geschützte Arten im Freistaat und will die Umsetzung verhi… [+2141 chars],,de,'Angriff'
https://www.zeit.de/news/2025-04/16/thueringer-afd-mitglieder-haben-154-waffen,https://www.zeit.de/news/2025-04/16/thueringer-afd-mitglieder-haben-154-waffen,0,www.zeit.de,Parteien: Thüringer AfD-Mitglieder haben 154 Waffen,Hier finden Sie Informationen zu dem Thema „Parteien“. Lesen Sie jetzt „Thüringer AfD-Mitglieder haben 154 Waffen“.,https://img.zeit.de/news/2025-04/16/thueringer-afd-mitglieder-haben-154-waffen-image-group/wide__1300x731,2025-04-16T14:04:24Z,https://web.archive.org/web/20250417072123/https://www.zeit.de/news/2025-04/16/thueringer-afd-mitglieder-haben-154-waffen,"Bei der Thüringer AfD besitzen 34 Parteimitglieder insgesamt 154 Schusswaffen. Das geht aus einer Antwort des Innenministeriums auf eine Anfrage der Linke-Abgeordneten Katharina König-Preuss hervor, … [+1277 chars]",,de,'Waffen'
https://www.zeit.de/news/2025-04/16/17-verletzte-bei-angriff-in-weissenfelser-discounter,https://www.zeit.de/news/2025-04/16/17-verletzte-bei-angriff-in-weissenfelser-discounter,0,www.zeit.de,Kriminalität: 17 Verletzte bei Angriff in Weißenfelser Discounter,Hier finden Sie Informationen zu dem Thema „Kriminalität“. Lesen Sie jetzt „17 Verletzte bei Angriff in Weißenfelser Discounter“.,https://img.zeit.de/news/2025-04/16/17-verletzte-bei-angriff-in-weissenfelser-discounter-image-group/wide__1300x731,2025-04-16T14:59:42Z,,"In einem Discounter in Weißenfels im Burgendlandkreis hat ein 33-Jähriger 17 Personen mit einem Reizstoffspray verletzt. Der Mann sei beobachtet worden, wie er im Laden mehrfach seinen Rucksack geöff… [+312 chars]",,de,'Angriff'
https://www.zeit.de/news/2025-04/16/klebe-attacke-auf-sixtinische-madonna-mildere-strafen,https://www.zeit.de/news/2025-04/16/klebe-attacke-auf-sixtinische-madonna-mildere-strafen,0,www.zeit.de,"Klimaschutzaktivismus: Klebe-Attacke auf ""Sixtinische Madonna"" - Mildere Strafen","Hier finden Sie Informationen zu dem Thema „Klimaschutzaktivismus“. Lesen Sie jetzt „Klebe-Attacke auf ""Sixtinische Madonna"" - Mildere Strafen“.",https://img.zeit.de/news/2025-04/16/klebe-attacke-auf-sixtinische-madonna-mildere-strafen-image-group/wide__1300x731,2025-04-16T16:21:26Z,,Zwei verurteilte Klima-Aktivisten haben nach der Klebe-Attacke auf die «Sixtinische Madonna» in der Dresdner Gemäldegalerie Alte Meister Straferlass erhalten - in einem Berufungsverfahren. Das Landge… [+1177 chars],,de,'Klima'
https://www.welt.de/wirtschaft/article255956872/Letzte-Hochoefen-gerettet-Dieser-Schritt-zeigt-die-Angst-Grossbritanniens-vor-der-Stahl-Krise.html,https://www.welt.de/wirtschaft/article255956872/Letzte-Hochoefen-gerettet-Dieser-Schritt-zeigt-die-Angst-Grossbritanniens-vor-der-Stahl-Krise.html,0,www.welt.de,Dieser Schritt zeigt die britische Angst vor der Stahl-Krise,"Per Notstandsgesetz hat das britische Parlament die letzten beiden Stahl-Hochöfen des Landes gerettet. Es ist ein drastischer Eingriff, den London wählte, um nicht als erstes G-20-Land ohne Neustahl-Produktion dazustehen. Das Gezerre um das Werk belastet auch…",https://img.welt.de/img/wirtschaft/mobile255957356/3687939267-ci16x9-w1200/worker-in-steel-mill.jpg,2025-04-16T17:14:13Z,,"Per Notstandsgesetz hat das britische Parlament die letzten beiden Stahl-Hochöfen des Landes gerettet. Es ist ein drastischer Eingriff, den London wählte, um nicht als erstes G-20-Land ohne Neustahl-… [+8330 chars]",,de,'Krise'
https://www.zeit.de/news/2025-04/16/ukraine-botschafter-kritisiert-kriegs-gedenken-mit-russland,https://www.zeit.de/news/2025-04/16/ukraine-botschafter-kritisiert-kriegs-gedenken-mit-russland,0,www.zeit.de,Kontroverse um Gedenken: Ukraine-Botschafter kritisiert Kriegs-Gedenken mit Russland,Hier finden Sie Informationen zu dem Thema „Kontroverse um Gedenken“. Lesen Sie jetzt „Ukraine-Botschafter kritisiert Kriegs-Gedenken mit Russland“.,https://img.zeit.de/news/2025-04/16/ukraine-botschafter-kritisiert-kriegs-gedenken-mit-russland-image-group/wide__1300x731,2025-04-16T17:19:11Z,https://web.archive.org/web/20250417050416/https://www.zeit.de/news/2025-04/16/ukraine-botschafter-kritisiert-kriegs-gedenken-mit-russland,Der ukrainische Botschafter Oleksii Makeiev hat die Teilnahme des russischen Botschafters Sergej Netschajew an einer Gedenkveranstaltung zum 80. Jahrestag der Schlacht auf den Seelower Höhen scharf k… [+2545 chars],,de,'Wladimir Putin'
https://www.zeit.de/news/2025-04/16/russische-drohnen-treffen-hafenstadt-odessa,https://www.zeit.de/news/2025-04/16/russische-drohnen-treffen-hafenstadt-odessa,0,www.zeit.de,Russischer Angriffskrieg: Kiew: Ukraine stellt 40 Prozent ihrer Waffen selbst her,Hier finden Sie Informationen zu dem Thema „Russischer Angriffskrieg“. Lesen Sie jetzt „Kiew: Ukraine stellt 40 Prozent ihrer Waffen selbst her“.,https://img.zeit.de/news/2025-04/16/russische-drohnen-treffen-hafenstadt-odessa-image-group/wide__1300x731,2025-04-16T19:23:40Z,,Die Ukraine kämpft nach Angaben von Präsident Wolodymyr Selenskyj bei der Abwehr des russischen Angriffskrieges aktuell zu 40 Prozent mit Waffen aus eigener Produktion. «Unsere Verteidigungsindustrie… [+1360 chars],,de,'Angriff'
https://www.faz.net/aktuell/wirtschaft/briten-streiten-ueber-china-strategie-110423521.html,https://www.faz.net/aktuell/wirtschaft/briten-streiten-ueber-china-strategie-110423521.html,0,www.faz.net,China-Konflikt: Britische Stahlindustrie am Scheideweg,Krise von British Steel führt sogar zu „Sabotage“-Vorwürfen. Labour-Politiker fordern die Überprüfung alles Investments in kritischen Industrien.,https://media0.faz.net/ppmedia/aktuell/wirtschaft/3265873490/1.10424090/facebook_teaser/am-stahlwerk-von-british-steel.jpg,2025-04-16T19:33:34Z,http://archive.md/20250417092023/https://www.faz.net/aktuell/wirtschaft/briten-streiten-ueber-china-strategie-110423521.html,Die Krise des Stahlunternehmens British Steel und der offene Konflikt mit dem chinesischen Ei­gentümerkonzern Jingye haben im Vereinigten Königreich eine scharfe De­batte über den Umgang mit Investi­… [+4120 chars],,de,'Krise'
https://www.zeit.de/news/2025-04/16/baseballschlaeger-und-metallstange-angriff-auf-16-jaehrigen,https://www.zeit.de/news/2025-04/16/baseballschlaeger-und-metallstange-angriff-auf-16-jaehrigen,0,www.zeit.de,Kreuzberg: Baseballschläger und Metallstange: Angriff auf 16-Jährigen,Hier finden Sie Informationen zu dem Thema „Kreuzberg“. Lesen Sie jetzt „Baseballschläger und Metallstange: Angriff auf 16-Jährigen“.,https://img.zeit.de/news/2025-04/16/baseballschlaeger-und-metallstange-angriff-auf-16-jaehrigen-image-group/wide__1300x731,2025-04-16T19:39:57Z,,Mit einem Baseballschläger und einer Metallstange soll ein 16-Jähriger von mehreren Angreifern im Böcklerpark in Kreuzberg attackiert worden sein. Er sei am späten Dienstagabend aus einer 10- bis 15-… [+830 chars],,de,'Angriff'
https://www.faz.net/aktuell/politik/ausland/frankreich-und-algerien-schwerste-diplomatische-krise-seit-jahrzehnten-110423206.html,https://www.faz.net/aktuell/politik/ausland/frankreich-und-algerien-schwerste-diplomatische-krise-seit-jahrzehnten-110423206.html,0,www.faz.net,Frankreich und Algerien: Schwerste diplomatische Krise seit Jahrzehnten,"Frankreichs Botschafter hat Algerien verlassen. Das Land habe sich „zur Eskalation entschieden“, sagt Außenminister Jean-Noël Barrot.",https://media1.faz.net/ppmedia/aktuell/1397775883/1.10423445/facebook_teaser_fplus/die-algerische-flagge-weht-an.jpg,2025-04-16T20:03:42Z,http://archive.md/20250416210214/https://www.faz.net/aktuell/politik/ausland/frankreich-und-algerien-schwerste-diplomatische-krise-seit-jahrzehnten-110423206.html,"Der französische Botschafter in Algerien, Stéphane Romatet, hat am Mittwoch auf Geheiß von Präsident Emmanuel Macron das Land verlassen. Der Rückruf ist der vorläufige Höhepunkt der bislang schwerste… [+604 chars]",,de,'Krise'
https://www.telepolis.de/features/Droht-eine-US-Bodenoffensive-im-Jemen-10353908.html,https://www.telepolis.de/features/Droht-eine-US-Bodenoffensive-im-Jemen-10353908.html,0,www.telepolis.de,Droht eine US-Bodenoffensive im Jemen?,Die USA erwägen eine Beteiligung an einer möglichen Bodenoperation gegen die Huthis im Jemen. Dies könnte den seit 2022 bestehenden Waffenstillstand beenden. Ein Gastbeitrag.,https://heise.cloudimg.io/bound/1200x1200/q85.png-lossy-85.webp-lossy-85.foil1/_www-heise-de_/imgs/18/4/8/3/8/6/1/4/shutterstock_2153816285-d4822b5585564146.jpeg,2025-04-16T22:00:00Z,,"Die USA erwägen offenbar, eine Bodenoffensive im Jemen zu unterstützen
(Bild: viper-zero/Shutterstock.com)
Die USA erwägen eine Beteiligung an einer möglichen Bodenoperation gegen die Huthis im Jem… [+5209 chars]",,de,'Krise'
https://www.zeit.de/news/2025-04/17/bundestag-schliesst-russland-von-weltkriegs-gedenken-aus,https://www.zeit.de/news/2025-04/17/bundestag-schliesst-russland-von-weltkriegs-gedenken-aus,0,www.zeit.de,Gedenken am 8. Mai: Bundestag schließt Russland von Weltkriegs-Gedenken aus,Hier finden Sie Informationen zu dem Thema „Gedenken am 8. Mai“. Lesen Sie jetzt „Bundestag schließt Russland von Weltkriegs-Gedenken aus“.,https://img.zeit.de/news/2025-04/17/bundestag-schliesst-russland-von-weltkriegs-gedenken-aus-image-group/wide__1300x731,2025-04-17T01:00:38Z,,Der Bundestag schließt die Botschafter von Russland und Belarus von der zentralen Gedenkfeier zum 80. Jahrestag des Endes des Zweiten Weltkriegs am 8. Mai aus. Dabei beruft sich die Parlamentsverwalt… [+3509 chars],,de,'Russland'
