index,url,valid,domain,title,description,image,published,archive,content,quote,language,keyword
https://www.welt.de/politik/ausland/article69a291a07c787f6a1cef1bc5/krieg-im-iran-iranisches-kriegsschiff-im-indischen-ozean-mit-torpedo-versenkt-usa-veroeffentlichen-video-liveticker.html,https://www.welt.de/politik/ausland/article69a291a07c787f6a1cef1bc5/krieg-im-iran-iranisches-kriegsschiff-im-indischen-ozean-mit-torpedo-versenkt-usa-veroeffentlichen-video-liveticker.html,0,www.welt.de,Iranisches Kriegsschiff im Indischen Ozean mit Torpedo versenkt – USA veröffentlichen Video,Vor der Küste Sri Lankas ist ein iranisches Kriegsschiff angegriffen worden und gesunken. Derzeit seien 101 Menschen vermisst. Spaniens Ministerpräsident bekräftigt weiter seine Ablehnung des Angriffs der USA und Israels auf den Iran. Mehr im Liveticker.,https://images.welt.de/69a291a07c787f6a1cef1bc5/63a05a222e158ae929f3138c7df76521/ci16x9-w1200/1772635843669-afp-99wv8t6-jpg,2026-03-04T15:25:00Z,,Ein U-Boot der USA hat im Indischen Ozean ein Kriegsschiff des Irans mit einem Torpedo versenkt. Mehr als 100 Menschen werden derzeit vermisst. Das US-Militär veröffentlicht Aufnahmen des Einsatzes. … [+19165 chars],,de,'Angriff'
https://www.n-tv.de/politik/Slowakei-macht-Drohung-wahr-und-stoppt-Notstrom-fuer-Ukraine-id30431537.html,https://www.n-tv.de/politik/Slowakei-macht-Drohung-wahr-und-stoppt-Notstrom-fuer-Ukraine-id30431537.html,0,www.n-tv.de,Streit um Erdöl aus Russland : Slowakei macht Drohung wahr und stoppt Notstrom für Ukraine,Auch vier Jahre nach Beginn des Ukraine-Kriegs ist die Slowakei vom russischen Erdöl abhängig. Seit mehreren Wochen fließt allerdings über die durch die Ukraine führende Druschba-Pipeline kein Öl mehr. Bratislava sieht die Schuld bei Kiew - und setzt nun sein…,https://www.n-tv.de/img/30431554/1772640444/Img_16_9/1200/From-left-Czech-PM-Andrej-Babis-not-seen-and-Slovak-Prime-Minister-Robert-Fico-photo-give-a-news-conference-after-their-meeting-during-Andrej-Babis-first-official-trip-abroad-after-his-appointment-in-Bratislava-Slovakia-January-8-2026.jpg,2026-03-04T15:27:06Z,,"Der slowakische Premier Fico hatte die Einstellung von Notstromlieferungen vor mehr als einer Woche angedroht. (Foto: picture alliance / CTK)
Auch vier Jahre nach Beginn des Ukraine-Kriegs ist die S… [+2393 chars]",,de,'Ukraine'
https://www.n-tv.de/politik/Ungarn-fordert-von-Moskau-Preisgarantie-fuer-Oel-und-Gas-id30431520.html,https://www.n-tv.de/politik/Ungarn-fordert-von-Moskau-Preisgarantie-fuer-Oel-und-Gas-id30431520.html,0,www.n-tv.de,Anstieg durch Iran-Krieg droht: Ungarn fordert von Moskau Preisgarantie für Öl und Gas,"Der Krieg im Nahen Osten lässt die Preise für Öl und Gas global nach oben schnellen. Der ungarische Außenminister reist nun nach Moskau, um das für sein Land zu verhindern. Dafür will er sich ""Garantien"" von seinen Partnern im Kreml geben lassen.",https://www.n-tv.de/img/6668851/1757242304/Img_16_9/1200/9311747.jpg,2026-03-04T15:30:56Z,,"Der ungarische Außenminister ist regelmäßig zu Gast in Moskau. (Foto: picture alliance / Anadolu)
Der Krieg im Nahen Osten lässt die Preise für Öl und Gas global nach oben schnellen. Der ungarische … [+1900 chars]",,de,'Preis'
https://www.sueddeutsche.de/politik/russischer-angriffskrieg-moskau-ukraine-hat-tanker-im-mittelmeer-angegriffen-li.3444633,https://www.sueddeutsche.de/politik/russischer-angriffskrieg-moskau-ukraine-hat-tanker-im-mittelmeer-angegriffen-li.3444633,0,www.sueddeutsche.de,Russischer Angriffskrieg: Moskau: Ukraine hat Tanker im Mittelmeer angegriffen,,https://www.sueddeutsche.de/szde-assets/img/szde-article-sharing-image-no-teaser-image-fallback.png,2026-03-04T15:31:26Z,,"Moskau hat Kiew vorgeworfen, ein russisches Schiff im Mittelmeer angegriffen zu haben. Laut dem russischen Verkehrsministerium attackierte die Ukraine bereits am Dienstag im Mittelmeer den Gastanker … [+1680 chars]",,de,'Ukraine'
https://www.sueddeutsche.de/politik/energiepreise-inflation-auswirkungen-deutschland-li.3443393,https://www.sueddeutsche.de/politik/energiepreise-inflation-auswirkungen-deutschland-li.3443393,0,www.sueddeutsche.de,Podcast: „Auf den Punkt“: Energiepreise: Droht wieder ein Preisschock?,"Die angespannte Lage in Iran führt zu steigenden Öl- und Gaspreisen, was die Inflation in Deutschland befeuern könnte. Droht ein ähnlich großes Problem wie bei Beginn des Ukraine-Kriegs?",https://www.sueddeutsche.de/2025/03/12/4d031366-ad93-4b81-89dc-aa57357f2531.png?q=60&fm=webp&width=1200&rect=0%2C0%2C3200%2C1800,2026-03-04T15:37:36Z,,Welche Auswirkungen haben die steigenden Öl- und Gaspreise in Deutschland: auf die wirtschaftliche Lage und auf jeden Einzelnen? Droht wieder ein Inflationsschock wegen der hohen Energiepreise wie zu… [+1181 chars],,de,'Inflation'
https://www.nzz.ch/wirtschaft/der-benzinpreis-in-den-usa-steigt-an-zieht-sich-trumps-krieg-in-iran-lange-hin-wird-ihm-das-politisch-schaden-ld.1927579,https://www.nzz.ch/wirtschaft/der-benzinpreis-in-den-usa-steigt-an-zieht-sich-trumps-krieg-in-iran-lange-hin-wird-ihm-das-politisch-schaden-ld.1927579,0,www.nzz.ch,"Der Benzinpreis in den USA steigt an – zieht sich Trumps Krieg in Iran lange hin, wird ihm das politisch schaden","An den amerikanischen Tankstellen sind die Folgen des Waffengangs schon angekommen. Trump setzt darauf, dass er den Krieg rechtzeitig vor den Zwischenwahlen im Herbst beenden kann.","https://img.nzz.ch/2026/03/04/96785c77-24aa-4688-90f6-14ffa6ec3131.jpg?width=1200&height=675&fit=bounds&quality=75&auto=webp&crop=4000,2250,x0,y0&wmark=nzz",2026-03-04T16:00:19Z,,"An den amerikanischen Tankstellen sind die Folgen des Waffengangs schon angekommen. Trump setzt darauf, dass er den Krieg rechtzeitig vor den Zwischenwahlen im Herbst beenden kann.
Zusammenfassung
… [+6933 chars]",,de,'Inflation'
https://www.zeit.de/news/2026-03/04/sieben-jahre-haft-fuer-angriff-mit-radlader-auf-bundesstrasse,https://www.zeit.de/news/2026-03/04/sieben-jahre-haft-fuer-angriff-mit-radlader-auf-bundesstrasse,0,www.zeit.de,Urteil: Sieben Jahre Haft für Angriff mit Radlader auf Bundesstraße,Hier finden Sie Informationen zu dem Thema „Urteil“. Lesen Sie jetzt „Sieben Jahre Haft für Angriff mit Radlader auf Bundesstraße“.,https://img.zeit.de/news/2026-03/04/sieben-jahre-haft-fuer-angriff-mit-radlader-auf-bundesstrasse-image-group/wide__1300x731,2026-03-04T16:38:55Z,,"Weil er betrunken mit einem Radlader auf mehrere Fahrzeuge losgefahren ist, hat das Landgericht Marburg einen 29-jährigen Mann wegen versuchten Mordes zu einer Haftstrafe von sieben Jahren verurteilt… [+833 chars]",,de,'Angriff'
https://www.faz.net/aktuell/sport/sportpolitik/krieg-im-nahen-osten-ioc-praesidentin-fehlt-die-substanz-110847530.html,https://www.faz.net/aktuell/sport/sportpolitik/krieg-im-nahen-osten-ioc-praesidentin-fehlt-die-substanz-110847530.html,0,www.faz.net,Krieg im Nahen Osten: Das IOC und die Flucht in die eigene Verzwergung,"Olympischer Friede? Kürzlich noch Grund für PR-Offensiven. Im Angesicht der amerikanisch-israelischen Angriffe vollzieht die IOC-Präsidentin eine Kehrtwende – und offenbart, wie sehr ihr die Substanz fehlt.",https://media0.faz.net/image/w1200h627/0f8faf323e11/w6033h3152x0y121o/202602/43601.0.1813230082/olympischer-friede-als-nettes.webp,2026-03-04T17:13:48Z,,"Nachdem vergangenen Samstag die ersten Bomben und Cruise Missiles in Teheran und anderen iranischen Städten einschlugen, war drei Tage lang nichts zu hören vom Internationalen Olympischen Komitee (IO… [+3129 chars]",,de,'Wladimir Putin'
https://www.stern.de/gesellschaft/regional/bayern/hohe-gas--und-oelpreise--aiwanger-fordert-stopp-der-co2-steuer-wegen-preisschub-37192166.html,https://www.stern.de/gesellschaft/regional/bayern/hohe-gas--und-oelpreise--aiwanger-fordert-stopp-der-co2-steuer-wegen-preisschub-37192166.html,0,www.stern.de,Hohe Gas- und Ölpreise: Aiwanger fordert Stopp der CO2-Steuer wegen Preisschub,München (lby) - Bayerns Wirtschaftsminister Hubert Aiwanger (Freie Wähler) fordert angesichts gestiegener Preise für Öl und Gas den Stopp der CO2-Steuer.,https://image.stern.de/37192168/t/S4/v1/w1440/r1.7778/-/04--z3wczzevwev7axs2048jpeg---1995e1c8d5ad9a20.jpg,2026-03-04T18:07:06Z,,"Kopiere den aktuellen Link
Zur Merkliste hinzufügen
Spritpreise könnten laut Hubert Aiwanger sofort um 15 bis 20 Cent sinken wenn die CO2-Steuer fällt. Wo er stattdessen Einsparpotenzial sieht.
Ba… [+1429 chars]",,de,'Preis'
https://www.zeit.de/news/2026-03/04/aiwanger-fordert-stopp-der-co2-steuer-wegen-preisschub,https://www.zeit.de/news/2026-03/04/aiwanger-fordert-stopp-der-co2-steuer-wegen-preisschub,0,www.zeit.de,Hohe Gas- und Ölpreise: Aiwanger fordert Stopp der CO2-Steuer wegen Preisschub,Hier finden Sie Informationen zu dem Thema „Hohe Gas- und Ölpreise“. Lesen Sie jetzt „Aiwanger fordert Stopp der CO2-Steuer wegen Preisschub“.,https://img.zeit.de/news/2026-03/04/aiwanger-fordert-stopp-der-co2-steuer-wegen-preisschub-image-group/wide__1300x731,2026-03-04T18:07:06Z,,Bayerns Wirtschaftsminister Hubert Aiwanger (Freie Wähler) fordert angesichts gestiegener Preise für Öl und Gas den Stopp der CO2-Steuer. Der Bund und die Europäische Union müssten die heimische Wirt… [+1271 chars],,de,'Preis'
https://www.stern.de/digital/online/macbook-neo-vorgestellt--apple-macht-jetzt-auf-billig-37191938.html,https://www.stern.de/digital/online/macbook-neo-vorgestellt--apple-macht-jetzt-auf-billig-37191938.html,0,www.stern.de,Neues Macbook Neo: Apple macht jetzt auf billig,Ausgerechnet Apple geht gegen den Trend steigender Preise – und setzt auf günstige Einsteigerprodukte. Das neue Macbook Neo ist eigentlich ein iPhone im anderen Gewand.,https://image.stern.de/37192152/t/JR/v2/w1440/r1.7778/-/apple-macbook-neo.jpg,2026-03-04T18:17:00Z,,"Kopiere den aktuellen Link
Zur Merkliste hinzufügen
Ausgerechnet Apple geht gegen den Trend steigender Preise  und setzt auf günstige Einsteigerprodukte. Das neue Macbook Neo ist eigentlich ein iPh… [+3920 chars]",,de,'Inflation'
https://www.stern.de/news/gas-tanker-sinkt-vor-libyen-nach-explosion---putin-spricht-von--terrorangriff--kiews-37190896.html,https://www.stern.de/news/gas-tanker-sinkt-vor-libyen-nach-explosion---putin-spricht-von--terrorangriff--kiews-37190896.html,0,www.stern.de,"Gas-Tanker sinkt vor Libyen nach Explosion - Putin spricht von ""Terrorangriff"" Kiews","Russland hat die Ukraine beschuldigt, einen russischen Flüssigerdgas-Frachter vor der libyschen Küste angegriffen und versenkt zu haben. Es handele sich um einen ""Terrorangriff"" Kiews, sagte Kreml-Chef Wladimir Putin am Mittwoch. Laut dem russischen Verteidig…",https://image.stern.de/37192238/t/I4/v1/w1440/r1.7778/-/04--symbolbild-eines-fluessigerdgastankers-lng---b4ea9f7d012e4422.jpg,2026-03-04T18:49:12Z,,"Kopiere den aktuellen Link
Zur Merkliste hinzufügen
Russland hat die Ukraine beschuldigt, einen russischen Flüssigerdgas-Frachter vor der libyschen Küste angegriffen und versenkt zu haben. Es hande… [+2039 chars]",,de,'Gas'
https://orf.at/stories/3422469/,https://orf.at/stories/3422469/,0,orf.at,Gas-Tanker sinkt vor Libyen: Für Putin „Terrorangriff“ Kiews,,https://orf.at/mojo/1_4_1/storyserver//news/common/images/og-fallback-news.png,2026-03-04T19:00:07Z,,"Russland hat die Ukraine beschuldigt, einen russischen Flüssigerdgasfrachter vor der libyschen Küste angegriffen und versenkt zu haben. Es handle sich um einen Terrorangriff Kiews, sagte Kreml-Chef W… [+874 chars]",,de,'Gas'
https://www.zeit.de/politik/ausland/2026-03/iran-ueberblick-usa-kriegsschiff-trauerfeier,https://www.zeit.de/politik/ausland/2026-03/iran-ueberblick-usa-kriegsschiff-trauerfeier,0,www.zeit.de,"Iran-Überblick: USA versenken iranisches Kriegsschiff, Iran verschiebt Trauerfeier",Die USA haben ihre Angriffe verstärkt und ein Kriegsschiff zerstört. Der Iran verschob die geplante Trauerfeier für Chamenei und reagierte mit Gegenangriff. Der Tag,https://img.zeit.de/administratives/sharing/fallback-image-die-zeit/wide__1300x731,2026-03-04T19:08:22Z,,"Die USA und Israel haben ihre Angriffe im Iran fortgesetzt, aber auch ein Kriegsschiff im Indischen Ozean ins Visier genommen. Ein amerikanisches U-Boot habe in internationalen Gewässern vor der Küst… [+3355 chars]",,de,'Angriff'
https://www.n-tv.de/politik/Russland-soll-es-schlechter-gehen-als-gedacht-id30432272.html,https://www.n-tv.de/politik/Russland-soll-es-schlechter-gehen-als-gedacht-id30432272.html,0,www.n-tv.de,BND: Zahlen geschönt: Russland soll es schlechter gehen als gedacht,Russland ordnet dem Krieg gegen die Ukraine alles andere unter - auch die wirtschaftliche Zukunft. Der deutsche Auslandsgeheimdienst glaubt an schwerwiegende Folgen über Jahre hinaus. Derzeit läuft es aber nicht nur schlecht für Moskau.,https://www.n-tv.de/img/30432338/1772653319/Img_16_9/1200/RUSSIA-SEVASTOPOL-APRIL-29-2023-Gray-smoke-rises-over-an-oil-depot-in-Sevastopol-s-Kazachya-Bukhta-neighborhood-hit-by-fire-According-to-preliminary-data-a-fuel-tank-has-caught-fire-after-a-drone-attack-According-to-the-city-authorities-the-fire-covers-an-area-of-1-000-sqm.jpg,2026-03-04T19:12:51Z,,"BND: Zahlen geschöntRussland soll es schlechter gehen als gedacht
Auch ukrainische Angriffe auf die Ölinfrastruktur kosten den Kreml Milliarden. (Foto: IMAGO/ITAR-TASS)
Russland ordnet dem Krieg ge… [+3184 chars]",,de,'Ukraine'
https://www.bild.de/leben-wissen/mein-geld-finanzportal/krieg-im-nahen-osten-sorgt-fuer-run-auf-gastarife-und-solaranlagen-69a8549d625a8415070ae87a,https://www.bild.de/leben-wissen/mein-geld-finanzportal/krieg-im-nahen-osten-sorgt-fuer-run-auf-gastarife-und-solaranlagen-69a8549d625a8415070ae87a,0,www.bild.de,Nachfrage mehr als verdoppelt - Seit Kriegsbeginn! Run auf Gastarife und Solar,Krieg im Nahen Osten: Großer Ansturm auf günstige Gasverträge trotz stabiler Neukundenpreise.,"https://images.bild.de/69a8549d625a8415070ae87a/a63d087f99197168869247f040f42e25,d6d3083f?w=1280",2026-03-04T19:30:56Z,,TTS-Player überspringenArtikel weiterlesenDie Spannungen im Nahen Osten sorgen für einen regelrechten Ansturm auf Gastarife. Denn noch sind sie günstig. Mehr als doppelt so viele neue Gasverträge wer… [+1996 chars],,de,'Gas'
https://www.morgenpost.de/wirtschaft/article411374012/reiche-laesst-kartellamt-rekordpreise-bei-tankstellen-pruefen.html,https://www.morgenpost.de/wirtschaft/article411374012/reiche-laesst-kartellamt-rekordpreise-bei-tankstellen-pruefen.html,0,www.morgenpost.de,Reiche lässt Kartellamt Rekordpreise bei Tankstellen prüfen,Die Preise an den Tankstellen steigen wegen des Iran-Kriegs immer weiter. Bundeswirtschaftsministerin Reiche will dagegen vorgehen.,https://img.sparknews.funkemedien.de/411366193/411366193_1772652817_v16_9_1600.jpeg,2026-03-04T19:33:35Z,,Bundeswirtschaftsministerin Katherina Reiche (CDU) hat eine kartellrechtliche Prüfung der exorbitanten Preissprünge an den deutschen Tankstellen infolge des Iran-Kriegs angekündigt. Wir werden prüfen… [+1107 chars],,de,'Preis'
https://www.focus.de/finanzen/news/reiche-laesst-kartellamt-rekordpreise-bei-tankstellen-pruefen_a60dd7e1-027a-4d8d-afeb-e63e0d19b191.html,https://www.focus.de/finanzen/news/reiche-laesst-kartellamt-rekordpreise-bei-tankstellen-pruefen_a60dd7e1-027a-4d8d-afeb-e63e0d19b191.html,0,www.focus.de,Reiche lässt Kartellamt Rekordpreise bei Tankstellen prüfen,Bundeswirtschaftsministerin Katherina Reiche (CDU) hat eine kartellrechtliche Prüfung der exorbitanten Preissprünge an den deutschen Tankstellen infolge des Iran-Kriegs angekündigt.,https://quadro.burda-forward.de/ctf/b52f7e98-e57d-49b2-b7c6-59be22b297c4.4d75b6f8-7f30-41db-b1ff-cba8d971947a.png?im=RegionOfInterestCrop%3D%281200%2C630%29%2CregionOfInterest%3D%281400%2C700%29&hash=c861c3a6d4b5ae8ee1e184bebe1ba77ea98264b25c3eee1dba043387af39957d,2026-03-04T19:38:00Z,,"""Wir werden prüfen, dass nicht eine Situation ausgenutzt wird, die sich an den Märkten abbildet, aber nicht in dieser Höhe"", sagte Reiche im Podcast von Table.Briefings. Darüber sei sie mit dem Bunde… [+914 chars]",,de,'Gas'
https://www.faz.net/aktuell/wirtschaft/auto-verkehr/teurer-sprit-durch-iran-krieg-kommt-der-tankrabatt-zurueck-110847609.html,https://www.faz.net/aktuell/wirtschaft/auto-verkehr/teurer-sprit-durch-iran-krieg-kommt-der-tankrabatt-zurueck-110847609.html,0,www.faz.net,Irankrieg verteuert Sprit: Kommt jetzt der Tankrabatt zurück?,Angesichts des Preisanstiegs für Öl und Gas gibt es die ersten Rufe nach Entlastungen für Bürger und Unternehmen. Eine höhere Inflation und weniger Wachstum können Union und SPD in diesem Wahljahr nicht gebrauchen.,https://media0.faz.net/image/w1200h627/eb034c669454/w6000h3135x0y433o/202603/43601.0.1845343952/teures-tanken-die-spritpreise.webp,2026-03-04T20:23:36Z,,"Die AfD wittert ein Thema, mit dem sie Wähler mobilisieren kann. Postet mir Euren Benzinpreis-Schock unter dem Hashtag #DankeCDU, schrieb Fraktionschefin Alice Weidel am Mittwoch auf der Plattform X … [+6420 chars]",,de,'Preis'
https://www.focus.de/politik/ausland/putin-erwaegt-stopp-der-gaslieferungen-in-eu-jetzt-oeffnen-sich-andere-maerkte_adc87387-3975-4a26-ab1a-6dced42cdb41.html,https://www.focus.de/politik/ausland/putin-erwaegt-stopp-der-gaslieferungen-in-eu-jetzt-oeffnen-sich-andere-maerkte_adc87387-3975-4a26-ab1a-6dced42cdb41.html,0,www.focus.de,"Putin erwägt Stopp der Gaslieferungen in EU: ""Jetzt öffnen sich andere Märkte""","Angesichts des von der EU geplanten Embargos gegen russisches Gas denkt Kremlchef Wladimir Putin darüber nach, die Lieferungen nun selbst schon vorher zu stoppen.",https://quadro.burda-forward.de/ctf/7f4580aa-0d05-4490-b4ba-be98c5878177.2b5a9664-5e7a-4ddb-b13e-6bb05a827ff6.jpeg?im=RegionOfInterestCrop%3D%281200%2C630%29%2CregionOfInterest%3D%28822%2C523%29&hash=258e2d2945f3865fab6abc0e2641d356eaf9f75c5886c1ab49308829b25fcebe,2026-03-04T20:43:00Z,,"Jetzt öffnen sich andere Märkte. Und vielleicht ist es für uns vorteilhafter, jetzt sofort die Lieferungen für den europäischen Markt einzustellen, sagte Putin in einem auch vom Kreml veröffentlichte… [+2082 chars]",,de,'Wladimir Putin'
https://www.n-tv.de/politik/21-21-Trilaterales-Treffen-wird-anscheinend-verschoben-id30432777.html,https://www.n-tv.de/politik/21-21-Trilaterales-Treffen-wird-anscheinend-verschoben-id30432777.html,0,www.n-tv.de,Ukraine-Krieg im Liveticker: +++ 21:21 Trilaterales Treffen wird anscheinend verschoben +++,"Berlin, Washington, Brüssel - überall. ntv berichtet von allen wichtigen Schauplätzen der Innen- und Außenpolitik.",https://www.n-tv.de/img/2339153/1721988811/Img_16_9/1200/Ukraine-Liveticker.jpg,2026-03-04T21:00:00Z,,"Eigentlich sollen die trilateralen Gespräche zwischen Vertretern Russlands, der Ukraine und der USA in dieser Woche weitergehen, doch eine neue Verhandlungsrunde ist derzeit nicht in Sicht. Man sei f… [+28125 chars]",,de,'Gas'
https://www.n-tv.de/politik/21-14-Hisbollah-Chef-Kapitulieren-nicht-vor-israelisch-amerikanischen-Aggression-id30432745.html,https://www.n-tv.de/politik/21-14-Hisbollah-Chef-Kapitulieren-nicht-vor-israelisch-amerikanischen-Aggression-id30432745.html,0,www.n-tv.de,"Angriff auf den Iran im Liveticker: +++ 21:14 Hisbollah-Chef: Kapitulieren nicht vor ""israelisch-amerikanischen Aggression"" +++","Berlin, Washington, Brüssel - überall. ntv berichtet von allen wichtigen Schauplätzen der Innen- und Außenpolitik.",https://www.n-tv.de/img/30428897/1772610587/Img_16_9/1200/An-Iranian-flag-is-placed-among-the-ruins-of-a-police-station-struck-Monday-during-the-U-S-Israeli-military-campaign-in-Tehran-Iran-Tuesday-March-3-2026.jpg,2026-03-04T21:00:00Z,,"Die Schiitenmiliz Hisbollah im Libanon hat angekündigt, sich der ""israelisch-amerikanischen Aggression"" entgegenzustellen. Die Hisbollah werde nicht ""kapitulieren"", sagt der Chef der vom Iran finanzi… [+45628 chars]",,de,'Angriff'
https://www.stern.de/wirtschaft/news/verbraucher--reiche-laesst-hohe-spritpreise-ueberpruefen-37192346.html,https://www.stern.de/wirtschaft/news/verbraucher--reiche-laesst-hohe-spritpreise-ueberpruefen-37192346.html,0,www.stern.de,Verbraucher: Reiche lässt hohe Spritpreise überprüfen,"Der Iran-Krieg macht sich in Deutschland auch an den Zapfsäulen bemerkbar. Die Bundesregierung prüft, was sie gegen überhöhte Preise tun kann. ""Es darf keine Abzocke geben"", warnt der Finanzminister.",https://image.stern.de/37192348/t/sz/v1/w1440/r1.7778/-/04--f7kqbvlkwsv10axs2048jpeg---f443f7165af88f23.jpg,2026-03-04T21:12:38Z,,"Kopiere den aktuellen Link
Zur Merkliste hinzufügen
Der Iran-Krieg macht sich in Deutschland auch an den Zapfsäulen bemerkbar. Die Bundesregierung prüft, was sie gegen überhöhte Preise tun kann. ""E… [+1479 chars]",,de,'Preis'
https://www.zeit.de/news/2026-03/04/selenskyj-bisher-keine-signale-fuer-neue-ukraine-gespraeche,https://www.zeit.de/news/2026-03/04/selenskyj-bisher-keine-signale-fuer-neue-ukraine-gespraeche,0,www.zeit.de,Krieg in der Ukraine: Selenskyj: Bisher keine Signale für neue Ukraine-Gespräche,Hier finden Sie Informationen zu dem Thema „Krieg in der Ukraine“. Lesen Sie jetzt „Selenskyj: Bisher keine Signale für neue Ukraine-Gespräche“.,https://img.zeit.de/news/2026-03/04/selenskyj-bisher-keine-signale-fuer-neue-ukraine-gespraeche-image-group/wide__1300x731,2026-03-04T21:28:47Z,,Der ukrainische Präsident Wolodymyr Selenskyj geht wegen der Lage im Nahen Osten von einer Pause in den Friedensgesprächen mit Russland unter US-Vermittlung aus. «Aufgrund der Situation mit dem Iran … [+2261 chars],,de,'Wladimir Putin'
https://www.jungewelt.de/artikel/518621.großbritanniens-staatshaushalt-konjunkturprognose-schon-veraltet.html,https://www.jungewelt.de/artikel/518621.großbritanniens-staatshaushalt-konjunkturprognose-schon-veraltet.html,0,www.jungewelt.de,Großbritanniens Staatshaushalt: Konjunkturprognose schon veraltet,Britische Finanzministerin stellt Frühjahrsprognose vor und lobt gesunkene Inflation. Iran-Krieg sorgt bereits für neuerlich steigende Energiepreise.,https://www.jungewelt.de/img/1100/219859.jpg,2026-03-04T23:00:00Z,,"In diesem Jahr werde das Wachstum gering ausfallen. Aber ab 2027 werde es steil bergauf gehen, versprach die britische Finanzministerin Rachel Reeves bei der Vorstellung ihres »Spring Statements« am … [+3507 chars]",,de,'Inflation'
https://ooe.orf.at/stories/3344410/,https://ooe.orf.at/stories/3344410/,0,ooe.orf.at,Jobverlust verursacht neue Schuldenfälle,"Fast 4.000 neue Schuldner in Oberösterreich haben sich im vergangenen Jahr Hilfe bei der heimischen Schuldnerberatung geholt. Damit liegen die Zahlen ähnlich hoch wie im Rekordjahr 2024, das mit hoher Inflation und schlechter Konjunktur zu Buche geschlagen ha…",https://ibs.orf.at/ooe?image=https%3A%2F%2Foekastatic.orf.at%2Fmims%2F2024%2F05%2F53%2Fcrops%2Fw%3D1200%2Ch%3D627%2Cq%3D75%2F2089618_master_789253_geld.jpg%3Fs%3D5e3d7b112228aaf99d8699207da177e4c77ef6fc,2026-03-05T05:09:19Z,,"So führte etwa die steigende Arbeitslosigkeit durch größere Entlassungswellen auch im Angestelltenbereich dazu, dass deutlich mehr Arbeitslose in der Schuldenfalle sitzen und Hilfe in den Büros der S… [+1024 chars]",,de,'Inflation'
https://www.faz.net/pro/weltwirtschaft/weltwissen/die-folgen-des-irankriegs-fuer-china-und-indien-accg-200591221.html,https://www.faz.net/pro/weltwirtschaft/weltwissen/die-folgen-des-irankriegs-fuer-china-und-indien-accg-200591221.html,0,www.faz.net,"Öl, Waffen, Bündnisse: Die Angriffe im Golf treffen auch Indien und China","Trotz Sanktionen haben die USA Indien wieder erlaubt, russisches Öl zu  kaufen. Das zeigt: Der neue Golfkrieg wirbelt die globalen Lieferketten für Rohstoffe und Waffen durcheinander. Das belastet Asiens Großmächte – und erhöht die Gefahr für Taiwan.",https://media0.faz.net/image/w1200h627/1fe80547d8a7/w4000h2090x0y455o/202603/43601.0.1841217663/auf-ausfaelle-vorbereitet.webp,2026-03-05T06:15:46Z,,"Indien hatte sich unter Ministerpräsident Narendra Modi schrittweise von Iran abgewendet, auch wenn der ein enger Verbündeter des eigenen Partners Russland war. Neu Delhi aber erkannte, dass Israel u… [+10795 chars]",,de,'Angriff'
https://www.deutsche-startups.de/?p=443251,https://www.deutsche-startups.de/?p=443251,0,www.deutsche-startups.de,#Gastbeitrag - KI als Stresstest: Was 2026 auf dem M&A-Markt über Erfolg entscheidet,Nach einer Phase der Anpassung steuert der M&A-Markt auf ein entscheidendes Jahr zu. Hohe Liquidität auf Käuferseite trifft auf ein begrenztes Angebot an überzeugenden Targets. Ein Gastbeitrag von Klaus Wagner und Thorsten Hackspiel (ox8 Corporate Finance).,https://www.deutsche-startups.de/wp-content/uploads/2014/01/ds-exit.jpg,2026-03-05T07:15:00Z,,"Politische Unsicherheiten, handelspolitische Spannungen und anhaltende geopolitische Konflikte haben den M&amp;A-Markt 2025 spürbar ausgebremst. Investoren agierten vorsichtiger, Kapital wurde deutli… [+5274 chars]",,de,'Gas'
https://noe.orf.at/stories/3344374/,https://noe.orf.at/stories/3344374/,0,noe.orf.at,Energiesparen: Langfristige Konzepte nötig,Der 5. März ist der internationale Tag des Energiesparens. Nach den erneuten Unruhen im nahen Osten könnten Preise für Öl und Gas wieder steigen. Die Energie- und Umweltagentur (eNu) des Landes setzt in ihren Beratungen diesbezüglich auf langfristige Konzepte.,https://ibs.orf.at/noe?image=https%3A%2F%2Foekastatic.orf.at%2Fmims%2F2025%2F46%2F49%2Fcrops%2Fw%3D1200%2Ch%3D627%2Cq%3D75%2F2833800_master_1094049_abd_20220720_abd0028.hr.jpg%3Fs%3D1bdc0fb448f4ac7d06cc45d65bdd9450223daa9a,2026-03-05T07:24:20Z,,"Seit Beginn des Krieges, den die USA und Israel gemeinsam mit ihren völkerrechtswidrigen Angriffen am Samstag starteten, ist der Gaspreis um mehr als 80 Prozent gestiegen. Noch stärker war der Gaspre… [+2396 chars]",,de,'Inflation'
