index,url,valid,domain,title,description,image,published,archive,content,quote,language,keyword
https://www.morgenpost.de/wirtschaft/article238270775/2-286-euro-rrsparnis-gas-strom-sprit.html,https://www.morgenpost.de/wirtschaft/article238270775/2-286-euro-rrsparnis-gas-strom-sprit.html,0,www.morgenpost.de,"Energiepreise: 2.286 Euro Ersparnis: Gas, Strom und Sprit werden günstiger",Eine Analyse des Vergleichportals Verivox zeigt: Seit dem Hoch im Oktober sind die Energiepreise gesunken. Teuer bleibt es trotzdem.,https://img.morgenpost.de/img/wirtschaft/crop238270771/0632606212-w820-cv16_9-q85/95e4deb0-e75b-11ed-9e95-dc17223803e5.jpg,2023-05-01T03:00:00Z,,"Berlin.  Ob beim Heizen, an der Tankstelle oder beim Stromverbrauch: Das Schlimmste scheint für die Verbraucherinnen und Verbraucher überwunden: Wie das Vergleichsportal Verivox ermittelt hat, sind d… [+1581 chars]",,de,'Gas'
https://www.welt.de/finanzen/verbraucher/article245085280/Deutschlandticket-bis-Heizkosten-Zuschuss-Was-sich-im-Mai-aendert.html,https://www.welt.de/finanzen/verbraucher/article245085280/Deutschlandticket-bis-Heizkosten-Zuschuss-Was-sich-im-Mai-aendert.html,0,www.welt.de,Deutschlandticket bis Heizkosten-Zuschuss – Das ändert sich für Sie im Mai,"Der neue Monat verspricht endlich Entlastung für alle, die im vergangenen Jahr Tausende Euro für Heizöl, Pellets oder Kohle ausgeben mussten. Bahnfahrer starten in eine Preis-Ära und die Nutzer von WhatsApp, Amazon und Facebook werden von neuen EU-Regeln prof…",https://img.welt.de/img/finanzen/verbraucher/mobile245087450/6781359897-ci16x9-w1200/kombo-mai-deutschland-ticket-heizung-meta.jpg,2023-05-01T04:05:36Z,http://archive.md/20230501063113/https://www.welt.de/finanzen/verbraucher/article245085280/Deutschlandticket-bis-Heizkosten-Zuschuss-Was-sich-im-Mai-aendert.html,Der sprichwörtliche Wonnemonat bringt einige Erleichterungen für Pendler und andere Bahnfahrer. Die Corona-Pandemie rückt noch weiter in den Hintergrund. Doch die fast beispiellose Inflation lastet w… [+7957 chars],,de,'Heizen'
https://www.faz.net/aktuell/politik/ausland/zusammenfassung-0500-ereignisse-der-nacht-und-ausblick-auf-den-tag-armeechef-der-ukraine-trifft-nato-kommandeur-die-nacht-im-ueberblick-18860233.html,https://www.faz.net/aktuell/politik/ausland/zusammenfassung-0500-ereignisse-der-nacht-und-ausblick-auf-den-tag-armeechef-der-ukraine-trifft-nato-kommandeur-die-nacht-im-ueberblick-18860233.html,0,www.faz.net,Ukraine: Armeechef Saluschnyj informiert NATO-Kommandeur Cavoli über Pläne,"Es sei um „Szenarien, Bedrohungen und Voraussetzungen für unsere zukünftigen Aktionen“ gegangen. Der ukrainische Präsident hob verschiedene Länder für ihre Unterstützung hervor, darunter auch Deutschland.",https://media0.faz.net/ppmedia/aktuell/2412813876/1.8860242/facebook_teaser/der-ukrainische-praesident.jpg,2023-05-01T05:07:50Z,,"Der ukrainische Präsident Wolodymyr Selenskyj hat den ausländischen Partnern seines Landes für deren jüngste Unterstützung mit Waffen, Geld und anderen Hilfsleistungen im Krieg gegen Russland gedankt… [+4810 chars]",,de,'Waffen'
https://www.stern.de/gesellschaft/regional/hamburg-schleswig-holstein/unterhaltung--musicalbranche-blickt-optimistisch-in-die-zukunft-33425426.html,https://www.stern.de/gesellschaft/regional/hamburg-schleswig-holstein/unterhaltung--musicalbranche-blickt-optimistisch-in-die-zukunft-33425426.html,0,www.stern.de,Unterhaltung: Musicalbranche blickt optimistisch in die Zukunft,"Nach der Krise durch die Corona-Pandemie blickt die Musicalbranche wieder optimistisch in die Zukunft. ""Das Publikum kam viel schneller als erhofft wieder zurück - ganz offensichtlich gab es eine große Sehnsucht nach dem gemeinsamen Erleben kultureller Angebo…",https://image.stern.de/33425428/t/w3/v1/w1440/r1.7778/-/01--urnnewsmldpacom2009010123050199514405v3w800h600l719t322r1745b1415jpeg---773890404d135ff6.jpg,2023-05-01T06:57:00Z,,"Nach der Krise durch die Corona-Pandemie blickt die Musicalbranche wieder optimistisch in die Zukunft. ""Das Publikum kam viel schneller als erhofft wieder zurück - ganz offensichtlich gab es eine gro… [+1651 chars]",,de,'Krise'
https://www.welt.de/wirtschaft/article245056148/Inflation-und-Nullwachstum-Deutschland-wird-zum-Bremsklotz-Europas.html,https://www.welt.de/wirtschaft/article245056148/Inflation-und-Nullwachstum-Deutschland-wird-zum-Bremsklotz-Europas.html,0,www.welt.de,„In der Vergangenheit folgten dann stets Rezessionen“,"Ganz knapp kann Deutschland eine Rezession vermeiden. Doch die Wirtschaft ächzt vor allem unter der hohen Inflation. Die Preissteigerung ist nur um 0,2 Punkte auf 7,2 Prozent zurückgegangen. Andere Länder meistern die Lage weit besser, insbesondere in Südeuro…",https://img.welt.de/img/wirtschaft/mobile245059464/6001352937-ci16x9-w1200/GettyImages-1401764586.jpg,2023-05-01T07:38:03Z,,"Deutschland schleppt sich über die Ziellinie. 0,0 Prozent betrug das Wirtschaftswachstum im ersten Quartal dieses Jahres das heißt: die Wirtschaft stagnierte. Nachdem sie im Quartal davor leicht gesc… [+4528 chars]",,de,'Krise'
https://www.morgenpost.de/politik/article238274677/ukraine-russland-luftangriff-krieg-tote.html,https://www.morgenpost.de/politik/article238274677/ukraine-russland-luftangriff-krieg-tote.html,0,www.morgenpost.de,Ukraine-Krieg: Nächtlicher Raketenangriff auf Ukraine – 25 Verletzte,Russland hat die Ukraine in der Nacht zum Montag massiv beschossen. Zahlreiche Menschen wurden verletzt – darunter auch Kinder.,https://img.morgenpost.de/img/frontpage/crop238274649/3692601828-w820-cv16_9-q85/Ukraine-Luftangriff.jpg,2023-05-01T07:52:13Z,,"Es ist kurz nach halb sieben Uhr morgens, als die Sirenen in Odessa Entwarnung geben. In den Stunden davor herrscht in der gesamten Ukraine Luftalarm. Wieder einmal, wie so häufig in diesen Tagen, in… [+1623 chars]",,de,'Russland'
https://taz.de/Krieg-in-Sudan/!5931321/,https://taz.de/Krieg-in-Sudan/!5931321/,0,taz.de,Krieg in Sudan: Humanitäre Krise verschärft sich,Eine neue Waffenruhe zwischen Regierungstruppen und RSF-Miliz wird schnell wieder gebrochen. Immer mehr Menschen in Sudan sind auf Hilfe angewiesen.,https://taz.de/picture/6237361/948/Sudan-USA-1.jpeg,2023-05-01T07:55:00Z,,"Eine neue Waffenruhe zwischen Regierungstruppen und RSF-Miliz wird schnell wieder gebrochen. Immer mehr Menschen in Sudan sind auf Hilfe angewiesen.
Per Schiff evakuieren die USA weitere der rund 16… [+2995 chars]",,de,'Krise'
https://www.welt.de/kultur/literarischewelt/article244986746/Beste-Sachbuecher-WELT-Bestenliste-Mai-2023.html,https://www.welt.de/kultur/literarischewelt/article244986746/Beste-Sachbuecher-WELT-Bestenliste-Mai-2023.html,0,www.welt.de,Die zehn besten Sachbücher im Mai,"Lesestoff zum Mitreden: Ein neuer Blick auf Afrika. Eine Studie über die Krise der konservativen Parteien und ein Blick in die geheimnisvollen Zeichnungen der Steinzeithöhlen. Nur drei von zehn Büchern, die Experten diesen Monat empfehlen.",https://img.welt.de/img/kultur/literarischewelt/mobile245009248/7631357767-ci16x9-w1200/DWO-Teaser-buecher-aw-bn.jpg,2023-05-01T08:34:29Z,,"An dieser Stelle erscheint monatlich die Empfehlungsliste mit der größten Verbreitung im deutschsprachigen Raum. Medienpartner sind Literarische Welt, RBB Kultur, NZZ und Radio Österreich 1. Experten… [+5603 chars]",,de,'Krise'
https://www.morgenpost.de/politik/article238269537/ukraine-krieg-gegenoffensive-russland.html,https://www.morgenpost.de/politik/article238269537/ukraine-krieg-gegenoffensive-russland.html,0,www.morgenpost.de,Kommentar: Die Gegenoffensive der Ukraine: Alles auf eine Karte,"In der Ukraine steht in den kommenden Wochen womöglich alles auf dem Spiel, meint unser Autor. Was Selenskyj fürchten muss. Ein Kommentar.",https://img.morgenpost.de/img/politik/crop238269535/5452608739-w820-cv16_9-q85/41e1ee5a-e73f-11ed-8bde-604576346eb6.jpg,2023-05-01T08:36:28Z,,"Kiew. In der Ukraine bereiten sich Zehntausende Soldaten auf den Beginn einer militärischen Großoperation vor, die den Verlauf des Krieges entscheidend ändern könnte. Die russische Winteroffensive is… [+4339 chars]",,de,'Krise'
https://www.tagesspiegel.de/politik/in-der-ampel-koalition-das-klima-problem-der-fdp-9734720.html,https://www.tagesspiegel.de/politik/in-der-ampel-koalition-das-klima-problem-der-fdp-9734720.html,0,www.tagesspiegel.de,In der Ampel-Koalition: Das Klima-Problem der FDP,Die Liberalen haben in der Klimaschutzpolitik ein Glaubwürdigkeitsproblem. Sie geben damit ganze Wählerschichten auf.,,2023-05-01T09:14:46Z,,"Dienstagabend, im ZDF läuft Markus Lanz. FDP-Fraktionschef Christian Dürr sitzt in der Sendung und windet sich. Heizungsverbotsgesetz, was ist denn das für ein Wort?, will Lanz wissen, wissen Sie, wi… [+5779 chars]",,de,'Klima'
https://www.tagesspiegel.de/meinung/millionen-in-deutschland-sind-betroffen-wer-will-jetzt-schon-uber-armut-reden-9745169.html,https://www.tagesspiegel.de/meinung/millionen-in-deutschland-sind-betroffen-wer-will-jetzt-schon-uber-armut-reden-9745169.html,0,www.tagesspiegel.de,Millionen in Deutschland sind betroffen: Wer will jetzt schon über Armut reden?,"Soziale Politik ist - gute Sozialpolitik. Und nach der Krise ist vor der Krise. In der muss prekären Haushalten besser geholfen werden, damit die Gesellschaft als Ganzes krisenfester wird.",https://www.tagesspiegel.de/images/ich-bin-armutsbetroffen-deu-deutschland-germany-berlin-06082022-plakat-ich-bin-armutsbetroffen-5-nach-12-energie-g/alternates/BASE_16_9_W1400/ich-bin-armutsbetroffen-deu-deutschland-germany-berlin-06082022-plakat-ich-bin-armutsbetroffen-5-nach-12-energie-g.jpeg,2023-05-01T09:47:17Z,,"Armut gibt es bei uns nicht? Gibt es doch! Und zwar von jung bis alt.
Armut zeigt sich zum Beispiel daran, dass für viele das Geld nicht ausreicht, nach Standards der Deutschen Gesellschaft für Ernä… [+2526 chars]",,de,'Krise'
https://www.n-tv.de/wirtschaft/Bank-First-Republic-wird-an-JPMorgan-Chase-verkauft-article24090671.html,https://www.n-tv.de/wirtschaft/Bank-First-Republic-wird-an-JPMorgan-Chase-verkauft-article24090671.html,0,www.n-tv.de,Dritte Bankenrettung in Folge: US-Finanzriese kauft gestrauchelte Regionalbank,Es ist wieder mal so weit: Schon zum dritten Mal innerhalb kurzer Zeit muss eine strauchelnde US-Bank gerettet werden. Diesmal übernimmt der Finanzriese JP Morgan die First Republic. Eine erste Rettungsaktion mithilfe der führenden Banken des Landes war gesch…,https://bilder4.n-tv.de/img/incoming/crop24090691/2851325488-cImg_16_9-w1200/2023-04-09T110119Z-1681435766-RC21VZ9XNGKS-RTRMADP-3-GLOBAL-BANKS-SHORTSELLERS.jpg,2023-05-01T09:50:35Z,,Es ist wieder mal so weit: Schon zum dritten Mal innerhalb kurzer Zeit muss eine strauchelnde US-Bank gerettet werden. Diesmal übernimmt der Finanzriese JP Morgan die First Republic. Eine erste Rettu… [+1845 chars],,de,'Finanz'
https://www.zeit.de/news/2023-05/01/mann-springt-bei-flucht-vor-polizei-in-kanal,https://www.zeit.de/news/2023-05/01/mann-springt-bei-flucht-vor-polizei-in-kanal,0,www.zeit.de,Ermittlungen: Mann springt bei Flucht vor Polizei in Kanal,,,2023-05-01T10:51:06Z,,"When browsing with ads:
We collect personal data and also transmit it to third-party providers
 that help us improve and finance our digital content. Some of the information stored on your device, … [+732 chars]",,de,'Flucht'
https://www.morgenpost.de/wirtschaft/article238276847/usa-banken-krise-first-republic-jp-morgan.html,https://www.morgenpost.de/wirtschaft/article238276847/usa-banken-krise-first-republic-jp-morgan.html,0,www.morgenpost.de,Finanzbeben: Nächste US-Bank am Ende: J.P. Morgan schluckt First Republic,Durch das Bankenbeben war die First Republic Bank in Schieflage geraten. Nun fängt Finanzriese J.P. Morgan das taumelnde Geldhaus auf.,https://img.morgenpost.de/img/wirtschaft/crop238276845/6412606227-w820-cv16_9-q85/8b4ad6d4-e81a-11ed-b2e0-5190d01cc0f3.jpg,2023-05-01T12:34:05Z,,"Washington.  Jamie Dimon wird für den amerikanischen Finanz-Sektor immer wichtiger. Der Sohn griechischer Einwanderer half in der Weltfinanzkrise 2008, als sein Haus - J.P. Morgan - die abgestürzte I… [+2909 chars]",,de,'Finanz'
https://www.wiwo.de/unternehmen/handel/fluggesellschaft-finanzchefin-uebernimmt-das-steuer-bei-qantas/29125570.html,https://www.wiwo.de/unternehmen/handel/fluggesellschaft-finanzchefin-uebernimmt-das-steuer-bei-qantas/29125570.html,0,www.wiwo.de,Fluggesellschaft: Finanzchefin übernimmt das Steuer bei Qantas,Vanessa Hudson übernimmt die Position ab November von Konzernchef Alan Joyce. Sie ist seit 28 Jahren im Unternehmen tätig.,https://www.wiwo.de/images/vanessa-hudson/29125548/2-format11240.jpg,2023-05-02T02:55:00Z,,Erstmals in der Konzerngeschichte wird eine Frau das Ruder bei der australischen Fluggesellschaft Qantas in die Hand nehmen. Die bisherige Finanzchefin Vanessa Hudson wird im November die Nachfolge v… [+889 chars],,de,'Finanz'
https://www.handelsblatt.com/unternehmen/handel-konsumgueter/fluggesellschaft-finanzchefin-uebernimmt-das-steuer-bei-qantas/29125530.html,https://www.handelsblatt.com/unternehmen/handel-konsumgueter/fluggesellschaft-finanzchefin-uebernimmt-das-steuer-bei-qantas/29125530.html,0,www.handelsblatt.com,Fluggesellschaft: Finanzchefin übernimmt das Steuer bei Qantas,Vanessa Hudson übernimmt die Position ab November von Konzernchef Alan Joyce. Sie ist seit 28 Jahren im Unternehmen tätig.,https://www.handelsblatt.com/images/vanessa-hudson/29125548/2-format2003.jpg,2023-05-02T02:55:00Z,,"Vanessa HudsonDie jetzige Finanzchefin führt ab November das Unternehmen. 
(Foto: via REUTERS)
Bangalore Erstmals in der Konzerngeschichte wird eine Frau das Ruder bei der australischen Fluggesells… [+979 chars]",,de,'Finanz'
https://www.zeit.de/politik/ausland/2023-05/sudan-konflikt-un-flucht,https://www.zeit.de/politik/ausland/2023-05/sudan-konflikt-un-flucht,0,www.zeit.de,Vereinte Nationen: Mehr als 330.000 Menschen auf der Flucht im Sudan,Die humanitäre Krise im Sudan spitzt sich zu. Nach UN-Angaben haben bereits Hunderttausende Menschen ihre Heimat verlassen.,,2023-05-02T09:48:05Z,,"When browsing with ads:
We collect personal data and also transmit it to third-party providers
 that help us improve and finance our digital content. Some of the information stored on your device, … [+732 chars]",,de,'Krise'
https://www.welt.de/politik/ausland/article245106184/Binnenfluechtlinge-UN-rechnet-mit-330-000-Vertriebenen-durch-Kaempfe-im-Sudan.html,https://www.welt.de/politik/ausland/article245106184/Binnenfluechtlinge-UN-rechnet-mit-330-000-Vertriebenen-durch-Kaempfe-im-Sudan.html,0,www.welt.de,UN rechnet mit 330.000 Vertriebenen durch Kämpfe im Sudan,"Die Kämpfe im Sudan reißen trotz geltender Waffenruhe nicht ab. 73.000 Menschen sind laut UN bereits in Nachbarländer geflohen. Mehr als 330.000 werden aktuellen Schätzungen zufolge gezwungen sein, innerhalb des Landes zu fliehen. Und die Zahlen könnten noch …",https://img.welt.de/img/politik/ausland/mobile245046732/4881355537-ci16x9-w1200/People-walk-near-damaged-cars-and-buildings-at-the-central-market.jpg,2023-05-02T10:02:26Z,http://archive.md/20230502101312/https://www.welt.de/politik/ausland/article245106184/Binnenfluechtlinge-UN-rechnet-mit-330-000-Vertriebenen-durch-Kaempfe-im-Sudan.html,Durch die andauernden Kämpfe im Sudan sind seit Mitte April nach Angaben der UNO mehr als 330.000 Menschen zur Flucht innerhalb des Landes gezwungen worden. Das sagte ein Sprecher der Internationalen… [+1492 chars],,de,'Flucht'
https://www.diepresse.com/6282722/mehr-als-100000-menschen-bisher-aus-sudan-geflohen,https://www.diepresse.com/6282722/mehr-als-100000-menschen-bisher-aus-sudan-geflohen,0,www.diepresse.com,Mehr als 100.000 Menschen bisher aus Sudan geflohen,Seit Ausbruch des Konflikts wurden Hunderttausende zur Flucht gezwungen - auch innerhalb des Landes. Die Kämpfe könnten die ganze Region destabilisieren.,https://media.diepresse.com/social_diepresse_nachrichten/images/uploads_1200/d/e/2/6282722/E76B4C28-B450-4447-BDA3-E8C95FF39863_v0_h.jpg,2023-05-02T10:48:00Z,,"Seit Ausbruch des Konflikts wurden Hunderttausende zur Flucht gezwungen - auch innerhalb des Landes. Die Kämpfe könnten die ganze Region destabilisieren.
Vor den Kämpfen im Sudan sind nach Angaben d… [+1564 chars]",,de,'Flucht'
https://www.stern.de/gesellschaft/regional/rheinland-pfalz-saarland/gesundheitspolitik--scholz-und-dreyer-fuer-leichteren-zugang-zu-gesundheitsdaten-33429046.html,https://www.stern.de/gesellschaft/regional/rheinland-pfalz-saarland/gesundheitspolitik--scholz-und-dreyer-fuer-leichteren-zugang-zu-gesundheitsdaten-33429046.html,0,www.stern.de,Gesundheitspolitik: Scholz und Dreyer für leichteren Zugang zu Gesundheitsdaten,"Gute Rahmenbedingungen für forschende Pharmaunternehmen sind nach Einschätzung von Bundeskanzler Olaf Scholz (SPD) außerordentlich wichtig für Deutschland. ""Der Krieg in der Ukraine, die Pandemie und die damit zusammenhängenden Probleme in den weltweiten Lief…",https://image.stern.de/33429048/t/AV/v1/w1440/r1.7778/-/02--urnnewsmldpacom2009010123050299528977v2w800h600l486t367r1362b950jpeg---bff6be8ead4781eb.jpg,2023-05-02T11:38:55Z,,"Gute Rahmenbedingungen für forschende Pharmaunternehmen sind nach Einschätzung von Bundeskanzler Olaf Scholz (SPD) außerordentlich wichtig für Deutschland. ""Der Krieg in der Ukraine, die Pandemie und… [+1747 chars]",,de,'Ukraine'
https://consent.google.com/ml?continue=https://news.google.com/rss/articles/CBMikwFodHRwczovL3d3dy50YWdlc3NwaWVnZWwuZGUvaW50ZXJuYXRpb25hbGVzL3NjaGF0enVuZy12b24tdXMtZ2VoZWltZGllbnN0ZW4tcnVzc2xhbmQtc29sbC1zZWl0LWRlemVtYmVyLTEwMDAwMC1zb2xkYXRlbi12ZXJsb3Jlbi1oYWJlbi05NzQ3OTA1Lmh0bWzSAQA?oc%3D5&gl=FR&hl=en-US&cm=2&pc=n&src=1,https://consent.google.com/ml?continue=https://news.google.com/rss/articles/CBMikwFodHRwczovL3d3dy50YWdlc3NwaWVnZWwuZGUvaW50ZXJuYXRpb25hbGVzL3NjaGF0enVuZy12b24tdXMtZ2VoZWltZGllbnN0ZW4tcnVzc2xhbmQtc29sbC1zZWl0LWRlemVtYmVyLTEwMDAwMC1zb2xkYXRlbi12ZXJsb3Jlbi1oYWJlbi05NzQ3OTA1Lmh0bWzSAQA?oc%3D5&gl=FR&hl=en-US&cm=2&pc=n&src=1,0,consent.google.com,Schätzung von US-Geheimdiensten: Russland soll seit Dezember 100.000 Soldaten verloren haben - Tagesspiegel,"<ol><li>Schätzung von US-Geheimdiensten: Russland soll seit Dezember 100.000 Soldaten verloren haben  Tagesspiegel
</li><li>Ukraine-Krieg im Blog | Ukraine wirft Russland gezielte Angriffe auf Wohngebiete vor  t-online
</li><li>Krieg in der Ukraine im Live-…",,2023-05-02T11:42:00Z,,"We use cookies and data to<ul><li>Deliver and maintain Google services</li><li>Track outages and protect against spam, fraud, and abuse</li><li>Measure audience engagement and site statistics to unde… [+1131 chars]",,de,'Russland'
https://www.faz.net/aktuell/politik/ukraine-liveticker-schojgu-fordert-groessere-produktion-von-raketen-faz-18495964.html,https://www.faz.net/aktuell/politik/ukraine-liveticker-schojgu-fordert-groessere-produktion-von-raketen-faz-18495964.html,0,www.faz.net,Ukraine-Liveblog: Schojgu fordert größere Produktion von Raketen,Ukraine droht Enttäuschung bei NATO-Gipfel +++ Putin-treue Motorradfahrer Richtung Berlin aufgebrochen +++ Güterzug in Russland nach Sprengung entgleist +++ „Gegenoffensive könnte Tragödie für Russland werden“ +++ alle Entwicklungen im Liveblog,https://media0.faz.net/ppmedia/aktuell/politik/1302053775/1.8862980/facebook_teaser/russlands.jpg,2023-05-02T11:43:50Z,,Die Hoffnungen der Ukraine auf eine konkretere NATO-Beitrittsperspektive drohen vorerst enttäuscht zu werden. Nach Informationen der Deutschen Presse-Agentur haben zuletzt Bündnismitglieder wie die U… [+1070 chars],,de,'Russland'
https://www.welt.de/politik/ausland/plus245100688/Ukraine-Krieg-So-wichtig-sind-Drohnen-fuer-die-Gegenoffensive.html,https://www.welt.de/politik/ausland/plus245100688/Ukraine-Krieg-So-wichtig-sind-Drohnen-fuer-die-Gegenoffensive.html,0,www.welt.de,Der Krieg der Drohnen,"Die Ukraine legt viel Kreativität an den Tag, um frei erhältliche Drohnen für den Kriegseinsatz umzurüsten. Sie werden damit tatsächlich zu einer Gefahr für die Russen – die aber auch aufgerüstet haben. In den nächsten Wochen wird sich entscheiden, wer den Lu…",https://img.welt.de/img/incoming/mobile245105210/5321355437-ci16x9-w1200-fnov-fpotl-fpi157750653/FILE-A-Ukrainian-soldier-carries.jpg,2023-05-02T11:47:23Z,,"Eine Belohnung von 20 Millionen ukrainischen Hrywnja, umgerechnet etwa 490.000 Euro, hat Wolodymyr Jatsenko, Mitgründer der ukrainischen Monobank, demjenigen versprochen, der am 9. Mai eine Drohne au… [+413 chars]",,de,'Ukraine'
https://www.sueddeutsche.de/politik/russland-freiwillige-front-ukraine-1.5834247,https://www.sueddeutsche.de/politik/russland-freiwillige-front-ukraine-1.5834247,0,www.sueddeutsche.de,Russland: Ein hoher Einsatz,"Mit 64 Jahren beschloss der Russe Jurij Markow, freiwillig an der Front in der Ukraine zu kämpfen. Er glaubt an das, was Wladimir Putin erzählt. Aber auf die versprochene Entschädigung für seine Verletzungen wartet er noch immer.",https://www.sueddeutsche.de/image/sz.1.5834250/1200x675?v=1683028306,2023-05-02T11:52:01Z,,"Mit 64 Jahren beschloss der Russe Jurij Markow, freiwillig an der Front in der Ukraine zu kämpfen. Er glaubt an das, was Wladimir Putin erzählt. Aber auf die versprochene Entschädigung für seine Verl… [+361 chars]",,de,'Ukraine'
https://consent.google.com/ml?continue=https://news.google.com/rss/articles/CBMihQFodHRwczovL3dlYi5kZS9tYWdhemluZS9wb2xpdGlrL3J1c3NsYW5kLWtyaWVnLXVrcmFpbmUva3JpZWctdWtyYWluZS1saXZlLXRpY2tlci1tdW5pdGlvbnNtYW5nZWwtc2Nob2lndS1rb250ZXJ0LXdhZ25lci1jaGVmLTM4MTY2NTUw0gEA?oc%3D5&gl=FR&hl=en-US&cm=2&pc=n&src=1,https://consent.google.com/ml?continue=https://news.google.com/rss/articles/CBMihQFodHRwczovL3dlYi5kZS9tYWdhemluZS9wb2xpdGlrL3J1c3NsYW5kLWtyaWVnLXVrcmFpbmUva3JpZWctdWtyYWluZS1saXZlLXRpY2tlci1tdW5pdGlvbnNtYW5nZWwtc2Nob2lndS1rb250ZXJ0LXdhZ25lci1jaGVmLTM4MTY2NTUw0gEA?oc%3D5&gl=FR&hl=en-US&cm=2&pc=n&src=1,0,consent.google.com,Krieg in der Ukraine im Live-Ticker: Munitionsmangel? Schoigu kontert nach jüngsten Klagen des Wagner-Chefs - WEB.DE News,Krieg in der Ukraine im Live-Ticker: Munitionsmangel? Schoigu kontert nach jüngsten Klagen des Wagner-Chefs  WEB.DE NewsMehr zum Thema ansehen in Google News,,2023-05-02T11:54:28Z,,"We use cookies and data to<ul><li>Deliver and maintain Google services</li><li>Track outages and protect against spam, fraud, and abuse</li><li>Measure audience engagement and site statistics to unde… [+1131 chars]",,de,'Ukraine'
https://www.zeit.de/news/2023-05/02/judith-holofernes-erhaelt-fred-jay-preis-fuer-ihre-songtexte,https://www.zeit.de/news/2023-05/02/judith-holofernes-erhaelt-fred-jay-preis-fuer-ihre-songtexte,0,www.zeit.de,Musik: Judith Holofernes erhält Fred Jay Preis für ihre Songtexte,,,2023-05-02T12:01:33Z,,"When browsing with ads:
We collect personal data and also transmit it to third-party providers
 that help us improve and finance our digital content. Some of the information stored on your device, … [+732 chars]",,de,'Preis'
https://www.welt.de/kultur/literarischewelt/article244516760/Alexander-Kluge-Warum-die-Grausamkeit-aufhoeren-muss.html,https://www.welt.de/kultur/literarischewelt/article244516760/Alexander-Kluge-Warum-die-Grausamkeit-aufhoeren-muss.html,0,www.welt.de,Das Wetter in den Ardennen rettete Deutschland vor der Atombombe,"Kriege, die unerledigt enden, hören nicht auf, sagt Schriftsteller Alexander Kluge. In seiner „Kriegsfibel 2023“ blickt er auf die Gegenwart in der Ukraine wie auf die Vergangenheit des Zweiten Weltkriegs - auf ein „Knäuel von Konflikten“ und die großen Folge…",https://img.welt.de/img/kultur/literarischewelt/mobile245072270/1311357277-ci16x9-w1200/Alexander-Kluge.jpg,2023-05-02T12:05:23Z,http://archive.md/20230502130730/https://www.welt.de/kultur/literarischewelt/article244516760/Alexander-Kluge-Warum-die-Grausamkeit-aufhoeren-muss.html,"Der Krieg ist ein Maulwurf, der Frieden wohl eher eine Schildkröte. Kriege, die unerledigt enden, hören nicht auf, im Untergrund zu wühlen. Sie graben sich durch die Jahrhunderte voran, schreibt der … [+4590 chars]",,de,'Ukraine'
https://noe.orf.at/stories/3205584/,https://noe.orf.at/stories/3205584/,0,noe.orf.at,Nach Verfolgungsjagd: Weitere Diebstähle geklärt,Nach einer spektakulären Flucht vor der Polizei samt Pkw-Crash gegen eine Gartenmauer in Gerersdorf (Bezirk St. Pölten) konnte die Polizei einem 22-Jährigen weitere Diebstähle zuordnen. Der Mann befindet sich in der Justizanstalt St. Pölten in Haft.,https://ibs.orf.at/noe?image=https%3A%2F%2Foekastatic.orf.at%2Fmims%2F2023%2F17%2F50%2Fcrops%2Fw%3D1200%2Ch%3D627%2Cq%3D75%2F1767584_master_656250_1.jpg%3Fs%3D04509c66b868040b06cd57169102d750973940a9,2023-05-02T12:20:17Z,,"Die Verfolgungsjagd hatte vergangene Woche mit zwei verletzten Männern, einem brennenden Fahrzeug und einer Festnahme geendet. Der 22-Jährige war damals mit einem möglichen Komplizen nach einem Treib… [+975 chars]",,de,'Flucht'
https://www.zeit.de/news/2023-05/02/pressefreiheit-preis-fuer-iranische-journalistin-hamedi,https://www.zeit.de/news/2023-05/02/pressefreiheit-preis-fuer-iranische-journalistin-hamedi,0,www.zeit.de,Auszeichnung: Pressefreiheit-Preis für iranische Journalistin Hamedi,,,2023-05-02T12:32:30Z,,"When browsing with ads:
We collect personal data and also transmit it to third-party providers
 that help us improve and finance our digital content. Some of the information stored on your device, … [+732 chars]",,de,'Preis'
