index,url,valid,domain,title,description,image,published,archive,content,quote,language,keyword
https://www.bild.de/politik/inland/heiz-gesetz-das-muessen-mieter-und-eigentuemer-jetzt-wissen-69f31b371f066f0e6e19909f,https://www.bild.de/politik/inland/heiz-gesetz-das-muessen-mieter-und-eigentuemer-jetzt-wissen-69f31b371f066f0e6e19909f,0,www.bild.de,Regierung einig über neues Gesetz - DAS kommt jetzt beim Heizen auf Sie zu,Berlin – Die schwarz-rote Koalition hat sich bei der geplanten Reform des Heiz-Gesetzes auf eine Kostenbremse für Mieter geeinigt. Eckpunkte für eine Ref...,"https://images.bild.de/69f31b371f066f0e6e19909f/cef8b0532e0b31f48860b91f03d33758,58747190?w=1280",2026-05-01T01:05:26Z,,"Die schwarz-rote Koalition hat sich bei der geplanten Reform des Heiz-Gesetzes auf eine Kostenbremse für Mieter geeinigt: Neue Gas- und Ölheizungen bleiben erlaubt, doch ab 2029 greift die Biotreppe … [+370 chars]",,de,'heizen'
https://www.zeit.de/news/2026-05/01/forscher-bayerns-rueckzug-von-klimaziel-2040-fatales-signal,https://www.zeit.de/news/2026-05/01/forscher-bayerns-rueckzug-von-klimaziel-2040-fatales-signal,0,www.zeit.de,Klimaschutz: Forscher: Bayerns Rückzug von Klimaziel 2040 fatales Signal,Hier finden Sie Informationen zu dem Thema „Klimaschutz“. Lesen Sie jetzt „Forscher: Bayerns Rückzug von Klimaziel 2040 fatales Signal“.,https://img.zeit.de/news/2026-05/01/forscher-bayerns-rueckzug-von-klimaziel-2040-fatales-signal-image-group/wide__1300x731,2026-05-01T02:30:09Z,,Wissenschaftler werten den Ausstieg Bayerns aus dem selbst gesetzten Klimaziel 2040 als verheerendes Zeichen mit Wirkung weit über die Grenzen des Freistaats hinaus. «Auch wenn es für das globale Kli… [+3636 chars],,de,'Klima'
https://steiermark.orf.at/magazin/stories/3350501/,https://steiermark.orf.at/magazin/stories/3350501/,0,steiermark.orf.at,Roth: „Österreich ist ein komplexer Markt“,Der Iran-Krieg hat derzeit großen Einfluss auf das Rauf und Runter an den Tankstellen. Allein über die Straße von Hormus fließen laut dem Grazer Experten Jürgen Roth 20 Prozent der weltweiten Energie – im ORF-Gespräch beleuchtet er den komplexen Handelsweg de…,https://ibs.orf.at/stm?image=https%3A%2F%2Foekastatic.orf.at%2Fmims%2F2019%2F38%2F36%2Fcrops%2Fw%3D1200%2Ch%3D627%2Cq%3D75%2F298841_master_92636_heizoel_.jpg%3Fs%3D015d19a456c054f8d8a598024bac9e1933fc486a,2026-05-01T07:45:00Z,,"Nach zähen Regierungsverhandlungen wird die Spritpreis-Bremse nun doch in abgespeckter Form verlängert. Bis jetzt waren die Preise an den Zapfsäulen um zehn Cent pro Liter geringer, ab Freitag werden… [+2119 chars]",,de,'Iran'
https://www.focus.de/politik/ausland/usa-starten-milliarden-offensive-auf-dem-balkan-mit-gas-deals-und-ki-mega-projekt_7a491b70-32d1-45cc-8fb9-d9cab5601b0e.html,https://www.focus.de/politik/ausland/usa-starten-milliarden-offensive-auf-dem-balkan-mit-gas-deals-und-ki-mega-projekt_7a491b70-32d1-45cc-8fb9-d9cab5601b0e.html,0,www.focus.de,USA starten Milliarden-Offensive auf dem Balkan – mit Gas-Deals und KI-Mega-Projekt,Die USA stecken Milliarden in Energie und KI im Balkan und nehmen Russland damit einen seiner wichtigsten Einflussräume in Europa.,"https://quadro.burda-forward.de/ctf/9840bf4b-499f-4860-97dd-b7196961ba49.c6c448c0-cfc1-4bb2-aba3-8235624c702b.jpg?im=RegionOfInterestCrop=(1200,630),regionOfInterest=(3828,703)&hash=b057bd96026628910f0729d391130e2c9cb870a5f6ed3181a811e163ed98f52f",2026-05-01T08:38:00Z,,Die USA bauen ihren Einfluss auf dem Balkan mit milliardenschweren Energie- und Technologieprojekten aus. Nach Informationen von Reuters schließen die Vereinigten Staaten und US-Firmen neue Gasverträ… [+2406 chars],,de,'Gas'
https://www.welt.de/politik/ausland/plus69f324c84c47c7adc671d545/nato-uebung-labor-der-zukunft-mit-diesem-manoever-sendet-frankreich-ein-unmissverstaendliches-signal.html,https://www.welt.de/politik/ausland/plus69f324c84c47c7adc671d545/nato-uebung-labor-der-zukunft-mit-diesem-manoever-sendet-frankreich-ein-unmissverstaendliches-signal.html,0,www.welt.de,„Labor der Zukunft“ – Mit diesem Manöver sendet Frankreich ein unmissverständliches Signal,"Frankreich richtet die größte Militärübung seit dem Kalten Krieg aus und simuliert mit Nato-Partnern den Drohnenkrieg. Vor Ort wird sichtbar, wie sich das Bündnis auf einen Angriff mit hochmodernen Waffen vorbereitet – und worauf es im Krieg von morgen ankomm…",https://images.welt.de/69f324c84c47c7adc671d545/b2b4f7bbe17b7c8d50a18d356ddb082d-master/ci16x9-w1200/2026-04-30t121451z-798405475-rc2nzka1yh8d-rtrmadp-3-france-defence-army-jpg,2026-05-01T12:03:19Z,,"Frankreich richtet die größte Militärübung seit dem Kalten Krieg aus und simuliert mit Nato-Partnern den Drohnenkrieg. Vor Ort wird sichtbar, wie sich das Bündnis auf einen Angriff mit hochmodernen W… [+59 chars]",,de,'Waffen'
https://www.stern.de/news/tankrabatt-in-kraft--spritpreise-an-den-zapfsaeulen-sinken-37360340.html,https://www.stern.de/news/tankrabatt-in-kraft--spritpreise-an-den-zapfsaeulen-sinken-37360340.html,0,www.stern.de,Tankrabatt in Kraft: Spritpreise an den Zapfsäulen sinken,"Mit Inkrafttreten des Tankrabatts sind die Preise an den Zapfsäulen in Deutschland am Freitag deutlich gesunken - allerdings war das Niveau am Vortag auch sehr hoch. Von Donnerstag- bis Freitagmittag ging der Preis für einen Liter E10 laut ADAC um 15,8 Cent z…",https://image.stern.de/37360598/t/qp/v1/w1440/r1.7778/-/01--tankstelle-in-berlin---2d2969cb65cb763b.jpg,2026-05-01T12:17:04Z,,"Kopiere den aktuellen Link
Zur Merkliste hinzufügen
Mit Inkrafttreten des Tankrabatts sind die Preise an den Zapfsäulen in Deutschland am Freitag deutlich gesunken - allerdings war das Niveau am Vo… [+3218 chars]",,de,'Preis'
https://www.bild.de/regional/hessen/tragoedie-in-hessen-gas-unfall-in-lederfabrik-fordert-5-todesopfer-69f46d9b6fe2dee7bfb0f8e9,https://www.bild.de/regional/hessen/tragoedie-in-hessen-gas-unfall-in-lederfabrik-fordert-5-todesopfer-69f46d9b6fe2dee7bfb0f8e9,0,www.bild.de,Tragödie in Hessen - Gas-Unfall in Lederfabrik fordert 5. Todesopfer,14 Tage nach dem tragischen Unfall in einer Lederfabrik in Runkel (Hessen) ist ein fünfter Arbeiter an seinen Verletzungen gestorben.,"https://images.bild.de/69f46d9b6fe2dee7bfb0f8e9/cf061267c2e8626bb2efd72c020003f7,9ae725fb?w=1280",2026-05-01T12:37:40Z,,TTS-Player überspringenArtikel weiterlesenRunkel (Hessen) Er kämpfte 14 Tage lang gegen den Tod an. Doch am Ende reichten seine Kräfte nicht. Zwei Wochen nach dem schweren Gas-Unfall in einer Lederfa… [+2210 chars],,de,'Gas'
https://www.zeit.de/wirtschaft/2026-04/druschba-pipeline-oel-lieferstopp-pck-raffinerie,https://www.zeit.de/wirtschaft/2026-04/druschba-pipeline-oel-lieferstopp-pck-raffinerie,0,www.zeit.de,Lieferstopp von kasachischem Öl: Was bedeutet der Druschba-Öl-Lieferstopp für Deutschland?,Russland stoppt die Öllieferung durch die Druschba-Pipeline von Kasachstan nach Deutschland. Welche Auswirkungen hat das? Und wird Sprit in Berlin bald richtig teuer?,https://img.zeit.de/wirtschaft/unternehmen/2026-04/kasachstan-oel-schwedt-russland-transit-gestoppt-gxe-bild/wide__1300x731,2026-05-01T17:09:00Z,,Russland will ab dem 1. Mai kein kasachisches Öl mehr über die Pipeline Druschba nach Deutschland durchlassen. Die Regierung in Moskau beruft sich dabei auf technische Schwierigkeiten. Warum kann Rus… [+6748 chars],,de,'Russland'
https://www.faz.net/aktuell/wirtschaft/das-aendert-sich-fuer-mieter-im-neuen-heizungsgesetz-200787023.html,https://www.faz.net/aktuell/wirtschaft/das-aendert-sich-fuer-mieter-im-neuen-heizungsgesetz-200787023.html,0,www.faz.net,Kostenbremse für die Wärmewende: Das ändert sich für Mieter im neuen Heizungsgesetz,"Vermieter und Mieter sollen Teile der Kosten für Öl und Gas je zur Hälfte tragen. Die Koalition zeigt neue Geschlossenheit, Klimaschützer und Wohneigentümer halten den Entwurf für falsch – aus gegenteiligen Gründen.",https://media0.faz.net/image/w1200h627/e8c69e0655a1/w3000h1567x0y214o/202601/43601.0.1642267411/schoen-warm-und-schoen-gruen.webp,2026-05-01T18:16:02Z,,Die Bundesregierung will Mieter von Teilen der hohen Betriebskosten für neue Gas- oder Ölheizungen entlasten. Künftig sollen die Wohnungseigentümer rund die Hälfte der zusätzlichen laufenden Ausgaben… [+5819 chars],,de,'Gas'
https://www.stern.de/gesellschaft/regional/nordrhein-westfalen/energiekosten--eon-verspricht-bestandskunden-stabile-strom--und-gaspreise-37361528.html,https://www.stern.de/gesellschaft/regional/nordrhein-westfalen/energiekosten--eon-verspricht-bestandskunden-stabile-strom--und-gaspreise-37361528.html,0,www.stern.de,Energiekosten: Eon verspricht Bestandskunden stabile Strom- und Gaspreise,Wie wirkt sich der Irankrieg in diesem Jahr auf Versorgungssicherheit und Energiepreise aus? Für seine Strom- und Gaskunden hat Deutschlands größter Energieversorger schon jetzt eine Antwort.,https://image.stern.de/37361530/t/ra/v1/w1440/r1.7778/-/02--z5kjahiyvzv11axs2048jpeg---53c322e3b9b5e568.jpg,2026-05-02T02:30:04Z,,"Kopiere den aktuellen Link
Zur Merkliste hinzufügen
Wie wirkt sich der Irankrieg in diesem Jahr auf Versorgungssicherheit und Energiepreise aus? Für seine Strom- und Gaskunden hat Deutschlands größ… [+3532 chars]",,de,'Gas'
https://www.zeit.de/news/2026-05/02/eon-verspricht-bestandskunden-stabile-strom-und-gaspreise,https://www.zeit.de/news/2026-05/02/eon-verspricht-bestandskunden-stabile-strom-und-gaspreise,0,www.zeit.de,Energiekosten: Eon verspricht Bestandskunden stabile Strom- und Gaspreise,Hier finden Sie Informationen zu dem Thema „Energiekosten“. Lesen Sie jetzt „Eon verspricht Bestandskunden stabile Strom- und Gaspreise“.,https://img.zeit.de/news/2026-05/02/eon-verspricht-bestandskunden-stabile-strom-und-gaspreise-image-group/wide__1300x731,2026-05-02T02:30:04Z,,Deutschlands größter Energieversorger Eon will in diesem Jahr bei Strom und Gas nicht mehr an der Preisschraube drehen. «Wir als Eon werden die Strom- und Gaspreise für unsere Bestandskundinnen und -… [+3321 chars],,de,'Gas'
https://www.nzz.ch/schweiz/viele-glauben-wenn-die-gruenen-klein-seien-gelte-das-auch-fuer-die-klimakrise-das-ist-fatal-ld.10005172,https://www.nzz.ch/schweiz/viele-glauben-wenn-die-gruenen-klein-seien-gelte-das-auch-fuer-die-klimakrise-das-ist-fatal-ld.10005172,0,www.nzz.ch,"INTERVIEW - «Viele glauben, wenn die Grünen klein seien, gelte das auch für die Klimakrise. Das ist fatal»","Aline Trede hat mit ihrer Partei Wahlen und Abstimmungen gewonnen, inzwischen aber gehen reihenweise Mandate verloren. Im Gespräch erklärt sie, dass in der Politik das «Hässig-Sii» im Trend liege, dass sie die SP enttäuscht habe und wie es jetzt mit den Grüne…","https://img-msp-prod.nzz.ch/2026/04/30/1b649029-80c1-4ccb-980a-7a0583df6b6e.jpg?width=1200&height=674&fit=bounds&quality=75&auto=webp&crop=4706,2647,x0,y245&wmark=nzz",2026-05-02T03:30:00Z,,"Aline Trede hat mit ihrer Partei Wahlen und Abstimmungen gewonnen, inzwischen aber gehen reihenweise Mandate verloren. Im Gespräch erklärt sie, dass in der Politik das «Hässig-Sii» im Trend liege, da… [+13194 chars]",,de,'Klima'
https://www.focus.de/finanzen/vae-umgehen-strasse-von-hormus-mit-pipeline-und-bahn_6f66fa27-85be-46f1-987a-8b70c8d9528a.html,https://www.focus.de/finanzen/vae-umgehen-strasse-von-hormus-mit-pipeline-und-bahn_6f66fa27-85be-46f1-987a-8b70c8d9528a.html,0,www.focus.de,VAE umgehen Straße von Hormus – mit Pipeline und Bahn,Die Vereinigten Arabischen Emirate könnten eine wichtige Rolle bei der Umgehung der Straße von Hormus spielen. Entscheidend ist der Hafen Fudschaira.,"https://quadro.burda-forward.de/ctf/e5466ba1-c80f-4d98-832e-1942c7df8272.2884a1cc-f94e-4fe5-9ace-22ec06a1d367.jpg?im=RegionOfInterestCrop=(1200,630),regionOfInterest=(1803,1075)&hash=230dab749dec288e2f19cc608a8c927456e7a70ba4230e964043f99d6a240fd6",2026-05-02T04:09:00Z,,"Der Hafen Fudschaira liegt östlich der Straße von Hormus am Golf von Oman. Vor dem Krieg ging etwa die Hälfte der Ölexporte der VAE per Habshan-Pipeline nach Fudschaira: 1,8 Millionen Barrel pro Tag … [+2938 chars]",,de,'Gas'
https://www.focus.de/auto/ratgeber/tankstellen-umgehen-mit-dem-fruehstarter-trick-neue-preisregel_2c6eb5d5-159e-4d29-9d33-787d1ddb9877.html,https://www.focus.de/auto/ratgeber/tankstellen-umgehen-mit-dem-fruehstarter-trick-neue-preisregel_2c6eb5d5-159e-4d29-9d33-787d1ddb9877.html,0,www.focus.de,"Tankstellen umgehen mit dem ""Frühstarter-Effekt"" neue Preisregel","Zum 1. Mai soll es eine kleine Steuersenkung beim Benzin geben. Doch Daten zeigen, dass Tankstellen schon beim erlaubten Erhöhungs-Zeitpunkt tricksen.","https://quadro.burda-forward.de/ctf/a1dc0c62-b05e-47c4-be24-a6c949411a07.4c5baad0-a5ad-47af-97e6-fb7e878de277.jpeg?im=RegionOfInterestCrop=(1200,630),regionOfInterest=(590,687)&hash=1703db59d3b14ec3aa37698427ea3eb9ae61111edbda5536782af7fc8a4ac1cf",2026-05-02T04:12:00Z,,Am 1. Mai (Freitag) tritt die sogenannte Preisbremse beim Tanken inkraft. Von Anfang Mai bis Ende Juni sollen die Steuern auf Diesel und Benzin um je rund 17 Cent brutto pro Liter gesenkt werden. Sei… [+3511 chars],,de,'Gas'
https://www.welt.de/regionales/nrw/article69f0820648f8152efecc978b/rohstoffknappheit-welche-bodenschaetze-in-nrw-gefoerdert-werden-koennten.html,https://www.welt.de/regionales/nrw/article69f0820648f8152efecc978b/rohstoffknappheit-welche-bodenschaetze-in-nrw-gefoerdert-werden-koennten.html,0,www.welt.de,Die Schätze im Boden von Rheinland und Westfalen,"In den Tiefen des Landes NRW lagern viele Rohstoffe. Gefördert werden nur wenige. Doch das müsse man in Zeiten globaler Krisen überdenken, sagen Experten.",https://images.welt.de/69f0820648f8152efecc978b/25aa81b47d314ecfe961a6c76d56f280-master/ci16x9-w1200/587421389-jpg,2026-05-02T04:51:15Z,,"In den Tiefen des Landes NRW lagern viele Rohstoffe. Gefördert werden nur wenige. Doch das müsse man in Zeiten globaler Krisen überdenken, sagen Experten.Am Rand eines Gewerbegebiets am Stadtrand Kre… [+7476 chars]",,de,'Krise'
https://www.faz.net/aktuell/finanzen/welche-europaeischen-aktien-jetzt-potential-haben-accg-200772259.html,https://www.faz.net/aktuell/finanzen/welche-europaeischen-aktien-jetzt-potential-haben-accg-200772259.html,0,www.faz.net,Geldanlage: Welche europäischen Aktien jetzt Potential haben,Auf der Suche nach Rendite waren die USA lange Zeit das Maß aller Dinge. Doch auch Europa hat einiges zu bieten. Öl und Gas stehen hoch im Kurs.,https://media0.faz.net/image/w1200h627/3858eb7cf9a6/w3488h1822x0y70o/202604/43601.0.2034418977/mit-bildschirminseln-der.webp,2026-05-02T08:28:33Z,,Eigentlich sollte es ein Jahr der europäischen Aktien werden. Die Unsicherheiten in den USA sorgten spätestens mit dem Amtsantritt von Donald Trump zum Jahresanfang 2025 für ein Umleiten von Kapital … [+169 chars],,de,'Gas'
https://www.telepolis.de/article/Kapitalismus-und-Krieg-Warum-Frieden-systemfremd-wirkt-11277866.html,https://www.telepolis.de/article/Kapitalismus-und-Krieg-Warum-Frieden-systemfremd-wirkt-11277866.html,0,www.telepolis.de,Kapitalismus und Krieg: Warum Frieden systemfremd wirkt,"Zwischen Wachstumszwang, Profitinteressen und autoritären Tendenzen – eine kritische Perspektive auf Ukraine-Krieg und globale Aufrüstung",https://heise.cloudimg.io/bound/1200x1200/q85.png-lossy-85.webp-lossy-85.foil1/_www-heise-de_/imgs/18/5/0/7/4/2/9/3/panzer-01-c7c73cac7a02a9ca.jpg,2026-05-02T10:00:00Z,,"Zwischen Wachstumszwang, Profitinteressen und autoritären Tendenzen eine kritische Perspektive auf Ukraine-Krieg und globale Aufrüstung
Marx/ Engels lehrten uns, dass der Kapitalismus ein System ist… [+15060 chars]",,de,'Ukraine'
https://www.faz.net/aktuell/stil/essen-trinken/kuechen-koeche/so-isst-politik-oman-laesst-gruessen-accg-200785195.html,https://www.faz.net/aktuell/stil/essen-trinken/kuechen-koeche/so-isst-politik-oman-laesst-gruessen-accg-200785195.html,0,www.faz.net,So isst Politik: Nervennahrung für Beamte in der Krise,Diese Woche probiert sich unsere Kolumnistin an einem Reisgericht der Botschafterin von Oman. Lässt sich so die Hormus-Krise lösen?,https://media0.faz.net/image/w1200h627/6212a36abf42/w3000h1567x0y113o/202604/c047022a-43e5-11f1-8527-64eaa3489506/madfun-die-nervennahrung-fuer.webp,2026-05-02T10:46:51Z,,"In Deutschland ist es populär, Flächen in der Maßeinheit Saarland anzugeben. Wobei ist es wirklich populär? Für Saarländer ist es ärgerlich und für alle anderen langweilig. So genau kann man sich die… [+2510 chars]",,de,'Hormus'
https://www.stern.de/geo/das-wunder-im-wald--ein-jahr-im-leben-einer-eiche-37338712.html,https://www.stern.de/geo/das-wunder-im-wald--ein-jahr-im-leben-einer-eiche-37338712.html,0,www.stern.de,Zyklus der Natur: Das Wunder im Wald: Ein Jahr im Leben einer Eiche,"Eichen sind faszinierende Wunderwerke der Natur: Sie trotzen Stürmen und Kälte. Immer besser verstehen Forscher, welche verborgenen Prozesse ihnen helfen, sich an jede Saison anzupassen.",https://image.stern.de/37338714/t/D7/v4/w1440/r1.7778/-/adobestock-422631630.jpg,2026-05-02T11:36:00Z,,"Zugang zu stern+statt 11,96 
 nur 1  
<ul><li>Alles von stern+ mit erstklassigen Inhalten von GEO und Capital</li><li>4 Wochen testen, dann 2,99  je Woche</li><li>jederzeit kündbar</li></ul>",,de,'Kälte'
https://www.faz.net/aktuell/politik/usa-unter-trump/worum-es-fuer-die-nato-in-der-strasse-von-hormus-geht-200789575.html,https://www.faz.net/aktuell/politik/usa-unter-trump/worum-es-fuer-die-nato-in-der-strasse-von-hormus-geht-200789575.html,0,www.faz.net,Straße von Hormus: Die NATO in der Bredouille,Die Europäer dürfen sich nicht mehr als notwendig von den USA abhängig machen. Sie müssen sich aber mit ihnen arrangieren.,https://media0.faz.net/image/w1200h627/382f5075e790/w3000h1567x0y210o/202605/50abe450-455f-11f1-8527-64eaa3489506/unruhe-in-der-nordatlantischen.webp,2026-05-02T12:28:24Z,,In der Straße von Hormus steckt nicht nur die internationale Schifffahrt in der Klemme. Die von Iran gesperrte Meerenge hat auch die NATO und ihre Verbündeten in die Bredouille gebracht. Sollen sie s… [+4588 chars],,de,'Hormus'
https://www.focus.de/sport/fussball/iran-attackiert-fifa-und-stellt-bedingungen-fuer-wm-teilnahme-in-den-usa_bf026148-f480-482b-b193-3a435a99928c.html,https://www.focus.de/sport/fussball/iran-attackiert-fifa-und-stellt-bedingungen-fuer-wm-teilnahme-in-den-usa_bf026148-f480-482b-b193-3a435a99928c.html,0,www.focus.de,Iran attackiert Fifa und stellt Bedingungen für WM-Teilnahme in den USA,Der iranische Fußball-Verband (FFI) hat den Weltverband Fifa scharf kritisiert und will Bedingungen für eine Teilnahme an der Weltmeisterschaft stellen.,"https://quadro.burda-forward.de/ctf/61fb6258-f647-474c-9862-94dfd3b43876.5937f167-c987-4e8b-b28d-c873e1985001.jpg?im=RegionOfInterestCrop=(1200,630),regionOfInterest=(405,276)&hash=ae67bf1300d50576778f16c5212bc84a0f2bffddb7e561b27ae850f3850105e9",2026-05-02T18:00:00Z,,"""Ich habe die Fifa noch nie so schwach erlebt"", sagte Verbandschef Mehdi Tadsch laut Nachrichtenagentur Tasnim. Anstatt gegen ""Beleidigungen und Erniedrigungen gegenüber dem Iran"" vorzugehen, lasse s… [+2142 chars]",,de,'Iran'
https://www.tagesschau.de/ausland/asien/mohammadi-nobelpreistraegerin-iran-100.html,https://www.tagesschau.de/ausland/asien/mohammadi-nobelpreistraegerin-iran-100.html,0,www.tagesschau.de,"Friedensnobelpreisträgerin Mohammadi in ""äußerst akuter Gefahr""",Die Friedensnobelpreisträgerin Mohammadi ist nach Angaben ihrer Stiftung in einem sehr kritischen Zustand. Sie war in einem Gefängnis im Iran kollabiert und in eine Klinik verlegt worden.,https://images.tagesschau.de/image/ecd07ace-b615-4d3c-957b-3419f56c3dff/AAABldudYQQ/AAABnSSvrFg/16x9-big/nargis-mohammedi-100.jpg?width=1280,2026-05-02T18:56:07Z,,"Stand: 02.05.2026 20:56 Uhr
Die Friedensnobelpreisträgerin Mohammadi ist nach Angaben ihrer Stiftung in einem sehr kritischen Zustand. Sie war in einem Gefängnis im Iran kollabiert und in eine Klini… [+1970 chars]",,de,'Iran'
https://www.stern.de/news/iranische-nobelpreistraegerin-mohammadi-aus-gefaengnis-ins-krankenhaus-gebracht-37362342.html,https://www.stern.de/news/iranische-nobelpreistraegerin-mohammadi-aus-gefaengnis-ins-krankenhaus-gebracht-37362342.html,0,www.stern.de,Iranische Nobelpreisträgerin Mohammadi aus Gefängnis ins Krankenhaus gebracht,"Die inhaftierte iranische Friedensnobelpreisträgerin Narges Mohammadi ist nach Angaben ihrer Unterstützer ""nach einer katastrophalen Verschlechterung ihres Gesundheitszustands"" ins Krankenhaus eingeliefert worden. Die 54-jährige Aktivistin sei am Freitag eili…",https://image.stern.de/37362966/t/1y/v1/w1440/r1.7778/-/02--archivbild-von-narges-mohammadi---f1cb6b92f56d582a.jpg,2026-05-02T19:19:22Z,,"Kopiere den aktuellen Link
Zur Merkliste hinzufügen
Die inhaftierte iranische Friedensnobelpreisträgerin Narges Mohammadi ist nach Angaben ihrer Unterstützer ""nach einer katastrophalen Verschlechte… [+2342 chars]",,de,'Iran'
https://www.n-tv.de/politik/Bewaffnete-kapern-Oeltanker-im-Golf-von-Aden-id30779322.html,https://www.n-tv.de/politik/Bewaffnete-kapern-Oeltanker-im-Golf-von-Aden-id30779322.html,0,www.n-tv.de,Angst vor Piraterie-Rückkehr: Bewaffnete kapern Öltanker im Golf von Aden,"Der Schiffsverkehr im Nahen Osten macht zuletzt vor allem durch die geschlossene Straße von Hormus von sich reden. Piraterie rückt völlig in den Hintergrund. Bis jetzt. Nun wird ein Öltanker gekapert. Von wem ist unklar, wohin er gebracht wird, ebenfalls.",https://www.n-tv.de/img/30779326/1777751522/Img_16_9/1200/Tanker-ankern-in-der-Strasse-von-Hormuz-vor-der-Kueste-der-Insel-Qeschm.jpg,2026-05-02T19:37:11Z,,"Zwei Öltanker in der Straße von Hormus. (Foto: picture alliance/dpa/AP)
Der Schiffsverkehr im Nahen Osten macht zuletzt vor allem durch die geschlossene Straße von Hormus von sich reden. Piraterie r… [+2283 chars]",,de,'Iran'
https://www.focus.de/kultur/kino-tv/ein-jahr-kanzler-friedrich-merz-bei-caren-miosga-im-liveticker_0373efb1-ab3b-4c39-a213-529c869c1d71.html,https://www.focus.de/kultur/kino-tv/ein-jahr-kanzler-friedrich-merz-bei-caren-miosga-im-liveticker_0373efb1-ab3b-4c39-a213-529c869c1d71.html,0,www.focus.de,Ein Jahr Kanzler: Friedrich Merz bei Caren Miosga im Liveticker,Vor knapp einem Jahr ist Friedrich Merz das Amt als Bundeskanzler angetreten. Am Sonntag ist er zu Gast bei Caren Miosga. Die Frage: Wie schwer ist regieren? Der ARD-Talk im Liveticker.,"https://quadro.burda-forward.de/ctf/5e2576a5-587c-4924-a45c-af5a760b1dca.9fba9587-29ba-446a-a74f-9aed1a5040d1.jpeg?im=RegionOfInterestCrop=(1200,630),regionOfInterest=(1037,796)&hash=48c4ff610ebcfb2ca22f4e066a419c516427e3692a04f00b064399df7d61cea3",2026-05-02T20:04:00Z,,"Knapp ein Jahr nach seinem Amtsantritt am 06. Mai 2025 steht Bundeskanzler Friedrich Merz (CDU) unter erheblichem Druck. Bei Caren Miosga (Sonntag, 21.45 Uhr/ARD) steht er nun Rede und Antwort. Das T… [+772 chars]",,de,'Iran'
https://orf.at/stories/3428635/,https://orf.at/stories/3428635/,0,orf.at,US-Regierung billigt Waffenexporte an Partner,,https://orf.at/mojo/1_4_1/storyserver//news/common/images/og-fallback-news.png,2026-05-02T20:31:57Z,,"Das US-Außenministerium hat heute milliardenschwere Waffenlieferungen an Bahrain, Israel, Kuwait, Katar und die Vereinigten Arabischen Emirate genehmigt.
Per Notfallbeschluss habe Außenminister Marc… [+989 chars]",,de,'Waffen'
https://www.n-tv.de/politik/Nobelpreistraegerin-Narges-Mohammadi-auf-Intensivstation-id30779608.html,https://www.n-tv.de/politik/Nobelpreistraegerin-Narges-Mohammadi-auf-Intensivstation-id30779608.html,0,www.n-tv.de,Im Iran in Haft: Nobelpreisträgerin Narges Mohammadi auf Intensivstation,Im März erleidet die im Iran inhaftierte Friedensnobelpreisträgerin Narges Mohammadi einen Herzinfarkt. Der Gesundheitszustand der 54-Jährigen habe sich stark verschlechtert. Ihre Familie beklagt unzureichende medizinische Versorgung im Gefängnis.,https://www.n-tv.de/img/30721916/1777761945/Img_16_9/1200/Narges-Mohammadi-speaks-during-an-interview-conducted-by-the-Yomiuri-Shimbun-in-Tehran-Iran-on-December-6-2025-Narges-Mohammadi-is-Iranian-human-rights-activist-and-was-awarded-the-2023-Nobel-Peace-Prize-for-her-fight-against-the-oppression-of-women-in-Iran-and-her-fight-to-promote-human-rights-and-freedom-for-all.jpg,2026-05-02T20:51:44Z,,"Narges Mohammadi Anfang Dezember in Teheran. (Foto: picture alliance / ASSOCIATED PRESS)
Im März erleidet die im Iran inhaftierte Friedensnobelpreisträgerin Narges Mohammadi einen Herzinfarkt. Der G… [+1896 chars]",,de,'Iran'
https://www.zeit.de/news/2026-05/03/trump-kuendigt-ueberpruefung-eines-iran-plans-an,https://www.zeit.de/news/2026-05/03/trump-kuendigt-ueberpruefung-eines-iran-plans-an,0,www.zeit.de,Iran-Krieg: Trump kündigt Überprüfung eines Iran-Plans an,Hier finden Sie Informationen zu dem Thema „Iran-Krieg“. Lesen Sie jetzt „Trump kündigt Überprüfung eines Iran-Plans an“.,https://img.zeit.de/news/2026-05/03/trump-kuendigt-ueberpruefung-eines-iran-plans-an-image-group/wide__1300x731,2026-05-02T23:21:33Z,,"US-Präsident Donald Trump kündigt an, einen vom Iran übermittelten Plan für ein Ende des Kriegs prüfen zu wollen. Allerdings könne er sich nicht vorstellen, dass dieser Plan akzeptabel sein werde, sc… [+1773 chars]",,de,'Iran'
