index,url,valid,domain,title,description,image,published,archive,content,quote,language,keyword
https://www.stern.de/digital/technik/wagner-chef-will-aus-bachmut-abziehen---warum-das-keine-gute-nachricht-ist-33440196.html,https://www.stern.de/digital/technik/wagner-chef-will-aus-bachmut-abziehen---warum-das-keine-gute-nachricht-ist-33440196.html,0,www.stern.de,Krieg in der Ukraine: Wagner-Chef will aus Bachmut abziehen – warum das keine gute Nachricht ist,"Inmitten seiner gefallenen Söldner rechnet Jewgeni Prigoschin mit dem russischen Militär ab. Weil er keine Munition bekomme, werde er aus Bachmut abziehen, droht Prigoschin. Darüber sollte man sich nicht freuen, militärisch ist es richtig, die Söldnertruppe a…",https://image.stern.de/33440226/t/mA/v1/w1440/r1.7778/-/prig.jpg,2023-05-05T11:34:00Z,https://web.archive.org/web/20230505204602/https://www.stern.de/digital/technik/wagner-chef-will-aus-bachmut-abziehen---warum-das-keine-gute-nachricht-ist-33440196.html,"Zum zweiten Mal innerhalb weniger Tage hat der Chef der Wagner-Gruppe, Jewgeni Prigoschin, zwei Videos ""abgefeuert"". Im ersten Video sprach der ""Koch"" mit ""War Gonzo"", Semjon Pegow, einem bei russisc… [+4649 chars]",,de,'Ukraine'
https://www.sueddeutsche.de/panorama/serbien-schule-massaker-todesstrafe-vucic-1.5840898,https://www.sueddeutsche.de/panorama/serbien-schule-massaker-todesstrafe-vucic-1.5840898,0,www.sueddeutsche.de,Serbien: Zwei Massaker in 48 Stunden,"Erst erschießt ein Schüler neun Menschen, dann tötet ein junger Mann neun weitere. Serbiens Präsident Vučić will die Waffengesetze verschärfen und bedauert die Abschaffung der Todesstrafe.",https://www.sueddeutsche.de/image/sz.1.5840900/1200x675?v=1683289881,2023-05-05T11:42:52Z,http://archive.md/20230505123908/https://www.sueddeutsche.de/panorama/serbien-schule-massaker-todesstrafe-vucic-1.5840898,"Erst erschießt ein Schüler neun Menschen, dann tötet ein junger Mann neun weitere. Serbiens Präsident Vui will die Waffengesetze verschärfen und bedauert die Abschaffung der Todesstrafe.Sie saßen ein… [+2906 chars]",,de,'Waffen'
https://www.stern.de/politik/ausland/ukraine-krieg--fuer-bill-clinton-war-schon-2011-klar--dass-putin-etwas-unternehmen-werde-33440008.html,https://www.stern.de/politik/ausland/ukraine-krieg--fuer-bill-clinton-war-schon-2011-klar--dass-putin-etwas-unternehmen-werde-33440008.html,0,www.stern.de,"Ex-US-Präsident: Für Bill Clinton war schon 2011 klar, dass Wladimir Putin etwas in der Ukraine unternehmen werde","Die Krim-Annexion durch Russland war 2011 noch Jahre entfernt, für Bill Clinton aber sei es nur eine ""Frage der Zeit"" gewesen, dass Wladimir Putin in der Ukraine aktiv werden würde.",https://image.stern.de/33440036/t/tz/v1/w1440/r1.7778/-/neuer-inhalt.jpg,2023-05-05T12:25:00Z,https://web.archive.org/web/20230505170311/https://www.stern.de/politik/ausland/ukraine-krieg--fuer-bill-clinton-war-schon-2011-klar--dass-putin-etwas-unternehmen-werde-33440008.html,"Bill Clinton, ehemaliger US-Präsident, will bereits 2011 die dunkle Vorahnung gehabt haben, dass Wladimir Putin etwas in Sachen Ukraine unternehmen würde. Ein russischer Einsatz sei nur eine ""Frage d… [+2085 chars]",,de,'Waffen'
https://www.n-tv.de/politik/Generalinspekteur-Breuer-in-der-Ukraine-Kiew-will-Schiffe-article24102023.html,https://www.n-tv.de/politik/Generalinspekteur-Breuer-in-der-Ukraine-Kiew-will-Schiffe-article24102023.html,0,www.n-tv.de,Berlin sichert weitere Hilfen zu: Generalinspekteur Breuer in der Ukraine - Kiew will Schiffe,Bei einem Besuch in Kiew sichert Generalinspekteur Breuer der Ukraine weitere Hilfen zu. Zugleich spricht er sich nach Angaben der Gastgeber für eine enge Kooperation aus. Die Ukraine erneuert derweil ihre Forderung nach Schiffen.,https://bilder3.n-tv.de/img/incoming/crop24102022/8651325775-cImg_16_9-w1200/400139143.jpg,2023-05-05T12:47:11Z,https://web.archive.org/web/20230505202009/https://www.n-tv.de/politik/Generalinspekteur-Breuer-in-der-Ukraine-Kiew-will-Schiffe-article24102023.html,Bei einem Besuch in Kiew sichert Generalinspekteur Breuer der Ukraine weitere Hilfen zu. Zugleich spricht er sich nach Angaben der Gastgeber für eine enge Kooperation aus. Die Ukraine erneuert derwei… [+1502 chars],,de,'Ukraine'
https://www.stern.de/panorama/klima-der-gewalt--wieder-acht-tote-nach-schuessen-in-serbien-33438682.html,https://www.stern.de/panorama/klima-der-gewalt--wieder-acht-tote-nach-schuessen-in-serbien-33438682.html,0,www.stern.de,Klima der Gewalt: Wieder acht Tote nach Schüssen in Serbien,Nach dem Schulmassaker in Belgrad trifft das Balkanland ein weiterer Schock. Ein junger Mann tötet in einem kleinen Dorf mehrere Menschen. Zu viele Waffen kursieren Experten zufolge in der Bevölkerung.,https://image.stern.de/33439054/t/Y0/v4/w1440/r1.7778/-/05--urnnewsmldpacom2009010123050599568259v3w800h600l640t425r1920b1278jpeg---381db2d73c4dfa52.jpg,2023-05-05T13:52:47Z,,Nach dem Schulmassaker in Belgrad trifft das Balkanland ein weiterer Schock. Ein junger Mann tötet in einem kleinen Dorf mehrere Menschen. Zu viele Waffen kursieren Experten zufolge in der Bevölkerun… [+5063 chars],,de,'Waffen'
https://www.zeit.de/politik/ausland/2023-05/serbien-amoklauf-schusswaffen-entwaffnung,https://www.zeit.de/politik/ausland/2023-05/serbien-amoklauf-schusswaffen-entwaffnung,0,www.zeit.de,Serbien: Präsident Aleksandar Vučić will Serbien entwaffnen,Nach zwei Schusswaffenangriffen in nur zwei Tagen hat Vučić eine Entwaffnungskampagne angekündigt. Hunderttausende Waffen sollen eingezogen werden.,,2023-05-05T13:59:06Z,,"When browsing with ads:
We collect personal data and also transmit it to third-party providers
 that help us improve and finance our digital content. Some of the information stored on your device, … [+732 chars]",,de,'Waffen'
https://www.dw.com/de/ukraine-aktuell-drohungen-und-vorw%C3%BCrfe-von-wagner-chef-prigoschin/a-65523251,https://www.dw.com/de/ukraine-aktuell-drohungen-und-vorw%C3%BCrfe-von-wagner-chef-prigoschin/a-65523251,0,www.dw.com,Ukraine aktuell: Drohungen und Vorwürfe von Wagner-Chef Prigoschin,"Der Chef der Wagner-Söldnertruppe teilt aus: mit Kritik an der russische Armeespitze. Die ukrainische Luftwaffe bestätigt den Abschuss eines ""fehlgeleiteten"" Flugkörpers. Unser Überblick.",https://static.dw.com/image/65530989_6.jpg,2023-05-05T14:00:00Z,https://web.archive.org/web/20230505165313/https://www.dw.com/de/ukraine-aktuell-drohungen-und-vorw%C3%BCrfe-von-wagner-chef-prigoschin/a-65523251,"Das Wichtigste in Kürze:
<ul><li>Drohungen und Vorwürfe von Wagner-Chef Prigoschi</li><li>Ukraine schießt eigene Drohne ab</li><li>Russland meldet ebenfalls Drohnenangriffe</li><li>China will im Ukr… [+10468 chars]",,de,'Ukraine'
https://scilogs.spektrum.de/gedankenwerkstatt/wie-verhext-der-unwiderrufliche-kollaps-der-zivilisation/,https://scilogs.spektrum.de/gedankenwerkstatt/wie-verhext-der-unwiderrufliche-kollaps-der-zivilisation/,0,scilogs.spektrum.de,Wie verhext – der unwiderrufliche Kollaps der Zivilisation,"Viele Klimaaktivisten sind davon überzeugt, dass die Zivilisation bald zusammenbricht, wenn der Klimawandel nicht gestoppt wird. Das wäre natürlich fatal. Sollten wir ins Mittelalter zurückfallen, müssten wir wieder mit Holz oder Kohle heizen. Wärmepumpen, Wi…",https://scilogs.spektrum.de/gedankenwerkstatt/files/Bosch_garten-2.jpg,2023-05-05T14:30:09Z,https://web.archive.org/web/20230505181303/https://scilogs.spektrum.de/gedankenwerkstatt/wie-verhext-der-unwiderrufliche-kollaps-der-zivilisation/,"Viele Klimaaktivisten sind davon überzeugt, dass die Zivilisation bald zusammenbricht, wenn der Klimawandel nicht gestoppt wird. Das wäre natürlich fatal. Sollten wir ins Mittelalter zurückfallen, mü… [+12815 chars]",,de,'Waffen'
https://www.handelsblatt.com/politik/international/liveblog-zum-ukraine-krieg-schoigu-besucht-nach-prigoschin-kritik-russische-truppen-pistorius-sichert-ukraine-unterstuetzung-zu/27982126.html,https://www.handelsblatt.com/politik/international/liveblog-zum-ukraine-krieg-schoigu-besucht-nach-prigoschin-kritik-russische-truppen-pistorius-sichert-ukraine-unterstuetzung-zu/27982126.html,0,www.handelsblatt.com,+++ Ukraine-Krieg +++: Schoigu besucht nach Prigoschin-Kritik russische Truppen – Pistorius sichert Ukraine Unterstützung zu,Bundeswehr-Generalinspekteur Breuer zu Gesprächen in der Ukraine +++ Berlin: Verbot russischer und ukrainischer Fahnen am 8. und 9. Mai +++ Der Newsblog.,https://www.handelsblatt.com/images/sergej-schoigu/29135620/2-format2003.jpg,2023-05-05T14:41:00Z,https://web.archive.org/web/20230505153053/https://www.handelsblatt.com/politik/international/liveblog-zum-ukraine-krieg-schoigu-besucht-nach-prigoschin-kritik-russische-truppen-pistorius-sichert-ukraine-unterstuetzung-zu/27982126.html,"<li>Herr N. B.05.05.2023, 14:04 Uhr
Russland soll die Grenzen der Ukraine Stand 1991 akzeptieren und die annektierten Regionen sofort verlassen!Es gibt keine unabhängige Donbass / Luhansk. beider ge… [+6273 chars]",,de,'Ukraine'
https://www.handelsblatt.com/politik/international/liveblog-zum-ukraine-krieg-tschetschenen-fuehrer-kadyrow-bietet-ersatz-fuer-wagner-truppe-an-russland-evakuiert-doerfer-entlang-der-front/27982126.html,https://www.handelsblatt.com/politik/international/liveblog-zum-ukraine-krieg-tschetschenen-fuehrer-kadyrow-bietet-ersatz-fuer-wagner-truppe-an-russland-evakuiert-doerfer-entlang-der-front/27982126.html,0,www.handelsblatt.com,+++ Ukraine-Krieg +++: Tschetschenen-Führer Kadyrow bietet Ersatz für Wagner-Truppe an – Russland evakuiert Dörfer entlang der Front,Luftalarm in Kiew und vielen anderen Landesteilen +++ Schoigu besucht nach Prigoschin-Kritik russische Truppen +++ Bundeswehr-Generalinspekteur in der Ukraine +++ Der Newsblog.,https://www.handelsblatt.com/images/ramzan-kadyrow/29135962/2-format2003.jpg,2023-05-05T14:41:00Z,,"<li>Herr Andre Peter05.05.2023, 19:57 Uhr
Die Vorgeschichte zum Krieg - wider dem Vergesssen:1. Die Nato - Osterweiterung fand statt im Gegensatz zu den mündlichen Versprechen von 1989 bei der Wiede… [+9014 chars]",,de,'Ukraine'
https://www.faz.net/aktuell/gesellschaft/kriminalitaet/acht-tote-bei-abermaligem-massaker-serbien-soll-entwaffnet-werden-18872246.html,https://www.faz.net/aktuell/gesellschaft/kriminalitaet/acht-tote-bei-abermaligem-massaker-serbien-soll-entwaffnet-werden-18872246.html,0,www.faz.net,Acht Tote bei abermaligem Massaker: Serbien soll entwaffnet werden,Angesichts zweier Schusswaffenangriffe in Serbien binnen zwei Tagen kündigt Präsident Aleksandar Vučić in Belgrad erhebliche Verschärfungen der Waffengesetze an.,https://media1.faz.net/ppmedia/aktuell/1583667476/1.8872245/facebook_teaser/in-dubona-polizisten-sichern.jpg,2023-05-05T14:58:07Z,https://web.archive.org/web/20230505152657/http://www.faz.net/aktuell/gesellschaft/kriminalitaet/acht-tote-bei-abermaligem-massaker-serbien-soll-entwaffnet-werden-18872246.html,Angesichts zweier Schusswaffenangriffe auf wehrlose Menschen in Serbien binnen zwei Tagen hat Präsident Aleksandar Vui am Freitag in Belgrad erhebliche Verschärfungen der Waffengesetze und eine Mobil… [+5042 chars],,de,'Waffen'
https://www.der-postillon.com/2023/05/wagner-pizza.html,https://www.der-postillon.com/2023/05/wagner-pizza.html,0,www.der-postillon.com,"Wagner-Chef droht mit Aus für beliebte Fertigpizza, wenn Moskau keine Waffen liefert","Bachmut (dpo) - Der Machtkampf in der russischen Militärführung eskaliert immer weiter: Weil seine Kämpfer zu wenig Munition erhalten, hat der Chef der Wagner-Gruppe Jewgeni Prigoschin nun damit gedroht, die beliebten Steinofen-Fertigpizzen für die seine Trup…",https://blogger.googleusercontent.com/img/b/R29vZ2xl/AVvXsEiRweATZcPdQDI_8OM78NDg47a9Gs2V97txbM5PsHcHbr-iyGU1NtVRUYMPcvv5Y0BLLI7R5Nxr-MH1OJiSqGXShbAg8dh1jgzo5mXAoq-ET_wKgRQHm4O6VfL8F5l-vgfufi7Z5XwyVBRxM6W-sIgSZ66CWBdzQkEMBQocx4aKtCXRtUHaGT2_gqp1/w1600/Wagner-Fertigpizza.jpg,2023-05-05T15:00:45Z,https://web.archive.org/web/20230505153733/https://www.der-postillon.com/2023/05/wagner-pizza.html,"Bachmut (dpo) - Der Machtkampf in der russischen Militärführung eskaliert immer weiter: Weil seine Kämpfer zu wenig Munition erhalten, hat der Chef der Wagner-Gruppe Jewgeni Prigoschin nun damit gedr… [+1184 chars]",,de,'Waffen'
https://www.tagesspiegel.de/internationales/ukraine-invasion-tag-436-in-moskau-ist-nichts-mehr-normal-9772196.html,https://www.tagesspiegel.de/internationales/ukraine-invasion-tag-436-in-moskau-ist-nichts-mehr-normal-9772196.html,0,www.tagesspiegel.de,Ukraine-Invasion Tag 436: „In Moskau ist nichts mehr normal“,"Wagner-Chef Prigoschin wütet gegen die Generäle in Moskau, wieder Anschläge auf russische Infrastruktur, China füllt die Lücken westlicher Importe. Der Überblick am Abend.",https://www.tagesspiegel.de/images/kreml-wirft-ukraine-versuchten-drohnen-anschlag-auf-putin-vor1/alternates/BASE_16_9_W1400/kreml-wirft-ukraine-versuchten-drohnen-anschlag-auf-putin-vor.jpeg,2023-05-05T15:07:36Z,,"In einem sehenswerten Beitrag erzählt der Moskau-Korrespondent der BBC, Steve Rosenberg, vom Alltag in Moskau (zu sehen ist das Video hier). Auf den ersten Blick scheine alles normal, erzählt er, abe… [+6498 chars]",,de,'Ukraine'
