index,url,valid,domain,title,description,image,published,archive,content,quote,language,keyword
https://www.n-tv.de/politik/London-investiert-Milliarden-in-sechs-Munitionsfabriken-article25805081.html,https://www.n-tv.de/politik/London-investiert-Milliarden-in-sechs-Munitionsfabriken-article25805081.html,0,www.n-tv.de,Waffen mit größerer Reichweite: London investiert Milliarden in sechs Munitionsfabriken,"Bis 2027 plant Großbritannien, 2,5 Prozent seiner Wirtschaftskraft in die Verteidigung zu stecken. Die Labour-Partei will am Montag deshalb einen Bericht zur Überprüfung der Verteidigungspolitik vorstellen. Eine erste Priorität ist der Bau neuer Werke für die…",https://www.n-tv.de/img/incoming/crop25805080/5861325995-cImg_16_9-w1200/526771919.jpg,2025-06-01T01:26:41Z,,"Bis 2027 plant Großbritannien, 2,5 Prozent seiner Wirtschaftskraft in die Verteidigung zu stecken. Die Labour-Partei will am Montag deshalb einen Bericht zur Überprüfung der Verteidigungspolitik vors… [+2005 chars]",,de,'Waffen'
https://www.stern.de/gesellschaft/regional/berlin-brandenburg/zum-sommerbeginn--hitzehilfe-fuer-berliner-obdachlose-startet-35771066.html,https://www.stern.de/gesellschaft/regional/berlin-brandenburg/zum-sommerbeginn--hitzehilfe-fuer-berliner-obdachlose-startet-35771066.html,0,www.stern.de,Zum Sommerbeginn: Hitzehilfe für Berliner Obdachlose startet,Nicht nur Kälte und Regen machen auf der Straße lebenden Menschen zu schaffen. Im Sommer kann Hitze für sie lebensgefährlich werden. Deshalb startet an diesem Sonntag erneut die Hitzehilfe.,https://image.stern.de/35771068/t/j-/v1/w1440/r1.7778/-/01--xdvzzwtlpjv4axs2048jpeg---029d242d39720c94.jpg,2025-06-01T02:00:53Z,https://web.archive.org/web/20250601023458/https://www.stern.de/gesellschaft/regional/berlin-brandenburg/zum-sommerbeginn--hitzehilfe-fuer-berliner-obdachlose-startet-35771066.html,"Kopiere den aktuellen Link
Zur Merkliste hinzufügen
Nicht nur Kälte und Regen machen auf der Straße lebenden Menschen zu schaffen. Im Sommer kann Hitze für sie lebensgefährlich werden. Deshalb star… [+951 chars]",,de,'Kälte'
https://www.tagesspiegel.de/berlin/zum-sommerbeginn-hitzehilfe-fur-berliner-obdachlose-startet-13783969.html,https://www.tagesspiegel.de/berlin/zum-sommerbeginn-hitzehilfe-fur-berliner-obdachlose-startet-13783969.html,0,www.tagesspiegel.de,Zum Sommerbeginn: Hitzehilfe für Berliner Obdachlose startet,Nicht nur Kälte und Regen machen auf der Straße lebenden Menschen zu schaffen. Im Sommer kann Hitze für sie lebensgefährlich werden. Deshalb startet an diesem Sonntag erneut die Hitzehilfe.,https://www.tagesspiegel.de/images/13783972/alternates/BASE_16_9_W1400/1748743387000/notunterkunft-der-hitzehilfe-fur-obdachlose.jpeg,2025-06-01T02:02:31Z,https://web.archive.org/web/20250601081433/https://www.tagesspiegel.de/berlin/zum-sommerbeginn-hitzehilfe-fur-berliner-obdachlose-startet-13783969.html,Mit dem meteorologischen Beginn des Sommers startet an diesem Sonntag auch die Hitzehilfe für obdachlose Menschen in Berlin. Sie können dann in speziellen Räumlichkeiten Schutz vor gleißender Sonne u… [+1465 chars],,de,'Kälte'
https://www.zeit.de/news/2025-06/01/hamas-dutzende-opfer-bei-israelischem-angriff-in-gaza,https://www.zeit.de/news/2025-06/01/hamas-dutzende-opfer-bei-israelischem-angriff-in-gaza,0,www.zeit.de,Gaza-Krieg: Hamas: Dutzende Opfer bei israelischem Angriff in Gaza,Hier finden Sie Informationen zu dem Thema „Gaza-Krieg“. Lesen Sie jetzt „Hamas: Dutzende Opfer bei israelischem Angriff in Gaza“.,https://img.zeit.de/news/2025-06/01/hamas-dutzende-opfer-bei-israelischem-angriff-in-gaza-image-group/wide__1300x731,2025-06-01T04:39:17Z,,Bei einem israelischen Angriff im Süden des Gazastreifens sollen nach Angaben des Medienbüros der islamistischen Hamas am frühen Morgen mindestens 22 Palästinenser getötet worden sein. Mehr als 115 w… [+1034 chars],,de,'Angriff'
https://www.zeit.de/politik/ausland/2025-06/grenzregionen-russland-meldet-einsturz-zwei-bruecken-brjansk-kursk,https://www.zeit.de/politik/ausland/2025-06/grenzregionen-russland-meldet-einsturz-zwei-bruecken-brjansk-kursk,0,www.zeit.de,Grenzregionen: Russland meldet Einsturz von Brücken in Brjansk und Kursk,In Russland sind nach lokalen Angaben zwei Brücken in Grenzregionen eingestürzt. Es habe Tote und Verletzte gegeben. In Brjansk vermutet der Gouverneur eine Sprengung.,https://img.zeit.de/politik/ausland/2025-06/grenzregionen-russland-meldet-einsturz-zwei-bruecken-brjansk-kursk-bild/wide__1300x731,2025-06-01T07:14:44Z,,"Russische Behörden haben den Einsturz zweier Brücken in den Regionen Kursk und Brjansk gemeldet, die an die Ukraine grenzen. Der Regionsgouverneur von Brjansk, Alexander Bogomas, teilte mit, mindeste… [+2660 chars]",,de,'Russland'
https://www.morgenpost.de/berlin/article409157638/zum-sommeranfang-berlin-startet-hitzehilfe-fuer-obdachlose.html,https://www.morgenpost.de/berlin/article409157638/zum-sommeranfang-berlin-startet-hitzehilfe-fuer-obdachlose.html,0,www.morgenpost.de,Zum Sommeranfang: Berlin startet Hitzehilfe für Obdachlose,Nicht nur Kälte macht auf der Straße lebenden Menschen zu schaffen. Hitze kann für sie lebensgefährlich werden. Was Sie tun können.,https://img.sparknews.funkemedien.de/409157617/409157617_1748762473_v16_9_1600.jpeg,2025-06-01T07:21:14Z,https://web.archive.org/web/20250602092438/https://www.morgenpost.de/berlin/article409157638/zum-sommeranfang-berlin-startet-hitzehilfe-fuer-obdachlose.html,"Berlin. Nicht nur Kälte macht auf der Straße lebenden Menschen zu schaffen. Hitze kann für sie lebensgefährlich werden. Was Sie tun können.
Mit dem meteorologischen Beginn des Sommers startet an die… [+1056 chars]",,de,'Kälte'
https://stadt-bremerhaven.de/energiepreise-in-deutschland-sorge-ist-weiterhin-gross/,https://stadt-bremerhaven.de/energiepreise-in-deutschland-sorge-ist-weiterhin-gross/,0,stadt-bremerhaven.de,Energiepreise in Deutschland: Sorge ist weiterhin groß,"Die Energiepreise kennen im Grunde in Deutschland nur einen Weg: den nach oben. Ich selbst habe etwa erst diesen Monat wieder eine Strompreiserhöhung ins Haus flattern sehen. Und diese Preisentwicklung bereitet dann auch immer noch vielen Menschen Sorgen, wie…",https://stadt-bremerhaven.de/wp-content/uploads/2025/05/Solar-Deutschland.jpg,2025-06-01T09:00:47Z,https://web.archive.org/web/20250601165556/https://stadt-bremerhaven.de/energiepreise-in-deutschland-sorge-ist-weiterhin-gross/,Die Energiepreise kennen im Grunde in Deutschland nur einen Weg: den nach oben. Ich selbst habe etwa erst diesen Monat wieder eine Strompreiserhöhung ins Haus flattern sehen. Und diese Preisentwicklu… [+3086 chars],,de,'Heizen'
https://www.bild.de/politik/ausland-und-internationales/russische-geheimakten-putins-waffen-brauchen-westliche-technologie-6837155a1572f10f9457db76,https://www.bild.de/politik/ausland-und-internationales/russische-geheimakten-putins-waffen-brauchen-westliche-technologie-6837155a1572f10f9457db76,0,www.bild.de,Geheimpapiere zeigen - So stark hängt Russlands Militär vom Westen ab,Geheime Dokumente zeigen Russlands Abhängigkeit von westlichen Halbleitern in modernen Waffen. Ohne sie verliert Putins Arsenal an Treffsicherheit.,"https://images.bild.de/6837155a1572f10f9457db76/ae4a1427a9c22de7ed19897f0098f2bc,f35c0c4d?w=1280",2025-06-01T09:03:52Z,http://archive.md/20250601090559/https://www.bild.de/politik/ausland-und-internationales/russische-geheimakten-putins-waffen-brauchen-westliche-technologie-6837155a1572f10f9457db76,Russlands Militär kommt ohne westliche Technologie nicht aus. Ein riesiges Datenleck enthüllt die Abhängigkeit von US-Chips in Putins Kriegsmaschinerie. Exklusive Einblicke in geheime Dokumente zeige… [+231 chars],,de,'Waffen'
https://www.sueddeutsche.de/wirtschaft/bafin-esg-nachhaltigkeit-li.3259156,https://www.sueddeutsche.de/wirtschaft/bafin-esg-nachhaltigkeit-li.3259156,0,www.sueddeutsche.de,Grüne Geldanlage: „Anleger wirksam vor Irreführung schützen“,"Ist grüne Geldanlage am Ende nur eine Mogelpackung? Rupert Schaefer, Exekutivdirektor für den Geschäftsbereich Strategie, Policy und Steuerung bei der Finanzaufsicht Bafin, sieht zumindest auf Ebene der EU-Regulierung Verbesserungsbedarf.",https://www.sueddeutsche.de/2024/01/31/71f3edbf-8a86-4d82-a1f8-ae2798b12520.jpeg?q=60&fm=webp&width=1200&rect=0%2C89%2C1282%2C721,2025-06-01T09:43:18Z,https://web.archive.org/web/20250601140838/https://www.sueddeutsche.de/wirtschaft/bafin-esg-nachhaltigkeit-li.3259156,"Eigentlich war es gut gemeint: Mit der EU-Offenlegungsverordnung (Abkürzung: SFDR) wollte Brüssel vor vier Jahren nachhaltige Geldanlage für Privatanleger transparenter machen, auch um sogenanntes Gr… [+6580 chars]",,de,'Finanz'
https://www.tagesspiegel.de/internationales/steckt-die-ukraine-dahinter-was-wir-uber-die-bruckeneinsturze-in-russland-wissen--und-was-nicht-13784710.html,https://www.tagesspiegel.de/internationales/steckt-die-ukraine-dahinter-was-wir-uber-die-bruckeneinsturze-in-russland-wissen--und-was-nicht-13784710.html,0,www.tagesspiegel.de,Steckt die Ukraine dahinter?: Was wir über die Brückeneinstürze in Russland wissen – und was nicht,"Zwei Brücken, zwei Züge, sieben Tote, Dutzende Verletzte – und ein Verdacht: Russland spricht von Terror, die Ukraine schweigt. Wir beantworten die wichtigsten Fragen zu den Vorfällen.",https://www.tagesspiegel.de/images/13784695/alternates/BASE_16_9_W1400/1748771340000/ukraine-krieg-zug-entgleist-in-brjansk.jpeg,2025-06-01T10:06:54Z,http://archive.md/20250601104859/https://www.tagesspiegel.de/internationales/steckt-die-ukraine-dahinter-was-wir-uber-die-bruckeneinsturze-in-russland-wissen--und-was-nicht-13784710.html,"Eingestürzte Pfeiler, brennende Brücken, überall Qualm. Innerhalb kürzester Zeit sind in Russland Brücken eingestürzt beide lagen im umkämpften Grenzgebiet zur Ukraine.
Wie es genau dazu kam und ob … [+6725 chars]",,de,'Waffen'
https://www.tagesspiegel.de/internationales/eingesturzte-brucken-in-russland-steckt-die-ukraine-dahinter-13784710.html,https://www.tagesspiegel.de/internationales/eingesturzte-brucken-in-russland-steckt-die-ukraine-dahinter-13784710.html,0,www.tagesspiegel.de,Eingestürzte Brücken in Russland: Steckt die Ukraine dahinter?,"Zwei Brücken, zwei Züge – ein Verdacht: Russland spricht von Terror, die Ukraine schweigt. Was wir über die Explosionen nahe der ukrainischen Grenze wissen.",https://www.tagesspiegel.de/images/13784695/alternates/BASE_16_9_W1400/1748771340000/ukraine-krieg-zug-entgleist-in-brjansk.jpeg,2025-06-01T10:06:54Z,,"Eingestürzte Pfeiler, brennende Brücken, überall Qualm. Innerhalb kürzester Zeit sind in Russland Brücken eingestürzt beide lagen im umkämpften Grenzgebiet zur Ukraine.
Wie es genau dazu kam und ob … [+6725 chars]",,de,'Ukraine'
https://www.tagesschau.de/ausland/europa/russland-brueckeneinsturz-zug-104.html,https://www.tagesschau.de/ausland/europa/russland-brueckeneinsturz-zug-104.html,0,www.tagesschau.de,"Russland wertet zerstörte Brücken als ""Terrorakt""","Wer steckt hinten den zerstörten Brücken und Zugunglücken in Russland? Ermittler gehen von einer Explosion aus, Politiker in Moskau machen die Ukraine verantwortlich. Dort wird über eine andere Zugsprengung berichtet.",https://images.tagesschau.de/image/76ef2704-6df8-4b2d-8469-c175155ac8d2/AAABlyse9f4/AAABkZLhkrw/16x9-1280/bruecke-russland-102.jpg,2025-06-01T10:58:13Z,,"Stand: 01.06.2025 12:58 Uhr
Wer steckt hinten den zerstörten Brücken und Zugunglücken in Russland? Ermittler gehen von einer Explosion aus, Politiker in Moskau machen die Ukraine verantwortlich. Dor… [+4129 chars]",,de,'Russland'
https://www.dw.com/de/tote-und-verletzte-bei-br%C3%BCckeneinst%C3%BCrzen-in-russland/a-72748066,https://www.dw.com/de/tote-und-verletzte-bei-br%C3%BCckeneinst%C3%BCrzen-in-russland/a-72748066,0,www.dw.com,Tote und Verletzte bei Brückeneinstürzen in Russland,"Im Westen Russlands sind zwei Brücken an Bahnstrecken eingestürzt, als gerade Züge die Gleise befuhren. Waren es Anschläge des ukrainischen Geheimdienstes?",https://static.dw.com/image/72748158_6.jpg,2025-06-01T11:17:00Z,,"Brjansk und Kursk liegen direkt an der Grenze zur Ukraine. In beiden Regionen im Westen Russlands sind in der vergangenen Nacht Züge entgleist, weil zwei Brücken an Bahnstrecken eingestürzt waren.
I… [+4648 chars]",,de,'Waffen'
https://www.tagesspiegel.de/internationales/krieg-in-der-ukraine-schwere-kampfe-vor-neuen-friedensgesprachen-13785268.html,https://www.tagesspiegel.de/internationales/krieg-in-der-ukraine-schwere-kampfe-vor-neuen-friedensgesprachen-13785268.html,0,www.tagesspiegel.de,Krieg in der Ukraine: Schwere Kämpfe vor neuen Friedensgesprächen,"Unterhändler Kiews und Moskaus treffen am Montag zu neuen Friedensgesprächen zusammen. Am Tag davor jedoch sprechen an allen Fronten die Waffen, selbst hinter den Fronten wird gekämpft.",https://www.tagesspiegel.de/images/13785829/alternates/BASE_16_9_W1400/1748787725000/ukrainische-kampfdrohne.jpeg,2025-06-01T12:17:21Z,,Unmittelbar vor neuen Verhandlungen zwischen Russland und der Ukraine haben Militärs und Geheimdienste beider Kriegsparteien teils spektakuläre Angriffe gestartet. Während die Diplomaten noch Unterla… [+6399 chars],,de,'Waffen'
https://www.tagesspiegel.de/internationales/krieg-in-der-ukraine-schwere-kampfe-vor-neuen-ukraine-friedensgesprachen-13785268.html,https://www.tagesspiegel.de/internationales/krieg-in-der-ukraine-schwere-kampfe-vor-neuen-ukraine-friedensgesprachen-13785268.html,0,www.tagesspiegel.de,Krieg in der Ukraine: Schwere Kämpfe vor neuen Ukraine-Friedensgesprächen,"Unterhändler Kiews und Moskaus treffen am Montag zu neuen Friedensgesprächen zusammen. Am Tag davor jedoch sprechen an allen Fronten die Waffen, selbst hinter den Fronten wird gekämpft.",https://www.tagesspiegel.de/images/13785829/alternates/BASE_16_9_W1400/1748787725000/ukrainische-kampfdrohne.jpeg,2025-06-01T12:17:21Z,https://web.archive.org/web/20250602031141/https://www.tagesspiegel.de/internationales/krieg-in-der-ukraine-schwere-kampfe-vor-neuen-ukraine-friedensgesprachen-13785268.html,Unmittelbar vor neuen Verhandlungen zwischen Russland und der Ukraine haben Militärs und Geheimdienste beider Kriegsparteien teils spektakuläre Angriffe gestartet. Während die Diplomaten noch Unterla… [+7006 chars],,de,'Ukraine'
https://www.zeit.de/news/2025-06/01/kiew-und-moskau-verhandeln-am-montag-ueber-waffenruhe,https://www.zeit.de/news/2025-06/01/kiew-und-moskau-verhandeln-am-montag-ueber-waffenruhe,0,www.zeit.de,Russisch-ukrainische Gespräche: Kiew und Moskau verhandeln am Montag über Waffenruhe,Hier finden Sie Informationen zu dem Thema „Russisch-ukrainische Gespräche“. Lesen Sie jetzt „Kiew und Moskau verhandeln am Montag über Waffenruhe“.,https://img.zeit.de/news/2025-06/01/kiew-und-moskau-verhandeln-am-montag-ueber-waffenruhe-image-group/wide__1300x731,2025-06-01T12:37:31Z,,Kiew hat einem russischen Vorschlag für eine weitere direkte Gesprächsrunde zur Beendigung des Ukraine-Kriegs zugestimmt. «Am Montag wird unsere Delegation von (Verteidigungsminister) Rustem Umjerow … [+5050 chars],,de,'Krise'
https://www.faz.net/aktuell/politik/ukraine/ukraine-liveticker-selenskyj-bestaetigt-teilnahme-der-ukraine-an-verhandlungen-in-istanbul-110172806.html,https://www.faz.net/aktuell/politik/ukraine/ukraine-liveticker-selenskyj-bestaetigt-teilnahme-der-ukraine-an-verhandlungen-in-istanbul-110172806.html,0,www.faz.net,Ukraine-Liveblog: Selenskyj bestätigt Teilnahme der Ukraine an Verhandlungen in Istanbul,Ukraine meldet Angriffe auf russische Militärbasen +++ Russland stuft Brückeneinstürze als Terror ein +++ Kiews Luftabwehr im Einsatz +++ alle Neuigkeiten im Liveblog,https://media1.faz.net/ppmedia/aktuell/politik/1066753861/1.10510959/facebook_teaser/der-ukrainische-praesident.jpg,2025-06-01T12:48:39Z,,Die Ukraine hat nach Angaben aus ukrainischen Geheimdienstkreisen einen Angriff auf eine russische Militärbasis in Ostsibirien ausgeführt. Nach dem Angriff auf die rund 4200 Kilometer von der ukraini… [+789 chars],,de,'Russland'
https://www.faz.net/aktuell/wirtschaft/historischer-einschnitt-hohe-arbeitslosigkeit-treibt-arbeitsagentur-in-finanznot-110510952.html,https://www.faz.net/aktuell/wirtschaft/historischer-einschnitt-hohe-arbeitslosigkeit-treibt-arbeitsagentur-in-finanznot-110510952.html,0,www.faz.net,Hohe Arbeitslosigkeit treibt Arbeitsagentur in Finanznot,"Die Ausgaben steigen so stark, dass die Bundesagentur für Arbeit erstmals im Normalbetrieb eine Finanzspritze des Bundes braucht. Der will sich dafür offenbar noch stärker verschulden.",https://media0.faz.net/ppmedia/2060255313/1.7414996/facebook_teaser/in-finanznot-die-bundesagentur.jpg,2025-06-01T13:30:14Z,,"Die beharrlich steigende Arbeitslosigkeit treibt die Bundesagentur für Arbeit (BA) so tief in die roten Zahlen, dass sie ihre Aufgaben nur noch mit einer Finanzspitze der Bundesregierung erfüllen kan… [+3020 chars]",,de,'Finanz'
https://www.zeit.de/news/2025-06/01/ukrainische-drohnen-greifen-russischen-militaerflugplaetze-an,https://www.zeit.de/news/2025-06/01/ukrainische-drohnen-greifen-russischen-militaerflugplaetze-an,0,www.zeit.de,Krieg Ukraine-Russland: Ukrainische Drohnen greifen russischen Militärflugplätze an,Hier finden Sie Informationen zu dem Thema „Krieg Ukraine-Russland“. Lesen Sie jetzt „Ukrainische Drohnen greifen russischen Militärflugplätze an“.,https://img.zeit.de/news/2025-06/01/ukrainische-drohnen-greifen-russischen-militaerflugplaetze-an-image-group/wide__1300x731,2025-06-01T13:32:02Z,,Der ukrainische Geheimdienst SBU hat in einer koordinierten Aktion gleich vier russische Militärflughäfen attackiert und dabei nach eigener Darstellung über 40 Kampf- und Aufklärungsflugzeuge zerstör… [+1110 chars],,de,'Ukraine'
https://www.zeit.de/politik/ausland/2025-06/ukrainekrieg-drohnen-angriff-luftwaffenstuetzpunkte-sibirien-russland-flugzeuge,https://www.zeit.de/politik/ausland/2025-06/ukrainekrieg-drohnen-angriff-luftwaffenstuetzpunkte-sibirien-russland-flugzeuge,0,www.zeit.de,Drohnenangriffe: Ukraine greift laut Berichten russische Luftwaffenstützpunkte an,"40 zerstörte Flugzeuge, vier attackierte Stützpunkte: Der Ukraine ist laut Berichten ein wichtiger Angriff gelungen. Sie soll tief in Russlands Kernland getroffen haben.",https://img.zeit.de/administratives/sharing/fallback-image/wide__1300x731,2025-06-01T13:39:45Z,,Der ukrainische Geheimdienst SBU hat nach Angaben eines ukrainischen Geheimdienstmitarbeiters einen Großangriff auf Militärflugzeuge weit im russischen Kernland ausgeführt. Das berichten mehrere Medi… [+1437 chars],,de,'Angriff'
https://www.zeit.de/news/2025-06/01/klitschko-hofft-auf-kriegsende-noch-2025,https://www.zeit.de/news/2025-06/01/klitschko-hofft-auf-kriegsende-noch-2025,0,www.zeit.de,Krieg in der Ukraine: Klitschko hofft auf Kriegsende noch 2025,Hier finden Sie Informationen zu dem Thema „Krieg in der Ukraine“. Lesen Sie jetzt „Klitschko hofft auf Kriegsende noch 2025“.,https://img.zeit.de/news/2025-06/01/klitschko-hofft-auf-kriegsende-noch-2025-image-group/wide__1300x731,2025-06-01T13:40:51Z,,"Der Bürgermeister von Kiew, Vitali Klitschko, hofft auf einen Frieden in der Ukraine noch in diesem Jahr. «Wir drücken den Daumen und wir hoffen», dass 2025 endlich eine diplomatische Lösung gefunden… [+850 chars]",,de,'Ukraine'
https://www.tagesschau.de/ausland/europa/grossbritannien-verteidigung-munitionsfabriken-100.html,https://www.tagesschau.de/ausland/europa/grossbritannien-verteidigung-munitionsfabriken-100.html,0,www.tagesschau.de,Britische Regierung plant neue Munitionsfabriken,Mit einer neuen Verteidigungsstrategie will Großbritannien seine Rüstungsindustrie stärken und die Munitionsproduktion ankurbeln. Russlands Krieg gegen die Ukraine zeige: Ein Militär sei nur so stark wie die dahinterstehende Industrie.,https://images.tagesschau.de/image/189d0d45-00ee-4c70-a91c-e5e1d13de54c/AAABlyuwOxc/AAABkZLhkrw/16x9-1280/healey-starmer-100.jpg,2025-06-01T13:52:33Z,https://web.archive.org/web/20250601140842/https://www.tagesschau.de/ausland/europa/grossbritannien-verteidigung-munitionsfabriken-100.html,"Stand: 01.06.2025 15:52 Uhr
Mit einer neuen Verteidigungsstrategie will Großbritannien seine Rüstungsindustrie stärken und die Munitionsproduktion ankurbeln. Russlands Krieg gegen die Ukraine zeige:… [+2204 chars]",,de,'Waffen'
https://www.stern.de/news/vor-geplanten-waffenruhe-gespraechen--ukraine-greift-russische-stuetzpunkte-bis-ostsibirien-an-35772308.html,https://www.stern.de/news/vor-geplanten-waffenruhe-gespraechen--ukraine-greift-russische-stuetzpunkte-bis-ostsibirien-an-35772308.html,0,www.stern.de,Vor geplanten Waffenruhe-Gesprächen: Ukraine greift russische Stützpunkte bis Ostsibirien an,"Einen Tag vor einem geplanten weiteren direkten Treffen zwischen Delegationen Russlands und der Ukraine in Istanbul hat Kiew nach eigenen Angaben ""großangelegte Angriffe"" auf vier Militärstützpunkte tief im russischen Staatsgebiet ausgeführt. Angegriffen word…",https://image.stern.de/35772310/t/YN/v1/w1440/r1.7778/-/01--durch-brueckeneinsturz-beschaedigter-zug-in-russischer-region-kursk---ff1e4262ea4d264c.jpg,2025-06-01T14:58:33Z,https://web.archive.org/web/20250601151947/https://www.stern.de/news/vor-geplanten-waffenruhe-gespraechen--ukraine-greift-russische-stuetzpunkte-bis-ostsibirien-an-35772308.html,"Kopiere den aktuellen Link
Zur Merkliste hinzufügen
Einen Tag vor einem geplanten weiteren direkten Treffen zwischen Delegationen Russlands und der Ukraine in Istanbul hat Kiew nach eigenen Angaben… [+5085 chars]",,de,'Russland'
https://www.sueddeutsche.de/politik/ukraine-angriff-militaerflughaefen-luftwaffe-einsatz-li.3262336,https://www.sueddeutsche.de/politik/ukraine-angriff-militaerflughaefen-luftwaffe-einsatz-li.3262336,0,www.sueddeutsche.de,Drohnenschlag gegen Luftwaffenbasen: Ukraine greift russische Luftwaffe tief im Landesinneren an,"Die Ukraine hat mehrere russische Militärflughäfen mit Drohnen angegriffen und dabei bedeutende Erfolge erzielt. Dies geschah einen Tag vor den geplanten Gesprächen mit Russland, während beide Seiten heftige Angriffe durchführten. Mychajlo Drapatyj trat nach …",https://www.sueddeutsche.de/2025/06/01/0856ea91-002f-4d68-832d-a8aff3916113.png?q=60&fm=webp&width=1200&rect=22%2C0%2C2969%2C1670,2025-06-01T15:04:49Z,http://archive.md/20250601151949/https://www.sueddeutsche.de/politik/ukraine-angriff-militaerflughaefen-luftwaffe-einsatz-li.3262336,"Zwar sei es gelungen, die meisten Drohnen abzuschießen oder elektronisch zu zerstören. Auch drei Marschflugkörper seien abgeschossen worden. Den Russen sei es indes gelungen, 18 Ziele in der gesamten… [+4510 chars]",,de,'Ukraine'
https://www.faz.net/aktuell/politik/ukraine/operation-spinnennetz-ukraine-zerstoert-russische-bomber-110511463.html,https://www.faz.net/aktuell/politik/ukraine/operation-spinnennetz-ukraine-zerstoert-russische-bomber-110511463.html,0,www.faz.net,Operation „Spinnennetz“: Ukraine zerstört mehr als 40 russische Bomber,Der ukrainische Großangriff auf russische Flugfelder wurde offenbar von langer Hand geplant. Mit First-Person-View-Drohnen wurden wertvolle Bomber im vermeintlich sicheren russischen Hinterland zerstört.,https://media1.faz.net/ppmedia/aktuell/3171175576/1.10511559/facebook_teaser/sbu-chef-wassyl-maljuk.jpg,2025-06-01T15:28:29Z,http://archive.md/20250601153039/https://www.faz.net/aktuell/politik/ukraine/operation-spinnennetz-ukraine-zerstoert-russische-bomber-110511463.html,Drohnenaufnahmen zeigen abgestellte Langstreckenbomber auf einem Flugfeld. Aus der Vogelperspektive ist dann ein Treffer nach dem anderen zu sehen. Immer mehr Flugzeuge gehen nacheinander in Flammen … [+4191 chars],,de,'Waffen'
https://www.stern.de/politik/ausland/krieg-in-der-ukraine--schwere-kaempfe-vor-neuen-ukraine-friedensgespraechen-35771958.html,https://www.stern.de/politik/ausland/krieg-in-der-ukraine--schwere-kaempfe-vor-neuen-ukraine-friedensgespraechen-35771958.html,0,www.stern.de,Krieg in der Ukraine: Schwere Kämpfe vor neuen Ukraine-Friedensgesprächen,"Unterhändler Kiews und Moskaus treffen am Montag zu neuen Friedensgesprächen zusammen. Am Tag davor jedoch sprechen an allen Fronten die Waffen, selbst hinter den Fronten wird gekämpft.",https://image.stern.de/35772386/t/WT/v1/w1440/r1.7778/-/01--xscao7h3x6v7axs2048jpeg---97bb04f4d461c9d5.jpg,2025-06-01T15:47:11Z,https://web.archive.org/web/20250601160313/https://www.stern.de/politik/ausland/krieg-in-der-ukraine--schwere-kaempfe-vor-neuen-ukraine-friedensgespraechen-35771958.html,"Kopiere den aktuellen Link
Zur Merkliste hinzufügen
Unterhändler Kiews und Moskaus treffen am Montag zu neuen Friedensgesprächen zusammen. Am Tag davor jedoch sprechen an allen Fronten die Waffen, … [+6494 chars]",,de,'Ukraine'
https://www.telepolis.de/features/Selenskyj-entmachtet-Russlands-Nuklearstreitkraefte-10421574.html,https://www.telepolis.de/features/Selenskyj-entmachtet-Russlands-Nuklearstreitkraefte-10421574.html,0,www.telepolis.de,Selenskyj entmachtet Russlands Nuklearstreitkräfte,Ukrainische Drohnen zerstören Dutzende russische Atombomber. Die nukleare Abschreckung Moskaus ist auf Jahrzehnte geschwächt.,https://heise.cloudimg.io/bound/1200x1200/q85.png-lossy-85.webp-lossy-85.foil1/_www-heise-de_/imgs/18/4/8/6/4/0/3/3/Angriff-db26fa10782ceca9.png,2025-06-01T16:15:00Z,https://web.archive.org/web/20250601163302/https://www.telepolis.de/features/Selenskyj-entmachtet-Russlands-Nuklearstreitkraefte-10421574.html,"(Bild: Screenshot Video)
Ukrainische Drohnen zerstören Dutzende russische Atombomber. Die nukleare Abschreckung Moskaus ist auf Jahrzehnte geschwächt.
Dicke schwarze Rauchwolken steigen über dem ru… [+7736 chars]",,de,'Waffen'
